{
  "items": [
    {
      "url": "https://www.howsweeteats.com/2020/04/baja-grain-bowls/",
      "urls": [
        "https://www.howsweeteats.com/2020/04/baja-grain-bowls/"
      ],
      "link_texts": [
        "Baja Grain Bowls"
      ],
      "menu_files": [
        "Menus/Menu week of 10-4-20.md",
        "Menus/Menu week of 3-19-21.md",
        "Menus/Menu week of 3-9-21.md",
        "Menus/Menu week of 4-22-20.md",
        "Menus/Menu week of 4-28-22.md",
        "Menus/Menu week of 5-1-21.md",
        "Menus/Menu week of 5-22-20.md",
        "Menus/Menu week of 6-16-22.md",
        "Menus/Menu week of 8-1-20.md",
        "Menus/Menu week of 8-26-20.md",
        "Menus/Menu week of 9-6-20.md"
      ],
      "menu_weeks": [
        "2020-10-04",
        "2021-03-19",
        "2021-03-09",
        "2020-04-22",
        "2022-04-28",
        "2021-05-01",
        "2020-05-22",
        "2022-06-16",
        "2020-08-01",
        "2020-08-26",
        "2020-09-06"
      ],
      "menu_seasons": [
        "fall",
        "spring",
        "summer"
      ],
      "meal_types": [
        "dinner"
      ],
      "sections": [],
      "source_hints": [
        "veg"
      ],
      "item_texts": [
        "Baja grain bowls",
        "Baja grain bowls (veg)"
      ],
      "count": 11,
      "ingredients": [
        "3 tablespoons freshly squeezed lime juice",
        "1 1/2 tablespoons honey",
        "1/4 cup fresh cilantro",
        "2 garlic cloves, minced or pressed",
        "1/4 teaspoon salt",
        "1/4 teaspoon pepper",
        "pinch crushed red pepper flakes",
        "1/3 cup extra virgin olive oil",
        "1 cup cooked rice",
        "1 cup cooked quinoa",
        "1 14-ounce can black beans, drained and rinsed",
        "1 avocado, thinly sliced",
        "3/4 cup diced tomatoes",
        "2/3 cup corn",
        "1/2 cup crumbled feta cheese",
        "2 tablespoons chopped fresh cilantro",
        "plain greek yogurt or sour cream, for serving",
        "lime wedges for spritzing",
        "salt and pepper"
      ],
      "recipe_tags": [
        "Bowls",
        "Recipes",
        "Vegetarian",
        "Weeknight Meals"
      ],
      "main_protein": "vegetarian"
    },
    {
      "url": "https://pinchofyum.com/chicken-with-coconut-kale",
      "urls": [
        "https://pinchofyum.com/chicken-with-coconut-kale"
      ],
      "link_texts": [
        "Chicken With Coconut Kale"
      ],
      "menu_files": [
        "Menus/Menu week of 1-17-25.md",
        "Menus/Menu week of 10-23-24.md",
        "Menus/Menu week of 12-31-25.md",
        "Menus/Menu week of 12-6-24.md",
        "Menus/Menu week of 2-27-25.md",
        "Menus/Menu week of 5-26-25.md",
        "Menus/Menu week of 9-24-24.md",
        "Menus/Week of 11-17-25.md"
      ],
      "menu_weeks": [
        "2025-01-17",
        "2024-10-23",
        "2025-12-31",
        "2024-12-06",
        "2025-02-27",
        "2025-05-26",
        "2024-09-24",
        "2025-11-17"
      ],
      "menu_seasons": [
        "winter",
        "fall",
        "spring"
      ],
      "meal_types": [
        "dinner"
      ],
      "sections": [],
      "source_hints": [
        "https://pinchofyum.com/chicken-with-coconut-kale"
      ],
      "item_texts": [
        "Chicken with Coconut Kale (add red pepper)",
        "Chicken with Coconut Kale (add red peppers)",
        "Chicken with coconut kale add bell pepper",
        "Chicken with Coconut Kale (use spinach and red peppers)",
        "Chicken with coconut spinach (add red pepper)",
        "Chicken with Coconut Kale add some bell pepper"
      ],
      "count": 8,
      "ingredients": [
        "1 lb. boneless skinless chicken breasts, cut or pounded into thin pieces",
        "2\u20133 tablespoons all-purpose chicken seasoning (McCormick Rotisserie Chicken Seasoning)",
        "1 1/2 tablespoons avocado oil (divided)",
        "1 shallot, thinly sliced",
        "2\u20133 cups finely shredded curly kale, stems removed (about 3-4 stalks)",
        "1 tablespoon yellow curry paste",
        "1 can full-fat coconut milk",
        "1 tablespoon soy sauce",
        "1 tablespoon brown sugar",
        "rice (optional, for serving)",
        "chili crisp or cilantro for garnish (optional)"
      ],
      "recipe_tags": [
        "All Recipes",
        "Dairy-Free",
        "Dinner",
        "Gluten-Free",
        "Kale",
        "Main Dishes",
        "Meat and Chicken",
        "Quick and Easy",
        "Recipes",
        "SOS Series",
        "Stovetop"
      ],
      "main_protein": "chicken"
    },
    {
      "url": "https://pinchofyum.com/15-minute-meal-prep-egg-roll-in-a-bowl",
      "urls": [
        "https://pinchofyum.com/15-minute-meal-prep-egg-roll-in-a-bowl"
      ],
      "link_texts": [
        "15 Minute Meal Prep Egg Roll in a Bowl",
        "15 Minute Meal Prep Egg Roll In A Bowl"
      ],
      "menu_files": [
        "Menus/Menu week of 12-31-19.md",
        "Menus/Menu week of 3-15-19.md",
        "Menus/Menu week of 3-20-23.md",
        "Menus/Menu week of 4-28-22.md",
        "Menus/Menu week of 4-28-25.md",
        "Menus/Menu week of 6-23-19.md",
        "Menus/Menu week of 7-1-24.md"
      ],
      "menu_weeks": [
        "2019-12-31",
        "2019-03-15",
        "2023-03-20",
        "2022-04-28",
        "2025-04-28",
        "2019-06-23",
        "2024-07-01"
      ],
      "menu_seasons": [
        "winter",
        "spring",
        "summer"
      ],
      "meal_types": [
        "dinner"
      ],
      "sections": [],
      "source_hints": [
        "use ground beef"
      ],
      "item_texts": [
        "Egg roll in a bowl",
        "Egg roll in a bowl (use ground beef)",
        "egg roll in a bowl",
        "15 min Egg roll in a bowl"
      ],
      "count": 7,
      "ingredients": [
        "1 tablespoon olive oil",
        "3 cloves garlic, minced",
        "1 knob of ginger, grated",
        "1 teaspoon Chinese five-spice",
        "2 tablespoons soy sauce",
        "chili paste to taste",
        "1 pound ground pork",
        "5\u20136 cups shredded cabbage or coleslaw mix",
        "3 large carrots, diagonally sliced",
        "Rice and green onions for serving"
      ],
      "recipe_tags": [
        "All Recipes",
        "Bowls",
        "Dairy-Free",
        "Healthy",
        "Kid-Friendly",
        "Lunch",
        "Meal Prep",
        "Recipes",
        "Rice",
        "Sugar-Free",
        "Winter"
      ],
      "main_protein": "pork"
    },
    {
      "url": "https://pinchofyum.com/spaghetti-with-crispy-zucchini",
      "urls": [
        "https://pinchofyum.com/spaghetti-with-crispy-zucchini"
      ],
      "link_texts": [
        "Spaghetti with Crispy Zucchini",
        "Spaghetti With Crispy Zucchini",
        "(Pinch of Yum) "
      ],
      "menu_files": [
        "Menus/Menu week of 10-11-23.md",
        "Menus/Menu week of 11-8-24.md",
        "Menus/Menu week of 5-17-24.md",
        "Menus/Menu week of 7-5-25.md",
        "Menus/Menu week of 7-8-23.md",
        "Menus/Menu week of 9-2-23.md",
        "Menus/Week of 7-14-25.md"
      ],
      "menu_weeks": [
        "2023-10-11",
        "2024-11-08",
        "2024-05-17",
        "2025-07-05",
        "2023-07-08",
        "2023-09-02",
        "2025-07-14"
      ],
      "menu_seasons": [
        "fall",
        "spring",
        "summer"
      ],
      "meal_types": [
        "dinner"
      ],
      "sections": [],
      "source_hints": [
        "https://pinchofyum.com/spaghetti-with-crispy-zucchini",
        "Pinch of Yum"
      ],
      "item_texts": [
        "Spaghetti with Crispy Zucchini",
        "Spaghetti with crispy zucchini",
        "Spaghetti with crispy zucchini Chicken nuggets, salad, sweet potato fries",
        "Spaghetti with crispy zucchini (Pinch of Yum) or zucchini and squash can be grilled with steaks, add potatoes if do steaks",
        "Spaghetti with crispy zucchini (Pinch of Yum)"
      ],
      "count": 7,
      "ingredients": [
        "1/2 pound of uncooked spaghetti",
        "one 24-oz. jar of your favorite store-bought spaghetti sauce (about 2/3rds of a jar)",
        "1 zucchini, cut into 1/4 inch-thick rounds (about 2\u20133 cups)",
        "1 egg",
        "1 cup panko breadcrumbs",
        "1/2 cup grated Parmesan cheese (optional)",
        "1 tablespoon lemon zest (optional)",
        "1 teaspoon salt and pepper to taste",
        "1 teaspoon Italian seasoning",
        "1/2 teaspoon garlic powder",
        "1/2 cup cheese (shredded mozzarella/provolone, fresh mozzarella slices, or goat cheese)",
        "1/4 cup fresh basil leaves for topping"
      ],
      "recipe_tags": [
        "All Recipes",
        "Dinner",
        "Kid-Friendly",
        "Main Dishes",
        "Pasta",
        "Quick and Easy",
        "Recipes",
        "SOS Series",
        "Stovetop",
        "Summer",
        "Vegetarian",
        "Zucchini"
      ],
      "main_protein": "vegetarian"
    },
    {
      "url": "https://cookieandkate.com/vegetarian-italian-chopped-salad-recipe/",
      "urls": [
        "https://cookieandkate.com/vegetarian-italian-chopped-salad-recipe/"
      ],
      "link_texts": [
        "Vegetarian Italian Chopped Salad"
      ],
      "menu_files": [
        "Menus/Menu week of 1-12-2021.md",
        "Menus/Menu week of 1-2-18.md",
        "Menus/Menu week of 1-24-21.md",
        "Menus/Menu week of 12-4-18.md",
        "Menus/Menu week of 3-7-20.md",
        "Menus/Menu week of 8-23-17.md"
      ],
      "menu_weeks": [
        "2021-01-12",
        "2018-01-02",
        "2021-01-24",
        "2018-12-04",
        "2020-03-07",
        "2017-08-23"
      ],
      "menu_seasons": [
        "winter",
        "spring",
        "summer"
      ],
      "meal_types": [
        "lunch",
        "dinner"
      ],
      "sections": [],
      "source_hints": [
        "Vegetarian"
      ],
      "item_texts": [
        "Lunch: Vegetarian Italian Chopped Salad",
        "Vegetarian Italian chopped salad",
        "Vegetarian Italian Chopped Salad",
        "Vegetarian Italian Chopped salad (Vegetarian)"
      ],
      "count": 6,
      "ingredients": [
        "10 ounces chopped romaine lettuce (about 2 medium or 3 small heads, chopped)",
        "1/2 medium head of radicchio, finely chopped (about 2 cups)",
        "1/2 medium red onion, chopped (about 1 cup)",
        "2 ribs celery, chopped",
        "1 pint cherry tomatoes, thinly sliced",
        "1/3 cup stemmed and thinly sliced pickled pepperoncini peppers",
        "1/3 cup oil-packed sun-dried tomatoes, rinsed and roughly chopped",
        "1 can (15 ounces) chickpeas, rinsed and drained, or 1 1/2 cups cooked chickpeas",
        "1 cup (4 ounces) 1/4\" cubes of provolone cheese (optional)",
        "1/3 cup extra-virgin olive oil",
        "1/3 cup red wine vinegar",
        "1 tablespoon Dijon mustard",
        "2 teaspoons dried oregano",
        "1 teaspoon honey",
        "2 cloves garlic, pressed or minced",
        "10 twists freshly ground black pepper",
        "1/4 teaspoon salt, more to taste",
        "Pinch of red pepper flakes, for heat (optional)"
      ],
      "recipe_tags": [
        "dairy free",
        "egg free",
        "fall",
        "favorites",
        "gluten free",
        "Independence Day",
        "Italian",
        "Mediterranean",
        "nut free",
        "recipes",
        "salads",
        "side dishes",
        "soy free",
        "spring",
        "summer",
        "vegan"
      ],
      "main_protein": "vegetarian"
    },
    {
      "url": "https://www.seriouseats.com/herb-butter-rubbed-crisp-skinned-butterflied-spatchcock-roast-turkey-thanksgiving-recipe",
      "urls": [
        "https://www.seriouseats.com/herb-butter-rubbed-crisp-skinned-butterflied-spatchcock-roast-turkey-thanksgiving-recipe"
      ],
      "link_texts": [
        "Herb-Butter Rubbed Crisp-Skinned Butterflied Roast Turkey"
      ],
      "menu_files": [
        "Menus/Menu week of 11-10-17.md",
        "Menus/Menu week of 11-19-22.md",
        "Menus/Menu week of 11-28-19.md",
        "Menus/Menu week of 12-3-17.md",
        "Menus/Menu week of 3-29-22.md",
        "Menus/Menu week of 6-16-22.md"
      ],
      "menu_weeks": [
        "2017-11-10",
        "2022-11-19",
        "2019-11-28",
        "2017-12-03",
        "2022-03-29",
        "2022-06-16"
      ],
      "menu_seasons": [
        "fall",
        "winter",
        "spring",
        "summer"
      ],
      "meal_types": [
        "dinner"
      ],
      "sections": [],
      "source_hints": [],
      "item_texts": [
        "Turkey",
        "Leftover turkey and vegetable dumpling soup",
        "Turkey taco skillet",
        "Baked Quesadillas with ground turkey and black beans"
      ],
      "count": 6,
      "ingredients": [
        "4 medium cloves garlic",
        "1/4 cup roughly chopped chives",
        "1/4 cup fresh parsley leaves",
        "1/4 cup fresh sage leaves",
        "2 tablespoons fresh thyme leaves",
        "1 medium shallot, thinly sliced",
        "1 stick butter, cut into 1/4-inch slices",
        "Kosher salt and freshly ground black pepper",
        "1 whole turkey (10 - 15 pounds total), butterflied and brined",
        "Gravy, for serving"
      ],
      "recipe_tags": [],
      "main_protein": "turkey"
    },
    {
      "url": "https://www.skinnytaste.com/butternut-squash-and-black-bean/",
      "urls": [
        "https://www.skinnytaste.com/butternut-squash-and-black-bean/"
      ],
      "link_texts": [
        "Butternut Squash and Black Bean Enchiladas"
      ],
      "menu_files": [
        "Menus/Menu week of 11-1-20.md",
        "Menus/Menu week of 11-10-17.md",
        "Menus/Menu week of 2-19-18.md",
        "Menus/Menu week of 3-31-18.md",
        "Menus/Menu week of 6-1-21.md",
        "Menus/Menu week of Thanksgiving.md"
      ],
      "menu_weeks": [
        "2020-11-01",
        "2017-11-10",
        "2018-02-19",
        "2018-03-31",
        "2021-06-01"
      ],
      "menu_seasons": [
        "fall",
        "winter",
        "spring",
        "summer"
      ],
      "meal_types": [
        "dinner"
      ],
      "sections": [],
      "source_hints": [
        "radishes, avocado"
      ],
      "item_texts": [
        "Butternut squash and black bean enchiladas (radishes, avocado)",
        "Butternut squash and black bean enchiladas"
      ],
      "count": 6,
      "ingredients": [
        "1 cup red enchilada sauce, homemade or canned",
        "1 tsp olive oil",
        "2 1/2 cups peeled butternut squash, cut 1/2-inch-dice",
        "salt and pepper, to taste",
        "1 small onion, diced",
        "3 cloves garlic, minced",
        "1 jalapeno, seeded and diced",
        "10 oz can Rotel tomatoes with green chilies",
        "1 1/2 cups reduced sodium canned black beans, rinsed and drained",
        "1/4 cup cilantro",
        "1 tsp cumin",
        "1/2 tsp chili powder",
        "1/4 cup water",
        "8 medium low-carb whole wheat flour tortillas",
        "1 cup reduced-fat shredded Mexican cheese",
        "2 tbsp chopped scallions, for garnish",
        "reduced-fat sour cream, for serving (optional)"
      ],
      "recipe_tags": [],
      "main_protein": "vegetarian"
    },
    {
      "url": "https://damndelicious.net/2021/08/13/chicken-and-broccoli-stir-fry/",
      "urls": [
        "https://damndelicious.net/2021/08/13/chicken-and-broccoli-stir-fry/"
      ],
      "link_texts": [
        "Chicken and Broccoli Stir Fry",
        "Chicken And Broccoli Stir Fry"
      ],
      "menu_files": [
        "Menus/Menu week of 1-13-22.md",
        "Menus/Menu week of 5-30-24.md",
        "Menus/Menu week of 7-20.md",
        "Menus/Menu week of 7-23-23.md",
        "Menus/Menu week of 7-8-22.md"
      ],
      "menu_weeks": [
        "2022-01-13",
        "2024-05-30",
        "2023-07-23",
        "2022-07-08"
      ],
      "menu_seasons": [
        "winter",
        "spring",
        "summer"
      ],
      "meal_types": [
        "dinner"
      ],
      "sections": [],
      "source_hints": [
        "Damn Delicious",
        "Gimme Some Oven"
      ],
      "item_texts": [
        "Chicken and broccoli stir fry (Damn Delicious)",
        "Chicken and broccoli stir fry:",
        "Cashew chicken and broccoli stir fry (Gimme Some Oven)",
        "Chicken and Broccoli Stir fry (Damn Delicious)"
      ],
      "count": 5,
      "ingredients": [
        "1/2 cup chicken stock",
        "1/4 cup oyster sauce",
        "1 tablespoon rice wine vinegar",
        "1 tablespoon freshly grated ginger",
        "3 cloves garlic, minced",
        "1 teaspoon Sriracha, optional",
        "1 pound boneless, skinless chicken thighs, cut into bite-size pieces",
        "Kosher salt and freshly ground black pepper, to taste",
        "2 tablespoons cornstarch",
        "1 tablespoon canola oil",
        "1 tablespoon sesame oil",
        "3 cups broccoli florets",
        "1/2 teaspoon toasted sesame seeds"
      ],
      "recipe_tags": [],
      "main_protein": "chicken"
    },
    {
      "url": "https://pinchofyum.com/easy-vegan-burrito-bowls",
      "urls": [
        "https://pinchofyum.com/easy-vegan-burrito-bowls"
      ],
      "link_texts": [
        "Easy Vegan Burrito Bowls"
      ],
      "menu_files": [
        "Menus/Menu week of 1-12-2021.md",
        "Menus/Menu week of 10-4-2019.md",
        "Menus/Menu week of 11-6-18.md",
        "Menus/Menu week of 3-15-19.md",
        "Menus/Menu week of 4-2-2020.md",
        "Menus/Menu week of 12-3-17.md",
        "Menus/Menu week of 1-11-20.md",
        "Menus/Menu week of 11-6-19.md",
        "Menus/Menu week of 10-15-17.md",
        "Menus/Menu week of 6-10-18.md"
      ],
      "menu_weeks": [
        "2021-01-12",
        "2019-10-04",
        "2018-11-06",
        "2019-03-15",
        "2020-04-02",
        "2017-12-03",
        "2020-01-11",
        "2019-11-06",
        "2017-10-15",
        "2018-06-10"
      ],
      "menu_seasons": [
        "winter",
        "fall",
        "spring",
        "summer"
      ],
      "meal_types": [
        "dinner"
      ],
      "sections": [],
      "source_hints": [
        "guac in freezer",
        "peppers and onions, salsa, sour cream, black beans, rice, avocado, frozen corn"
      ],
      "item_texts": [
        "Cauliflower walnut taco meat burrito bowls",
        "Cauliflower walnut taco meat burrito bowls, make pico and guac, black beans and corn, saute peppers",
        "Cauliflower walnut burrito bowls",
        "Cauliflower Walnut burrito bowls (guac in freezer)",
        "Cauliflower walnut Burrito bowls (peppers and onions, salsa, sour cream, black beans, rice, avocado, frozen corn)",
        "Cauliflower walnut taco bowls (radishes!!!) with saut\u00e9ed peppers and onions",
        "Cauliflower \ud83c\udf2f bowls"
      ],
      "count": 10,
      "ingredients": [
        "3 cups cauliflower florets",
        "2 cups whole walnuts",
        "2 individual chipotles in adobo sauce",
        "1 tablespoon chili powder",
        "1 teaspoon cumin",
        "1 teaspoon salt",
        "lime juice, garlic / onion powder, and cayenne to taste",
        "4\u20135 bell peppers, sliced",
        "olive oil and salt",
        "1 1/2 cups uncooked rice",
        "1 14-ounce can black beans, rinsed and drained",
        "lime wedges and cilantro for serving"
      ],
      "recipe_tags": [
        "All Recipes",
        "Bell Pepper",
        "Bowls",
        "Cauliflower",
        "Dairy-Free",
        "Dinner",
        "Fall",
        "Healthy",
        "Legume",
        "Lime",
        "Lunch",
        "Main Dishes",
        "Meal Prep",
        "Quick and Easy",
        "Recipes",
        "Rice",
        "Sheet Pan",
        "Sugar-Free",
        "Tacos",
        "Vegan",
        "Vegetarian"
      ],
      "main_protein": "vegetarian"
    },
    {
      "url": "https://pinchofyum.com/instant-pot-cauliflower-curry",
      "urls": [
        "https://pinchofyum.com/instant-pot-cauliflower-curry"
      ],
      "link_texts": [
        "Instant Pot Cauliflower Curry"
      ],
      "menu_files": [
        "Menus/Menu week of 10-4-2019.md",
        "Menus/Menu week of 2-23-21.md",
        "Menus/Menu week of 3-9-21.md",
        "Menus/Menu week of 5-19-21.md",
        "Menus/Menu week of 9-17-19.md"
      ],
      "menu_weeks": [
        "2019-10-04",
        "2021-02-23",
        "2021-03-09",
        "2021-05-19",
        "2019-09-17"
      ],
      "menu_seasons": [
        "fall",
        "winter",
        "spring"
      ],
      "meal_types": [
        "dinner"
      ],
      "sections": [],
      "source_hints": [],
      "item_texts": [
        "Instant pot cauliflower curry",
        "Instant Pot Cauliflower curry"
      ],
      "count": 5,
      "ingredients": [
        "half of an onion, diced",
        "3 cloves garlic, minced",
        "2 cups cauliflower, cut into florets",
        "2 cups squash, cut into cubes",
        "1/2 cup red lentils",
        "2 tablespoons red curry paste",
        "1 teaspoon turmeric (optional)",
        "1 14\u2013ounce can diced tomatoes",
        "1 can coconut milk",
        "1 cup water",
        "1 1/2 teaspoons kosher salt"
      ],
      "recipe_tags": [
        "All Recipes",
        "Cauliflower",
        "Dairy-Free",
        "Dinner",
        "Fall",
        "Instant Pot",
        "Legume",
        "Main Dishes",
        "Most Popular",
        "Quick and Easy",
        "Recipes",
        "Rice",
        "Sugar-Free",
        "Tomato",
        "Vegan",
        "Vegetarian"
      ],
      "main_protein": "vegetarian"
    },
    {
      "url": "https://www.howsweeteats.com/2021/03/asparagus-pasta-salad/",
      "urls": [
        "https://www.howsweeteats.com/2021/03/asparagus-pasta-salad/"
      ],
      "link_texts": [
        "Asparagus Pasta Salad",
        "Asparagus Pasta Salad with Honey Mustard Dressing"
      ],
      "menu_files": [
        "Menus/Menu week of 3-12-25.md",
        "Menus/Menu week of 5-30-24.md",
        "Menus/Menu week of 6-1-22.md",
        "Menus/Menu week of 6-5-23.md",
        "Menus/Menu week of 7-20.md"
      ],
      "menu_weeks": [
        "2025-03-12",
        "2024-05-30",
        "2022-06-01",
        "2023-06-05"
      ],
      "menu_seasons": [
        "spring",
        "summer"
      ],
      "meal_types": [
        "dinner"
      ],
      "sections": [],
      "source_hints": [],
      "item_texts": [
        "Spring pasta salad with honey mustard dressing",
        "Asparagus pasta salad with honey mustard dressing"
      ],
      "count": 5,
      "ingredients": [
        "1 pound pasta, cooked",
        "kosher salt and pepper",
        "1 pound asparagus, woody stems removed and cut into thirds",
        "1 pint cherry tomatoes, quartered",
        "4 green onions, thinly sliced",
        "8 ounces white cheddar or fontina cheese, cubed",
        "1/4 cup chopped fresh herbs, like basil and parsley",
        "1/4 cup apple cider vinegar",
        "2 tablespoons honey",
        "2 tablespoons dijon mustard",
        "2 garlic cloves, finely minced or pressed",
        "kosher salt and pepper",
        "1/2 cup extra virgin olive oil"
      ],
      "recipe_tags": [
        "Pasta",
        "Recipes",
        "Salads",
        "Side Dishes",
        "Spring",
        "Summer",
        "Vegetarian"
      ],
      "main_protein": "vegetarian"
    },
    {
      "url": "https://www.wellplated.com/instant-pot-butter-chicken/",
      "urls": [
        "https://www.wellplated.com/instant-pot-butter-chicken/"
      ],
      "link_texts": [
        "Instant Pot Butter Chicken"
      ],
      "menu_files": [
        "Menus/Menu week of 10-10-21.md",
        "Menus/Menu week of 3-21-20.md",
        "Menus/Menu week of 4-3-21.md",
        "Menus/Menu week of 6-1-22.md",
        "Menus/Menu week of 8-1-19.md"
      ],
      "menu_weeks": [
        "2021-10-10",
        "2020-03-21",
        "2021-04-03",
        "2022-06-01",
        "2019-08-01"
      ],
      "menu_seasons": [
        "fall",
        "spring",
        "summer"
      ],
      "meal_types": [
        "dinner"
      ],
      "sections": [],
      "source_hints": [],
      "item_texts": [
        "Instant pot butter chicken",
        "Instant Pot butter chicken"
      ],
      "count": 5,
      "ingredients": [
        "1 tablespoon coconut oil",
        "1 small yellow onion diced (about 1 cup)",
        "4 cloves minced garlic about 4 teaspoons",
        "1 tablespoon minced fresh ginger",
        "1 1/2 tablespoons curry powder",
        "2 teaspoons garam masala",
        "1 teaspoon chili powder",
        "3/4 teaspoon kosher salt",
        "Splash of water or low sodium chicken broth",
        "1 (28-ounce) can tomato sauce",
        "1 small cauliflower or 1/2 large head, cut into florets (about 4 1/2 cups)",
        "2 pounds boneless, skinless chicken breasts",
        "2 tablespoons unsalted butter cut into small pieces",
        "1/2 cup half-and-half or full-fat coconut milk",
        "1/2 cup plain nonfat Greek yogurt or non-dairy yogurt",
        "Prepared brown rice or turmeric rice, quinoa, or homemade naan, for serving",
        "Chopped fresh cilantro for serving"
      ],
      "main_protein": "chicken"
    },
    {
      "url": "https://iowagirleats.com/broccoli-beef-recipe/",
      "urls": [
        "https://iowagirleats.com/broccoli-beef-recipe/"
      ],
      "link_texts": [
        "Lighter Broccoli Beef"
      ],
      "menu_files": [
        "Menus/Menu week of 1-9-24.md",
        "Menus/Menu week of 2-23-21.md",
        "Menus/Menu week of 2-6-21.md",
        "Menus/Menu week of 6-1-21.md"
      ],
      "menu_weeks": [
        "2024-01-09",
        "2021-02-23",
        "2021-02-06",
        "2021-06-01"
      ],
      "menu_seasons": [
        "winter",
        "summer"
      ],
      "meal_types": [
        "dinner"
      ],
      "sections": [],
      "source_hints": [
        "Iowa Girl Eats"
      ],
      "item_texts": [
        "Lighter broccoli beef with brown rice (Iowa Girl Eats)",
        "Lighter Broccoli Beef",
        "Lighter broccoli beef"
      ],
      "count": 4,
      "ingredients": [
        "1-1/4 lb flank or sirloin steak, cut very thin against the grain",
        "1/2 cup + 2 Tablespoons reduced-sodium gluten free Tamari, divided, or soy sauce if not GF",
        "2-1/2 Tablespoons gluten free flour OR cornstarch, divided",
        "3/4 cup gluten free low-sodium chicken broth",
        "1/4 cup brown sugar",
        "1 Tablespoon rice vinegar",
        "1 teaspoon sesame oil",
        "3 cloves garlic, minced",
        "1/2 teaspoon ground ginger OR 1 teaspoon ginger paste",
        "1/4 teaspoon red chili pepper flakes, or more or less",
        "1/4 cup + 2 Tablespoons water, divided",
        "4 cups broccoli florets",
        "2 Tablespoon vegetable oil, divided",
        "cooked rice, for serving"
      ],
      "recipe_tags": [
        "Gluten Free",
        "Dairy Free",
        "Egg Free"
      ],
      "main_protein": "beef"
    },
    {
      "url": "https://pinchofyum.com/gnocchi-with-creamy-mushroom-sauce",
      "urls": [
        "https://pinchofyum.com/gnocchi-with-creamy-mushroom-sauce"
      ],
      "link_texts": [
        "Gnocchi With Creamy Mushroom Sauce"
      ],
      "menu_files": [
        "Menus/Menu week of 1-16-26.md",
        "Menus/Menu week of 11-8-24.md",
        "Menus/Menu week of 12-19-25.md",
        "Menus/Menu week of 6-12-24.md"
      ],
      "menu_weeks": [
        "2026-01-16",
        "2024-11-08",
        "2025-12-19",
        "2024-06-12"
      ],
      "menu_seasons": [
        "winter",
        "fall",
        "summer"
      ],
      "meal_types": [
        "dinner"
      ],
      "sections": [],
      "source_hints": [
        "https://pinchofyum.com/gnocchi-with-creamy-mushroom-sauce"
      ],
      "item_texts": [
        "Gnocchi with creamy mushroom sauce",
        "Gnocchi with creamy mushroom sauce and air fryer chicken breast"
      ],
      "count": 4,
      "ingredients": [
        "2 tablespoons butter",
        "16 ounces white button or baby bella mushrooms, cut into thin slices",
        "1/2 teaspoon salt",
        "3 cloves garlic, thinly sliced",
        "1 1/2 cups chicken broth (+ an additional 1/4 cup as needed)",
        "3/4 cup heavy cream",
        "3 sprigs fresh thyme",
        "1 tablespoon cornstarch dissolved in 1 tablespoon cold water",
        "1/4 cup Parmesan cheese",
        "two 16-ounce packages gnocchi, prepared according to package directions (I use DeLallo and I love their mini-size gnocchi for this!)"
      ],
      "recipe_tags": [
        "All Recipes",
        "Dinner",
        "Fall",
        "Mushroom",
        "Pasta",
        "Quick and Easy",
        "Recipes",
        "SOS Series",
        "Vegetarian",
        "Winter"
      ],
      "main_protein": "chicken"
    },
    {
      "url": "https://pinchofyum.com/red-chile-chicken-tacos-with-creamy-corn",
      "urls": [
        "https://pinchofyum.com/red-chile-chicken-tacos-with-creamy-corn"
      ],
      "link_texts": [
        "Red Chile Chicken Tacos with Creamy Corn",
        "Red Chile Chicken Tacos with Creamy Corn Recipe - Pinch of Yum"
      ],
      "menu_files": [
        "Menus/Menu week of 1-9-24.md",
        "Menus/Menu week of 10-6-22.md",
        "Menus/Menu week of 8-26-25.md",
        "Menus/Week of 7-27-25.md"
      ],
      "menu_weeks": [
        "2024-01-09",
        "2022-10-06",
        "2025-08-26",
        "2025-07-27"
      ],
      "menu_seasons": [
        "winter",
        "fall",
        "summer"
      ],
      "meal_types": [
        "dinner"
      ],
      "sections": [],
      "source_hints": [
        "Pinch of Yum",
        "https://pinchofyum.com/red-chile-chicken-tacos-with-creamy-corn"
      ],
      "item_texts": [
        "Red chile chicken tacos with creamy corn (Pinch of Yum)",
        "Red Chile Chicken tacos with creamy corn",
        "Red chile chicken tacos with creamy corn Red Chile Chicken Tacos with Creamy Corn Recipe - Pinch of Yum"
      ],
      "count": 4,
      "ingredients": [
        "1 pound boneless skinless chicken thighs",
        "olive oil, salt, and pepper",
        "8 oz. of red chile enchilada sauce (lately I\u2019ve been using Siete Foods Red Enchilada Sauce as my usual Frontera Brand is no longer available!)",
        "one 14\u2013ounce can pinto beans, rinsed and drained",
        "1/4 cup mayo",
        "2 tablespoons cream cheese",
        "2 cups frozen or fresh sweet corn",
        "1 clove garlic, grated",
        "1/2 teaspoon salt",
        "1 teaspoon cumin",
        "1 teaspoon chili powder",
        "lime juice to taste",
        "1 red onion, thinly sliced",
        "1/2 cup red wine vinegar",
        "1/2 cup water",
        "1 teaspoon salt",
        "1 tablespoon sugar",
        "8 corn tortillas (I like to quickly pan-fry mine in a shallow skillet of hot oil to make them extra soft)",
        "1/2 cup vegetable oil for frying (optional)",
        "1/4 cup cilantro"
      ],
      "recipe_tags": [
        "All Recipes",
        "Dinner",
        "Gluten-Free",
        "Healthy",
        "Kid-Friendly",
        "Lime",
        "Main Dishes",
        "Meat and Chicken",
        "Recipes",
        "Spring",
        "Sugar-Free",
        "Summer",
        "Tacos",
        "Winter"
      ],
      "main_protein": "chicken"
    },
    {
      "url": "https://pinchofyum.com/sweet-potato-peanut-soup",
      "urls": [
        "https://pinchofyum.com/sweet-potato-peanut-soup"
      ],
      "link_texts": [
        "Spicy Peanut Soup with Sweet Potato + Kale"
      ],
      "menu_files": [
        "Menus/Menu week of 1-10-19.md",
        "Menus/Menu week of 10-21-19.md",
        "Menus/Menu week of 10-6-22.md",
        "Menus/Menu week of 12-7-20.md"
      ],
      "menu_weeks": [
        "2019-01-10",
        "2019-10-21",
        "2022-10-06",
        "2020-12-07"
      ],
      "menu_seasons": [
        "winter",
        "fall"
      ],
      "meal_types": [
        "dinner"
      ],
      "sections": [],
      "source_hints": [
        "instant pot"
      ],
      "item_texts": [
        "Spicy peanut soup with sweet potato (instant pot)",
        "Spicy peanut soup with sweet potato and kale, salad",
        "Spicy peanut soup with sweet potatoes",
        "Spicy peanut soup with sweet potatoes and kale"
      ],
      "count": 4,
      "ingredients": [
        "2 tablespoons olive oil",
        "half an onion, diced",
        "1 jalape\u00f1o, minced",
        "2 cloves garlic, minced",
        "3 large sweet potatoes, peeled and cubed",
        "one 14-ounce can fire roasted tomatoes",
        "one 14-ounce can light coconut milk",
        "2 cups water",
        "1 teaspoon salt",
        "1 teaspoon curry and/or turmeric",
        "1/2 cup chopped peanuts",
        "1/4 cup peanut butter",
        "1\u20132 cups kale, stems removed, chopped"
      ],
      "recipe_tags": [
        "All Recipes",
        "Dairy-Free",
        "Gluten-Free",
        "Healthy",
        "Instant Pot",
        "Jalape\u00f1o",
        "Kale",
        "Most Popular",
        "Peanut Butter",
        "Recipes",
        "Soups",
        "Stovetop",
        "Sugar Free January",
        "Sugar-Free",
        "Sweet Potato",
        "Tomato",
        "Vegan",
        "Winter"
      ],
      "main_protein": "vegetarian"
    },
    {
      "url": "https://www.gimmesomeoven.com/vegetarian-moo-shu/",
      "urls": [
        "https://www.gimmesomeoven.com/vegetarian-moo-shu/"
      ],
      "link_texts": [
        "Vegetarian Moo Shu"
      ],
      "menu_files": [
        "Menus/Menu week of 1-11-20.md",
        "Menus/Menu week of 4-22-20.md",
        "Menus/Menu week of 5-1-21.md",
        "Menus/Super Bowl menu.md"
      ],
      "menu_weeks": [
        "2020-01-11",
        "2020-04-22",
        "2021-05-01"
      ],
      "menu_seasons": [
        "winter",
        "spring"
      ],
      "meal_types": [
        "dinner"
      ],
      "sections": [],
      "source_hints": [
        "veg"
      ],
      "item_texts": [
        "Vegetarian Moo Shu",
        "Vegetarian Moo Shu (veg)",
        "Vegetarian Moo shu"
      ],
      "count": 4,
      "ingredients": [
        "1 batch crispy tofu (see below)",
        "1 batch sauce (see below)",
        "2 tablespoons peanut oil (or olive oil)",
        "2 large eggs, whisked",
        "8 ounces shiitake mushrooms, stemmed and thinly sliced",
        "4 cloves garlic, minced or pressed",
        "1 (14-ounce) bag coleslaw",
        "1/2 cup thinly-sliced green onions",
        "for serving: flour tortillas, lettuce cups, rice or quinoa",
        "toppings: hoisin sauce, extra green onions, toasted sesame seeds",
        "14 ounces extra-firm tofu",
        "2 teaspoons cornstarch",
        "1 teaspoon fine sea salt",
        "1/2 teaspoon black pepper",
        "1 tablespoon peanut oil (or olive oil)",
        "1/2 cup hoisin sauce",
        "1/4 cup rice vinegar",
        "2 tablespoons oyster sauce",
        "2 tablespoons low-sodium soy sauce",
        "1 teaspoon toasted sesame oil",
        "1/4 teaspoon freshly-cracked black pepper"
      ],
      "recipe_tags": [],
      "main_protein": "tofu"
    },
    {
      "url": null,
      "urls": [],
      "link_texts": [],
      "menu_files": [
        "Menus/Menu week of 10-4-2019.md",
        "Menus/Menu week of 4-22-20.md",
        "Menus/Menu week of 6-1-22.md"
      ],
      "menu_weeks": [
        "2019-10-04",
        "2020-04-22",
        "2022-06-01"
      ],
      "menu_seasons": [
        "fall",
        "spring",
        "summer"
      ],
      "meal_types": [
        "dinner"
      ],
      "sections": [],
      "source_hints": [],
      "item_texts": [
        "Italian drunken noodles"
      ],
      "count": 3,
      "main_protein": "unknown"
    },
    {
      "url": null,
      "urls": [],
      "link_texts": [],
      "menu_files": [
        "Menus/Menu week of 11-19-22.md",
        "Menus/Menu week of 11-28-19.md",
        "Menus/Menu week of Thanksgiving.md"
      ],
      "menu_weeks": [
        "2022-11-19",
        "2019-11-28"
      ],
      "menu_seasons": [
        "fall"
      ],
      "meal_types": [
        "dinner"
      ],
      "sections": [],
      "source_hints": [],
      "item_texts": [
        "Apple pie"
      ],
      "count": 3,
      "main_protein": "unknown"
    },
    {
      "url": null,
      "urls": [],
      "link_texts": [],
      "menu_files": [
        "Menus/Menu week of 11-19-22.md",
        "Menus/Menu week of 11-28-19.md",
        "Menus/Menu week of Thanksgiving.md"
      ],
      "menu_weeks": [
        "2022-11-19",
        "2019-11-28"
      ],
      "menu_seasons": [
        "fall"
      ],
      "meal_types": [
        "dinner"
      ],
      "sections": [],
      "source_hints": [],
      "item_texts": [
        "Green bean casserole"
      ],
      "count": 3,
      "main_protein": "unknown"
    },
    {
      "url": "https://pinchofyum.com/bang-bang-salmon-with-avocado-cucumber-salsa",
      "urls": [
        "https://pinchofyum.com/bang-bang-salmon-with-avocado-cucumber-salsa"
      ],
      "link_texts": [
        "Bang Bang Salmon With Avocado Cucumber Salsa"
      ],
      "menu_files": [
        "Menus/Menu week of 11-8-24.md",
        "Menus/Menu week of 12-6-24.md",
        "Menus/Menu week of 2-27-25.md"
      ],
      "menu_weeks": [
        "2024-11-08",
        "2024-12-06",
        "2025-02-27"
      ],
      "menu_seasons": [
        "fall",
        "winter"
      ],
      "meal_types": [
        "dinner"
      ],
      "sections": [],
      "source_hints": [
        "https://pinchofyum.com/bang-bang-salmon-with-avocado-cucumber-salsa"
      ],
      "item_texts": [
        "Bang Bang Salmon with avocado cucumber salsa:"
      ],
      "count": 3,
      "ingredients": [
        "1 1/2 pounds salmon filet",
        "1\u20132 tablespoons all-purpose seasoning mix",
        "1/4 cup mayo",
        "2 tablespoons sweet chili sauce",
        "1 clove garlic, grated",
        "1 teaspoon soy sauce",
        "chili crisp for topping",
        "cooked rice",
        "avocado cucumber salsa (for serving)"
      ],
      "recipe_tags": [
        "All Recipes",
        "Avocado",
        "Dairy-Free",
        "Dinner",
        "Fish and Seafood",
        "Gluten-Free",
        "Main Dishes",
        "Most Popular",
        "Quick and Easy",
        "Recipes",
        "Rice",
        "Salmon",
        "Sheet Pan",
        "SOS Series"
      ],
      "main_protein": "seafood"
    },
    {
      "url": "https://pinchofyum.com/burst-tomato-pappardelle",
      "urls": [
        "https://pinchofyum.com/burst-tomato-pappardelle"
      ],
      "link_texts": [
        "Burst Tomato Pappardelle",
        "Burst Tomato Pappardelle"
      ],
      "menu_files": [
        "Menus/Menu week of 8-13-25.md",
        "Menus/Menu week of 9-17-23.md",
        "Menus/Sean Bachelor.md"
      ],
      "menu_weeks": [
        "2025-08-13",
        "2023-09-17"
      ],
      "menu_seasons": [
        "summer",
        "fall"
      ],
      "meal_types": [
        "dinner"
      ],
      "sections": [],
      "source_hints": [
        "https://pinchofyum.com/burst-tomato-pappardelle"
      ],
      "item_texts": [
        "Burst Tomato Pappardelle With Zucchini, Sweet Corn, And Pan-Fried Chicken Frozen orange chicken and broccoli xxxom/burst-tomato-pappardelle",
        "Burst tomato pappardelle",
        "Burst Tomato Pappardelle with Zucchini, Sweet Corn, and Pan-Fried Chicken"
      ],
      "count": 3,
      "ingredients": [
        "1 lb. boneless skinless chicken breasts, cut thin or pounded a bit so they cook quicker and more evenly",
        "1/2 cup flour in a bowl with plenty of salt and pepper",
        "1 tablespoon extra virgin olive oil",
        "1\u20132 tablespoons butter",
        "one 8.8 ounce package of egg pappardelle",
        "1\u20132 cups cherry tomatoes",
        "1\u20132 cup sweet corn, cut off the cob (about 2 ears)",
        "1\u20132 cups zucchini half-moons (about 1 small zucchini)",
        "2 cloves minced garlic",
        "juice of 1 lemon",
        "salt to taste",
        "1/2 cup heavy cream",
        "1/4 cup Parmesan and/or 1/4 cup basil for topping"
      ],
      "recipe_tags": [
        "All Recipes",
        "Dinner",
        "Main Dishes",
        "Meat and Chicken",
        "Pasta",
        "Stovetop",
        "Sugar-Free",
        "Summer",
        "Tomato",
        "Zucchini"
      ],
      "main_protein": "chicken"
    },
    {
      "url": "https://pinchofyum.com/butter-chicken-meatballs",
      "urls": [
        "https://pinchofyum.com/butter-chicken-meatballs"
      ],
      "link_texts": [
        "Butter Chicken Meatballs"
      ],
      "menu_files": [
        "Menus/Menu week of 4-5-23.md",
        "Menus/Menu week of 8-3-23.md",
        "Menus/Menu week of 9-17-23.md"
      ],
      "menu_weeks": [
        "2023-04-05",
        "2023-08-03",
        "2023-09-17"
      ],
      "menu_seasons": [
        "spring",
        "summer",
        "fall"
      ],
      "meal_types": [
        "dinner"
      ],
      "sections": [],
      "source_hints": [],
      "item_texts": [
        "Butter chicken meatballs with roasted cauliflower",
        "Butter chicken meatballs"
      ],
      "count": 3,
      "ingredients": [
        "1 tablespoon avocado oil or olive oil",
        "half of an onion, roughly chopped",
        "3 cloves garlic, minced (or a garlic paste)",
        "a small piece of fresh ginger, grated (or a ginger paste)",
        "1/4 teaspoon turmeric",
        "1/4 teaspoon smoked paprika",
        "1/2 teaspoon garam masala",
        "1/2 teaspoon cumin",
        "one 14-ounce can crushed tomatoes or plain tomato sauce",
        "1/2 cup water (more as needed later)",
        "1/2 teaspoon to 1 teaspoon kosher salt",
        "1 teaspoon sugar",
        "20 ounces of cooked chicken or turkey meatballs",
        "2 tablespoons butter",
        "1/3 cup heavy cream (more to taste)",
        "1 1/2 cups basmati rice, or precooked rice",
        "1/4 cup fresh cilantro"
      ],
      "recipe_tags": [
        "All Recipes",
        "Dinner",
        "Dutch Oven",
        "Instant Pot",
        "Kid-Friendly",
        "Main Dishes",
        "Meat and Chicken",
        "Quick and Easy",
        "Recipes",
        "Rice",
        "SOS Series",
        "Winter"
      ],
      "main_protein": "turkey"
    },
    {
      "url": "https://pinchofyum.com/chicken-wontons-in-spicy-chili-sauce",
      "urls": [
        "https://pinchofyum.com/chicken-wontons-in-spicy-chili-sauce"
      ],
      "link_texts": [
        "Chicken Wontons in Spicy Chili Sauce",
        "Chicken Wontons In Spicy Chili Sauce"
      ],
      "menu_files": [
        "Menus/Menu week of 1-20-24.md",
        "Menus/Menu week of 2-2-24.md",
        "Menus/Menu week of 8-13-25.md"
      ],
      "menu_weeks": [
        "2024-01-20",
        "2024-02-02",
        "2025-08-13"
      ],
      "menu_seasons": [
        "winter",
        "summer"
      ],
      "meal_types": [
        "dinner"
      ],
      "sections": [],
      "source_hints": [
        "Pinch of Yum",
        "https://pinchofyum.com/chicken-wontons-in-spicy-chili-sauce"
      ],
      "item_texts": [
        "Chicken wontons with spicy sauce and roasted broccoli (Pinch of Yum)",
        "Chicken wontons in spicy chili sauce Spicy peanut tofu bowls"
      ],
      "count": 3,
      "ingredients": [
        "3 tablespoons sesame oil, divided",
        "8 ounces shiitake mushrooms, sliced",
        "1 clove garlic, grated",
        "one 12-ounce bag frozen wontons",
        "1\u20132 cups chicken broth (depending on how soupy you like it)",
        "1/2 cup teriyaki sauce",
        "1\u20132 tablespoons chili crisp",
        "green onions, sliced",
        "sesame seeds"
      ],
      "recipe_tags": [
        "All Recipes",
        "Dairy-Free",
        "Dinner",
        "Main Dishes",
        "Meat and Chicken",
        "Most Popular",
        "Mushroom",
        "Quick and Easy",
        "Recipes",
        "SOS Series",
        "Sugar-Free"
      ],
      "main_protein": "chicken"
    },
    {
      "url": "https://pinchofyum.com/cilantro-orange-chicken-with-rice-and-beans",
      "urls": [
        "https://pinchofyum.com/cilantro-orange-chicken-with-rice-and-beans"
      ],
      "link_texts": [
        "Cilantro Orange Chicken with Rice and Beans"
      ],
      "menu_files": [
        "Menus/Menu week of 10-11-23.md",
        "Menus/Menu week of 4-23-23.md",
        "Menus/Menu week of 6-5-23.md"
      ],
      "menu_weeks": [
        "2023-10-11",
        "2023-04-23",
        "2023-06-05"
      ],
      "menu_seasons": [
        "fall",
        "spring",
        "summer"
      ],
      "meal_types": [
        "dinner"
      ],
      "sections": [],
      "source_hints": [
        "no skewers"
      ],
      "item_texts": [
        "Cilantro Orange Chicken",
        "Cilantro Orange Chicken with rice and beans",
        "Cilantro orange chicken with rice and beans (no skewers)"
      ],
      "count": 3,
      "ingredients": [
        "1/4 \u2013 1/2 cup cilantro, finely chopped",
        "2 cloves garlic, grated",
        "juice of 2 oranges (about 4\u20135 tablespoons juice) + a bit of zest",
        "3 tablespoons brown sugar",
        "3 tablespoons avocado oil",
        "2 tablespoons white vinegar",
        "1 1/2 teaspoons salt",
        "1.25 pounds boneless skinless chicken thighs, cut into bite sized pieces",
        "wood or metal skewers (optional)",
        "one 8.8-ounce pouch pre-made yellow rice (or make your own!)",
        "one 14-ounce can refried or regular black beans",
        "1\u20132 cups diced pineapple, mango, and/or avocado (optional)"
      ],
      "recipe_tags": [
        "All Recipes",
        "Bowls",
        "Dairy-Free",
        "Dinner",
        "Gluten-Free",
        "Healthy",
        "Main Dishes",
        "Meat and Chicken",
        "Quick and Easy",
        "Recipes",
        "Rice",
        "Sheet Pan",
        "SOS Series",
        "Spring",
        "Summer"
      ],
      "main_protein": "chicken"
    },
    {
      "url": "https://pinchofyum.com/ricotta-meatballs-with-the-crispy-topping",
      "urls": [
        "https://pinchofyum.com/ricotta-meatballs-with-the-crispy-topping"
      ],
      "link_texts": [
        "Ricotta Meatballs With The Crispy Topping"
      ],
      "menu_files": [
        "Menus/Menu week of 4-28-25.md",
        "Menus/Menu week of 5-26-25.md",
        "Menus/Menu week of 9-24-24.md"
      ],
      "menu_weeks": [
        "2025-04-28",
        "2025-05-26",
        "2024-09-24"
      ],
      "menu_seasons": [
        "spring",
        "fall"
      ],
      "meal_types": [
        "dinner"
      ],
      "sections": [],
      "source_hints": [
        "https://pinchofyum.com/ricotta-meatballs-with-the-crispy-topping"
      ],
      "item_texts": [
        "Ricotta meatballs and salad:",
        "Ricotta meatballs with crispy topping, garlic bread or baguette, zucchini and squash",
        "Ricotta meatballs with crispy topping"
      ],
      "count": 3,
      "ingredients": [
        "1 lb. ground turkey",
        "1/2 cup full-fat ricotta cheese",
        "1/2 cup Parmesan cheese",
        "1/2 cup panko",
        "1 teaspoon garlic powder",
        "1 teaspoon salt",
        "1/2 teaspoon Italian seasoning",
        "1 jar tomato sauce (like a marinara or pasta sauce)",
        "1/4 cup panko",
        "1/4 cup Parmesan cheese",
        "2 teaspoons olive oil",
        "chopped parsley"
      ],
      "recipe_tags": [
        "All Recipes",
        "Dinner",
        "Dutch Oven",
        "Fall",
        "Kid-Friendly",
        "Main Dishes",
        "Meat and Chicken",
        "Most Popular",
        "Quick and Easy",
        "Recipes",
        "SOS Series",
        "Tomato",
        "Winter"
      ],
      "main_protein": "turkey"
    },
    {
      "url": "https://pinchofyum.com/thai-peanut-chicken-bowls",
      "urls": [
        "https://pinchofyum.com/thai-peanut-chicken-bowls"
      ],
      "link_texts": [
        "Thai Peanut Chicken Bowls"
      ],
      "menu_files": [
        "Menus/Menu week of 1-17-25.md",
        "Menus/Menu week of 3-30-25.md",
        "Menus/Menu week of 4-28-25.md"
      ],
      "menu_weeks": [
        "2025-01-17",
        "2025-03-30",
        "2025-04-28"
      ],
      "menu_seasons": [
        "winter",
        "spring"
      ],
      "meal_types": [
        "dinner"
      ],
      "sections": [],
      "source_hints": [
        "https://pinchofyum.com/thai-peanut-chicken-bowls"
      ],
      "item_texts": [
        "Thai peanut chicken bowls: use chicken thighs"
      ],
      "count": 3,
      "ingredients": [
        "1 lb. boneless skinless chicken breasts or thighs, cut into thin slices",
        "8-ounce jar Thai peanut satay sauce (from Trader Joe\u2019s)",
        "1 clove grated garlic",
        "2 cups thinly sliced cucumber (1 large English cucumber)",
        "1/2 cup thinly sliced red onion (about 1/4 an onion)",
        "2 tablespoons avocado oil",
        "1 tablespoon vinegar",
        "salt and sugar to taste",
        "4 ounces vermicelli noodles",
        "a few tablespoons of crushed peanuts",
        "a few sprigs of herbs \u2013 mint, cilantro, and basil"
      ],
      "recipe_tags": [
        "All Recipes",
        "Bowls",
        "Dairy-Free",
        "Dinner",
        "Healthy",
        "Meat and Chicken",
        "Peanut Butter",
        "Quick and Easy",
        "Recipes"
      ],
      "main_protein": "chicken"
    },
    {
      "url": "https://pinchofyum.com/trader-joes-sun-dried-tomato-focaccia-turkey-sandwich",
      "urls": [
        "https://pinchofyum.com/trader-joes-sun-dried-tomato-focaccia-turkey-sandwich"
      ],
      "link_texts": [
        "Trader Joes Sun Dried Tomato Focaccia Turkey Sandwich",
        "Trader Joe's Sun-Dried Tomato Focaccia Turkey Sandwich Recipe - Pinch of Yum"
      ],
      "menu_files": [
        "Menus/Menu week of 6-13-25.md",
        "Menus/Menu week of 9-10-25.md",
        "Menus/Week of 7-27-25.md"
      ],
      "menu_weeks": [
        "2025-06-13",
        "2025-09-10",
        "2025-07-27"
      ],
      "menu_seasons": [
        "summer",
        "fall"
      ],
      "meal_types": [
        "dinner"
      ],
      "sections": [],
      "source_hints": [
        "use micro greens",
        "https://pinchofyum.com/trader-joes-sun-dried-tomato-focaccia-turkey-sandwich"
      ],
      "item_texts": [
        "Friday: Turkey Focaccia sandwich fruit (use micro greens)",
        "Trader Joe\u2019s Sun-Dried Tomato Focaccia Turkey Sandwich",
        "Roasted Tomato Focaccia Turkey Sandwich with Pesto Mayo and soup Trader Joe's Sun-Dried Tomato Focaccia Turkey Sandwich Recipe - Pinch of Yum"
      ],
      "count": 3,
      "ingredients": [
        "1 loaf of Trader Joe\u2019s sun-dried tomato focaccia",
        "one 7-ounce package deli turkey",
        "1 large tomato, thinly sliced",
        "one handful of greens \u2013 sprouts, microgreens, spinach, etc.",
        "a few pieces of thinly sliced red onion",
        "1/4 cup mayo",
        "1/4 cup pesto"
      ],
      "recipe_tags": [
        "All Recipes",
        "Dinner",
        "Kid-Friendly",
        "Lunch",
        "Meat and Chicken",
        "Quick and Easy",
        "Recipes",
        "Sandwiches",
        "Spinach",
        "Spring",
        "Sugar-Free",
        "Summer",
        "Tomato"
      ],
      "main_protein": "turkey"
    },
    {
      "url": "https://www.acouplecooks.com/chickpea-couscous-bowls-tahini-sauce/",
      "urls": [
        "https://www.acouplecooks.com/chickpea-couscous-bowls-tahini-sauce/"
      ],
      "link_texts": [
        "Mediterranean Couscous Bowls"
      ],
      "menu_files": [
        "Menus/Menu week of 1-10-19.md",
        "Menus/Menu week of 8-12-18.md",
        "Menus/Menu week of 6-16-22.md"
      ],
      "menu_weeks": [
        "2019-01-10",
        "2018-08-12",
        "2022-06-16"
      ],
      "menu_seasons": [
        "winter",
        "summer"
      ],
      "meal_types": [
        "dinner"
      ],
      "sections": [],
      "source_hints": [],
      "item_texts": [
        "Chickpea cous cous bowls with tahini sauce",
        "Mediterranean couscous bowls"
      ],
      "count": 3,
      "ingredients": [
        "1 1/2 cups cooked or 1 15-ounce can chickpeas",
        "1 tablespoon olive oil",
        "1/2 teaspoon cumin",
        "1/2 teaspoon kosher salt",
        "1 cup whole wheat couscous",
        "3/4 teaspoon kosher salt",
        "1 tablespoon olive oil",
        "2 tablespoons finely chopped parsley",
        "1 small cucumber",
        "1 pint cherry tomatoes",
        "8 cups salad greens",
        "1 recipe Best Tahini Sauce"
      ],
      "main_protein": "vegetarian"
    },
    {
      "url": "https://www.halfbakedharvest.com/one-pot-hamburger-helper/",
      "urls": [
        "https://www.halfbakedharvest.com/one-pot-hamburger-helper/"
      ],
      "link_texts": [
        "One Pot Hamburger Helper",
        "Healthier Homemade One Pot Hamburger Helper. - Half Baked Harvest"
      ],
      "menu_files": [
        "Menus/Menu week of 1-28-25.md",
        "Menus/Menu week of 10-23-24.md",
        "Menus/Menu week of 11-5-25.md"
      ],
      "menu_weeks": [
        "2025-01-28",
        "2024-10-23",
        "2025-11-05"
      ],
      "menu_seasons": [
        "winter",
        "fall"
      ],
      "meal_types": [
        "dinner"
      ],
      "sections": [],
      "source_hints": [
        "https://www.halfbakedharvest.com/one-pot-hamburger-helper/"
      ],
      "item_texts": [
        "Healthier Hamburger Helper",
        "One pot healthier hamburger helper",
        "Healthier one pot hamburger helper Healthier Homemade One Pot Hamburger Helper. - Half Baked Harvest"
      ],
      "count": 3,
      "ingredients": [
        "2 tablespoons extra virgin olive oil",
        "1 pound lean ground beef",
        "1 medium yellow onion, chopped",
        "kosher salt and black pepper",
        "1 teaspoon chili powder",
        "1 teaspoon paprika",
        "1 teaspoon garlic powder",
        "1 pound short cut pasta",
        "1 zucchini, grated (about 1 cup grated)",
        "2 cups low sodium beef broth",
        "1 1/2 cups milk",
        "1 1/2-2 cups shredded cheddar cheese",
        "1 tablespoon ketchup",
        "fresh parsley, for serving"
      ],
      "main_protein": "beef"
    },
    {
      "url": "https://www.howsweeteats.com/2021/05/strawberry-salad/",
      "urls": [
        "https://www.howsweeteats.com/2021/05/strawberry-salad/"
      ],
      "link_texts": [
        "Strawberry Salad"
      ],
      "menu_files": [
        "Menus/Menu week of 5-17-24.md",
        "Menus/Menu week of 5-26-25.md",
        "Menus/Menu week of 5-30-24.md"
      ],
      "menu_weeks": [
        "2024-05-17",
        "2025-05-26",
        "2024-05-30"
      ],
      "menu_seasons": [
        "spring"
      ],
      "meal_types": [
        "dinner"
      ],
      "sections": [],
      "source_hints": [],
      "item_texts": [
        "Strawberry crunch salad and baguette",
        "Strawberry crunch salad with baguette:"
      ],
      "count": 3,
      "ingredients": [
        "2/3 cup sliced or slivered almonds",
        "3 tablespoons sugar",
        "10 ounces arugula greens",
        "8 ounces strawberries, hulled and quartered or chopped",
        "1 avocado chopped",
        "2 ounces crumbled goat cheese",
        "1/3 cup roasted salted pistachios, chopped",
        "3 tablespoons champagne vinegar",
        "1/2 lemon, juiced",
        "2 tablespoons honey",
        "1 teaspoon dijon mustard",
        "1 garlic clove, freshly grated",
        "pinch kosher salt and pepper",
        "1/2 cup olive oil"
      ],
      "main_protein": "vegetarian"
    },
    {
      "url": "https://www.spendwithpennies.com/instant-pot-chicken-noodle-soup/",
      "urls": [
        "https://www.spendwithpennies.com/instant-pot-chicken-noodle-soup/"
      ],
      "link_texts": [
        "Instant Pot Chicken Noodle Soup",
        "Instant Pot Chicken Noodle Soup"
      ],
      "menu_files": [
        "Menus/Menu week of 10-11-23.md",
        "Menus/Menu week of 10-4-25.md",
        "Menus/Menu week of 6-1-21.md"
      ],
      "menu_weeks": [
        "2023-10-11",
        "2025-10-04",
        "2021-06-01"
      ],
      "menu_seasons": [
        "fall",
        "summer"
      ],
      "meal_types": [
        "dinner"
      ],
      "sections": [],
      "source_hints": [
        "Spend with Pennies",
        "https://www.spendwithpennies.com/instant-pot-chicken-noodle-soup/"
      ],
      "item_texts": [
        "Instant pot chicken noodle soup (Spend with Pennies)",
        "Instant pot chicken noodle soup"
      ],
      "count": 3,
      "ingredients": [
        "1 large onion diced",
        "1 tablespoon olive oil",
        "2 large boneless skinless chicken breasts (8 oz each)",
        "2 medium carrots sliced (about 1 cup)",
        "2 ribs celery sliced (about 1 cup)",
        "1 tablespoon chopped fresh parsley",
        "1 bay leaf",
        "6 cups chicken broth or stock",
        "4 ounces egg noodles (approx. 2 1/2 cups dry)",
        "salt and black pepper to taste"
      ],
      "recipe_tags": [
        "Chicken",
        "Instant Pot",
        "Lunch",
        "Main Dishes",
        "Recipes",
        "Soups & Stews"
      ],
      "main_protein": "chicken"
    },
    {
      "url": null,
      "urls": [],
      "link_texts": [],
      "menu_files": [
        "Menus/Menu week of 1-11-20.md",
        "Menus/Menu week of 10-4-2019.md"
      ],
      "menu_weeks": [
        "2020-01-11",
        "2019-10-04"
      ],
      "menu_seasons": [
        "winter",
        "fall"
      ],
      "meal_types": [
        "dinner"
      ],
      "sections": [],
      "source_hints": [],
      "item_texts": [
        "Irish potato soup"
      ],
      "count": 2,
      "main_protein": "unknown"
    },
    {
      "url": null,
      "urls": [],
      "link_texts": [],
      "menu_files": [
        "Menus/Menu week of 1-13-18.md",
        "Menus/Menu week of 1-28-18.md"
      ],
      "menu_weeks": [
        "2018-01-13",
        "2018-01-28"
      ],
      "menu_seasons": [
        "winter"
      ],
      "meal_types": [
        "dinner"
      ],
      "sections": [],
      "source_hints": [],
      "item_texts": [
        "Dark chocolate almond joy bites"
      ],
      "count": 2,
      "main_protein": "unknown"
    },
    {
      "url": null,
      "urls": [],
      "link_texts": [],
      "menu_files": [
        "Menus/Menu week of 1-13-18.md",
        "Menus/Menu week of 3-14-18.md"
      ],
      "menu_weeks": [
        "2018-01-13",
        "2018-03-14"
      ],
      "menu_seasons": [
        "winter",
        "spring"
      ],
      "meal_types": [
        "dinner"
      ],
      "sections": [],
      "source_hints": [],
      "item_texts": [
        "Chips and salsa"
      ],
      "count": 2,
      "main_protein": "unknown"
    },
    {
      "url": null,
      "urls": [],
      "link_texts": [],
      "menu_files": [
        "Menus/Menu week of 1-16-22.md",
        "Menus/Menu week of 1-31-22.md"
      ],
      "menu_weeks": [
        "2022-01-16",
        "2022-01-31"
      ],
      "menu_seasons": [
        "winter"
      ],
      "meal_types": [
        "snack"
      ],
      "sections": [],
      "source_hints": [],
      "item_texts": [
        "Snack: cookie dough energy bites"
      ],
      "count": 2,
      "main_protein": "unknown"
    },
    {
      "url": null,
      "urls": [],
      "link_texts": [],
      "menu_files": [
        "Menus/Menu week of 1-23-23.md",
        "Menus/Menu week of 12-28-23.md"
      ],
      "menu_weeks": [
        "2023-01-23",
        "2023-12-28"
      ],
      "menu_seasons": [
        "winter"
      ],
      "meal_types": [
        "dinner"
      ],
      "sections": [],
      "source_hints": [],
      "item_texts": [
        "ROASTED CAULIFLOWER HUMMUS BOWLS",
        "Roasted cauliflower hummus bowls"
      ],
      "count": 2,
      "main_protein": "unknown"
    },
    {
      "url": null,
      "urls": [],
      "link_texts": [],
      "menu_files": [
        "Menus/Menu week of 1-24-20.md",
        "Menus/Menu week of 3-21-20.md"
      ],
      "menu_weeks": [
        "2020-01-24",
        "2020-03-21"
      ],
      "menu_seasons": [
        "winter",
        "spring"
      ],
      "meal_types": [
        "dinner"
      ],
      "sections": [],
      "source_hints": [],
      "item_texts": [
        "Best easy fish tacos"
      ],
      "count": 2,
      "main_protein": "unknown"
    },
    {
      "url": null,
      "urls": [],
      "link_texts": [],
      "menu_files": [
        "Menus/Menu week of 1-24-21.md",
        "Menus/Menu week of 2-8-20.md"
      ],
      "menu_weeks": [
        "2021-01-24",
        "2020-02-08"
      ],
      "menu_seasons": [
        "winter"
      ],
      "meal_types": [
        "dinner"
      ],
      "sections": [],
      "source_hints": [],
      "item_texts": [
        "Cashew tofu stir fry"
      ],
      "count": 2,
      "main_protein": "unknown"
    },
    {
      "url": null,
      "urls": [],
      "link_texts": [],
      "menu_files": [
        "Menus/Menu week of 1-28-18.md",
        "Menus/Menu week of 2-23-20.md"
      ],
      "menu_weeks": [
        "2018-01-28",
        "2020-02-23"
      ],
      "menu_seasons": [
        "winter"
      ],
      "meal_types": [
        "dinner"
      ],
      "sections": [],
      "source_hints": [],
      "item_texts": [
        "Buffalo Chicken wontons and apples",
        "Buffalo chicken wontons and apples"
      ],
      "count": 2,
      "main_protein": "unknown"
    },
    {
      "url": null,
      "urls": [],
      "link_texts": [],
      "menu_files": [
        "Menus/Menu week of 1-28-18.md",
        "Menus/Menu week of 2-19-18.md"
      ],
      "menu_weeks": [
        "2018-01-28",
        "2018-02-19"
      ],
      "menu_seasons": [
        "winter"
      ],
      "meal_types": [
        "dinner"
      ],
      "sections": [],
      "source_hints": [],
      "item_texts": [
        "Cilantro lime chicken meatball bowls"
      ],
      "count": 2,
      "main_protein": "unknown"
    },
    {
      "url": null,
      "urls": [],
      "link_texts": [],
      "menu_files": [
        "Menus/Menu week of 10-15-17.md",
        "Menus/Menu week of 11-1-20.md"
      ],
      "menu_weeks": [
        "2017-10-15",
        "2020-11-01"
      ],
      "menu_seasons": [
        "fall"
      ],
      "meal_types": [
        "dinner"
      ],
      "sections": [],
      "source_hints": [],
      "item_texts": [
        "Roasted chicken thighs with delicata squash"
      ],
      "count": 2,
      "main_protein": "unknown"
    },
    {
      "url": null,
      "urls": [],
      "link_texts": [],
      "menu_files": [
        "Menus/Menu week of 11-12-22.md",
        "Menus/Menu week of 3-21-20.md"
      ],
      "menu_weeks": [
        "2022-11-12",
        "2020-03-21"
      ],
      "menu_seasons": [
        "fall",
        "spring"
      ],
      "meal_types": [
        "dinner"
      ],
      "sections": [],
      "source_hints": [],
      "item_texts": [
        "Red Curry Lentils",
        "Red curry lentils"
      ],
      "count": 2,
      "main_protein": "unknown"
    },
    {
      "url": null,
      "urls": [],
      "link_texts": [],
      "menu_files": [
        "Menus/Menu week of 11-19-22.md",
        "Menus/Menu week of 11-28-19.md"
      ],
      "menu_weeks": [
        "2022-11-19",
        "2019-11-28"
      ],
      "menu_seasons": [
        "fall"
      ],
      "meal_types": [
        "dinner"
      ],
      "sections": [],
      "source_hints": [],
      "item_texts": [
        "Mashed potatoes",
        "Mashed Potatoes"
      ],
      "count": 2,
      "main_protein": "unknown"
    },
    {
      "url": null,
      "urls": [],
      "link_texts": [],
      "menu_files": [
        "Menus/Menu week of 11-6-18.md",
        "Menus/Menu week of 9-17-20.md"
      ],
      "menu_weeks": [
        "2018-11-06",
        "2020-09-17"
      ],
      "menu_seasons": [
        "fall"
      ],
      "meal_types": [
        "dinner"
      ],
      "sections": [],
      "source_hints": [],
      "item_texts": [
        "Spaghetti squash casserole"
      ],
      "count": 2,
      "main_protein": "unknown"
    },
    {
      "url": null,
      "urls": [],
      "link_texts": [],
      "menu_files": [
        "Menus/Menu week of 11-6-18.md",
        "Menus/Menu week of 5-22-19.md"
      ],
      "menu_weeks": [
        "2018-11-06",
        "2019-05-22"
      ],
      "menu_seasons": [
        "fall",
        "spring"
      ],
      "meal_types": [
        "dinner"
      ],
      "sections": [],
      "source_hints": [],
      "item_texts": [
        "Sheet pan chicken tikka"
      ],
      "count": 2,
      "main_protein": "unknown"
    },
    {
      "url": null,
      "urls": [],
      "link_texts": [],
      "menu_files": [
        "Menus/Menu week of 12-10-23.md",
        "Menus/Week of 12-14-22.md"
      ],
      "menu_weeks": [
        "2023-12-10",
        "2022-12-14"
      ],
      "menu_seasons": [
        "winter"
      ],
      "meal_types": [
        "dinner"
      ],
      "sections": [],
      "source_hints": [],
      "item_texts": [
        "Easy crockpot carnitas"
      ],
      "count": 2,
      "main_protein": "unknown"
    },
    {
      "url": null,
      "urls": [],
      "link_texts": [],
      "menu_files": [
        "Menus/Menu week of 12-3-17.md",
        "Menus/Menu week of 12-7-19.md"
      ],
      "menu_weeks": [
        "2017-12-03",
        "2019-12-07"
      ],
      "menu_seasons": [
        "winter"
      ],
      "meal_types": [
        "dinner"
      ],
      "sections": [],
      "source_hints": [],
      "item_texts": [
        "Spaghetti squash pizza boats"
      ],
      "count": 2,
      "main_protein": "unknown"
    },
    {
      "url": null,
      "urls": [],
      "link_texts": [],
      "menu_files": [
        "Menus/Menu week of 2-14-19.md",
        "Menus/Menu\u0301 week of 12-28-18.md"
      ],
      "menu_weeks": [
        "2019-02-14",
        "2018-12-28"
      ],
      "menu_seasons": [
        "winter"
      ],
      "meal_types": [
        "dinner"
      ],
      "sections": [],
      "source_hints": [],
      "item_texts": [
        "Instant pot chicken tikka masala"
      ],
      "count": 2,
      "main_protein": "unknown"
    },
    {
      "url": null,
      "urls": [],
      "link_texts": [],
      "menu_files": [
        "Menus/Menu week of 3-15-19.md",
        "Menus/Menu week of 3-19-21.md"
      ],
      "menu_weeks": [
        "2019-03-15",
        "2021-03-19"
      ],
      "menu_seasons": [
        "spring"
      ],
      "meal_types": [
        "dinner"
      ],
      "sections": [],
      "source_hints": [],
      "item_texts": [
        "Crockpot quinoa chicken primavera"
      ],
      "count": 2,
      "main_protein": "unknown"
    },
    {
      "url": null,
      "urls": [],
      "link_texts": [],
      "menu_files": [
        "Menus/Menu week of 6-1-22.md",
        "Menus/Menu week of 8-20-23.md"
      ],
      "menu_weeks": [
        "2022-06-01",
        "2023-08-20"
      ],
      "menu_seasons": [
        "summer"
      ],
      "meal_types": [
        "dinner"
      ],
      "sections": [],
      "source_hints": [],
      "item_texts": [
        "Bread salad"
      ],
      "count": 2,
      "main_protein": "unknown"
    },
    {
      "url": null,
      "urls": [],
      "link_texts": [],
      "menu_files": [
        "Menus/Menu week of 7-20-17.md",
        "Menus/Menu week of 8-23-17.md"
      ],
      "menu_weeks": [
        "2017-07-20",
        "2017-08-23"
      ],
      "menu_seasons": [
        "summer"
      ],
      "meal_types": [
        "dinner"
      ],
      "sections": [],
      "source_hints": [],
      "item_texts": [
        "Kung pao chicken zoodles",
        "Kung pao chicken Zoodles"
      ],
      "count": 2,
      "main_protein": "unknown"
    },
    {
      "url": null,
      "urls": [],
      "link_texts": [],
      "menu_files": [
        "Menus/Menu week of 7-8-22.md",
        "Menus/Menu week of 8-1-22.md"
      ],
      "menu_weeks": [
        "2022-07-08",
        "2022-08-01"
      ],
      "menu_seasons": [
        "summer"
      ],
      "meal_types": [
        "dinner"
      ],
      "sections": [],
      "source_hints": [
        "Skinnytaste"
      ],
      "item_texts": [
        "Peruvian-style grilled chicken with aji verde sauce (Serious Eats), cuban rice and black beans (Skinnytaste)"
      ],
      "count": 2,
      "main_protein": "unknown"
    },
    {
      "url": null,
      "urls": [],
      "link_texts": [],
      "menu_files": [
        "Menus/Menu week of 8-1-20.md",
        "Menus/Menu week of 8-12-20.md"
      ],
      "menu_weeks": [
        "2020-08-01",
        "2020-08-12"
      ],
      "menu_seasons": [
        "summer"
      ],
      "meal_types": [
        "dinner"
      ],
      "sections": [],
      "source_hints": [],
      "item_texts": [
        "Steak tacos and elote"
      ],
      "count": 2,
      "main_protein": "unknown"
    },
    {
      "url": "https://cravingsbychrissyteigen.com/blogs/recipes/squash-and-ricotta-pizza-recipe",
      "urls": [
        "https://cravingsbychrissyteigen.com/blogs/recipes/squash-and-ricotta-pizza-recipe"
      ],
      "link_texts": [
        "Garlicky Roasted Squash and Ricotta Pizza"
      ],
      "menu_files": [
        "Menus/Menu week of 1-12-2021.md",
        "Menus/Menu week of 11-16-20.md"
      ],
      "menu_weeks": [
        "2021-01-12",
        "2020-11-16"
      ],
      "menu_seasons": [
        "winter",
        "fall"
      ],
      "meal_types": [
        "dinner"
      ],
      "sections": [],
      "source_hints": [
        "roast garlic and make dough ahead of time"
      ],
      "item_texts": [
        "Garlicky roasted squash and ricotta pizza",
        "Garlicky roasted squash and ricotta pizza (roast garlic and make dough ahead of time)"
      ],
      "count": 2,
      "ingredients": [
        "30 large or 40 medium cloves peeled garlic (about 1 1/4 cups\u2014this makes extra; recipe can be halved)",
        "2 1/4 cups olive oil",
        "3/4 cup warm water, plus more as needed",
        "1 packet (2 1/4 teaspoons) active dry yeast",
        "1 1/2 tablespoons sugar",
        "1 teaspoon fine sea salt",
        "2 cups flour, plus more as needed",
        "1 tablespoon olive oil",
        "2 small or 1 medium delicata squash (6 ounces), seeded and cut into 1/4 inch rings; can use small butternut squash if delicata is not available",
        "3 tablespoons olive oil",
        "6 ounces fresh mozzarella, thinly sliced",
        "1 cup finely shredded Parmigiano-Reggiano cheese",
        "4 ounces (1/2 cup) fresh ricotta cheese",
        "1 tablespoon finely sliced fresh sage",
        "1 teaspoon finely minced Thai bird or other fresh hot chiles (seed only if you want to!), plus more for garnish",
        "kosher salt and freshly ground black pepper to taste"
      ],
      "recipe_tags": [],
      "main_protein": "vegetarian"
    },
    {
      "url": "https://pinchofyum.com/5-ingredient-spicy-pork",
      "urls": [
        "https://pinchofyum.com/5-ingredient-spicy-pork"
      ],
      "link_texts": [
        "5 Ingredient Spicy Pork"
      ],
      "menu_files": [
        "Menus/Menu week of 1-23-23.md",
        "Menus/Menu week of 4-4-24.md"
      ],
      "menu_weeks": [
        "2023-01-23",
        "2024-04-04"
      ],
      "menu_seasons": [
        "winter",
        "spring"
      ],
      "meal_types": [
        "dinner"
      ],
      "sections": [],
      "source_hints": [],
      "item_texts": [
        "Five ingredient spicy pork",
        "5 ingredient spicy pork"
      ],
      "count": 2,
      "ingredients": [
        "2 tablespoons hot chili paste (I like sambal oelek, but sriracha can also work)",
        "2 tablespoons soy sauce",
        "2 tablespoons brown sugar",
        "1-inch piece of ginger, peeled and finely grated",
        "1 garlic clove, finely grated",
        "1 1/2 pounds pork tenderloin, very thinly sliced (see notes)",
        "2 tablespoons vegetable oil",
        "1 1/2 cups rice, uncooked",
        "2 carrots, sliced into coins",
        "3 cups spinach, cooked down",
        "2 tablespoons green onions, sliced"
      ],
      "recipe_tags": [
        "5 Ingredients",
        "All Recipes",
        "Bowls",
        "Carrot",
        "Dairy-Free",
        "Dinner",
        "Main Dishes",
        "Meat and Chicken",
        "Quick and Easy",
        "Recipes",
        "Rice",
        "Spring"
      ],
      "main_protein": "pork"
    },
    {
      "url": "https://pinchofyum.com/baked-salmon-with-amazing-lemon-sauce",
      "urls": [
        "https://pinchofyum.com/baked-salmon-with-amazing-lemon-sauce"
      ],
      "link_texts": [
        "Baked Salmon with Amazing Lemon Sauce"
      ],
      "menu_files": [
        "Menus/Menu week of 1-13-22.md",
        "Menus/Menu week of 11-19-22.md"
      ],
      "menu_weeks": [
        "2022-01-13",
        "2022-11-19"
      ],
      "menu_seasons": [
        "winter",
        "fall"
      ],
      "meal_types": [
        "dinner"
      ],
      "sections": [],
      "source_hints": [
        "Pinch of Yum"
      ],
      "item_texts": [
        "Baked Salmon with amazing lemon sauce (Pinch of Yum)",
        "Baked salmon with amazing lemon sauce"
      ],
      "count": 2,
      "ingredients": [
        "1 lb. small gold potatoes, cut into bite-sized pieces",
        "olive oil + garlic powder, salt, and pepper",
        "2\u20133 cups of broccoli florets (I\u2019m using baby broccoli in the photos)",
        "1\u20132 lbs. salmon (cut into 2-4 filets)",
        "6\u20138 tablespoons butter",
        "1\u20132 cloves garlic, minced",
        "1 shallot, minced",
        "2\u20133 sprigs of fresh thyme",
        "1/2 cup heavy cream",
        "1/2 cup chicken broth",
        "juice of 1 lemon",
        "2 tablespoons chopped fresh parsley or basil",
        "salt and pepper to taste"
      ],
      "recipe_tags": [
        "All Recipes",
        "Broccoli",
        "Dinner",
        "Fish and Seafood",
        "Gluten-Free",
        "Healthy",
        "Lemon",
        "Main Dishes",
        "Salmon",
        "Sheet Pan"
      ],
      "main_protein": "seafood"
    },
    {
      "url": "https://pinchofyum.com/burger-bowls-with-house-sauce-and-ranch-fries",
      "urls": [
        "https://pinchofyum.com/burger-bowls-with-house-sauce-and-ranch-fries"
      ],
      "link_texts": [
        "Burger Bowls With House Sauce And Ranch Fries",
        "Burger Bowls with House Sauce and Ranch Fries Recipe - Pinch of Yum"
      ],
      "menu_files": [
        "Menus/Menu week of 9-21-25.md",
        "Menus/Week of 7-27-25.md"
      ],
      "menu_weeks": [
        "2025-09-21",
        "2025-07-27"
      ],
      "menu_seasons": [
        "fall",
        "summer"
      ],
      "meal_types": [
        "lunch",
        "dinner"
      ],
      "sections": [],
      "source_hints": [
        "https://pinchofyum.com/burger-bowls-with-house-sauce-and-ranch-fries"
      ],
      "item_texts": [
        "Burger bowls with house sauce and ranch fries BLTs (for lunch)?",
        "Burger bowls with ranch fries Burger Bowls with House Sauce and Ranch Fries Recipe - Pinch of Yum"
      ],
      "count": 2,
      "ingredients": [
        "1 lb. ground beef (85/15 for the juiciest)",
        "2 teaspoons burger seasoning (one teaspoon per side)",
        "Shredded lettuce",
        "Diced tomatoes",
        "Diced burger pickles",
        "1 22\u2013ounce bag frozen waffle fries",
        "3 tablespoons butter",
        "1 1-ounce packet ranch seasoning mix (or 3 tablespoons)",
        "1/2 cup mayo",
        "2 tablespoons ketchup",
        "1 teaspoon horseradish",
        "1 teaspoon Worcestershire",
        "1/2 teaspoon paprika",
        "1 clove grated garlic"
      ],
      "recipe_tags": [
        "All Recipes",
        "Bowls",
        "Dinner",
        "Gluten-Free",
        "Kid-Friendly",
        "Meat and Chicken",
        "Quick and Easy",
        "Recipes",
        "SOS Series",
        "Stovetop",
        "Summer"
      ],
      "main_protein": "beef"
    },
    {
      "url": "https://pinchofyum.com/cauliflower-walnut-vegetarian-taco-meat",
      "urls": [
        "https://pinchofyum.com/cauliflower-walnut-vegetarian-taco-meat"
      ],
      "link_texts": [
        "Cauliflower Walnut Vegetarian Taco Meat"
      ],
      "menu_files": [
        "Menus/Menu week of 1-28-25.md",
        "Menus/Week of 11-17-25.md"
      ],
      "menu_weeks": [
        "2025-01-28",
        "2025-11-17"
      ],
      "menu_seasons": [
        "winter",
        "fall"
      ],
      "meal_types": [
        "dinner"
      ],
      "sections": [],
      "source_hints": [
        "https://pinchofyum.com/cauliflower-walnut-vegetarian-taco-meat"
      ],
      "item_texts": [
        "Cauliflower walnut taco meat Double recipe, serve with black beans, pico, cheese, sour cream, corn, salsa, and lettuce",
        "Fake meat burrito bowls (premade pico and guac, microwave rice packets)"
      ],
      "count": 2,
      "ingredients": [
        "3 cups cauliflower florets",
        "2 cups whole walnuts",
        "2 individual chipotles in adobo sauce",
        "1 tablespoon chili powder",
        "1 teaspoon cumin",
        "1 teaspoon salt",
        "2 tablespoons lime juice",
        "1/2 teaspoon garlic or onion powder",
        "a pinch of cayenne for more heat"
      ],
      "recipe_tags": [
        "5 Ingredients",
        "All Recipes",
        "Bowls",
        "Cauliflower",
        "Dairy-Free",
        "Dinner",
        "Gluten Free May",
        "Gluten-Free",
        "Healthy",
        "Lunch",
        "Main Dishes",
        "Quick and Easy",
        "Sheet Pan",
        "Sugar Free January",
        "Sugar-Free",
        "Tacos",
        "Vegan",
        "Vegetarian",
        "Winter"
      ],
      "main_protein": "vegetarian"
    },
    {
      "url": "https://pinchofyum.com/instant-pot-short-rib-ragu",
      "urls": [
        "https://pinchofyum.com/instant-pot-short-rib-ragu"
      ],
      "link_texts": [
        "Instant Pot Short Rib Ragu",
        "Instant Pot Short Rib Ragu"
      ],
      "menu_files": [
        "Menus/Menu week of 1-10-19.md",
        "Menus/Menu week of 1-17-25.md"
      ],
      "menu_weeks": [
        "2019-01-10",
        "2025-01-17"
      ],
      "menu_seasons": [
        "winter"
      ],
      "meal_types": [
        "dinner"
      ],
      "sections": [],
      "source_hints": [],
      "item_texts": [
        "Instant pot short rib ragu",
        "Short rib ragu and fancy pasta in the freezer"
      ],
      "count": 2,
      "ingredients": [
        "2 lbs bone-in short ribs (or 1 lb boneless)",
        "1 tablespoon vegetable oil",
        "1 small onion, finely diced",
        "2 cloves garlic, chopped",
        "1/4 cup dry red wine",
        "one 25-oz jar store bought marinara/spaghetti sauce (I use DeLallo tomato basil sauce)",
        "1/2 cup water",
        "1/2 teaspoon salt",
        "1/4 teaspoon crushed red pepper",
        "salt & pepper, to taste",
        "1 lb. pasta or gnocchi"
      ],
      "recipe_tags": [
        "5 Ingredients",
        "All Recipes",
        "Dairy-Free",
        "Instant Pot",
        "Meat and Chicken",
        "Pasta",
        "Quick and Easy",
        "Spring",
        "Sugar-Free"
      ],
      "main_protein": "vegetarian"
    },
    {
      "url": "https://pinchofyum.com/quick-and-easy-lentil-quesadillas",
      "urls": [
        "https://pinchofyum.com/quick-and-easy-lentil-quesadillas"
      ],
      "link_texts": [
        "Quick and Easy Lentil Quesadillas",
        "Quick And Easy Lentil Quesadillas"
      ],
      "menu_files": [
        "Menus/Menu week of 1-11-20.md",
        "Menus/Week of 11-17-25.md",
        "Menus/Super Bowl menu.md",
        "Menus/Menu week of 12-17-18.md",
        "Menus/Menu week of 2-20-23.md",
        "Menus/Menu week of 2-6-21.md"
      ],
      "menu_weeks": [
        "2020-01-11",
        "2025-11-17",
        "2018-12-17",
        "2023-02-20",
        "2021-02-06"
      ],
      "menu_seasons": [
        "winter",
        "fall"
      ],
      "meal_types": [
        "dinner"
      ],
      "sections": [],
      "source_hints": [
        "https://pinchofyum.com/quick-and-easy-lentil-quesadillas",
        "Thursday"
      ],
      "item_texts": [
        "Crockpot Lentil Quesadillas with magic green sauce",
        "Quick and easy lentil quesadillas",
        "Lentil quesadillas and magic green sauce",
        "Quick and easy lentil quesadillas and magic green sauce",
        "Wednesday: Quick and easy lentil quesadillas and magic green sauce",
        "Quick and easy lentil quesadillas with Magic green sauce (Thursday)",
        "Quick and easy lentil quesadillas (crockpot) and magic green sauce"
      ],
      "count": 6,
      "ingredients": [
        "one 28 ounce can diced tomatoes",
        "half a yellow onion",
        "2 cloves garlic",
        "1 1/2 teaspoons cumin",
        "2 teaspoons chili powder",
        "1 teaspoon salt",
        "1 tablespoon oil",
        "1 cup uncooked brown or green lentils, rinsed",
        "1 cup uncooked brown rice, rinsed",
        "2 1/2 cups vegetable broth",
        "16 flour tortillas",
        "3\u20134 cups shredded Pepperjack cheese",
        "a few tablespoons butter (optional)"
      ],
      "recipe_tags": [
        "All Recipes",
        "Dinner",
        "Kid-Friendly",
        "Legume",
        "Main Dishes",
        "Quick and Easy",
        "Recipes",
        "Slow Cooker",
        "Spring",
        "Tomato",
        "Vegetarian"
      ],
      "main_protein": "vegetarian"
    },
    {
      "url": "https://pinchofyum.com/quinoa-crunch-salad-with-peanut-dressing",
      "urls": [
        "https://pinchofyum.com/quinoa-crunch-salad-with-peanut-dressing"
      ],
      "link_texts": [
        "Quinoa Crunch Salad with Peanut Dressing"
      ],
      "menu_files": [
        "Menus/Menu week of 1-11-20.md",
        "Menus/Menu week of 3-7-20.md"
      ],
      "menu_weeks": [
        "2020-01-11",
        "2020-03-07"
      ],
      "menu_seasons": [
        "winter",
        "spring"
      ],
      "meal_types": [
        "dinner"
      ],
      "sections": [],
      "source_hints": [
        "Vegetarian"
      ],
      "item_texts": [
        "Quinoa Crunch Salad with peanut dressing",
        "Quinoa crunch salad with peanut dressing (Vegetarian)"
      ],
      "count": 2,
      "ingredients": [
        "2\u20133 cups shelled edamame",
        "2 cups Simply Nature Organic Quinoa",
        "1 cucumber, diced",
        "1\u20132 bell peppers, diced",
        "2 ripe mangoes, diced",
        "3 carrots, shredded",
        "half a head of purple cabbage, shredded",
        "sliced almonds, peanuts, cashews, etc. (I used the addicting Southern Grove Chili Lime Cashews from ALDI)",
        "1/2 cup Simply Nature Creamy Peanut Butter",
        "1/3 cup soy sauce",
        "1/3 cup vinegar (white distilled or rice vinegar)",
        "1/4 cup sesame oil",
        "1\u20132 tablespoons chili paste like sambal oelek",
        "2 tablespoons honey",
        "1 clove garlic",
        "1 knob of fresh ginger, peeled"
      ],
      "recipe_tags": [
        "All Recipes",
        "Bell Pepper",
        "Carrot",
        "Dairy-Free",
        "Healthy",
        "Lunch",
        "Quinoa",
        "Recipes",
        "Salads",
        "Sugar Free January",
        "Sugar-Free",
        "Vegetarian",
        "Winter"
      ],
      "main_protein": "vegetarian"
    },
    {
      "url": "https://pinchofyum.com/thai-coconut-soup-with-tofu-and-rice",
      "urls": [
        "https://pinchofyum.com/thai-coconut-soup-with-tofu-and-rice"
      ],
      "link_texts": [
        "Thai Coconut Soup with Tofu and Rice"
      ],
      "menu_files": [
        "Menus/Menu week of 1-9-24.md",
        "Menus/Menu week of 2-20-23.md"
      ],
      "menu_weeks": [
        "2024-01-09",
        "2023-02-20"
      ],
      "menu_seasons": [
        "winter"
      ],
      "meal_types": [
        "dinner"
      ],
      "sections": [],
      "source_hints": [
        "Pinch of Yum"
      ],
      "item_texts": [
        "Thai coconut soup with tofu and rice (Pinch of Yum)",
        "Thai coconut soup with tofu and rice"
      ],
      "count": 2,
      "ingredients": [
        "1 tablespoon oil",
        "5 cloves garlic, minced",
        "one 3-inch piece of ginger, peeled and cut into thin slices",
        "3 stalks lemongrass, ends trimmed, outer layer peeled, and cut into bigger chunks",
        "1\u20132 tablespoons roasted red chili paste",
        "8 ounces fresh mushrooms, sliced",
        "1 red bell pepper, thinly sliced",
        "1 block of extra firm tofu, pressed and cut into small cubes",
        "5\u20136 cups vegetable or chicken broth",
        "about 20 ounces full fat coconut milk (I like Aroy-D brand, and I use about 1.5 cans)",
        "3 tablespoons fish sauce (more or less to taste)",
        "3 tablespoons brown sugar",
        "juice and zest of 1-2 limes (to taste)",
        "salt to taste (about 1 teaspoon)",
        "lots of cilantro",
        "chili oil for serving",
        "rice for serving"
      ],
      "recipe_tags": [
        "All Recipes",
        "Dairy-Free",
        "Dinner",
        "Fall",
        "Gluten-Free",
        "Healthy",
        "Lime",
        "Main Dishes",
        "Rice",
        "Soups",
        "Stovetop",
        "The Soup Series",
        "Tofu",
        "Vegetarian"
      ],
      "main_protein": "seafood"
    },
    {
      "url": "https://www.bonappetit.com/recipe/saucy-soy-butter-beef-and-peppers-recipe",
      "urls": [
        "https://www.bonappetit.com/recipe/saucy-soy-butter-beef-and-peppers-recipe"
      ],
      "link_texts": [
        "Saucy Soy Butter Beef And Peppers Recipe"
      ],
      "menu_files": [
        "Menus/Menu week of 7-25-24.md",
        "Menus/Menu week of 8-18-24.md"
      ],
      "menu_weeks": [
        "2024-07-25",
        "2024-08-18"
      ],
      "menu_seasons": [
        "summer"
      ],
      "meal_types": [
        "dinner"
      ],
      "sections": [],
      "source_hints": [
        "https://www.bonappetit.com/recipe/saucy-soy-butter-beef-and-peppers-recipe"
      ],
      "item_texts": [
        "Saucy soy-butter beef and peppers"
      ],
      "count": 2,
      "ingredients": [
        "1 lb boneless New York strip steak or sirloin, thinly sliced",
        "6 scallions, white and pale green parts and dark green parts separated, sliced",
        "12 oz shishito peppers, stems removed, sliced in half on a diagonal",
        "1 1\" piece ginger, peeled, finely chopped",
        "2 tbsp chilled unsalted butter, cut into pieces",
        "2 tbsp cornstarch",
        "2 tsp low-sodium soy sauce",
        "1/4 cup premium oyster sauce",
        "1 tbsp distilled white vinegar",
        "2 tsp vegetable oil",
        "3 tbsp vegetable oil, divided",
        "2 tbsp sugar",
        "2 tsp freshly cracked black pepper",
        "6 large garlic cloves, thinly sliced",
        "Steamed rice (for serving)",
        "Kosher salt"
      ],
      "recipe_tags": [],
      "main_protein": "beef"
    },
    {
      "url": null,
      "urls": [],
      "link_texts": [],
      "menu_files": [
        "Menus/Menu week of 1-10-19.md"
      ],
      "menu_weeks": [
        "2019-01-10"
      ],
      "menu_seasons": [
        "winter"
      ],
      "meal_types": [
        "dinner"
      ],
      "sections": [],
      "source_hints": [],
      "item_texts": [
        "Instant pot chicken chili verde"
      ],
      "count": 1,
      "main_protein": "unknown"
    },
    {
      "url": null,
      "urls": [],
      "link_texts": [],
      "menu_files": [
        "Menus/Menu week of 1-11-20.md"
      ],
      "menu_weeks": [
        "2020-01-11"
      ],
      "menu_seasons": [
        "winter"
      ],
      "meal_types": [
        "dinner"
      ],
      "sections": [],
      "source_hints": [],
      "item_texts": [
        "Roasted beet, goat cheese, and candied pecan salad with amelia\u2019s bread",
        "Saturday: Roasted beet, goat cheese, and candied pecan salad with amelia\u2019s bread"
      ],
      "count": 1,
      "main_protein": "unknown"
    },
    {
      "url": null,
      "urls": [],
      "link_texts": [],
      "menu_files": [
        "Menus/Menu week of 1-13-18.md"
      ],
      "menu_weeks": [
        "2018-01-13"
      ],
      "menu_seasons": [
        "winter"
      ],
      "meal_types": [
        "dinner"
      ],
      "sections": [],
      "source_hints": [],
      "item_texts": [
        "Fried chicken, cornbread, green beans"
      ],
      "count": 1,
      "main_protein": "unknown"
    },
    {
      "url": null,
      "urls": [],
      "link_texts": [],
      "menu_files": [
        "Menus/Menu week of 1-13-18.md"
      ],
      "menu_weeks": [
        "2018-01-13"
      ],
      "menu_seasons": [
        "winter"
      ],
      "meal_types": [
        "dinner"
      ],
      "sections": [],
      "source_hints": [],
      "item_texts": [
        "Squid ink pasta with shrimp and scallops"
      ],
      "count": 1,
      "main_protein": "unknown"
    },
    {
      "url": null,
      "urls": [],
      "link_texts": [],
      "menu_files": [
        "Menus/Menu week of 1-13-18.md"
      ],
      "menu_weeks": [
        "2018-01-13"
      ],
      "menu_seasons": [
        "winter"
      ],
      "meal_types": [
        "dinner"
      ],
      "sections": [],
      "source_hints": [],
      "item_texts": [
        "Quick dal makhani"
      ],
      "count": 1,
      "main_protein": "unknown"
    },
    {
      "url": null,
      "urls": [],
      "link_texts": [],
      "menu_files": [
        "Menus/Menu week of 1-13-18.md"
      ],
      "menu_weeks": [
        "2018-01-13"
      ],
      "menu_seasons": [
        "winter"
      ],
      "meal_types": [
        "dinner"
      ],
      "sections": [],
      "source_hints": [],
      "item_texts": [
        "Broccoli cauliflower beef stir fry"
      ],
      "count": 1,
      "main_protein": "unknown"
    },
    {
      "url": null,
      "urls": [],
      "link_texts": [],
      "menu_files": [
        "Menus/Menu week of 1-13-18.md"
      ],
      "menu_weeks": [
        "2018-01-13"
      ],
      "menu_seasons": [
        "winter"
      ],
      "meal_types": [
        "dinner"
      ],
      "sections": [],
      "source_hints": [],
      "item_texts": [
        "Skillet-charred fish tacos (cravings p209)"
      ],
      "count": 1,
      "main_protein": "unknown"
    },
    {
      "url": null,
      "urls": [],
      "link_texts": [],
      "menu_files": [
        "Menus/Menu week of 1-13-22.md"
      ],
      "menu_weeks": [
        "2022-01-13"
      ],
      "menu_seasons": [
        "winter"
      ],
      "meal_types": [
        "dinner"
      ],
      "sections": [],
      "source_hints": [],
      "item_texts": [
        "The best Detox crockpot lentil soup (Pinch of Yum) and bread"
      ],
      "count": 1,
      "main_protein": "unknown"
    },
    {
      "url": null,
      "urls": [],
      "link_texts": [],
      "menu_files": [
        "Menus/Menu week of 1-16-22.md"
      ],
      "menu_weeks": [
        "2022-01-16"
      ],
      "menu_seasons": [
        "winter"
      ],
      "meal_types": [
        "dinner"
      ],
      "sections": [],
      "source_hints": [],
      "item_texts": [
        "Smokey beans and greens tacos with aj\u00ed verde"
      ],
      "count": 1,
      "main_protein": "unknown"
    },
    {
      "url": null,
      "urls": [],
      "link_texts": [],
      "menu_files": [
        "Menus/Menu week of 1-16-26.md"
      ],
      "menu_weeks": [
        "2026-01-16"
      ],
      "menu_seasons": [
        "winter"
      ],
      "meal_types": [
        "dinner"
      ],
      "sections": [],
      "source_hints": [],
      "item_texts": [
        "Perogies with bacon, sour cream, cheese, chives, and salad"
      ],
      "count": 1,
      "main_protein": "unknown"
    },
    {
      "url": null,
      "urls": [],
      "link_texts": [],
      "menu_files": [
        "Menus/Menu week of 1-16-26.md"
      ],
      "menu_weeks": [
        "2026-01-16"
      ],
      "menu_seasons": [
        "winter"
      ],
      "meal_types": [
        "dinner"
      ],
      "sections": [],
      "source_hints": [],
      "item_texts": [
        "Orange chicken (freezer) and broccoli"
      ],
      "count": 1,
      "main_protein": "unknown"
    },
    {
      "url": null,
      "urls": [],
      "link_texts": [],
      "menu_files": [
        "Menus/Menu week of 1-2-18.md"
      ],
      "menu_weeks": [
        "2018-01-02"
      ],
      "menu_seasons": [
        "winter"
      ],
      "meal_types": [
        "dinner"
      ],
      "sections": [],
      "source_hints": [],
      "item_texts": [
        "Golden soup and spinach salad"
      ],
      "count": 1,
      "main_protein": "unknown"
    },
    {
      "url": null,
      "urls": [],
      "link_texts": [],
      "menu_files": [
        "Menus/Menu week of 1-2-18.md"
      ],
      "menu_weeks": [
        "2018-01-02"
      ],
      "menu_seasons": [
        "winter"
      ],
      "meal_types": [
        "dinner"
      ],
      "sections": [],
      "source_hints": [],
      "item_texts": [
        "Cabbage, sausage, and potato soup"
      ],
      "count": 1,
      "main_protein": "unknown"
    },
    {
      "url": null,
      "urls": [],
      "link_texts": [],
      "menu_files": [
        "Menus/Menu week of 1-21-19.md"
      ],
      "menu_weeks": [
        "2019-01-21"
      ],
      "menu_seasons": [
        "winter"
      ],
      "meal_types": [
        "dinner"
      ],
      "sections": [],
      "source_hints": [],
      "item_texts": [
        "Cauliflower and tomato coconut curry"
      ],
      "count": 1,
      "main_protein": "unknown"
    },
    {
      "url": null,
      "urls": [],
      "link_texts": [],
      "menu_files": [
        "Menus/Menu week of 1-23-23.md"
      ],
      "menu_weeks": [
        "2023-01-23"
      ],
      "menu_seasons": [
        "winter"
      ],
      "meal_types": [
        "dinner"
      ],
      "sections": [],
      "source_hints": [],
      "item_texts": [
        "SAUSAGE, KALE, AND WHITE BEAN SOUP"
      ],
      "count": 1,
      "main_protein": "unknown"
    },
    {
      "url": null,
      "urls": [],
      "link_texts": [],
      "menu_files": [
        "Menus/Menu week of 1-23-23.md"
      ],
      "menu_weeks": [
        "2023-01-23"
      ],
      "menu_seasons": [
        "winter"
      ],
      "meal_types": [
        "dinner"
      ],
      "sections": [],
      "source_hints": [],
      "item_texts": [
        "WALNUT CHORIZO TACOS"
      ],
      "count": 1,
      "main_protein": "unknown"
    },
    {
      "url": null,
      "urls": [],
      "link_texts": [],
      "menu_files": [
        "Menus/Menu week of 1-23-23.md"
      ],
      "menu_weeks": [
        "2023-01-23"
      ],
      "menu_seasons": [
        "winter"
      ],
      "meal_types": [
        "dinner"
      ],
      "sections": [],
      "source_hints": [],
      "item_texts": [
        "AVOCADO KALE CAESAR SALAD"
      ],
      "count": 1,
      "main_protein": "unknown"
    },
    {
      "url": null,
      "urls": [],
      "link_texts": [],
      "menu_files": [
        "Menus/Menu week of 1-24-20.md"
      ],
      "menu_weeks": [
        "2020-01-24"
      ],
      "menu_seasons": [
        "winter"
      ],
      "meal_types": [
        "dinner"
      ],
      "sections": [],
      "source_hints": [],
      "item_texts": [
        "Spaghetti squash burrito boats"
      ],
      "count": 1,
      "main_protein": "unknown"
    },
    {
      "url": null,
      "urls": [],
      "link_texts": [],
      "menu_files": [
        "Menus/Menu week of 1-24-21.md"
      ],
      "menu_weeks": [
        "2021-01-24"
      ],
      "menu_seasons": [
        "winter"
      ],
      "meal_types": [
        "dinner"
      ],
      "sections": [],
      "source_hints": [],
      "item_texts": [
        "Slow cooker Olive Garden pasta e fagioli soup"
      ],
      "count": 1,
      "main_protein": "unknown"
    },
    {
      "url": null,
      "urls": [],
      "link_texts": [],
      "menu_files": [
        "Menus/Menu week of 1-24-21.md"
      ],
      "menu_weeks": [
        "2021-01-24"
      ],
      "menu_seasons": [
        "winter"
      ],
      "meal_types": [
        "dinner"
      ],
      "sections": [],
      "source_hints": [
        "can freeze ahead"
      ],
      "item_texts": [
        "Instant pot beef stew (can freeze ahead)"
      ],
      "count": 1,
      "main_protein": "unknown"
    },
    {
      "url": null,
      "urls": [],
      "link_texts": [],
      "menu_files": [
        "Menus/Menu week of 1-24-21.md"
      ],
      "menu_weeks": [
        "2021-01-24"
      ],
      "menu_seasons": [
        "winter"
      ],
      "meal_types": [
        "dinner"
      ],
      "sections": [],
      "source_hints": [],
      "item_texts": [
        "Peach smoothie or green smoothie"
      ],
      "count": 1,
      "main_protein": "unknown"
    },
    {
      "url": null,
      "urls": [],
      "link_texts": [],
      "menu_files": [
        "Menus/Menu week of 1-28-18.md"
      ],
      "menu_weeks": [
        "2018-01-28"
      ],
      "menu_seasons": [
        "winter"
      ],
      "meal_types": [
        "dinner"
      ],
      "sections": [],
      "source_hints": [],
      "item_texts": [
        "Curry chicken salad"
      ],
      "count": 1,
      "main_protein": "unknown"
    },
    {
      "url": null,
      "urls": [],
      "link_texts": [],
      "menu_files": [
        "Menus/Menu week of 1-31-22.md"
      ],
      "menu_weeks": [
        "2022-01-31"
      ],
      "menu_seasons": [
        "winter"
      ],
      "meal_types": [
        "dinner"
      ],
      "sections": [],
      "source_hints": [],
      "item_texts": [
        "Chicken stir fry"
      ],
      "count": 1,
      "main_protein": "unknown"
    },
    {
      "url": null,
      "urls": [],
      "link_texts": [],
      "menu_files": [
        "Menus/Menu week of 1-31-22.md"
      ],
      "menu_weeks": [
        "2022-01-31"
      ],
      "menu_seasons": [
        "winter"
      ],
      "meal_types": [
        "dinner"
      ],
      "sections": [],
      "source_hints": [],
      "item_texts": [
        "Beyond Beef mushroom rice bowls"
      ],
      "count": 1,
      "main_protein": "unknown"
    },
    {
      "url": null,
      "urls": [],
      "link_texts": [],
      "menu_files": [
        "Menus/Menu week of 1-31-22.md"
      ],
      "menu_weeks": [
        "2022-01-31"
      ],
      "menu_seasons": [
        "winter"
      ],
      "meal_types": [
        "dinner"
      ],
      "sections": [],
      "source_hints": [],
      "item_texts": [
        "Panko chicken"
      ],
      "count": 1,
      "main_protein": "unknown"
    },
    {
      "url": null,
      "urls": [],
      "link_texts": [],
      "menu_files": [
        "Menus/Menu week of 1-31-22.md"
      ],
      "menu_weeks": [
        "2022-01-31"
      ],
      "menu_seasons": [
        "winter"
      ],
      "meal_types": [
        "dinner"
      ],
      "sections": [],
      "source_hints": [],
      "item_texts": [
        "Pita sandwiches"
      ],
      "count": 1,
      "main_protein": "unknown"
    },
    {
      "url": null,
      "urls": [],
      "link_texts": [],
      "menu_files": [
        "Menus/Menu week of 1-31-22.md"
      ],
      "menu_weeks": [
        "2022-01-31"
      ],
      "menu_seasons": [
        "winter"
      ],
      "meal_types": [
        "dinner"
      ],
      "sections": [],
      "source_hints": [],
      "item_texts": [
        "Garlic caper chicken"
      ],
      "count": 1,
      "main_protein": "unknown"
    },
    {
      "url": null,
      "urls": [],
      "link_texts": [],
      "menu_files": [
        "Menus/Menu week of 1-31-22.md"
      ],
      "menu_weeks": [
        "2022-01-31"
      ],
      "menu_seasons": [
        "winter"
      ],
      "meal_types": [
        "dinner"
      ],
      "sections": [],
      "source_hints": [],
      "item_texts": [
        "Instant pot wild rice soup"
      ],
      "count": 1,
      "main_protein": "unknown"
    },
    {
      "url": null,
      "urls": [],
      "link_texts": [],
      "menu_files": [
        "Menus/Menu week of 1-31-22.md"
      ],
      "menu_weeks": [
        "2022-01-31"
      ],
      "menu_seasons": [
        "winter"
      ],
      "meal_types": [
        "dinner"
      ],
      "sections": [],
      "source_hints": [],
      "item_texts": [
        "Orange salmon and fried rice"
      ],
      "count": 1,
      "main_protein": "unknown"
    },
    {
      "url": null,
      "urls": [],
      "link_texts": [],
      "menu_files": [
        "Menus/Menu week of 1-31-22.md"
      ],
      "menu_weeks": [
        "2022-01-31"
      ],
      "menu_seasons": [
        "winter"
      ],
      "meal_types": [
        "dinner"
      ],
      "sections": [],
      "source_hints": [],
      "item_texts": [
        "Spicy shrimp tacos with garlic cilantro lime slaw"
      ],
      "count": 1,
      "main_protein": "unknown"
    },
    {
      "url": null,
      "urls": [],
      "link_texts": [],
      "menu_files": [
        "Menus/Menu week of 10-1-23.md"
      ],
      "menu_weeks": [
        "2023-10-01"
      ],
      "menu_seasons": [
        "fall"
      ],
      "meal_types": [
        "dinner"
      ],
      "sections": [],
      "source_hints": [],
      "item_texts": [
        "Roasted honey nut squash and chickpeas with hot honey (NYT cooking) - make with cous cous"
      ],
      "count": 1,
      "main_protein": "unknown"
    },
    {
      "url": null,
      "urls": [],
      "link_texts": [],
      "menu_files": [
        "Menus/Menu week of 10-10-21.md"
      ],
      "menu_weeks": [
        "2021-10-10"
      ],
      "menu_seasons": [
        "fall"
      ],
      "meal_types": [
        "dinner"
      ],
      "sections": [],
      "source_hints": [
        "with $$ dear mom greens"
      ],
      "item_texts": [
        "Italian beef and salad (with $$ dear mom greens)"
      ],
      "count": 1,
      "main_protein": "unknown"
    },
    {
      "url": null,
      "urls": [],
      "link_texts": [],
      "menu_files": [
        "Menus/Menu week of 10-10-21.md"
      ],
      "menu_weeks": [
        "2021-10-10"
      ],
      "menu_seasons": [
        "fall"
      ],
      "meal_types": [
        "dinner"
      ],
      "sections": [],
      "source_hints": [],
      "item_texts": [
        "Sheet pan sausage and peppers (serve as sandwiches with provolone and pasta sauce) - Get baguette from Amelia\u2019s"
      ],
      "count": 1,
      "main_protein": "unknown"
    },
    {
      "url": null,
      "urls": [],
      "link_texts": [],
      "menu_files": [
        "Menus/Menu week of 10-13-22.md"
      ],
      "menu_weeks": [
        "2022-10-13"
      ],
      "menu_seasons": [
        "fall"
      ],
      "meal_types": [
        "dinner"
      ],
      "sections": [],
      "source_hints": [],
      "item_texts": [
        "Roasted veggie pitas with avocado dip"
      ],
      "count": 1,
      "main_protein": "unknown"
    },
    {
      "url": null,
      "urls": [],
      "link_texts": [],
      "menu_files": [
        "Menus/Menu week of 10-13-22.md"
      ],
      "menu_weeks": [
        "2022-10-13"
      ],
      "menu_seasons": [
        "fall"
      ],
      "meal_types": [
        "dinner"
      ],
      "sections": [],
      "source_hints": [],
      "item_texts": [
        "Crunchwrap Supreme"
      ],
      "count": 1,
      "main_protein": "unknown"
    },
    {
      "url": null,
      "urls": [],
      "link_texts": [],
      "menu_files": [
        "Menus/Menu week of 10-13-22.md"
      ],
      "menu_weeks": [
        "2022-10-13"
      ],
      "menu_seasons": [
        "fall"
      ],
      "meal_types": [
        "dinner"
      ],
      "sections": [],
      "source_hints": [],
      "item_texts": [
        "Crockpot chicken gnocchi soup"
      ],
      "count": 1,
      "main_protein": "unknown"
    },
    {
      "url": null,
      "urls": [],
      "link_texts": [],
      "menu_files": [
        "Menus/Menu week of 10-15-17.md"
      ],
      "menu_weeks": [
        "2017-10-15"
      ],
      "menu_seasons": [
        "fall"
      ],
      "meal_types": [
        "dinner"
      ],
      "sections": [],
      "source_hints": [],
      "item_texts": [
        "Sunday morning: eggs and chard, bacon, potatoes?"
      ],
      "count": 1,
      "main_protein": "unknown"
    },
    {
      "url": null,
      "urls": [],
      "link_texts": [],
      "menu_files": [
        "Menus/Menu week of 10-15-17.md"
      ],
      "menu_weeks": [
        "2017-10-15"
      ],
      "menu_seasons": [
        "fall"
      ],
      "meal_types": [
        "dinner"
      ],
      "sections": [],
      "source_hints": [],
      "item_texts": [
        "Orzo with feta, tomatoes, and dill"
      ],
      "count": 1,
      "main_protein": "unknown"
    },
    {
      "url": null,
      "urls": [],
      "link_texts": [],
      "menu_files": [
        "Menus/Menu week of 10-18-20.md"
      ],
      "menu_weeks": [
        "2020-10-18"
      ],
      "menu_seasons": [
        "fall"
      ],
      "meal_types": [
        "dinner"
      ],
      "sections": [],
      "source_hints": [],
      "item_texts": [
        "Cider braised pot roast with caramelized onions and cauliflower rice (takes 3-4 hours in oven)"
      ],
      "count": 1,
      "main_protein": "unknown"
    },
    {
      "url": null,
      "urls": [],
      "link_texts": [],
      "menu_files": [
        "Menus/Menu week of 10-18-20.md"
      ],
      "menu_weeks": [
        "2020-10-18"
      ],
      "menu_seasons": [
        "fall"
      ],
      "meal_types": [
        "dinner"
      ],
      "sections": [],
      "source_hints": [],
      "item_texts": [
        "Brown butter gnocchi with roasted butternut squash and kale",
        "Sunday: Brown butter gnocchi with roasted butternut squash and kale"
      ],
      "count": 1,
      "main_protein": "unknown"
    },
    {
      "url": null,
      "urls": [],
      "link_texts": [],
      "menu_files": [
        "Menus/Menu week of 10-18-20.md"
      ],
      "menu_weeks": [
        "2020-10-18"
      ],
      "menu_seasons": [
        "fall"
      ],
      "meal_types": [
        "dinner"
      ],
      "sections": [],
      "source_hints": [],
      "item_texts": [
        "Quesadillas and pico"
      ],
      "count": 1,
      "main_protein": "unknown"
    },
    {
      "url": null,
      "urls": [],
      "link_texts": [],
      "menu_files": [
        "Menus/Menu week of 10-18-20.md"
      ],
      "menu_weeks": [
        "2020-10-18"
      ],
      "menu_seasons": [
        "fall"
      ],
      "meal_types": [
        "dinner"
      ],
      "sections": [],
      "source_hints": [],
      "item_texts": [
        "Roast and/or chop one of the butternut squash"
      ],
      "count": 1,
      "main_protein": "unknown"
    },
    {
      "url": null,
      "urls": [],
      "link_texts": [],
      "menu_files": [
        "Menus/Menu week of 10-18-20.md"
      ],
      "menu_weeks": [
        "2020-10-18"
      ],
      "menu_seasons": [
        "fall"
      ],
      "meal_types": [
        "dinner"
      ],
      "sections": [],
      "source_hints": [],
      "item_texts": [
        "Quick-pickle banana peppers"
      ],
      "count": 1,
      "main_protein": "unknown"
    },
    {
      "url": null,
      "urls": [],
      "link_texts": [],
      "menu_files": [
        "Menus/Menu week of 10-21-19.md"
      ],
      "menu_weeks": [
        "2019-10-21"
      ],
      "menu_seasons": [
        "fall"
      ],
      "meal_types": [
        "dinner"
      ],
      "sections": [],
      "source_hints": [],
      "item_texts": [
        "Maple roasted chicken thighs and winter squashSalmon cakes and slaw"
      ],
      "count": 1,
      "main_protein": "unknown"
    },
    {
      "url": null,
      "urls": [],
      "link_texts": [],
      "menu_files": [
        "Menus/Menu week of 10-21-19.md"
      ],
      "menu_weeks": [
        "2019-10-21"
      ],
      "menu_seasons": [
        "fall"
      ],
      "meal_types": [
        "dinner"
      ],
      "sections": [],
      "source_hints": [],
      "item_texts": [
        "Rosemary Chicken noodle soup, salad"
      ],
      "count": 1,
      "main_protein": "unknown"
    },
    {
      "url": null,
      "urls": [],
      "link_texts": [],
      "menu_files": [
        "Menus/Menu week of 10-22-25.md"
      ],
      "menu_weeks": [
        "2025-10-22"
      ],
      "menu_seasons": [
        "fall"
      ],
      "meal_types": [
        "dinner"
      ],
      "sections": [],
      "source_hints": [],
      "item_texts": [
        "Double recipes to bring to Jill Tuesday 10/28:"
      ],
      "count": 1,
      "main_protein": "unknown"
    },
    {
      "url": null,
      "urls": [],
      "link_texts": [],
      "menu_files": [
        "Menus/Menu week of 10-25-18.md"
      ],
      "menu_weeks": [
        "2018-10-25"
      ],
      "menu_seasons": [
        "fall"
      ],
      "meal_types": [
        "dinner"
      ],
      "sections": [],
      "source_hints": [],
      "item_texts": [
        "Wed spooky season: chili, cornbread muffins"
      ],
      "count": 1,
      "main_protein": "unknown"
    },
    {
      "url": null,
      "urls": [],
      "link_texts": [],
      "menu_files": [
        "Menus/Menu week of 10-25-18.md"
      ],
      "menu_weeks": [
        "2018-10-25"
      ],
      "menu_seasons": [
        "fall"
      ],
      "meal_types": [
        "dinner"
      ],
      "sections": [],
      "source_hints": [],
      "item_texts": [
        "pan-seared chicken with roasted honey nut squash and apple",
        "Thursday: pan-seared chicken with roasted honey nut squash and apple"
      ],
      "count": 1,
      "main_protein": "unknown"
    },
    {
      "url": null,
      "urls": [],
      "link_texts": [],
      "menu_files": [
        "Menus/Menu week of 10-25-18.md"
      ],
      "menu_weeks": [
        "2018-10-25"
      ],
      "menu_seasons": [
        "fall"
      ],
      "meal_types": [
        "dinner"
      ],
      "sections": [],
      "source_hints": [],
      "item_texts": [
        "Friday weenie roast: garlic Spaghetti squash with herbs"
      ],
      "count": 1,
      "main_protein": "unknown"
    },
    {
      "url": null,
      "urls": [],
      "link_texts": [],
      "menu_files": [
        "Menus/Menu week of 10-26-23.md"
      ],
      "menu_weeks": [
        "2023-10-26"
      ],
      "menu_seasons": [
        "fall"
      ],
      "meal_types": [
        "dinner"
      ],
      "sections": [],
      "source_hints": [],
      "item_texts": [
        "Chicken lettuce wraps with Lime drench"
      ],
      "count": 1,
      "main_protein": "unknown"
    },
    {
      "url": null,
      "urls": [],
      "link_texts": [],
      "menu_files": [
        "Menus/Menu week of 10-26-23.md"
      ],
      "menu_weeks": [
        "2023-10-26"
      ],
      "menu_seasons": [
        "fall"
      ],
      "meal_types": [
        "dinner"
      ],
      "sections": [],
      "source_hints": [],
      "item_texts": [
        "Lemongrass meatball bowls"
      ],
      "count": 1,
      "main_protein": "unknown"
    },
    {
      "url": null,
      "urls": [],
      "link_texts": [],
      "menu_files": [
        "Menus/Menu week of 10-27-22.md"
      ],
      "menu_weeks": [
        "2022-10-27"
      ],
      "menu_seasons": [
        "fall"
      ],
      "meal_types": [
        "dinner"
      ],
      "sections": [],
      "source_hints": [],
      "item_texts": [
        "Baked shrimp with feta and grilled sourdough"
      ],
      "count": 1,
      "main_protein": "unknown"
    },
    {
      "url": null,
      "urls": [],
      "link_texts": [],
      "menu_files": [
        "Menus/Menu week of 10-31-17.md"
      ],
      "menu_weeks": [
        "2017-10-31"
      ],
      "menu_seasons": [
        "fall"
      ],
      "meal_types": [
        "dinner"
      ],
      "sections": [],
      "source_hints": [],
      "item_texts": [
        "Turnips with Bacon and Orange (Dooley pg 209), pork chops with apples and onions",
        "Saturday: Turnips with Bacon and Orange (Dooley pg 209), pork chops with apples and onions"
      ],
      "count": 1,
      "main_protein": "unknown"
    },
    {
      "url": null,
      "urls": [],
      "link_texts": [],
      "menu_files": [
        "Menus/Menu week of 10-31-17.md"
      ],
      "menu_weeks": [
        "2017-10-31"
      ],
      "menu_seasons": [
        "fall"
      ],
      "meal_types": [
        "dinner"
      ],
      "sections": [],
      "source_hints": [],
      "item_texts": [
        "balsamic roasted fingerling potatoes and Brussels sprouts, baked tilapia with pecan rosemary topping",
        "Tuesday: balsamic roasted fingerling potatoes and Brussels sprouts, baked tilapia with pecan rosemary topping"
      ],
      "count": 1,
      "main_protein": "unknown"
    },
    {
      "url": null,
      "urls": [],
      "link_texts": [],
      "menu_files": [
        "Menus/Menu week of 10-4-20.md"
      ],
      "menu_weeks": [
        "2020-10-04"
      ],
      "menu_seasons": [
        "fall"
      ],
      "meal_types": [
        "dinner"
      ],
      "sections": [],
      "source_hints": [],
      "item_texts": [
        "Sheet pan salmon with bok choy"
      ],
      "count": 1,
      "main_protein": "unknown"
    },
    {
      "url": null,
      "urls": [],
      "link_texts": [],
      "menu_files": [
        "Menus/Menu week of 10-4-20.md"
      ],
      "menu_weeks": [
        "2020-10-04"
      ],
      "menu_seasons": [
        "fall"
      ],
      "meal_types": [
        "dinner"
      ],
      "sections": [],
      "source_hints": [],
      "item_texts": [
        "Weekend: Pumpkin cinnamon rolls"
      ],
      "count": 1,
      "main_protein": "unknown"
    },
    {
      "url": null,
      "urls": [],
      "link_texts": [],
      "menu_files": [
        "Menus/Menu week of 10-4-2019.md"
      ],
      "menu_weeks": [
        "2019-10-04"
      ],
      "menu_seasons": [
        "fall"
      ],
      "meal_types": [
        "dinner"
      ],
      "sections": [],
      "source_hints": [
        "use spinach instead of kale"
      ],
      "item_texts": [
        "Sweet potato salad (use spinach instead of kale)"
      ],
      "count": 1,
      "main_protein": "unknown"
    },
    {
      "url": null,
      "urls": [],
      "link_texts": [],
      "menu_files": [
        "Menus/Menu week of 10-6-18.md"
      ],
      "menu_weeks": [
        "2018-10-06"
      ],
      "menu_seasons": [
        "fall"
      ],
      "meal_types": [
        "dinner"
      ],
      "sections": [],
      "source_hints": [],
      "item_texts": [
        "Potato soup and dinner rolls"
      ],
      "count": 1,
      "main_protein": "unknown"
    },
    {
      "url": null,
      "urls": [],
      "link_texts": [],
      "menu_files": [
        "Menus/Menu week of 10-6-18.md"
      ],
      "menu_weeks": [
        "2018-10-06"
      ],
      "menu_seasons": [
        "fall"
      ],
      "meal_types": [
        "dinner"
      ],
      "sections": [],
      "source_hints": [],
      "item_texts": [
        "Morracan stew packet"
      ],
      "count": 1,
      "main_protein": "unknown"
    },
    {
      "url": null,
      "urls": [],
      "link_texts": [],
      "menu_files": [
        "Menus/Menu week of 10-6-22.md"
      ],
      "menu_weeks": [
        "2022-10-06"
      ],
      "menu_seasons": [
        "fall"
      ],
      "meal_types": [
        "dinner"
      ],
      "sections": [],
      "source_hints": [],
      "item_texts": [
        "Chipotle Orange Shrimp with Cilantro rice"
      ],
      "count": 1,
      "main_protein": "unknown"
    },
    {
      "url": null,
      "urls": [],
      "link_texts": [],
      "menu_files": [
        "Menus/Menu week of 10-6-22.md"
      ],
      "menu_weeks": [
        "2022-10-06"
      ],
      "menu_seasons": [
        "fall"
      ],
      "meal_types": [
        "dinner"
      ],
      "sections": [],
      "source_hints": [],
      "item_texts": [
        "Instant Pot Pasta with meatballs"
      ],
      "count": 1,
      "main_protein": "unknown"
    },
    {
      "url": null,
      "urls": [],
      "link_texts": [],
      "menu_files": [
        "Menus/Menu week of 10-7-17.md"
      ],
      "menu_weeks": [
        "2017-10-07"
      ],
      "menu_seasons": [
        "fall"
      ],
      "meal_types": [
        "dinner"
      ],
      "sections": [],
      "source_hints": [],
      "item_texts": [
        "Chicken fajitas and roasted tomatillo salsa, black beans, radishes"
      ],
      "count": 1,
      "main_protein": "unknown"
    },
    {
      "url": null,
      "urls": [],
      "link_texts": [],
      "menu_files": [
        "Menus/Menu week of 10-7-17.md"
      ],
      "menu_weeks": [
        "2017-10-07"
      ],
      "menu_seasons": [
        "fall"
      ],
      "meal_types": [
        "dinner"
      ],
      "sections": [],
      "source_hints": [],
      "item_texts": [
        "Lemon braised chicken and beans with mint pesto and arugula salad"
      ],
      "count": 1,
      "main_protein": "unknown"
    },
    {
      "url": null,
      "urls": [],
      "link_texts": [],
      "menu_files": [
        "Menus/Menu week of 11-1-20.md"
      ],
      "menu_weeks": [
        "2020-11-01"
      ],
      "menu_seasons": [
        "fall"
      ],
      "meal_types": [
        "dinner"
      ],
      "sections": [],
      "source_hints": [
        "Use Pinch of Yum back pocket stir fry sauce recipe"
      ],
      "item_texts": [
        "Stir fry with tofu, bell peppers, onions radishes, a little cauliflower (Use Pinch of Yum back pocket stir fry sauce recipe)"
      ],
      "count": 1,
      "main_protein": "unknown"
    },
    {
      "url": null,
      "urls": [],
      "link_texts": [],
      "menu_files": [
        "Menus/Menu week of 11-10-17.md"
      ],
      "menu_weeks": [
        "2017-11-10"
      ],
      "menu_seasons": [
        "fall"
      ],
      "meal_types": [
        "dinner"
      ],
      "sections": [],
      "source_hints": [],
      "item_texts": [
        "Pan burgers, roasted parsnips"
      ],
      "count": 1,
      "main_protein": "unknown"
    },
    {
      "url": null,
      "urls": [],
      "link_texts": [],
      "menu_files": [
        "Menus/Menu week of 11-10-17.md"
      ],
      "menu_weeks": [
        "2017-11-10"
      ],
      "menu_seasons": [
        "fall"
      ],
      "meal_types": [
        "dinner"
      ],
      "sections": [],
      "source_hints": [],
      "item_texts": [
        "Senegalese soup"
      ],
      "count": 1,
      "main_protein": "unknown"
    },
    {
      "url": null,
      "urls": [],
      "link_texts": [],
      "menu_files": [
        "Menus/Menu week of 11-10-17.md"
      ],
      "menu_weeks": [
        "2017-11-10"
      ],
      "menu_seasons": [
        "fall"
      ],
      "meal_types": [
        "dinner"
      ],
      "sections": [],
      "source_hints": [
        "make with veggie broth"
      ],
      "item_texts": [
        "Stuffing (make with veggie broth)"
      ],
      "count": 1,
      "main_protein": "unknown"
    },
    {
      "url": null,
      "urls": [],
      "link_texts": [],
      "menu_files": [
        "Menus/Menu week of 11-10-17.md"
      ],
      "menu_weeks": [
        "2017-11-10"
      ],
      "menu_seasons": [
        "fall"
      ],
      "meal_types": [
        "dinner"
      ],
      "sections": [],
      "source_hints": [],
      "item_texts": [
        "Crackers, goat cheese, Katy\u2019s port wine cranberry sauce"
      ],
      "count": 1,
      "main_protein": "unknown"
    },
    {
      "url": null,
      "urls": [],
      "link_texts": [],
      "menu_files": [
        "Menus/Menu week of 11-12-22.md"
      ],
      "menu_weeks": [
        "2022-11-12"
      ],
      "menu_seasons": [
        "fall"
      ],
      "meal_types": [
        "dinner"
      ],
      "sections": [],
      "source_hints": [],
      "item_texts": [
        "Lemon pepper noodles with zucchini and squash and some butter sauce we make up. Maybe chicken if we have our shit together."
      ],
      "count": 1,
      "main_protein": "unknown"
    },
    {
      "url": null,
      "urls": [],
      "link_texts": [],
      "menu_files": [
        "Menus/Menu week of 11-12-22.md"
      ],
      "menu_weeks": [
        "2022-11-12"
      ],
      "menu_seasons": [
        "fall"
      ],
      "meal_types": [
        "dinner"
      ],
      "sections": [],
      "source_hints": [
        "Pinch of yum"
      ],
      "item_texts": [
        "Instant Pot Pot Roast (Pinch of yum)"
      ],
      "count": 1,
      "main_protein": "unknown"
    },
    {
      "url": null,
      "urls": [],
      "link_texts": [],
      "menu_files": [
        "Menus/Menu week of 11-16-20.md"
      ],
      "menu_weeks": [
        "2020-11-16"
      ],
      "menu_seasons": [
        "fall"
      ],
      "meal_types": [
        "snack"
      ],
      "sections": [],
      "source_hints": [],
      "item_texts": [
        "Snack: Hummus and radishes, yacon"
      ],
      "count": 1,
      "main_protein": "unknown"
    },
    {
      "url": null,
      "urls": [],
      "link_texts": [],
      "menu_files": [
        "Menus/Menu week of 11-16-20.md"
      ],
      "menu_weeks": [
        "2020-11-16"
      ],
      "menu_seasons": [
        "fall"
      ],
      "meal_types": [
        "dinner"
      ],
      "sections": [],
      "source_hints": [
        "add pan-fried daikon"
      ],
      "item_texts": [
        "Kale fried rice (add pan-fried daikon)"
      ],
      "count": 1,
      "main_protein": "unknown"
    },
    {
      "url": null,
      "urls": [],
      "link_texts": [],
      "menu_files": [
        "Menus/Menu week of 11-16-20.md"
      ],
      "menu_weeks": [
        "2020-11-16"
      ],
      "menu_seasons": [
        "fall"
      ],
      "meal_types": [
        "dinner"
      ],
      "sections": [],
      "source_hints": [],
      "item_texts": [
        "Side 2: Roasted purple top turnips"
      ],
      "count": 1,
      "main_protein": "unknown"
    },
    {
      "url": null,
      "urls": [],
      "link_texts": [],
      "menu_files": [
        "Menus/Menu week of 11-16-20.md"
      ],
      "menu_weeks": [
        "2020-11-16"
      ],
      "menu_seasons": [
        "fall"
      ],
      "meal_types": [
        "dinner"
      ],
      "sections": [],
      "source_hints": [],
      "item_texts": [
        "Side 1: Napa cabbage salad with mandarins and yacon"
      ],
      "count": 1,
      "main_protein": "unknown"
    },
    {
      "url": null,
      "urls": [],
      "link_texts": [],
      "menu_files": [
        "Menus/Menu week of 11-18-19.md"
      ],
      "menu_weeks": [
        "2019-11-18"
      ],
      "menu_seasons": [
        "fall"
      ],
      "meal_types": [
        "dinner"
      ],
      "sections": [],
      "source_hints": [],
      "item_texts": [
        "Moroccan chickpeas (from frozen - instant pot) and cous cous, cucumber"
      ],
      "count": 1,
      "main_protein": "unknown"
    },
    {
      "url": null,
      "urls": [],
      "link_texts": [],
      "menu_files": [
        "Menus/Menu week of 11-18-19.md"
      ],
      "menu_weeks": [
        "2019-11-18"
      ],
      "menu_seasons": [
        "fall"
      ],
      "meal_types": [
        "dinner"
      ],
      "sections": [],
      "source_hints": [],
      "item_texts": [
        "Potato soup and salad"
      ],
      "count": 1,
      "main_protein": "unknown"
    },
    {
      "url": null,
      "urls": [],
      "link_texts": [],
      "menu_files": [
        "Menus/Menu week of 11-18-19.md"
      ],
      "menu_weeks": [
        "2019-11-18"
      ],
      "menu_seasons": [
        "fall"
      ],
      "meal_types": [
        "dinner"
      ],
      "sections": [],
      "source_hints": [
        "pear and goat cheese"
      ],
      "item_texts": [
        "Salad (pear and goat cheese)"
      ],
      "count": 1,
      "main_protein": "unknown"
    },
    {
      "url": null,
      "urls": [],
      "link_texts": [],
      "menu_files": [
        "Menus/Menu week of 11-19-22.md"
      ],
      "menu_weeks": [
        "2022-11-19"
      ],
      "menu_seasons": [
        "fall"
      ],
      "meal_types": [
        "dinner"
      ],
      "sections": [],
      "source_hints": [],
      "item_texts": [
        "Millionaire Gnocchi with Red Sauce"
      ],
      "count": 1,
      "main_protein": "unknown"
    },
    {
      "url": null,
      "urls": [],
      "link_texts": [],
      "menu_files": [
        "Menus/Menu week of 11-19-22.md"
      ],
      "menu_weeks": [
        "2022-11-19"
      ],
      "menu_seasons": [
        "fall"
      ],
      "meal_types": [
        "dinner"
      ],
      "sections": [],
      "source_hints": [],
      "item_texts": [
        "Creamy Kale pasta"
      ],
      "count": 1,
      "main_protein": "unknown"
    },
    {
      "url": null,
      "urls": [],
      "link_texts": [],
      "menu_files": [
        "Menus/Menu week of 11-19-22.md"
      ],
      "menu_weeks": [
        "2022-11-19"
      ],
      "menu_seasons": [
        "fall"
      ],
      "meal_types": [
        "dinner"
      ],
      "sections": [],
      "source_hints": [],
      "item_texts": [
        "Instant Pot Tandoori-Inspired Chicken"
      ],
      "count": 1,
      "main_protein": "unknown"
    },
    {
      "url": null,
      "urls": [],
      "link_texts": [],
      "menu_files": [
        "Menus/Menu week of 11-19-22.md"
      ],
      "menu_weeks": [
        "2022-11-19"
      ],
      "menu_seasons": [
        "fall"
      ],
      "meal_types": [
        "dinner"
      ],
      "sections": [],
      "source_hints": [],
      "item_texts": [
        "Pumpkin pie"
      ],
      "count": 1,
      "main_protein": "unknown"
    },
    {
      "url": null,
      "urls": [],
      "link_texts": [],
      "menu_files": [
        "Menus/Menu week of 11-19-22.md"
      ],
      "menu_weeks": [
        "2022-11-19"
      ],
      "menu_seasons": [
        "fall"
      ],
      "meal_types": [
        "dinner"
      ],
      "sections": [],
      "source_hints": [],
      "item_texts": [
        "German cucumber dill salad"
      ],
      "count": 1,
      "main_protein": "unknown"
    },
    {
      "url": null,
      "urls": [],
      "link_texts": [],
      "menu_files": [
        "Menus/Menu week of 11-24-23.md"
      ],
      "menu_weeks": [
        "2023-11-24"
      ],
      "menu_seasons": [
        "fall"
      ],
      "meal_types": [
        "dinner"
      ],
      "sections": [],
      "source_hints": [],
      "item_texts": [
        "Pinch of Yum House Favorite Roasted Brussels Sprouts"
      ],
      "count": 1,
      "main_protein": "unknown"
    },
    {
      "url": null,
      "urls": [],
      "link_texts": [],
      "menu_files": [
        "Menus/Menu week of 11-24-23.md"
      ],
      "menu_weeks": [
        "2023-11-24"
      ],
      "menu_seasons": [
        "fall"
      ],
      "meal_types": [
        "dinner"
      ],
      "sections": [],
      "source_hints": [],
      "item_texts": [
        "Egg Waffles with Romesco and Goat Cheese"
      ],
      "count": 1,
      "main_protein": "unknown"
    },
    {
      "url": null,
      "urls": [],
      "link_texts": [],
      "menu_files": [
        "Menus/Menu week of 11-24-23.md"
      ],
      "menu_weeks": [
        "2023-11-24"
      ],
      "menu_seasons": [
        "fall"
      ],
      "meal_types": [
        "dinner"
      ],
      "sections": [],
      "source_hints": [],
      "item_texts": [
        "Hot Honey Salmon"
      ],
      "count": 1,
      "main_protein": "unknown"
    },
    {
      "url": null,
      "urls": [],
      "link_texts": [],
      "menu_files": [
        "Menus/Menu week of 11-24-23.md"
      ],
      "menu_weeks": [
        "2023-11-24"
      ],
      "menu_seasons": [
        "fall"
      ],
      "meal_types": [
        "dinner"
      ],
      "sections": [],
      "source_hints": [],
      "item_texts": [
        "Creamy Mushroom Soup"
      ],
      "count": 1,
      "main_protein": "unknown"
    },
    {
      "url": null,
      "urls": [],
      "link_texts": [],
      "menu_files": [
        "Menus/Menu week of 11-28-19.md"
      ],
      "menu_weeks": [
        "2019-11-28"
      ],
      "menu_seasons": [
        "fall"
      ],
      "meal_types": [
        "dinner"
      ],
      "sections": [],
      "source_hints": [],
      "item_texts": [
        "Herb and Garlic Marinated Olives"
      ],
      "count": 1,
      "main_protein": "unknown"
    },
    {
      "url": null,
      "urls": [],
      "link_texts": [],
      "menu_files": [
        "Menus/Menu week of 11-28-19.md"
      ],
      "menu_weeks": [
        "2019-11-28"
      ],
      "menu_seasons": [
        "fall"
      ],
      "meal_types": [
        "dinner"
      ],
      "sections": [],
      "source_hints": [],
      "item_texts": [
        "Flank steak and roasted Brussels sprouts"
      ],
      "count": 1,
      "main_protein": "unknown"
    },
    {
      "url": null,
      "urls": [],
      "link_texts": [],
      "menu_files": [
        "Menus/Menu week of 11-3-21.md"
      ],
      "menu_weeks": [
        "2021-11-03"
      ],
      "menu_seasons": [
        "fall"
      ],
      "meal_types": [
        "dinner"
      ],
      "sections": [],
      "source_hints": [],
      "item_texts": [
        "Jalape\u00f1o poppers"
      ],
      "count": 1,
      "main_protein": "unknown"
    },
    {
      "url": null,
      "urls": [],
      "link_texts": [],
      "menu_files": [
        "Menus/Menu week of 11-6-18.md"
      ],
      "menu_weeks": [
        "2018-11-06"
      ],
      "menu_seasons": [
        "fall"
      ],
      "meal_types": [
        "dinner"
      ],
      "sections": [],
      "source_hints": [],
      "item_texts": [
        "Goat cheese, beets, pecan salad and bread"
      ],
      "count": 1,
      "main_protein": "unknown"
    },
    {
      "url": null,
      "urls": [],
      "link_texts": [],
      "menu_files": [
        "Menus/Menu week of 11-6-19.md"
      ],
      "menu_weeks": [
        "2019-11-06"
      ],
      "menu_seasons": [
        "fall"
      ],
      "meal_types": [
        "dinner"
      ],
      "sections": [],
      "source_hints": [],
      "item_texts": [
        "Crock pot Irish stew"
      ],
      "count": 1,
      "main_protein": "unknown"
    },
    {
      "url": null,
      "urls": [],
      "link_texts": [],
      "menu_files": [
        "Menus/Menu week of 11-6-19.md"
      ],
      "menu_weeks": [
        "2019-11-06"
      ],
      "menu_seasons": [
        "fall"
      ],
      "meal_types": [
        "dinner"
      ],
      "sections": [],
      "source_hints": [],
      "item_texts": [
        "Tandoori chicken (from frozen - instant pot), add roasted cauliflower and potatoes"
      ],
      "count": 1,
      "main_protein": "unknown"
    },
    {
      "url": null,
      "urls": [],
      "link_texts": [],
      "menu_files": [
        "Menus/Menu week of 11-6-19.md"
      ],
      "menu_weeks": [
        "2019-11-06"
      ],
      "menu_seasons": [
        "fall"
      ],
      "meal_types": [
        "dinner"
      ],
      "sections": [],
      "source_hints": [
        "from frozen - instant pot"
      ],
      "item_texts": [
        "Detox lentil soup and bread (from frozen - instant pot)"
      ],
      "count": 1,
      "main_protein": "unknown"
    },
    {
      "url": null,
      "urls": [],
      "link_texts": [],
      "menu_files": [
        "Menus/Menu week of 11-8-23.md"
      ],
      "menu_weeks": [
        "2023-11-08"
      ],
      "menu_seasons": [
        "fall"
      ],
      "meal_types": [
        "dinner"
      ],
      "sections": [],
      "source_hints": [],
      "item_texts": [
        "Chicken fingers and roasted broccoli/potatoes"
      ],
      "count": 1,
      "main_protein": "unknown"
    },
    {
      "url": null,
      "urls": [],
      "link_texts": [],
      "menu_files": [
        "Menus/Menu week of 11-8-23.md"
      ],
      "menu_weeks": [
        "2023-11-08"
      ],
      "menu_seasons": [
        "fall"
      ],
      "meal_types": [
        "dinner"
      ],
      "sections": [],
      "source_hints": [],
      "item_texts": [
        "Mushroom Penne with Walnut pesto"
      ],
      "count": 1,
      "main_protein": "unknown"
    },
    {
      "url": null,
      "urls": [],
      "link_texts": [],
      "menu_files": [
        "Menus/Menu week of 12-10-23.md"
      ],
      "menu_weeks": [
        "2023-12-10"
      ],
      "menu_seasons": [
        "winter"
      ],
      "meal_types": [
        "dinner"
      ],
      "sections": [],
      "source_hints": [],
      "item_texts": [
        "Greek Baked Orzo"
      ],
      "count": 1,
      "main_protein": "unknown"
    },
    {
      "url": null,
      "urls": [],
      "link_texts": [],
      "menu_files": [
        "Menus/Menu week of 12-10-23.md"
      ],
      "menu_weeks": [
        "2023-12-10"
      ],
      "menu_seasons": [
        "winter"
      ],
      "meal_types": [
        "dinner"
      ],
      "sections": [],
      "source_hints": [
        "Pinch of Yum - contest"
      ],
      "item_texts": [
        "Vegetarian shepherd\u2019s Pie (Pinch of Yum - contest)"
      ],
      "count": 1,
      "main_protein": "unknown"
    },
    {
      "url": null,
      "urls": [],
      "link_texts": [],
      "menu_files": [
        "Menus/Menu week of 12-15-17.md"
      ],
      "menu_weeks": [
        "2017-12-15"
      ],
      "menu_seasons": [
        "winter"
      ],
      "meal_types": [
        "dinner"
      ],
      "sections": [],
      "source_hints": [],
      "item_texts": [
        "crispy potato, chorizo and green chili hash",
        "Sunday:crispy potato, chorizo and green chili hash"
      ],
      "count": 1,
      "main_protein": "unknown"
    },
    {
      "url": null,
      "urls": [],
      "link_texts": [],
      "menu_files": [
        "Menus/Menu week of 12-16-19.md"
      ],
      "menu_weeks": [
        "2019-12-16"
      ],
      "menu_seasons": [
        "winter"
      ],
      "meal_types": [
        "dinner"
      ],
      "sections": [],
      "source_hints": [],
      "item_texts": [
        "Vegetable soup and bread"
      ],
      "count": 1,
      "main_protein": "unknown"
    },
    {
      "url": null,
      "urls": [],
      "link_texts": [],
      "menu_files": [
        "Menus/Menu week of 12-17-18.md"
      ],
      "menu_weeks": [
        "2018-12-17"
      ],
      "menu_seasons": [
        "winter"
      ],
      "meal_types": [
        "dinner"
      ],
      "sections": [],
      "source_hints": [],
      "item_texts": [
        "Butternut squash quinoa chili",
        "Monday: Butternut squash quinoa chili"
      ],
      "count": 1,
      "main_protein": "unknown"
    },
    {
      "url": null,
      "urls": [],
      "link_texts": [],
      "menu_files": [
        "Menus/Menu week of 12-17-18.md"
      ],
      "menu_weeks": [
        "2018-12-17"
      ],
      "menu_seasons": [
        "winter"
      ],
      "meal_types": [
        "dinner"
      ],
      "sections": [],
      "source_hints": [
        "cousins night out - don\u2019t know if this included dinner"
      ],
      "item_texts": [
        "crispy chicken bacon pesto gnocchi skillet - add asparagus (cousins night out - don\u2019t know if this included dinner)",
        "Friday: crispy chicken bacon pesto gnocchi skillet - add asparagus (cousins night out - don\u2019t know if this included dinner)"
      ],
      "count": 1,
      "main_protein": "unknown"
    },
    {
      "url": null,
      "urls": [],
      "link_texts": [],
      "menu_files": [
        "Menus/Menu week of 12-21-20.md"
      ],
      "menu_weeks": [
        "2020-12-21"
      ],
      "menu_seasons": [
        "winter"
      ],
      "meal_types": [
        "dinner"
      ],
      "sections": [],
      "source_hints": [],
      "item_texts": [
        "Christmas eve: Ham rounds and peanut butter cookies"
      ],
      "count": 1,
      "main_protein": "unknown"
    },
    {
      "url": null,
      "urls": [],
      "link_texts": [],
      "menu_files": [
        "Menus/Menu week of 12-21-20.md"
      ],
      "menu_weeks": [
        "2020-12-21"
      ],
      "menu_seasons": [
        "winter"
      ],
      "meal_types": [
        "dinner"
      ],
      "sections": [],
      "source_hints": [],
      "item_texts": [
        "Chicken tacos; napa cabbage slaw with honey lime dressing, avocado",
        "Wednesday: Chicken tacos; napa cabbage slaw with honey lime dressing, avocado"
      ],
      "count": 1,
      "main_protein": "unknown"
    },
    {
      "url": null,
      "urls": [],
      "link_texts": [],
      "menu_files": [
        "Menus/Menu week of 12-22-21.md"
      ],
      "menu_weeks": [
        "2021-12-22"
      ],
      "menu_seasons": [
        "winter"
      ],
      "meal_types": [
        "dinner"
      ],
      "sections": [],
      "source_hints": [],
      "item_texts": [
        "Christmas dinner: truffle oil cheesy pasta and bagged salad"
      ],
      "count": 1,
      "main_protein": "unknown"
    },
    {
      "url": null,
      "urls": [],
      "link_texts": [],
      "menu_files": [
        "Menus/Menu week of 12-22-21.md"
      ],
      "menu_weeks": [
        "2021-12-22"
      ],
      "menu_seasons": [
        "winter"
      ],
      "meal_types": [
        "dinner"
      ],
      "sections": [],
      "source_hints": [],
      "item_texts": [
        "Christmas Eve: spinach and artichoke dip, veggie tray, cider,"
      ],
      "count": 1,
      "main_protein": "unknown"
    },
    {
      "url": null,
      "urls": [],
      "link_texts": [],
      "menu_files": [
        "Menus/Menu week of 12-27-22.md"
      ],
      "menu_weeks": [
        "2022-12-27"
      ],
      "menu_seasons": [
        "winter"
      ],
      "meal_types": [
        "dinner"
      ],
      "sections": [],
      "source_hints": [],
      "item_texts": [
        "Leftover corned beef sandwiches and bagged salad"
      ],
      "count": 1,
      "main_protein": "unknown"
    },
    {
      "url": null,
      "urls": [],
      "link_texts": [],
      "menu_files": [
        "Menus/Menu week of 12-27-22.md"
      ],
      "menu_weeks": [
        "2022-12-27"
      ],
      "menu_seasons": [
        "winter"
      ],
      "meal_types": [
        "dinner"
      ],
      "sections": [],
      "source_hints": [],
      "item_texts": [
        "Cinnamon rolls"
      ],
      "count": 1,
      "main_protein": "unknown"
    },
    {
      "url": null,
      "urls": [],
      "link_texts": [],
      "menu_files": [
        "Menus/Menu week of 12-3-17.md"
      ],
      "menu_weeks": [
        "2017-12-03"
      ],
      "menu_seasons": [
        "winter"
      ],
      "meal_types": [
        "dinner"
      ],
      "sections": [],
      "source_hints": [],
      "item_texts": [
        "Spring detox cauliflower salad"
      ],
      "count": 1,
      "main_protein": "unknown"
    },
    {
      "url": null,
      "urls": [],
      "link_texts": [],
      "menu_files": [
        "Menus/Menu week of 12-3-17.md"
      ],
      "menu_weeks": [
        "2017-12-03"
      ],
      "menu_seasons": [
        "winter"
      ],
      "meal_types": [
        "dinner"
      ],
      "sections": [],
      "source_hints": [],
      "item_texts": [
        "Chorizo and butternut squash lentil soup"
      ],
      "count": 1,
      "main_protein": "unknown"
    },
    {
      "url": null,
      "urls": [],
      "link_texts": [],
      "menu_files": [
        "Menus/Menu week of 12-3-22.md"
      ],
      "menu_weeks": [
        "2022-12-03"
      ],
      "menu_seasons": [
        "winter"
      ],
      "meal_types": [
        "dinner"
      ],
      "sections": [],
      "source_hints": [],
      "item_texts": [
        "Cozy veggie korma"
      ],
      "count": 1,
      "main_protein": "unknown"
    },
    {
      "url": null,
      "urls": [],
      "link_texts": [],
      "menu_files": [
        "Menus/Menu week of 12-3-22.md"
      ],
      "menu_weeks": [
        "2022-12-03"
      ],
      "menu_seasons": [
        "winter"
      ],
      "meal_types": [
        "dinner"
      ],
      "sections": [],
      "source_hints": [
        "pinch of yum"
      ],
      "item_texts": [
        "Life changing beef stew (pinch of yum)"
      ],
      "count": 1,
      "main_protein": "unknown"
    },
    {
      "url": null,
      "urls": [],
      "link_texts": [],
      "menu_files": [
        "Menus/Menu week of 12-31-19.md"
      ],
      "menu_weeks": [
        "2019-12-31"
      ],
      "menu_seasons": [
        "winter"
      ],
      "meal_types": [
        "dinner"
      ],
      "sections": [],
      "source_hints": [],
      "item_texts": [
        "Instant Pot red curry lentils"
      ],
      "count": 1,
      "main_protein": "unknown"
    },
    {
      "url": null,
      "urls": [],
      "link_texts": [],
      "menu_files": [
        "Menus/Menu week of 12-31-19.md"
      ],
      "menu_weeks": [
        "2019-12-31"
      ],
      "menu_seasons": [
        "winter"
      ],
      "meal_types": [
        "lunch"
      ],
      "sections": [],
      "source_hints": [],
      "item_texts": [
        "Lunch prep: Greek orzo salad in a jar"
      ],
      "count": 1,
      "main_protein": "unknown"
    },
    {
      "url": null,
      "urls": [],
      "link_texts": [],
      "menu_files": [
        "Menus/Menu week of 12-31-2020.md"
      ],
      "menu_weeks": [
        "2020-12-31"
      ],
      "menu_seasons": [
        "winter"
      ],
      "meal_types": [
        "dinner"
      ],
      "sections": [],
      "source_hints": [],
      "item_texts": [
        "Root vegetable stew and bread"
      ],
      "count": 1,
      "main_protein": "unknown"
    },
    {
      "url": null,
      "urls": [],
      "link_texts": [],
      "menu_files": [
        "Menus/Menu week of 12-31-2020.md"
      ],
      "menu_weeks": [
        "2020-12-31"
      ],
      "menu_seasons": [
        "winter"
      ],
      "meal_types": [
        "breakfast"
      ],
      "sections": [],
      "source_hints": [],
      "item_texts": [
        "Croque Madame",
        "Breakfast: Croque Madame"
      ],
      "count": 1,
      "main_protein": "unknown"
    },
    {
      "url": null,
      "urls": [],
      "link_texts": [],
      "menu_files": [
        "Menus/Menu week of 12-31-2020.md"
      ],
      "menu_weeks": [
        "2020-12-31"
      ],
      "menu_seasons": [
        "winter"
      ],
      "meal_types": [
        "dinner"
      ],
      "sections": [],
      "source_hints": [],
      "item_texts": [
        "Baby greens salad with goat cheese, beets, and candied pecans"
      ],
      "count": 1,
      "main_protein": "unknown"
    },
    {
      "url": null,
      "urls": [],
      "link_texts": [],
      "menu_files": [
        "Menus/Menu week of 12-4-18.md"
      ],
      "menu_weeks": [
        "2018-12-04"
      ],
      "menu_seasons": [
        "winter"
      ],
      "meal_types": [
        "dinner"
      ],
      "sections": [],
      "source_hints": [],
      "item_texts": [
        "Chicken Noodle Soup",
        "Tuesday: Chicken Noodle Soup"
      ],
      "count": 1,
      "main_protein": "unknown"
    },
    {
      "url": null,
      "urls": [],
      "link_texts": [],
      "menu_files": [
        "Menus/Menu week of 12-4-18.md"
      ],
      "menu_weeks": [
        "2018-12-04"
      ],
      "menu_seasons": [
        "winter"
      ],
      "meal_types": [
        "dinner"
      ],
      "sections": [],
      "source_hints": [],
      "item_texts": [
        "Tamales rice and beans"
      ],
      "count": 1,
      "main_protein": "unknown"
    },
    {
      "url": null,
      "urls": [],
      "link_texts": [],
      "menu_files": [
        "Menus/Menu week of 12-4-18.md"
      ],
      "menu_weeks": [
        "2018-12-04"
      ],
      "menu_seasons": [
        "winter"
      ],
      "meal_types": [
        "dinner"
      ],
      "sections": [],
      "source_hints": [],
      "item_texts": [
        "4 cheese garlic spaghetti squash and chicken"
      ],
      "count": 1,
      "main_protein": "unknown"
    },
    {
      "url": null,
      "urls": [],
      "link_texts": [],
      "menu_files": [
        "Menus/Menu week of 12-4-18.md"
      ],
      "menu_weeks": [
        "2018-12-04"
      ],
      "menu_seasons": [
        "winter"
      ],
      "meal_types": [
        "dinner"
      ],
      "sections": [],
      "source_hints": [],
      "item_texts": [
        "Ribeye steaks, purple potatoes, and green beans"
      ],
      "count": 1,
      "main_protein": "unknown"
    },
    {
      "url": null,
      "urls": [],
      "link_texts": [],
      "menu_files": [
        "Menus/Menu week of 12-7-20.md"
      ],
      "menu_weeks": [
        "2020-12-07"
      ],
      "menu_seasons": [
        "winter"
      ],
      "meal_types": [
        "dinner"
      ],
      "sections": [],
      "source_hints": [],
      "item_texts": [
        "Coconut lentil curry with rainbow chard"
      ],
      "count": 1,
      "main_protein": "unknown"
    },
    {
      "url": null,
      "urls": [],
      "link_texts": [],
      "menu_files": [
        "Menus/Menu week of 2-14-19.md"
      ],
      "menu_weeks": [
        "2019-02-14"
      ],
      "menu_seasons": [
        "winter"
      ],
      "meal_types": [
        "dinner"
      ],
      "sections": [],
      "source_hints": [],
      "item_texts": [
        "Pepperoncini chicken noodle soup"
      ],
      "count": 1,
      "main_protein": "unknown"
    },
    {
      "url": null,
      "urls": [],
      "link_texts": [],
      "menu_files": [
        "Menus/Menu week of 2-14-19.md"
      ],
      "menu_weeks": [
        "2019-02-14"
      ],
      "menu_seasons": [
        "winter"
      ],
      "meal_types": [
        "dinner"
      ],
      "sections": [],
      "source_hints": [],
      "item_texts": [
        "Egg roll bowls"
      ],
      "count": 1,
      "main_protein": "unknown"
    },
    {
      "url": null,
      "urls": [],
      "link_texts": [],
      "menu_files": [
        "Menus/Menu week of 2-16-24.md"
      ],
      "menu_weeks": [
        "2024-02-16"
      ],
      "menu_seasons": [
        "winter"
      ],
      "meal_types": [
        "dinner"
      ],
      "sections": [],
      "source_hints": [],
      "item_texts": [
        "Chicago hot dogs and salad"
      ],
      "count": 1,
      "main_protein": "unknown"
    },
    {
      "url": null,
      "urls": [],
      "link_texts": [],
      "menu_files": [
        "Menus/Menu week of 2-16-24.md"
      ],
      "menu_weeks": [
        "2024-02-16"
      ],
      "menu_seasons": [
        "winter"
      ],
      "meal_types": [
        "dinner"
      ],
      "sections": [],
      "source_hints": [
        "Half Baked Harvest"
      ],
      "item_texts": [
        "Sheet Pan Chicken Tzatziki and sweet potatoes (Half Baked Harvest)"
      ],
      "count": 1,
      "main_protein": "unknown"
    },
    {
      "url": null,
      "urls": [],
      "link_texts": [],
      "menu_files": [
        "Menus/Menu week of 2-19-18.md"
      ],
      "menu_weeks": [
        "2018-02-19"
      ],
      "menu_seasons": [
        "winter"
      ],
      "meal_types": [
        "dinner"
      ],
      "sections": [],
      "source_hints": [],
      "item_texts": [
        "One pan broccoli quinoa skillet"
      ],
      "count": 1,
      "main_protein": "unknown"
    },
    {
      "url": null,
      "urls": [],
      "link_texts": [],
      "menu_files": [
        "Menus/Menu week of 2-2-24.md"
      ],
      "menu_weeks": [
        "2024-02-02"
      ],
      "menu_seasons": [
        "winter"
      ],
      "meal_types": [
        "dinner"
      ],
      "sections": [],
      "source_hints": [
        "Dishing Out Health"
      ],
      "item_texts": [
        "BBQ Ranch Chickpea Quinoa bowls (Dishing Out Health)"
      ],
      "count": 1,
      "main_protein": "unknown"
    },
    {
      "url": null,
      "urls": [],
      "link_texts": [],
      "menu_files": [
        "Menus/Menu week of 2-2-24.md"
      ],
      "menu_weeks": [
        "2024-02-02"
      ],
      "menu_seasons": [
        "winter"
      ],
      "meal_types": [
        "dinner"
      ],
      "sections": [],
      "source_hints": [
        "Mel\u2019s kitchen cafe"
      ],
      "item_texts": [
        "Easy Chicken Enchilada Casserole (Mel\u2019s kitchen cafe)"
      ],
      "count": 1,
      "main_protein": "unknown"
    },
    {
      "url": null,
      "urls": [],
      "link_texts": [],
      "menu_files": [
        "Menus/Menu week of 2-20-23.md"
      ],
      "menu_weeks": [
        "2023-02-20"
      ],
      "menu_seasons": [
        "winter"
      ],
      "meal_types": [
        "dinner"
      ],
      "sections": [],
      "source_hints": [
        "Pinch of yum"
      ],
      "item_texts": [
        "Chopped thai salad (Pinch of yum)"
      ],
      "count": 1,
      "main_protein": "unknown"
    },
    {
      "url": null,
      "urls": [],
      "link_texts": [],
      "menu_files": [
        "Menus/Menu week of 2-20-23.md"
      ],
      "menu_weeks": [
        "2023-02-20"
      ],
      "menu_seasons": [
        "winter"
      ],
      "meal_types": [
        "dinner"
      ],
      "sections": [],
      "source_hints": [],
      "item_texts": [
        "Kimchi grilled cheese"
      ],
      "count": 1,
      "main_protein": "unknown"
    },
    {
      "url": null,
      "urls": [],
      "link_texts": [],
      "menu_files": [
        "Menus/Menu week of 2-20-23.md"
      ],
      "menu_weeks": [
        "2023-02-20"
      ],
      "menu_seasons": [
        "winter"
      ],
      "meal_types": [
        "dinner"
      ],
      "sections": [],
      "source_hints": [],
      "item_texts": [
        "Cauliflower soup"
      ],
      "count": 1,
      "main_protein": "unknown"
    },
    {
      "url": null,
      "urls": [],
      "link_texts": [],
      "menu_files": [
        "Menus/Menu week of 2-23-20.md"
      ],
      "menu_weeks": [
        "2020-02-23"
      ],
      "menu_seasons": [
        "winter"
      ],
      "meal_types": [
        "dinner"
      ],
      "sections": [],
      "source_hints": [
        "vegetarian"
      ],
      "item_texts": [
        "Mediterranean cous cous bowls (vegetarian)"
      ],
      "count": 1,
      "main_protein": "unknown"
    },
    {
      "url": null,
      "urls": [],
      "link_texts": [],
      "menu_files": [
        "Menus/Menu week of 2-27-22.md"
      ],
      "menu_weeks": [
        "2022-02-27"
      ],
      "menu_seasons": [
        "winter"
      ],
      "meal_types": [
        "dinner"
      ],
      "sections": [],
      "source_hints": [],
      "item_texts": [
        "Seared chicken and sherry pan sauce",
        "Thursday -Seared chicken and sherry pan sauce"
      ],
      "count": 1,
      "main_protein": "unknown"
    },
    {
      "url": null,
      "urls": [],
      "link_texts": [],
      "menu_files": [
        "Menus/Menu week of 2-27-22.md"
      ],
      "menu_weeks": [
        "2022-02-27"
      ],
      "menu_seasons": [
        "winter"
      ],
      "meal_types": [
        "dinner"
      ],
      "sections": [],
      "source_hints": [],
      "item_texts": [
        "Pork chorizo and fig bake"
      ],
      "count": 1,
      "main_protein": "unknown"
    },
    {
      "url": null,
      "urls": [],
      "link_texts": [],
      "menu_files": [
        "Menus/Menu week of 2-29-24.md"
      ],
      "menu_weeks": [
        "2024-02-29"
      ],
      "menu_seasons": [
        "winter"
      ],
      "meal_types": [
        "dinner"
      ],
      "sections": [],
      "source_hints": [
        "Pinch of Yum"
      ],
      "item_texts": [
        "Instant pot Chicken and Dumplings (Pinch of Yum)"
      ],
      "count": 1,
      "main_protein": "unknown"
    },
    {
      "url": null,
      "urls": [],
      "link_texts": [],
      "menu_files": [
        "Menus/Menu week of 2-29-24.md"
      ],
      "menu_weeks": [
        "2024-02-29"
      ],
      "menu_seasons": [
        "winter"
      ],
      "meal_types": [
        "dinner"
      ],
      "sections": [],
      "source_hints": [
        "Well Plated"
      ],
      "item_texts": [
        "Chicken broccoli alfredo (Well Plated)"
      ],
      "count": 1,
      "main_protein": "unknown"
    },
    {
      "url": null,
      "urls": [],
      "link_texts": [],
      "menu_files": [
        "Menus/Menu week of 2-6-23.md"
      ],
      "menu_weeks": [
        "2023-02-06"
      ],
      "menu_seasons": [
        "winter"
      ],
      "meal_types": [
        "dinner"
      ],
      "sections": [],
      "source_hints": [],
      "item_texts": [
        "Sesame beef and broccoli"
      ],
      "count": 1,
      "main_protein": "unknown"
    },
    {
      "url": null,
      "urls": [],
      "link_texts": [],
      "menu_files": [
        "Menus/Menu week of 2-6-23.md"
      ],
      "menu_weeks": [
        "2023-02-06"
      ],
      "menu_seasons": [
        "winter"
      ],
      "meal_types": [
        "dinner"
      ],
      "sections": [],
      "source_hints": [],
      "item_texts": [
        "Brussels sprouts tacos"
      ],
      "count": 1,
      "main_protein": "unknown"
    },
    {
      "url": null,
      "urls": [],
      "link_texts": [],
      "menu_files": [
        "Menus/Menu week of 2-8-20.md"
      ],
      "menu_weeks": [
        "2020-02-08"
      ],
      "menu_seasons": [
        "winter"
      ],
      "meal_types": [
        "dinner"
      ],
      "sections": [],
      "source_hints": [
        "use red cabbage"
      ],
      "item_texts": [
        "Thai summer rolls with peanut sauce (use red cabbage)"
      ],
      "count": 1,
      "main_protein": "unknown"
    },
    {
      "url": null,
      "urls": [],
      "link_texts": [],
      "menu_files": [
        "Menus/Menu week of 2-8-20.md"
      ],
      "menu_weeks": [
        "2020-02-08"
      ],
      "menu_seasons": [
        "winter"
      ],
      "meal_types": [
        "dinner"
      ],
      "sections": [],
      "source_hints": [],
      "item_texts": [
        "Crispy autumn veg burgers with apple cider slaw, sweet potato fries"
      ],
      "count": 1,
      "main_protein": "unknown"
    },
    {
      "url": null,
      "urls": [],
      "link_texts": [],
      "menu_files": [
        "Menus/Menu week of 2-8-20.md"
      ],
      "menu_weeks": [
        "2020-02-08"
      ],
      "menu_seasons": [
        "winter"
      ],
      "meal_types": [
        "dinner"
      ],
      "sections": [],
      "source_hints": [],
      "item_texts": [
        "Warm black bean dip"
      ],
      "count": 1,
      "main_protein": "unknown"
    },
    {
      "url": null,
      "urls": [],
      "link_texts": [],
      "menu_files": [
        "Menus/Menu week of 3-1-19.md"
      ],
      "menu_weeks": [
        "2019-03-01"
      ],
      "menu_seasons": [
        "spring"
      ],
      "meal_types": [
        "dinner"
      ],
      "sections": [],
      "source_hints": [],
      "item_texts": [
        "Easy green curry with tofu, red bell pepper, mushrooms, and leftover other veggies"
      ],
      "count": 1,
      "main_protein": "unknown"
    },
    {
      "url": null,
      "urls": [],
      "link_texts": [],
      "menu_files": [
        "Menus/Menu week of 3-1-19.md"
      ],
      "menu_weeks": [
        "2019-03-01"
      ],
      "menu_seasons": [
        "spring"
      ],
      "meal_types": [
        "dinner"
      ],
      "sections": [],
      "source_hints": [],
      "item_texts": [
        "Fettucini with preserved lemon and roasted garlic, salad",
        "Sunday: Fettucini with preserved lemon and roasted garlic, salad"
      ],
      "count": 1,
      "main_protein": "unknown"
    },
    {
      "url": null,
      "urls": [],
      "link_texts": [],
      "menu_files": [
        "Menus/Menu week of 3-1-19.md"
      ],
      "menu_weeks": [
        "2019-03-01"
      ],
      "menu_seasons": [
        "spring"
      ],
      "meal_types": [
        "dinner"
      ],
      "sections": [],
      "source_hints": [],
      "item_texts": [
        "Chicken guacamole taquitos"
      ],
      "count": 1,
      "main_protein": "unknown"
    },
    {
      "url": null,
      "urls": [],
      "link_texts": [],
      "menu_files": [
        "Menus/Menu week of 3-12-24.md"
      ],
      "menu_weeks": [
        "2024-03-12"
      ],
      "menu_seasons": [
        "spring"
      ],
      "meal_types": [
        "dinner"
      ],
      "sections": [],
      "source_hints": [
        "half baked harvest"
      ],
      "item_texts": [
        "One pot broccoli cheese pesto pasta (half baked harvest)"
      ],
      "count": 1,
      "main_protein": "unknown"
    },
    {
      "url": null,
      "urls": [],
      "link_texts": [],
      "menu_files": [
        "Menus/Menu week of 3-12-24.md"
      ],
      "menu_weeks": [
        "2024-03-12"
      ],
      "menu_seasons": [
        "spring"
      ],
      "meal_types": [
        "dinner"
      ],
      "sections": [],
      "source_hints": [
        "Half baked harvest"
      ],
      "item_texts": [
        "Crockpot Thai Yellow Curry Chicken with Garlic Rice (Half baked harvest)"
      ],
      "count": 1,
      "main_protein": "unknown"
    },
    {
      "url": null,
      "urls": [],
      "link_texts": [],
      "menu_files": [
        "Menus/Menu week of 3-14-18.md"
      ],
      "menu_weeks": [
        "2018-03-14"
      ],
      "menu_seasons": [
        "spring"
      ],
      "meal_types": [
        "dinner"
      ],
      "sections": [],
      "source_hints": [],
      "item_texts": [
        "Double fudge Irish cream cookies"
      ],
      "count": 1,
      "main_protein": "unknown"
    },
    {
      "url": null,
      "urls": [],
      "link_texts": [],
      "menu_files": [
        "Menus/Menu week of 3-14-18.md"
      ],
      "menu_weeks": [
        "2018-03-14"
      ],
      "menu_seasons": [
        "spring"
      ],
      "meal_types": [
        "dinner"
      ],
      "sections": [],
      "source_hints": [
        "Maggie"
      ],
      "item_texts": [
        "Irish soda bread muffins (Maggie)"
      ],
      "count": 1,
      "main_protein": "unknown"
    },
    {
      "url": null,
      "urls": [],
      "link_texts": [],
      "menu_files": [
        "Menus/Menu week of 3-14-18.md"
      ],
      "menu_weeks": [
        "2018-03-14"
      ],
      "menu_seasons": [
        "spring"
      ],
      "meal_types": [
        "dinner"
      ],
      "sections": [],
      "source_hints": [],
      "item_texts": [
        "corned beef, Irish cheddar cabbage sandwiches",
        "Wednesday: corned beef, Irish cheddar cabbage sandwiches"
      ],
      "count": 1,
      "main_protein": "unknown"
    },
    {
      "url": null,
      "urls": [],
      "link_texts": [],
      "menu_files": [
        "Menus/Menu week of 3-14-18.md"
      ],
      "menu_weeks": [
        "2018-03-14"
      ],
      "menu_seasons": [
        "spring"
      ],
      "meal_types": [
        "dinner"
      ],
      "sections": [],
      "source_hints": [],
      "item_texts": [
        "colcannon",
        "Thursday: colcannon"
      ],
      "count": 1,
      "main_protein": "unknown"
    },
    {
      "url": null,
      "urls": [],
      "link_texts": [],
      "menu_files": [
        "Menus/Menu week of 3-15-19.md"
      ],
      "menu_weeks": [
        "2019-03-15"
      ],
      "menu_seasons": [
        "spring"
      ],
      "meal_types": [
        "dinner"
      ],
      "sections": [],
      "source_hints": [],
      "item_texts": [
        "Salad (feta, cranberries, apple, walnuts) and dinner rolls"
      ],
      "count": 1,
      "main_protein": "unknown"
    },
    {
      "url": null,
      "urls": [],
      "link_texts": [],
      "menu_files": [
        "Menus/Menu week of 3-15-19.md"
      ],
      "menu_weeks": [
        "2019-03-15"
      ],
      "menu_seasons": [
        "spring"
      ],
      "meal_types": [
        "dinner"
      ],
      "sections": [],
      "source_hints": [],
      "item_texts": [
        "Leftovers: Corned beef sandwiches"
      ],
      "count": 1,
      "main_protein": "unknown"
    },
    {
      "url": null,
      "urls": [],
      "link_texts": [],
      "menu_files": [
        "Menus/Menu week of 3-15-19.md"
      ],
      "menu_weeks": [
        "2019-03-15"
      ],
      "menu_seasons": [
        "spring"
      ],
      "meal_types": [
        "dinner"
      ],
      "sections": [],
      "source_hints": [],
      "item_texts": [
        "Sesame noodle bowls"
      ],
      "count": 1,
      "main_protein": "unknown"
    },
    {
      "url": null,
      "urls": [],
      "link_texts": [],
      "menu_files": [
        "Menus/Menu week of 3-19-21.md"
      ],
      "menu_weeks": [
        "2021-03-19"
      ],
      "menu_seasons": [
        "spring"
      ],
      "meal_types": [
        "dinner"
      ],
      "sections": [],
      "source_hints": [],
      "item_texts": [
        "Easy pepper steak and rice"
      ],
      "count": 1,
      "main_protein": "unknown"
    },
    {
      "url": null,
      "urls": [],
      "link_texts": [],
      "menu_files": [
        "Menus/Menu week of 3-20-23.md"
      ],
      "menu_weeks": [
        "2023-03-20"
      ],
      "menu_seasons": [
        "spring"
      ],
      "meal_types": [
        "dinner"
      ],
      "sections": [],
      "source_hints": [],
      "item_texts": [
        "The Olivers Salad"
      ],
      "count": 1,
      "main_protein": "unknown"
    },
    {
      "url": null,
      "urls": [],
      "link_texts": [],
      "menu_files": [
        "Menus/Menu week of 3-20-23.md"
      ],
      "menu_weeks": [
        "2023-03-20"
      ],
      "menu_seasons": [
        "spring"
      ],
      "meal_types": [
        "dinner"
      ],
      "sections": [],
      "source_hints": [],
      "item_texts": [
        "Coconut curry ramen"
      ],
      "count": 1,
      "main_protein": "unknown"
    },
    {
      "url": null,
      "urls": [],
      "link_texts": [],
      "menu_files": [
        "Menus/Menu week of 3-20-23.md"
      ],
      "menu_weeks": [
        "2023-03-20"
      ],
      "menu_seasons": [
        "spring"
      ],
      "meal_types": [
        "dinner"
      ],
      "sections": [],
      "source_hints": [],
      "item_texts": [
        "Three cheese baked Gnocchi"
      ],
      "count": 1,
      "main_protein": "unknown"
    },
    {
      "url": null,
      "urls": [],
      "link_texts": [],
      "menu_files": [
        "Menus/Menu week of 3-20-23.md"
      ],
      "menu_weeks": [
        "2023-03-20"
      ],
      "menu_seasons": [
        "spring"
      ],
      "meal_types": [
        "dinner"
      ],
      "sections": [],
      "source_hints": [],
      "item_texts": [
        "Loaded BBQ Baked potatoes"
      ],
      "count": 1,
      "main_protein": "unknown"
    },
    {
      "url": null,
      "urls": [],
      "link_texts": [],
      "menu_files": [
        "Menus/Menu week of 3-21-20.md"
      ],
      "menu_weeks": [
        "2020-03-21"
      ],
      "menu_seasons": [
        "spring"
      ],
      "meal_types": [
        "dinner"
      ],
      "sections": [],
      "source_hints": [
        "freeze"
      ],
      "item_texts": [
        "Detox lentil soup (freeze)"
      ],
      "count": 1,
      "main_protein": "unknown"
    },
    {
      "url": null,
      "urls": [],
      "link_texts": [],
      "menu_files": [
        "Menus/Menu week of 3-21-20.md"
      ],
      "menu_weeks": [
        "2020-03-21"
      ],
      "menu_seasons": [
        "spring"
      ],
      "meal_types": [
        "lunch"
      ],
      "sections": [],
      "source_hints": [],
      "item_texts": [
        "Lunch? Winter rainbow quinoa salad"
      ],
      "count": 1,
      "main_protein": "unknown"
    },
    {
      "url": null,
      "urls": [],
      "link_texts": [],
      "menu_files": [
        "Menus/Menu week of 3-21-20.md"
      ],
      "menu_weeks": [
        "2020-03-21"
      ],
      "menu_seasons": [
        "spring"
      ],
      "meal_types": [
        "dinner"
      ],
      "sections": [],
      "source_hints": [],
      "item_texts": [
        "One Pot Creamy Asparagus and Bacon Pasta"
      ],
      "count": 1,
      "main_protein": "unknown"
    },
    {
      "url": null,
      "urls": [],
      "link_texts": [],
      "menu_files": [
        "Menus/Menu week of 3-24-24.md"
      ],
      "menu_weeks": [
        "2024-03-24"
      ],
      "menu_seasons": [
        "spring"
      ],
      "meal_types": [
        "dinner"
      ],
      "sections": [],
      "source_hints": [],
      "item_texts": [
        "Asparagus pasta with Lemon (A couple cooks) add frozen chicken tenders"
      ],
      "count": 1,
      "main_protein": "unknown"
    },
    {
      "url": null,
      "urls": [],
      "link_texts": [],
      "menu_files": [
        "Menus/Menu week of 3-24-24.md"
      ],
      "menu_weeks": [
        "2024-03-24"
      ],
      "menu_seasons": [
        "spring"
      ],
      "meal_types": [
        "dinner"
      ],
      "sections": [],
      "source_hints": [
        "Half Baked Harvest"
      ],
      "item_texts": [
        "30 Minute Thai Basil Beef noodles (Half Baked Harvest)"
      ],
      "count": 1,
      "main_protein": "unknown"
    },
    {
      "url": null,
      "urls": [],
      "link_texts": [],
      "menu_files": [
        "Menus/Menu week of 3-24-24.md"
      ],
      "menu_weeks": [
        "2024-03-24"
      ],
      "menu_seasons": [
        "spring"
      ],
      "meal_types": [
        "dinner"
      ],
      "sections": [],
      "source_hints": [],
      "item_texts": [
        "Marry Me Chicken (Pinch of Yum) with mashed potatoes, bagged salad. Use frozen chicken tenders"
      ],
      "count": 1,
      "main_protein": "unknown"
    },
    {
      "url": null,
      "urls": [],
      "link_texts": [],
      "menu_files": [
        "Menus/Menu week of 3-31-18.md"
      ],
      "menu_weeks": [
        "2018-03-31"
      ],
      "menu_seasons": [
        "spring"
      ],
      "meal_types": [
        "breakfast"
      ],
      "sections": [],
      "source_hints": [],
      "item_texts": [
        "Easter breakfast: eggs, bacon, potatoes, blackberries"
      ],
      "count": 1,
      "main_protein": "unknown"
    },
    {
      "url": null,
      "urls": [],
      "link_texts": [],
      "menu_files": [
        "Menus/Menu week of 3-31-18.md"
      ],
      "menu_weeks": [
        "2018-03-31"
      ],
      "menu_seasons": [
        "spring"
      ],
      "meal_types": [
        "dessert"
      ],
      "sections": [],
      "source_hints": [],
      "item_texts": [
        "Easter dinner: lemon asparagus truffle pasta, salad (skinnytaste house salad), dessert: ice cream"
      ],
      "count": 1,
      "main_protein": "unknown"
    },
    {
      "url": null,
      "urls": [],
      "link_texts": [],
      "menu_files": [
        "Menus/Menu week of 3-31-18.md"
      ],
      "menu_weeks": [
        "2018-03-31"
      ],
      "menu_seasons": [
        "spring"
      ],
      "meal_types": [
        "dinner"
      ],
      "sections": [],
      "source_hints": [],
      "item_texts": [
        "Chickpea tikka masala with green rice (cookie and Kate p. 157)"
      ],
      "count": 1,
      "main_protein": "unknown"
    },
    {
      "url": null,
      "urls": [],
      "link_texts": [],
      "menu_files": [
        "Menus/Menu week of 3-31-18.md"
      ],
      "menu_weeks": [
        "2018-03-31"
      ],
      "menu_seasons": [
        "spring"
      ],
      "meal_types": [
        "dinner"
      ],
      "sections": [],
      "source_hints": [],
      "item_texts": [
        "French onion soup"
      ],
      "count": 1,
      "main_protein": "unknown"
    },
    {
      "url": null,
      "urls": [],
      "link_texts": [],
      "menu_files": [
        "Menus/Menu week of 3-5-23.md"
      ],
      "menu_weeks": [
        "2023-03-05"
      ],
      "menu_seasons": [
        "spring"
      ],
      "meal_types": [
        "dinner"
      ],
      "sections": [],
      "source_hints": [],
      "item_texts": [
        "Frozen chicken nuggets, bagged salad, sweet potato fries"
      ],
      "count": 1,
      "main_protein": "unknown"
    },
    {
      "url": null,
      "urls": [],
      "link_texts": [],
      "menu_files": [
        "Menus/Menu week of 3-5-23.md"
      ],
      "menu_weeks": [
        "2023-03-05"
      ],
      "menu_seasons": [
        "spring"
      ],
      "meal_types": [
        "dinner"
      ],
      "sections": [],
      "source_hints": [
        "Wednesday"
      ],
      "item_texts": [
        "Slow cooker beef stew (Damn Delicious) (Wednesday)"
      ],
      "count": 1,
      "main_protein": "unknown"
    },
    {
      "url": null,
      "urls": [],
      "link_texts": [],
      "menu_files": [
        "Menus/Menu week of 3-5-23.md"
      ],
      "menu_weeks": [
        "2023-03-05"
      ],
      "menu_seasons": [
        "spring"
      ],
      "meal_types": [
        "dinner"
      ],
      "sections": [],
      "source_hints": [
        "use up frozen"
      ],
      "item_texts": [
        "Ribeye steaks, asparagus, sweet potato fries (use up frozen)"
      ],
      "count": 1,
      "main_protein": "unknown"
    },
    {
      "url": null,
      "urls": [],
      "link_texts": [],
      "menu_files": [
        "Menus/Menu week of 3-5-23.md"
      ],
      "menu_weeks": [
        "2023-03-05"
      ],
      "menu_seasons": [
        "spring"
      ],
      "meal_types": [
        "dinner"
      ],
      "sections": [],
      "source_hints": [
        "Friday"
      ],
      "item_texts": [
        "Spicy shrimp veracruz (Friday)"
      ],
      "count": 1,
      "main_protein": "unknown"
    },
    {
      "url": null,
      "urls": [],
      "link_texts": [],
      "menu_files": [
        "Menus/Menu week of 3-5-23.md"
      ],
      "menu_weeks": [
        "2023-03-05"
      ],
      "menu_seasons": [
        "spring"
      ],
      "meal_types": [
        "dinner"
      ],
      "sections": [],
      "source_hints": [
        "Tuesday"
      ],
      "item_texts": [
        "Chopped salad pizza (maybe, or maybe just pizza and salad) (Tuesday)"
      ],
      "count": 1,
      "main_protein": "unknown"
    },
    {
      "url": null,
      "urls": [],
      "link_texts": [],
      "menu_files": [
        "Menus/Menu week of 3-7-20.md"
      ],
      "menu_weeks": [
        "2020-03-07"
      ],
      "menu_seasons": [
        "spring"
      ],
      "meal_types": [
        "dinner"
      ],
      "sections": [],
      "source_hints": [],
      "item_texts": [
        "Healthy Orange chicken"
      ],
      "count": 1,
      "main_protein": "unknown"
    },
    {
      "url": null,
      "urls": [],
      "link_texts": [],
      "menu_files": [
        "Menus/Menu week of 3-7-20.md"
      ],
      "menu_weeks": [
        "2020-03-07"
      ],
      "menu_seasons": [
        "spring"
      ],
      "meal_types": [
        "dinner"
      ],
      "sections": [],
      "source_hints": [
        "need to make dough"
      ],
      "item_texts": [
        "Corned beef and cabbagePizza (need to make dough)"
      ],
      "count": 1,
      "main_protein": "unknown"
    },
    {
      "url": null,
      "urls": [],
      "link_texts": [],
      "menu_files": [
        "Menus/Menu week of 3-7-20.md"
      ],
      "menu_weeks": [
        "2020-03-07"
      ],
      "menu_seasons": [
        "spring"
      ],
      "meal_types": [
        "dinner"
      ],
      "sections": [],
      "source_hints": [
        "serve with quinoa"
      ],
      "item_texts": [
        "Korean beef bowls (serve with quinoa)"
      ],
      "count": 1,
      "main_protein": "unknown"
    },
    {
      "url": null,
      "urls": [],
      "link_texts": [],
      "menu_files": [
        "Menus/Menu week of 3-9-21.md"
      ],
      "menu_weeks": [
        "2021-03-09"
      ],
      "menu_seasons": [
        "spring"
      ],
      "meal_types": [
        "dinner"
      ],
      "sections": [],
      "source_hints": [],
      "item_texts": [
        "St Patrick\u2019s Day: Corned beef, cabbage, and potatoes"
      ],
      "count": 1,
      "main_protein": "unknown"
    },
    {
      "url": null,
      "urls": [],
      "link_texts": [],
      "menu_files": [
        "Menus/Menu week of 4-10-19.md"
      ],
      "menu_weeks": [
        "2019-04-10"
      ],
      "menu_seasons": [
        "spring"
      ],
      "meal_types": [
        "dinner"
      ],
      "sections": [],
      "source_hints": [],
      "item_texts": [
        "Tandoori chicken and salad",
        "Wednesday: Tandoori chicken and salad"
      ],
      "count": 1,
      "main_protein": "unknown"
    },
    {
      "url": null,
      "urls": [],
      "link_texts": [],
      "menu_files": [
        "Menus/Menu week of 4-10-22.md"
      ],
      "menu_weeks": [
        "2022-04-10"
      ],
      "menu_seasons": [
        "spring"
      ],
      "meal_types": [
        "dinner"
      ],
      "sections": [],
      "source_hints": [],
      "item_texts": [
        "Easter dinner: lemon chicken skewers with creamy feta sauce (half baked harvest), roasted yellow potatoes, flatbread"
      ],
      "count": 1,
      "main_protein": "unknown"
    },
    {
      "url": null,
      "urls": [],
      "link_texts": [],
      "menu_files": [
        "Menus/Menu week of 4-10-22.md"
      ],
      "menu_weeks": [
        "2022-04-10"
      ],
      "menu_seasons": [
        "spring"
      ],
      "meal_types": [
        "breakfast"
      ],
      "sections": [],
      "source_hints": [],
      "item_texts": [
        "Easter breakfast: monkeys, eggs, moms fancy bacon, fruit"
      ],
      "count": 1,
      "main_protein": "unknown"
    },
    {
      "url": null,
      "urls": [],
      "link_texts": [],
      "menu_files": [
        "Menus/Menu week of 4-10-22.md"
      ],
      "menu_weeks": [
        "2022-04-10"
      ],
      "menu_seasons": [
        "spring"
      ],
      "meal_types": [
        "dinner"
      ],
      "sections": [],
      "source_hints": [],
      "item_texts": [
        "mac and cheese and salad",
        "Friday: mac and cheese and salad"
      ],
      "count": 1,
      "main_protein": "unknown"
    },
    {
      "url": null,
      "urls": [],
      "link_texts": [],
      "menu_files": [
        "Menus/Menu week of 4-13-21.md"
      ],
      "menu_weeks": [
        "2021-04-13"
      ],
      "menu_seasons": [
        "spring"
      ],
      "meal_types": [
        "dinner"
      ],
      "sections": [],
      "source_hints": [
        "make chicken in instant pot"
      ],
      "item_texts": [
        "Easy chicken enchilada casserole (make chicken in instant pot)"
      ],
      "count": 1,
      "main_protein": "unknown"
    },
    {
      "url": null,
      "urls": [],
      "link_texts": [],
      "menu_files": [
        "Menus/Menu week of 4-13-21.md"
      ],
      "menu_weeks": [
        "2021-04-13"
      ],
      "menu_seasons": [
        "spring"
      ],
      "meal_types": [
        "dinner"
      ],
      "sections": [],
      "source_hints": [],
      "item_texts": [
        "Filipino bbq on grill, grilled peppers and zucchini/squash"
      ],
      "count": 1,
      "main_protein": "unknown"
    },
    {
      "url": null,
      "urls": [],
      "link_texts": [],
      "menu_files": [
        "Menus/Menu week of 4-16-18.md"
      ],
      "menu_weeks": [
        "2018-04-16"
      ],
      "menu_seasons": [
        "spring"
      ],
      "meal_types": [
        "dinner"
      ],
      "sections": [],
      "source_hints": [],
      "item_texts": [
        "Curried satay veggie bowls"
      ],
      "count": 1,
      "main_protein": "unknown"
    },
    {
      "url": null,
      "urls": [],
      "link_texts": [],
      "menu_files": [
        "Menus/Menu week of 4-16-18.md"
      ],
      "menu_weeks": [
        "2018-04-16"
      ],
      "menu_seasons": [
        "spring"
      ],
      "meal_types": [
        "dinner"
      ],
      "sections": [],
      "source_hints": [],
      "item_texts": [
        "Spicy peanut chicken soba noodle salad"
      ],
      "count": 1,
      "main_protein": "unknown"
    },
    {
      "url": null,
      "urls": [],
      "link_texts": [],
      "menu_files": [
        "Menus/Menu week of 4-2-2020.md"
      ],
      "menu_weeks": [
        "2020-04-02"
      ],
      "menu_seasons": [
        "spring"
      ],
      "meal_types": [
        "dinner"
      ],
      "sections": [],
      "source_hints": [],
      "item_texts": [
        "Lemon asparagus chicken"
      ],
      "count": 1,
      "main_protein": "unknown"
    },
    {
      "url": null,
      "urls": [],
      "link_texts": [],
      "menu_files": [
        "Menus/Menu week of 4-2-2020.md"
      ],
      "menu_weeks": [
        "2020-04-02"
      ],
      "menu_seasons": [
        "spring"
      ],
      "meal_types": [
        "dinner"
      ],
      "sections": [],
      "source_hints": [],
      "item_texts": [
        "Easter: ham, mustard sauce, sweet potatoes, green bean casserole, carrot cake cheesecake"
      ],
      "count": 1,
      "main_protein": "unknown"
    },
    {
      "url": null,
      "urls": [],
      "link_texts": [],
      "menu_files": [
        "Menus/Menu week of 4-20-24.md"
      ],
      "menu_weeks": [
        "2024-04-20"
      ],
      "menu_seasons": [
        "spring"
      ],
      "meal_types": [
        "dinner"
      ],
      "sections": [],
      "source_hints": [],
      "item_texts": [
        "Buffalo Ranch chopped salad kit with chicken fingers"
      ],
      "count": 1,
      "main_protein": "unknown"
    },
    {
      "url": null,
      "urls": [],
      "link_texts": [],
      "menu_files": [
        "Menus/Menu week of 4-21-19.md"
      ],
      "menu_weeks": [
        "2019-04-21"
      ],
      "menu_seasons": [
        "spring"
      ],
      "meal_types": [
        "dinner"
      ],
      "sections": [],
      "source_hints": [],
      "item_texts": [
        "Easter Sunday: ham, mustard sauce, asparagus, sean family sweet potatoes, green bean casserole, dinner rolls"
      ],
      "count": 1,
      "main_protein": "unknown"
    },
    {
      "url": null,
      "urls": [],
      "link_texts": [],
      "menu_files": [
        "Menus/Menu week of 4-21-19.md"
      ],
      "menu_weeks": [
        "2019-04-21"
      ],
      "menu_seasons": [
        "spring"
      ],
      "meal_types": [
        "dinner"
      ],
      "sections": [],
      "source_hints": [],
      "item_texts": [
        "Strawberry faro salad with avocado and feta"
      ],
      "count": 1,
      "main_protein": "unknown"
    },
    {
      "url": null,
      "urls": [],
      "link_texts": [],
      "menu_files": [
        "Menus/Menu week of 4-21-19.md"
      ],
      "menu_weeks": [
        "2019-04-21"
      ],
      "menu_seasons": [
        "spring"
      ],
      "meal_types": [
        "dinner"
      ],
      "sections": [],
      "source_hints": [],
      "item_texts": [
        "Beef rag\u00fa with spaghetti, bag salad"
      ],
      "count": 1,
      "main_protein": "unknown"
    },
    {
      "url": null,
      "urls": [],
      "link_texts": [],
      "menu_files": [
        "Menus/Menu week of 4-21-19.md"
      ],
      "menu_weeks": [
        "2019-04-21"
      ],
      "menu_seasons": [
        "spring"
      ],
      "meal_types": [
        "dinner"
      ],
      "sections": [],
      "source_hints": [],
      "item_texts": [
        "Egg salad and dill roasted potatoes"
      ],
      "count": 1,
      "main_protein": "unknown"
    },
    {
      "url": null,
      "urls": [],
      "link_texts": [],
      "menu_files": [
        "Menus/Menu week of 4-23-23.md"
      ],
      "menu_weeks": [
        "2023-04-23"
      ],
      "menu_seasons": [
        "spring"
      ],
      "meal_types": [
        "dinner"
      ],
      "sections": [],
      "source_hints": [],
      "item_texts": [
        "Roasted red pepper pasta with cauliflower (Pinch of Yum) - pasta sauce in freezer"
      ],
      "count": 1,
      "main_protein": "unknown"
    },
    {
      "url": null,
      "urls": [],
      "link_texts": [],
      "menu_files": [
        "Menus/Menu week of 4-3-21.md"
      ],
      "menu_weeks": [
        "2021-04-03"
      ],
      "menu_seasons": [
        "spring"
      ],
      "meal_types": [
        "dinner"
      ],
      "sections": [],
      "source_hints": [
        "make Saturday and refrigerate"
      ],
      "item_texts": [
        "Spring vegetable egg casserole (make Saturday and refrigerate)"
      ],
      "count": 1,
      "main_protein": "unknown"
    },
    {
      "url": null,
      "urls": [],
      "link_texts": [],
      "menu_files": [
        "Menus/Menu week of 4-3-21.md"
      ],
      "menu_weeks": [
        "2021-04-03"
      ],
      "menu_seasons": [
        "spring"
      ],
      "meal_types": [
        "dinner"
      ],
      "sections": [],
      "source_hints": [],
      "item_texts": [
        "Spring pasta salad with honey mustard dressing"
      ],
      "count": 1,
      "main_protein": "unknown"
    },
    {
      "url": null,
      "urls": [],
      "link_texts": [],
      "menu_files": [
        "Menus/Menu week of 4-3-21.md"
      ],
      "menu_weeks": [
        "2021-04-03"
      ],
      "menu_seasons": [
        "spring"
      ],
      "meal_types": [
        "lunch"
      ],
      "sections": [],
      "source_hints": [],
      "item_texts": [
        "Egg Salad Sandwiches",
        "Lunch: Egg Salad Sandwiches"
      ],
      "count": 1,
      "main_protein": "unknown"
    },
    {
      "url": null,
      "urls": [],
      "link_texts": [],
      "menu_files": [
        "Menus/Menu week of 4-4-24.md"
      ],
      "menu_weeks": [
        "2024-04-04"
      ],
      "menu_seasons": [
        "spring"
      ],
      "meal_types": [
        "dinner"
      ],
      "sections": [],
      "source_hints": [],
      "item_texts": [
        "Instant pot carnitas"
      ],
      "count": 1,
      "main_protein": "unknown"
    },
    {
      "url": null,
      "urls": [],
      "link_texts": [],
      "menu_files": [
        "Menus/Menu week of 4-5-23.md"
      ],
      "menu_weeks": [
        "2023-04-05"
      ],
      "menu_seasons": [
        "spring"
      ],
      "meal_types": [
        "dinner"
      ],
      "sections": [],
      "source_hints": [],
      "item_texts": [
        "Vegan mega burritos"
      ],
      "count": 1,
      "main_protein": "unknown"
    },
    {
      "url": null,
      "urls": [],
      "link_texts": [],
      "menu_files": [
        "Menus/Menu week of 4-5-23.md"
      ],
      "menu_weeks": [
        "2023-04-05"
      ],
      "menu_seasons": [
        "spring"
      ],
      "meal_types": [
        "dinner"
      ],
      "sections": [],
      "source_hints": [],
      "item_texts": [
        "Lemon Herb Pasta Salad"
      ],
      "count": 1,
      "main_protein": "unknown"
    },
    {
      "url": null,
      "urls": [],
      "link_texts": [],
      "menu_files": [
        "Menus/Menu week of 4-5-23.md"
      ],
      "menu_weeks": [
        "2023-04-05"
      ],
      "menu_seasons": [
        "spring"
      ],
      "meal_types": [
        "dinner"
      ],
      "sections": [],
      "source_hints": [],
      "item_texts": [
        "Basic + Awesome Chicken Quinoa salad"
      ],
      "count": 1,
      "main_protein": "unknown"
    },
    {
      "url": null,
      "urls": [],
      "link_texts": [],
      "menu_files": [
        "Menus/Menu week of 5-1-21.md"
      ],
      "menu_weeks": [
        "2021-05-01"
      ],
      "menu_seasons": [
        "spring"
      ],
      "meal_types": [
        "dinner"
      ],
      "sections": [],
      "source_hints": [
        "star tribune recipe"
      ],
      "item_texts": [
        "Soy-honey glazed Salmon sushi bowl (star tribune recipe)"
      ],
      "count": 1,
      "main_protein": "unknown"
    },
    {
      "url": null,
      "urls": [],
      "link_texts": [],
      "menu_files": [
        "Menus/Menu week of 5-1-24.md"
      ],
      "menu_weeks": [
        "2024-05-01"
      ],
      "menu_seasons": [
        "spring"
      ],
      "meal_types": [
        "dinner"
      ],
      "sections": [],
      "source_hints": [
        "Pinch of Yum"
      ],
      "item_texts": [
        "Marry me chicken with mashed potatoes and a side salad (Pinch of Yum)"
      ],
      "count": 1,
      "main_protein": "unknown"
    },
    {
      "url": null,
      "urls": [],
      "link_texts": [],
      "menu_files": [
        "Menus/Menu week of 5-1-24.md"
      ],
      "menu_weeks": [
        "2024-05-01"
      ],
      "menu_seasons": [
        "spring"
      ],
      "meal_types": [
        "dinner"
      ],
      "sections": [],
      "source_hints": [],
      "item_texts": [
        "Chickpea, date, and avocado salad with za\u2019atar vinaigrette (Gimme Some Oven) add feta"
      ],
      "count": 1,
      "main_protein": "unknown"
    },
    {
      "url": null,
      "urls": [],
      "link_texts": [],
      "menu_files": [
        "Menus/Menu week of 5-1-24.md"
      ],
      "menu_weeks": [
        "2024-05-01"
      ],
      "menu_seasons": [
        "spring"
      ],
      "meal_types": [
        "dinner"
      ],
      "sections": [],
      "source_hints": [
        "Pinch of Yum"
      ],
      "item_texts": [
        "Red chile toastadas with eggs (Pinch of Yum)"
      ],
      "count": 1,
      "main_protein": "unknown"
    },
    {
      "url": null,
      "urls": [],
      "link_texts": [],
      "menu_files": [
        "Menus/Menu week of 5-19-21.md"
      ],
      "menu_weeks": [
        "2021-05-19"
      ],
      "menu_seasons": [
        "spring"
      ],
      "meal_types": [
        "dinner"
      ],
      "sections": [],
      "source_hints": [],
      "item_texts": [
        "Baked oatmeal"
      ],
      "count": 1,
      "main_protein": "unknown"
    },
    {
      "url": null,
      "urls": [],
      "link_texts": [],
      "menu_files": [
        "Menus/Menu week of 5-21-23.md"
      ],
      "menu_weeks": [
        "2023-05-21"
      ],
      "menu_seasons": [
        "spring"
      ],
      "meal_types": [
        "dinner"
      ],
      "sections": [],
      "source_hints": [],
      "item_texts": [
        "Smash burgers, sweet potato fries, bagged salad"
      ],
      "count": 1,
      "main_protein": "unknown"
    },
    {
      "url": null,
      "urls": [],
      "link_texts": [],
      "menu_files": [
        "Menus/Menu week of 5-21-23.md"
      ],
      "menu_weeks": [
        "2023-05-21"
      ],
      "menu_seasons": [
        "spring"
      ],
      "meal_types": [
        "dinner"
      ],
      "sections": [],
      "source_hints": [],
      "item_texts": [
        "Cashew Crunch Salad with chickpeas"
      ],
      "count": 1,
      "main_protein": "unknown"
    },
    {
      "url": null,
      "urls": [],
      "link_texts": [],
      "menu_files": [
        "Menus/Menu week of 5-22-19.md"
      ],
      "menu_weeks": [
        "2019-05-22"
      ],
      "menu_seasons": [
        "spring"
      ],
      "meal_types": [
        "dinner"
      ],
      "sections": [],
      "source_hints": [],
      "item_texts": [
        "strawberry spinach salad"
      ],
      "count": 1,
      "main_protein": "unknown"
    },
    {
      "url": null,
      "urls": [],
      "link_texts": [],
      "menu_files": [
        "Menus/Menu week of 5-22-19.md"
      ],
      "menu_weeks": [
        "2019-05-22"
      ],
      "menu_seasons": [
        "spring"
      ],
      "meal_types": [
        "dinner"
      ],
      "sections": [],
      "source_hints": [],
      "item_texts": [
        "honey mustard grilled salmon with avocado basil sauce, summer cous cous salad"
      ],
      "count": 1,
      "main_protein": "unknown"
    },
    {
      "url": null,
      "urls": [],
      "link_texts": [],
      "menu_files": [
        "Menus/Menu week of 5-22-19.md"
      ],
      "menu_weeks": [
        "2019-05-22"
      ],
      "menu_seasons": [
        "spring"
      ],
      "meal_types": [
        "dinner"
      ],
      "sections": [],
      "source_hints": [],
      "item_texts": [
        "Bagel egg and cheese sandwiches"
      ],
      "count": 1,
      "main_protein": "unknown"
    },
    {
      "url": null,
      "urls": [],
      "link_texts": [],
      "menu_files": [
        "Menus/Menu week of 5-22-20.md"
      ],
      "menu_weeks": [
        "2020-05-22"
      ],
      "menu_seasons": [
        "spring"
      ],
      "meal_types": [
        "dinner"
      ],
      "sections": [],
      "source_hints": [],
      "item_texts": [
        "bucatini al la amatriciana"
      ],
      "count": 1,
      "main_protein": "unknown"
    },
    {
      "url": null,
      "urls": [],
      "link_texts": [],
      "menu_files": [
        "Menus/Menu week of 5-26-25.md"
      ],
      "menu_weeks": [
        "2025-05-26"
      ],
      "menu_seasons": [
        "spring"
      ],
      "meal_types": [
        "dinner"
      ],
      "sections": [],
      "source_hints": [],
      "item_texts": [
        "Frozen gyros and cucumber and hummus"
      ],
      "count": 1,
      "main_protein": "unknown"
    },
    {
      "url": null,
      "urls": [],
      "link_texts": [],
      "menu_files": [
        "Menus/Menu week of 5-6-19.md"
      ],
      "menu_weeks": [
        "2019-05-06"
      ],
      "menu_seasons": [
        "spring"
      ],
      "meal_types": [
        "dinner"
      ],
      "sections": [],
      "source_hints": [],
      "item_texts": [
        "Spinach strawberry salad with poppyseed dressing"
      ],
      "count": 1,
      "main_protein": "unknown"
    },
    {
      "url": null,
      "urls": [],
      "link_texts": [],
      "menu_files": [
        "Menus/Menu week of 5-6-19.md"
      ],
      "menu_weeks": [
        "2019-05-06"
      ],
      "menu_seasons": [
        "spring"
      ],
      "meal_types": [
        "dinner"
      ],
      "sections": [],
      "source_hints": [],
      "item_texts": [
        "Chicago dogs and roasted carrots"
      ],
      "count": 1,
      "main_protein": "unknown"
    },
    {
      "url": null,
      "urls": [],
      "link_texts": [],
      "menu_files": [
        "Menus/Menu week of 5-6-19.md"
      ],
      "menu_weeks": [
        "2019-05-06"
      ],
      "menu_seasons": [
        "spring"
      ],
      "meal_types": [
        "breakfast"
      ],
      "sections": [],
      "source_hints": [],
      "item_texts": [
        "Birthday breakfast: egg bacon bagel sandwich"
      ],
      "count": 1,
      "main_protein": "unknown"
    },
    {
      "url": null,
      "urls": [],
      "link_texts": [],
      "menu_files": [
        "Menus/Menu week of 5-7-20.md"
      ],
      "menu_weeks": [
        "2020-05-07"
      ],
      "menu_seasons": [
        "spring"
      ],
      "meal_types": [
        "dinner"
      ],
      "sections": [],
      "source_hints": [],
      "item_texts": [
        "Ribs, corn, cilantro lime cucumber salad"
      ],
      "count": 1,
      "main_protein": "unknown"
    },
    {
      "url": null,
      "urls": [],
      "link_texts": [],
      "menu_files": [
        "Menus/Menu week of 5-8-23.md"
      ],
      "menu_weeks": [
        "2023-05-08"
      ],
      "menu_seasons": [
        "spring"
      ],
      "meal_types": [
        "dinner"
      ],
      "sections": [],
      "source_hints": [
        "Pinch of yum"
      ],
      "item_texts": [
        "Coconut curry salmon (Pinch of yum)"
      ],
      "count": 1,
      "main_protein": "unknown"
    },
    {
      "url": null,
      "urls": [],
      "link_texts": [],
      "menu_files": [
        "Menus/Menu week of 5-8-23.md"
      ],
      "menu_weeks": [
        "2023-05-08"
      ],
      "menu_seasons": [
        "spring"
      ],
      "meal_types": [
        "dinner",
        "grill"
      ],
      "sections": [],
      "source_hints": [
        "pinch of yum"
      ],
      "item_texts": [
        "Smash burgers"
      ],
      "count": 1,
      "side_dish": [
        "bagged salad (pinch of yum)"
      ],
      "main_protein": "unknown"
    },
    {
      "url": null,
      "urls": [],
      "link_texts": [],
      "menu_files": [
        "Menus/Menu week of 5-8-23.md"
      ],
      "menu_weeks": [
        "2023-05-08"
      ],
      "menu_seasons": [
        "spring"
      ],
      "meal_types": [
        "dinner"
      ],
      "sections": [],
      "source_hints": [
        "pinch of yum"
      ],
      "item_texts": [
        "Chicken quinoa salad (pinch of yum)"
      ],
      "count": 1,
      "main_protein": "unknown"
    },
    {
      "url": null,
      "urls": [],
      "link_texts": [],
      "menu_files": [
        "Menus/Menu week of 6-1-21.md"
      ],
      "menu_weeks": [
        "2021-06-01"
      ],
      "menu_seasons": [
        "summer"
      ],
      "meal_types": [
        "dinner"
      ],
      "sections": [],
      "source_hints": [],
      "item_texts": [
        "Floating taco bowls with quick pico"
      ],
      "count": 1,
      "main_protein": "unknown"
    },
    {
      "url": null,
      "urls": [],
      "link_texts": [],
      "menu_files": [
        "Menus/Menu week of 6-1-21.md"
      ],
      "menu_weeks": [
        "2021-06-01"
      ],
      "menu_seasons": [
        "summer"
      ],
      "meal_types": [
        "dinner"
      ],
      "sections": [],
      "source_hints": [],
      "item_texts": [
        "Green pepper, onion, gnocchi"
      ],
      "count": 1,
      "main_protein": "unknown"
    },
    {
      "url": null,
      "urls": [],
      "link_texts": [],
      "menu_files": [
        "Menus/Menu week of 6-1-21.md"
      ],
      "menu_weeks": [
        "2021-06-01"
      ],
      "menu_seasons": [
        "summer"
      ],
      "meal_types": [
        "dinner"
      ],
      "sections": [],
      "source_hints": [],
      "item_texts": [
        "Strawberry crunch salad and baguette"
      ],
      "count": 1,
      "main_protein": "unknown"
    },
    {
      "url": null,
      "urls": [],
      "link_texts": [],
      "menu_files": [
        "Menus/Menu week of 6-1-22.md"
      ],
      "menu_weeks": [
        "2022-06-01"
      ],
      "menu_seasons": [
        "summer"
      ],
      "meal_types": [
        "dinner"
      ],
      "sections": [],
      "source_hints": [],
      "item_texts": [
        "Roasted cauliflower burrito bowls"
      ],
      "count": 1,
      "main_protein": "unknown"
    },
    {
      "url": null,
      "urls": [],
      "link_texts": [],
      "menu_files": [
        "Menus/Menu week of 6-10-18.md"
      ],
      "menu_weeks": [
        "2018-06-10"
      ],
      "menu_seasons": [
        "summer"
      ],
      "meal_types": [
        "dinner"
      ],
      "sections": [],
      "source_hints": [],
      "item_texts": [
        "Strawberry poppyseed salad",
        "Sunday: Strawberry poppyseed salad"
      ],
      "count": 1,
      "main_protein": "unknown"
    },
    {
      "url": null,
      "urls": [],
      "link_texts": [],
      "menu_files": [
        "Menus/Menu week of 6-13-25.md"
      ],
      "menu_weeks": [
        "2025-06-13"
      ],
      "menu_seasons": [
        "summer"
      ],
      "meal_types": [
        "dinner"
      ],
      "sections": [],
      "source_hints": [
        "cous cous, ground beef with greek spices, tzatziki, feta, cucumber, tomato, hummus, etc."
      ],
      "item_texts": [
        "Ground beef bowls (cous cous, ground beef with greek spices, tzatziki, feta, cucumber, tomato, hummus, etc.)"
      ],
      "count": 1,
      "main_protein": "unknown"
    },
    {
      "url": null,
      "urls": [],
      "link_texts": [],
      "menu_files": [
        "Menus/Menu week of 6-16-22.md"
      ],
      "menu_weeks": [
        "2022-06-16"
      ],
      "menu_seasons": [
        "summer"
      ],
      "meal_types": [
        "dinner"
      ],
      "sections": [],
      "source_hints": [],
      "item_texts": [
        "Cashew tofu and rice"
      ],
      "count": 1,
      "main_protein": "unknown"
    },
    {
      "url": null,
      "urls": [],
      "link_texts": [],
      "menu_files": [
        "Menus/Menu week of 6-16-22.md"
      ],
      "menu_weeks": [
        "2022-06-16"
      ],
      "menu_seasons": [
        "summer"
      ],
      "meal_types": [
        "dinner"
      ],
      "sections": [],
      "source_hints": [],
      "item_texts": [
        "Blackberry Pie Bars"
      ],
      "count": 1,
      "main_protein": "unknown"
    },
    {
      "url": null,
      "urls": [],
      "link_texts": [],
      "menu_files": [
        "Menus/Menu week of 6-19-20.md"
      ],
      "menu_weeks": [
        "2020-06-19"
      ],
      "menu_seasons": [
        "summer"
      ],
      "meal_types": [
        "dinner"
      ],
      "sections": [],
      "source_hints": [],
      "item_texts": [
        "Peruvian chicken, chips and guacamole"
      ],
      "count": 1,
      "main_protein": "unknown"
    },
    {
      "url": null,
      "urls": [],
      "link_texts": [],
      "menu_files": [
        "Menus/Menu week of 6-19-20.md"
      ],
      "menu_weeks": [
        "2020-06-19"
      ],
      "menu_seasons": [
        "summer"
      ],
      "meal_types": [
        "dinner"
      ],
      "sections": [],
      "source_hints": [],
      "item_texts": [
        "Bahn mi (make pickled diakon/carrots) - grill pork"
      ],
      "count": 1,
      "main_protein": "unknown"
    },
    {
      "url": null,
      "urls": [],
      "link_texts": [],
      "menu_files": [
        "Menus/Menu week of 6-19-20.md"
      ],
      "menu_weeks": [
        "2020-06-19"
      ],
      "menu_seasons": [
        "summer"
      ],
      "meal_types": [
        "dinner"
      ],
      "sections": [],
      "source_hints": [
        "Monday"
      ],
      "item_texts": [
        "Panzanilla salad (Monday)"
      ],
      "count": 1,
      "main_protein": "unknown"
    },
    {
      "url": null,
      "urls": [],
      "link_texts": [],
      "menu_files": [
        "Menus/Menu week of 6-19-20.md"
      ],
      "menu_weeks": [
        "2020-06-19"
      ],
      "menu_seasons": [
        "summer"
      ],
      "meal_types": [
        "dinner"
      ],
      "sections": [],
      "source_hints": [],
      "item_texts": [
        "Chard and eggs"
      ],
      "count": 1,
      "main_protein": "unknown"
    },
    {
      "url": null,
      "urls": [],
      "link_texts": [],
      "menu_files": [
        "Menus/Menu week of 6-19-20.md"
      ],
      "menu_weeks": [
        "2020-06-19"
      ],
      "menu_seasons": [
        "summer"
      ],
      "meal_types": [
        "dinner"
      ],
      "sections": [],
      "source_hints": [
        "use avocados!"
      ],
      "item_texts": [
        "Quesadillas (use avocados!)"
      ],
      "count": 1,
      "main_protein": "unknown"
    },
    {
      "url": null,
      "urls": [],
      "link_texts": [],
      "menu_files": [
        "Menus/Menu week of 6-29-18.md"
      ],
      "menu_weeks": [
        "2018-06-29"
      ],
      "menu_seasons": [
        "summer"
      ],
      "meal_types": [
        "lunch"
      ],
      "sections": [],
      "source_hints": [],
      "item_texts": [
        "Surly; lunch: blts",
        "Sunday: Surly; lunch: blts"
      ],
      "count": 1,
      "main_protein": "unknown"
    },
    {
      "url": null,
      "urls": [],
      "link_texts": [],
      "menu_files": [
        "Menus/Menu week of 6-29-18.md"
      ],
      "menu_weeks": [
        "2018-06-29"
      ],
      "menu_seasons": [
        "summer"
      ],
      "meal_types": [
        "dinner"
      ],
      "sections": [],
      "source_hints": [],
      "item_texts": [
        "red quinoa and black bean salad with avocado",
        "Monday: red quinoa and black bean salad with avocado"
      ],
      "count": 1,
      "main_protein": "unknown"
    },
    {
      "url": null,
      "urls": [],
      "link_texts": [],
      "menu_files": [
        "Menus/Menu week of 6-3-18.md"
      ],
      "menu_weeks": [
        "2018-06-03"
      ],
      "menu_seasons": [
        "summer"
      ],
      "meal_types": [
        "dinner"
      ],
      "sections": [],
      "source_hints": [],
      "item_texts": [
        "lemon chicken asparagus and cous cous",
        "Thursday: lemon chicken asparagus and cous cous"
      ],
      "count": 1,
      "main_protein": "unknown"
    },
    {
      "url": null,
      "urls": [],
      "link_texts": [],
      "menu_files": [
        "Menus/Menu week of 6-3-2020.md"
      ],
      "menu_weeks": [
        "2020-06-03"
      ],
      "menu_seasons": [
        "summer"
      ],
      "meal_types": [
        "dinner"
      ],
      "sections": [],
      "source_hints": [
        "crock pot"
      ],
      "item_texts": [
        "Lemon Chicken and rice soup - Taste of home (crock pot)"
      ],
      "count": 1,
      "main_protein": "unknown"
    },
    {
      "url": null,
      "urls": [],
      "link_texts": [],
      "menu_files": [
        "Menus/Menu week of 6-3-2020.md"
      ],
      "menu_weeks": [
        "2020-06-03"
      ],
      "menu_seasons": [
        "summer"
      ],
      "meal_types": [
        "dinner"
      ],
      "sections": [],
      "source_hints": [
        "double - make with white rice"
      ],
      "item_texts": [
        "Kale fried rice (double - make with white rice)"
      ],
      "count": 1,
      "main_protein": "unknown"
    },
    {
      "url": null,
      "urls": [],
      "link_texts": [],
      "menu_files": [
        "Menus/Menu week of 6-3-2020.md"
      ],
      "menu_weeks": [
        "2020-06-03"
      ],
      "menu_seasons": [
        "summer"
      ],
      "meal_types": [
        "breakfast"
      ],
      "sections": [],
      "source_hints": [],
      "item_texts": [
        "Weekend breakfast: eggs, bacon"
      ],
      "count": 1,
      "main_protein": "unknown"
    },
    {
      "url": null,
      "urls": [],
      "link_texts": [],
      "menu_files": [
        "Menus/Menu week of 6-5-23.md"
      ],
      "menu_weeks": [
        "2023-06-05"
      ],
      "menu_seasons": [
        "summer"
      ],
      "meal_types": [
        "dinner"
      ],
      "sections": [],
      "source_hints": [],
      "item_texts": [
        "Salmon, asparagus potatoes"
      ],
      "count": 1,
      "main_protein": "unknown"
    },
    {
      "url": null,
      "urls": [],
      "link_texts": [],
      "menu_files": [
        "Menus/Menu week of 7-1-24.md"
      ],
      "menu_weeks": [
        "2024-07-01"
      ],
      "menu_seasons": [
        "summer"
      ],
      "meal_types": [
        "dinner"
      ],
      "sections": [],
      "source_hints": [],
      "item_texts": [
        "Radish Bean salad"
      ],
      "count": 1,
      "main_protein": "unknown"
    },
    {
      "url": null,
      "urls": [],
      "link_texts": [],
      "menu_files": [
        "Menus/Menu week of 7-12-20.md"
      ],
      "menu_weeks": [
        "2020-07-12"
      ],
      "menu_seasons": [
        "summer"
      ],
      "meal_types": [
        "dinner"
      ],
      "sections": [],
      "source_hints": [],
      "item_texts": [
        "Roasted garlic pasta with burst cherry tomatoes"
      ],
      "count": 1,
      "main_protein": "unknown"
    },
    {
      "url": null,
      "urls": [],
      "link_texts": [],
      "menu_files": [
        "Menus/Menu week of 7-12-20.md"
      ],
      "menu_weeks": [
        "2020-07-12"
      ],
      "menu_seasons": [
        "summer"
      ],
      "meal_types": [
        "dinner"
      ],
      "sections": [],
      "source_hints": [
        "cucumber salad, zucchini and squash"
      ],
      "item_texts": [
        "Carmelized onion smash burgers, whatever vegetables are left (cucumber salad, zucchini and squash)"
      ],
      "count": 1,
      "main_protein": "unknown"
    },
    {
      "url": null,
      "urls": [],
      "link_texts": [],
      "menu_files": [
        "Menus/Menu week of 7-2-20 (vacation).md"
      ],
      "menu_weeks": [
        "2020-07-02"
      ],
      "menu_seasons": [
        "summer"
      ],
      "meal_types": [
        "breakfast"
      ],
      "sections": [
        "Breakfast"
      ],
      "source_hints": [],
      "item_texts": [
        "Granola, yogurt, berries"
      ],
      "count": 1,
      "main_protein": "unknown"
    },
    {
      "url": null,
      "urls": [],
      "link_texts": [],
      "menu_files": [
        "Menus/Menu week of 7-2-20 (vacation).md"
      ],
      "menu_weeks": [
        "2020-07-02"
      ],
      "menu_seasons": [
        "summer"
      ],
      "meal_types": [
        "lunch"
      ],
      "sections": [
        "Lunches"
      ],
      "source_hints": [
        "make ahead and bring - keep dressing separate"
      ],
      "item_texts": [
        "Vegetarian Italian chop salad (make ahead and bring - keep dressing separate)"
      ],
      "count": 1,
      "main_protein": "unknown"
    },
    {
      "url": null,
      "urls": [],
      "link_texts": [],
      "menu_files": [
        "Menus/Menu week of 7-2-20 (vacation).md"
      ],
      "menu_weeks": [
        "2020-07-02"
      ],
      "menu_seasons": [
        "summer"
      ],
      "meal_types": [
        "lunch"
      ],
      "sections": [
        "Lunches"
      ],
      "source_hints": [],
      "item_texts": [
        "Lunchmeat sandwiches, chips, cherries"
      ],
      "count": 1,
      "main_protein": "unknown"
    },
    {
      "url": null,
      "urls": [],
      "link_texts": [],
      "menu_files": [
        "Menus/Menu week of 7-2-20 (vacation).md"
      ],
      "menu_weeks": [
        "2020-07-02"
      ],
      "menu_seasons": [
        "summer"
      ],
      "meal_types": [
        "dinner"
      ],
      "sections": [
        "Dinner"
      ],
      "source_hints": [
        "maybe same night as charcuterie"
      ],
      "item_texts": [
        "5-ingredient pesto pasta salad (maybe same night as charcuterie)"
      ],
      "count": 1,
      "main_protein": "unknown"
    },
    {
      "url": null,
      "urls": [],
      "link_texts": [],
      "menu_files": [
        "Menus/Menu week of 7-2-20 (vacation).md"
      ],
      "menu_weeks": [
        "2020-07-02"
      ],
      "menu_seasons": [
        "summer"
      ],
      "meal_types": [
        "snack"
      ],
      "sections": [
        "Snacks"
      ],
      "source_hints": [],
      "item_texts": [
        "Trail mix"
      ],
      "count": 1,
      "main_protein": "unknown"
    },
    {
      "url": null,
      "urls": [],
      "link_texts": [],
      "menu_files": [
        "Menus/Menu week of 7-2-20 (vacation).md"
      ],
      "menu_weeks": [
        "2020-07-02"
      ],
      "menu_seasons": [
        "summer"
      ],
      "meal_types": [
        "snack"
      ],
      "sections": [
        "Snacks"
      ],
      "source_hints": [],
      "item_texts": [
        "Peanut butter pretzel bites"
      ],
      "count": 1,
      "main_protein": "unknown"
    },
    {
      "url": null,
      "urls": [],
      "link_texts": [],
      "menu_files": [
        "Menus/Menu week of 7-20-17.md"
      ],
      "menu_weeks": [
        "2017-07-20"
      ],
      "menu_seasons": [
        "summer"
      ],
      "meal_types": [
        "dinner"
      ],
      "sections": [],
      "source_hints": [],
      "item_texts": [
        "Potato salmon cakes with garlic and chive Greek yogurt sauce and side salad with beets and goat cheese"
      ],
      "count": 1,
      "main_protein": "unknown"
    },
    {
      "url": null,
      "urls": [],
      "link_texts": [],
      "menu_files": [
        "Menus/Menu week of 7-20-17.md"
      ],
      "menu_weeks": [
        "2017-07-20"
      ],
      "menu_seasons": [
        "summer"
      ],
      "meal_types": [
        "dinner"
      ],
      "sections": [],
      "source_hints": [],
      "item_texts": [
        "Spring roll bowls with tofu"
      ],
      "count": 1,
      "main_protein": "unknown"
    },
    {
      "url": null,
      "urls": [],
      "link_texts": [],
      "menu_files": [
        "Menus/Menu week of 7-20-17.md"
      ],
      "menu_weeks": [
        "2017-07-20"
      ],
      "menu_seasons": [
        "summer"
      ],
      "meal_types": [
        "dinner"
      ],
      "sections": [],
      "source_hints": [
        "and zucchini if any leftover"
      ],
      "item_texts": [
        "Garlic scape pesto and gnocchi (and zucchini if any leftover)"
      ],
      "count": 1,
      "main_protein": "unknown"
    },
    {
      "url": null,
      "urls": [],
      "link_texts": [],
      "menu_files": [
        "Menus/Menu week of 7-21-19.md"
      ],
      "menu_weeks": [
        "2019-07-21"
      ],
      "menu_seasons": [
        "summer"
      ],
      "meal_types": [
        "dinner"
      ],
      "sections": [],
      "source_hints": [],
      "item_texts": [
        "honey mustard salmon, bagged costco salad",
        "grilled honey mustard salmon, bagged costco salad"
      ],
      "count": 1,
      "main_protein": "unknown"
    },
    {
      "url": null,
      "urls": [],
      "link_texts": [],
      "menu_files": [
        "Menus/Menu week of 7-21-19.md"
      ],
      "menu_weeks": [
        "2019-07-21"
      ],
      "menu_seasons": [
        "summer"
      ],
      "meal_types": [
        "lunch"
      ],
      "sections": [],
      "source_hints": [],
      "item_texts": [
        "caprese grilled cheese",
        "Lunch: caprese grilled cheese"
      ],
      "count": 1,
      "main_protein": "unknown"
    },
    {
      "url": null,
      "urls": [],
      "link_texts": [],
      "menu_files": [
        "Menus/Menu week of 7-21-19.md"
      ],
      "menu_weeks": [
        "2019-07-21"
      ],
      "menu_seasons": [
        "summer"
      ],
      "meal_types": [
        "breakfast"
      ],
      "sections": [],
      "source_hints": [],
      "item_texts": [
        "steel cut oats, potatoes, eggs, bacon, etc.",
        "Breakfast: steel cut oats, potatoes, eggs, bacon, etc."
      ],
      "count": 1,
      "main_protein": "unknown"
    },
    {
      "url": null,
      "urls": [],
      "link_texts": [],
      "menu_files": [
        "Menus/Menu week of 7-23-23.md"
      ],
      "menu_weeks": [
        "2023-07-23"
      ],
      "menu_seasons": [
        "summer"
      ],
      "meal_types": [
        "dinner"
      ],
      "sections": [],
      "source_hints": [],
      "item_texts": [
        "Chicken nuggets/strips (frozen) and roasted broccoli"
      ],
      "count": 1,
      "main_protein": "unknown"
    },
    {
      "url": null,
      "urls": [],
      "link_texts": [],
      "menu_files": [
        "Menus/Menu week of 7-23-23.md"
      ],
      "menu_weeks": [
        "2023-07-23"
      ],
      "menu_seasons": [
        "summer"
      ],
      "meal_types": [
        "dinner"
      ],
      "sections": [],
      "source_hints": [
        "Well Plated"
      ],
      "item_texts": [
        "Sheet pan sausage and peppers (Well Plated)"
      ],
      "count": 1,
      "main_protein": "unknown"
    },
    {
      "url": null,
      "urls": [],
      "link_texts": [],
      "menu_files": [
        "Menus/Menu week of 7-25-24.md"
      ],
      "menu_weeks": [
        "2024-07-25"
      ],
      "menu_seasons": [
        "summer"
      ],
      "meal_types": [
        "dinner"
      ],
      "sections": [],
      "source_hints": [],
      "item_texts": [
        "banana cupcakes"
      ],
      "count": 1,
      "main_protein": "unknown"
    },
    {
      "url": null,
      "urls": [],
      "link_texts": [],
      "menu_files": [
        "Menus/Menu week of 7-5-19.md"
      ],
      "menu_weeks": [
        "2019-07-05"
      ],
      "menu_seasons": [
        "summer"
      ],
      "meal_types": [
        "dinner",
        "grill"
      ],
      "sections": [],
      "source_hints": [],
      "item_texts": [
        "Cook out - \u201cskewers\u201d - caprese salad, cowboy caviar, peppers, onion, zucchini/squash, brats",
        "Saturday: Cook out - \u201cskewers\u201d - caprese salad, cowboy caviar, peppers, onion, zucchini/squash, brats"
      ],
      "count": 1,
      "side_dish": [
        "\u201cbrats\u201d"
      ],
      "main_protein": "unknown"
    },
    {
      "url": null,
      "urls": [],
      "link_texts": [],
      "menu_files": [
        "Menus/Menu week of 7-5-19.md"
      ],
      "menu_weeks": [
        "2019-07-05"
      ],
      "menu_seasons": [
        "summer"
      ],
      "meal_types": [
        "dinner"
      ],
      "sections": [],
      "source_hints": [],
      "item_texts": [
        "Stir fry noodles and tofu/spinach"
      ],
      "count": 1,
      "main_protein": "unknown"
    },
    {
      "url": null,
      "urls": [],
      "link_texts": [],
      "menu_files": [
        "Menus/Menu week of 7-5-25.md"
      ],
      "menu_weeks": [
        "2025-07-05"
      ],
      "menu_seasons": [
        "summer"
      ],
      "meal_types": [
        "dinner"
      ],
      "sections": [],
      "source_hints": [],
      "item_texts": [
        "Chicken nuggets, air fryer broccoli, sweet potato fries"
      ],
      "count": 1,
      "main_protein": "unknown"
    },
    {
      "url": null,
      "urls": [],
      "link_texts": [],
      "menu_files": [
        "Menus/Menu week of 7-8-17.md"
      ],
      "menu_weeks": [
        "2017-07-08"
      ],
      "menu_seasons": [
        "summer"
      ],
      "meal_types": [
        "dinner"
      ],
      "sections": [],
      "source_hints": [],
      "item_texts": [
        "Garlic scape beef satay with grilled zucchini"
      ],
      "count": 1,
      "main_protein": "unknown"
    },
    {
      "url": null,
      "urls": [],
      "link_texts": [],
      "menu_files": [
        "Menus/Menu week of 7-8-17.md"
      ],
      "menu_weeks": [
        "2017-07-08"
      ],
      "menu_seasons": [
        "summer"
      ],
      "meal_types": [
        "lunch"
      ],
      "sections": [],
      "source_hints": [
        "lunch"
      ],
      "item_texts": [
        "Kale fried rice (lunch)"
      ],
      "count": 1,
      "main_protein": "unknown"
    },
    {
      "url": null,
      "urls": [],
      "link_texts": [],
      "menu_files": [
        "Menus/Menu week of 7-8-22.md"
      ],
      "menu_weeks": [
        "2022-07-08"
      ],
      "menu_seasons": [
        "summer"
      ],
      "meal_types": [
        "dinner"
      ],
      "sections": [],
      "source_hints": [],
      "item_texts": [
        "Strawberry and gorgonzola salad with poppy seed dressing (Skinnytaste) and Amelia\u2019s bread"
      ],
      "count": 1,
      "main_protein": "unknown"
    },
    {
      "url": null,
      "urls": [],
      "link_texts": [],
      "menu_files": [
        "Menus/Menu week of 7-8-23.md"
      ],
      "menu_weeks": [
        "2023-07-08"
      ],
      "menu_seasons": [
        "summer"
      ],
      "meal_types": [
        "dinner"
      ],
      "sections": [],
      "source_hints": [
        "Pinch of Yum"
      ],
      "item_texts": [
        "Salmon with Basil sauce and tomato salad (Pinch of Yum)"
      ],
      "count": 1,
      "main_protein": "unknown"
    },
    {
      "url": null,
      "urls": [],
      "link_texts": [],
      "menu_files": [
        "Menus/Menu week of 7-8-23.md"
      ],
      "menu_weeks": [
        "2023-07-08"
      ],
      "menu_seasons": [
        "summer"
      ],
      "meal_types": [
        "dinner"
      ],
      "sections": [],
      "source_hints": [
        "Pinch of Yum"
      ],
      "item_texts": [
        "The Best Easy Pasta Salad (Pinch of Yum)"
      ],
      "count": 1,
      "main_protein": "unknown"
    },
    {
      "url": null,
      "urls": [],
      "link_texts": [],
      "menu_files": [
        "Menus/Menu week of 7-9-18.md"
      ],
      "menu_weeks": [
        "2018-07-09"
      ],
      "menu_seasons": [
        "summer"
      ],
      "meal_types": [
        "dinner"
      ],
      "sections": [],
      "source_hints": [],
      "item_texts": [
        "Pasta with meat sauce",
        "Monday: Pasta with meat sauce"
      ],
      "count": 1,
      "main_protein": "unknown"
    },
    {
      "url": null,
      "urls": [],
      "link_texts": [],
      "menu_files": [
        "Menus/Menu week of 7-9-18.md"
      ],
      "menu_weeks": [
        "2018-07-09"
      ],
      "menu_seasons": [
        "summer"
      ],
      "meal_types": [
        "dinner"
      ],
      "sections": [],
      "source_hints": [],
      "item_texts": [
        "Detoux Moroccan spiced chickpea glow bowl x2 for Anna and David",
        "Thursday: Detoux Moroccan spiced chickpea glow bowl x2 for Anna and David"
      ],
      "count": 1,
      "main_protein": "unknown"
    },
    {
      "url": null,
      "urls": [],
      "link_texts": [],
      "menu_files": [
        "Menus/Menu week of 7-9-18.md"
      ],
      "menu_weeks": [
        "2018-07-09"
      ],
      "menu_seasons": [
        "summer"
      ],
      "meal_types": [
        "dinner"
      ],
      "sections": [],
      "source_hints": [],
      "item_texts": [
        "Sunday morning: bacon, potato, egg casserole, banana bread"
      ],
      "count": 1,
      "main_protein": "unknown"
    },
    {
      "url": null,
      "urls": [],
      "link_texts": [],
      "menu_files": [
        "Menus/Menu week of 8-1-19.md"
      ],
      "menu_weeks": [
        "2019-08-01"
      ],
      "menu_seasons": [
        "summer"
      ],
      "meal_types": [
        "dinner"
      ],
      "sections": [],
      "source_hints": [
        "halve recipe"
      ],
      "item_texts": [
        "Peruvian-style green chicken with green sauce, corn salad with chili and lime (halve recipe)"
      ],
      "count": 1,
      "main_protein": "unknown"
    },
    {
      "url": null,
      "urls": [],
      "link_texts": [],
      "menu_files": [
        "Menus/Menu week of 8-1-19.md"
      ],
      "menu_weeks": [
        "2019-08-01"
      ],
      "menu_seasons": [
        "summer"
      ],
      "meal_types": [
        "breakfast"
      ],
      "sections": [],
      "source_hints": [],
      "item_texts": [
        "Sunday breakfast: eggs, potatoes, bacon"
      ],
      "count": 1,
      "main_protein": "unknown"
    },
    {
      "url": null,
      "urls": [],
      "link_texts": [],
      "menu_files": [
        "Menus/Menu week of 8-1-20.md"
      ],
      "menu_weeks": [
        "2020-08-01"
      ],
      "menu_seasons": [
        "summer"
      ],
      "meal_types": [
        "dinner"
      ],
      "sections": [],
      "source_hints": [],
      "item_texts": [
        "Peruvian chicken, beans or summer squash"
      ],
      "count": 1,
      "main_protein": "unknown"
    },
    {
      "url": null,
      "urls": [],
      "link_texts": [],
      "menu_files": [
        "Menus/Menu week of 8-1-22.md"
      ],
      "menu_weeks": [
        "2022-08-01"
      ],
      "menu_seasons": [
        "summer"
      ],
      "meal_types": [
        "dinner"
      ],
      "sections": [],
      "source_hints": [],
      "item_texts": [
        "Skirt steak and poblano tacos"
      ],
      "count": 1,
      "main_protein": "unknown"
    },
    {
      "url": null,
      "urls": [],
      "link_texts": [],
      "menu_files": [
        "Menus/Menu week of 8-1-22.md"
      ],
      "menu_weeks": [
        "2022-08-01"
      ],
      "menu_seasons": [
        "summer"
      ],
      "meal_types": [
        "dinner"
      ],
      "sections": [],
      "source_hints": [
        "Gimme some oven"
      ],
      "item_texts": [
        "Instant Pot carnitas (Gimme some oven)"
      ],
      "count": 1,
      "main_protein": "unknown"
    },
    {
      "url": null,
      "urls": [],
      "link_texts": [],
      "menu_files": [
        "Menus/Menu week of 8-1-22.md"
      ],
      "menu_weeks": [
        "2022-08-01"
      ],
      "menu_seasons": [
        "summer"
      ],
      "meal_types": [
        "dinner"
      ],
      "sections": [],
      "source_hints": [
        "how sweet eats"
      ],
      "item_texts": [
        "Summer skillet gnocchi (how sweet eats)"
      ],
      "count": 1,
      "main_protein": "unknown"
    },
    {
      "url": null,
      "urls": [],
      "link_texts": [],
      "menu_files": [
        "Menus/Menu week of 8-1-22.md"
      ],
      "menu_weeks": [
        "2022-08-01"
      ],
      "menu_seasons": [
        "summer"
      ],
      "meal_types": [
        "dinner"
      ],
      "sections": [],
      "source_hints": [
        "gimme some oven"
      ],
      "item_texts": [
        "Cashew chicken and broccoli (gimme some oven)"
      ],
      "count": 1,
      "main_protein": "unknown"
    },
    {
      "url": null,
      "urls": [],
      "link_texts": [],
      "menu_files": [
        "Menus/Menu week of 8-12-18.md"
      ],
      "menu_weeks": [
        "2018-08-12"
      ],
      "menu_seasons": [
        "summer"
      ],
      "meal_types": [
        "lunch"
      ],
      "sections": [],
      "source_hints": [],
      "item_texts": [
        "caprese bites",
        "Lunch: caprese bites"
      ],
      "count": 1,
      "main_protein": "unknown"
    },
    {
      "url": null,
      "urls": [],
      "link_texts": [],
      "menu_files": [
        "Menus/Menu week of 8-12-18.md"
      ],
      "menu_weeks": [
        "2018-08-12"
      ],
      "menu_seasons": [
        "summer"
      ],
      "meal_types": [
        "dinner"
      ],
      "sections": [],
      "source_hints": [],
      "item_texts": [
        "Sean bday: blackberry pie"
      ],
      "count": 1,
      "main_protein": "unknown"
    },
    {
      "url": null,
      "urls": [],
      "link_texts": [],
      "menu_files": [
        "Menus/Menu week of 8-12-18.md"
      ],
      "menu_weeks": [
        "2018-08-12"
      ],
      "menu_seasons": [
        "summer"
      ],
      "meal_types": [
        "dinner"
      ],
      "sections": [],
      "source_hints": [],
      "item_texts": [
        "5 ingredient lemon chicken and green beans"
      ],
      "count": 1,
      "main_protein": "unknown"
    },
    {
      "url": null,
      "urls": [],
      "link_texts": [],
      "menu_files": [
        "Menus/Menu week of 8-12-18.md"
      ],
      "menu_weeks": [
        "2018-08-12"
      ],
      "menu_seasons": [
        "summer"
      ],
      "meal_types": [
        "dinner"
      ],
      "sections": [],
      "source_hints": [],
      "item_texts": [
        "Roasted eggplant lasagna (pg 163 Love Real Food)"
      ],
      "count": 1,
      "main_protein": "unknown"
    },
    {
      "url": null,
      "urls": [],
      "link_texts": [],
      "menu_files": [
        "Menus/Menu week of 8-12-20.md"
      ],
      "menu_weeks": [
        "2020-08-12"
      ],
      "menu_seasons": [
        "summer"
      ],
      "meal_types": [
        "dinner"
      ],
      "sections": [],
      "source_hints": [],
      "item_texts": [
        "Gnocchi and summer squash and peppers"
      ],
      "count": 1,
      "main_protein": "unknown"
    },
    {
      "url": null,
      "urls": [],
      "link_texts": [],
      "menu_files": [
        "Menus/Menu week of 8-12-20.md"
      ],
      "menu_weeks": [
        "2020-08-12"
      ],
      "menu_seasons": [
        "summer"
      ],
      "meal_types": [
        "dinner"
      ],
      "sections": [],
      "source_hints": [],
      "item_texts": [
        "Blueberry pie"
      ],
      "count": 1,
      "main_protein": "unknown"
    },
    {
      "url": null,
      "urls": [],
      "link_texts": [],
      "menu_files": [
        "Menus/Menu week of 8-17-19.md"
      ],
      "menu_weeks": [
        "2019-08-17"
      ],
      "menu_seasons": [
        "summer"
      ],
      "meal_types": [
        "dinner"
      ],
      "sections": [],
      "source_hints": [],
      "item_texts": [
        "Israeli cous cous salad"
      ],
      "count": 1,
      "main_protein": "unknown"
    },
    {
      "url": null,
      "urls": [],
      "link_texts": [],
      "menu_files": [
        "Menus/Menu week of 8-17-19.md"
      ],
      "menu_weeks": [
        "2019-08-17"
      ],
      "menu_seasons": [
        "summer"
      ],
      "meal_types": [
        "dinner"
      ],
      "sections": [],
      "source_hints": [],
      "item_texts": [
        "Bucatini Americiana"
      ],
      "count": 1,
      "main_protein": "unknown"
    },
    {
      "url": null,
      "urls": [],
      "link_texts": [],
      "menu_files": [
        "Menus/Menu week of 8-18-24.md"
      ],
      "menu_weeks": [
        "2024-08-18"
      ],
      "menu_seasons": [
        "summer"
      ],
      "meal_types": [
        "dinner"
      ],
      "sections": [],
      "source_hints": [],
      "item_texts": [
        "White people tacos add some random ass peppers from csa"
      ],
      "count": 1,
      "main_protein": "unknown"
    },
    {
      "url": null,
      "urls": [],
      "link_texts": [],
      "menu_files": [
        "Menus/Menu week of 8-18-24.md"
      ],
      "menu_weeks": [
        "2024-08-18"
      ],
      "menu_seasons": [
        "summer"
      ],
      "meal_types": [
        "dinner"
      ],
      "sections": [],
      "source_hints": [],
      "item_texts": [
        "poblano and banana peppers"
      ],
      "count": 1,
      "main_protein": "unknown"
    },
    {
      "url": null,
      "urls": [],
      "link_texts": [],
      "menu_files": [
        "Menus/Menu week of 8-20-23.md"
      ],
      "menu_weeks": [
        "2023-08-20"
      ],
      "menu_seasons": [
        "summer"
      ],
      "meal_types": [
        "dinner"
      ],
      "sections": [],
      "source_hints": [],
      "item_texts": [
        "Zucchini and squash"
      ],
      "count": 1,
      "main_protein": "unknown"
    },
    {
      "url": null,
      "urls": [],
      "link_texts": [],
      "menu_files": [
        "Menus/Menu week of 8-22-18.md"
      ],
      "menu_weeks": [
        "2018-08-22"
      ],
      "menu_seasons": [
        "summer"
      ],
      "meal_types": [
        "dinner"
      ],
      "sections": [],
      "source_hints": [],
      "item_texts": [
        "Fajitas with skirt steak"
      ],
      "count": 1,
      "main_protein": "unknown"
    },
    {
      "url": null,
      "urls": [],
      "link_texts": [],
      "menu_files": [
        "Menus/Menu week of 8-22-18.md"
      ],
      "menu_weeks": [
        "2018-08-22"
      ],
      "menu_seasons": [
        "summer"
      ],
      "meal_types": [
        "dinner"
      ],
      "sections": [],
      "source_hints": [],
      "item_texts": [
        "Bachelor dinner: tilapia and peas and rice"
      ],
      "count": 1,
      "main_protein": "unknown"
    },
    {
      "url": null,
      "urls": [],
      "link_texts": [],
      "menu_files": [
        "Menus/Menu week of 8-22-18.md"
      ],
      "menu_weeks": [
        "2018-08-22"
      ],
      "menu_seasons": [
        "summer"
      ],
      "meal_types": [
        "dinner"
      ],
      "sections": [],
      "source_hints": [],
      "item_texts": [
        "Greek chicken sheet pan dinner (skinnytaste f&s p.158) with house salad"
      ],
      "count": 1,
      "main_protein": "unknown"
    },
    {
      "url": null,
      "urls": [],
      "link_texts": [],
      "menu_files": [
        "Menus/Menu week of 8-22-18.md"
      ],
      "menu_weeks": [
        "2018-08-22"
      ],
      "menu_seasons": [
        "summer"
      ],
      "meal_types": [
        "dinner"
      ],
      "sections": [],
      "source_hints": [],
      "item_texts": [
        "Zucchini applesauce muffins"
      ],
      "count": 1,
      "main_protein": "unknown"
    },
    {
      "url": null,
      "urls": [],
      "link_texts": [],
      "menu_files": [
        "Menus/Menu week of 8-22-18.md"
      ],
      "menu_weeks": [
        "2018-08-22"
      ],
      "menu_seasons": [
        "summer"
      ],
      "meal_types": [
        "dinner"
      ],
      "sections": [],
      "source_hints": [],
      "item_texts": [
        "Tomatillo salsa"
      ],
      "count": 1,
      "main_protein": "unknown"
    },
    {
      "url": null,
      "urls": [],
      "link_texts": [],
      "menu_files": [
        "Menus/Menu week of 8-22-22.md"
      ],
      "menu_weeks": [
        "2022-08-22"
      ],
      "menu_seasons": [
        "summer"
      ],
      "meal_types": [
        "dinner"
      ],
      "sections": [],
      "source_hints": [
        "Gimme Some Oven"
      ],
      "item_texts": [
        "Sesame chicken salad (Gimme Some Oven)"
      ],
      "count": 1,
      "main_protein": "unknown"
    },
    {
      "url": null,
      "urls": [],
      "link_texts": [],
      "menu_files": [
        "Menus/Menu week of 8-23-17.md"
      ],
      "menu_weeks": [
        "2017-08-23"
      ],
      "menu_seasons": [
        "summer"
      ],
      "meal_types": [
        "dinner"
      ],
      "sections": [],
      "source_hints": [],
      "item_texts": [
        "Bandh gobhi matar and rice"
      ],
      "count": 1,
      "main_protein": "unknown"
    },
    {
      "url": null,
      "urls": [],
      "link_texts": [],
      "menu_files": [
        "Menus/Menu week of 8-26-20.md"
      ],
      "menu_weeks": [
        "2020-08-26"
      ],
      "menu_seasons": [
        "summer"
      ],
      "meal_types": [
        "dinner"
      ],
      "sections": [],
      "source_hints": [],
      "item_texts": [
        "Baked quesadillas"
      ],
      "count": 1,
      "main_protein": "unknown"
    },
    {
      "url": null,
      "urls": [],
      "link_texts": [],
      "menu_files": [
        "Menus/Menu week of 8-26-20.md"
      ],
      "menu_weeks": [
        "2020-08-26"
      ],
      "menu_seasons": [
        "summer"
      ],
      "meal_types": [
        "lunch"
      ],
      "sections": [],
      "source_hints": [],
      "item_texts": [
        "BLTs or caprese panini",
        "Lunch: BLTs or caprese panini"
      ],
      "count": 1,
      "main_protein": "unknown"
    },
    {
      "url": null,
      "urls": [],
      "link_texts": [],
      "menu_files": [
        "Menus/Menu week of 8-26-20.md"
      ],
      "menu_weeks": [
        "2020-08-26"
      ],
      "menu_seasons": [
        "summer"
      ],
      "meal_types": [
        "dinner"
      ],
      "sections": [],
      "source_hints": [],
      "item_texts": [
        "Socca with Whipped Feta and Tomato Salad"
      ],
      "count": 1,
      "main_protein": "unknown"
    },
    {
      "url": null,
      "urls": [],
      "link_texts": [],
      "menu_files": [
        "Menus/Menu week of 8-26-20.md"
      ],
      "menu_weeks": [
        "2020-08-26"
      ],
      "menu_seasons": [
        "summer"
      ],
      "meal_types": [
        "dinner"
      ],
      "sections": [],
      "source_hints": [
        "okra, cabbage, red pepper, squash"
      ],
      "item_texts": [
        "Stir fry noodles and chicken (okra, cabbage, red pepper, squash)"
      ],
      "count": 1,
      "main_protein": "unknown"
    },
    {
      "url": null,
      "urls": [],
      "link_texts": [],
      "menu_files": [
        "Menus/Menu week of 8-3-23.md"
      ],
      "menu_weeks": [
        "2023-08-03"
      ],
      "menu_seasons": [
        "summer"
      ],
      "meal_types": [
        "dinner"
      ],
      "sections": [],
      "source_hints": [
        "How Sweet Eats"
      ],
      "item_texts": [
        "Panzanella with Marinated chickpeas and chimichurri (How Sweet Eats)"
      ],
      "count": 1,
      "main_protein": "unknown"
    },
    {
      "url": null,
      "urls": [],
      "link_texts": [],
      "menu_files": [
        "Menus/Menu week of 8-3-23.md"
      ],
      "menu_weeks": [
        "2023-08-03"
      ],
      "menu_seasons": [
        "summer"
      ],
      "meal_types": [
        "dinner"
      ],
      "sections": [],
      "source_hints": [],
      "item_texts": [
        "Skillet lasagna (America\u2019s test Kitchen) and bagged salad"
      ],
      "count": 1,
      "main_protein": "unknown"
    },
    {
      "url": null,
      "urls": [],
      "link_texts": [],
      "menu_files": [
        "Menus/Menu week of 8-5-17.md"
      ],
      "menu_weeks": [
        "2017-08-05"
      ],
      "menu_seasons": [
        "summer"
      ],
      "meal_types": [
        "breakfast"
      ],
      "sections": [],
      "source_hints": [],
      "item_texts": [
        "Sunday SJW brunch: easy cinnamon rolls, spring vegetable egg casserole"
      ],
      "count": 1,
      "main_protein": "unknown"
    },
    {
      "url": null,
      "urls": [],
      "link_texts": [],
      "menu_files": [
        "Menus/Menu week of 9-1-19.md"
      ],
      "menu_weeks": [
        "2019-09-01"
      ],
      "menu_seasons": [
        "fall"
      ],
      "meal_types": [
        "dinner"
      ],
      "sections": [],
      "source_hints": [],
      "item_texts": [
        "gnocchi, zucchini, sauce made with tomatoes"
      ],
      "count": 1,
      "main_protein": "unknown"
    },
    {
      "url": null,
      "urls": [],
      "link_texts": [],
      "menu_files": [
        "Menus/Menu week of 9-1-19.md"
      ],
      "menu_weeks": [
        "2019-09-01"
      ],
      "menu_seasons": [
        "fall"
      ],
      "meal_types": [
        "dinner"
      ],
      "sections": [],
      "source_hints": [],
      "item_texts": [
        "Caprese Skillet Lasagna"
      ],
      "count": 1,
      "main_protein": "unknown"
    },
    {
      "url": null,
      "urls": [],
      "link_texts": [],
      "menu_files": [
        "Menus/Menu week of 9-1-21.md"
      ],
      "menu_weeks": [
        "2021-09-01"
      ],
      "menu_seasons": [
        "fall"
      ],
      "meal_types": [
        "dinner"
      ],
      "sections": [],
      "source_hints": [],
      "item_texts": [
        "Bachelor: Italian sausage, saut\u00e9 banana peppers, onions, frozen or fresh tomatoes, pasta, any other leftover appropriate vegetables"
      ],
      "count": 1,
      "main_protein": "unknown"
    },
    {
      "url": null,
      "urls": [],
      "link_texts": [],
      "menu_files": [
        "Menus/Menu week of 9-1-21.md"
      ],
      "menu_weeks": [
        "2021-09-01"
      ],
      "menu_seasons": [
        "fall"
      ],
      "meal_types": [
        "dinner"
      ],
      "sections": [],
      "source_hints": [],
      "item_texts": [
        "Frozen Lasagna and bagged salad"
      ],
      "count": 1,
      "main_protein": "unknown"
    },
    {
      "url": null,
      "urls": [],
      "link_texts": [],
      "menu_files": [
        "Menus/Menu week of 9-1-21.md"
      ],
      "menu_weeks": [
        "2021-09-01"
      ],
      "menu_seasons": [
        "fall"
      ],
      "meal_types": [
        "dinner"
      ],
      "sections": [],
      "source_hints": [],
      "item_texts": [
        "Mexican casserole"
      ],
      "count": 1,
      "main_protein": "unknown"
    },
    {
      "url": null,
      "urls": [],
      "link_texts": [],
      "menu_files": [
        "Menus/Menu week of 9-1-22.md"
      ],
      "menu_weeks": [
        "2022-09-01"
      ],
      "menu_seasons": [
        "fall"
      ],
      "meal_types": [
        "dinner"
      ],
      "sections": [],
      "source_hints": [],
      "item_texts": [
        "Corn, avocado, and quinoa salad"
      ],
      "count": 1,
      "main_protein": "unknown"
    },
    {
      "url": null,
      "urls": [],
      "link_texts": [],
      "menu_files": [
        "Menus/Menu week of 9-1-22.md"
      ],
      "menu_weeks": [
        "2022-09-01"
      ],
      "menu_seasons": [
        "fall"
      ],
      "meal_types": [
        "dinner"
      ],
      "sections": [],
      "source_hints": [],
      "item_texts": [
        "BBQ ribs and corn"
      ],
      "count": 1,
      "main_protein": "unknown"
    },
    {
      "url": null,
      "urls": [],
      "link_texts": [],
      "menu_files": [
        "Menus/Menu week of 9-1-22.md"
      ],
      "menu_weeks": [
        "2022-09-01"
      ],
      "menu_seasons": [
        "fall"
      ],
      "meal_types": [
        "dinner"
      ],
      "sections": [],
      "source_hints": [],
      "item_texts": [
        "Chipotle tahini bowls"
      ],
      "count": 1,
      "main_protein": "unknown"
    },
    {
      "url": null,
      "urls": [],
      "link_texts": [],
      "menu_files": [
        "Menus/Menu week of 9-1-22.md"
      ],
      "menu_weeks": [
        "2022-09-01"
      ],
      "menu_seasons": [
        "fall"
      ],
      "meal_types": [
        "dinner"
      ],
      "sections": [],
      "source_hints": [
        "Well Plated"
      ],
      "item_texts": [
        "Sweet potato black bean quesadillas (Well Plated)"
      ],
      "count": 1,
      "main_protein": "unknown"
    },
    {
      "url": null,
      "urls": [],
      "link_texts": [],
      "menu_files": [
        "Menus/Menu week of 9-1-24.md"
      ],
      "menu_weeks": [
        "2024-09-01"
      ],
      "menu_seasons": [
        "fall"
      ],
      "meal_types": [
        "dinner"
      ],
      "sections": [],
      "source_hints": [
        "Christine\u2019s recipe"
      ],
      "item_texts": [
        "Moussaka (Christine\u2019s recipe)"
      ],
      "count": 1,
      "main_protein": "unknown"
    },
    {
      "url": null,
      "urls": [],
      "link_texts": [],
      "menu_files": [
        "Menus/Menu week of 9-10-25.md"
      ],
      "menu_weeks": [
        "2025-09-10"
      ],
      "menu_seasons": [
        "fall"
      ],
      "meal_types": [
        "dinner"
      ],
      "sections": [],
      "source_hints": [
        "dough will be in freezer"
      ],
      "item_texts": [
        "Trader Joe\u2019s pizzas (dough will be in freezer)"
      ],
      "count": 1,
      "main_protein": "unknown"
    },
    {
      "url": null,
      "urls": [],
      "link_texts": [],
      "menu_files": [
        "Menus/Menu week of 9-10-25.md"
      ],
      "menu_weeks": [
        "2025-09-10"
      ],
      "menu_seasons": [
        "fall"
      ],
      "meal_types": [
        "dinner"
      ],
      "sections": [],
      "source_hints": [],
      "item_texts": [
        "BLTs and tomato soup"
      ],
      "count": 1,
      "main_protein": "unknown"
    },
    {
      "url": null,
      "urls": [],
      "link_texts": [],
      "menu_files": [
        "Menus/Menu week of 9-15-22.md"
      ],
      "menu_weeks": [
        "2022-09-15"
      ],
      "menu_seasons": [
        "fall"
      ],
      "meal_types": [
        "dinner"
      ],
      "sections": [],
      "source_hints": [],
      "item_texts": [
        "Couscous salad with lime basil vinaigrette"
      ],
      "count": 1,
      "main_protein": "unknown"
    },
    {
      "url": null,
      "urls": [],
      "link_texts": [],
      "menu_files": [
        "Menus/Menu week of 9-17-19.md"
      ],
      "menu_weeks": [
        "2019-09-17"
      ],
      "menu_seasons": [
        "fall"
      ],
      "meal_types": [
        "dinner"
      ],
      "sections": [],
      "source_hints": [],
      "item_texts": [
        "Enchiladas with poblano peppers and leftover pork"
      ],
      "count": 1,
      "main_protein": "unknown"
    },
    {
      "url": null,
      "urls": [],
      "link_texts": [],
      "menu_files": [
        "Menus/Menu week of 9-17-19.md"
      ],
      "menu_weeks": [
        "2019-09-17"
      ],
      "menu_seasons": [
        "fall"
      ],
      "meal_types": [
        "dinner"
      ],
      "sections": [],
      "source_hints": [],
      "item_texts": [
        "Chicago dogs and sweet potato fries"
      ],
      "count": 1,
      "main_protein": "unknown"
    },
    {
      "url": null,
      "urls": [],
      "link_texts": [],
      "menu_files": [
        "Menus/Menu week of 9-17-19.md"
      ],
      "menu_weeks": [
        "2019-09-17"
      ],
      "menu_seasons": [
        "fall"
      ],
      "meal_types": [
        "dinner"
      ],
      "sections": [],
      "source_hints": [],
      "item_texts": [
        "Weekend: Make pesto"
      ],
      "count": 1,
      "main_protein": "unknown"
    },
    {
      "url": null,
      "urls": [],
      "link_texts": [],
      "menu_files": [
        "Menus/Menu week of 9-17-20.md"
      ],
      "menu_weeks": [
        "2020-09-17"
      ],
      "menu_seasons": [
        "fall"
      ],
      "meal_types": [
        "dinner"
      ],
      "sections": [],
      "source_hints": [],
      "item_texts": [
        "Ratatouille Baked Chicken"
      ],
      "count": 1,
      "main_protein": "unknown"
    },
    {
      "url": null,
      "urls": [],
      "link_texts": [],
      "menu_files": [
        "Menus/Menu week of 9-17-20.md"
      ],
      "menu_weeks": [
        "2020-09-17"
      ],
      "menu_seasons": [
        "fall"
      ],
      "meal_types": [
        "dinner"
      ],
      "sections": [],
      "source_hints": [],
      "item_texts": [
        "Peanut soba noodles"
      ],
      "count": 1,
      "main_protein": "unknown"
    },
    {
      "url": null,
      "urls": [],
      "link_texts": [],
      "menu_files": [
        "Menus/Menu week of 9-2-23.md"
      ],
      "menu_weeks": [
        "2023-09-02"
      ],
      "menu_seasons": [
        "fall"
      ],
      "meal_types": [
        "drink"
      ],
      "sections": [],
      "source_hints": [],
      "item_texts": [
        "Drink: Cucumber agua fresca"
      ],
      "count": 1,
      "main_protein": "unknown"
    },
    {
      "url": null,
      "urls": [],
      "link_texts": [],
      "menu_files": [
        "Menus/Menu week of 9-2-23.md"
      ],
      "menu_weeks": [
        "2023-09-02"
      ],
      "menu_seasons": [
        "fall"
      ],
      "meal_types": [
        "lunch"
      ],
      "sections": [],
      "source_hints": [],
      "item_texts": [
        "caprese sandwiches and BLTs",
        "Lunch: caprese sandwiches and BLTs"
      ],
      "count": 1,
      "main_protein": "unknown"
    },
    {
      "url": null,
      "urls": [],
      "link_texts": [],
      "menu_files": [
        "Menus/Menu week of 9-2-23.md"
      ],
      "menu_weeks": [
        "2023-09-02"
      ],
      "menu_seasons": [
        "fall"
      ],
      "meal_types": [
        "dinner"
      ],
      "sections": [],
      "source_hints": [],
      "item_texts": [
        "Flank steak tacos and roasted corn (use bread salad chimichurri recipe/leftovers) - Two Peas and their Pod - Grill or saute a pepper to go with",
        "Grilled Flank steak tacos and roasted corn (use bread salad chimichurri recipe/leftovers) - Two Peas and their Pod - Grill or saute a pepper to go with"
      ],
      "count": 1,
      "main_protein": "unknown"
    },
    {
      "url": null,
      "urls": [],
      "link_texts": [],
      "menu_files": [
        "Menus/Menu week of 9-2-23.md"
      ],
      "menu_weeks": [
        "2023-09-02"
      ],
      "menu_seasons": [
        "fall"
      ],
      "meal_types": [
        "dinner"
      ],
      "sections": [],
      "source_hints": [
        "Wednesday or later"
      ],
      "item_texts": [
        "Bread salad (Wednesday or later)"
      ],
      "count": 1,
      "main_protein": "unknown"
    },
    {
      "url": null,
      "urls": [],
      "link_texts": [],
      "menu_files": [
        "Menus/Menu week of 9-21-25.md"
      ],
      "menu_weeks": [
        "2025-09-21"
      ],
      "menu_seasons": [
        "fall"
      ],
      "meal_types": [
        "dinner"
      ],
      "sections": [],
      "source_hints": [],
      "item_texts": [
        "Crock pot chili"
      ],
      "count": 1,
      "main_protein": "unknown"
    },
    {
      "url": null,
      "urls": [],
      "link_texts": [],
      "menu_files": [
        "Menus/Menu week of 9-21-25.md"
      ],
      "menu_weeks": [
        "2025-09-21"
      ],
      "menu_seasons": [
        "fall"
      ],
      "meal_types": [
        "dinner"
      ],
      "sections": [],
      "source_hints": [],
      "item_texts": [
        "Homemade spaghetti sauce and pasta"
      ],
      "count": 1,
      "main_protein": "unknown"
    },
    {
      "url": null,
      "urls": [],
      "link_texts": [],
      "menu_files": [
        "Menus/Menu week of 9-22-18.md"
      ],
      "menu_weeks": [
        "2018-09-22"
      ],
      "menu_seasons": [
        "fall"
      ],
      "meal_types": [
        "dinner"
      ],
      "sections": [],
      "source_hints": [],
      "item_texts": [
        "Mushroom poblano posole verde"
      ],
      "count": 1,
      "main_protein": "unknown"
    },
    {
      "url": null,
      "urls": [],
      "link_texts": [],
      "menu_files": [
        "Menus/Menu week of 9-22-18.md"
      ],
      "menu_weeks": [
        "2018-09-22"
      ],
      "menu_seasons": [
        "fall"
      ],
      "meal_types": [
        "dinner"
      ],
      "sections": [],
      "source_hints": [],
      "item_texts": [
        "Slow cooker apple crisp and ice cream"
      ],
      "count": 1,
      "main_protein": "unknown"
    },
    {
      "url": null,
      "urls": [],
      "link_texts": [],
      "menu_files": [
        "Menus/Menu week of 9-22-18.md"
      ],
      "menu_weeks": [
        "2018-09-22"
      ],
      "menu_seasons": [
        "fall"
      ],
      "meal_types": [
        "dinner"
      ],
      "sections": [],
      "source_hints": [],
      "item_texts": [
        "Autumn green salad and rolls"
      ],
      "count": 1,
      "main_protein": "unknown"
    },
    {
      "url": null,
      "urls": [],
      "link_texts": [],
      "menu_files": [
        "Menus/Menu week of 9-22-18.md"
      ],
      "menu_weeks": [
        "2018-09-22"
      ],
      "menu_seasons": [
        "fall"
      ],
      "meal_types": [
        "dinner"
      ],
      "sections": [],
      "source_hints": [],
      "item_texts": [
        "Cookie and Kate favorite quinoa salad"
      ],
      "count": 1,
      "main_protein": "unknown"
    },
    {
      "url": null,
      "urls": [],
      "link_texts": [],
      "menu_files": [
        "Menus/Menu week of 9-22-18.md"
      ],
      "menu_weeks": [
        "2018-09-22"
      ],
      "menu_seasons": [
        "fall"
      ],
      "meal_types": [
        "dinner"
      ],
      "sections": [],
      "source_hints": [],
      "item_texts": [
        "Spaghetti squash, pasta sauce, italiana sausage"
      ],
      "count": 1,
      "main_protein": "unknown"
    },
    {
      "url": null,
      "urls": [],
      "link_texts": [],
      "menu_files": [
        "Menus/Menu week of 9-22-18.md"
      ],
      "menu_weeks": [
        "2018-09-22"
      ],
      "menu_seasons": [
        "fall"
      ],
      "meal_types": [
        "dinner"
      ],
      "sections": [],
      "source_hints": [],
      "item_texts": [
        "Smoked salmon arugula bagel sandwiches"
      ],
      "count": 1,
      "main_protein": "unknown"
    },
    {
      "url": null,
      "urls": [],
      "link_texts": [],
      "menu_files": [
        "Menus/Menu week of 9-6-18.md"
      ],
      "menu_weeks": [
        "2018-09-06"
      ],
      "menu_seasons": [
        "fall"
      ],
      "meal_types": [
        "dinner"
      ],
      "sections": [],
      "source_hints": [],
      "item_texts": [
        "Roasted tomato caprese saladx2"
      ],
      "count": 1,
      "main_protein": "unknown"
    },
    {
      "url": null,
      "urls": [],
      "link_texts": [],
      "menu_files": [
        "Menus/Menu week of 9-6-18.md"
      ],
      "menu_weeks": [
        "2018-09-06"
      ],
      "menu_seasons": [
        "fall"
      ],
      "meal_types": [
        "dinner"
      ],
      "sections": [],
      "source_hints": [],
      "item_texts": [
        "Crockpot Italian beef sandwiches, roasted broccoli"
      ],
      "count": 1,
      "main_protein": "unknown"
    },
    {
      "url": null,
      "urls": [],
      "link_texts": [],
      "menu_files": [
        "Menus/Menu week of 9-6-18.md"
      ],
      "menu_weeks": [
        "2018-09-06"
      ],
      "menu_seasons": [
        "fall"
      ],
      "meal_types": [
        "lunch"
      ],
      "sections": [],
      "source_hints": [
        "double for lunches"
      ],
      "item_texts": [
        "Mexican quinoa with lazy guac (double for lunches)"
      ],
      "count": 1,
      "main_protein": "unknown"
    },
    {
      "url": null,
      "urls": [],
      "link_texts": [],
      "menu_files": [
        "Menus/Menu week of 9-6-18.md"
      ],
      "menu_weeks": [
        "2018-09-06"
      ],
      "menu_seasons": [
        "fall"
      ],
      "meal_types": [
        "dinner"
      ],
      "sections": [],
      "source_hints": [],
      "item_texts": [
        "Honey glazed pork tenderloin with roasted grapes (seriously delish p.206), house salad"
      ],
      "count": 1,
      "main_protein": "unknown"
    },
    {
      "url": null,
      "urls": [],
      "link_texts": [],
      "menu_files": [
        "Menus/Menu week of 9-6-20.md"
      ],
      "menu_weeks": [
        "2020-09-06"
      ],
      "menu_seasons": [
        "fall"
      ],
      "meal_types": [
        "dinner"
      ],
      "sections": [],
      "source_hints": [],
      "item_texts": [
        "Pesto Pasta with summer squash, peppers, baby tomatoes"
      ],
      "count": 1,
      "main_protein": "unknown"
    },
    {
      "url": null,
      "urls": [],
      "link_texts": [],
      "menu_files": [
        "Menus/Menu week of 9-6-20.md"
      ],
      "menu_weeks": [
        "2020-09-06"
      ],
      "menu_seasons": [
        "fall"
      ],
      "meal_types": [
        "lunch"
      ],
      "sections": [],
      "source_hints": [],
      "item_texts": [
        "BLTs with cucumber salad",
        "Lunch: BLTs with cucumber salad"
      ],
      "count": 1,
      "main_protein": "unknown"
    },
    {
      "url": null,
      "urls": [],
      "link_texts": [],
      "menu_files": [
        "Menus/Menu week of 9-6-20.md"
      ],
      "menu_weeks": [
        "2020-09-06"
      ],
      "menu_seasons": [
        "fall"
      ],
      "meal_types": [
        "dinner"
      ],
      "sections": [],
      "source_hints": [],
      "item_texts": [
        "Ribs, fresh green bean salad with balsamic dressing, sauteed summer squash"
      ],
      "count": 1,
      "main_protein": "unknown"
    },
    {
      "url": null,
      "urls": [],
      "link_texts": [],
      "menu_files": [
        "Menus/Menu week of 9-6-20.md"
      ],
      "menu_weeks": [
        "2020-09-06"
      ],
      "menu_seasons": [
        "fall"
      ],
      "meal_types": [
        "dinner"
      ],
      "sections": [],
      "source_hints": [
        "make sauce"
      ],
      "item_texts": [
        "Pizza (make sauce)"
      ],
      "count": 1,
      "main_protein": "unknown"
    },
    {
      "url": null,
      "urls": [],
      "link_texts": [],
      "menu_files": [
        "Menus/Menu week of 9-8-17.md"
      ],
      "menu_weeks": [
        "2017-09-08"
      ],
      "menu_seasons": [
        "fall"
      ],
      "meal_types": [
        "dinner"
      ],
      "sections": [],
      "source_hints": [],
      "item_texts": [
        "Smoked salmon bagels and cream cheese"
      ],
      "count": 1,
      "main_protein": "unknown"
    },
    {
      "url": null,
      "urls": [],
      "link_texts": [],
      "menu_files": [
        "Menus/Menu week of Thanksgiving.md"
      ],
      "menu_weeks": [],
      "menu_seasons": [
        "unknown"
      ],
      "meal_types": [
        "dinner"
      ],
      "sections": [],
      "source_hints": [],
      "item_texts": [
        "Honey mustard chicken chopped salad",
        "Monday: Honey mustard chicken chopped salad"
      ],
      "count": 1,
      "main_protein": "unknown"
    },
    {
      "url": null,
      "urls": [],
      "link_texts": [],
      "menu_files": [
        "Menus/Menu week of Thanksgiving.md"
      ],
      "menu_weeks": [],
      "menu_seasons": [
        "unknown"
      ],
      "meal_types": [
        "dinner"
      ],
      "sections": [],
      "source_hints": [],
      "item_texts": [
        "Pecan sweet potatoes"
      ],
      "count": 1,
      "main_protein": "unknown"
    },
    {
      "url": null,
      "urls": [],
      "link_texts": [],
      "menu_files": [
        "Menus/Menu week of Thanksgiving.md"
      ],
      "menu_weeks": [],
      "menu_seasons": [
        "unknown"
      ],
      "meal_types": [
        "dinner"
      ],
      "sections": [],
      "source_hints": [],
      "item_texts": [
        "Mashed potatoes (add butter-cooked leeks) & gravy"
      ],
      "count": 1,
      "main_protein": "unknown"
    },
    {
      "url": null,
      "urls": [],
      "link_texts": [],
      "menu_files": [
        "Menus/Menu week of Thanksgiving.md"
      ],
      "menu_weeks": [],
      "menu_seasons": [
        "unknown"
      ],
      "meal_types": [
        "dinner"
      ],
      "sections": [],
      "source_hints": [],
      "item_texts": [
        "Roasted chicken"
      ],
      "count": 1,
      "main_protein": "unknown"
    },
    {
      "url": null,
      "urls": [],
      "link_texts": [],
      "menu_files": [
        "Menus/Menu\u0301 week of 12-28-18.md"
      ],
      "menu_weeks": [
        "2018-12-28"
      ],
      "menu_seasons": [
        "winter"
      ],
      "meal_types": [
        "dinner"
      ],
      "sections": [],
      "source_hints": [],
      "item_texts": [
        "slow cooker cozy autumn wild rice soup, baguette",
        "Sunday: slow cooker cozy autumn wild rice soup, baguette"
      ],
      "count": 1,
      "main_protein": "unknown"
    },
    {
      "url": null,
      "urls": [],
      "link_texts": [],
      "menu_files": [
        "Menus/Sean Bachelor.md"
      ],
      "menu_weeks": [],
      "menu_seasons": [
        "unknown"
      ],
      "meal_types": [
        "dinner"
      ],
      "sections": [],
      "source_hints": [],
      "item_texts": [
        "Tilapia bachelor style"
      ],
      "count": 1,
      "main_protein": "unknown"
    },
    {
      "url": null,
      "urls": [],
      "link_texts": [],
      "menu_files": [
        "Menus/Sean Bachelor.md"
      ],
      "menu_weeks": [],
      "menu_seasons": [
        "unknown"
      ],
      "meal_types": [
        "dinner"
      ],
      "sections": [],
      "source_hints": [],
      "item_texts": [
        "Lemon chicken thighs and asparagus"
      ],
      "count": 1,
      "main_protein": "unknown"
    },
    {
      "url": null,
      "urls": [],
      "link_texts": [],
      "menu_files": [
        "Menus/Super Bowl menu.md"
      ],
      "menu_weeks": [],
      "menu_seasons": [
        "unknown"
      ],
      "meal_types": [
        "dinner"
      ],
      "sections": [],
      "source_hints": [],
      "item_texts": [
        "Vegan queso and chips"
      ],
      "count": 1,
      "main_protein": "unknown"
    },
    {
      "url": null,
      "urls": [],
      "link_texts": [],
      "menu_files": [
        "Menus/Super Bowl menu.md"
      ],
      "menu_weeks": [],
      "menu_seasons": [
        "unknown"
      ],
      "meal_types": [
        "dinner"
      ],
      "sections": [],
      "source_hints": [],
      "item_texts": [
        "Pumpkin chocolate chip bread"
      ],
      "count": 1,
      "main_protein": "unknown"
    },
    {
      "url": null,
      "urls": [],
      "link_texts": [],
      "menu_files": [
        "Menus/Week of 12-14-22.md"
      ],
      "menu_weeks": [
        "2022-12-14"
      ],
      "menu_seasons": [
        "winter"
      ],
      "meal_types": [
        "dinner"
      ],
      "sections": [],
      "source_hints": [],
      "item_texts": [
        "Quick and easy spiced chickpea bowls"
      ],
      "count": 1,
      "main_protein": "unknown"
    },
    {
      "url": null,
      "urls": [],
      "link_texts": [],
      "menu_files": [
        "Menus/Week of 7-14-25.md"
      ],
      "menu_weeks": [
        "2025-07-14"
      ],
      "menu_seasons": [
        "summer"
      ],
      "meal_types": [
        "dinner"
      ],
      "sections": [],
      "source_hints": [
        "can also add green beans if extra"
      ],
      "item_texts": [
        "Frozen orange chicken and broccoli (can also add green beans if extra)"
      ],
      "count": 1,
      "main_protein": "unknown"
    },
    {
      "url": null,
      "urls": [],
      "link_texts": [],
      "menu_files": [
        "Menus/Week of 7-27-25.md"
      ],
      "menu_weeks": [
        "2025-07-27"
      ],
      "menu_seasons": [
        "summer"
      ],
      "meal_types": [
        "dinner"
      ],
      "sections": [],
      "source_hints": [],
      "item_texts": [
        "Bachelor pasta: noodles, leftover zucchini, ground beef, sauce in fridge, ricotta in fridge"
      ],
      "count": 1,
      "main_protein": "unknown"
    },
    {
      "url": "https://bakerbynature.com/garlicky-tomato-basil-pasta-salad/",
      "urls": [
        "https://bakerbynature.com/garlicky-tomato-basil-pasta-salad/"
      ],
      "link_texts": [
        "Garlicky Tomato Basil Pasta Salad"
      ],
      "menu_files": [
        "Menus/Menu week of 9-10-25.md"
      ],
      "menu_weeks": [
        "2025-09-10"
      ],
      "menu_seasons": [
        "fall"
      ],
      "meal_types": [
        "dinner"
      ],
      "sections": [],
      "source_hints": [
        "https://bakerbynature.com/garlicky-tomato-basil-pasta-salad/"
      ],
      "item_texts": [
        "Tomato basil pasta salad"
      ],
      "count": 1,
      "ingredients": [
        "1/2 cup fresh basil loosely packed",
        "3 cloves garlic minced",
        "3/4 cup olive oil",
        "1/4 cup fresh lemon juice",
        "1 and 1/2 Tablespoons red wine vinegar",
        "2 teaspoons granulated sugar",
        "3/4 teaspoon salt",
        "1/2 teaspoon crushed red pepper flakes OR freshly ground black pepper",
        "1 pound farfalle pasta",
        "1 pint cherry tomatoes cut in half",
        "1/2 cup red onion thinly sliced",
        "1 12 ounce container marinated mozzarella balls removed from oil",
        "1/3 cup fresh basil loosely packed, thinly sliced"
      ],
      "recipe_tags": [
        "Pasta",
        "Pasta Salad",
        "Recipes",
        "Savory",
        "Side Dishes",
        "Summer Recipes"
      ],
      "main_protein": "vegetarian"
    },
    {
      "url": "https://cooking.nytimes.com/recipes/1018355-roasted-japanese-eggplant-with-crushed-tomato-pecorino-and-thyme",
      "urls": [
        "https://cooking.nytimes.com/recipes/1018355-roasted-japanese-eggplant-with-crushed-tomato-pecorino-and-thyme"
      ],
      "link_texts": [
        "1018355 Roasted Japanese Eggplant With Crushed Tomato Pecorino And Thyme"
      ],
      "menu_files": [
        "Menus/Menu week of 7-14-24.md"
      ],
      "menu_weeks": [
        "2024-07-14"
      ],
      "menu_seasons": [
        "summer"
      ],
      "meal_types": [
        "dinner"
      ],
      "sections": [],
      "source_hints": [],
      "item_texts": [
        "Roasted Japanese eggplant with crushed tomato, pecorino, and thyme"
      ],
      "count": 1,
      "main_protein": "unknown"
    },
    {
      "url": "https://damndelicious.net/2014/01/03/bbq-chicken-salad/",
      "urls": [
        "https://damndelicious.net/2014/01/03/bbq-chicken-salad/"
      ],
      "link_texts": [
        "Bbq Chicken Salad"
      ],
      "menu_files": [
        "Menus/Menu week of 5-15-25.md"
      ],
      "menu_weeks": [
        "2025-05-15"
      ],
      "menu_seasons": [
        "spring"
      ],
      "meal_types": [
        "dinner"
      ],
      "sections": [],
      "source_hints": [],
      "item_texts": [
        "BBQ chicken salad"
      ],
      "count": 1,
      "ingredients": [
        "1 1/2 pounds boneless, skinless chicken thighs, cut into 1-inch chunks",
        "2 tablespoons vegetable oil, divided",
        "2 teaspoons BBQ seasoning",
        "Kosher salt and freshly ground black pepper, to taste",
        "1/2 cup BBQ sauce",
        "2 ears corn, husks and silk removed",
        "1 head romaine, shredded",
        "1 1/2 cups cherry tomatoes, halved",
        "1 cup canned black beans, rinsed and drained",
        "1 avocado, halved, seeded, peeled and diced",
        "1/2 cup diced red onion",
        "1 cup shredded sharp cheddar cheese",
        "Homemade ranch dressing"
      ],
      "recipe_tags": [],
      "main_protein": "chicken"
    },
    {
      "url": "https://freshaprilflours.com/baked-turkey-cheese-sliders/",
      "urls": [
        "https://freshaprilflours.com/baked-turkey-cheese-sliders/"
      ],
      "link_texts": [
        "Baked Turkey Cheese Sliders"
      ],
      "menu_files": [
        "Menus/Menu week of 3-12-25.md"
      ],
      "menu_weeks": [
        "2025-03-12"
      ],
      "menu_seasons": [
        "spring"
      ],
      "meal_types": [
        "dinner"
      ],
      "sections": [],
      "source_hints": [
        "https://freshaprilflours.com/baked-turkey-cheese-sliders/"
      ],
      "item_texts": [
        "Turkey and cheese sliders with salad"
      ],
      "count": 1,
      "ingredients": [
        "1/4 cup (57g) unsalted butter melted",
        "1 Tablespoon (14g) Dijon mustard",
        "1 teaspoon honey",
        "1/2 Tablespoon Worcestershire sauce",
        "2 teaspoons poppy seeds",
        "1 teaspoon dried minced onion",
        "12 slider rolls",
        "2 Tablespoons (29g) mayonnaise",
        "3/4 to 1 pound (340-454g) sliced turkey",
        "12 slices thinly sliced cheese"
      ],
      "recipe_tags": [],
      "main_protein": "turkey"
    },
    {
      "url": "https://jordosworld.com/chicken-bacon-ranch-casserole/",
      "urls": [
        "https://jordosworld.com/chicken-bacon-ranch-casserole/"
      ],
      "link_texts": [
        "Chicken Bacon Ranch Casserole"
      ],
      "menu_files": [
        "Menus/Menu week of 5-15-25.md"
      ],
      "menu_weeks": [
        "2025-05-15"
      ],
      "menu_seasons": [
        "spring"
      ],
      "meal_types": [
        "dinner"
      ],
      "sections": [],
      "source_hints": [
        "https://jordosworld.com/chicken-bacon-ranch-casserole/"
      ],
      "item_texts": [
        "Chicken bacon ranch casserole add broccoli:"
      ],
      "count": 1,
      "ingredients": [
        "8 oz box of Banza Penne Pasta (16 oz cooked)",
        "1.5 lbs shredded chicken cooked",
        "1/2 cup plain greek yogurt",
        "3 tablespoon packet ranch seasoning mix (or one packet)",
        "1/3 cup unsweetened almond milk",
        "1 cup low fat mozzarella cheese",
        "6 pieces bacon cooked",
        "Optional: chopped green onions hot sauce"
      ],
      "recipe_tags": [],
      "main_protein": "pork"
    },
    {
      "url": "https://juliasalbum.com/chicken-with-zucchini-and-corn/",
      "urls": [
        "https://juliasalbum.com/chicken-with-zucchini-and-corn/"
      ],
      "link_texts": [
        "Chicken With Zucchini And Corn"
      ],
      "menu_files": [
        "Menus/Menu week of 5-17-24.md"
      ],
      "menu_weeks": [
        "2024-05-17"
      ],
      "menu_seasons": [
        "spring"
      ],
      "meal_types": [
        "dinner"
      ],
      "sections": [],
      "source_hints": [
        "https://juliasalbum.com/chicken-with-zucchini-and-corn/"
      ],
      "item_texts": [
        "Garlic Butter Chicken with Zucchini and corn"
      ],
      "count": 1,
      "ingredients": [
        "2 tablespoons olive oil",
        "2 zucchini medium, sliced",
        "salt and pepper to taste",
        "1.5 cups corn kernels cooked (about 3 corn ears - corn on the cob)",
        "1 lb chicken breasts skinless, boneless, sliced",
        "1/2 teaspoon smoked paprika or more",
        "1/2 teaspoon chili powder or more",
        "1/4 teaspoon salt or to taste",
        "black pepper freshly ground, to taste",
        "2 tablespoons olive oil",
        "5 cloves garlic minced",
        "2 tablespoons freshly squeezed lime juice or more",
        "4 tablespoons butter divided",
        "1/2 cup fresh cilantro chopped"
      ],
      "recipe_tags": [],
      "main_protein": "chicken"
    },
    {
      "url": "https://jz-eats.com/cucumber-radish-salad/",
      "urls": [
        "https://jz-eats.com/cucumber-radish-salad/"
      ],
      "link_texts": [
        "Cucumber Radish Salad"
      ],
      "menu_files": [
        "Menus/Menu week of 6-12-24.md"
      ],
      "menu_weeks": [
        "2024-06-12"
      ],
      "menu_seasons": [
        "summer"
      ],
      "meal_types": [
        "dinner"
      ],
      "sections": [],
      "source_hints": [
        "https://jz-eats.com/cucumber-radish-salad/"
      ],
      "item_texts": [
        "Salmon Burgers with slaw"
      ],
      "count": 1,
      "ingredients": [
        "3 Persian cucumbers",
        "1 or 2 bunches of radishes",
        "1/4 cup fresh dill, chopped",
        "3 scallions, thinly sliced",
        "1 garlic clove, minced",
        "1/2 lemon, juice",
        "2 tablespoons extra virgin olive oil",
        "1/2 teaspoon apple cider vinegar",
        "1/4 teaspoon honey",
        "1/4 teaspoon kosher salt",
        "1/4 teaspoon black pepper"
      ],
      "recipe_tags": [],
      "main_protein": "vegetarian"
    },
    {
      "url": "https://kitchengatherings.com/root-veg-chicken/",
      "urls": [
        "https://kitchengatherings.com/root-veg-chicken/"
      ],
      "link_texts": [
        "Root Veg Chicken"
      ],
      "menu_files": [
        "Menus/Menu week of 7-1-24.md"
      ],
      "menu_weeks": [
        "2024-07-01"
      ],
      "menu_seasons": [
        "summer"
      ],
      "meal_types": [
        "dinner"
      ],
      "sections": [],
      "source_hints": [
        "https://kitchengatherings.com/root-veg-chicken/"
      ],
      "item_texts": [
        "Roasted colorful root vegetables with sage, thyme, and rosemary"
      ],
      "count": 1,
      "ingredients": [
        "2 small beets (red & yellow), peeled & quartered",
        "4 carrots (orange, yellow, maroon)",
        "2-3 small turnips, peeled & quartered",
        "3 watermelon radishes, peeled & halved",
        "6 fingerling or baby potatoes, halved",
        "1 cipollini onion, whole with ends cut off & peeled (optional)",
        "3 shallots, each sliced into 4 thick pieces lengthwise",
        "4-5 whole cloves of garlic, washed but not peeled",
        "10 fresh sage leaves",
        "2 sprigs rosemary",
        "Fresh thyme sprigs, about 1.5 tablespoons",
        "2-3 tablespoons olive oil, enough to coat the vegetables",
        "1/4 cup white wine",
        "3/4 teaspoons salt, or to taste",
        "Freshly ground black pepper",
        "1.5 pounds chicken breasts (bone-in or boneless)",
        "1 tablespoon unsalted butter",
        "20 sage leaves",
        "1 tablespoon fresh rosemary leaves",
        "1/3 teaspoon fresh thyme leaves",
        "1/4 cup white wine",
        "1/2 teaspoon salt, or to taste",
        "Freshly ground black pepper"
      ],
      "recipe_tags": [],
      "main_protein": "chicken"
    },
    {
      "url": "https://pinchofyum.com/30-minute-meal-prep-roasted-vegetable-bowls-with-green-tahini",
      "urls": [
        "https://pinchofyum.com/30-minute-meal-prep-roasted-vegetable-bowls-with-green-tahini"
      ],
      "link_texts": [
        "Roasted Vegetable Bowls with Green Tahini"
      ],
      "menu_files": [
        "Menus/Menu week of 10-11-23.md"
      ],
      "menu_weeks": [
        "2023-10-11"
      ],
      "menu_seasons": [
        "fall"
      ],
      "meal_types": [
        "dinner"
      ],
      "sections": [],
      "source_hints": [],
      "item_texts": [
        "Roasted vegetable bowls"
      ],
      "count": 1,
      "ingredients": [
        "8 large carrots, peeled and chopped",
        "3 golden potatoes, chopped",
        "1 head of broccoli, cut into florets",
        "1 head of cauliflower, cut into florets",
        "olive oil and salt",
        "1/2 cup olive oil (mild tasting)",
        "1/2 cup water",
        "1/4 cup tahini",
        "a big bunch of cilantro and/or parsley",
        "1 clove garlic",
        "squeeze of half a lemon (about 2 tablespoons)",
        "1/2 teaspoon salt (more to taste)",
        "6 hard boiled eggs (or other protein)",
        "3 avocados"
      ],
      "recipe_tags": [
        "All Recipes",
        "Avocado",
        "Bowls",
        "Cauliflower",
        "Dairy-Free",
        "Healthy",
        "Lemon",
        "Lunch",
        "Meal Prep",
        "Recipes",
        "Sheet Pan",
        "Sugar-Free",
        "Tofu",
        "Vegetarian",
        "Winter"
      ],
      "main_protein": "vegetarian"
    },
    {
      "url": "https://pinchofyum.com/5-ingredient-lemon-chicken-asparagus",
      "urls": [
        "https://pinchofyum.com/5-ingredient-lemon-chicken-asparagus"
      ],
      "link_texts": [
        "5 Ingredient Lemon Chicken Asparagus"
      ],
      "menu_files": [
        "Menus/Menu week of 5-15-25.md"
      ],
      "menu_weeks": [
        "2025-05-15"
      ],
      "menu_seasons": [
        "spring"
      ],
      "meal_types": [
        "dinner"
      ],
      "sections": [],
      "source_hints": [],
      "item_texts": [
        "5 ingredient Lemon Chicken with asparagus"
      ],
      "count": 1,
      "ingredients": [
        "1 lb. boneless skinless chicken breasts",
        "1/4 cup flour",
        "1/2 teaspoon salt and pepper, to taste",
        "2 tablespoons butter",
        "1 teaspoon lemon pepper seasoning",
        "1\u20132 cups chopped asparagus",
        "2 lemons, sliced",
        "2 tablespoons honey + 2 tablespoons butter (optional, see FAQ notes)",
        "parsley for topping (optional)"
      ],
      "recipe_tags": [
        "5 Ingredients",
        "All Recipes",
        "Dairy-Free",
        "Dinner",
        "Healthy",
        "Lemon",
        "Main Dishes",
        "Meat and Chicken",
        "Quick and Easy",
        "Spring"
      ],
      "main_protein": "chicken"
    },
    {
      "url": "https://pinchofyum.com/5-minute-magic-green-sauce",
      "urls": [
        "https://pinchofyum.com/5-minute-magic-green-sauce"
      ],
      "link_texts": [
        "5 Minute Magic Green Sauce"
      ],
      "menu_files": [
        "Menus/Week of 11-17-25.md"
      ],
      "menu_weeks": [
        "2025-11-17"
      ],
      "menu_seasons": [
        "fall"
      ],
      "meal_types": [
        "dinner"
      ],
      "sections": [],
      "source_hints": [],
      "item_texts": [
        "(crockpot) and magic green sauce"
      ],
      "count": 1,
      "ingredients": [
        "1 avocado",
        "1 cup packed parsley and cilantro leaves (combined)",
        "1 jalapeno, ribs and seeds removed",
        "2 cloves garlic",
        "juice of one lime (or two \u2013 get lots of limey goodness in there!)",
        "1/2 cup water",
        "1/2 cup olive oil",
        "1 teaspoon salt",
        "1/2 cup pistachios (you can sub other nuts \u2013 see FAQs)"
      ],
      "recipe_tags": [
        "5 Ingredients",
        "All Recipes",
        "Avocado",
        "Dairy-Free",
        "Gluten-Free",
        "Healthy",
        "Jalape\u00f1o",
        "Lime",
        "Most Popular",
        "Quick and Easy",
        "Sauces",
        "Snacks",
        "Spring",
        "Sugar-Free",
        "Vegan",
        "Vegetarian"
      ],
      "main_protein": "vegetarian"
    },
    {
      "url": "https://pinchofyum.com/caramelized-pork-tacos-with-pineapple-salsa",
      "urls": [
        "https://pinchofyum.com/caramelized-pork-tacos-with-pineapple-salsa"
      ],
      "link_texts": [
        "Caramelized Pork Tacos With Pineapple Salsa"
      ],
      "menu_files": [
        "Menus/Menu week of 4-28-25.md"
      ],
      "menu_weeks": [
        "2025-04-28"
      ],
      "menu_seasons": [
        "spring"
      ],
      "meal_types": [
        "dinner"
      ],
      "sections": [],
      "source_hints": [
        "https://pinchofyum.com/caramelized-pork-tacos-with-pineapple-salsa"
      ],
      "item_texts": [
        "Carmelized pork tacos with (mango) salsa"
      ],
      "count": 1,
      "ingredients": [
        "1 tablespoon oil",
        "1 shallot, minced",
        "1 clove garlic, minced",
        "1 jalape\u00f1o, diced with ribs and seeds removed",
        "2 teaspoons fish sauce",
        "18 ounces boneless pork loin, sliced into thin strips",
        "2 tablespoons sugar",
        "2 tablespoons water",
        "1 cup chopped pineapple",
        "1 cup chopped cucumber",
        "1/2 cup chopped cilantro",
        "1/2 red onion or shallot, chopped",
        "a squeeze of lime juice",
        "a pinch of salt",
        "8 tortillas",
        "1/4 cup cilantro",
        "1 lime, sliced into sections",
        "chili sauce (1/4 cup mayo and 2 teaspoons hot sauce like sriracha)"
      ],
      "recipe_tags": [
        "All Recipes",
        "Dairy-Free",
        "Dinner",
        "Gluten-Free",
        "Jalape\u00f1o",
        "Lime",
        "Main Dishes",
        "Meat and Chicken",
        "Most Popular",
        "Stovetop",
        "Summer",
        "Tacos"
      ],
      "main_protein": "seafood"
    },
    {
      "url": "https://pinchofyum.com/carrot-cake-coffee-cake?utm_source=convertkit&utm_medium=email&utm_campaign=What+I%27m+Bringing+Back+Home+for+Easter+Weekend%21+-+17310250",
      "urls": [
        "https://pinchofyum.com/carrot-cake-coffee-cake?utm_source=convertkit&utm_medium=email&utm_campaign=What+I%27m+Bringing+Back+Home+for+Easter+Weekend%21+-+17310250"
      ],
      "link_texts": [
        "Carrot Cake Coffee Cake"
      ],
      "menu_files": [
        "Menus/Easter brunch.md"
      ],
      "menu_weeks": [],
      "menu_seasons": [
        "unknown"
      ],
      "meal_types": [
        "dinner"
      ],
      "sections": [],
      "source_hints": [],
      "item_texts": [
        "Carrot cake coffee cake - make the night before"
      ],
      "count": 1,
      "ingredients": [
        "2 large carrots",
        "3/4 cup granulated sugar",
        "1/2 cup butter, melted",
        "2 eggs",
        "1 cup flour",
        "1 teaspoon baking soda",
        "1 teaspoon cinnamon",
        "pinch of salt",
        "4 tablespoons butter, melted",
        "1/2 cup flour",
        "1/2 cup brown sugar",
        "1 teaspoon cinnamon",
        "pinch of salt"
      ],
      "recipe_tags": [
        "All Recipes",
        "Baking",
        "Breakfast",
        "Cake",
        "Carrot",
        "Most Popular",
        "Spring"
      ],
      "main_protein": "vegetarian"
    },
    {
      "url": "https://pinchofyum.com/creamy-baked-orzo-with-meatballs",
      "urls": [
        "https://pinchofyum.com/creamy-baked-orzo-with-meatballs"
      ],
      "link_texts": [
        "Creamy Baked Orzo With Meatballs"
      ],
      "menu_files": [
        "Menus/Week of 11-17-25.md"
      ],
      "menu_weeks": [
        "2025-11-17"
      ],
      "menu_seasons": [
        "fall"
      ],
      "meal_types": [
        "dinner"
      ],
      "sections": [],
      "source_hints": [
        "https://pinchofyum.com/creamy-baked-orzo-with-meatballs"
      ],
      "item_texts": [
        "Creamy baked orzo with meatballs"
      ],
      "count": 1,
      "ingredients": [
        "16 ounces DeLallo orzo",
        "3 cups vegetable or chicken broth",
        "2 cups ready-to-serve tomato soup",
        "2\u20133 cups premade chicken meatballs",
        "1 pint cherry tomatoes, halved",
        "1/2 cup Parmesan cheese",
        "1 clove garlic",
        "2 tablespoons butter",
        "fresh basil for topping",
        "olive oil for topping"
      ],
      "recipe_tags": [
        "All Recipes",
        "Dinner",
        "Fall",
        "Kid-Friendly",
        "Main Dishes",
        "Meat and Chicken",
        "Pasta",
        "Quick and Easy",
        "Recipes",
        "SOS Series",
        "Sugar-Free",
        "Winter"
      ],
      "main_protein": "chicken"
    },
    {
      "url": "https://pinchofyum.com/garlic-and-black-pepper-beef-skewers",
      "urls": [
        "https://pinchofyum.com/garlic-and-black-pepper-beef-skewers"
      ],
      "link_texts": [
        "Garlic And Black Pepper Beef Skewers"
      ],
      "menu_files": [
        "Menus/Menu week of 8-26-25.md"
      ],
      "menu_weeks": [
        "2025-08-26"
      ],
      "menu_seasons": [
        "summer"
      ],
      "meal_types": [
        "dinner"
      ],
      "sections": [],
      "source_hints": [
        "https://pinchofyum.com/garlic-and-black-pepper-beef-skewers"
      ],
      "item_texts": [
        "Garlic and Black pepper beef skewers Frozen Orange chicken and broccoli (Tuesday)"
      ],
      "count": 1,
      "ingredients": [
        "1 pound flank steak",
        "2 tablespoons low sodium soy sauce",
        "2 tablespoons brown sugar",
        "1/2 teaspoon fish sauce",
        "2 tablespoons neutral oil",
        "3\u20134 cloves garlic, minced",
        "1/2 teaspoon black pepper",
        "4\u20135 teaspoons butter",
        "green onions for topping",
        "rice for serving"
      ],
      "recipe_tags": [
        "All Recipes",
        "Dairy-Free",
        "Dinner",
        "Grilling",
        "Main Dishes",
        "Meat and Chicken",
        "Quick and Easy",
        "Recipes",
        "Rice",
        "Summer"
      ],
      "main_protein": "seafood"
    },
    {
      "url": "https://pinchofyum.com/instant-pot-chili",
      "urls": [
        "https://pinchofyum.com/instant-pot-chili"
      ],
      "link_texts": [
        "Instant Pot Chili"
      ],
      "menu_files": [
        "Menus/Menu week of 11-20-24.md"
      ],
      "menu_weeks": [
        "2024-11-20"
      ],
      "menu_seasons": [
        "fall"
      ],
      "meal_types": [
        "dinner"
      ],
      "sections": [],
      "source_hints": [
        "https://pinchofyum.com/instant-pot-chili"
      ],
      "item_texts": [
        "Pumpkin walnut chili"
      ],
      "count": 1,
      "ingredients": [
        "1 tablespoon olive oil",
        "1 pound ground beef",
        "half an onion, diced",
        "2 cloves garlic, minced",
        "2 tablespoons chili powder",
        "2 teaspoons paprika",
        "1/2 teaspoon cayenne",
        "1 teaspoon salt",
        "1 1/2 cups water or broth",
        "one 28-ounce can crushed tomatoes",
        "one 14-ounce can black beans, drained and rinsed",
        "one 14-ounce can pinto beans, drained and rinsed",
        "1 cup uncooked rice",
        "sour cream and cheese for topping"
      ],
      "recipe_tags": [
        "All Recipes",
        "Dairy-Free",
        "Dinner",
        "Gluten-Free",
        "Healthy",
        "Instant Pot",
        "Main Dishes",
        "Meat and Chicken",
        "Most Popular",
        "Quick and Easy",
        "Recipes",
        "Soups",
        "Sugar-Free",
        "Winter"
      ],
      "main_protein": "beef"
    },
    {
      "url": "https://pinchofyum.com/instant-pot-spaghetti",
      "urls": [
        "https://pinchofyum.com/instant-pot-spaghetti"
      ],
      "link_texts": [
        "Instant Pot Spaghetti"
      ],
      "menu_files": [
        "Menus/Menu week of 12-31-25.md"
      ],
      "menu_weeks": [
        "2025-12-31"
      ],
      "menu_seasons": [
        "winter"
      ],
      "meal_types": [
        "dinner"
      ],
      "sections": [],
      "source_hints": [
        "https://pinchofyum.com/instant-pot-spaghetti"
      ],
      "item_texts": [
        "Instant pot spaghetti"
      ],
      "count": 1,
      "ingredients": [
        "1 pound ground beef",
        "1/2 onion, diced",
        "3 cloves garlic, minced",
        "1 teaspoon dried oregano",
        "1 teaspoon dried basil",
        "1/2 teaspoon salt",
        "freshly ground black pepper",
        "4 cups water",
        "1 jar (about 24 ounces) spaghetti sauce",
        "12 ounces whole wheat spaghetti (broken in half)",
        "2 tablespoons tomato paste",
        "1/2 cup cream"
      ],
      "recipe_tags": [
        "All Recipes",
        "Dinner",
        "Instant Pot",
        "Kid-Friendly",
        "Main Dishes",
        "Meat and Chicken",
        "Pasta",
        "Quick and Easy",
        "Recipes",
        "SOS Series",
        "Tomato",
        "Winter"
      ],
      "main_protein": "beef"
    },
    {
      "url": "https://pinchofyum.com/lemon-rosemary-chicken-soup",
      "urls": [
        "https://pinchofyum.com/lemon-rosemary-chicken-soup"
      ],
      "link_texts": [
        "Lemon Rosemary Chicken Soup"
      ],
      "menu_files": [
        "Menus/Menu week of 12-31-25.md"
      ],
      "menu_weeks": [
        "2025-12-31"
      ],
      "menu_seasons": [
        "winter"
      ],
      "meal_types": [
        "dinner"
      ],
      "sections": [],
      "source_hints": [
        "https://pinchofyum.com/lemon-rosemary-chicken-soup"
      ],
      "item_texts": [
        "Lemon Rosemary chicken soup"
      ],
      "count": 1,
      "ingredients": [
        "2 tablespoons olive oil",
        "6\u20137 carrots, chopped",
        "2 onions, chopped",
        "1 teaspoon salt",
        "1/2 cup white wine",
        "3 garlic cloves, minced",
        "4 cups chicken stock",
        "4 cups water",
        "3 tablespoons fresh rosemary, finely chopped (divided)",
        "2 bay leaves",
        "1/2 cup dry pearled barley",
        "1 cup panko breadcrumbs",
        "1/4 cup grated Parmesan cheese",
        "1/2 teaspoon garlic powder",
        "1\u20132 tablespoons olive oil",
        "juice of 3 lemons",
        "2\u20133 cups cooked shredded chicken"
      ],
      "recipe_tags": [
        "All Recipes",
        "Dinner",
        "Dairy-Free",
        "Healthy",
        "Main Dishes",
        "Meat and Chicken",
        "Recipes",
        "Soups",
        "Stovetop",
        "Winter"
      ],
      "main_protein": "chicken"
    },
    {
      "url": "https://pinchofyum.com/napa-chicken-salad-with-sesame-dressing",
      "urls": [
        "https://pinchofyum.com/napa-chicken-salad-with-sesame-dressing"
      ],
      "link_texts": [
        "Napa Chicken Salad with Sesame Dressing"
      ],
      "menu_files": [
        "Menus/Menu week of 9-17-23.md"
      ],
      "menu_weeks": [
        "2023-09-17"
      ],
      "menu_seasons": [
        "fall"
      ],
      "meal_types": [
        "dinner"
      ],
      "sections": [],
      "source_hints": [],
      "item_texts": [
        "Napa chicken salad"
      ],
      "count": 1,
      "ingredients": [
        "1/2 cup Mayo",
        "1/4 cup plain Greek yogurt",
        "2 tablespoons honey",
        "2 tablespoons soy sauce",
        "1 tablespoon rice vinegar",
        "1/2 teaspoon toasted sesame oil",
        "1 clove garlic, grated",
        "1 teaspoon fresh grated ginger",
        "2\u20133 cups thinly sliced Napa cabbage",
        "2\u20133 cups diced or shredded cooked chicken",
        "1 cup shredded carrot",
        "1/2 cup chopped scallions",
        "1/2 cup chopped cilantro",
        "1/2 cup slivered almonds",
        "chili oil for topping (optional)"
      ],
      "recipe_tags": [
        "All Recipes",
        "Dairy-Free",
        "Healthy",
        "Lunch",
        "Main Dishes",
        "Meat and Chicken",
        "Quick and Easy",
        "Recipes",
        "Salads",
        "Summer"
      ],
      "main_protein": "chicken"
    },
    {
      "url": "https://pinchofyum.com/rainbow-chicken-salad-almond-honey-mustard-dressing",
      "urls": [
        "https://pinchofyum.com/rainbow-chicken-salad-almond-honey-mustard-dressing"
      ],
      "link_texts": [
        "Rainbow Chicken Salad Almond Honey Mustard Dressing"
      ],
      "menu_files": [
        "Menus/Menu week of 7-14-24.md"
      ],
      "menu_weeks": [
        "2024-07-14"
      ],
      "menu_seasons": [
        "summer"
      ],
      "meal_types": [
        "dinner"
      ],
      "sections": [],
      "source_hints": [
        "https://pinchofyum.com/rainbow-chicken-salad-almond-honey-mustard-dressing"
      ],
      "item_texts": [
        "Rainbow Chicken Salad with Almond Honey Mustard Dressing"
      ],
      "count": 1,
      "ingredients": [
        "1/2 cup olive oil",
        "1/4 cup apple cider vinegar",
        "2 tablespoons Dijon mustard",
        "3 cloves garlic, grated",
        "1/4 cup honey",
        "salt and pepper",
        "10 cups chopped salad mix (romaine, spinach, etc.)",
        "2 cups shredded rotisserie chicken",
        "1/2 cup almonds",
        "1 cup grapes",
        "1 cup berries",
        "1 cup avocado, diced",
        "1 cup feta or goat cheese",
        "1/2 cup red onions"
      ],
      "recipe_tags": [
        "All Recipes",
        "Dinner",
        "Healthy",
        "Lunch",
        "Main Dishes",
        "Meat and Chicken",
        "Quick and Easy",
        "Recipes",
        "Salads",
        "Summer"
      ],
      "main_protein": "chicken"
    },
    {
      "url": "https://pinchofyum.com/ridiculously-good-air-fryer-chicken-breast",
      "urls": [
        "https://pinchofyum.com/ridiculously-good-air-fryer-chicken-breast"
      ],
      "link_texts": [
        "Ridiculously Good Air Fryer Chicken Breast"
      ],
      "menu_files": [
        "Menus/Menu week of 7-14-24.md"
      ],
      "menu_weeks": [
        "2024-07-14"
      ],
      "menu_seasons": [
        "summer"
      ],
      "meal_types": [
        "dinner"
      ],
      "sections": [],
      "source_hints": [
        "https://pinchofyum.com/ridiculously-good-air-fryer-chicken-breast"
      ],
      "item_texts": [
        "With a batch of Air Fryer chicken:"
      ],
      "count": 1,
      "ingredients": [
        "2\u20133 boneless skinless chicken breasts",
        "1 tablespoon brown sugar",
        "1 1/2 teaspoons paprika",
        "1 1/2 teaspoons garlic powder",
        "1 teaspoon onion powder",
        "1 teaspoon salt",
        "1/2 teaspoon black pepper",
        "1/2 teaspoon cayenne",
        "1 tablespoon oil"
      ],
      "recipe_tags": [
        "All Recipes",
        "Dairy-Free",
        "Dinner",
        "Healthy",
        "Main Dishes",
        "Meat and Chicken",
        "Quick and Easy",
        "Recipes",
        "Summer"
      ],
      "main_protein": "chicken"
    },
    {
      "url": "https://pinchofyum.com/roasted-sweet-potato-stacks-with-chipotle-sauce",
      "urls": [
        "https://pinchofyum.com/roasted-sweet-potato-stacks-with-chipotle-sauce"
      ],
      "link_texts": [
        "Roasted Sweet Potato Stacks With Chipotle Sauce"
      ],
      "menu_files": [
        "Menus/Menu week of 1-16-26.md"
      ],
      "menu_weeks": [
        "2026-01-16"
      ],
      "menu_seasons": [
        "winter"
      ],
      "meal_types": [
        "dinner"
      ],
      "sections": [],
      "source_hints": [
        "https://pinchofyum.com/roasted-sweet-potato-stacks-with-chipotle-sauce"
      ],
      "item_texts": [
        "Sweet potato stacks with chipotle sauce"
      ],
      "count": 1,
      "ingredients": [
        "a big hunk of olive oil",
        "2\u20133 sweet potatoes, peeled",
        "1/2 teaspoon salt",
        "2 chipotle peppers in adobo",
        "1/2 cup sour cream",
        "juice of 1/2 lime",
        "1/4 cup mayo",
        "1/2 teaspoon garlic powder"
      ],
      "recipe_tags": [
        "All Recipes",
        "Appetizer",
        "Dairy-Free",
        "Gluten-Free",
        "Healthy",
        "Kid-Friendly",
        "Main Dishes",
        "Recipes",
        "Sides",
        "Sweet Potato",
        "Vegetarian"
      ],
      "main_protein": "vegetarian"
    },
    {
      "url": "https://pinchofyum.com/super-yummy-chicken-salad",
      "urls": [
        "https://pinchofyum.com/super-yummy-chicken-salad"
      ],
      "link_texts": [
        "Super Yummy Chicken Salad"
      ],
      "menu_files": [
        "Menus/Menu week of 7-1-24.md"
      ],
      "menu_weeks": [
        "2024-07-01"
      ],
      "menu_seasons": [
        "summer"
      ],
      "meal_types": [
        "dinner"
      ],
      "sections": [],
      "source_hints": [
        "https://pinchofyum.com/super-yummy-chicken-salad"
      ],
      "item_texts": [
        "Chicken salad:"
      ],
      "count": 1,
      "ingredients": [
        "1 batch Greco's chicken (any shredded chicken is fine)",
        "1/2 cup mayonnaise",
        "1 cup chopped celery",
        "1/2 cup chopped pecans",
        "1/2 cup chopped green grapes",
        "1/2 teaspoon salt",
        "1/4 teaspoon garlic powder",
        "1/4 teaspoon onion powder",
        "a squeeze of lemon juice"
      ],
      "recipe_tags": [
        "All Recipes",
        "Lunch",
        "Meat and Chicken",
        "Quick and Easy",
        "Recipes",
        "Summer"
      ],
      "main_protein": "chicken"
    },
    {
      "url": "https://pinchofyum.com/thai-shrimp-curry-with-yummy-shallot-crispies",
      "urls": [
        "https://pinchofyum.com/thai-shrimp-curry-with-yummy-shallot-crispies"
      ],
      "link_texts": [
        "Thai Shrimp Curry With Yummy Shallot Crispies"
      ],
      "menu_files": [
        "Menus/Menu week of 8-13-25.md"
      ],
      "menu_weeks": [
        "2025-08-13"
      ],
      "menu_seasons": [
        "summer"
      ],
      "meal_types": [
        "dinner"
      ],
      "sections": [],
      "source_hints": [
        "red pepper and broccoli"
      ],
      "item_texts": [
        "Thai shrimp curry with shallot crisps (red pepper and broccoli)"
      ],
      "count": 1,
      "ingredients": [
        "6 tablespoons oil",
        "2 shallots, thinly sliced",
        "1 tablespoon red curry paste",
        "1 tablespoon yellow curry paste",
        "3 cloves garlic, minced",
        "1 small knob of fresh ginger, minced",
        "1/2 teaspoon turmeric",
        "2 cups snap peas",
        "1 red bell pepper, thinly sliced",
        "1 can coconut milk",
        "1 1/2 pounds shrimp",
        "1/2 cup basil",
        "1/2 cup cilantro",
        "salt and pepper",
        "rice"
      ],
      "recipe_tags": [
        "All Recipes",
        "Dairy-Free",
        "Dinner",
        "Fish and Seafood",
        "Gluten-Free",
        "Healthy",
        "Main Dishes",
        "Most Popular",
        "Quick and Easy",
        "Recipes",
        "Rice",
        "Spring",
        "Summer"
      ],
      "main_protein": "seafood"
    },
    {
      "url": "https://sallysbakingaddiction.com/salted-caramel-apple-pie-bars/",
      "urls": [
        "https://sallysbakingaddiction.com/salted-caramel-apple-pie-bars/"
      ],
      "link_texts": [
        "Salted Caramel Apple Pie Bars"
      ],
      "menu_files": [
        "Menus/Menu week of 10-22-25.md"
      ],
      "menu_weeks": [
        "2025-10-22"
      ],
      "menu_seasons": [
        "fall"
      ],
      "meal_types": [
        "dinner"
      ],
      "sections": [],
      "source_hints": [
        "https://sallysbakingaddiction.com/salted-caramel-apple-pie-bars/"
      ],
      "item_texts": [
        "Salted caramel apple pie bars:"
      ],
      "count": 1,
      "ingredients": [
        "2 and 1/2 cups all-purpose flour (spooned & leveled)",
        "1 teaspoon baking powder",
        "1/2 teaspoon salt",
        "1 cup (230g) unsalted butter, softened to room temperature",
        "1 cup (200g) packed light or dark brown sugar",
        "2 large eggs",
        "2 teaspoons pure vanilla extract",
        "4 large apples, peeled and thinly sliced (about 4 heaping cups)",
        "2 Tablespoons (28g) unsalted butter",
        "1/4 cup (50g) packed light or dark brown sugar",
        "2 teaspoons ground cinnamon",
        "1/4 teaspoon ground nutmeg",
        "1/4 teaspoon salt",
        "1/3 cup (80ml) salted caramel sauce",
        "1 cup (120g) chopped pecans (optional)",
        "1 cup (120g) all-purpose flour",
        "1/2 cup (100g) packed light or dark brown sugar",
        "1/2 teaspoon ground cinnamon",
        "1/2 cup (115g) unsalted butter, cold and cubed"
      ],
      "recipe_tags": [],
      "main_protein": "vegetarian"
    },
    {
      "url": "https://www.browneyedbaker.com/best-ever-potato-salad-recipe/",
      "urls": [
        "https://www.browneyedbaker.com/best-ever-potato-salad-recipe/"
      ],
      "link_texts": [
        "Best Ever Potato Salad Recipe"
      ],
      "menu_files": [
        "Menus/Menu week of 10-22-25.md"
      ],
      "menu_weeks": [
        "2025-10-22"
      ],
      "menu_seasons": [
        "fall"
      ],
      "meal_types": [
        "dinner"
      ],
      "sections": [],
      "source_hints": [
        "https://www.browneyedbaker.com/best-ever-potato-salad-recipe/"
      ],
      "item_texts": [
        "Potato salad:"
      ],
      "count": 1,
      "ingredients": [
        "3 pounds Yukon Gold potatoes peeled and cut into 3/4-inch pieces",
        "1 tablespoon salt",
        "4 large hard-boiled eggs chopped",
        "1 1/2 cups mayonnaise",
        "2 tablespoons dill pickle relish",
        "1 tablespoon yellow mustard",
        "1/2 teaspoon celery seed",
        "1/4 teaspoon salt",
        "1/4 teaspoon black pepper",
        "1/4 cup chopped celery",
        "1/4 cup chopped red onion",
        "2 tablespoons chopped fresh dill",
        "Paprika for garnish"
      ],
      "recipe_tags": [],
      "main_protein": "vegetarian"
    },
    {
      "url": "https://www.browneyedbaker.com/bread-and-butter-pickles/",
      "urls": [
        "https://www.browneyedbaker.com/bread-and-butter-pickles/"
      ],
      "link_texts": [
        "Bread And Butter Pickles"
      ],
      "menu_files": [
        "Menus/Week of 7-14-25.md"
      ],
      "menu_weeks": [
        "2025-07-14"
      ],
      "menu_seasons": [
        "summer"
      ],
      "meal_types": [
        "dinner"
      ],
      "sections": [],
      "source_hints": [
        "https://www.browneyedbaker.com/bread-and-butter-pickles/"
      ],
      "item_texts": [
        "Make bread and butter pickles"
      ],
      "count": 1,
      "ingredients": [
        "2 pounds cucumbers",
        "1/2 pound onions",
        "1/4 cup salt",
        "1 cup sugar",
        "1 cup white vinegar",
        "1/2 cup apple cider vinegar",
        "1 tablespoon mustard seeds",
        "1 teaspoon celery seeds",
        "1/2 teaspoon turmeric"
      ],
      "recipe_tags": [],
      "main_protein": "vegetarian"
    },
    {
      "url": "https://www.browneyedbaker.com/buttermilk-waffles-recipe/",
      "urls": [
        "https://www.browneyedbaker.com/buttermilk-waffles-recipe/"
      ],
      "link_texts": [
        "Buttermilk Waffles Recipe"
      ],
      "menu_files": [
        "Menus/Menu week of 12-28-23.md"
      ],
      "menu_weeks": [
        "2023-12-28"
      ],
      "menu_seasons": [
        "winter"
      ],
      "meal_types": [
        "dinner"
      ],
      "sections": [],
      "source_hints": [],
      "item_texts": [
        "Waffles"
      ],
      "count": 1,
      "ingredients": [
        "1 1/2 cups (212 g) all-purpose flour",
        "2 tablespoons sugar",
        "1 teaspoon baking powder",
        "1/2 teaspoon baking soda",
        "1/2 teaspoon salt",
        "1 1/2 cups (360 ml) buttermilk",
        "2 large eggs",
        "1/4 cup (57 g) unsalted butter, melted and cooled slightly",
        "1 teaspoon vanilla extract",
        "1 tablespoon vegetable oil, for greasing the waffle iron"
      ],
      "recipe_tags": [],
      "main_protein": "vegetarian"
    },
    {
      "url": "https://www.gimmesomeoven.com/easy-sesame-shishito-peppers-recipe/",
      "urls": [
        "https://www.gimmesomeoven.com/easy-sesame-shishito-peppers-recipe/"
      ],
      "link_texts": [
        "Easy Sesame Shishito Peppers Recipe"
      ],
      "menu_files": [
        "Menus/Menu week of 7-14-24.md"
      ],
      "menu_weeks": [
        "2024-07-14"
      ],
      "menu_seasons": [
        "summer"
      ],
      "meal_types": [
        "dinner"
      ],
      "sections": [],
      "source_hints": [
        "https://www.gimmesomeoven.com/easy-sesame-shishito-peppers-recipe/"
      ],
      "item_texts": [
        "Blistered shishito peppers:"
      ],
      "count": 1,
      "ingredients": [
        "2 tablespoons olive oil",
