{
  "menus": [
    {
      "file": "Menus/Easter brunch.md",
      "title": "Easter brunch",
      "week_of_date": null,
      "items": [
        {
          "text": "[https://www.twopeasandtheirpod.com/bacon-potato-and-egg-casserole/#wprm-recipe-container-39516](https://www.twopeasandtheirpod.com/bacon-potato-and-egg-casserole/#wprm-recipe-container-39516)Make the night before. Sub water for milk. only add cheese to half and not in the mix.",
          "checked": true,
          "section": null,
          "source_hint": null,
          "links": [
            {
              "text": "https://www.twopeasandtheirpod.com/bacon-potato-and-egg-casserole/#wprm-recipe-container-39516",
              "url": "https://www.twopeasandtheirpod.com/bacon-potato-and-egg-casserole/#wprm-recipe-container-39516"
            }
          ],
          "urls": [
            "https://www.twopeasandtheirpod.com/bacon-potato-and-egg-casserole/#wprm-recipe-container-39516](https://www.twopeasandtheirpod.com/bacon-potato-and-egg-casserole/#wprm-recipe-container-39516"
          ]
        },
        {
          "text": "Carrot cake coffee cake - make the night before [https://pinchofyum.com/carrot-cake-coffee-cake?utm_source=convertkit&utm_medium=email&utm_campaign=What+I%27m+Bringing+Back+Home+for+Easter+Weekend%21+-+17310250](https://pinchofyum.com/carrot-cake-coffee-cake?utm_source=convertkit&utm_medium=email&utm_campaign=What+I%27m+Bringing+Back+Home+for+Easter+Weekend%21+-+17310250)Use vegan butter",
          "checked": true,
          "section": null,
          "source_hint": null,
          "links": [
            {
              "text": "https://pinchofyum.com/carrot-cake-coffee-cake?utm_source=convertkit&utm_medium=email&utm_campaign=What+I%27m+Bringing+Back+Home+for+Easter+Weekend%21+-+17310250",
              "url": "https://pinchofyum.com/carrot-cake-coffee-cake?utm_source=convertkit&utm_medium=email&utm_campaign=What+I%27m+Bringing+Back+Home+for+Easter+Weekend%21+-+17310250"
            }
          ],
          "urls": [
            "https://pinchofyum.com/carrot-cake-coffee-cake?utm_source=convertkit&utm_medium=email&utm_campaign=What+I%27m+Bringing+Back+Home+for+Easter+Weekend%21+-+17310250](https://pinchofyum.com/carrot-cake-coffee-cake?utm_source=convertkit&utm_medium=email&utm_campaign=What+I%27m+Bringing+Back+Home+for+Easter+Weekend%21+-+17310250"
          ]
        },
        {
          "text": "FruitMonkeys",
          "checked": true,
          "section": null,
          "source_hint": null,
          "links": [],
          "urls": []
        }
      ]
    },
    {
      "file": "Menus/Easy post baby recipes.md",
      "title": "Easy post baby recipes",
      "week_of_date": null,
      "items": [
        {
          "text": "Spicy peanut tofu bowls",
          "checked": false,
          "section": null,
          "source_hint": null,
          "links": [],
          "urls": []
        },
        {
          "text": "Roasted sweet potato tacos",
          "checked": false,
          "section": null,
          "source_hint": null,
          "links": [],
          "urls": []
        },
        {
          "text": "Bulgur salad",
          "checked": true,
          "section": null,
          "source_hint": null,
          "links": [],
          "urls": []
        },
        {
          "text": "Roasted tomato caprese pasta salad",
          "checked": true,
          "section": null,
          "source_hint": null,
          "links": [],
          "urls": []
        },
        {
          "text": "Gnocchi with Brussels Sprouts, Chicken Sausage and Pesto",
          "checked": true,
          "section": null,
          "source_hint": null,
          "links": [],
          "urls": []
        }
      ]
    },
    {
      "file": "Menus/Maeve\u2019s first note.md",
      "title": "Maeve\u2019s first note",
      "week_of_date": null,
      "items": []
    },
    {
      "file": "Menus/Menu week of 1-10-19.md",
      "title": "Menu week of 1/10/19",
      "week_of_date": "2019-01-10",
      "items": [
        {
          "text": "Instant pot chicken chili verde",
          "checked": true,
          "section": null,
          "source_hint": null,
          "links": [],
          "urls": []
        },
        {
          "text": "Chicken Caesar salad",
          "checked": true,
          "section": null,
          "source_hint": null,
          "links": [],
          "urls": []
        },
        {
          "text": "Spicy peanut soup with sweet potato (instant pot)",
          "checked": true,
          "section": null,
          "source_hint": "instant pot",
          "links": [],
          "urls": []
        },
        {
          "text": "Bulgur salad",
          "checked": true,
          "section": null,
          "source_hint": null,
          "links": [],
          "urls": []
        },
        {
          "text": "Salmon burgers with slaw",
          "checked": true,
          "section": null,
          "source_hint": null,
          "links": [],
          "urls": []
        },
        {
          "text": "Chickpea cous cous bowls with tahini sauce",
          "checked": true,
          "section": null,
          "source_hint": null,
          "links": [],
          "urls": []
        },
        {
          "text": "Instant pot short rib ragu",
          "checked": true,
          "section": null,
          "source_hint": null,
          "links": [],
          "urls": []
        }
      ]
    },
    {
      "file": "Menus/Menu week of 1-11-20.md",
      "title": "Menu week of 1/11/20",
      "week_of_date": "2020-01-11",
      "items": [
        {
          "text": "Chicken Quinoa Broccoli Casserole",
          "checked": true,
          "section": null,
          "source_hint": null,
          "links": [],
          "urls": []
        },
        {
          "text": "Cauliflower Walnut burrito bowls (guac in freezer)",
          "checked": true,
          "section": null,
          "source_hint": "guac in freezer",
          "links": [],
          "urls": []
        },
        {
          "text": "Irish potato soup",
          "checked": true,
          "section": null,
          "source_hint": null,
          "links": [],
          "urls": []
        },
        {
          "text": "Saturday: Roasted beet, goat cheese, and candied pecan salad with amelia\u2019s bread",
          "checked": true,
          "section": null,
          "source_hint": null,
          "links": [],
          "urls": []
        },
        {
          "text": "Vegetarian Moo Shu",
          "checked": true,
          "section": null,
          "source_hint": null,
          "links": [],
          "urls": []
        },
        {
          "text": "Crockpot Lentil Quesadillas with magic green sauce",
          "checked": true,
          "section": null,
          "source_hint": null,
          "links": [],
          "urls": []
        },
        {
          "text": "Steak and roasted parsnips and beets",
          "checked": true,
          "section": null,
          "source_hint": null,
          "links": [],
          "urls": []
        },
        {
          "text": "Quinoa Crunch Salad with peanut dressing",
          "checked": false,
          "section": null,
          "source_hint": null,
          "links": [],
          "urls": []
        },
        {
          "text": "Breakfast balls",
          "checked": true,
          "section": null,
          "source_hint": null,
          "links": [],
          "urls": []
        }
      ]
    },
    {
      "file": "Menus/Menu week of 1-12-2021.md",
      "title": "Menu week of 1/12/2021",
      "week_of_date": "2021-01-12",
      "items": [
        {
          "text": "Root vegetable soup (freezer) and salad",
          "checked": false,
          "section": null,
          "source_hint": null,
          "links": [],
          "urls": []
        },
        {
          "text": "Lunch: Vegetarian Italian Chopped Salad",
          "checked": false,
          "section": null,
          "source_hint": null,
          "links": [],
          "urls": []
        },
        {
          "text": "Garlicky roasted squash and ricotta pizza",
          "checked": true,
          "section": null,
          "source_hint": null,
          "links": [],
          "urls": []
        },
        {
          "text": "Chipotle quinoa burgers and sweet potato fries",
          "checked": true,
          "section": null,
          "source_hint": null,
          "links": [],
          "urls": []
        },
        {
          "text": "Cauliflower Gnocchi",
          "checked": true,
          "section": null,
          "source_hint": null,
          "links": [],
          "urls": []
        },
        {
          "text": "Cauliflower walnut taco meat burrito bowls",
          "checked": true,
          "section": null,
          "source_hint": null,
          "links": [],
          "urls": []
        },
        {
          "text": "Vegan sheet pan fajitas with chipotle queso",
          "checked": true,
          "section": null,
          "source_hint": null,
          "links": [],
          "urls": []
        },
        {
          "text": "Instant pot Italian Beef sandwiches",
          "checked": true,
          "section": null,
          "source_hint": null,
          "links": [],
          "urls": []
        }
      ]
    },
    {
      "file": "Menus/Menu week of 1-13-18.md",
      "title": "Menu week of 1/13/18",
      "week_of_date": "2018-01-13",
      "items": [
        {
          "text": "Fried chicken, cornbread, green beans",
          "checked": true,
          "section": null,
          "source_hint": null,
          "links": [],
          "urls": []
        },
        {
          "text": "Squid ink pasta with shrimp and scallops",
          "checked": true,
          "section": null,
          "source_hint": null,
          "links": [],
          "urls": []
        },
        {
          "text": "Quick dal makhani",
          "checked": true,
          "section": null,
          "source_hint": null,
          "links": [],
          "urls": []
        },
        {
          "text": "Bulgar salad",
          "checked": true,
          "section": null,
          "source_hint": null,
          "links": [],
          "urls": []
        },
        {
          "text": "Broccoli cauliflower beef stir fry",
          "checked": true,
          "section": null,
          "source_hint": null,
          "links": [],
          "urls": []
        },
        {
          "text": "Pizza",
          "checked": true,
          "section": null,
          "source_hint": null,
          "links": [],
          "urls": []
        },
        {
          "text": "Skillet-charred fish tacos (cravings p209)",
          "checked": true,
          "section": null,
          "source_hint": null,
          "links": [],
          "urls": []
        },
        {
          "text": "Dark chocolate almond joy bites",
          "checked": true,
          "section": null,
          "source_hint": null,
          "links": [],
          "urls": []
        },
        {
          "text": "Chips and salsa",
          "checked": true,
          "section": null,
          "source_hint": null,
          "links": [],
          "urls": []
        },
        {
          "text": "Carrots and hummus",
          "checked": true,
          "section": null,
          "source_hint": null,
          "links": [],
          "urls": []
        },
        {
          "text": "Cheese and crackers (include goat cheese and port wine cranberry",
          "checked": true,
          "section": null,
          "source_hint": null,
          "links": [],
          "urls": []
        }
      ]
    },
    {
      "file": "Menus/Menu week of 1-13-22.md",
      "title": "Menu week of 1/13/22",
      "week_of_date": "2022-01-13",
      "items": [
        {
          "text": "Instant Pot Korean beef tacos (marinade in freezer)",
          "checked": true,
          "section": null,
          "source_hint": "marinade in freezer",
          "links": [],
          "urls": []
        },
        {
          "text": "Instant Pot Chicken and dumplings",
          "checked": true,
          "section": null,
          "source_hint": null,
          "links": [],
          "urls": []
        },
        {
          "text": "Frozen pizza and bagged salad",
          "checked": true,
          "section": null,
          "source_hint": null,
          "links": [],
          "urls": []
        },
        {
          "text": "Sesame apricot tofu (Pinch of Yum)",
          "checked": true,
          "section": null,
          "source_hint": "Pinch of Yum",
          "links": [],
          "urls": []
        },
        {
          "text": "Chicken and broccoli stir fry (Damn Delicious)",
          "checked": true,
          "section": null,
          "source_hint": "Damn Delicious",
          "links": [],
          "urls": []
        },
        {
          "text": "Green Goddess roasted chicken  [https://www.today.com/recipes/green-goddess-roasted-chicken-t106869](https://www.today.com/recipes/green-goddess-roasted-chicken-t106869) and carrots",
          "checked": true,
          "section": null,
          "source_hint": null,
          "links": [
            {
              "text": "https://www.today.com/recipes/green-goddess-roasted-chicken-t106869",
              "url": "https://www.today.com/recipes/green-goddess-roasted-chicken-t106869"
            }
          ],
          "urls": [
            "https://www.today.com/recipes/green-goddess-roasted-chicken-t106869](https://www.today.com/recipes/green-goddess-roasted-chicken-t106869"
          ]
        },
        {
          "text": "The best Detox crockpot lentil soup (Pinch of Yum) and bread",
          "checked": true,
          "section": null,
          "source_hint": null,
          "links": [],
          "urls": []
        },
        {
          "text": "Baked Salmon with amazing lemon sauce (Pinch of Yum)",
          "checked": true,
          "section": null,
          "source_hint": "Pinch of Yum",
          "links": [],
          "urls": []
        },
        {
          "text": "Sweet potato black bean bowls",
          "checked": true,
          "section": null,
          "source_hint": null,
          "links": [],
          "urls": []
        }
      ]
    },
    {
      "file": "Menus/Menu week of 1-16-22.md",
      "title": "Menu week of 1/16/22",
      "week_of_date": "2022-01-16",
      "items": [
        {
          "text": "Blue apron: chicken",
          "checked": true,
          "section": null,
          "source_hint": null,
          "links": [],
          "urls": []
        },
        {
          "text": "Smokey beans and greens tacos with aj\u00ed verde",
          "checked": true,
          "section": null,
          "source_hint": null,
          "links": [],
          "urls": []
        },
        {
          "text": "Blue apron: steak",
          "checked": true,
          "section": null,
          "source_hint": null,
          "links": [],
          "urls": []
        },
        {
          "text": "Blue apron: salmon",
          "checked": true,
          "section": null,
          "source_hint": null,
          "links": [],
          "urls": []
        },
        {
          "text": "Creamy red pepper pasta with bl\u00edsteres tomatoes",
          "checked": true,
          "section": null,
          "source_hint": null,
          "links": [],
          "urls": []
        },
        {
          "text": "Blue Apron: wonton noodles",
          "checked": true,
          "section": null,
          "source_hint": null,
          "links": [],
          "urls": []
        },
        {
          "text": "Blue apron: cheese burgers and potato wedges",
          "checked": true,
          "section": null,
          "source_hint": null,
          "links": [],
          "urls": []
        },
        {
          "text": "Plantain and pinto stew with aj\u00ed verde (make rice)",
          "checked": true,
          "section": null,
          "source_hint": "make rice",
          "links": [],
          "urls": []
        },
        {
          "text": "Snack: cookie dough energy bites",
          "checked": false,
          "section": null,
          "source_hint": null,
          "links": [],
          "urls": []
        },
        {
          "text": "Anytime: simple greens salad",
          "checked": true,
          "section": null,
          "source_hint": null,
          "links": [],
          "urls": []
        },
        {
          "text": "Moe casserole",
          "checked": false,
          "section": null,
          "source_hint": null,
          "links": [],
          "urls": []
        },
        {
          "text": "Frozen pizza",
          "checked": true,
          "section": null,
          "source_hint": null,
          "links": [],
          "urls": []
        }
      ]
    },
    {
      "file": "Menus/Menu week of 1-16-26.md",
      "title": "Menu week of 1/16/26",
      "week_of_date": "2026-01-16",
      "items": [
        {
          "text": "White people tacos",
          "checked": true,
          "section": null,
          "source_hint": null,
          "links": [],
          "urls": []
        },
        {
          "text": "Roasted red pepper pasta and cauliflower",
          "checked": true,
          "section": null,
          "source_hint": null,
          "links": [],
          "urls": []
        },
        {
          "text": "Perogies with bacon, sour cream, cheese, chives, and salad",
          "checked": true,
          "section": null,
          "source_hint": null,
          "links": [],
          "urls": []
        },
        {
          "text": "Orange chicken, broccoli, and rice",
          "checked": true,
          "section": null,
          "source_hint": null,
          "links": [],
          "urls": []
        },
        {
          "text": "Sheet pan chicken pitas [https://pinchofyum.com/sheet-pan-chicken-pitas](https://pinchofyum.com/sheet-pan-chicken-pitas)Frozen pizza and salad",
          "checked": false,
          "section": null,
          "source_hint": null,
          "links": [
            {
              "text": "https://pinchofyum.com/sheet-pan-chicken-pitas",
              "url": "https://pinchofyum.com/sheet-pan-chicken-pitas"
            }
          ],
          "urls": [
            "https://pinchofyum.com/sheet-pan-chicken-pitas](https://pinchofyum.com/sheet-pan-chicken-pitas"
          ]
        },
        {
          "text": "Chicken nuggets, sweet potato fries, leftover broccoli",
          "checked": true,
          "section": null,
          "source_hint": null,
          "links": [],
          "urls": []
        },
        {
          "text": "Orange chicken (freezer) and broccoli",
          "checked": true,
          "section": null,
          "source_hint": null,
          "links": [],
          "urls": []
        },
        {
          "text": "Sweet potato stacks with chipotle sauce [https://pinchofyum.com/roasted-sweet-potato-stacks-with-chipotle-sauce](https://pinchofyum.com/roasted-sweet-potato-stacks-with-chipotle-sauce)Sheet pan meatballs with tomato salad and green sauce [https://pinchofyum.com/sheet-pan-meatballs-with-tomato-salad-and-green-sauce](https://pinchofyum.com/sheet-pan-meatballs-with-tomato-salad-and-green-sauce)Breakfast: French toast, bacon",
          "checked": true,
          "section": null,
          "source_hint": null,
          "links": [
            {
              "text": "https://pinchofyum.com/roasted-sweet-potato-stacks-with-chipotle-sauce",
              "url": "https://pinchofyum.com/roasted-sweet-potato-stacks-with-chipotle-sauce"
            },
            {
              "text": "https://pinchofyum.com/sheet-pan-meatballs-with-tomato-salad-and-green-sauce",
              "url": "https://pinchofyum.com/sheet-pan-meatballs-with-tomato-salad-and-green-sauce"
            }
          ],
          "urls": [
            "https://pinchofyum.com/roasted-sweet-potato-stacks-with-chipotle-sauce](https://pinchofyum.com/roasted-sweet-potato-stacks-with-chipotle-sauce",
            "https://pinchofyum.com/sheet-pan-meatballs-with-tomato-salad-and-green-sauce](https://pinchofyum.com/sheet-pan-meatballs-with-tomato-salad-and-green-sauce"
          ]
        },
        {
          "text": "Ang\u2019s creamy tortellini soup [https://pinchofyum.com/tortellini-soup](https://pinchofyum.com/tortellini-soup)Gnocchi with creamy mushroom sauce [https://pinchofyum.com/gnocchi-with-creamy-mushroom-sauce](https://pinchofyum.com/gnocchi-with-creamy-mushroom-sauce)",
          "checked": true,
          "section": null,
          "source_hint": "https://pinchofyum.com/gnocchi-with-creamy-mushroom-sauce",
          "links": [
            {
              "text": "https://pinchofyum.com/tortellini-soup",
              "url": "https://pinchofyum.com/tortellini-soup"
            },
            {
              "text": "https://pinchofyum.com/gnocchi-with-creamy-mushroom-sauce",
              "url": "https://pinchofyum.com/gnocchi-with-creamy-mushroom-sauce"
            }
          ],
          "urls": [
            "https://pinchofyum.com/tortellini-soup](https://pinchofyum.com/tortellini-soup",
            "https://pinchofyum.com/gnocchi-with-creamy-mushroom-sauce](https://pinchofyum.com/gnocchi-with-creamy-mushroom-sauce"
          ]
        }
      ]
    },
    {
      "file": "Menus/Menu week of 1-17-25.md",
      "title": "Menu week of 1/17/25",
      "week_of_date": "2025-01-17",
      "items": [
        {
          "text": "Sesame apricot tofu [https://pinchofyum.com/sesame-apricot-tofu](https://pinchofyum.com/sesame-apricot-tofu)Thai peanut chicken bowls: [https://pinchofyum.com/thai-peanut-chicken-bowls](https://pinchofyum.com/thai-peanut-chicken-bowls) use chicken thighs",
          "checked": true,
          "section": null,
          "source_hint": null,
          "links": [
            {
              "text": "https://pinchofyum.com/sesame-apricot-tofu",
              "url": "https://pinchofyum.com/sesame-apricot-tofu"
            },
            {
              "text": "https://pinchofyum.com/thai-peanut-chicken-bowls",
              "url": "https://pinchofyum.com/thai-peanut-chicken-bowls"
            }
          ],
          "urls": [
            "https://pinchofyum.com/sesame-apricot-tofu](https://pinchofyum.com/sesame-apricot-tofu",
            "https://pinchofyum.com/thai-peanut-chicken-bowls](https://pinchofyum.com/thai-peanut-chicken-bowls"
          ]
        },
        {
          "text": "Chicken nuggets, broccoli, sweet potato fries",
          "checked": true,
          "section": null,
          "source_hint": null,
          "links": [],
          "urls": []
        },
        {
          "text": "Ground beef tacos",
          "checked": true,
          "section": null,
          "source_hint": null,
          "links": [],
          "urls": []
        },
        {
          "text": "Frozen pizza and salad",
          "checked": true,
          "section": null,
          "source_hint": null,
          "links": [],
          "urls": []
        },
        {
          "text": "Slow cooker vegetarian chili [https://www.gimmesomeoven.com/slow-cooker  no-vegetarian-chili-recipe/#tasty-recipes-63953](https://www.gimmesomeoven.com/slow-cooker-vegetarian-chili-recipe/#tasty-recipes-63953) (cook the onions first) and corn bread muffins",
          "checked": true,
          "section": null,
          "source_hint": null,
          "links": [
            {
              "text": "https://www.gimmesomeoven.com/slow-cooker  no-vegetarian-chili-recipe/#tasty-recipes-63953",
              "url": "https://www.gimmesomeoven.com/slow-cooker-vegetarian-chili-recipe/#tasty-recipes-63953"
            }
          ],
          "urls": [
            "https://www.gimmesomeoven.com/slow-cooker",
            "https://www.gimmesomeoven.com/slow-cooker-vegetarian-chili-recipe/#tasty-recipes-63953"
          ]
        },
        {
          "text": "Short rib ragu [https://pinchofyum.com/instant-pot-short-rib-ragu](https://pinchofyum.com/instant-pot-short-rib-ragu) and fancy pasta in the freezer",
          "checked": true,
          "section": null,
          "source_hint": null,
          "links": [
            {
              "text": "https://pinchofyum.com/instant-pot-short-rib-ragu",
              "url": "https://pinchofyum.com/instant-pot-short-rib-ragu"
            }
          ],
          "urls": [
            "https://pinchofyum.com/instant-pot-short-rib-ragu](https://pinchofyum.com/instant-pot-short-rib-ragu"
          ]
        },
        {
          "text": "Chicken with Coconut Kale (add red pepper)  [https://pinchofyum.com/chicken-with-coconut-kale](https://pinchofyum.com/chicken-with-coconut-kale)",
          "checked": true,
          "section": null,
          "source_hint": "https://pinchofyum.com/chicken-with-coconut-kale",
          "links": [
            {
              "text": "https://pinchofyum.com/chicken-with-coconut-kale",
              "url": "https://pinchofyum.com/chicken-with-coconut-kale"
            }
          ],
          "urls": [
            "https://pinchofyum.com/chicken-with-coconut-kale](https://pinchofyum.com/chicken-with-coconut-kale"
          ]
        }
      ]
    },
    {
      "file": "Menus/Menu week of 1-2-18.md",
      "title": "Menu week of 1/2/18",
      "week_of_date": "2018-01-02",
      "items": [
        {
          "text": "Corned beef and cabbage, potatoes",
          "checked": true,
          "section": null,
          "source_hint": null,
          "links": [],
          "urls": []
        },
        {
          "text": "Golden soup and spinach salad",
          "checked": true,
          "section": null,
          "source_hint": null,
          "links": [],
          "urls": []
        },
        {
          "text": "Tofu green curry and brown rice",
          "checked": true,
          "section": null,
          "source_hint": null,
          "links": [],
          "urls": []
        },
        {
          "text": "Vegetarian Italian chopped salad",
          "checked": true,
          "section": null,
          "source_hint": null,
          "links": [],
          "urls": []
        },
        {
          "text": "Cabbage, sausage, and potato soup",
          "checked": true,
          "section": null,
          "source_hint": null,
          "links": [],
          "urls": []
        },
        {
          "text": "Whole wheat pasta salad with salmon",
          "checked": true,
          "section": null,
          "source_hint": null,
          "links": [],
          "urls": []
        }
      ]
    },
    {
      "file": "Menus/Menu week of 1-20-24.md",
      "title": "Menu week of 1/20/24",
      "week_of_date": "2024-01-20",
      "items": [
        {
          "text": "Black pepper stir fry udon noodles with tofu (Pinch of Yum)",
          "checked": true,
          "section": null,
          "source_hint": "Pinch of Yum",
          "links": [],
          "urls": []
        },
        {
          "text": "Red pepper cashew pasta with cauliflower",
          "checked": true,
          "section": null,
          "source_hint": null,
          "links": [],
          "urls": []
        },
        {
          "text": "Chicken nuggets, sweet potato fries, roasted broccoli",
          "checked": true,
          "section": null,
          "source_hint": null,
          "links": [],
          "urls": []
        },
        {
          "text": "Brats and some kind of roasted vegetable (use sour kraut up)",
          "checked": true,
          "section": null,
          "source_hint": "use sour kraut up",
          "links": [],
          "urls": []
        },
        {
          "text": "Frozen pizza and salad",
          "checked": true,
          "section": null,
          "source_hint": null,
          "links": [],
          "urls": []
        },
        {
          "text": "Crock pot white chicken chili (Iowa Girl Eats)",
          "checked": true,
          "section": null,
          "source_hint": "Iowa Girl Eats",
          "links": [],
          "urls": []
        },
        {
          "text": "Ground beef tacos",
          "checked": true,
          "section": null,
          "source_hint": null,
          "links": [],
          "urls": []
        },
        {
          "text": "Chicken wontons with spicy sauce and roasted broccoli (Pinch of Yum)",
          "checked": true,
          "section": null,
          "source_hint": "Pinch of Yum",
          "links": [],
          "urls": []
        }
      ]
    },
    {
      "file": "Menus/Menu week of 1-21-19.md",
      "title": "Menu week of 1/21/19",
      "week_of_date": "2019-01-21",
      "items": [
        {
          "text": "Cauliflower and tomato coconut curry",
          "checked": true,
          "section": null,
          "source_hint": null,
          "links": [],
          "urls": []
        },
        {
          "text": "Black pepper stir fry noodles",
          "checked": true,
          "section": null,
          "source_hint": null,
          "links": [],
          "urls": []
        },
        {
          "text": "Chicken tinga tacos",
          "checked": true,
          "section": null,
          "source_hint": null,
          "links": [],
          "urls": []
        },
        {
          "text": "Pizza",
          "checked": true,
          "section": null,
          "source_hint": null,
          "links": [],
          "urls": []
        },
        {
          "text": "Quinoa salad with apple, chickpeas, toasted almonds, apple cider vinaigrette",
          "checked": true,
          "section": null,
          "source_hint": null,
          "links": [],
          "urls": []
        },
        {
          "text": "Sweet potato and black bean toastadas",
          "checked": true,
          "section": null,
          "source_hint": null,
          "links": [],
          "urls": []
        },
        {
          "text": "Chicken Caesar salad",
          "checked": true,
          "section": null,
          "source_hint": null,
          "links": [],
          "urls": []
        },
        {
          "text": "Everything Greek pork pitas and Greek salad (take to Haley\u2019s?)",
          "checked": true,
          "section": null,
          "source_hint": "take to Haley\u2019s?",
          "links": [],
          "urls": []
        },
        {
          "text": "Chili",
          "checked": true,
          "section": null,
          "source_hint": null,
          "links": [],
          "urls": []
        }
      ]
    },
    {
      "file": "Menus/Menu week of 1-23-23.md",
      "title": "Menu week of 1/23/23",
      "week_of_date": "2023-01-23",
      "items": [
        {
          "text": "COCONUT CURRY SALMON",
          "checked": true,
          "section": null,
          "source_hint": null,
          "links": [],
          "urls": []
        },
        {
          "text": "SAUSAGE, KALE, AND WHITE BEAN SOUP",
          "checked": true,
          "section": null,
          "source_hint": null,
          "links": [],
          "urls": []
        },
        {
          "text": "WALNUT CHORIZO TACOS",
          "checked": true,
          "section": null,
          "source_hint": null,
          "links": [],
          "urls": []
        },
        {
          "text": "Five ingredient spicy pork [https://pinchofyum.com/5-ingredient-spicy-pork](https://pinchofyum.com/5-ingredient-spicy-pork)Gnocchi with Brussels Sprouts, Chicken Sausage and Pesto",
          "checked": true,
          "section": null,
          "source_hint": null,
          "links": [
            {
              "text": "https://pinchofyum.com/5-ingredient-spicy-pork",
              "url": "https://pinchofyum.com/5-ingredient-spicy-pork"
            }
          ],
          "urls": [
            "https://pinchofyum.com/5-ingredient-spicy-pork](https://pinchofyum.com/5-ingredient-spicy-pork"
          ]
        },
        {
          "text": "ROASTED CAULIFLOWER HUMMUS BOWLS",
          "checked": true,
          "section": null,
          "source_hint": null,
          "links": [],
          "urls": []
        },
        {
          "text": "AVOCADO KALE CAESAR SALAD",
          "checked": true,
          "section": null,
          "source_hint": null,
          "links": [],
          "urls": []
        }
      ]
    },
    {
      "file": "Menus/Menu week of 1-24-20.md",
      "title": "Menu week of 1/24/20",
      "week_of_date": "2020-01-24",
      "items": [
        {
          "text": "Best easy fish tacos",
          "checked": true,
          "section": null,
          "source_hint": null,
          "links": [],
          "urls": []
        },
        {
          "text": "Spaghetti squash burrito boats",
          "checked": true,
          "section": null,
          "source_hint": null,
          "links": [],
          "urls": []
        },
        {
          "text": "Chili",
          "checked": true,
          "section": null,
          "source_hint": null,
          "links": [],
          "urls": []
        },
        {
          "text": "Chicken caesar salad",
          "checked": true,
          "section": null,
          "source_hint": null,
          "links": [],
          "urls": []
        },
        {
          "text": "Korean bbq steak bowls",
          "checked": true,
          "section": null,
          "source_hint": null,
          "links": [],
          "urls": []
        },
        {
          "text": "Instant pot cauliflower mac and cheese",
          "checked": true,
          "section": null,
          "source_hint": null,
          "links": [],
          "urls": []
        },
        {
          "text": "Spicy peanut tofu bowls",
          "checked": true,
          "section": null,
          "source_hint": null,
          "links": [],
          "urls": []
        },
        {
          "text": "Breakfast sandwiches",
          "checked": true,
          "section": null,
          "source_hint": null,
          "links": [],
          "urls": []
        }
      ]
    },
    {
      "file": "Menus/Menu week of 1-24-21.md",
      "title": "Menu week of 1/24/21",
      "week_of_date": "2021-01-24",
      "items": [
        {
          "text": "Chili",
          "checked": true,
          "section": null,
          "source_hint": null,
          "links": [],
          "urls": []
        },
        {
          "text": "Cashew tofu stir fry",
          "checked": true,
          "section": null,
          "source_hint": null,
          "links": [],
          "urls": []
        },
        {
          "text": "Vegetarian Italian Chopped Salad",
          "checked": true,
          "section": null,
          "source_hint": null,
          "links": [],
          "urls": []
        },
        {
          "text": "Slow cooker Olive Garden pasta e fagioli soup",
          "checked": true,
          "section": null,
          "source_hint": null,
          "links": [],
          "urls": []
        },
        {
          "text": "Spicy peanut tofu bowls",
          "checked": true,
          "section": null,
          "source_hint": null,
          "links": [],
          "urls": []
        },
        {
          "text": "Pizza",
          "checked": true,
          "section": null,
          "source_hint": null,
          "links": [],
          "urls": []
        },
        {
          "text": "Instant pot beef stew (can freeze ahead)",
          "checked": true,
          "section": null,
          "source_hint": "can freeze ahead",
          "links": [],
          "urls": []
        },
        {
          "text": "Sheet pan pesto gnocchi",
          "checked": true,
          "section": null,
          "source_hint": null,
          "links": [],
          "urls": []
        },
        {
          "text": "Snack: breakfast balls",
          "checked": false,
          "section": null,
          "source_hint": null,
          "links": [],
          "urls": []
        },
        {
          "text": "Peach smoothie or green smoothie",
          "checked": true,
          "section": null,
          "source_hint": null,
          "links": [],
          "urls": []
        }
      ]
    },
    {
      "file": "Menus/Menu week of 1-28-18.md",
      "title": "Menu week of 1/28/18",
      "week_of_date": "2018-01-28",
      "items": [
        {
          "text": "Buffalo Chicken wontons and apples",
          "checked": true,
          "section": null,
          "source_hint": null,
          "links": [],
          "urls": []
        },
        {
          "text": "Bulgar salad",
          "checked": true,
          "section": null,
          "source_hint": null,
          "links": [],
          "urls": []
        },
        {
          "text": "Curry chicken salad",
          "checked": true,
          "section": null,
          "source_hint": null,
          "links": [],
          "urls": []
        },
        {
          "text": "Cilantro lime chicken meatball bowls",
          "checked": false,
          "section": null,
          "source_hint": null,
          "links": [],
          "urls": []
        },
        {
          "text": "Butternut squash Mac and cheese",
          "checked": false,
          "section": null,
          "source_hint": null,
          "links": [],
          "urls": []
        },
        {
          "text": "Red pepper pasta with roasted cauliflower",
          "checked": true,
          "section": null,
          "source_hint": null,
          "links": [],
          "urls": []
        },
        {
          "text": "Autumn glow salad",
          "checked": true,
          "section": null,
          "source_hint": null,
          "links": [],
          "urls": []
        },
        {
          "text": "feta stuffed buffalo chicken meatballs",
          "checked": true,
          "section": null,
          "source_hint": null,
          "links": [],
          "urls": []
        },
        {
          "text": "Pizza bites",
          "checked": true,
          "section": null,
          "source_hint": null,
          "links": [],
          "urls": []
        },
        {
          "text": "Zesty like shrimp and avocado salad",
          "checked": true,
          "section": null,
          "source_hint": null,
          "links": [],
          "urls": []
        },
        {
          "text": "Fruit (blueberries, mangoes, apples)",
          "checked": true,
          "section": null,
          "source_hint": "blueberries, mangoes, apples",
          "links": [],
          "urls": []
        },
        {
          "text": "Eggs, bacon, potatoes",
          "checked": true,
          "section": null,
          "source_hint": null,
          "links": [],
          "urls": []
        },
        {
          "text": "Dark chocolate almond joy bites",
          "checked": true,
          "section": null,
          "source_hint": null,
          "links": [],
          "urls": []
        }
      ]
    },
    {
      "file": "Menus/Menu week of 1-28-25.md",
      "title": "Menu week of 1/28/25",
      "week_of_date": "2025-01-28",
      "items": [
        {
          "text": "5 ingredient tomato soup and grilled cheese: [https://pinchofyum.com/5-ingredient-tomato-soup](https://pinchofyum.com/5-ingredient-tomato-soup)Black pepper stir fry udon add ground pork  [https://pinchofyum.com/black-pepper-stir-fried-udon](https://pinchofyum.com/black-pepper-stir-fried-udon)",
          "checked": true,
          "section": null,
          "source_hint": "https://pinchofyum.com/black-pepper-stir-fried-udon",
          "links": [
            {
              "text": "https://pinchofyum.com/5-ingredient-tomato-soup",
              "url": "https://pinchofyum.com/5-ingredient-tomato-soup"
            },
            {
              "text": "https://pinchofyum.com/black-pepper-stir-fried-udon",
              "url": "https://pinchofyum.com/black-pepper-stir-fried-udon"
            }
          ],
          "urls": [
            "https://pinchofyum.com/5-ingredient-tomato-soup](https://pinchofyum.com/5-ingredient-tomato-soup",
            "https://pinchofyum.com/black-pepper-stir-fried-udon](https://pinchofyum.com/black-pepper-stir-fried-udon"
          ]
        },
        {
          "text": "Autumn glow salad add chicken [https://pinchofyum.com/autumn-glow-salad-with-lemon-dressing](https://pinchofyum.com/autumn-glow-salad-with-lemon-dressing)Cauliflower walnut taco meat [https://pinchofyum.com/cauliflower-walnut-vegetarian-taco-meat](https://pinchofyum.com/cauliflower-walnut-vegetarian-taco-meat) Double recipe, serve with black beans, pico, cheese, sour cream, corn, salsa, and lettuce",
          "checked": true,
          "section": null,
          "source_hint": null,
          "links": [
            {
              "text": "https://pinchofyum.com/autumn-glow-salad-with-lemon-dressing",
              "url": "https://pinchofyum.com/autumn-glow-salad-with-lemon-dressing"
            },
            {
              "text": "https://pinchofyum.com/cauliflower-walnut-vegetarian-taco-meat",
              "url": "https://pinchofyum.com/cauliflower-walnut-vegetarian-taco-meat"
            }
          ],
          "urls": [
            "https://pinchofyum.com/autumn-glow-salad-with-lemon-dressing](https://pinchofyum.com/autumn-glow-salad-with-lemon-dressing",
            "https://pinchofyum.com/cauliflower-walnut-vegetarian-taco-meat](https://pinchofyum.com/cauliflower-walnut-vegetarian-taco-meat"
          ]
        },
        {
          "text": "Spicy peanut tofu bowls [https://pinchofyum.com/spicy-peanut-tofu-bowls](https://pinchofyum.com/spicy-peanut-tofu-bowls)Chicken nuggets, broccoli, sweet potato fries",
          "checked": true,
          "section": null,
          "source_hint": null,
          "links": [
            {
              "text": "https://pinchofyum.com/spicy-peanut-tofu-bowls",
              "url": "https://pinchofyum.com/spicy-peanut-tofu-bowls"
            }
          ],
          "urls": [
            "https://pinchofyum.com/spicy-peanut-tofu-bowls](https://pinchofyum.com/spicy-peanut-tofu-bowls"
          ]
        },
        {
          "text": "Frozen pizza and salad",
          "checked": true,
          "section": null,
          "source_hint": null,
          "links": [],
          "urls": []
        },
        {
          "text": "Healthier Hamburger Helper [https://www.halfbakedharvest.com/one-pot-hamburger-helper/](https://www.halfbakedharvest.com/one-pot-hamburger-helper/)",
          "checked": true,
          "section": null,
          "source_hint": "https://www.halfbakedharvest.com/one-pot-hamburger-helper/",
          "links": [
            {
              "text": "https://www.halfbakedharvest.com/one-pot-hamburger-helper/",
              "url": "https://www.halfbakedharvest.com/one-pot-hamburger-helper/"
            }
          ],
          "urls": [
            "https://www.halfbakedharvest.com/one-pot-hamburger-helper/](https://www.halfbakedharvest.com/one-pot-hamburger-helper/"
          ]
        }
      ]
    },
    {
      "file": "Menus/Menu week of 1-31-22.md",
      "title": "Menu week of 1/31/22",
      "week_of_date": "2022-01-31",
      "items": [
        {
          "text": "Tofu peanut bowls",
          "checked": false,
          "section": null,
          "source_hint": null,
          "links": [],
          "urls": []
        },
        {
          "text": "Sweet potato tacos",
          "checked": false,
          "section": null,
          "source_hint": null,
          "links": [],
          "urls": []
        },
        {
          "text": "Steaks",
          "checked": false,
          "section": null,
          "source_hint": null,
          "links": [],
          "urls": []
        },
        {
          "text": "Chicken stir fry",
          "checked": true,
          "section": null,
          "source_hint": null,
          "links": [],
          "urls": []
        },
        {
          "text": "Beyond Beef mushroom rice bowls",
          "checked": true,
          "section": null,
          "source_hint": null,
          "links": [],
          "urls": []
        },
        {
          "text": "Panko chicken",
          "checked": true,
          "section": null,
          "source_hint": null,
          "links": [],
          "urls": []
        },
        {
          "text": "Black pepper stir fried udon (POY week 3)",
          "checked": true,
          "section": null,
          "source_hint": null,
          "links": [],
          "urls": []
        },
        {
          "text": "Pita sandwiches",
          "checked": true,
          "section": null,
          "source_hint": null,
          "links": [],
          "urls": []
        },
        {
          "text": "Slow cooker butternut squash tortellini",
          "checked": true,
          "section": null,
          "source_hint": null,
          "links": [],
          "urls": []
        },
        {
          "text": "Garlic caper chicken",
          "checked": true,
          "section": null,
          "source_hint": null,
          "links": [],
          "urls": []
        },
        {
          "text": "Steaks",
          "checked": true,
          "section": null,
          "source_hint": null,
          "links": [],
          "urls": []
        },
        {
          "text": "Blue apron gnocchi",
          "checked": true,
          "section": null,
          "source_hint": null,
          "links": [],
          "urls": []
        },
        {
          "text": "Instant pot wild rice soup",
          "checked": true,
          "section": null,
          "source_hint": null,
          "links": [],
          "urls": []
        },
        {
          "text": "Orange salmon and fried rice",
          "checked": true,
          "section": null,
          "source_hint": null,
          "links": [],
          "urls": []
        },
        {
          "text": "Spicy shrimp tacos with garlic cilantro lime slaw",
          "checked": true,
          "section": null,
          "source_hint": null,
          "links": [],
          "urls": []
        },
        {
          "text": "Blue apron chicken",
          "checked": true,
          "section": null,
          "source_hint": null,
          "links": [],
          "urls": []
        },
        {
          "text": "Snack: cookie dough energy bites",
          "checked": true,
          "section": null,
          "source_hint": null,
          "links": [],
          "urls": []
        },
        {
          "text": "Anytime: simple greens salad",
          "checked": true,
          "section": null,
          "source_hint": null,
          "links": [],
          "urls": []
        },
        {
          "text": "Moe casserole",
          "checked": false,
          "section": null,
          "source_hint": null,
          "links": [],
          "urls": []
        }
      ]
    },
    {
      "file": "Menus/Menu week of 1-4-25.md",
      "title": "Menu week of 1/4/25",
      "week_of_date": "2025-01-04",
      "items": [
        {
          "text": "Autumn glow salad add chicken [https://pinchofyum.com/autumn-glow-salad-with-lemon-dressing](https://pinchofyum.com/autumn-glow-salad-with-lemon-dressing)Cauliflower Orange Gnocchi [https://pinchofyum.com/cauliflower-orange-gnocchi](https://pinchofyum.com/cauliflower-orange-gnocchi)Olive Garden Zuppa Toscana [https://damndelicious.net/2018/03/03/instant-pot-olive-garden-zuppa-toscana-copycat/](https://damndelicious.net/2018/03/03/instant-pot-olive-garden-zuppa-toscana-copycat/) and everyday italian salad  <span style=\"color: #fbb827ff;text-align: left;\">",
          "checked": true,
          "section": null,
          "source_hint": null,
          "links": [
            {
              "text": "https://pinchofyum.com/autumn-glow-salad-with-lemon-dressing",
              "url": "https://pinchofyum.com/autumn-glow-salad-with-lemon-dressing"
            },
            {
              "text": "https://pinchofyum.com/cauliflower-orange-gnocchi",
              "url": "https://pinchofyum.com/cauliflower-orange-gnocchi"
            },
            {
              "text": "https://damndelicious.net/2018/03/03/instant-pot-olive-garden-zuppa-toscana-copycat/",
              "url": "https://damndelicious.net/2018/03/03/instant-pot-olive-garden-zuppa-toscana-copycat/"
            }
          ],
          "urls": [
            "https://pinchofyum.com/autumn-glow-salad-with-lemon-dressing](https://pinchofyum.com/autumn-glow-salad-with-lemon-dressing",
            "https://pinchofyum.com/cauliflower-orange-gnocchi](https://pinchofyum.com/cauliflower-orange-gnocchi",
            "https://damndelicious.net/2018/03/03/instant-pot-olive-garden-zuppa-toscana-copycat/](https://damndelicious.net/2018/03/03/instant-pot-olive-garden-zuppa-toscana-copycat/"
          ]
        },
        {
          "text": "Chicken tacos with green sauce [https://pinchofyum.com/chicken-tacos](https://pinchofyum.com/chicken-tacos) and a makeshift black bean salad",
          "checked": true,
          "section": null,
          "source_hint": null,
          "links": [
            {
              "text": "https://pinchofyum.com/chicken-tacos",
              "url": "https://pinchofyum.com/chicken-tacos"
            }
          ],
          "urls": [
            "https://pinchofyum.com/chicken-tacos](https://pinchofyum.com/chicken-tacos"
          ]
        },
        {
          "text": "Lighter beef and broccoli [https://iowagirleats.com/broccoli-beef-recipe/#wprm-recipe-container-146358](https://iowagirleats.com/broccoli-beef-recipe/#wprm-recipe-container-146358)Chili",
          "checked": true,
          "section": null,
          "source_hint": null,
          "links": [
            {
              "text": "https://iowagirleats.com/broccoli-beef-recipe/#wprm-recipe-container-146358",
              "url": "https://iowagirleats.com/broccoli-beef-recipe/#wprm-recipe-container-146358"
            }
          ],
          "urls": [
            "https://iowagirleats.com/broccoli-beef-recipe/#wprm-recipe-container-146358](https://iowagirleats.com/broccoli-beef-recipe/#wprm-recipe-container-146358"
          ]
        }
      ]
    },
    {
      "file": "Menus/Menu week of 1-9-24.md",
      "title": "Menu week of 1/9/24",
      "week_of_date": "2024-01-09",
      "items": [
        {
          "text": "Sesame apricot tofu with broccoli instead of beans",
          "checked": true,
          "section": null,
          "source_hint": null,
          "links": [],
          "urls": []
        },
        {
          "text": "5 ingredient tomato soup (Pinch of Yum) and grilled cheese",
          "checked": true,
          "section": null,
          "source_hint": null,
          "links": [],
          "urls": []
        },
        {
          "text": "Lighter broccoli beef with brown rice (Iowa Girl Eats)",
          "checked": true,
          "section": null,
          "source_hint": "Iowa Girl Eats",
          "links": [],
          "urls": []
        },
        {
          "text": "Red chile chicken tacos with creamy corn (Pinch of Yum)",
          "checked": true,
          "section": null,
          "source_hint": "Pinch of Yum",
          "links": [],
          "urls": []
        },
        {
          "text": "Frozen pizza and salad",
          "checked": true,
          "section": null,
          "source_hint": null,
          "links": [],
          "urls": []
        },
        {
          "text": "Thai coconut soup with tofu and rice (Pinch of Yum)",
          "checked": true,
          "section": null,
          "source_hint": "Pinch of Yum",
          "links": [],
          "urls": []
        },
        {
          "text": "Gnocchi with Brussels, Chicken sausage, and pesto (gimme some oven)",
          "checked": true,
          "section": null,
          "source_hint": "gimme some oven",
          "links": [],
          "urls": []
        },
        {
          "text": "Butternut squash mac and cheese with caramelized onions, bacon, and apple (Pinch of Yum)",
          "checked": true,
          "section": null,
          "source_hint": "Pinch of Yum",
          "links": [],
          "urls": []
        }
      ]
    },
    {
      "file": "Menus/Menu week of 10-1-23.md",
      "title": "Menu week of 10/1/23",
      "week_of_date": "2023-10-01",
      "items": [
        {
          "text": "Roasted honey nut squash and chickpeas with hot honey (NYT cooking) - make with cous cous",
          "checked": true,
          "section": null,
          "source_hint": null,
          "links": [],
          "urls": []
        },
        {
          "text": "Spanish chicken and potatoes (Pinch of Yum)",
          "checked": true,
          "section": null,
          "source_hint": "Pinch of Yum",
          "links": [],
          "urls": []
        },
        {
          "text": "Spicy peanut tofu bowls (Pinch of Yum)",
          "checked": true,
          "section": null,
          "source_hint": "Pinch of Yum",
          "links": [],
          "urls": []
        },
        {
          "text": "Sheet pan pesto gnocchi (Two Peas and their Pod)",
          "checked": false,
          "section": null,
          "source_hint": "Two Peas and their Pod",
          "links": [],
          "urls": []
        },
        {
          "text": "Slow cooker butternut squash tortellini (Mels kitchen cafe) and bagged salad",
          "checked": false,
          "section": null,
          "source_hint": null,
          "links": [],
          "urls": []
        },
        {
          "text": "Zoo Boo pick up something",
          "checked": true,
          "section": null,
          "source_hint": null,
          "links": [],
          "urls": []
        },
        {
          "text": "Grilled steak, roasted broccoli, potatoes",
          "checked": true,
          "section": null,
          "source_hint": null,
          "links": [],
          "urls": []
        }
      ]
    },
    {
      "file": "Menus/Menu week of 10-10-21.md",
      "title": "Menu week of 10/10/21",
      "week_of_date": "2021-10-10",
      "items": [
        {
          "text": "Instant pot butter chicken",
          "checked": false,
          "section": null,
          "source_hint": null,
          "links": [],
          "urls": []
        },
        {
          "text": "Burgers and bagged salad, frozen sweet potato fries",
          "checked": true,
          "section": null,
          "source_hint": null,
          "links": [],
          "urls": []
        },
        {
          "text": "Roasted sweet potato tacos",
          "checked": true,
          "section": null,
          "source_hint": null,
          "links": [],
          "urls": []
        },
        {
          "text": "Chicken Caesar salad",
          "checked": true,
          "section": null,
          "source_hint": null,
          "links": [],
          "urls": []
        },
        {
          "text": "Italian beef and salad (with $$ dear mom greens)",
          "checked": true,
          "section": null,
          "source_hint": "with $$ dear mom greens",
          "links": [],
          "urls": []
        },
        {
          "text": "Spicy peanut tofu bowls",
          "checked": true,
          "section": null,
          "source_hint": null,
          "links": [],
          "urls": []
        },
        {
          "text": "Black pepper stir fry udon (pinch of yum sos series - add stir fry beef)",
          "checked": true,
          "section": null,
          "source_hint": "pinch of yum sos series - add stir fry beef",
          "links": [],
          "urls": []
        },
        {
          "text": "BLTAs",
          "checked": true,
          "section": null,
          "source_hint": null,
          "links": [],
          "urls": []
        },
        {
          "text": "Sheet pan sausage and peppers (serve as sandwiches with provolone and pasta sauce) - Get baguette from Amelia\u2019s",
          "checked": true,
          "section": null,
          "source_hint": null,
          "links": [],
          "urls": []
        },
        {
          "text": "Instant pot cilantro lime chicken and lentil rice bowls",
          "checked": false,
          "section": null,
          "source_hint": null,
          "links": [],
          "urls": []
        },
        {
          "text": "Moe\u2019s casseroles",
          "checked": false,
          "section": null,
          "source_hint": null,
          "links": [],
          "urls": []
        },
        {
          "text": "Fy",
          "checked": false,
          "section": null,
          "source_hint": null,
          "links": [],
          "urls": []
        }
      ]
    },
    {
      "file": "Menus/Menu week of 10-11-23.md",
      "title": "Menu week of 10/11/23",
      "week_of_date": "2023-10-11",
      "items": [
        {
          "text": "Instant pot chicken noodle soup (Spend with Pennies)",
          "checked": true,
          "section": null,
          "source_hint": "Spend with Pennies",
          "links": [],
          "urls": []
        },
        {
          "text": "Frozen pizza and salad",
          "checked": true,
          "section": null,
          "source_hint": null,
          "links": [],
          "urls": []
        },
        {
          "text": "Spaghetti with Crispy Zucchini",
          "checked": false,
          "section": null,
          "source_hint": null,
          "links": [],
          "urls": []
        },
        {
          "text": "Roasted vegetable bowls",
          "checked": true,
          "section": null,
          "source_hint": null,
          "links": [],
          "urls": []
        },
        {
          "text": "Chicken Tinga Tacos",
          "checked": true,
          "section": null,
          "source_hint": null,
          "links": [],
          "urls": []
        },
        {
          "text": "Cilantro Orange Chicken",
          "checked": true,
          "section": null,
          "source_hint": null,
          "links": [],
          "urls": []
        },
        {
          "text": "Salmon Burgers with Slaw",
          "checked": true,
          "section": null,
          "source_hint": null,
          "links": [],
          "urls": []
        }
      ]
    },
    {
      "file": "Menus/Menu week of 10-13-22.md",
      "title": "Menu week of 10/13/22",
      "week_of_date": "2022-10-13",
      "items": [
        {
          "text": "Roasted veggie pitas with avocado dip",
          "checked": false,
          "section": null,
          "source_hint": null,
          "links": [],
          "urls": []
        },
        {
          "text": "Crunchwrap Supreme",
          "checked": true,
          "section": null,
          "source_hint": null,
          "links": [],
          "urls": []
        },
        {
          "text": "Crockpot chicken gnocchi soup",
          "checked": true,
          "section": null,
          "source_hint": null,
          "links": [],
          "urls": []
        },
        {
          "text": "Saucy gochujang noodles with chicken",
          "checked": true,
          "section": null,
          "source_hint": null,
          "links": [],
          "urls": []
        },
        {
          "text": "Sesame apricot tofu",
          "checked": true,
          "section": null,
          "source_hint": null,
          "links": [],
          "urls": []
        },
        {
          "text": "Steak",
          "checked": true,
          "section": null,
          "source_hint": null,
          "links": [],
          "urls": []
        }
      ]
    },
    {
      "file": "Menus/Menu week of 10-15-17.md",
      "title": "Menu week of 10/15/17",
      "week_of_date": "2017-10-15",
      "items": [
        {
          "text": "Roasted chicken thighs with delicata squash",
          "checked": true,
          "section": null,
          "source_hint": null,
          "links": [],
          "urls": []
        },
        {
          "text": "Sunday morning: eggs and chard, bacon, potatoes?",
          "checked": true,
          "section": null,
          "source_hint": null,
          "links": [],
          "urls": []
        },
        {
          "text": "Cauliflower walnut taco bowls (radishes!!!) with saut\u00e9ed peppers and onions",
          "checked": true,
          "section": null,
          "source_hint": null,
          "links": [],
          "urls": []
        },
        {
          "text": "Orzo with feta, tomatoes, and dill",
          "checked": true,
          "section": null,
          "source_hint": null,
          "links": [],
          "urls": []
        }
      ]
    },
    {
      "file": "Menus/Menu week of 10-18-20.md",
      "title": "Menu week of 10/18/20",
      "week_of_date": "2020-10-18",
      "items": [
        {
          "text": "Cider braised pot roast with caramelized onions and cauliflower rice (takes 3-4 hours in oven)",
          "checked": true,
          "section": null,
          "source_hint": null,
          "links": [],
          "urls": []
        },
        {
          "text": "Feel good fall salad",
          "checked": true,
          "section": null,
          "source_hint": null,
          "links": [],
          "urls": []
        },
        {
          "text": "Beer braised brats with apple mustard slaw",
          "checked": true,
          "section": null,
          "source_hint": null,
          "links": [],
          "urls": []
        },
        {
          "text": "Short rib tacos with pepper mustard slaw (slow cooker)",
          "checked": true,
          "section": null,
          "source_hint": "slow cooker",
          "links": [],
          "urls": []
        },
        {
          "text": "Sheet pan pesto gnocchi (lots of baby tomatoes)",
          "checked": true,
          "section": null,
          "source_hint": "lots of baby tomatoes",
          "links": [],
          "urls": []
        },
        {
          "text": "Sunday: Brown butter gnocchi with roasted butternut squash and kale",
          "checked": true,
          "section": null,
          "source_hint": null,
          "links": [],
          "urls": []
        },
        {
          "text": "Quesadillas and pico",
          "checked": true,
          "section": null,
          "source_hint": null,
          "links": [],
          "urls": []
        },
        {
          "text": "Precooked brats",
          "checked": true,
          "section": null,
          "source_hint": null,
          "links": [],
          "urls": []
        },
        {
          "text": "Kale fried rice",
          "checked": true,
          "section": null,
          "source_hint": null,
          "links": [],
          "urls": []
        },
        {
          "text": "Roast and/or chop one of the butternut squash",
          "checked": false,
          "section": null,
          "source_hint": null,
          "links": [],
          "urls": []
        },
        {
          "text": "Dice and freeze tomatoes",
          "checked": true,
          "section": null,
          "source_hint": null,
          "links": [],
          "urls": []
        },
        {
          "text": "Make granola",
          "checked": true,
          "section": null,
          "source_hint": null,
          "links": [],
          "urls": []
        },
        {
          "text": "Make pico with baby tomatoes",
          "checked": true,
          "section": null,
          "source_hint": null,
          "links": [],
          "urls": []
        },
        {
          "text": "Quick-pickle banana peppers",
          "checked": true,
          "section": null,
          "source_hint": null,
          "links": [],
          "urls": []
        },
        {
          "text": "Harvest the green onions from garden",
          "checked": true,
          "section": null,
          "source_hint": null,
          "links": [],
          "urls": []
        }
      ]
    },
    {
      "file": "Menus/Menu week of 10-21-19.md",
      "title": "Menu week of 10/21/19",
      "week_of_date": "2019-10-21",
      "items": [
        {
          "text": "Maple roasted chicken thighs and winter squashSalmon cakes and slaw",
          "checked": true,
          "section": null,
          "source_hint": null,
          "links": [],
          "urls": []
        },
        {
          "text": "Halloween: chili and cornbread",
          "checked": true,
          "section": null,
          "source_hint": null,
          "links": [],
          "urls": []
        },
        {
          "text": "Spicy peanut soup with sweet potato and kale, salad",
          "checked": true,
          "section": null,
          "source_hint": null,
          "links": [],
          "urls": []
        },
        {
          "text": "Autumn glow salad",
          "checked": true,
          "section": null,
          "source_hint": null,
          "links": [],
          "urls": []
        },
        {
          "text": "Ratatouille and crusty bread",
          "checked": true,
          "section": null,
          "source_hint": null,
          "links": [],
          "urls": []
        },
        {
          "text": "Rosemary Chicken noodle soup, salad",
          "checked": true,
          "section": null,
          "source_hint": null,
          "links": [],
          "urls": []
        },
        {
          "text": "Butternut squash Mac and cheese",
          "checked": true,
          "section": null,
          "source_hint": null,
          "links": [],
          "urls": []
        },
        {
          "text": "Bulgar salad",
          "checked": true,
          "section": null,
          "source_hint": null,
          "links": [],
          "urls": []
        }
      ]
    },
    {
      "file": "Menus/Menu week of 10-22-25.md",
      "title": "Menu week of 10/22/25",
      "week_of_date": "2025-10-22",
      "items": [
        {
          "text": "Butternut squash apple soup and croutons: [https://www.wellplated.com/butternut-squash-soup/#wprm-recipe-container-34260](https://www.wellplated.com/butternut-squash-soup/#wprm-recipe-container-34260)Halloween: Chili and cornbread",
          "checked": true,
          "section": null,
          "source_hint": null,
          "links": [
            {
              "text": "https://www.wellplated.com/butternut-squash-soup/#wprm-recipe-container-34260",
              "url": "https://www.wellplated.com/butternut-squash-soup/#wprm-recipe-container-34260"
            }
          ],
          "urls": [
            "https://www.wellplated.com/butternut-squash-soup/#wprm-recipe-container-34260](https://www.wellplated.com/butternut-squash-soup/#wprm-recipe-container-34260"
          ]
        },
        {
          "text": "Roasted sweet potato tacos [https://www.gimmesomeoven.com/roasted-sweet-potato-tacos/#tasty-recipes-72325-jump-target](https://www.gimmesomeoven.com/roasted-sweet-potato-tacos/#tasty-recipes-72325-jump-target)Halloween: Chili and cornbread",
          "checked": true,
          "section": null,
          "source_hint": null,
          "links": [
            {
              "text": "https://www.gimmesomeoven.com/roasted-sweet-potato-tacos/#tasty-recipes-72325-jump-target",
              "url": "https://www.gimmesomeoven.com/roasted-sweet-potato-tacos/#tasty-recipes-72325-jump-target"
            }
          ],
          "urls": [
            "https://www.gimmesomeoven.com/roasted-sweet-potato-tacos/#tasty-recipes-72325-jump-target](https://www.gimmesomeoven.com/roasted-sweet-potato-tacos/#tasty-recipes-72325-jump-target"
          ]
        },
        {
          "text": "Frozen pizza and salad",
          "checked": true,
          "section": null,
          "source_hint": null,
          "links": [],
          "urls": []
        },
        {
          "text": "Double recipes to bring to Jill Tuesday 10/28:",
          "checked": true,
          "section": null,
          "source_hint": null,
          "links": [],
          "urls": []
        },
        {
          "text": "Pulled pork sandwiches: [https://damndelicious.net/2020/08/08/instant-pot-bbq-pulled-pork/](https://damndelicious.net/2020/08/08/instant-pot-bbq-pulled-pork/)Fruit salad [https://www.loveandlemons.com/fruit-salad-recipe/](https://www.loveandlemons.com/fruit-salad-recipe/)Coleslaw",
          "checked": true,
          "section": null,
          "source_hint": null,
          "links": [
            {
              "text": "https://damndelicious.net/2020/08/08/instant-pot-bbq-pulled-pork/",
              "url": "https://damndelicious.net/2020/08/08/instant-pot-bbq-pulled-pork/"
            },
            {
              "text": "https://www.loveandlemons.com/fruit-salad-recipe/",
              "url": "https://www.loveandlemons.com/fruit-salad-recipe/"
            }
          ],
          "urls": [
            "https://damndelicious.net/2020/08/08/instant-pot-bbq-pulled-pork/](https://damndelicious.net/2020/08/08/instant-pot-bbq-pulled-pork/",
            "https://www.loveandlemons.com/fruit-salad-recipe/](https://www.loveandlemons.com/fruit-salad-recipe/"
          ]
        },
        {
          "text": "Potato salad: [https://www.browneyedbaker.com/best-ever-potato-salad-recipe/](https://www.browneyedbaker.com/best-ever-potato-salad-recipe/)Salted caramel apple pie bars: [https://sallysbakingaddiction.com/salted-caramel-apple-pie-bars/](https://sallysbakingaddiction.com/salted-caramel-apple-pie-bars/)Slow cooker beef stroganoff [https://www.wellplated.com/slow-cooker-beef-stroganoff/#wprm-recipe-container-33048](https://www.wellplated.com/slow-cooker-beef-stroganoff/#wprm-recipe-container-33048)Sheet pan pesto gnocchi [https://www.twopeasandtheirpod.com/sheet-pan-pesto-gnocchi/#wprm-recipe-container-44204](https://www.twopeasandtheirpod.com/sheet-pan-pesto-gnocchi/#wprm-recipe-container-44204)Roasted delicate squash salad and baguette: [https://www.twopeasandtheirpod.com/roasted-delicata-squash-salad/](https://www.twopeasandtheirpod.com/roasted-delicata-squash-salad/)",
          "checked": true,
          "section": null,
          "source_hint": "https://www.twopeasandtheirpod.com/roasted-delicata-squash-salad/",
          "links": [
            {
              "text": "https://www.browneyedbaker.com/best-ever-potato-salad-recipe/",
              "url": "https://www.browneyedbaker.com/best-ever-potato-salad-recipe/"
            },
            {
              "text": "https://sallysbakingaddiction.com/salted-caramel-apple-pie-bars/",
              "url": "https://sallysbakingaddiction.com/salted-caramel-apple-pie-bars/"
            },
            {
              "text": "https://www.wellplated.com/slow-cooker-beef-stroganoff/#wprm-recipe-container-33048",
              "url": "https://www.wellplated.com/slow-cooker-beef-stroganoff/#wprm-recipe-container-33048"
            },
            {
              "text": "https://www.twopeasandtheirpod.com/sheet-pan-pesto-gnocchi/#wprm-recipe-container-44204",
              "url": "https://www.twopeasandtheirpod.com/sheet-pan-pesto-gnocchi/#wprm-recipe-container-44204"
            },
            {
              "text": "https://www.twopeasandtheirpod.com/roasted-delicata-squash-salad/",
              "url": "https://www.twopeasandtheirpod.com/roasted-delicata-squash-salad/"
            }
          ],
          "urls": [
            "https://www.browneyedbaker.com/best-ever-potato-salad-recipe/](https://www.browneyedbaker.com/best-ever-potato-salad-recipe/",
            "https://sallysbakingaddiction.com/salted-caramel-apple-pie-bars/](https://sallysbakingaddiction.com/salted-caramel-apple-pie-bars/",
            "https://www.wellplated.com/slow-cooker-beef-stroganoff/#wprm-recipe-container-33048](https://www.wellplated.com/slow-cooker-beef-stroganoff/#wprm-recipe-container-33048",
            "https://www.twopeasandtheirpod.com/sheet-pan-pesto-gnocchi/#wprm-recipe-container-44204](https://www.twopeasandtheirpod.com/sheet-pan-pesto-gnocchi/#wprm-recipe-container-44204",
            "https://www.twopeasandtheirpod.com/roasted-delicata-squash-salad/](https://www.twopeasandtheirpod.com/roasted-delicata-squash-salad/"
          ]
        }
      ]
    },
    {
      "file": "Menus/Menu week of 10-23-24.md",
      "title": "Menu week of 10/23/24",
      "week_of_date": "2024-10-23",
      "items": [
        {
          "text": "Poblano white chicken chili [https://www.gimmesomeoven.com/poblano-white-chicken-chili/](https://www.gimmesomeoven.com/poblano-white-chicken-chili/)Roasted sweet potato tacos [https://www.gimmesomeoven.com/roasted-sweet-potato-tacos/](https://www.gimmesomeoven.com/roasted-sweet-potato-tacos/)Chili (Halloween)",
          "checked": true,
          "section": null,
          "source_hint": "Halloween",
          "links": [
            {
              "text": "https://www.gimmesomeoven.com/poblano-white-chicken-chili/",
              "url": "https://www.gimmesomeoven.com/poblano-white-chicken-chili/"
            },
            {
              "text": "https://www.gimmesomeoven.com/roasted-sweet-potato-tacos/",
              "url": "https://www.gimmesomeoven.com/roasted-sweet-potato-tacos/"
            }
          ],
          "urls": [
            "https://www.gimmesomeoven.com/poblano-white-chicken-chili/](https://www.gimmesomeoven.com/poblano-white-chicken-chili/",
            "https://www.gimmesomeoven.com/roasted-sweet-potato-tacos/](https://www.gimmesomeoven.com/roasted-sweet-potato-tacos/"
          ]
        },
        {
          "text": "Chicken with Coconut Kale (add red peppers) [https://pinchofyum.com/chicken-with-coconut-kale](https://pinchofyum.com/chicken-with-coconut-kale)Pizza and bagged salad",
          "checked": true,
          "section": null,
          "source_hint": null,
          "links": [
            {
              "text": "https://pinchofyum.com/chicken-with-coconut-kale",
              "url": "https://pinchofyum.com/chicken-with-coconut-kale"
            }
          ],
          "urls": [
            "https://pinchofyum.com/chicken-with-coconut-kale](https://pinchofyum.com/chicken-with-coconut-kale"
          ]
        },
        {
          "text": "Tofu and Brown Lettuce Wraps with Peanut Sauce [https://pinchofyum.com/tofu-and-brown-rice-lettuce-wraps](https://pinchofyum.com/tofu-and-brown-rice-lettuce-wraps)One pot healthier hamburger helper [https://www.halfbakedharvest.com/one-pot-hamburger-helper/](https://www.halfbakedharvest.com/one-pot-hamburger-helper/)Sheet pan pesto gnocchi [https://www.twopeasandtheirpod.com/sheet-pan-pesto-gnocchi/](https://www.twopeasandtheirpod.com/sheet-pan-pesto-gnocchi/)",
          "checked": true,
          "section": null,
          "source_hint": "https://www.twopeasandtheirpod.com/sheet-pan-pesto-gnocchi/",
          "links": [
            {
              "text": "https://pinchofyum.com/tofu-and-brown-rice-lettuce-wraps",
              "url": "https://pinchofyum.com/tofu-and-brown-rice-lettuce-wraps"
            },
            {
              "text": "https://www.halfbakedharvest.com/one-pot-hamburger-helper/",
              "url": "https://www.halfbakedharvest.com/one-pot-hamburger-helper/"
            },
            {
              "text": "https://www.twopeasandtheirpod.com/sheet-pan-pesto-gnocchi/",
              "url": "https://www.twopeasandtheirpod.com/sheet-pan-pesto-gnocchi/"
            }
          ],
          "urls": [
            "https://pinchofyum.com/tofu-and-brown-rice-lettuce-wraps](https://pinchofyum.com/tofu-and-brown-rice-lettuce-wraps",
            "https://www.halfbakedharvest.com/one-pot-hamburger-helper/](https://www.halfbakedharvest.com/one-pot-hamburger-helper/",
            "https://www.twopeasandtheirpod.com/sheet-pan-pesto-gnocchi/](https://www.twopeasandtheirpod.com/sheet-pan-pesto-gnocchi/"
          ]
        },
        {
          "text": "Yellow curry",
          "checked": false,
          "section": null,
          "source_hint": null,
          "links": [],
          "urls": []
        },
        {
          "text": "Red peppers",
          "checked": false,
          "section": null,
          "source_hint": null,
          "links": [],
          "urls": []
        },
        {
          "text": "Poblanos (lots)",
          "checked": false,
          "section": null,
          "source_hint": "lots",
          "links": [],
          "urls": []
        }
      ]
    },
    {
      "file": "Menus/Menu week of 10-25-18.md",
      "title": "Menu week of 10/25/18",
      "week_of_date": "2018-10-25",
      "items": [
        {
          "text": "Friday: Mimi Blue meatballs",
          "checked": true,
          "section": null,
          "source_hint": null,
          "links": [],
          "urls": []
        },
        {
          "text": "Saturday: farmer\u2019s market? pancakes and eggs, chicken enchiladas with green salsa",
          "checked": true,
          "section": null,
          "source_hint": null,
          "links": [],
          "urls": []
        },
        {
          "text": "Sunday: baked oatmeal? butternut squash Mac and cheese",
          "checked": true,
          "section": null,
          "source_hint": null,
          "links": [],
          "urls": []
        },
        {
          "text": "Monday: salad and dinner rolls",
          "checked": true,
          "section": null,
          "source_hint": null,
          "links": [],
          "urls": []
        },
        {
          "text": "Tuesday: jimmy johns or similar (book club at center point)",
          "checked": true,
          "section": null,
          "source_hint": "book club at center point",
          "links": [],
          "urls": []
        },
        {
          "text": "Wed spooky season: chili, cornbread muffins",
          "checked": true,
          "section": null,
          "source_hint": null,
          "links": [],
          "urls": []
        },
        {
          "text": "Thursday: pan-seared chicken with roasted honey nut squash and apple",
          "checked": true,
          "section": null,
          "source_hint": null,
          "links": [],
          "urls": []
        },
        {
          "text": "Friday weenie roast: garlic Spaghetti squash with herbs",
          "checked": true,
          "section": null,
          "source_hint": null,
          "links": [],
          "urls": []
        },
        {
          "text": "Saturday: pizza?",
          "checked": false,
          "section": null,
          "source_hint": null,
          "links": [],
          "urls": []
        }
      ]
    },
    {
      "file": "Menus/Menu week of 10-26-23.md",
      "title": "Menu week of 10/26/23",
      "week_of_date": "2023-10-26",
      "items": [
        {
          "text": "Autumn glow salad",
          "checked": true,
          "section": null,
          "source_hint": null,
          "links": [],
          "urls": []
        },
        {
          "text": "Chili (Halloween) and salad",
          "checked": true,
          "section": null,
          "source_hint": null,
          "links": [],
          "urls": []
        },
        {
          "text": "Moussaka",
          "checked": true,
          "section": null,
          "source_hint": null,
          "links": [],
          "urls": []
        },
        {
          "text": "Frozen pizza",
          "checked": true,
          "section": null,
          "source_hint": null,
          "links": [],
          "urls": []
        },
        {
          "text": "Crispy Black bean tacos",
          "checked": false,
          "section": null,
          "source_hint": null,
          "links": [],
          "urls": []
        },
        {
          "text": "Chicken lettuce wraps with Lime drench",
          "checked": true,
          "section": null,
          "source_hint": null,
          "links": [],
          "urls": []
        },
        {
          "text": "Lemongrass meatball bowls",
          "checked": true,
          "section": null,
          "source_hint": null,
          "links": [],
          "urls": []
        },
        {
          "text": "Parsnips",
          "checked": false,
          "section": null,
          "source_hint": null,
          "links": [],
          "urls": []
        },
        {
          "text": "Butternut squash",
          "checked": false,
          "section": null,
          "source_hint": null,
          "links": [],
          "urls": []
        },
        {
          "text": "Red potatoes",
          "checked": true,
          "section": null,
          "source_hint": null,
          "links": [],
          "urls": []
        },
        {
          "text": "Eggplant",
          "checked": true,
          "section": null,
          "source_hint": null,
          "links": [],
          "urls": []
        },
        {
          "text": "Cauliflower",
          "checked": true,
          "section": null,
          "source_hint": null,
          "links": [],
          "urls": []
        },
        {
          "text": "Purple finger line potatoes",
          "checked": true,
          "section": null,
          "source_hint": null,
          "links": [],
          "urls": []
        },
        {
          "text": "Delicate squash",
          "checked": true,
          "section": null,
          "source_hint": null,
          "links": [],
          "urls": []
        }
      ]
    },
    {
      "file": "Menus/Menu week of 10-27-22.md",
      "title": "Menu week of 10/27/22",
      "week_of_date": "2022-10-27",
      "items": [
        {
          "text": "Broccoli cheese soup",
          "checked": true,
          "section": null,
          "source_hint": null,
          "links": [],
          "urls": []
        },
        {
          "text": "Date night rigatoni with sausage and kale",
          "checked": true,
          "section": null,
          "source_hint": null,
          "links": [],
          "urls": []
        },
        {
          "text": "Chicken pot pie with biscuits",
          "checked": true,
          "section": null,
          "source_hint": null,
          "links": [],
          "urls": []
        },
        {
          "text": "Halloween: \u201cSunday\u201d chili",
          "checked": true,
          "section": null,
          "source_hint": null,
          "links": [],
          "urls": []
        },
        {
          "text": "Baked shrimp with feta and grilled sourdough",
          "checked": true,
          "section": null,
          "source_hint": null,
          "links": [],
          "urls": []
        },
        {
          "text": "Crunchy roll bowls",
          "checked": true,
          "section": null,
          "source_hint": null,
          "links": [],
          "urls": []
        }
      ]
    },
    {
      "file": "Menus/Menu week of 10-31-17.md",
      "title": "Menu week of 10/31/17",
      "week_of_date": "2017-10-31",
      "items": [
        {
          "text": "Tuesday: Chili",
          "checked": true,
          "section": null,
          "source_hint": null,
          "links": [],
          "urls": []
        },
        {
          "text": "Wednesday: Autumn glow salad",
          "checked": true,
          "section": null,
          "source_hint": null,
          "links": [],
          "urls": []
        },
        {
          "text": "Thursday: Alicia babysit for Missy, Sean on own",
          "checked": true,
          "section": null,
          "source_hint": null,
          "links": [],
          "urls": []
        },
        {
          "text": "Friday: Taste of Thanksgiving",
          "checked": true,
          "section": null,
          "source_hint": null,
          "links": [],
          "urls": []
        },
        {
          "text": "Saturday: Turnips with Bacon and Orange (Dooley pg 209), pork chops with apples and onions",
          "checked": true,
          "section": null,
          "source_hint": null,
          "links": [],
          "urls": []
        },
        {
          "text": "Sunday: Beets and caramelized onions with feta, chicken and honey mustard?",
          "checked": false,
          "section": null,
          "source_hint": null,
          "links": [],
          "urls": []
        },
        {
          "text": "Tuesday: balsamic roasted fingerling potatoes and Brussels sprouts, baked tilapia with pecan rosemary topping",
          "checked": false,
          "section": null,
          "source_hint": null,
          "links": [],
          "urls": []
        },
        {
          "text": "Wednesday: butternut squash Mac and cheese",
          "checked": true,
          "section": null,
          "source_hint": null,
          "links": [],
          "urls": []
        }
      ]
    },
    {
      "file": "Menus/Menu week of 10-4-20.md",
      "title": "Menu week of 10/4/20",
      "week_of_date": "2020-10-04",
      "items": [
        {
          "text": "One pot spanish chicken and potatoes",
          "checked": true,
          "section": null,
          "source_hint": null,
          "links": [],
          "urls": []
        },
        {
          "text": "Burgers and roasted potatoes/turnips",
          "checked": true,
          "section": null,
          "source_hint": null,
          "links": [],
          "urls": []
        },
        {
          "text": "Roasted sweet potato tacos (radish on top)",
          "checked": true,
          "section": null,
          "source_hint": "radish on top",
          "links": [],
          "urls": []
        },
        {
          "text": "Sheet pan salmon with bok choy",
          "checked": true,
          "section": null,
          "source_hint": null,
          "links": [],
          "urls": []
        },
        {
          "text": "Baja grain bowls",
          "checked": true,
          "section": null,
          "source_hint": null,
          "links": [],
          "urls": []
        },
        {
          "text": "Butternut squash mac and cheese",
          "checked": true,
          "section": null,
          "source_hint": null,
          "links": [],
          "urls": []
        },
        {
          "text": "Chickpea curry",
          "checked": true,
          "section": null,
          "source_hint": null,
          "links": [],
          "urls": []
        },
        {
          "text": "Weekend: Pumpkin cinnamon rolls",
          "checked": true,
          "section": null,
          "source_hint": null,
          "links": [],
          "urls": []
        }
      ]
    },
    {
      "file": "Menus/Menu week of 10-4-2019.md",
      "title": "Menu week of 10/4/2019",
      "week_of_date": "2019-10-04",
      "items": [
        {
          "text": "Instant pot cauliflower curry",
          "checked": true,
          "section": null,
          "source_hint": null,
          "links": [],
          "urls": []
        },
        {
          "text": "Pan-seared pork chops with roasted butternut squash and apple",
          "checked": true,
          "section": null,
          "source_hint": null,
          "links": [],
          "urls": []
        },
        {
          "text": "Irish potato soup",
          "checked": true,
          "section": null,
          "source_hint": null,
          "links": [],
          "urls": []
        },
        {
          "text": "Cauliflower walnut taco meat burrito bowls, make pico and guac, black beans and corn, saute peppers",
          "checked": true,
          "section": null,
          "source_hint": null,
          "links": [],
          "urls": []
        },
        {
          "text": "Italian drunken noodles",
          "checked": true,
          "section": null,
          "source_hint": null,
          "links": [],
          "urls": []
        },
        {
          "text": "Saturday: One pot Spanish chicken and potatoes",
          "checked": true,
          "section": null,
          "source_hint": null,
          "links": [],
          "urls": []
        },
        {
          "text": "Burgers and apple spinach salad",
          "checked": true,
          "section": null,
          "source_hint": null,
          "links": [],
          "urls": []
        },
        {
          "text": "Sweet potato salad (use spinach instead of kale)",
          "checked": true,
          "section": null,
          "source_hint": "use spinach instead of kale",
          "links": [],
          "urls": []
        }
      ]
    },
    {
      "file": "Menus/Menu week of 10-4-25.md",
      "title": "Menu week of 10/4/25",
      "week_of_date": "2025-10-04",
      "items": [
        {
          "text": "Poblano white chicken chili [https://www.gimmesomeoven.com/poblano-white-chicken-chili/](https://www.gimmesomeoven.com/poblano-white-chicken-chili/)Slow cooker butternut squash tortellini  [https://www.melskitchencafe.com/slow-cooker-butternut-squash-tortellini/](https://www.melskitchencafe.com/slow-cooker-butternut-squash-tortellini/)Instant pot chicken noodle soup [https://www.spendwithpennies.com/instant-pot-chicken-noodle-soup/](https://www.spendwithpennies.com/instant-pot-chicken-noodle-soup/)Frozen pizza and bagged salad",
          "checked": true,
          "section": null,
          "source_hint": null,
          "links": [
            {
              "text": "https://www.gimmesomeoven.com/poblano-white-chicken-chili/",
              "url": "https://www.gimmesomeoven.com/poblano-white-chicken-chili/"
            },
            {
              "text": "https://www.melskitchencafe.com/slow-cooker-butternut-squash-tortellini/",
              "url": "https://www.melskitchencafe.com/slow-cooker-butternut-squash-tortellini/"
            },
            {
              "text": "https://www.spendwithpennies.com/instant-pot-chicken-noodle-soup/",
              "url": "https://www.spendwithpennies.com/instant-pot-chicken-noodle-soup/"
            }
          ],
          "urls": [
            "https://www.gimmesomeoven.com/poblano-white-chicken-chili/](https://www.gimmesomeoven.com/poblano-white-chicken-chili/",
            "https://www.melskitchencafe.com/slow-cooker-butternut-squash-tortellini/](https://www.melskitchencafe.com/slow-cooker-butternut-squash-tortellini/",
            "https://www.spendwithpennies.com/instant-pot-chicken-noodle-soup/](https://www.spendwithpennies.com/instant-pot-chicken-noodle-soup/"
          ]
        },
        {
          "text": "Caprese pasta salad (Sean lunches) [https://www.forkknifeswoon.com/quick-roasted-tomato-caprese-pasta-salad/](https://www.forkknifeswoon.com/quick-roasted-tomato-caprese-pasta-salad/)Gnocchi with chicken sausage, Brussels sprouts, and pesto [https://www.gimmesomeoven.com/gnocchi-with-brussels-sprouts-chicken-sausage-and-kale-pesto/#tasty-recipes-64011](https://www.gimmesomeoven.com/gnocchi-with-brussels-sprouts-chicken-sausage-and-kale-pesto/#tasty-recipes-64011)Thai yellow chicken curry with potatoes [https://pinchofyum.com/thai-yellow-chicken-curry-with-potatoes](https://pinchofyum.com/thai-yellow-chicken-curry-with-potatoes)White people tacos",
          "checked": true,
          "section": null,
          "source_hint": null,
          "links": [
            {
              "text": "https://www.forkknifeswoon.com/quick-roasted-tomato-caprese-pasta-salad/",
              "url": "https://www.forkknifeswoon.com/quick-roasted-tomato-caprese-pasta-salad/"
            },
            {
              "text": "https://www.gimmesomeoven.com/gnocchi-with-brussels-sprouts-chicken-sausage-and-kale-pesto/#tasty-recipes-64011",
              "url": "https://www.gimmesomeoven.com/gnocchi-with-brussels-sprouts-chicken-sausage-and-kale-pesto/#tasty-recipes-64011"
            },
            {
              "text": "https://pinchofyum.com/thai-yellow-chicken-curry-with-potatoes",
              "url": "https://pinchofyum.com/thai-yellow-chicken-curry-with-potatoes"
            }
          ],
          "urls": [
            "https://www.forkknifeswoon.com/quick-roasted-tomato-caprese-pasta-salad/](https://www.forkknifeswoon.com/quick-roasted-tomato-caprese-pasta-salad/",
            "https://www.gimmesomeoven.com/gnocchi-with-brussels-sprouts-chicken-sausage-and-kale-pesto/#tasty-recipes-64011](https://www.gimmesomeoven.com/gnocchi-with-brussels-sprouts-chicken-sausage-and-kale-pesto/#tasty-recipes-64011",
            "https://pinchofyum.com/thai-yellow-chicken-curry-with-potatoes](https://pinchofyum.com/thai-yellow-chicken-curry-with-potatoes"
          ]
        }
      ]
    },
    {
      "file": "Menus/Menu week of 10-6-18.md",
      "title": "Menu week of 10/6/18",
      "week_of_date": "2018-10-06",
      "items": [
        {
          "text": "Ribs and coleslaw and green beans",
          "checked": true,
          "section": null,
          "source_hint": null,
          "links": [],
          "urls": []
        },
        {
          "text": "Caprese pasta salad",
          "checked": true,
          "section": null,
          "source_hint": null,
          "links": [],
          "urls": []
        },
        {
          "text": "Potato soup and dinner rolls",
          "checked": true,
          "section": null,
          "source_hint": null,
          "links": [],
          "urls": []
        },
        {
          "text": "Salad and rolls",
          "checked": true,
          "section": null,
          "source_hint": null,
          "links": [],
          "urls": []
        },
        {
          "text": "Autumn glow salad",
          "checked": true,
          "section": null,
          "source_hint": null,
          "links": [],
          "urls": []
        },
        {
          "text": "Butternut squash Mac and cheese",
          "checked": true,
          "section": null,
          "source_hint": null,
          "links": [],
          "urls": []
        },
        {
          "text": "Morracan stew packet",
          "checked": true,
          "section": null,
          "source_hint": null,
          "links": [],
          "urls": []
        },
        {
          "text": "Moussaka",
          "checked": true,
          "section": null,
          "source_hint": null,
          "links": [],
          "urls": []
        }
      ]
    },
    {
      "file": "Menus/Menu week of 10-6-22.md",
      "title": "Menu week of 10/6/22",
      "week_of_date": "2022-10-06",
      "items": [
        {
          "text": "Chipotle Orange Shrimp with Cilantro rice",
          "checked": true,
          "section": null,
          "source_hint": null,
          "links": [],
          "urls": []
        },
        {
          "text": "Red Chile Chicken tacos with creamy corn",
          "checked": true,
          "section": null,
          "source_hint": null,
          "links": [],
          "urls": []
        },
        {
          "text": "Black pepper stir fried udon (or in our case, soba cause that\u2019s what the store had)",
          "checked": true,
          "section": null,
          "source_hint": "or in our case, soba cause that\u2019s what the store had",
          "links": [],
          "urls": []
        },
        {
          "text": "Spicy peanut soup with sweet potatoes",
          "checked": true,
          "section": null,
          "source_hint": null,
          "links": [],
          "urls": []
        },
        {
          "text": "Salmon Burgers with Slaw",
          "checked": true,
          "section": null,
          "source_hint": null,
          "links": [],
          "urls": []
        },
        {
          "text": "Instant Pot Pasta with meatballs",
          "checked": true,
          "section": null,
          "source_hint": null,
          "links": [],
          "urls": []
        }
      ]
    },
    {
      "file": "Menus/Menu week of 10-6-24.md",
      "title": "Menu week of 10/6/24",
      "week_of_date": "2024-10-06",
      "items": [
        {
          "text": "Monday or Tuesday: Sesame apricot tofu (double and use baby bok chop and beans) [https://pinchofyum.com/sesame-apricot-tofu](https://pinchofyum.com/sesame-apricot-tofu)**Black Bean, Corn, and Red Pepper Salad With Lime Cilantro Vinaigrette Recipe (add baby tomatoes)** **[https://www.seriouseats.com/black-bean-corn-red-pepper-salad-lime-cilantro-vinaigrette-recipe](https://www.seriouseats.com/black-bean-corn-red-pepper-salad-lime-cilantro-vinaigrette-recipe)**  **and Slow cooker carnitas (add tomatillos) :** **[https://www.mykitchenaddiction.com/2012/09/slow-cooker-carnitas/](https://www.mykitchenaddiction.com/2012/09/slow-cooker-carnitas/)**Pasta salad: [https://pinchofyum.com/pasta-salad](https://pinchofyum.com/pasta-salad)Frozen pizza and salad",
          "checked": true,
          "section": null,
          "source_hint": null,
          "links": [
            {
              "text": "https://pinchofyum.com/sesame-apricot-tofu",
              "url": "https://pinchofyum.com/sesame-apricot-tofu"
            },
            {
              "text": "https://www.seriouseats.com/black-bean-corn-red-pepper-salad-lime-cilantro-vinaigrette-recipe",
              "url": "https://www.seriouseats.com/black-bean-corn-red-pepper-salad-lime-cilantro-vinaigrette-recipe"
            },
            {
              "text": "https://www.mykitchenaddiction.com/2012/09/slow-cooker-carnitas/",
              "url": "https://www.mykitchenaddiction.com/2012/09/slow-cooker-carnitas/"
            },
            {
              "text": "https://pinchofyum.com/pasta-salad",
              "url": "https://pinchofyum.com/pasta-salad"
            }
          ],
          "urls": [
            "https://pinchofyum.com/sesame-apricot-tofu](https://pinchofyum.com/sesame-apricot-tofu",
            "https://www.seriouseats.com/black-bean-corn-red-pepper-salad-lime-cilantro-vinaigrette-recipe](https://www.seriouseats.com/black-bean-corn-red-pepper-salad-lime-cilantro-vinaigrette-recipe",
            "https://www.mykitchenaddiction.com/2012/09/slow-cooker-carnitas/](https://www.mykitchenaddiction.com/2012/09/slow-cooker-carnitas/",
            "https://pinchofyum.com/pasta-salad](https://pinchofyum.com/pasta-salad"
          ]
        },
        {
          "text": "Slow cooker vegetarian chili [https://www.gimmesomeoven.com/slow-cooker-vegetarian-chili-recipe/#more-35175](https://www.gimmesomeoven.com/slow-cooker-vegetarian-chili-recipe/#more-35175)Easy pepper steak [https://www.gimmesomeoven.com/easy-pepper-steak-recipe/#tasty-recipes-65683](https://www.gimmesomeoven.com/easy-pepper-steak-recipe/#tasty-recipes-65683)",
          "checked": true,
          "section": null,
          "source_hint": null,
          "links": [
            {
              "text": "https://www.gimmesomeoven.com/slow-cooker-vegetarian-chili-recipe/#more-35175",
              "url": "https://www.gimmesomeoven.com/slow-cooker-vegetarian-chili-recipe/#more-35175"
            },
            {
              "text": "https://www.gimmesomeoven.com/easy-pepper-steak-recipe/#tasty-recipes-65683",
              "url": "https://www.gimmesomeoven.com/easy-pepper-steak-recipe/#tasty-recipes-65683"
            }
          ],
          "urls": [
            "https://www.gimmesomeoven.com/slow-cooker-vegetarian-chili-recipe/#more-35175](https://www.gimmesomeoven.com/slow-cooker-vegetarian-chili-recipe/#more-35175",
            "https://www.gimmesomeoven.com/easy-pepper-steak-recipe/#tasty-recipes-65683](https://www.gimmesomeoven.com/easy-pepper-steak-recipe/#tasty-recipes-65683"
          ]
        }
