{
  "items": [
    {
      "url": "https://pinchofyum.com/spicy-peanut-tofu-bowls",
      "urls": [
        "https://pinchofyum.com/spicy-peanut-tofu-bowls"
      ],
      "link_texts": [
        "Spicy Peanut Tofu Bowls",
        "https://pinchofyum.com/spicy-peanut-tofu-bowls"
      ],
      "menu_files": [
        "Menus/Easy post baby recipes.md",
        "Menus/Menu week of 1-24-20.md",
        "Menus/Menu week of 1-24-21.md",
        "Menus/Menu week of 1-28-25.md",
        "Menus/Menu week of 10-1-23.md",
        "Menus/Menu week of 10-10-21.md",
        "Menus/Menu week of 11-20-24.md",
        "Menus/Menu week of 11-3-21.md",
        "Menus/Menu week of 11-5-25.md",
        "Menus/Menu week of 11-8-23.md",
        "Menus/Menu week of 12-19-24.md",
        "Menus/Menu week of 12-22-21.md",
        "Menus/Menu week of 12-31-19.md",
        "Menus/Menu week of 2-2-24.md",
        "Menus/Menu week of 2-20-23.md",
        "Menus/Menu week of 2-27-22.md",
        "Menus/Menu week of 2-6-23.md",
        "Menus/Menu week of 3-12-25.md",
        "Menus/Menu week of 3-19-21.md",
        "Menus/Menu week of 3-29-22.md",
        "Menus/Menu week of 4-11-25.md",
        "Menus/Menu week of 4-2-2020.md",
        "Menus/Menu week of 4-28-22.md",
        "Menus/Menu week of 4-4-24.md",
        "Menus/Menu week of 5-1-24.md",
        "Menus/Menu week of 5-15-25.md",
        "Menus/Menu week of 5-22-20.md",
        "Menus/Menu week of 5-26-25.md",
        "Menus/Menu week of 5-8-23.md",
        "Menus/Menu week of 6-24-25.md",
        "Menus/Menu week of 7-20.md",
        "Menus/Menu week of 7-5-25.md",
        "Menus/Menu week of 8-20-23.md",
        "Menus/Menu week of 9-1-21.md",
        "Menus/Menu week of 9-19-21.md"
      ],
      "menu_weeks": [
        "2020-01-24",
        "2021-01-24",
        "2025-01-28",
        "2023-10-01",
        "2021-10-10",
        "2024-11-20",
        "2021-11-03",
        "2025-11-05",
        "2023-11-08",
        "2024-12-19",
        "2021-12-22",
        "2019-12-31",
        "2024-02-02",
        "2023-02-20",
        "2022-02-27",
        "2023-02-06",
        "2025-03-12",
        "2021-03-19",
        "2022-03-29",
        "2025-04-11",
        "2020-04-02",
        "2022-04-28",
        "2024-04-04",
        "2024-05-01",
        "2025-05-15",
        "2020-05-22",
        "2025-05-26",
        "2023-05-08",
        "2025-06-24",
        "2025-07-05",
        "2023-08-20",
        "2021-09-01",
        "2021-09-19"
      ],
      "menu_seasons": [
        "unknown",
        "winter",
        "fall",
        "spring",
        "summer"
      ],
      "meal_types": [
        "dinner"
      ],
      "sections": [],
      "source_hints": [
        "https://pinchofyum.com/spicy-peanut-tofu-bowls",
        "Pinch of Yum"
      ],
      "item_texts": [
        "Spicy peanut tofu bowls",
        "Spicy peanut tofu bowls (Pinch of Yum)",
        "Spicy peanut tofu bowls:",
        "Spicy Peanut Tofu Bowls",
        "Monday - spicy peanut tofu bowls",
        "Spicy peanut tofu bowls White people tacos",
        "Spicy Peanut tofu bowls",
        "Spicy peanut tofu bowls Skillet lasagna (anita to make - see phone of recipe she texted)"
      ],
      "count": 35
    },
    {
      "url": "https://pinchofyum.com/black-pepper-stir-fried-udon",
      "urls": [
        "https://pinchofyum.com/black-pepper-stir-fried-udon"
      ],
      "link_texts": [
        "Black Pepper Stir Fried Udon",
        "https://pinchofyum.com/black-pepper-stir-fried-udon"
      ],
      "menu_files": [
        "Menus/Menu week of 1-20-24.md",
        "Menus/Menu week of 1-21-19.md",
        "Menus/Menu week of 1-28-25.md",
        "Menus/Menu week of 10-10-21.md",
        "Menus/Menu week of 10-7-17.md",
        "Menus/Menu week of 11-16-20.md",
        "Menus/Menu week of 11-3-21.md",
        "Menus/Menu week of 11-6-18.md",
        "Menus/Menu week of 12-10-23.md",
        "Menus/Menu week of 12-15-17.md",
        "Menus/Menu week of 12-4-25.md",
        "Menus/Menu week of 2-11-25.md",
        "Menus/Menu week of 3-29-22.md",
        "Menus/Menu week of 3-30-25.md",
        "Menus/Menu week of 4-10-22.md",
        "Menus/Menu week of 4-11-25.md",
        "Menus/Menu week of 4-28-22.md",
        "Menus/Menu week of 5-19-21.md",
        "Menus/Menu week of 5-6-19.md",
        "Menus/Menu week of 6-10-18.md",
        "Menus/Menu week of 6-5-23.md",
        "Menus/Menu week of 7-8-22.md",
        "Menus/Menu week of 9-19-21.md",
        "Menus/Menu week of 9-21-17.md",
        "Menus/Menu week of 9-6-18.md",
        "Menus/Sean Bachelor.md"
      ],
      "menu_weeks": [
        "2024-01-20",
        "2019-01-21",
        "2025-01-28",
        "2021-10-10",
        "2017-10-07",
        "2020-11-16",
        "2021-11-03",
        "2018-11-06",
        "2023-12-10",
        "2017-12-15",
        "2025-12-04",
        "2025-02-11",
        "2022-03-29",
        "2025-03-30",
        "2022-04-10",
        "2025-04-11",
        "2022-04-28",
        "2021-05-19",
        "2019-05-06",
        "2018-06-10",
        "2023-06-05",
        "2022-07-08",
        "2021-09-19",
        "2017-09-21",
        "2018-09-06"
      ],
      "menu_seasons": [
        "winter",
        "fall",
        "spring",
        "summer",
        "unknown"
      ],
      "meal_types": [
        "dinner"
      ],
      "sections": [],
      "source_hints": [
        "Pinch of Yum",
        "https://pinchofyum.com/black-pepper-stir-fried-udon",
        "pinch of yum sos series - add stir fry beef",
        "with tofu",
        "add tofu",
        "pinch of yum"
      ],
      "item_texts": [
        "Black pepper stir fry udon noodles with tofu (Pinch of Yum)",
        "Black pepper stir fry noodles",
        "Black pepper stir fry udon add ground pork",
        "Black pepper stir fry udon (pinch of yum sos series - add stir fry beef)",
        "Black pepper stir fry noodles with baby bok choy and diakon",
        "Black pepper stir fry noodles with baby bok choy",
        "Black pepper stir fry udon (with tofu)",
        "Friday: black pepper stir fry noodles",
        "Black pepper stir fry udon noodles",
        "Tuesday: Black pepper stir fry udon noodles",
        "Black pepper stir fry udon noddles with stir fry beef",
        "Black pepper stir fry udon (add tofu)",
        "Black pepper stir fry noodles and bok choy",
        "Black pepper stir fry udon with stir fry beef (Pinch of Yum)",
        "Black pepper stir fry noodles with spinach",
        "Black pepper stir fry noodles with tofu (pinch of yum)",
        "Black pepper stir fry udon tofu"
      ],
      "count": 26
    },
    {
      "url": "https://pinchofyum.com/sesame-apricot-tofu",
      "urls": [
        "https://pinchofyum.com/sesame-apricot-tofu"
      ],
      "link_texts": [
        "Sesame Apricot Tofu",
        "https://pinchofyum.com/sesame-apricot-tofu"
      ],
      "menu_files": [
        "Menus/Menu week of 1-13-22.md",
        "Menus/Menu week of 1-17-25.md",
        "Menus/Menu week of 1-9-24.md",
        "Menus/Menu week of 10-13-22.md",
        "Menus/Menu week of 10-6-24.md",
        "Menus/Menu week of 12-19-25.md",
        "Menus/Menu week of 12-31-25.md",
        "Menus/Menu week of 2-11-25.md",
        "Menus/Menu week of 2-16-24.md",
        "Menus/Menu week of 2-27-25.md",
        "Menus/Menu week of 2-29-24.md",
        "Menus/Menu week of 3-30-25.md",
        "Menus/Menu week of 4-11-25.md",
        "Menus/Menu week of 4-23-23.md",
        "Menus/Menu week of 5-21-23.md",
        "Menus/Menu week of 6-26-23.md",
        "Menus/Menu week of 7-14-24.md",
        "Menus/Menu week of 7-25-24.md",
        "Menus/Menu week of 8-3-23.md",
        "Menus/Menu week of 9-2-23.md",
        "Menus/Week of 7-14-25.md"
      ],
      "menu_weeks": [
        "2022-01-13",
        "2025-01-17",
        "2024-01-09",
        "2022-10-13",
        "2024-10-06",
        "2025-12-19",
        "2025-12-31",
        "2025-02-11",
        "2024-02-16",
        "2025-02-27",
        "2024-02-29",
        "2025-03-30",
        "2025-04-11",
        "2023-04-23",
        "2023-05-21",
        "2023-06-26",
        "2024-07-14",
        "2024-07-25",
        "2023-08-03",
        "2023-09-02",
        "2025-07-14"
      ],
      "menu_seasons": [
        "winter",
        "fall",
        "spring",
        "summer"
      ],
      "meal_types": [
        "dinner"
      ],
      "sections": [],
      "source_hints": [
        "Pinch of Yum",
        "https://pinchofyum.com/sesame-apricot-tofu"
      ],
      "item_texts": [
        "Sesame apricot tofu (Pinch of Yum)",
        "Sesame apricot tofu",
        "Sesame apricot tofu with broccoli instead of beans",
        "Monday or Tuesday: Sesame apricot tofu (double and use baby bok chop and beans)",
        "Sesame Apricot tofu",
        "Sesame apricot tofu with broccoli instead of green beans",
        "Sesame apricot tofu with canned green beans (double)",
        "Sesame apricot tofu and green beans:",
        "Sesame apricot tofu and green beans: Brats and some vegetable from the CSA",
        "Sesame apricot tofu (Pinch of Yum) 0 can use chicken instead and my mom\u2019s green beans. double the sauce recipe",
        "Sesame apricot tofu BLTs and Panera broccoli cheddar soup"
      ],
      "count": 22
    },
    {
      "url": "https://www.gimmesomeoven.com/roasted-sweet-potato-tacos/",
      "urls": [
        "https://www.gimmesomeoven.com/roasted-sweet-potato-tacos/"
      ],
      "link_texts": [
        "Roasted Sweet Potato Tacos",
        "https://www.gimmesomeoven.com/roasted-sweet-potato-tacos/"
      ],
      "menu_files": [
        "Menus/Easy post baby recipes.md",
        "Menus/Menu week of 10-10-21.md",
        "Menus/Menu week of 10-23-24.md",
        "Menus/Menu week of 10-4-20.md",
        "Menus/Menu week of 11-3-21.md",
        "Menus/Menu week of 12-19-25.md",
        "Menus/Menu week of 12-22-21.md",
        "Menus/Menu week of 12-4-25.md",
        "Menus/Menu week of 12-6-24.md",
        "Menus/Menu week of 2-23-21.md",
        "Menus/Menu week of 2-29-24.md",
        "Menus/Menu week of 3-9-21.md",
        "Menus/Menu week of 4-28-22.md",
        "Menus/Menu week of 4-3-21.md",
        "Menus/Menu week of 5-19-21.md",
        "Menus/Menu week of 5-22-20.md",
        "Menus/Menu week of 5-7-20.md",
        "Menus/Menu week of 6-1-22.md",
        "Menus/Menu week of 7-8-22.md",
        "Menus/Menu week of 7-8-23.md",
        "Menus/Menu week of 9-1-21.md"
      ],
      "menu_weeks": [
        "2021-10-10",
        "2024-10-23",
        "2020-10-04",
        "2021-11-03",
        "2025-12-19",
        "2021-12-22",
        "2025-12-04",
        "2024-12-06",
        "2021-02-23",
        "2024-02-29",
        "2021-03-09",
        "2022-04-28",
        "2021-04-03",
        "2021-05-19",
        "2020-05-22",
        "2020-05-07",
        "2022-06-01",
        "2022-07-08",
        "2023-07-08",
        "2021-09-01"
      ],
      "menu_seasons": [
        "unknown",
        "fall",
        "winter",
        "spring",
        "summer"
      ],
      "meal_types": [
        "dinner"
      ],
      "sections": [],
      "source_hints": [
        "https://www.gimmesomeoven.com/roasted-sweet-potato-tacos/",
        "radish on top",
        "Gimme some Oven",
        "Gimme Some Oven"
      ],
      "item_texts": [
        "Roasted sweet potato tacos",
        "Roasted sweet potato tacos Chili (Halloween)",
        "Roasted sweet potato tacos (radish on top)",
        "Roasted sweet potato tacos: Chicken nuggets, broccoli, sweet potato fries",
        "Roasted Sweet Potato Tacos",
        "Roasted sweet potato tacos (Gimme some Oven)",
        "PizzaRoasted Sweet Potato Tacos",
        "Roasted sweet potato tacos (Gimme Some Oven)"
      ],
      "count": 21
    },
    {
      "url": "https://pinchofyum.com/autumn-glow-salad-with-lemon-dressing",
      "urls": [
        "https://pinchofyum.com/autumn-glow-salad-with-lemon-dressing"
      ],
      "link_texts": [
        "Autumn Glow Salad with Lemon Dressing",
        "https://pinchofyum.com/autumn-glow-salad-with-lemon-dressing"
      ],
      "menu_files": [
        "Menus/Menu week of 1-28-18.md",
        "Menus/Menu week of 1-28-25.md",
        "Menus/Menu week of 1-4-25.md",
        "Menus/Menu week of 10-21-19.md",
        "Menus/Menu week of 10-26-23.md",
        "Menus/Menu week of 10-31-17.md",
        "Menus/Menu week of 10-6-18.md",
        "Menus/Menu week of 11-1-20.md",
        "Menus/Menu week of 11-20-24.md",
        "Menus/Menu week of 11-3-21.md",
        "Menus/Menu week of 11-5-25.md",
        "Menus/Menu week of 11-6-18.md",
        "Menus/Menu week of 11-8-24.md",
        "Menus/Menu week of 12-21-20.md",
        "Menus/Menu week of 12-31-25.md",
        "Menus/Menu week of 12-7-20.md",
        "Menus/Menu week of 12-8-21.md",
        "Menus/Menu week of 3-1-19.md",
        "Menus/Week of 12-14-22.md"
      ],
      "menu_weeks": [
        "2018-01-28",
        "2025-01-28",
        "2025-01-04",
        "2019-10-21",
        "2023-10-26",
        "2017-10-31",
        "2018-10-06",
        "2020-11-01",
        "2024-11-20",
        "2021-11-03",
        "2025-11-05",
        "2018-11-06",
        "2024-11-08",
        "2020-12-21",
        "2025-12-31",
        "2020-12-07",
        "2021-12-08",
        "2019-03-01",
        "2022-12-14"
      ],
      "menu_seasons": [
        "winter",
        "fall",
        "spring"
      ],
      "meal_types": [
        "dinner"
      ],
      "sections": [],
      "source_hints": [
        "https://pinchofyum.com/autumn-glow-salad-with-lemon-dressing"
      ],
      "item_texts": [
        "Autumn glow salad",
        "Autumn glow salad add chicken",
        "Wednesday: Autumn glow salad",
        "Autumn glow salad with lemon dressing"
      ],
      "count": 19
    },
    {
      "url": "https://www.twopeasandtheirpod.com/sheet-pan-pesto-gnocchi/",
      "urls": [
        "https://www.twopeasandtheirpod.com/sheet-pan-pesto-gnocchi/"
      ],
      "link_texts": [
        "Sheet Pan Pesto Gnocchi",
        "https://www.twopeasandtheirpod.com/sheet-pan-pesto-gnocchi/"
      ],
      "menu_files": [
        "Menus/Menu week of 1-24-21.md",
        "Menus/Menu week of 10-1-23.md",
        "Menus/Menu week of 10-18-20.md",
        "Menus/Menu week of 10-23-24.md",
        "Menus/Menu week of 11-28-19.md",
        "Menus/Menu week of 11-6-19.md",
        "Menus/Menu week of 11-8-23.md",
        "Menus/Menu week of 2-6-23.md",
        "Menus/Menu week of 3-12-22.md",
        "Menus/Menu week of 3-20-23.md",
        "Menus/Menu week of 3-21-20.md",
        "Menus/Menu week of 4-28-22.md",
        "Menus/Menu week of 5-18-22.md",
        "Menus/Menu week of 5-19-21.md",
        "Menus/Menu week of 5-7-20.md",
        "Menus/Menu week of 8-1-19.md",
        "Menus/Menu week of 8-3-23.md",
        "Menus/Menu week of 9-17-23.md"
      ],
      "menu_weeks": [
        "2021-01-24",
        "2023-10-01",
        "2020-10-18",
        "2024-10-23",
        "2019-11-28",
        "2019-11-06",
        "2023-11-08",
        "2023-02-06",
        "2022-03-12",
        "2023-03-20",
        "2020-03-21",
        "2022-04-28",
        "2022-05-18",
        "2021-05-19",
        "2020-05-07",
        "2019-08-01",
        "2023-08-03",
        "2023-09-17"
      ],
      "menu_seasons": [
        "winter",
        "fall",
        "spring",
        "summer"
      ],
      "meal_types": [
        "dinner"
      ],
      "sections": [],
      "source_hints": [
        "Two Peas and their Pod",
        "lots of baby tomatoes",
        "https://www.twopeasandtheirpod.com/sheet-pan-pesto-gnocchi/"
      ],
      "item_texts": [
        "Sheet pan pesto gnocchi",
        "Sheet pan pesto gnocchi (Two Peas and their Pod)",
        "Sheet pan pesto gnocchi (lots of baby tomatoes)",
        "Sheet pan pesto gnocchi x2"
      ],
      "count": 18
    },
    {
      "url": "https://www.browneyedbaker.com/best-buttermilk-pancakes/",
      "urls": [
        "https://www.browneyedbaker.com/best-buttermilk-pancakes/"
      ],
      "link_texts": [
        "Best Buttermilk Pancakes"
      ],
      "menu_files": [
        "Menus/Menu week of 10-25-18.md",
        "Menus/Menu week of 11-3-21.md",
        "Menus/Menu week of 3-21-20.md",
        "Menus/Menu week of 3-7-20.md",
        "Menus/Menu week of 4-2-2020.md",
        "Menus/Menu week of 4-22-20.md",
        "Menus/Menu week of 5-1-21.md",
        "Menus/Menu week of 5-1-24.md",
        "Menus/Menu week of 6-12-24.md",
        "Menus/Menu week of 7-2-20 (vacation).md",
        "Menus/Menu week of 7-5-19.md",
        "Menus/Menu week of 8-12-18.md",
        "Menus/Menu week of 8-22-18.md",
        "Menus/Menu week of 9-21-17.md",
        "Menus/Menu week of Thanksgiving.md",
        "Menus/Menu\u0301 week of 12-28-18.md"
      ],
      "menu_weeks": [
        "2018-10-25",
        "2021-11-03",
        "2020-03-21",
        "2020-03-07",
        "2020-04-02",
        "2020-04-22",
        "2021-05-01",
        "2024-05-01",
        "2024-06-12",
        "2020-07-02",
        "2019-07-05",
        "2018-08-12",
        "2018-08-22",
        "2017-09-21",
        "2018-12-28"
      ],
      "menu_seasons": [
        "fall",
        "spring",
        "summer",
        "unknown",
        "winter"
      ],
      "meal_types": [
        "dinner",
        "breakfast"
      ],
      "sections": [
        "Breakfast"
      ],
      "source_hints": [],
      "item_texts": [
        "Saturday: farmer\u2019s market? pancakes and eggs, chicken enchiladas with green salsa",
        "Pancakes",
        "Breakfast: pancakes",
        "Breakfast: Pancakes and bacon",
        "Breakfast: Pancakes or waffles, eggs, bacon",
        "Pancakes and eggs",
        "Breakfast for dinner: eggs, pancakes, bacon",
        "Sean bday morning: pancakes",
        "Breakfast for dinner: pancakes, eggs, bacon",
        "New Year\u2019s Day breakfast: pancakes, eggs"
      ],
      "count": 16
    },
    {
      "url": "https://www.wellplated.com/butternut-squash-mac-and-cheese/",
      "urls": [
        "https://www.wellplated.com/butternut-squash-mac-and-cheese/"
      ],
      "link_texts": [
        "Butternut Squash Mac and Cheese"
      ],
      "menu_files": [
        "Menus/Menu week of 1-28-18.md",
        "Menus/Menu week of 1-9-24.md",
        "Menus/Menu week of 10-21-19.md",
        "Menus/Menu week of 10-25-18.md",
        "Menus/Menu week of 10-31-17.md",
        "Menus/Menu week of 10-4-20.md",
        "Menus/Menu week of 10-6-18.md",
        "Menus/Menu week of 12-16-19.md",
        "Menus/Menu week of 12-21-20.md",
        "Menus/Menu week of 12-31-2020.md",
        "Menus/Menu week of 12-7-20.md",
        "Menus/Menu week of 2-19-18.md",
        "Menus/Menu week of 2-2-24.md",
        "Menus/Menu week of Thanksgiving.md"
      ],
      "menu_weeks": [
        "2018-01-28",
        "2024-01-09",
        "2019-10-21",
        "2018-10-25",
        "2017-10-31",
        "2020-10-04",
        "2018-10-06",
        "2019-12-16",
        "2020-12-21",
        "2020-12-31",
        "2020-12-07",
        "2018-02-19",
        "2024-02-02"
      ],
      "menu_seasons": [
        "winter",
        "fall",
        "unknown"
      ],
      "meal_types": [
        "dinner"
      ],
      "sections": [],
      "source_hints": [
        "Pinch of Yum"
      ],
      "item_texts": [
        "Butternut squash Mac and cheese",
        "Butternut squash mac and cheese with caramelized onions, bacon, and apple (Pinch of Yum)",
        "Sunday: baked oatmeal? butternut squash Mac and cheese",
        "Wednesday: butternut squash Mac and cheese",
        "Butternut squash mac and cheese",
        "Butternut squash Mac and cheeseNew year\u2019s eve: Brown Butter scallops with parmesan risotto"
      ],
      "count": 14
    },
    {
      "url": "https://damndelicious.net/2023/04/21/best-chicken-caesar-salad-with-homemade-croutons/",
      "urls": [
        "https://damndelicious.net/2023/04/21/best-chicken-caesar-salad-with-homemade-croutons/"
      ],
      "link_texts": [
        "Best Chicken Caesar Salad with Homemade Croutons"
      ],
      "menu_files": [
        "Menus/Menu week of 1-10-19.md",
        "Menus/Menu week of 1-21-19.md",
        "Menus/Menu week of 1-24-20.md",
        "Menus/Menu week of 10-10-21.md",
        "Menus/Menu week of 11-3-21.md",
        "Menus/Menu week of 2-8-20.md",
        "Menus/Menu week of 3-31-18.md",
        "Menus/Menu week of 4-21-19.md",
        "Menus/Menu week of 6-13-25.md",
        "Menus/Menu week of 7-5-19.md",
        "Menus/Menu week of 8-17-19.md",
        "Menus/Menu week of 9-19-21.md"
      ],
      "menu_weeks": [
        "2019-01-10",
        "2019-01-21",
        "2020-01-24",
        "2021-10-10",
        "2021-11-03",
        "2020-02-08",
        "2018-03-31",
        "2019-04-21",
        "2025-06-13",
        "2019-07-05",
        "2019-08-17",
        "2021-09-19"
      ],
      "menu_seasons": [
        "winter",
        "fall",
        "spring",
        "summer"
      ],
      "meal_types": [
        "dinner"
      ],
      "sections": [],
      "source_hints": [],
      "item_texts": [
        "Chicken Caesar salad",
        "Chicken caesar salad",
        "Chicken Caesar Salad",
        "Tuesday: Chicken caesar salad"
      ],
      "count": 12
    },
    {
      "url": "https://www.wellplated.com/instant-pot-cauliflower-mac-and-cheese/",
      "urls": [
        "https://www.wellplated.com/instant-pot-cauliflower-mac-and-cheese/"
      ],
      "link_texts": [
        "Instant Pot Cauliflower Mac and Cheese",
        "https://www.wellplated.com/instant-pot-cauliflower-mac-and-cheese/"
      ],
      "menu_files": [
        "Menus/Menu week of 1-24-20.md",
        "Menus/Menu week of 11-3-21.md",
        "Menus/Menu week of 3-12-22.md",
        "Menus/Menu week of 4-11-25.md",
        "Menus/Menu week of 4-13-21.md",
        "Menus/Menu week of 4-3-21.md",
        "Menus/Menu week of 5-7-20.md",
        "Menus/Menu week of 5-8-23.md",
        "Menus/Menu week of 6-1-21.md",
        "Menus/Menu week of 7-21-19.md",
        "Menus/Menu week of 7-8-22.md",
        "Menus/Menu week of 9-19-21.md"
      ],
      "menu_weeks": [
        "2020-01-24",
        "2021-11-03",
        "2022-03-12",
        "2025-04-11",
        "2021-04-13",
        "2021-04-03",
        "2020-05-07",
        "2023-05-08",
        "2021-06-01",
        "2019-07-21",
        "2022-07-08",
        "2021-09-19"
      ],
      "menu_seasons": [
        "winter",
        "fall",
        "spring",
        "summer"
      ],
      "meal_types": [
        "dinner"
      ],
      "sections": [],
      "source_hints": [
        "https://www.wellplated.com/instant-pot-cauliflower-mac-and-cheese/",
        "Well Plated"
      ],
      "item_texts": [
        "Instant pot cauliflower mac and cheese",
        "Instant pot cauliflower Mac and cheese",
        "Instant Pot Cauliflower Mac & Cheese",
        "Instant Pot cauliflower mac and cheese",
        "Instant Pot Cauliflower Mac and cheese",
        "Instant pot cauliflower mac and cheese (Well Plated)",
        "Instant pot cauliflower mac and cheese, everyday italian salad",
        "Instant Pot Cauliflower Mac and Cheese (Well Plated)"
      ],
      "count": 12
    },
    {
      "url": "https://www.howsweeteats.com/2020/04/baja-grain-bowls/",
      "urls": [
        "https://www.howsweeteats.com/2020/04/baja-grain-bowls/"
      ],
      "link_texts": [
        "Baja Grain Bowls"
      ],
      "menu_files": [
        "Menus/Menu week of 10-4-20.md",
        "Menus/Menu week of 3-19-21.md",
        "Menus/Menu week of 3-9-21.md",
        "Menus/Menu week of 4-22-20.md",
        "Menus/Menu week of 4-28-22.md",
        "Menus/Menu week of 5-1-21.md",
        "Menus/Menu week of 5-22-20.md",
        "Menus/Menu week of 6-16-22.md",
        "Menus/Menu week of 8-1-20.md",
        "Menus/Menu week of 8-26-20.md",
        "Menus/Menu week of 9-6-20.md"
      ],
      "menu_weeks": [
        "2020-10-04",
        "2021-03-19",
        "2021-03-09",
        "2020-04-22",
        "2022-04-28",
        "2021-05-01",
        "2020-05-22",
        "2022-06-16",
        "2020-08-01",
        "2020-08-26",
        "2020-09-06"
      ],
      "menu_seasons": [
        "fall",
        "spring",
        "summer"
      ],
      "meal_types": [
        "dinner"
      ],
      "sections": [],
      "source_hints": [
        "veg"
      ],
      "item_texts": [
        "Baja grain bowls",
        "Baja grain bowls (veg)"
      ],
      "count": 11
    },
    {
      "url": "https://pinchofyum.com/yummy-salmon-burgers-slaw",
      "urls": [
        "https://pinchofyum.com/yummy-salmon-burgers-slaw"
      ],
      "link_texts": [
        "Yummy Salmon Burgers with Slaw"
      ],
      "menu_files": [
        "Menus/Menu week of 1-10-19.md",
        "Menus/Menu week of 10-11-23.md",
        "Menus/Menu week of 10-6-22.md",
        "Menus/Menu week of 11-1-20.md",
        "Menus/Menu week of 2-6-21.md",
        "Menus/Menu week of 3-15-19.md",
        "Menus/Menu week of 4-16-18.md",
        "Menus/Menu week of 5-18-22.md",
        "Menus/Menu week of 6-29-18.md",
        "Menus/Menu week of 9-1-19.md"
      ],
      "menu_weeks": [
        "2019-01-10",
        "2023-10-11",
        "2022-10-06",
        "2020-11-01",
        "2021-02-06",
        "2019-03-15",
        "2018-04-16",
        "2022-05-18",
        "2018-06-29",
        "2019-09-01"
      ],
      "menu_seasons": [
        "winter",
        "fall",
        "spring",
        "summer"
      ],
      "meal_types": [
        "dinner"
      ],
      "sections": [],
      "source_hints": [],
      "item_texts": [
        "Salmon burgers with slaw",
        "Salmon Burgers with Slaw",
        "Saturday: salmon burgers with slaw"
      ],
      "count": 10
    },
    {
      "url": "https://pinchofyum.com/chicken-with-coconut-kale",
      "urls": [
        "https://pinchofyum.com/chicken-with-coconut-kale"
      ],
      "link_texts": [
        "https://pinchofyum.com/chicken-with-coconut-kale"
      ],
      "menu_files": [
        "Menus/Menu week of 1-17-25.md",
        "Menus/Menu week of 10-23-24.md",
        "Menus/Menu week of 12-31-25.md",
        "Menus/Menu week of 12-6-24.md",
        "Menus/Menu week of 2-27-25.md",
        "Menus/Menu week of 5-26-25.md",
        "Menus/Menu week of 9-24-24.md",
        "Menus/Week of 11-17-25.md"
      ],
      "menu_weeks": [
        "2025-01-17",
        "2024-10-23",
        "2025-12-31",
        "2024-12-06",
        "2025-02-27",
        "2025-05-26",
        "2024-09-24",
        "2025-11-17"
      ],
      "menu_seasons": [
        "winter",
        "fall",
        "spring"
      ],
      "meal_types": [
        "dinner"
      ],
      "sections": [],
      "source_hints": [
        "https://pinchofyum.com/chicken-with-coconut-kale"
      ],
      "item_texts": [
        "Chicken with Coconut Kale (add red pepper)",
        "Chicken with Coconut Kale (add red peppers)",
        "Chicken with coconut kale add bell pepper",
        "Chicken with Coconut Kale (use spinach and red peppers)",
        "Chicken with coconut spinach (add red pepper)",
        "Chicken with Coconut Kale add some bell pepper"
      ],
      "count": 8
    },
    {
      "url": "https://pinchofyum.com/red-pepper-cashew-pasta",
      "urls": [
        "https://pinchofyum.com/red-pepper-cashew-pasta"
      ],
      "link_texts": [
        "Red Pepper Cashew Pasta with Roasted Cauliflower",
        "https://pinchofyum.com/red-pepper-cashew-pasta"
      ],
      "menu_files": [
        "Menus/Menu week of 1-16-26.md",
        "Menus/Menu week of 12-31-2020.md",
        "Menus/Menu week of 12-4-18.md",
        "Menus/Menu week of 12-4-25.md",
        "Menus/Menu week of 2-11-25.md",
        "Menus/Menu week of 2-27-25.md",
        "Menus/Menu week of 2-8-20.md",
        "Menus/Menu week of 5-7-18.md"
      ],
      "menu_weeks": [
        "2026-01-16",
        "2020-12-31",
        "2018-12-04",
        "2025-12-04",
        "2025-02-11",
        "2025-02-27",
        "2020-02-08",
        "2018-05-07"
      ],
      "menu_seasons": [
        "winter",
        "spring"
      ],
      "meal_types": [
        "dinner"
      ],
      "sections": [],
      "source_hints": [
        "https://pinchofyum.com/red-pepper-cashew-pasta",
        "sauce in freezer already"
      ],
      "item_texts": [
        "Roasted red pepper pasta and cauliflower",
        "Red pepper cashew pasta with roasted cauliflower",
        "Red pepper cashew pasta with roasted cauliflower Chicken nuggets, broccoli, sweet potato fries",
        "Red pepper cashew pasta with roasted cauliflower (sauce in freezer)",
        "Red pepper cashew pasta with roasted cauliflower (sauce in freezer already)"
      ],
      "count": 8
    },
    {
      "url": "https://www.forkknifeswoon.com/quick-roasted-tomato-caprese-pasta-salad/",
      "urls": [
        "https://www.forkknifeswoon.com/quick-roasted-tomato-caprese-pasta-salad/"
      ],
      "link_texts": [
        "Quick Roasted Tomato Caprese Pasta Salad",
        "https://www.forkknifeswoon.com/quick-roasted-tomato-caprese-pasta-salad/",
        "Quick Roasted Tomato Caprese Pasta Salad - Fork Knife Swoon"
      ],
      "menu_files": [
        "Menus/Easy post baby recipes.md",
        "Menus/Menu week of 10-4-25.md",
        "Menus/Menu week of 8-1-19.md",
        "Menus/Menu week of 8-17-19.md",
        "Menus/Menu week of 8-18-24.md",
        "Menus/Menu week of 8-26-25.md",
        "Menus/Menu week of 9-1-21.md",
        "Menus/Menu week of 9-24-24.md"
      ],
      "menu_weeks": [
        "2025-10-04",
        "2019-08-01",
        "2019-08-17",
        "2024-08-18",
        "2025-08-26",
        "2021-09-01",
        "2024-09-24"
      ],
      "menu_seasons": [
        "unknown",
        "fall",
        "summer"
      ],
      "meal_types": [
        "dinner",
        "lunch"
      ],
      "sections": [],
      "source_hints": [
        "https://www.forkknifeswoon.com/quick-roasted-tomato-caprese-pasta-salad/"
      ],
      "item_texts": [
        "Roasted tomato caprese pasta salad",
        "Caprese pasta salad (Sean lunches)",
        "Quick roasted tomato caprese pasta salad Quick Roasted Tomato Caprese Pasta Salad - Fork Knife Swoon",
        "Quick Roasted Tomato Caprese Pasta Salad",
        "/ Roasted Tomato Caprese Pasta Salad"
      ],
      "count": 8
    },
    {
      "url": "https://pinchofyum.com/15-minute-meal-prep-egg-roll-in-a-bowl",
      "urls": [
        "https://pinchofyum.com/15-minute-meal-prep-egg-roll-in-a-bowl"
      ],
      "link_texts": [
        "15 Minute Meal Prep Egg Roll in a Bowl",
        "https://pinchofyum.com/15-minute-meal-prep-egg-roll-in-a-bowl"
      ],
      "menu_files": [
        "Menus/Menu week of 12-31-19.md",
        "Menus/Menu week of 3-15-19.md",
        "Menus/Menu week of 3-20-23.md",
        "Menus/Menu week of 4-28-22.md",
        "Menus/Menu week of 4-28-25.md",
        "Menus/Menu week of 6-23-19.md",
        "Menus/Menu week of 7-1-24.md"
      ],
      "menu_weeks": [
        "2019-12-31",
        "2019-03-15",
        "2023-03-20",
        "2022-04-28",
        "2025-04-28",
        "2019-06-23",
        "2024-07-01"
      ],
      "menu_seasons": [
        "winter",
        "spring",
        "summer"
      ],
      "meal_types": [
        "dinner"
      ],
      "sections": [],
      "source_hints": [
        "use ground beef"
      ],
      "item_texts": [
        "Egg roll in a bowl",
        "Egg roll in a bowl (use ground beef)",
        "egg roll in a bowl",
        "15 min Egg roll in a bowl"
      ],
      "count": 7
    },
    {
      "url": "https://pinchofyum.com/bbq-salmon-mango-salsa",
      "urls": [
        "https://pinchofyum.com/bbq-salmon-mango-salsa"
      ],
      "link_texts": [
        "BBQ Salmon Bowls with Mango Avocado Salsa"
      ],
      "menu_files": [
        "Menus/Menu week of 3-24-24.md",
        "Menus/Menu week of 4-22-20.md",
        "Menus/Menu week of 5-7-20.md",
        "Menus/Menu week of 7-23-23.md",
        "Menus/Menu week of 8-1-19.md",
        "Menus/Menu week of 9-1-22.md",
        "Menus/Menu week of 9-17-23.md"
      ],
      "menu_weeks": [
        "2024-03-24",
        "2020-04-22",
        "2020-05-07",
        "2023-07-23",
        "2019-08-01",
        "2022-09-01",
        "2023-09-17"
      ],
      "menu_seasons": [
        "spring",
        "summer",
        "fall"
      ],
      "meal_types": [
        "dinner"
      ],
      "sections": [],
      "source_hints": [
        "Pinch of Yum"
      ],
      "item_texts": [
        "BBQ Salmon Bowls (Pinch of Yum)",
        "BBQ salmon bowls with mango avocado salsa",
        "BBQ Salmon bowls with mango avocado salsa",
        "BBQ salmon bowls with mango avocado salsa (Pinch of Yum)",
        "BBQ salmon bowls"
      ],
      "count": 7
    },
    {
      "url": "https://pinchofyum.com/spaghetti-with-crispy-zucchini",
      "urls": [
        "https://pinchofyum.com/spaghetti-with-crispy-zucchini"
      ],
      "link_texts": [
        "Spaghetti with Crispy Zucchini",
        "https://pinchofyum.com/spaghetti-with-crispy-zucchini",
        "(Pinch of Yum) "
      ],
      "menu_files": [
        "Menus/Menu week of 10-11-23.md",
        "Menus/Menu week of 11-8-24.md",
        "Menus/Menu week of 5-17-24.md",
        "Menus/Menu week of 7-5-25.md",
        "Menus/Menu week of 7-8-23.md",
        "Menus/Menu week of 9-2-23.md",
        "Menus/Week of 7-14-25.md"
      ],
      "menu_weeks": [
        "2023-10-11",
        "2024-11-08",
        "2024-05-17",
        "2025-07-05",
        "2023-07-08",
        "2023-09-02",
        "2025-07-14"
      ],
      "menu_seasons": [
        "fall",
        "spring",
        "summer"
      ],
      "meal_types": [
        "dinner"
      ],
      "sections": [],
      "source_hints": [
        "https://pinchofyum.com/spaghetti-with-crispy-zucchini",
        "Pinch of Yum"
      ],
      "item_texts": [
        "Spaghetti with Crispy Zucchini",
        "Spaghetti with crispy zucchini",
        "Spaghetti with crispy zucchini Chicken nuggets, salad, sweet potato fries",
        "Spaghetti with crispy zucchini (Pinch of Yum) or zucchini and squash can be grilled with steaks, add potatoes if do steaks",
        "Spaghetti with crispy zucchini (Pinch of Yum)"
      ],
      "count": 7
    },
    {
      "url": "https://cookieandkate.com/vegetarian-italian-chopped-salad-recipe/",
      "urls": [
        "https://cookieandkate.com/vegetarian-italian-chopped-salad-recipe/"
      ],
      "link_texts": [
        "Vegetarian Italian Chopped Salad"
      ],
      "menu_files": [
        "Menus/Menu week of 1-12-2021.md",
        "Menus/Menu week of 1-2-18.md",
        "Menus/Menu week of 1-24-21.md",
        "Menus/Menu week of 12-4-18.md",
        "Menus/Menu week of 3-7-20.md",
        "Menus/Menu week of 8-23-17.md"
      ],
      "menu_weeks": [
        "2021-01-12",
        "2018-01-02",
        "2021-01-24",
        "2018-12-04",
        "2020-03-07",
        "2017-08-23"
      ],
      "menu_seasons": [
        "winter",
        "spring",
        "summer"
      ],
      "meal_types": [
        "lunch",
        "dinner"
      ],
      "sections": [],
      "source_hints": [
        "Vegetarian"
      ],
      "item_texts": [
        "Lunch: Vegetarian Italian Chopped Salad",
        "Vegetarian Italian chopped salad",
        "Vegetarian Italian Chopped Salad",
        "Vegetarian Italian Chopped salad (Vegetarian)"
      ],
      "count": 6
    },
    {
      "url": "https://www.gimmesomeoven.com/gnocchi-with-brussels-sprouts-chicken-sausage-and-kale-pesto/",
      "urls": [
        "https://www.gimmesomeoven.com/gnocchi-with-brussels-sprouts-chicken-sausage-and-kale-pesto/"
      ],
      "link_texts": [
        "Gnocchi with Brussels Sprouts, Chicken Sausage and Kale Pesto"
      ],
      "menu_files": [
        "Menus/Easy post baby recipes.md",
        "Menus/Menu week of 1-23-23.md",
        "Menus/Menu week of 2-23-21.md",
        "Menus/Menu week of 2-8-20.md",
        "Menus/Menu week of 3-9-21.md",
        "Menus/Menu week of 9-1-21.md"
      ],
      "menu_weeks": [
        "2023-01-23",
        "2021-02-23",
        "2020-02-08",
        "2021-03-09",
        "2021-09-01"
      ],
      "menu_seasons": [
        "unknown",
        "winter",
        "spring",
        "fall"
      ],
      "meal_types": [
        "dinner"
      ],
      "sections": [],
      "source_hints": [],
      "item_texts": [
        "Gnocchi with Brussels Sprouts, Chicken Sausage and Pesto",
        "Gnocchi with brussels sprouts, chicken sausage, and pesto"
      ],
      "count": 6
    },
    {
      "url": "https://www.seriouseats.com/herb-butter-rubbed-crisp-skinned-butterflied-spatchcock-roast-turkey-thanksgiving-recipe",
      "urls": [
        "https://www.seriouseats.com/herb-butter-rubbed-crisp-skinned-butterflied-spatchcock-roast-turkey-thanksgiving-recipe"
      ],
      "link_texts": [
        "Herb-Butter Rubbed Crisp-Skinned Butterflied Roast Turkey"
      ],
      "menu_files": [
        "Menus/Menu week of 11-10-17.md",
        "Menus/Menu week of 11-19-22.md",
        "Menus/Menu week of 11-28-19.md",
        "Menus/Menu week of 12-3-17.md",
        "Menus/Menu week of 3-29-22.md",
        "Menus/Menu week of 6-16-22.md"
      ],
      "menu_weeks": [
        "2017-11-10",
        "2022-11-19",
        "2019-11-28",
        "2017-12-03",
        "2022-03-29",
        "2022-06-16"
      ],
      "menu_seasons": [
        "fall",
        "winter",
        "spring",
        "summer"
      ],
      "meal_types": [
        "dinner"
      ],
      "sections": [],
      "source_hints": [],
      "item_texts": [
        "Turkey",
        "Leftover turkey and vegetable dumpling soup",
        "Turkey taco skillet",
        "Baked Quesadillas with ground turkey and black beans"
      ],
      "count": 6
    },
    {
      "url": "https://www.skinnytaste.com/butternut-squash-and-black-bean/",
      "urls": [
        "https://www.skinnytaste.com/butternut-squash-and-black-bean/"
      ],
      "link_texts": [
        "Butternut Squash and Black Bean Enchiladas"
      ],
      "menu_files": [
        "Menus/Menu week of 11-1-20.md",
        "Menus/Menu week of 11-10-17.md",
        "Menus/Menu week of 2-19-18.md",
        "Menus/Menu week of 3-31-18.md",
        "Menus/Menu week of 6-1-21.md",
        "Menus/Menu week of Thanksgiving.md"
      ],
      "menu_weeks": [
        "2020-11-01",
        "2017-11-10",
        "2018-02-19",
        "2018-03-31",
        "2021-06-01"
      ],
      "menu_seasons": [
        "fall",
        "winter",
        "spring",
        "summer",
        "unknown"
      ],
      "meal_types": [
        "dinner"
      ],
      "sections": [],
      "source_hints": [
        "radishes, avocado"
      ],
      "item_texts": [
        "Butternut squash and black bean enchiladas (radishes, avocado)",
        "Butternut squash and black bean enchiladas"
      ],
      "count": 6
    },
    {
      "url": "https://damndelicious.net/2021/08/13/chicken-and-broccoli-stir-fry/",
      "urls": [
        "https://damndelicious.net/2021/08/13/chicken-and-broccoli-stir-fry/"
      ],
      "link_texts": [
        "Chicken and Broccoli Stir Fry",
        "https://damndelicious.net/2021/08/13/chicken-and-broccoli-stir-fry/"
      ],
      "menu_files": [
        "Menus/Menu week of 1-13-22.md",
        "Menus/Menu week of 5-30-24.md",
        "Menus/Menu week of 7-20.md",
        "Menus/Menu week of 7-23-23.md",
        "Menus/Menu week of 7-8-22.md"
      ],
      "menu_weeks": [
        "2022-01-13",
        "2024-05-30",
        "2023-07-23",
        "2022-07-08"
      ],
      "menu_seasons": [
        "winter",
        "spring",
        "unknown",
        "summer"
      ],
      "meal_types": [
        "dinner"
      ],
      "sections": [],
      "source_hints": [
        "Damn Delicious",
        "Gimme Some Oven"
      ],
      "item_texts": [
        "Chicken and broccoli stir fry (Damn Delicious)",
        "Chicken and broccoli stir fry:",
        "Cashew chicken and broccoli stir fry (Gimme Some Oven)",
        "Chicken and Broccoli Stir fry (Damn Delicious)"
      ],
      "count": 5
    },
    {
      "url": "https://honestlyyum.com/6637/beer-braised-brats-with-apple-mustard-slaw/",
      "urls": [
        "https://honestlyyum.com/6637/beer-braised-brats-with-apple-mustard-slaw/"
      ],
      "link_texts": [
        "Beer Braised Brats with Apple Mustard Slaw",
        "https://honestlyyum.com/6637/beer-braised-brats-with-apple-mustard-slaw/"
      ],
      "menu_files": [
        "Menus/Menu week of 10-18-20.md",
        "Menus/Menu week of 5-19-21.md",
        "Menus/Menu week of 5-21-23.md",
        "Menus/Menu week of 6-24-25.md",
        "Menus/Week of 7-14-25.md"
      ],
      "menu_weeks": [
        "2020-10-18",
        "2021-05-19",
        "2023-05-21",
        "2025-06-24",
        "2025-07-14"
      ],
      "menu_seasons": [
        "fall",
        "spring",
        "summer"
      ],
      "meal_types": [
        "dinner"
      ],
      "sections": [],
      "source_hints": [
        "grill"
      ],
      "item_texts": [
        "Beer braised brats with apple mustard slaw",
        "Beer brats with apple mustard slaw (grill)",
        "Beer braised brats",
        "Beer braised brats and apple mustard slaw"
      ],
      "count": 5
    },
    {
      "url": "https://pinchofyum.com/cauliflower-orange-gnocchi",
      "urls": [
        "https://pinchofyum.com/cauliflower-orange-gnocchi"
      ],
      "link_texts": [
        "https://pinchofyum.com/cauliflower-orange-gnocchi",
        "Pinch of Yum"
      ],
      "menu_files": [
        "Menus/Menu week of 1-4-25.md",
        "Menus/Menu week of 11-20-24.md",
        "Menus/Menu week of 12-31-25.md",
        "Menus/Menu week of 7-25-24.md",
        "Menus/Menu week of 7-5-25.md"
      ],
      "menu_weeks": [
        "2025-01-04",
        "2024-11-20",
        "2025-12-31",
        "2024-07-25",
        "2025-07-05"
      ],
      "menu_seasons": [
        "winter",
        "fall",
        "summer"
      ],
      "meal_types": [
        "dinner"
      ],
      "sections": [],
      "source_hints": [
        "https://pinchofyum.com/cauliflower-orange-gnocchi"
      ],
      "item_texts": [
        "Cauliflower Orange Gnocchi",
        "Cauliflower orange gnocchi: Chicken nuggets, broccoli, sweet potato fries",
        "Cauliflower orange gnocchi",
        "Cauliflower orange gnocchi (Pinch of Yum)"
      ],
      "count": 5
    },
    {
      "url": "https://pinchofyum.com/easy-vegan-burrito-bowls",
      "urls": [
        "https://pinchofyum.com/easy-vegan-burrito-bowls"
      ],
      "link_texts": [
        "Easy Vegan Burrito Bowls"
      ],
      "menu_files": [
        "Menus/Menu week of 1-12-2021.md",
        "Menus/Menu week of 10-4-2019.md",
        "Menus/Menu week of 11-6-18.md",
        "Menus/Menu week of 3-15-19.md",
        "Menus/Menu week of 4-2-2020.md"
      ],
      "menu_weeks": [
        "2021-01-12",
        "2019-10-04",
        "2018-11-06",
        "2019-03-15",
        "2020-04-02"
      ],
      "menu_seasons": [
        "winter",
        "fall",
        "spring"
      ],
      "meal_types": [
        "dinner"
      ],
      "sections": [],
      "source_hints": [],
      "item_texts": [
        "Cauliflower walnut taco meat burrito bowls",
        "Cauliflower walnut taco meat burrito bowls, make pico and guac, black beans and corn, saute peppers"
      ],
      "count": 5
    },
    {
      "url": "https://pinchofyum.com/instant-pot-cauliflower-curry",
      "urls": [
        "https://pinchofyum.com/instant-pot-cauliflower-curry"
      ],
      "link_texts": [
        "Instant Pot Cauliflower Curry"
      ],
      "menu_files": [
        "Menus/Menu week of 10-4-2019.md",
        "Menus/Menu week of 2-23-21.md",
        "Menus/Menu week of 3-9-21.md",
        "Menus/Menu week of 5-19-21.md",
        "Menus/Menu week of 9-17-19.md"
      ],
      "menu_weeks": [
        "2019-10-04",
        "2021-02-23",
        "2021-03-09",
        "2021-05-19",
        "2019-09-17"
      ],
      "menu_seasons": [
        "fall",
        "winter",
        "spring"
      ],
      "meal_types": [
        "dinner"
      ],
      "sections": [],
      "source_hints": [],
      "item_texts": [
        "Instant pot cauliflower curry",
        "Instant Pot Cauliflower curry"
      ],
      "count": 5
    },
    {
      "url": "https://pinchofyum.com/one-pot-spanish-chicken-potatoes",
      "urls": [
        "https://pinchofyum.com/one-pot-spanish-chicken-potatoes"
      ],
      "link_texts": [
        "One Pot Spanish Chicken and Potatoes"
      ],
      "menu_files": [
        "Menus/Menu week of 10-1-23.md",
        "Menus/Menu week of 10-4-20.md",
        "Menus/Menu week of 10-4-2019.md",
        "Menus/Menu week of 8-1-20.md",
        "Menus/Menu week of 9-2-23.md"
      ],
      "menu_weeks": [
        "2023-10-01",
        "2020-10-04",
        "2019-10-04",
        "2020-08-01",
        "2023-09-02"
      ],
      "menu_seasons": [
        "fall",
        "summer"
      ],
      "meal_types": [
        "dinner"
      ],
      "sections": [],
      "source_hints": [
        "Pinch of Yum"
      ],
      "item_texts": [
        "Spanish chicken and potatoes (Pinch of Yum)",
        "One pot spanish chicken and potatoes",
        "Saturday: One pot Spanish chicken and potatoes",
        "1 pot Spanish chicken and potatoes",
        "Spanish Chicken and potatoes (Pinch of Yum)"
      ],
      "count": 5
    },
    {
      "url": "https://pinchofyum.com/the-best-chicken-tinga-tacos",
      "urls": [
        "https://pinchofyum.com/the-best-chicken-tinga-tacos"
      ],
      "link_texts": [
        "The Best Chicken Tinga Tacos"
      ],
      "menu_files": [
        "Menus/Menu week of 1-21-19.md",
        "Menus/Menu week of 10-11-23.md",
        "Menus/Menu week of 11-19-22.md",
        "Menus/Menu week of 4-16-18.md",
        "Menus/Menu week of 5-22-19.md"
      ],
      "menu_weeks": [
        "2019-01-21",
        "2023-10-11",
        "2022-11-19",
        "2018-04-16",
        "2019-05-22"
      ],
      "menu_seasons": [
        "winter",
        "fall",
        "spring"
      ],
      "meal_types": [
        "dinner"
      ],
      "sections": [],
      "source_hints": [],
      "item_texts": [
        "Chicken tinga tacos",
        "Chicken Tinga Tacos"
      ],
      "count": 5
    },
    {
      "url": "https://www.howsweeteats.com/2021/03/asparagus-pasta-salad/",
      "urls": [
        "https://www.howsweeteats.com/2021/03/asparagus-pasta-salad/"
      ],
      "link_texts": [
        "https://www.howsweeteats.com/2021/03/asparagus-pasta-salad/",
        "Asparagus Pasta Salad with Honey Mustard Dressing"
      ],
      "menu_files": [
        "Menus/Menu week of 3-12-25.md",
        "Menus/Menu week of 5-30-24.md",
        "Menus/Menu week of 6-1-22.md",
        "Menus/Menu week of 6-5-23.md",
        "Menus/Menu week of 7-20.md"
      ],
      "menu_weeks": [
        "2025-03-12",
        "2024-05-30",
        "2022-06-01",
        "2023-06-05"
      ],
      "menu_seasons": [
        "spring",
        "summer",
        "unknown"
      ],
      "meal_types": [
        "dinner"
      ],
      "sections": [],
      "source_hints": [],
      "item_texts": [
        "Spring pasta salad with honey mustard dressing",
        "Asparagus pasta salad with honey mustard dressing"
      ],
      "count": 5
    },
    {
      "url": "https://www.melskitchencafe.com/slow-cooker-butternut-squash-tortellini/",
      "urls": [
        "https://www.melskitchencafe.com/slow-cooker-butternut-squash-tortellini/"
      ],
      "link_texts": [
        "Slow Cooker Butternut Squash Tortellini",
        "https://www.melskitchencafe.com/slow-cooker-butternut-squash-tortellini/"
      ],
      "menu_files": [
        "Menus/Menu week of 1-31-22.md",
        "Menus/Menu week of 10-1-23.md",
        "Menus/Menu week of 10-4-25.md",
        "Menus/Menu week of 3-19-21.md",
        "Menus/Menu week of 4-16-18.md"
      ],
      "menu_weeks": [
        "2022-01-31",
        "2023-10-01",
        "2025-10-04",
        "2021-03-19",
        "2018-04-16"
      ],
      "menu_seasons": [
        "winter",
        "fall",
        "spring"
      ],
      "meal_types": [
        "dinner"
      ],
      "sections": [],
      "source_hints": [
        "https://www.melskitchencafe.com/slow-cooker-butternut-squash-tortellini/"
      ],
      "item_texts": [
        "Slow cooker butternut squash tortellini",
        "Slow cooker butternut squash tortellini (Mels kitchen cafe) and bagged salad"
      ],
      "count": 5
    },
    {
      "url": "https://www.wellplated.com/instant-pot-butter-chicken/",
      "urls": [
        "https://www.wellplated.com/instant-pot-butter-chicken/"
      ],
      "link_texts": [
        "Instant Pot Butter Chicken"
      ],
      "menu_files": [
        "Menus/Menu week of 10-10-21.md",
        "Menus/Menu week of 3-21-20.md",
        "Menus/Menu week of 4-3-21.md",
        "Menus/Menu week of 6-1-22.md",
        "Menus/Menu week of 8-1-19.md"
      ],
      "menu_weeks": [
        "2021-10-10",
        "2020-03-21",
        "2021-04-03",
        "2022-06-01",
        "2019-08-01"
      ],
      "menu_seasons": [
        "fall",
        "spring",
        "summer"
      ],
      "meal_types": [
        "dinner"
      ],
      "sections": [],
      "source_hints": [],
      "item_texts": [
        "Instant pot butter chicken",
        "Instant Pot butter chicken"
      ],
      "count": 5
    },
    {
      "url": "https://iowagirleats.com/broccoli-beef-recipe/",
      "urls": [
        "https://iowagirleats.com/broccoli-beef-recipe/"
      ],
      "link_texts": [
        "Lighter Broccoli Beef"
      ],
      "menu_files": [
        "Menus/Menu week of 1-9-24.md",
        "Menus/Menu week of 2-23-21.md",
        "Menus/Menu week of 2-6-21.md",
        "Menus/Menu week of 6-1-21.md"
      ],
      "menu_weeks": [
        "2024-01-09",
        "2021-02-23",
        "2021-02-06",
        "2021-06-01"
      ],
      "menu_seasons": [
        "winter",
        "summer"
      ],
      "meal_types": [
        "dinner"
      ],
      "sections": [],
      "source_hints": [
        "Iowa Girl Eats"
      ],
      "item_texts": [
        "Lighter broccoli beef with brown rice (Iowa Girl Eats)",
        "Lighter Broccoli Beef",
        "Lighter broccoli beef"
      ],
      "count": 4
    },
    {
      "url": "https://pinchofyum.com/everything-greek-pork-pitas",
      "urls": [
        "https://pinchofyum.com/everything-greek-pork-pitas"
      ],
      "link_texts": [
        "Everything Greek Pork Pitas"
      ],
      "menu_files": [
        "Menus/Menu week of 1-21-19.md",
        "Menus/Menu week of 4-10-19.md",
        "Menus/Menu week of 5-21-23.md",
        "Menus/Menu week of 9-17-19.md"
      ],
      "menu_weeks": [
        "2019-01-21",
        "2019-04-10",
        "2023-05-21",
        "2019-09-17"
      ],
      "menu_seasons": [
        "winter",
        "spring",
        "fall"
      ],
      "meal_types": [
        "dinner"
      ],
      "sections": [],
      "source_hints": [
        "take to Haley\u2019s?",
        "pinch of yum"
      ],
      "item_texts": [
        "Everything Greek pork pitas and Greek salad (take to Haley\u2019s?)",
        "Everything greek pork pitas, greek salad, tzatziki",
        "Everything Greek Pork pitas (pinch of yum)",
        "Everything Greek pork pitas, cucumber and tomato salad"
      ],
      "count": 4
    },
    {
      "url": "https://pinchofyum.com/gnocchi-with-creamy-mushroom-sauce",
      "urls": [
        "https://pinchofyum.com/gnocchi-with-creamy-mushroom-sauce"
      ],
      "link_texts": [
        "https://pinchofyum.com/gnocchi-with-creamy-mushroom-sauce"
      ],
      "menu_files": [
        "Menus/Menu week of 1-16-26.md",
        "Menus/Menu week of 11-8-24.md",
        "Menus/Menu week of 12-19-25.md",
        "Menus/Menu week of 6-12-24.md"
      ],
      "menu_weeks": [
        "2026-01-16",
        "2024-11-08",
        "2025-12-19",
        "2024-06-12"
      ],
      "menu_seasons": [
        "winter",
        "fall",
        "summer"
      ],
      "meal_types": [
        "dinner"
      ],
      "sections": [],
      "source_hints": [
        "https://pinchofyum.com/gnocchi-with-creamy-mushroom-sauce"
      ],
      "item_texts": [
        "Gnocchi with creamy mushroom sauce",
        "Gnocchi with creamy mushroom sauce and air fryer chicken breast"
      ],
      "count": 4
    },
    {
      "url": "https://pinchofyum.com/instant-pot-chicken-and-dumplings",
      "urls": [
        "https://pinchofyum.com/instant-pot-chicken-and-dumplings"
      ],
      "link_texts": [
        "https://pinchofyum.com/instant-pot-chicken-and-dumplings"
      ],
      "menu_files": [
        "Menus/Menu week of 11-5-25.md",
        "Menus/Menu week of 12-19-25.md",
        "Menus/Menu week of 4-11-25.md",
        "Menus/Menu week of 9-24-24.md"
      ],
      "menu_weeks": [
        "2025-11-05",
        "2025-12-19",
        "2025-04-11",
        "2024-09-24"
      ],
      "menu_seasons": [
        "fall",
        "winter",
        "spring"
      ],
      "meal_types": [
        "dinner"
      ],
      "sections": [],
      "source_hints": [
        "https://pinchofyum.com/instant-pot-chicken-and-dumplings"
      ],
      "item_texts": [
        "Instant Pot chicken and dumplings",
        "Instant pot chicken and dumplings",
        "Instant Pot Chicken and Dumplings"
      ],
      "count": 4
    },
    {
      "url": "https://pinchofyum.com/red-chile-chicken-tacos-with-creamy-corn",
      "urls": [
        "https://pinchofyum.com/red-chile-chicken-tacos-with-creamy-corn"
      ],
      "link_texts": [
        "Red Chile Chicken Tacos with Creamy Corn",
        "Red Chile Chicken Tacos with Creamy Corn Recipe - Pinch of Yum"
      ],
      "menu_files": [
        "Menus/Menu week of 1-9-24.md",
        "Menus/Menu week of 10-6-22.md",
        "Menus/Menu week of 8-26-25.md",
        "Menus/Week of 7-27-25.md"
      ],
      "menu_weeks": [
        "2024-01-09",
        "2022-10-06",
        "2025-08-26",
        "2025-07-27"
      ],
      "menu_seasons": [
        "winter",
        "fall",
        "summer"
      ],
      "meal_types": [
        "dinner"
      ],
      "sections": [],
      "source_hints": [
        "Pinch of Yum",
        "https://pinchofyum.com/red-chile-chicken-tacos-with-creamy-corn"
      ],
      "item_texts": [
        "Red chile chicken tacos with creamy corn (Pinch of Yum)",
        "Red Chile Chicken tacos with creamy corn",
        "Red chile chicken tacos with creamy corn Red Chile Chicken Tacos with Creamy Corn Recipe - Pinch of Yum"
      ],
      "count": 4
    },
    {
      "url": "https://pinchofyum.com/sheet-pan-chicken-pitas",
      "urls": [
        "https://pinchofyum.com/sheet-pan-chicken-pitas"
      ],
      "link_texts": [
        "https://pinchofyum.com/sheet-pan-chicken-pitas"
      ],
      "menu_files": [
        "Menus/Menu week of 1-16-26.md",
        "Menus/Menu week of 11-20-24.md",
        "Menus/Menu week of 2-27-25.md",
        "Menus/Week of 11-17-25.md"
      ],
      "menu_weeks": [
        "2026-01-16",
        "2024-11-20",
        "2025-02-27",
        "2025-11-17"
      ],
      "menu_seasons": [
        "winter",
        "fall"
      ],
      "meal_types": [
        "dinner"
      ],
      "sections": [],
      "source_hints": [
        "https://pinchofyum.com/sheet-pan-chicken-pitas"
      ],
      "item_texts": [
        "Sheet pan chicken pitas",
        "Sheet pan chicken pitas with tzatziki"
      ],
      "count": 4
    },
    {
      "url": "https://pinchofyum.com/sweet-potato-peanut-soup",
      "urls": [
        "https://pinchofyum.com/sweet-potato-peanut-soup"
      ],
      "link_texts": [
        "Spicy Peanut Soup with Sweet Potato + Kale"
      ],
      "menu_files": [
        "Menus/Menu week of 1-10-19.md",
        "Menus/Menu week of 10-21-19.md",
        "Menus/Menu week of 10-6-22.md",
        "Menus/Menu week of 12-7-20.md"
      ],
      "menu_weeks": [
        "2019-01-10",
        "2019-10-21",
        "2022-10-06",
        "2020-12-07"
      ],
      "menu_seasons": [
        "winter",
        "fall"
      ],
      "meal_types": [
        "dinner"
      ],
      "sections": [],
      "source_hints": [
        "instant pot"
      ],
      "item_texts": [
        "Spicy peanut soup with sweet potato (instant pot)",
        "Spicy peanut soup with sweet potato and kale, salad",
        "Spicy peanut soup with sweet potatoes",
        "Spicy peanut soup with sweet potatoes and kale"
      ],
      "count": 4
    },
    {
      "url": "https://pinchofyum.com/tortellini-soup",
      "urls": [
        "https://pinchofyum.com/tortellini-soup"
      ],
      "link_texts": [
        "https://pinchofyum.com/tortellini-soup",
        "Ang's Creamy Tortellini Soup Recipe - Pinch of Yum"
      ],
      "menu_files": [
        "Menus/Menu week of 1-16-26.md",
        "Menus/Menu week of 11-5-25.md",
        "Menus/Menu week of 12-6-24.md",
        "Menus/Menu week of 4-11-25.md"
      ],
      "menu_weeks": [
        "2026-01-16",
        "2025-11-05",
        "2024-12-06",
        "2025-04-11"
      ],
      "menu_seasons": [
        "winter",
        "fall",
        "spring"
      ],
      "meal_types": [
        "dinner"
      ],
      "sections": [],
      "source_hints": [
        "https://pinchofyum.com/tortellini-soup"
      ],
      "item_texts": [
        "Ang\u2019s creamy tortellini soup",
        "Ang\u2019s creamy tortellini soup Ang's Creamy Tortellini Soup Recipe - Pinch of Yum",
        "Ang\u2019s tortellini soup"
      ],
      "count": 4
    },
    {
      "url": "https://www.gimmesomeoven.com/gnocchi-with-brussels-sprouts-chicken-sausage-and-kale-pesto/#tasty-recipes-64011",
      "urls": [
        "https://www.gimmesomeoven.com/gnocchi-with-brussels-sprouts-chicken-sausage-and-kale-pesto/#tasty-recipes-64011"
      ],
      "link_texts": [
        "https://www.gimmesomeoven.com/gnocchi-with-brussels-sprouts-chicken-sausage-and-kale-pesto/#tasty-recipes-64011"
      ],
      "menu_files": [
        "Menus/Menu week of 10-4-25.md",
        "Menus/Menu week of 12-19-24.md",
        "Menus/Menu week of 3-30-25.md",
        "Menus/Menu week of 5-17-24.md"
      ],
      "menu_weeks": [
        "2025-10-04",
        "2024-12-19",
        "2025-03-30",
        "2024-05-17"
      ],
      "menu_seasons": [
        "fall",
        "winter",
        "spring"
      ],
      "meal_types": [
        "dinner"
      ],
      "sections": [],
      "source_hints": [],
      "item_texts": [
        "Gnocchi with chicken sausage, Brussels sprouts, and pesto",
        "Gnocchi with brussels sprouts, chicken sausage, and pesto"
      ],
      "count": 4
    },
    {
      "url": "https://www.gimmesomeoven.com/vegetarian-moo-shu/",
      "urls": [
        "https://www.gimmesomeoven.com/vegetarian-moo-shu/"
      ],
      "link_texts": [
        "Vegetarian Moo Shu"
      ],
      "menu_files": [
        "Menus/Menu week of 1-11-20.md",
        "Menus/Menu week of 4-22-20.md",
        "Menus/Menu week of 5-1-21.md",
        "Menus/Super Bowl menu.md"
      ],
      "menu_weeks": [
        "2020-01-11",
        "2020-04-22",
        "2021-05-01"
      ],
      "menu_seasons": [
        "winter",
        "spring",
        "unknown"
      ],
      "meal_types": [
        "dinner"
      ],
      "sections": [],
      "source_hints": [
        "veg"
      ],
      "item_texts": [
        "Vegetarian Moo Shu",
        "Vegetarian Moo Shu (veg)",
        "Vegetarian Moo shu"
      ],
      "count": 4
    },
    {
      "url": "https://www.wellplated.com/instant-pot-cauliflower-mac-and-cheese/#wprm-recipe-container-33211",
      "urls": [
        "https://www.wellplated.com/instant-pot-cauliflower-mac-and-cheese/#wprm-recipe-container-33211"
      ],
      "link_texts": [
        "https://www.wellplated.com/instant-pot-cauliflower-mac-and-cheese/#wprm-recipe-container-33211"
      ],
      "menu_files": [
        "Menus/Menu week of 12-19-25.md",
        "Menus/Menu week of 6-24-25.md",
        "Menus/Menu week of 9-21-25.md",
        "Menus/Week of 7-27-25.md"
      ],
      "menu_weeks": [
        "2025-12-19",
        "2025-06-24",
        "2025-09-21",
        "2025-07-27"
      ],
      "menu_seasons": [
        "winter",
        "summer",
        "fall"
      ],
      "meal_types": [
        "dinner"
      ],
      "sections": [],
      "source_hints": [],
      "item_texts": [
        "Cauliflower mac and cheese, add chicken nuggets White people tacos",
        "Instant pot cauliflower mac & cheese (add buffalo sauce chicken fingers)",
        "Instant pot cauliflower mac and cheese",
        "Instant pot cauliflower mac & cheese (add buffalo sauce chicken fingers) Trader Joe\u2019s pizzas and tossed greens"
      ],
      "count": 4
    },
    {
      "url": "https://damndelicious.net/2020/08/08/instant-pot-bbq-pulled-pork/",
      "urls": [
        "https://damndelicious.net/2020/08/08/instant-pot-bbq-pulled-pork/"
      ],
      "link_texts": [
        "https://damndelicious.net/2020/08/08/instant-pot-bbq-pulled-pork/"
      ],
      "menu_files": [
        "Menus/Menu week of 10-22-25.md",
        "Menus/Menu week of 12-31-25.md",
        "Menus/Menu week of 4-11-25.md"
      ],
      "menu_weeks": [
        "2025-10-22",
        "2025-12-31",
        "2025-04-11"
      ],
      "menu_seasons": [
        "fall",
        "winter",
        "spring"
      ],
      "meal_types": [
        "dinner"
      ],
      "sections": [],
      "source_hints": [],
      "item_texts": [
        "Pulled pork sandwiches:",
        "Instant pot bbq pulled pork and sweet potato fries",
        "Instant pot bbq pulled pork, roasted broccoli, sweet potato fries"
      ],
      "count": 3
    },
    {
      "url": "https://iowagirleats.com/crock-pot-white-chicken-chili-recipe/",
      "urls": [
        "https://iowagirleats.com/crock-pot-white-chicken-chili-recipe/"
      ],
      "link_texts": [
        "CrockPot White Chicken Chili",
        "https://iowagirleats.com/crock-pot-white-chicken-chili-recipe/"
      ],
      "menu_files": [
        "Menus/Menu week of 1-20-24.md",
        "Menus/Menu week of 12-19-24.md",
        "Menus/Menu week of 12-31-25.md"
      ],
      "menu_weeks": [
        "2024-01-20",
        "2024-12-19",
        "2025-12-31"
      ],
      "menu_seasons": [
        "winter"
      ],
      "meal_types": [
        "dinner"
      ],
      "sections": [],
      "source_hints": [
        "Iowa Girl Eats",
        "https://iowagirleats.com/crock-pot-white-chicken-chili-recipe/"
      ],
      "item_texts": [
        "Crock pot white chicken chili (Iowa Girl Eats)",
        "Dinner: CrockPot White Chicken Chili",
        "Crock pot white chicken chili and quesadillas"
      ],
      "count": 3
    },
    {
      "url": "https://pinchofyum.com/15-minute-meal-prep-cilantro-lime-chicken-and-lentils",
      "urls": [
        "https://pinchofyum.com/15-minute-meal-prep-cilantro-lime-chicken-and-lentils"
      ],
      "link_texts": [
        "Cilantro Lime Chicken and Lentil Rice Bowls"
      ],
      "menu_files": [
        "Menus/Menu week of 10-10-21.md",
        "Menus/Menu week of 11-3-21.md",
        "Menus/Menu week of 9-1-21.md"
      ],
      "menu_weeks": [
        "2021-10-10",
        "2021-11-03",
        "2021-09-01"
      ],
      "menu_seasons": [
        "fall"
      ],
      "meal_types": [
        "dinner"
      ],
      "sections": [],
      "source_hints": [],
      "item_texts": [
        "Instant pot cilantro lime chicken and lentil rice bowls"
      ],
      "count": 3
    },
    {
      "url": "https://pinchofyum.com/bang-bang-salmon-with-avocado-cucumber-salsa",
      "urls": [
        "https://pinchofyum.com/bang-bang-salmon-with-avocado-cucumber-salsa"
      ],
      "link_texts": [
        "https://pinchofyum.com/bang-bang-salmon-with-avocado-cucumber-salsa"
      ],
      "menu_files": [
        "Menus/Menu week of 11-8-24.md",
        "Menus/Menu week of 12-6-24.md",
        "Menus/Menu week of 2-27-25.md"
      ],
      "menu_weeks": [
        "2024-11-08",
        "2024-12-06",
        "2025-02-27"
      ],
      "menu_seasons": [
        "fall",
        "winter"
      ],
      "meal_types": [
        "dinner"
      ],
      "sections": [],
      "source_hints": [
        "https://pinchofyum.com/bang-bang-salmon-with-avocado-cucumber-salsa"
      ],
      "item_texts": [
        "Bang Bang Salmon with avocado cucumber salsa:"
      ],
      "count": 3
    },
    {
      "url": "https://pinchofyum.com/bbq-jackfruit-sandwiches",
      "urls": [
        "https://pinchofyum.com/bbq-jackfruit-sandwiches"
      ],
      "link_texts": [
        "BBQ Jackfruit Sandwiches Recipe - Pinch of Yum",
        "https://pinchofyum.com/bbq-jackfruit-sandwiches"
      ],
      "menu_files": [
        "Menus/Menu week of 11-5-25.md",
        "Menus/Menu week of 5-26-25.md",
        "Menus/Menu week of 6-24-25.md"
      ],
      "menu_weeks": [
        "2025-11-05",
        "2025-05-26",
        "2025-06-24"
      ],
      "menu_seasons": [
        "fall",
        "spring",
        "summer"
      ],
      "meal_types": [
        "dinner"
      ],
      "sections": [],
      "source_hints": [
        "https://pinchofyum.com/bbq-jackfruit-sandwiches"
      ],
      "item_texts": [
        "BBQ jackfruit sandwiches and sweet potato fries BBQ Jackfruit Sandwiches Recipe - Pinch of Yum",
        "BBQ jackfruit sandwiches and sweet potato fries",
        "BBQ jackfruit sandwiches and sweet potato fries (make more slaw)"
      ],
      "count": 3
    },
    {
      "url": "https://pinchofyum.com/burst-tomato-pappardelle",
      "urls": [
        "https://pinchofyum.com/burst-tomato-pappardelle"
      ],
      "link_texts": [
        "https://pinchofyum.c xxxom/burst-tomato-pappardelle",
        "Burst Tomato Pappardelle"
      ],
      "menu_files": [
        "Menus/Menu week of 8-13-25.md",
        "Menus/Menu week of 9-17-23.md",
        "Menus/Sean Bachelor.md"
      ],
      "menu_weeks": [
        "2025-08-13",
        "2023-09-17"
      ],
      "menu_seasons": [
        "summer",
        "fall",
        "unknown"
      ],
      "meal_types": [
        "dinner"
      ],
      "sections": [],
      "source_hints": [
        "https://pinchofyum.com/burst-tomato-pappardelle"
      ],
      "item_texts": [
        "Burst Tomato Pappardelle With Zucchini, Sweet Corn, And Pan-Fried Chicken Frozen orange chicken and broccoli xxxom/burst-tomato-pappardelle",
        "Burst tomato pappardelle",
        "Burst Tomato Pappardelle with Zucchini, Sweet Corn, and Pan-Fried Chicken"
      ],
      "count": 3
    },
    {
      "url": "https://pinchofyum.com/butter-chicken-meatballs",
      "urls": [
        "https://pinchofyum.com/butter-chicken-meatballs"
      ],
      "link_texts": [
        "Butter Chicken Meatballs"
      ],
      "menu_files": [
        "Menus/Menu week of 4-5-23.md",
        "Menus/Menu week of 8-3-23.md",
        "Menus/Menu week of 9-17-23.md"
      ],
      "menu_weeks": [
        "2023-04-05",
        "2023-08-03",
        "2023-09-17"
      ],
      "menu_seasons": [
        "spring",
        "summer",
        "fall"
      ],
      "meal_types": [
        "dinner"
      ],
      "sections": [],
      "source_hints": [],
      "item_texts": [
        "Butter chicken meatballs with roasted cauliflower",
        "Butter chicken meatballs"
      ],
      "count": 3
    },
    {
      "url": "https://pinchofyum.com/chicken-tacos",
      "urls": [
        "https://pinchofyum.com/chicken-tacos"
      ],
      "link_texts": [
        "https://pinchofyum.com/chicken-tacos",
        "Ridiculously Good Chicken Tacos with Green Sauce Recipe - Pinch of Yum"
      ],
      "menu_files": [
        "Menus/Menu week of 1-4-25.md",
        "Menus/Menu week of 11-5-25.md",
        "Menus/Menu week of 2-11-25.md"
      ],
      "menu_weeks": [
        "2025-01-04",
        "2025-11-05",
        "2025-02-11"
      ],
      "menu_seasons": [
        "winter",
        "fall"
      ],
      "meal_types": [
        "dinner"
      ],
      "sections": [],
      "source_hints": [
        "https://pinchofyum.com/chicken-tacos"
      ],
      "item_texts": [
        "Chicken tacos with green sauce and a makeshift black bean salad",
        "Chicken tacos with green sauce Ridiculously Good Chicken Tacos with Green Sauce Recipe - Pinch of Yum"
      ],
      "count": 3
    },
    {
      "url": "https://pinchofyum.com/chicken-wontons-in-spicy-chili-sauce",
      "urls": [
        "https://pinchofyum.com/chicken-wontons-in-spicy-chili-sauce"
      ],
      "link_texts": [
        "Chicken Wontons in Spicy Chili Sauce",
        "https://pinchofyum.com/chicken-wontons-in-spicy-chili-sauce"
      ],
      "menu_files": [
        "Menus/Menu week of 1-20-24.md",
        "Menus/Menu week of 2-2-24.md",
        "Menus/Menu week of 8-13-25.md"
      ],
      "menu_weeks": [
        "2024-01-20",
        "2024-02-02",
        "2025-08-13"
      ],
      "menu_seasons": [
        "winter",
        "summer"
      ],
      "meal_types": [
        "dinner"
      ],
      "sections": [],
      "source_hints": [
        "Pinch of Yum",
        "https://pinchofyum.com/chicken-wontons-in-spicy-chili-sauce"
      ],
      "item_texts": [
        "Chicken wontons with spicy sauce and roasted broccoli (Pinch of Yum)",
        "Chicken wontons in spicy chili sauce Spicy peanut tofu bowls"
      ],
      "count": 3
    },
    {
      "url": "https://pinchofyum.com/cilantro-orange-chicken-with-rice-and-beans",
      "urls": [
        "https://pinchofyum.com/cilantro-orange-chicken-with-rice-and-beans"
      ],
      "link_texts": [
        "Cilantro Orange Chicken with Rice and Beans"
      ],
      "menu_files": [
        "Menus/Menu week of 10-11-23.md",
        "Menus/Menu week of 4-23-23.md",
        "Menus/Menu week of 6-5-23.md"
      ],
      "menu_weeks": [
        "2023-10-11",
        "2023-04-23",
        "2023-06-05"
      ],
      "menu_seasons": [
        "fall",
        "spring",
        "summer"
      ],
      "meal_types": [
        "dinner"
      ],
      "sections": [],
      "source_hints": [
        "no skewers"
      ],
      "item_texts": [
        "Cilantro Orange Chicken",
        "Cilantro Orange Chicken with rice and beans",
        "Cilantro orange chicken with rice and beans (no skewers)"
      ],
      "count": 3
    },
    {
      "url": "https://pinchofyum.com/ricotta-meatballs-with-the-crispy-topping",
      "urls": [
        "https://pinchofyum.com/ricotta-meatballs-with-the-crispy-topping"
      ],
      "link_texts": [
        "https://pinchofyum.com/ricotta-meatballs-with-the-crispy-topping"
      ],
      "menu_files": [
        "Menus/Menu week of 4-28-25.md",
        "Menus/Menu week of 5-26-25.md",
        "Menus/Menu week of 9-24-24.md"
      ],
      "menu_weeks": [
        "2025-04-28",
        "2025-05-26",
        "2024-09-24"
      ],
      "menu_seasons": [
        "spring",
        "fall"
      ],
      "meal_types": [
        "dinner"
      ],
      "sections": [],
      "source_hints": [
        "https://pinchofyum.com/ricotta-meatballs-with-the-crispy-topping"
      ],
      "item_texts": [
        "Ricotta meatballs and salad:",
        "Ricotta meatballs with crispy topping, garlic bread or baguette, zucchini and squash",
        "Ricotta meatballs with crispy topping"
      ],
      "count": 3
    },
    {
      "url": "https://pinchofyum.com/thai-peanut-chicken-bowls",
      "urls": [
        "https://pinchofyum.com/thai-peanut-chicken-bowls"
      ],
      "link_texts": [
        "https://pinchofyum.com/thai-peanut-chicken-bowls"
      ],
      "menu_files": [
        "Menus/Menu week of 1-17-25.md",
        "Menus/Menu week of 3-30-25.md",
        "Menus/Menu week of 4-28-25.md"
      ],
      "menu_weeks": [
        "2025-01-17",
        "2025-03-30",
        "2025-04-28"
      ],
      "menu_seasons": [
        "winter",
        "spring"
      ],
      "meal_types": [
        "dinner"
      ],
      "sections": [],
      "source_hints": [
        "https://pinchofyum.com/thai-peanut-chicken-bowls"
      ],
      "item_texts": [
        "Thai peanut chicken bowls: use chicken thighs"
      ],
      "count": 3
    },
    {
      "url": "https://pinchofyum.com/thai-yellow-chicken-curry-with-potatoes",
      "urls": [
        "https://pinchofyum.com/thai-yellow-chicken-curry-with-potatoes"
      ],
      "link_texts": [
        "https://pinchofyum.com/thai-yellow-chicken-curry-with-potatoes"
      ],
      "menu_files": [
        "Menus/Menu week of 10-4-25.md",
        "Menus/Menu week of 11-8-24.md",
        "Menus/Menu week of 6-24-25.md"
      ],
      "menu_weeks": [
        "2025-10-04",
        "2024-11-08",
        "2025-06-24"
      ],
      "menu_seasons": [
        "fall",
        "summer"
      ],
      "meal_types": [
        "dinner"
      ],
      "sections": [],
      "source_hints": [
        "https://pinchofyum.com/thai-yellow-chicken-curry-with-potatoes",
        "maybe add a turnip?"
      ],
      "item_texts": [
        "Thai yellow chicken curry with potatoes White people tacos",
        "Thai yellow curry chicken with potatoes Ground beef tacos",
        "Thai yellow chicken curry with potatoes (maybe add a turnip?)"
      ],
      "count": 3
    },
    {
      "url": "https://pinchofyum.com/trader-joes-sun-dried-tomato-focaccia-turkey-sandwich",
      "urls": [
        "https://pinchofyum.com/trader-joes-sun-dried-tomato-focaccia-turkey-sandwich"
      ],
      "link_texts": [
        "https://pinchofyum.com/trader-joes-sun-dried-tomato-focaccia-turkey-sandwich",
        "Trader Joe's Sun-Dried Tomato Focaccia Turkey Sandwich Recipe - Pinch of Yum"
      ],
      "menu_files": [
        "Menus/Menu week of 6-13-25.md",
        "Menus/Menu week of 9-10-25.md",
        "Menus/Week of 7-27-25.md"
      ],
      "menu_weeks": [
        "2025-06-13",
        "2025-09-10",
        "2025-07-27"
      ],
      "menu_seasons": [
        "summer",
        "fall"
      ],
      "meal_types": [
        "dinner"
      ],
      "sections": [],
      "source_hints": [
        "use micro greens",
        "https://pinchofyum.com/trader-joes-sun-dried-tomato-focaccia-turkey-sandwich"
      ],
      "item_texts": [
        "Friday: Turkey Focaccia sandwich fruit (use micro greens)",
        "Trader Joe\u2019s Sun-Dried Tomato Focaccia Turkey Sandwich",
        "Roasted Tomato Focaccia Turkey Sandwich with Pesto Mayo and soup Trader Joe's Sun-Dried Tomato Focaccia Turkey Sandwich Recipe - Pinch of Yum"
      ],
      "count": 3
    },
    {
      "url": "https://smittenkitchen.com/2012/08/leek-chard-and-corn-flatbread/",
      "urls": [
        "https://smittenkitchen.com/2012/08/leek-chard-and-corn-flatbread/"
      ],
      "link_texts": [
        "Leek, Chard, and Corn Flatbread"
      ],
      "menu_files": [
        "Menus/Menu week of 10-7-17.md",
        "Menus/Menu week of 9-21-17.md",
        "Menus/Menu week of 9-8-17.md"
      ],
      "menu_weeks": [
        "2017-10-07",
        "2017-09-21",
        "2017-09-08"
      ],
      "menu_seasons": [
        "fall"
      ],
      "meal_types": [
        "dinner"
      ],
      "sections": [],
      "source_hints": [],
      "item_texts": [
        "Leek, chard, goat cheese, and corn flatbread"
      ],
      "count": 3
    },
    {
      "url": "https://www.halfbakedharvest.com/one-pot-hamburger-helper/",
      "urls": [
        "https://www.halfbakedharvest.com/one-pot-hamburger-helper/"
      ],
      "link_texts": [
        "https://www.halfbakedharvest.com/one-pot-hamburger-helper/",
        "Healthier Homemade One Pot Hamburger Helper. - Half Baked Harvest"
      ],
      "menu_files": [
        "Menus/Menu week of 1-28-25.md",
        "Menus/Menu week of 10-23-24.md",
        "Menus/Menu week of 11-5-25.md"
      ],
      "menu_weeks": [
        "2025-01-28",
        "2024-10-23",
        "2025-11-05"
      ],
      "menu_seasons": [
        "winter",
        "fall"
      ],
      "meal_types": [
        "dinner"
      ],
      "sections": [],
      "source_hints": [
        "https://www.halfbakedharvest.com/one-pot-hamburger-helper/"
      ],
      "item_texts": [
        "Healthier Hamburger Helper",
        "One pot healthier hamburger helper",
        "Healthier one pot hamburger helper Healthier Homemade One Pot Hamburger Helper. - Half Baked Harvest"
      ],
      "count": 3
    },
    {
      "url": "https://www.howsweeteats.com/2021/05/strawberry-salad/",
      "urls": [
        "https://www.howsweeteats.com/2021/05/strawberry-salad/"
      ],
      "link_texts": [
        "https://www.howsweeteats.com/2021/05/strawberry-salad/"
      ],
      "menu_files": [
        "Menus/Menu week of 5-17-24.md",
        "Menus/Menu week of 5-26-25.md",
        "Menus/Menu week of 5-30-24.md"
      ],
      "menu_weeks": [
        "2024-05-17",
        "2025-05-26",
        "2024-05-30"
      ],
      "menu_seasons": [
        "spring"
      ],
      "meal_types": [
        "dinner"
      ],
      "sections": [],
      "source_hints": [],
      "item_texts": [
        "Strawberry crunch salad and baguette",
        "Strawberry crunch salad with baguette:"
      ],
      "count": 3
    },
    {
      "url": "https://www.spendwithpennies.com/instant-pot-chicken-noodle-soup/",
      "urls": [
        "https://www.spendwithpennies.com/instant-pot-chicken-noodle-soup/"
      ],
      "link_texts": [
        "Instant Pot Chicken Noodle Soup",
        "https://www.spendwithpennies.com/instant-pot-chicken-noodle-soup/"
      ],
      "menu_files": [
        "Menus/Menu week of 10-11-23.md",
        "Menus/Menu week of 10-4-25.md",
        "Menus/Menu week of 6-1-21.md"
      ],
      "menu_weeks": [
        "2023-10-11",
        "2025-10-04",
        "2021-06-01"
      ],
      "menu_seasons": [
        "fall",
        "summer"
      ],
      "meal_types": [
        "dinner"
      ],
      "sections": [],
      "source_hints": [
        "Spend with Pennies",
        "https://www.spendwithpennies.com/instant-pot-chicken-noodle-soup/"
      ],
      "item_texts": [
        "Instant pot chicken noodle soup (Spend with Pennies)",
        "Instant pot chicken noodle soup"
      ],
      "count": 3
    },
    {
      "url": "http://gimmesomeoven.com/roasted-sweet-potato-tacos/",
      "urls": [
        "http://gimmesomeoven.com/roasted-sweet-potato-tacos/"
      ],
      "link_texts": [
        "gimmesomeoven.com/roasted-sweet-potato-tacos/"
      ],
      "menu_files": [
        "Menus/Menu week of 3-30-25.md",
        "Menus/Menu week of 5-15-25.md"
      ],
      "menu_weeks": [
        "2025-03-30",
        "2025-05-15"
      ],
      "menu_seasons": [
        "spring"
      ],
      "meal_types": [
        "dinner"
      ],
      "sections": [],
      "source_hints": [
        "http://gimmesomeoven.com/roasted-sweet-potato-tacos/"
      ],
      "item_texts": [
        "Roasted sweet potato tacos Chicken nuggets, broccoli, sweet potato fries",
        "Sweet potato tacos"
      ],
      "count": 2
    },
    {
      "url": "https://cravingsbychrissyteigen.com/blogs/recipes/squash-and-ricotta-pizza-recipe",
      "urls": [
        "https://cravingsbychrissyteigen.com/blogs/recipes/squash-and-ricotta-pizza-recipe"
      ],
      "link_texts": [
        "Garlicky Roasted Squash and Ricotta Pizza"
      ],
      "menu_files": [
        "Menus/Menu week of 1-12-2021.md",
        "Menus/Menu week of 11-16-20.md"
      ],
      "menu_weeks": [
        "2021-01-12",
        "2020-11-16"
      ],
      "menu_seasons": [
        "winter",
        "fall"
      ],
      "meal_types": [
        "dinner"
      ],
      "sections": [],
      "source_hints": [
        "roast garlic and make dough ahead of time"
      ],
      "item_texts": [
        "Garlicky roasted squash and ricotta pizza",
        "Garlicky roasted squash and ricotta pizza (roast garlic and make dough ahead of time)"
      ],
      "count": 2
    },
    {
      "url": "https://damndelicious.net/2018/03/03/instant-pot-olive-garden-zuppa-toscana-copycat/",
      "urls": [
        "https://damndelicious.net/2018/03/03/instant-pot-olive-garden-zuppa-toscana-copycat/"
      ],
      "link_texts": [
        "https://damndelicious.net/2018/03/03/instant-pot-olive-garden-zuppa-toscana-copycat/"
      ],
      "menu_files": [
        "Menus/Menu week of 1-4-25.md",
        "Menus/Menu week of 9-10-24.md"
      ],
      "menu_weeks": [
        "2025-01-04",
        "2024-09-10"
      ],
      "menu_seasons": [
        "winter",
        "fall"
      ],
      "meal_types": [
        "dinner"
      ],
      "sections": [],
      "source_hints": [],
      "item_texts": [
        "Olive Garden Zuppa Toscana and everyday italian salad"
      ],
      "count": 2
    },
    {
      "url": "https://iowagirleats.com/broccoli-beef-recipe/#wprm-recipe-container-146358",
      "urls": [
        "https://iowagirleats.com/broccoli-beef-recipe/#wprm-recipe-container-146358"
      ],
      "link_texts": [
        "https://iowagirleats.com/broccoli-beef-recipe/#wprm-recipe-container-146358"
      ],
      "menu_files": [
        "Menus/Menu week of 1-4-25.md",
        "Menus/Week of 7-14-25.md"
      ],
      "menu_weeks": [
        "2025-01-04",
        "2025-07-14"
      ],
      "menu_seasons": [
        "winter",
        "summer"
      ],
      "meal_types": [
        "dinner"
      ],
      "sections": [],
      "source_hints": [],
      "item_texts": [
        "Lighter beef and broccoli",
        "Beef and broccoli stir fry"
      ],
      "count": 2
    },
    {
      "url": "https://pinchofyum.com/5-ingredient-spicy-pork",
      "urls": [
        "https://pinchofyum.com/5-ingredient-spicy-pork"
      ],
      "link_texts": [
        "https://pinchofyum.com/5-ingredient-spicy-pork"
      ],
      "menu_files": [
        "Menus/Menu week of 1-23-23.md",
        "Menus/Menu week of 4-4-24.md"
      ],
      "menu_weeks": [
        "2023-01-23",
        "2024-04-04"
      ],
      "menu_seasons": [
        "winter",
        "spring"
      ],
      "meal_types": [
        "dinner"
      ],
      "sections": [],
      "source_hints": [],
      "item_texts": [
        "Five ingredient spicy pork",
        "5 ingredient spicy pork"
      ],
      "count": 2
    },
    {
      "url": "https://pinchofyum.com/5-ingredient-tomato-soup",
      "urls": [
        "https://pinchofyum.com/5-ingredient-tomato-soup"
      ],
      "link_texts": [
        "https://pinchofyum.com/5-ingredient-tomato-soup"
      ],
      "menu_files": [
        "Menus/Menu week of 1-28-25.md",
        "Menus/Menu week of 11-8-24.md"
      ],
      "menu_weeks": [
        "2025-01-28",
        "2024-11-08"
      ],
      "menu_seasons": [
        "winter",
        "fall"
      ],
      "meal_types": [
        "dinner"
      ],
      "sections": [],
      "source_hints": [],
      "item_texts": [
        "5 ingredient tomato soup and grilled cheese:"
      ],
      "count": 2
    },
    {
      "url": "https://pinchofyum.com/baked-salmon-with-amazing-lemon-sauce",
      "urls": [
        "https://pinchofyum.com/baked-salmon-with-amazing-lemon-sauce"
      ],
      "link_texts": [
        "Baked Salmon with Amazing Lemon Sauce"
      ],
      "menu_files": [
        "Menus/Menu week of 1-13-22.md",
        "Menus/Menu week of 11-19-22.md"
      ],
      "menu_weeks": [
        "2022-01-13",
        "2022-11-19"
      ],
      "menu_seasons": [
        "winter",
        "fall"
      ],
      "meal_types": [
        "dinner"
      ],
      "sections": [],
      "source_hints": [
        "Pinch of Yum"
      ],
      "item_texts": [
        "Baked Salmon with amazing lemon sauce (Pinch of Yum)",
        "Baked salmon with amazing lemon sauce"
      ],
      "count": 2
    },
    {
      "url": "https://pinchofyum.com/brown-butter-scallops-parmesan-risotto",
      "urls": [
        "https://pinchofyum.com/brown-butter-scallops-parmesan-risotto"
      ],
      "link_texts": [
        "https://pinchofyum.com/brown-butter-scallops-parmesan-risotto"
      ],
      "menu_files": [
        "Menus/Menu week of 2-11-25.md",
        "Menus/Menu week of 6-12-24.md"
      ],
      "menu_weeks": [
        "2025-02-11",
        "2024-06-12"
      ],
      "menu_seasons": [
        "winter",
        "summer"
      ],
      "meal_types": [
        "dinner"
      ],
      "sections": [],
      "source_hints": [
        "https://pinchofyum.com/brown-butter-scallops-parmesan-risotto"
      ],
      "item_texts": [
        "Brown butter scallops with parmesan risotto and asparagus",
        "Brown butter scallops and parmesan risotto?"
      ],
      "count": 2
    },
    {
      "url": "https://pinchofyum.com/buffalo-chicken-burgers-with-whipped-feta-spread",
      "urls": [
        "https://pinchofyum.com/buffalo-chicken-burgers-with-whipped-feta-spread"
      ],
      "link_texts": [
        "https://pinchofyum.com/buffalo-chicken-burgers-with-whipped-feta-spread",
        "Buffalo Chicken Burgers with Whipped Feta Spread Recipe - Pinch of Yum"
      ],
      "menu_files": [
        "Menus/Menu week of 9-21-25.md",
        "Menus/Week of 7-27-25.md"
      ],
      "menu_weeks": [
        "2025-09-21",
        "2025-07-27"
      ],
      "menu_seasons": [
        "fall",
        "summer"
      ],
      "meal_types": [
        "dinner"
      ],
      "sections": [],
      "source_hints": [
        "https://pinchofyum.com/buffalo-chicken-burgers-with-whipped-feta-spread"
      ],
      "item_texts": [
        "Buffalo Chicken Burgers with Whipped Feta and sweet potato fries",
        "Buffalo chicken burgers with whipped feta Buffalo Chicken Burgers with Whipped Feta Spread Recipe - Pinch of Yum"
      ],
      "count": 2
    },
    {
      "url": "https://pinchofyum.com/burger-bowls-with-house-sauce-and-ranch-fries",
      "urls": [
        "https://pinchofyum.com/burger-bowls-with-house-sauce-and-ranch-fries"
      ],
      "link_texts": [
        "https://pinchofyum.com/burger-bowls-with-house-sauce-and-ranch-fries",
        "Burger Bowls with House Sauce and Ranch Fries Recipe - Pinch of Yum"
      ],
      "menu_files": [
        "Menus/Menu week of 9-21-25.md",
        "Menus/Week of 7-27-25.md"
      ],
      "menu_weeks": [
        "2025-09-21",
        "2025-07-27"
      ],
      "menu_seasons": [
        "fall",
        "summer"
      ],
      "meal_types": [
        "lunch",
        "dinner"
      ],
      "sections": [],
      "source_hints": [
        "https://pinchofyum.com/burger-bowls-with-house-sauce-and-ranch-fries"
      ],
      "item_texts": [
        "Burger bowls with house sauce and ranch fries BLTs (for lunch)?",
        "Burger bowls with ranch fries Burger Bowls with House Sauce and Ranch Fries Recipe - Pinch of Yum"
      ],
      "count": 2
    },
    {
      "url": "https://pinchofyum.com/cauliflower-walnut-vegetarian-taco-meat",
      "urls": [
        "https://pinchofyum.com/cauliflower-walnut-vegetarian-taco-meat"
      ],
      "link_texts": [
        "https://pinchofyum.com/cauliflower-walnut-vegetarian-taco-meat"
      ],
      "menu_files": [
        "Menus/Menu week of 1-28-25.md",
        "Menus/Week of 11-17-25.md"
      ],
      "menu_weeks": [
        "2025-01-28",
        "2025-11-17"
      ],
      "menu_seasons": [
        "winter",
        "fall"
      ],
      "meal_types": [
        "dinner"
      ],
      "sections": [],
      "source_hints": [
        "https://pinchofyum.com/cauliflower-walnut-vegetarian-taco-meat"
      ],
      "item_texts": [
        "Cauliflower walnut taco meat Double recipe, serve with black beans, pico, cheese, sour cream, corn, salsa, and lettuce",
        "Fake meat burrito bowls (premade pico and guac, microwave rice packets)"
      ],
      "count": 2
    },
    {
      "url": "https://pinchofyum.com/crunchy-roll-bowls",
      "urls": [
        "https://pinchofyum.com/crunchy-roll-bowls"
      ],
      "link_texts": [
        "https://pinchofyum.com/crunchy-roll-bowls",
        "Crunchy Roll Bowls Recipe - Pinch of Yum"
      ],
      "menu_files": [
        "Menus/Menu week of 9-21-25.md",
        "Menus/Week of 7-27-25.md"
      ],
      "menu_weeks": [
        "2025-09-21",
        "2025-07-27"
      ],
      "menu_seasons": [
        "fall",
        "summer"
      ],
      "meal_types": [
        "dinner"
      ],
      "sections": [],
      "source_hints": [
        "https://pinchofyum.com/crunchy-roll-bowls"
      ],
      "item_texts": [
        "Crunchy Roll Bowls with Crispy Shallots",
        "Crunchy roll bowls with crispy shallots Crunchy Roll Bowls Recipe - Pinch of Yum"
      ],
      "count": 2
    },
    {
      "url": "https://pinchofyum.com/ginger-chicken-meatball-sandos",
      "urls": [
        "https://pinchofyum.com/ginger-chicken-meatball-sandos"
      ],
      "link_texts": [
        "https://pinchofyum.com/ginger-chicken-meatball-sandos"
      ],
      "menu_files": [
        "Menus/Menu week of 12-4-25.md",
        "Menus/Menu week of 6-12-24.md"
      ],
      "menu_weeks": [
        "2025-12-04",
        "2024-06-12"
      ],
      "menu_seasons": [
        "winter",
        "summer"
      ],
      "meal_types": [
        "dinner"
      ],
      "sections": [],
      "source_hints": [
        "https://pinchofyum.com/ginger-chicken-meatball-sandos"
      ],
      "item_texts": [
        "Ginger chicken meatball sandos",
        "Cucumber radish salad plus ginger chicken meatball sandwiches (pita bread)"
      ],
      "count": 2
    },
    {
      "url": "https://pinchofyum.com/instant-pot-pot-roast",
      "urls": [
        "https://pinchofyum.com/instant-pot-pot-roast"
      ],
      "link_texts": [
        "https://pinchofyum.com/instant-pot-pot-roast"
      ],
      "menu_files": [
        "Menus/Menu week of 12-6-24.md",
        "Menus/Menu week of 4-11-25.md"
      ],
      "menu_weeks": [
        "2024-12-06",
        "2025-04-11"
      ],
      "menu_seasons": [
        "winter",
        "spring"
      ],
      "meal_types": [
        "dinner"
      ],
      "sections": [],
      "source_hints": [
        "https://pinchofyum.com/instant-pot-pot-roast"
      ],
      "item_texts": [
        "Instant Pot Pot roast:",
        "Instant Pot Pot Roast (Easter?)"
      ],
      "count": 2
    },
    {
      "url": "https://pinchofyum.com/instant-pot-short-rib-ragu",
      "urls": [
        "https://pinchofyum.com/instant-pot-short-rib-ragu"
      ],
      "link_texts": [
        "Instant Pot Short Rib Ragu",
        "https://pinchofyum.com/instant-pot-short-rib-ragu"
      ],
      "menu_files": [
        "Menus/Menu week of 1-10-19.md",
        "Menus/Menu week of 1-17-25.md"
      ],
      "menu_weeks": [
        "2019-01-10",
        "2025-01-17"
      ],
      "menu_seasons": [
        "winter"
      ],
      "meal_types": [
        "dinner"
      ],
      "sections": [],
      "source_hints": [],
      "item_texts": [
        "Instant pot short rib ragu",
        "Short rib ragu and fancy pasta in the freezer"
      ],
      "count": 2
    },
    {
      "url": "https://pinchofyum.com/lemongrass-chicken-with-rice-and-zucchini",
      "urls": [
        "https://pinchofyum.com/lemongrass-chicken-with-rice-and-zucchini"
      ],
      "link_texts": [
        "https://pinchofyum.com/lemongrass-chicken-with-rice-and-zucchini",
        "Lemongrass Chicken with Rice and Zucchini Recipe - Pinch of Yum"
      ],
      "menu_files": [
        "Menus/Menu week of 7-1-24.md",
        "Menus/Menu week of 8-18-24.md"
      ],
      "menu_weeks": [
        "2024-07-01",
        "2024-08-18"
      ],
      "menu_seasons": [
        "summer"
      ],
      "meal_types": [
        "dinner"
      ],
      "sections": [],
      "source_hints": [
        "https://pinchofyum.com/lemongrass-chicken-with-rice-and-zucchini"
      ],
      "item_texts": [
        "Lemongrass chicken with rice and zucchini",
        "Lemongrass chicken with rice and zucchini Lemongrass Chicken with Rice and Zucchini Recipe - Pinch of Yum"
      ],
      "count": 2
    },
    {
      "url": "https://pinchofyum.com/plantain-and-pinto-stew-with-aji-verde",
      "urls": [
        "https://pinchofyum.com/plantain-and-pinto-stew-with-aji-verde"
      ],
      "link_texts": [
        "Plantain and Pinto Stew with Aji Verde"
      ],
      "menu_files": [
        "Menus/Menu week of 12-28-23.md",
        "Menus/Menu week of 4-10-22.md"
      ],
      "menu_weeks": [
        "2023-12-28",
        "2022-04-10"
      ],
      "menu_seasons": [
        "winter",
        "spring"
      ],
      "meal_types": [
        "dinner"
      ],
      "sections": [],
      "source_hints": [],
      "item_texts": [
        "Plantain and pinto stew with aji verde"
      ],
      "count": 2
    },
    {
      "url": "https://pinchofyum.com/quick-and-easy-lentil-quesadillas",
      "urls": [
        "https://pinchofyum.com/quick-and-easy-lentil-quesadillas"
      ],
      "link_texts": [
        "Quick and Easy Lentil Quesadillas",
        "https://pinchofyum.com/quick-and-easy-lentil-quesadillas"
      ],
      "menu_files": [
        "Menus/Menu week of 1-11-20.md",
        "Menus/Week of 11-17-25.md"
      ],
      "menu_weeks": [
        "2020-01-11",
        "2025-11-17"
      ],
      "menu_seasons": [
        "winter",
        "fall"
      ],
      "meal_types": [
        "dinner"
      ],
      "sections": [],
      "source_hints": [
        "https://pinchofyum.com/quick-and-easy-lentil-quesadillas"
      ],
      "item_texts": [
        "Crockpot Lentil Quesadillas with magic green sauce",
        "Quick and easy lentil quesadillas"
      ],
      "count": 2
    },
    {
      "url": "https://pinchofyum.com/quinoa-crunch-salad-with-peanut-dressing",
      "urls": [
        "https://pinchofyum.com/quinoa-crunch-salad-with-peanut-dressing"
      ],
      "link_texts": [
        "Quinoa Crunch Salad with Peanut Dressing"
      ],
      "menu_files": [
        "Menus/Menu week of 1-11-20.md",
        "Menus/Menu week of 3-7-20.md"
      ],
      "menu_weeks": [
        "2020-01-11",
        "2020-03-07"
      ],
      "menu_seasons": [
        "winter",
        "spring"
      ],
      "meal_types": [
        "dinner"
      ],
      "sections": [],
      "source_hints": [
        "Vegetarian"
      ],
      "item_texts": [
        "Quinoa Crunch Salad with peanut dressing",
        "Quinoa crunch salad with peanut dressing (Vegetarian)"
      ],
      "count": 2
    },
    {
      "url": "https://pinchofyum.com/smoky-beans-greens-tacos-with-aji-verde",
      "urls": [
        "https://pinchofyum.com/smoky-beans-greens-tacos-with-aji-verde"
      ],
      "link_texts": [
        "https://pinchofyum.com/smoky-beans-greens-tacos-with-aji-verde"
      ],
      "menu_files": [
        "Menus/Menu week of 6-12-24.md",
        "Menus/Menu week of 7-1-24.md"
      ],
      "menu_weeks": [
        "2024-06-12",
        "2024-07-01"
      ],
      "menu_seasons": [
        "summer"
      ],
      "meal_types": [
        "dinner"
      ],
      "sections": [],
      "source_hints": [
        "https://pinchofyum.com/smoky-beans-greens-tacos-with-aji-verde"
      ],
      "item_texts": [
        "Smoky Beans and greens tacos with aji verde",
        "Smoky beans and greens tacos with ahi verde Use carrots and radishes"
      ],
      "count": 2
    },
    {
      "url": "https://pinchofyum.com/thai-coconut-soup-with-tofu-and-rice",
      "urls": [
        "https://pinchofyum.com/thai-coconut-soup-with-tofu-and-rice"
      ],
      "link_texts": [
        "Thai Coconut Soup with Tofu and Rice"
      ],
      "menu_files": [
        "Menus/Menu week of 1-9-24.md",
        "Menus/Menu week of 2-20-23.md"
      ],
      "menu_weeks": [
        "2024-01-09",
        "2023-02-20"
      ],
      "menu_seasons": [
        "winter"
      ],
      "meal_types": [
        "dinner"
      ],
      "sections": [],
      "source_hints": [
        "Pinch of Yum"
      ],
      "item_texts": [
        "Thai coconut soup with tofu and rice (Pinch of Yum)",
        "Thai coconut soup with tofu and rice"
      ],
      "count": 2
    },
    {
      "url": "https://www.acouplecooks.com/chickpea-couscous-bowls-tahini-sauce/",
      "urls": [
        "https://www.acouplecooks.com/chickpea-couscous-bowls-tahini-sauce/"
      ],
      "link_texts": [
        "Mediterranean Couscous Bowls"
      ],
      "menu_files": [
        "Menus/Menu week of 1-10-19.md",
        "Menus/Menu week of 8-12-18.md"
      ],
      "menu_weeks": [
        "2019-01-10",
        "2018-08-12"
      ],
      "menu_seasons": [
        "winter",
        "summer"
      ],
      "meal_types": [
        "dinner"
      ],
      "sections": [],
      "source_hints": [],
      "item_texts": [
        "Chickpea cous cous bowls with tahini sauce"
      ],
      "count": 2
    },
    {
      "url": "https://www.bonappetit.com/recipe/saucy-soy-butter-beef-and-peppers-recipe",
      "urls": [
        "https://www.bonappetit.com/recipe/saucy-soy-butter-beef-and-peppers-recipe"
      ],
      "link_texts": [
        "https://www.bonappetit.com/recipe/saucy-soy-butter-beef-and-peppers-recipe"
      ],
      "menu_files": [
        "Menus/Menu week of 7-25-24.md",
        "Menus/Menu week of 8-18-24.md"
      ],
      "menu_weeks": [
        "2024-07-25",
        "2024-08-18"
      ],
      "menu_seasons": [
        "summer"
      ],
      "meal_types": [
        "dinner"
      ],
      "sections": [],
      "source_hints": [
        "https://www.bonappetit.com/recipe/saucy-soy-butter-beef-and-peppers-recipe"
      ],
      "item_texts": [
        "Saucy soy-butter beef and peppers"
      ],
      "count": 2
    },
    {
      "url": "https://www.gimmesomeoven.com/poblano-white-chicken-chili/",
      "urls": [
        "https://www.gimmesomeoven.com/poblano-white-chicken-chili/"
      ],
      "link_texts": [
        "https://www.gimmesomeoven.com/poblano-white-chicken-chili/"
      ],
      "menu_files": [
        "Menus/Menu week of 10-23-24.md",
        "Menus/Menu week of 10-4-25.md"
      ],
      "menu_weeks": [
        "2024-10-23",
        "2025-10-04"
      ],
      "menu_seasons": [
        "fall"
      ],
      "meal_types": [
        "dinner"
      ],
      "sections": [],
      "source_hints": [
        "https://www.gimmesomeoven.com/poblano-white-chicken-chili/"
      ],
      "item_texts": [
        "Poblano white chicken chili"
      ],
      "count": 2
    },
    {
      "url": "https://www.gimmesomeoven.com/roasted-sweet-potato-tacos/#tasty-recipes-72325",
      "urls": [
        "https://www.gimmesomeoven.com/roasted-sweet-potato-tacos/#tasty-recipes-72325"
      ],
      "link_texts": [
        "https://www.gimmesomeoven.com/roasted-sweet-potato-tacos/#tasty-recipes-72325"
      ],
      "menu_files": [
        "Menus/Menu week of 5-30-24.md",
        "Menus/Menu week of 9-1-24.md"
      ],
      "menu_weeks": [
        "2024-05-30",
        "2024-09-01"
      ],
      "menu_seasons": [
        "spring",
        "fall"
      ],
      "meal_types": [
        "dinner"
      ],
      "sections": [],
      "source_hints": [],
      "item_texts": [
        "Sweet potato tacos",
        "Sweet potato tacos:"
      ],
      "count": 2
    },
    {
      "url": "https://www.halfbakedharvest.com/lemon-brown-butter-salmon-and-potatoes/",
      "urls": [
        "https://www.halfbakedharvest.com/lemon-brown-butter-salmon-and-potatoes/"
      ],
      "link_texts": [
        "https://www.halfbakedharvest.com/lemon-brown-butter-salmon-and-potatoes/"
      ],
      "menu_files": [
        "Menus/Menu week of 3-30-25.md",
        "Menus/Menu week of 5-17-24.md"
      ],
      "menu_weeks": [
        "2025-03-30",
        "2024-05-17"
      ],
      "menu_seasons": [
        "spring"
      ],
      "meal_types": [
        "dinner"
      ],
      "sections": [],
      "source_hints": [
        "https://www.halfbakedharvest.com/lemon-brown-butter-salmon-and-potatoes/"
      ],
      "item_texts": [
        "Sheet Pan Lemon Brown Butter Salmon and Potatoes with Parmesan Asparagus",
        "Sheet pan brown butter salmon, potatoes, and asparagus"
      ],
      "count": 2
    },
    {
      "url": "https://www.loveandlemons.com/lemony-swiss-chard-pasta/",
      "urls": [
        "https://www.loveandlemons.com/lemony-swiss-chard-pasta/"
      ],
      "link_texts": [
        "https://www.loveandlemons.com/lemony-swiss-chard-pasta/"
      ],
      "menu_files": [
        "Menus/Menu week of 7-1-24.md",
        "Menus/Menu week of 7-25-24.md"
      ],
      "menu_weeks": [
        "2024-07-01",
        "2024-07-25"
      ],
      "menu_seasons": [
        "summer"
      ],
      "meal_types": [
        "dinner"
      ],
      "sections": [],
      "source_hints": [
        "https://www.loveandlemons.com/lemony-swiss-chard-pasta/"
      ],
      "item_texts": [
        "Swiss chard pasta:"
      ],
      "count": 2
    },
    {
      "url": "https://www.pbs.org/food/recipes/bulgur-salad-with-grapes-and-feta-cheese",
      "urls": [
        "https://www.pbs.org/food/recipes/bulgur-salad-with-grapes-and-feta-cheese"
      ],
      "link_texts": [
        "Bulgur Salad with Grapes and Feta Cheese"
      ],
      "menu_files": [
        "Menus/Menu week of 7-2-20 (vacation).md",
        "Menus/Menu week of 7-8-17.md"
      ],
      "menu_weeks": [
        "2020-07-02",
        "2017-07-08"
      ],
      "menu_seasons": [
        "summer"
      ],
      "meal_types": [
        "lunch",
        "dinner"
      ],
      "sections": [
        "Lunches"
      ],
      "source_hints": [
        "make ahead and bring"
      ],
      "item_texts": [
        "Bulgur salad (make ahead and bring)",
        "Bulgur salad again"
      ],
      "count": 2
    },
    {
      "url": null,
      "urls": [],
      "link_texts": [],
      "menu_files": [
        "Menus/Easter brunch.md"
      ],
      "menu_weeks": [],
      "menu_seasons": [
        "unknown"
      ],
      "meal_types": [
        "dinner"
      ],
      "sections": [],
      "source_hints": [],
      "item_texts": [
        "Make the night before. Sub water for milk. only add cheese to half and not in the mix."
      ],
      "count": 1
    },
    {
      "url": null,
      "urls": [],
      "link_texts": [],
      "menu_files": [
        "Menus/Easter brunch.md"
      ],
      "menu_weeks": [],
      "menu_seasons": [
        "unknown"
      ],
      "meal_types": [
        "dinner"
      ],
      "sections": [],
      "source_hints": [],
      "item_texts": [
        "Use vegan butter"
      ],
      "count": 1
    },
    {
      "url": null,
      "urls": [],
      "link_texts": [],
      "menu_files": [
        "Menus/Easter brunch.md"
      ],
      "menu_weeks": [],
      "menu_seasons": [
        "unknown"
      ],
      "meal_types": [
        "dinner"
      ],
      "sections": [],
      "source_hints": [],
      "item_texts": [
        "FruitMonkeys"
      ],
      "count": 1
    },
    {
      "url": null,
      "urls": [],
      "link_texts": [],
      "menu_files": [
        "Menus/Menu week of 1-10-19.md"
      ],
      "menu_weeks": [
        "2019-01-10"
      ],
      "menu_seasons": [
        "winter"
      ],
      "meal_types": [
        "dinner"
      ],
      "sections": [],
      "source_hints": [],
      "item_texts": [
        "Instant pot chicken chili verde"
      ],
      "count": 1
    },
    {
      "url": null,
      "urls": [],
      "link_texts": [],
      "menu_files": [
        "Menus/Menu week of 1-11-20.md"
      ],
      "menu_weeks": [
        "2020-01-11"
      ],
      "menu_seasons": [
        "winter"
      ],
      "meal_types": [
        "dinner"
      ],
      "sections": [],
      "source_hints": [
        "guac in freezer"
      ],
      "item_texts": [
        "Cauliflower Walnut burrito bowls (guac in freezer)"
      ],
      "count": 1
    },
    {
      "url": null,
      "urls": [],
      "link_texts": [],
      "menu_files": [
        "Menus/Menu week of 1-11-20.md"
      ],
      "menu_weeks": [
        "2020-01-11"
      ],
      "menu_seasons": [
        "winter"
      ],
      "meal_types": [
        "dinner"
      ],
      "sections": [],
      "source_hints": [],
      "item_texts": [
        "Irish potato soup"
      ],
      "count": 1
    },
    {
      "url": null,
      "urls": [],
      "link_texts": [],
      "menu_files": [
        "Menus/Menu week of 1-11-20.md"
      ],
      "menu_weeks": [
        "2020-01-11"
      ],
      "menu_seasons": [
        "winter"
      ],
      "meal_types": [
        "dinner"
      ],
      "sections": [],
      "source_hints": [],
      "item_texts": [
        "Saturday: Roasted beet, goat cheese, and candied pecan salad with amelia\u2019s bread"
      ],
      "count": 1
    },
    {
      "url": null,
      "urls": [],
      "link_texts": [],
      "menu_files": [
        "Menus/Menu week of 1-11-20.md"
      ],
      "menu_weeks": [
        "2020-01-11"
      ],
      "menu_seasons": [
        "winter"
      ],
      "meal_types": [
        "dinner"
      ],
      "sections": [],
      "source_hints": [],
      "item_texts": [
        "Steak and roasted parsnips and beets"
      ],
      "count": 1
    },
    {
      "url": null,
      "urls": [],
      "link_texts": [],
      "menu_files": [
        "Menus/Menu week of 1-11-20.md"
      ],
      "menu_weeks": [
        "2020-01-11"
      ],
      "menu_seasons": [
        "winter"
      ],
      "meal_types": [
        "breakfast"
      ],
      "sections": [],
      "source_hints": [],
      "item_texts": [
        "Breakfast balls"
      ],
      "count": 1
    },
    {
      "url": null,
      "urls": [],
      "link_texts": [],
      "menu_files": [
        "Menus/Menu week of 1-12-2021.md"
      ],
      "menu_weeks": [
        "2021-01-12"
      ],
      "menu_seasons": [
        "winter"
      ],
      "meal_types": [
        "dinner"
      ],
      "sections": [],
      "source_hints": [],
      "item_texts": [
        "Root vegetable soup (freezer) and salad"
      ],
      "count": 1
    },
    {
      "url": null,
      "urls": [],
      "link_texts": [],
      "menu_files": [
        "Menus/Menu week of 1-12-2021.md"
      ],
      "menu_weeks": [
        "2021-01-12"
      ],
      "menu_seasons": [
        "winter"
      ],
      "meal_types": [
        "dinner"
      ],
      "sections": [],
      "source_hints": [],
      "item_texts": [
        "Chipotle quinoa burgers and sweet potato fries"
      ],
      "count": 1
    },
    {
      "url": null,
      "urls": [],
      "link_texts": [],
      "menu_files": [
        "Menus/Menu week of 1-12-2021.md"
      ],
      "menu_weeks": [
        "2021-01-12"
      ],
      "menu_seasons": [
        "winter"
      ],
      "meal_types": [
        "dinner"
      ],
      "sections": [],
      "source_hints": [],
      "item_texts": [
        "Cauliflower Gnocchi"
      ],
      "count": 1
    },
    {
      "url": null,
      "urls": [],
      "link_texts": [],
      "menu_files": [
        "Menus/Menu week of 1-12-2021.md"
      ],
      "menu_weeks": [
        "2021-01-12"
      ],
      "menu_seasons": [
        "winter"
      ],
      "meal_types": [
        "dinner"
      ],
      "sections": [],
      "source_hints": [],
      "item_texts": [
        "Vegan sheet pan fajitas with chipotle queso"
      ],
      "count": 1
    },
    {
      "url": null,
      "urls": [],
      "link_texts": [],
      "menu_files": [
        "Menus/Menu week of 1-12-2021.md"
      ],
      "menu_weeks": [
        "2021-01-12"
      ],
      "menu_seasons": [
        "winter"
      ],
      "meal_types": [
        "dinner"
      ],
      "sections": [],
      "source_hints": [],
      "item_texts": [
        "Instant pot Italian Beef sandwiches"
      ],
      "count": 1
    },
    {
      "url": null,
      "urls": [],
      "link_texts": [],
      "menu_files": [
        "Menus/Menu week of 1-13-18.md"
      ],
      "menu_weeks": [
        "2018-01-13"
      ],
      "menu_seasons": [
        "winter"
      ],
      "meal_types": [
        "dinner"
      ],
      "sections": [],
      "source_hints": [],
      "item_texts": [
        "Fried chicken, cornbread, green beans"
      ],
      "count": 1
    },
    {
      "url": null,
      "urls": [],
      "link_texts": [],
      "menu_files": [
        "Menus/Menu week of 1-13-18.md"
      ],
      "menu_weeks": [
        "2018-01-13"
      ],
      "menu_seasons": [
        "winter"
      ],
      "meal_types": [
        "dinner"
      ],
      "sections": [],
      "source_hints": [],
      "item_texts": [
        "Squid ink pasta with shrimp and scallops"
      ],
      "count": 1
    },
    {
      "url": null,
      "urls": [],
      "link_texts": [],
      "menu_files": [
        "Menus/Menu week of 1-13-18.md"
      ],
      "menu_weeks": [
        "2018-01-13"
      ],
      "menu_seasons": [
        "winter"
      ],
      "meal_types": [
        "dinner"
      ],
      "sections": [],
      "source_hints": [],
      "item_texts": [
        "Quick dal makhani"
      ],
      "count": 1
    },
    {
      "url": null,
      "urls": [],
      "link_texts": [],
      "menu_files": [
        "Menus/Menu week of 1-13-18.md"
      ],
      "menu_weeks": [
        "2018-01-13"
      ],
      "menu_seasons": [
        "winter"
      ],
      "meal_types": [
        "dinner"
      ],
      "sections": [],
      "source_hints": [],
      "item_texts": [
        "Broccoli cauliflower beef stir fry"
      ],
      "count": 1
    },
    {
      "url": null,
      "urls": [],
      "link_texts": [],
      "menu_files": [
        "Menus/Menu week of 1-13-18.md"
      ],
      "menu_weeks": [
        "2018-01-13"
      ],
      "menu_seasons": [
        "winter"
      ],
      "meal_types": [
        "dinner"
      ],
      "sections": [],
      "source_hints": [],
      "item_texts": [
        "Pizza"
      ],
      "count": 1
    },
    {
      "url": null,
      "urls": [],
      "link_texts": [],
      "menu_files": [
        "Menus/Menu week of 1-13-18.md"
      ],
      "menu_weeks": [
        "2018-01-13"
      ],
      "menu_seasons": [
        "winter"
      ],
      "meal_types": [
        "dinner"
      ],
      "sections": [],
      "source_hints": [],
      "item_texts": [
        "Skillet-charred fish tacos (cravings p209)"
      ],
      "count": 1
    },
    {
      "url": null,
      "urls": [],
      "link_texts": [],
      "menu_files": [
        "Menus/Menu week of 1-13-18.md"
      ],
      "menu_weeks": [
        "2018-01-13"
      ],
      "menu_seasons": [
        "winter"
      ],
      "meal_types": [
        "dinner"
      ],
      "sections": [],
      "source_hints": [],
      "item_texts": [
        "Dark chocolate almond joy bites"
      ],
      "count": 1
    },
    {
      "url": null,
      "urls": [],
      "link_texts": [],
      "menu_files": [
        "Menus/Menu week of 1-13-18.md"
      ],
      "menu_weeks": [
        "2018-01-13"
      ],
      "menu_seasons": [
        "winter"
      ],
      "meal_types": [
        "dinner"
      ],
      "sections": [],
      "source_hints": [],
      "item_texts": [
        "Chips and salsa"
      ],
      "count": 1
    },
    {
      "url": null,
      "urls": [],
      "link_texts": [],
      "menu_files": [
        "Menus/Menu week of 1-13-18.md"
      ],
      "menu_weeks": [
        "2018-01-13"
      ],
      "menu_seasons": [
        "winter"
      ],
      "meal_types": [
        "dinner"
      ],
      "sections": [],
      "source_hints": [],
      "item_texts": [
        "Carrots and hummus"
      ],
      "count": 1
    },
    {
      "url": null,
      "urls": [],
      "link_texts": [],
      "menu_files": [
        "Menus/Menu week of 1-13-18.md"
      ],
      "menu_weeks": [
        "2018-01-13"
      ],
      "menu_seasons": [
        "winter"
      ],
      "meal_types": [
        "dinner"
      ],
      "sections": [],
      "source_hints": [],
      "item_texts": [
        "Cheese and crackers (include goat cheese and port wine cranberry"
      ],
      "count": 1
    },
    {
      "url": null,
      "urls": [],
      "link_texts": [],
      "menu_files": [
        "Menus/Menu week of 1-13-22.md"
      ],
      "menu_weeks": [
        "2022-01-13"
      ],
      "menu_seasons": [
        "winter"
      ],
      "meal_types": [
        "dinner"
      ],
      "sections": [],
      "source_hints": [
        "marinade in freezer"
      ],
      "item_texts": [
        "Instant Pot Korean beef tacos (marinade in freezer)"
      ],
      "count": 1
    },
    {
      "url": null,
      "urls": [],
      "link_texts": [],
      "menu_files": [
        "Menus/Menu week of 1-13-22.md"
      ],
      "menu_weeks": [
        "2022-01-13"
      ],
      "menu_seasons": [
        "winter"
      ],
      "meal_types": [
        "dinner"
      ],
      "sections": [],
      "source_hints": [],
      "item_texts": [
        "Instant Pot Chicken and dumplings"
      ],
      "count": 1
    },
    {
      "url": null,
      "urls": [],
      "link_texts": [],
      "menu_files": [
        "Menus/Menu week of 1-13-22.md"
      ],
      "menu_weeks": [
        "2022-01-13"
      ],
      "menu_seasons": [
        "winter"
      ],
      "meal_types": [
        "dinner"
      ],
      "sections": [],
      "source_hints": [],
      "item_texts": [
        "The best Detox crockpot lentil soup (Pinch of Yum) and bread"
      ],
      "count": 1
    },
    {
      "url": null,
      "urls": [],
      "link_texts": [],
      "menu_files": [
        "Menus/Menu week of 1-13-22.md"
      ],
      "menu_weeks": [
        "2022-01-13"
      ],
      "menu_seasons": [
        "winter"
      ],
      "meal_types": [
        "dinner"
      ],
      "sections": [],
      "source_hints": [],
      "item_texts": [
        "Sweet potato black bean bowls"
      ],
      "count": 1
    },
    {
      "url": null,
      "urls": [],
      "link_texts": [],
      "menu_files": [
        "Menus/Menu week of 1-16-22.md"
      ],
      "menu_weeks": [
        "2022-01-16"
      ],
      "menu_seasons": [
        "winter"
      ],
      "meal_types": [
        "dinner"
      ],
      "sections": [],
      "source_hints": [],
      "item_texts": [
        "Blue apron: chicken"
      ],
      "count": 1
    },
    {
      "url": null,
      "urls": [],
      "link_texts": [],
      "menu_files": [
        "Menus/Menu week of 1-16-22.md"
      ],
      "menu_weeks": [
        "2022-01-16"
      ],
      "menu_seasons": [
        "winter"
      ],
      "meal_types": [
        "dinner"
      ],
      "sections": [],
      "source_hints": [],
      "item_texts": [
        "Smokey beans and greens tacos with aj\u00ed verde"
      ],
      "count": 1
    },
    {
      "url": null,
      "urls": [],
      "link_texts": [],
      "menu_files": [
        "Menus/Menu week of 1-16-22.md"
      ],
      "menu_weeks": [
        "2022-01-16"
      ],
      "menu_seasons": [
        "winter"
      ],
      "meal_types": [
        "dinner"
      ],
      "sections": [],
      "source_hints": [],
      "item_texts": [
        "Blue apron: steak"
      ],
      "count": 1
    },
    {
      "url": null,
      "urls": [],
      "link_texts": [],
      "menu_files": [
        "Menus/Menu week of 1-16-22.md"
      ],
      "menu_weeks": [
        "2022-01-16"
      ],
      "menu_seasons": [
        "winter"
      ],
      "meal_types": [
        "dinner"
      ],
      "sections": [],
      "source_hints": [],
      "item_texts": [
        "Blue apron: salmon"
      ],
      "count": 1
    },
    {
      "url": null,
      "urls": [],
      "link_texts": [],
      "menu_files": [
        "Menus/Menu week of 1-16-22.md"
      ],
      "menu_weeks": [
        "2022-01-16"
      ],
      "menu_seasons": [
        "winter"
      ],
      "meal_types": [
        "dinner"
      ],
      "sections": [],
      "source_hints": [],
      "item_texts": [
        "Creamy red pepper pasta with bl\u00edsteres tomatoes"
      ],
      "count": 1
    },
    {
      "url": null,
      "urls": [],
      "link_texts": [],
      "menu_files": [
        "Menus/Menu week of 1-16-22.md"
      ],
      "menu_weeks": [
        "2022-01-16"
      ],
      "menu_seasons": [
        "winter"
      ],
      "meal_types": [
        "dinner"
      ],
      "sections": [],
      "source_hints": [],
      "item_texts": [
        "Blue Apron: wonton noodles"
      ],
      "count": 1
    },
    {
      "url": null,
      "urls": [],
      "link_texts": [],
      "menu_files": [
        "Menus/Menu week of 1-16-22.md"
      ],
      "menu_weeks": [
        "2022-01-16"
      ],
      "menu_seasons": [
        "winter"
      ],
      "meal_types": [
        "dinner"
      ],
      "sections": [],
      "source_hints": [],
      "item_texts": [
        "Blue apron: cheese burgers and potato wedges"
      ],
      "count": 1
    },
    {
      "url": null,
      "urls": [],
      "link_texts": [],
      "menu_files": [
        "Menus/Menu week of 1-16-22.md"
      ],
      "menu_weeks": [
        "2022-01-16"
      ],
      "menu_seasons": [
        "winter"
      ],
      "meal_types": [
        "dinner"
      ],
      "sections": [],
      "source_hints": [
        "make rice"
      ],
      "item_texts": [
        "Plantain and pinto stew with aj\u00ed verde (make rice)"
      ],
      "count": 1
    },
    {
      "url": null,
      "urls": [],
      "link_texts": [],
      "menu_files": [
        "Menus/Menu week of 1-16-22.md"
      ],
      "menu_weeks": [
        "2022-01-16"
      ],
      "menu_seasons": [
        "winter"
      ],
      "meal_types": [
        "snack"
      ],
      "sections": [],
      "source_hints": [],
      "item_texts": [
        "Snack: cookie dough energy bites"
      ],
      "count": 1
    },
    {
      "url": null,
      "urls": [],
      "link_texts": [],
      "menu_files": [
        "Menus/Menu week of 1-16-22.md"
      ],
      "menu_weeks": [
        "2022-01-16"
      ],
      "menu_seasons": [
        "winter"
      ],
      "meal_types": [
        "dinner"
      ],
      "sections": [],
      "source_hints": [],
      "item_texts": [
        "Anytime: simple greens salad"
      ],
      "count": 1
    },
    {
      "url": null,
      "urls": [],
      "link_texts": [],
      "menu_files": [
        "Menus/Menu week of 1-16-26.md"
      ],
      "menu_weeks": [
        "2026-01-16"
      ],
      "menu_seasons": [
        "winter"
      ],
      "meal_types": [
        "dinner"
      ],
      "sections": [],
      "source_hints": [],
      "item_texts": [
        "Perogies with bacon, sour cream, cheese, chives, and salad"
      ],
      "count": 1
    },
    {
      "url": null,
      "urls": [],
      "link_texts": [],
      "menu_files": [
        "Menus/Menu week of 1-16-26.md"
      ],
      "menu_weeks": [
        "2026-01-16"
      ],
      "menu_seasons": [
        "winter"
      ],
      "meal_types": [
        "dinner"
      ],
      "sections": [],
      "source_hints": [],
      "item_texts": [
        "Orange chicken, broccoli, and rice"
      ],
      "count": 1
    },
    {
      "url": null,
      "urls": [],
      "link_texts": [],
      "menu_files": [
        "Menus/Menu week of 1-16-26.md"
      ],
      "menu_weeks": [
        "2026-01-16"
      ],
      "menu_seasons": [
        "winter"
      ],
      "meal_types": [
        "dinner"
      ],
      "sections": [],
      "source_hints": [],
      "item_texts": [
        "Chicken nuggets, sweet potato fries, leftover broccoli"
      ],
      "count": 1
    },
    {
      "url": null,
      "urls": [],
      "link_texts": [],
      "menu_files": [
        "Menus/Menu week of 1-16-26.md"
      ],
      "menu_weeks": [
        "2026-01-16"
      ],
      "menu_seasons": [
        "winter"
      ],
      "meal_types": [
        "dinner"
      ],
      "sections": [],
      "source_hints": [],
      "item_texts": [
        "Orange chicken (freezer) and broccoli"
      ],
      "count": 1
    },
    {
      "url": null,
      "urls": [],
      "link_texts": [],
      "menu_files": [
        "Menus/Menu week of 1-16-26.md"
      ],
      "menu_weeks": [
        "2026-01-16"
      ],
      "menu_seasons": [
        "winter"
      ],
      "meal_types": [
        "breakfast"
      ],
      "sections": [],
      "source_hints": [],
      "item_texts": [
        "Breakfast: French toast, bacon"
      ],
      "count": 1
    },
    {
      "url": null,
      "urls": [],
      "link_texts": [],
      "menu_files": [
        "Menus/Menu week of 1-17-25.md"
      ],
      "menu_weeks": [
        "2025-01-17"
      ],
      "menu_seasons": [
        "winter"
      ],
      "meal_types": [
        "dinner"
      ],
      "sections": [],
      "source_hints": [],
      "item_texts": [
        "Chicken nuggets, broccoli, sweet potato fries"
      ],
      "count": 1
    },
    {
      "url": null,
      "urls": [],
      "link_texts": [],
      "menu_files": [
        "Menus/Menu week of 1-2-18.md"
      ],
      "menu_weeks": [
        "2018-01-02"
      ],
      "menu_seasons": [
        "winter"
      ],
      "meal_types": [
        "dinner"
      ],
      "sections": [],
      "source_hints": [],
      "item_texts": [
        "Corned beef and cabbage, potatoes"
      ],
      "count": 1
    },
    {
      "url": null,
      "urls": [],
      "link_texts": [],
      "menu_files": [
        "Menus/Menu week of 1-2-18.md"
      ],
      "menu_weeks": [
        "2018-01-02"
      ],
      "menu_seasons": [
        "winter"
      ],
      "meal_types": [
        "dinner"
      ],
      "sections": [],
      "source_hints": [],
      "item_texts": [
        "Golden soup and spinach salad"
      ],
      "count": 1
    },
    {
      "url": null,
      "urls": [],
      "link_texts": [],
      "menu_files": [
        "Menus/Menu week of 1-2-18.md"
      ],
      "menu_weeks": [
        "2018-01-02"
      ],
      "menu_seasons": [
        "winter"
      ],
      "meal_types": [
        "dinner"
      ],
      "sections": [],
      "source_hints": [],
      "item_texts": [
        "Tofu green curry and brown rice"
      ],
      "count": 1
    },
    {
      "url": null,
      "urls": [],
      "link_texts": [],
      "menu_files": [
        "Menus/Menu week of 1-2-18.md"
      ],
      "menu_weeks": [
        "2018-01-02"
      ],
      "menu_seasons": [
        "winter"
      ],
      "meal_types": [
        "dinner"
      ],
      "sections": [],
      "source_hints": [],
      "item_texts": [
        "Cabbage, sausage, and potato soup"
      ],
      "count": 1
    },
    {
      "url": null,
      "urls": [],
      "link_texts": [],
      "menu_files": [
        "Menus/Menu week of 1-2-18.md"
      ],
      "menu_weeks": [
        "2018-01-02"
      ],
      "menu_seasons": [
        "winter"
      ],
      "meal_types": [
        "dinner"
      ],
      "sections": [],
      "source_hints": [],
      "item_texts": [
        "Whole wheat pasta salad with salmon"
      ],
      "count": 1
    },
    {
      "url": null,
      "urls": [],
      "link_texts": [],
      "menu_files": [
        "Menus/Menu week of 1-20-24.md"
      ],
      "menu_weeks": [
        "2024-01-20"
      ],
      "menu_seasons": [
        "winter"
      ],
      "meal_types": [
        "dinner"
      ],
      "sections": [],
      "source_hints": [],
      "item_texts": [
        "Red pepper cashew pasta with cauliflower"
      ],
      "count": 1
    },
    {
      "url": null,
      "urls": [],
      "link_texts": [],
      "menu_files": [
        "Menus/Menu week of 1-20-24.md"
      ],
      "menu_weeks": [
        "2024-01-20"
      ],
      "menu_seasons": [
        "winter"
      ],
      "meal_types": [
        "dinner"
      ],
      "sections": [],
      "source_hints": [],
      "item_texts": [
        "Chicken nuggets, sweet potato fries, roasted broccoli"
      ],
      "count": 1
    },
    {
      "url": null,
      "urls": [],
      "link_texts": [],
      "menu_files": [
        "Menus/Menu week of 1-20-24.md"
      ],
      "menu_weeks": [
        "2024-01-20"
      ],
      "menu_seasons": [
        "winter"
      ],
      "meal_types": [
        "dinner"
      ],
      "sections": [],
      "source_hints": [
        "use sour kraut up"
      ],
      "item_texts": [
        "Brats and some kind of roasted vegetable (use sour kraut up)"
      ],
      "count": 1
    },
    {
      "url": null,
      "urls": [],
      "link_texts": [],
      "menu_files": [
        "Menus/Menu week of 1-21-19.md"
      ],
      "menu_weeks": [
        "2019-01-21"
      ],
      "menu_seasons": [
        "winter"
      ],
      "meal_types": [
        "dinner"
      ],
      "sections": [],
      "source_hints": [],
      "item_texts": [
        "Cauliflower and tomato coconut curry"
      ],
      "count": 1
    },
    {
      "url": null,
      "urls": [],
      "link_texts": [],
      "menu_files": [
        "Menus/Menu week of 1-21-19.md"
      ],
      "menu_weeks": [
        "2019-01-21"
      ],
      "menu_seasons": [
        "winter"
      ],
      "meal_types": [
        "dinner"
      ],
      "sections": [],
      "source_hints": [],
      "item_texts": [
        "Pizza"
      ],
      "count": 1
    },
    {
      "url": null,
      "urls": [],
      "link_texts": [],
      "menu_files": [
        "Menus/Menu week of 1-21-19.md"
      ],
      "menu_weeks": [
        "2019-01-21"
      ],
      "menu_seasons": [
        "winter"
      ],
      "meal_types": [
        "dinner"
      ],
      "sections": [],
      "source_hints": [],
      "item_texts": [
        "Quinoa salad with apple, chickpeas, toasted almonds, apple cider vinaigrette"
      ],
      "count": 1
    },
    {
      "url": null,
      "urls": [],
      "link_texts": [],
      "menu_files": [
        "Menus/Menu week of 1-21-19.md"
      ],
      "menu_weeks": [
        "2019-01-21"
      ],
      "menu_seasons": [
        "winter"
      ],
      "meal_types": [
        "dinner"
      ],
      "sections": [],
      "source_hints": [],
      "item_texts": [
        "Sweet potato and black bean toastadas"
      ],
      "count": 1
    },
    {
      "url": null,
      "urls": [],
      "link_texts": [],
      "menu_files": [
        "Menus/Menu week of 1-21-19.md"
      ],
      "menu_weeks": [
        "2019-01-21"
      ],
      "menu_seasons": [
        "winter"
      ],
      "meal_types": [
        "dinner"
      ],
      "sections": [],
      "source_hints": [],
      "item_texts": [
        "Chili"
      ],
      "count": 1
    },
    {
      "url": null,
      "urls": [],
      "link_texts": [],
      "menu_files": [
        "Menus/Menu week of 1-23-23.md"
      ],
      "menu_weeks": [
        "2023-01-23"
      ],
      "menu_seasons": [
        "winter"
      ],
      "meal_types": [
        "dinner"
      ],
      "sections": [],
      "source_hints": [],
      "item_texts": [
        "COCONUT CURRY SALMON"
      ],
      "count": 1
    },
    {
      "url": null,
      "urls": [],
      "link_texts": [],
      "menu_files": [
        "Menus/Menu week of 1-23-23.md"
      ],
      "menu_weeks": [
        "2023-01-23"
      ],
      "menu_seasons": [
        "winter"
      ],
      "meal_types": [
        "dinner"
      ],
      "sections": [],
      "source_hints": [],
      "item_texts": [
        "SAUSAGE, KALE, AND WHITE BEAN SOUP"
      ],
      "count": 1
    },
    {
      "url": null,
      "urls": [],
      "link_texts": [],
      "menu_files": [
        "Menus/Menu week of 1-23-23.md"
      ],
      "menu_weeks": [
        "2023-01-23"
      ],
      "menu_seasons": [
        "winter"
      ],
      "meal_types": [
        "dinner"
      ],
      "sections": [],
      "source_hints": [],
      "item_texts": [
        "WALNUT CHORIZO TACOS"
      ],
      "count": 1
    },
    {
      "url": null,
      "urls": [],
      "link_texts": [],
      "menu_files": [
        "Menus/Menu week of 1-23-23.md"
      ],
      "menu_weeks": [
        "2023-01-23"
      ],
      "menu_seasons": [
        "winter"
      ],
      "meal_types": [
        "dinner"
      ],
      "sections": [],
      "source_hints": [],
      "item_texts": [
        "ROASTED CAULIFLOWER HUMMUS BOWLS"
      ],
      "count": 1
    },
    {
      "url": null,
      "urls": [],
      "link_texts": [],
      "menu_files": [
        "Menus/Menu week of 1-23-23.md"
      ],
      "menu_weeks": [
        "2023-01-23"
      ],
      "menu_seasons": [
        "winter"
      ],
      "meal_types": [
        "dinner"
      ],
      "sections": [],
      "source_hints": [],
      "item_texts": [
        "AVOCADO KALE CAESAR SALAD"
      ],
      "count": 1
    },
    {
      "url": null,
      "urls": [],
      "link_texts": [],
      "menu_files": [
        "Menus/Menu week of 1-24-20.md"
      ],
      "menu_weeks": [
        "2020-01-24"
      ],
      "menu_seasons": [
        "winter"
      ],
      "meal_types": [
        "dinner"
      ],
      "sections": [],
      "source_hints": [],
      "item_texts": [
        "Best easy fish tacos"
      ],
      "count": 1
    },
    {
      "url": null,
      "urls": [],
      "link_texts": [],
      "menu_files": [
        "Menus/Menu week of 1-24-20.md"
      ],
      "menu_weeks": [
        "2020-01-24"
      ],
      "menu_seasons": [
        "winter"
      ],
      "meal_types": [
        "dinner"
      ],
      "sections": [],
      "source_hints": [],
      "item_texts": [
        "Spaghetti squash burrito boats"
      ],
      "count": 1
    },
    {
      "url": null,
      "urls": [],
      "link_texts": [],
      "menu_files": [
        "Menus/Menu week of 1-24-20.md"
      ],
      "menu_weeks": [
        "2020-01-24"
      ],
      "menu_seasons": [
        "winter"
      ],
      "meal_types": [
        "dinner"
      ],
      "sections": [],
      "source_hints": [],
      "item_texts": [
        "Chili"
      ],
      "count": 1
    },
    {
      "url": null,
      "urls": [],
      "link_texts": [],
      "menu_files": [
        "Menus/Menu week of 1-24-20.md"
      ],
      "menu_weeks": [
        "2020-01-24"
      ],
      "menu_seasons": [
        "winter"
      ],
      "meal_types": [
        "dinner"
      ],
      "sections": [],
      "source_hints": [],
      "item_texts": [
        "Korean bbq steak bowls"
      ],
      "count": 1
    },
    {
      "url": null,
      "urls": [],
      "link_texts": [],
      "menu_files": [
        "Menus/Menu week of 1-24-20.md"
      ],
      "menu_weeks": [
        "2020-01-24"
      ],
      "menu_seasons": [
        "winter"
      ],
      "meal_types": [
        "breakfast"
      ],
      "sections": [],
      "source_hints": [],
      "item_texts": [
        "Breakfast sandwiches"
      ],
      "count": 1
    },
    {
      "url": null,
      "urls": [],
      "link_texts": [],
      "menu_files": [
        "Menus/Menu week of 1-24-21.md"
      ],
      "menu_weeks": [
        "2021-01-24"
      ],
      "menu_seasons": [
        "winter"
      ],
      "meal_types": [
        "dinner"
      ],
      "sections": [],
      "source_hints": [],
      "item_texts": [
        "Chili"
      ],
      "count": 1
    },
    {
      "url": null,
      "urls": [],
      "link_texts": [],
      "menu_files": [
        "Menus/Menu week of 1-24-21.md"
      ],
      "menu_weeks": [
        "2021-01-24"
      ],
      "menu_seasons": [
        "winter"
      ],
      "meal_types": [
        "dinner"
      ],
      "sections": [],
      "source_hints": [],
      "item_texts": [
        "Cashew tofu stir fry"
      ],
      "count": 1
    },
    {
      "url": null,
      "urls": [],
      "link_texts": [],
      "menu_files": [
        "Menus/Menu week of 1-24-21.md"
      ],
      "menu_weeks": [
        "2021-01-24"
      ],
      "menu_seasons": [
        "winter"
      ],
      "meal_types": [
        "dinner"
      ],
      "sections": [],
      "source_hints": [],
      "item_texts": [
        "Slow cooker Olive Garden pasta e fagioli soup"
      ],
      "count": 1
    },
    {
      "url": null,
      "urls": [],
      "link_texts": [],
      "menu_files": [
        "Menus/Menu week of 1-24-21.md"
      ],
      "menu_weeks": [
        "2021-01-24"
      ],
      "menu_seasons": [
        "winter"
      ],
      "meal_types": [
        "dinner"
      ],
      "sections": [],
      "source_hints": [],
      "item_texts": [
        "Pizza"
      ],
      "count": 1
    },
    {
      "url": null,
      "urls": [],
      "link_texts": [],
      "menu_files": [
        "Menus/Menu week of 1-24-21.md"
      ],
      "menu_weeks": [
        "2021-01-24"
      ],
      "menu_seasons": [
        "winter"
      ],
      "meal_types": [
        "dinner"
      ],
      "sections": [],
      "source_hints": [
        "can freeze ahead"
      ],
      "item_texts": [
        "Instant pot beef stew (can freeze ahead)"
      ],
      "count": 1
    },
    {
      "url": null,
      "urls": [],
      "link_texts": [],
      "menu_files": [
        "Menus/Menu week of 1-24-21.md"
      ],
      "menu_weeks": [
        "2021-01-24"
      ],
      "menu_seasons": [
        "winter"
      ],
      "meal_types": [
        "breakfast"
      ],
      "sections": [],
      "source_hints": [],
      "item_texts": [
        "Snack: breakfast balls"
      ],
      "count": 1
    },
    {
      "url": null,
      "urls": [],
      "link_texts": [],
      "menu_files": [
        "Menus/Menu week of 1-24-21.md"
      ],
      "menu_weeks": [
        "2021-01-24"
      ],
      "menu_seasons": [
        "winter"
      ],
      "meal_types": [
        "dinner"
      ],
      "sections": [],
      "source_hints": [],
      "item_texts": [
        "Peach smoothie or green smoothie"
      ],
      "count": 1
    },
    {
      "url": null,
      "urls": [],
      "link_texts": [],
      "menu_files": [
        "Menus/Menu week of 1-28-18.md"
      ],
      "menu_weeks": [
        "2018-01-28"
      ],
      "menu_seasons": [
        "winter"
      ],
      "meal_types": [
        "dinner"
      ],
      "sections": [],
      "source_hints": [],
      "item_texts": [
        "Buffalo Chicken wontons and apples"
      ],
      "count": 1
    },
    {
      "url": null,
      "urls": [],
      "link_texts": [],
      "menu_files": [
        "Menus/Menu week of 1-28-18.md"
      ],
      "menu_weeks": [
        "2018-01-28"
      ],
      "menu_seasons": [
        "winter"
      ],
      "meal_types": [
        "dinner"
      ],
      "sections": [],
      "source_hints": [],
      "item_texts": [
        "Curry chicken salad"
      ],
      "count": 1
    },
    {
      "url": null,
      "urls": [],
      "link_texts": [],
      "menu_files": [
        "Menus/Menu week of 1-28-18.md"
      ],
      "menu_weeks": [
        "2018-01-28"
      ],
      "menu_seasons": [
        "winter"
      ],
      "meal_types": [
        "dinner"
      ],
      "sections": [],
      "source_hints": [],
      "item_texts": [
        "Cilantro lime chicken meatball bowls"
      ],
      "count": 1
    },
    {
      "url": null,
      "urls": [],
      "link_texts": [],
      "menu_files": [
        "Menus/Menu week of 1-28-18.md"
      ],
      "menu_weeks": [
        "2018-01-28"
      ],
      "menu_seasons": [
        "winter"
      ],
      "meal_types": [
        "dinner"
      ],
      "sections": [],
      "source_hints": [],
      "item_texts": [
        "Red pepper pasta with roasted cauliflower"
      ],
      "count": 1
    },
    {
      "url": null,
      "urls": [],
      "link_texts": [],
      "menu_files": [
        "Menus/Menu week of 1-28-18.md"
      ],
      "menu_weeks": [
        "2018-01-28"
      ],
      "menu_seasons": [
        "winter"
      ],
      "meal_types": [
        "dinner"
      ],
      "sections": [],
      "source_hints": [],
      "item_texts": [
        "feta stuffed buffalo chicken meatballs"
      ],
      "count": 1
    },
    {
      "url": null,
      "urls": [],
      "link_texts": [],
      "menu_files": [
        "Menus/Menu week of 1-28-18.md"
      ],
      "menu_weeks": [
        "2018-01-28"
      ],
      "menu_seasons": [
        "winter"
      ],
      "meal_types": [
        "dinner"
      ],
      "sections": [],
      "source_hints": [],
      "item_texts": [
        "Pizza bites"
      ],
      "count": 1
    },
    {
      "url": null,
      "urls": [],
      "link_texts": [],
      "menu_files": [
        "Menus/Menu week of 1-28-18.md"
      ],
      "menu_weeks": [
        "2018-01-28"
      ],
      "menu_seasons": [
        "winter"
      ],
      "meal_types": [
        "dinner"
      ],
      "sections": [],
      "source_hints": [],
      "item_texts": [
        "Zesty like shrimp and avocado salad"
      ],
      "count": 1
    },
    {
      "url": null,
      "urls": [],
      "link_texts": [],
      "menu_files": [
        "Menus/Menu week of 1-28-18.md"
      ],
      "menu_weeks": [
        "2018-01-28"
      ],
      "menu_seasons": [
        "winter"
      ],
      "meal_types": [
        "dinner"
      ],
      "sections": [],
      "source_hints": [
        "blueberries, mangoes, apples"
      ],
      "item_texts": [
        "Fruit (blueberries, mangoes, apples)"
      ],
      "count": 1
    },
    {
      "url": null,
      "urls": [],
      "link_texts": [],
      "menu_files": [
        "Menus/Menu week of 1-28-18.md"
      ],
      "menu_weeks": [
        "2018-01-28"
      ],
      "menu_seasons": [
        "winter"
      ],
      "meal_types": [
        "dinner"
      ],
      "sections": [],
      "source_hints": [],
      "item_texts": [
        "Eggs, bacon, potatoes"
      ],
      "count": 1
    },
    {
      "url": null,
      "urls": [],
      "link_texts": [],
      "menu_files": [
        "Menus/Menu week of 1-28-18.md"
      ],
      "menu_weeks": [
        "2018-01-28"
      ],
      "menu_seasons": [
        "winter"
      ],
      "meal_types": [
        "dinner"
      ],
      "sections": [],
      "source_hints": [],
      "item_texts": [
        "Dark chocolate almond joy bites"
      ],
      "count": 1
    },
    {
      "url": null,
      "urls": [],
      "link_texts": [],
      "menu_files": [
        "Menus/Menu week of 1-28-25.md"
      ],
      "menu_weeks": [
        "2025-01-28"
      ],
      "menu_seasons": [
        "winter"
      ],
      "meal_types": [
        "dinner"
      ],
      "sections": [],
      "source_hints": [],
      "item_texts": [
        "Chicken nuggets, broccoli, sweet potato fries"
      ],
      "count": 1
    },
    {
      "url": null,
      "urls": [],
      "link_texts": [],
      "menu_files": [
        "Menus/Menu week of 1-31-22.md"
      ],
      "menu_weeks": [
        "2022-01-31"
      ],
      "menu_seasons": [
        "winter"
      ],
      "meal_types": [
        "dinner"
      ],
      "sections": [],
      "source_hints": [],
      "item_texts": [
        "Tofu peanut bowls"
      ],
      "count": 1
    },
    {
      "url": null,
      "urls": [],
      "link_texts": [],
      "menu_files": [
        "Menus/Menu week of 1-31-22.md"
      ],
      "menu_weeks": [
        "2022-01-31"
      ],
      "menu_seasons": [
        "winter"
      ],
      "meal_types": [
        "dinner"
      ],
      "sections": [],
      "source_hints": [],
      "item_texts": [
        "Sweet potato tacos"
      ],
      "count": 1
    },
    {
      "url": null,
      "urls": [],
      "link_texts": [],
      "menu_files": [
        "Menus/Menu week of 1-31-22.md"
      ],
      "menu_weeks": [
        "2022-01-31"
      ],
      "menu_seasons": [
        "winter"
      ],
      "meal_types": [
        "dinner"
      ],
      "sections": [],
      "source_hints": [],
      "item_texts": [
        "Steaks"
      ],
      "count": 1
    },
    {
      "url": null,
      "urls": [],
      "link_texts": [],
      "menu_files": [
        "Menus/Menu week of 1-31-22.md"
      ],
      "menu_weeks": [
        "2022-01-31"
      ],
      "menu_seasons": [
        "winter"
      ],
      "meal_types": [
        "dinner"
      ],
      "sections": [],
      "source_hints": [],
      "item_texts": [
        "Chicken stir fry"
      ],
      "count": 1
    },
    {
      "url": null,
      "urls": [],
      "link_texts": [],
      "menu_files": [
        "Menus/Menu week of 1-31-22.md"
      ],
      "menu_weeks": [
        "2022-01-31"
      ],
      "menu_seasons": [
        "winter"
      ],
      "meal_types": [
        "dinner"
      ],
      "sections": [],
      "source_hints": [],
      "item_texts": [
        "Beyond Beef mushroom rice bowls"
      ],
      "count": 1
    },
    {
      "url": null,
      "urls": [],
      "link_texts": [],
      "menu_files": [
        "Menus/Menu week of 1-31-22.md"
      ],
      "menu_weeks": [
        "2022-01-31"
      ],
      "menu_seasons": [
        "winter"
      ],
      "meal_types": [
        "dinner"
      ],
      "sections": [],
      "source_hints": [],
      "item_texts": [
        "Panko chicken"
      ],
      "count": 1
    },
    {
      "url": null,
      "urls": [],
      "link_texts": [],
      "menu_files": [
        "Menus/Menu week of 1-31-22.md"
      ],
      "menu_weeks": [
        "2022-01-31"
      ],
      "menu_seasons": [
        "winter"
      ],
      "meal_types": [
        "dinner"
      ],
      "sections": [],
      "source_hints": [],
      "item_texts": [
        "Black pepper stir fried udon (POY week 3)"
      ],
      "count": 1
    },
    {
      "url": null,
      "urls": [],
      "link_texts": [],
      "menu_files": [
        "Menus/Menu week of 1-31-22.md"
      ],
      "menu_weeks": [
        "2022-01-31"
      ],
      "menu_seasons": [
        "winter"
      ],
      "meal_types": [
        "dinner"
      ],
      "sections": [],
      "source_hints": [],
      "item_texts": [
        "Pita sandwiches"
      ],
      "count": 1
    },
    {
      "url": null,
      "urls": [],
      "link_texts": [],
      "menu_files": [
        "Menus/Menu week of 1-31-22.md"
      ],
      "menu_weeks": [
        "2022-01-31"
      ],
      "menu_seasons": [
        "winter"
      ],
      "meal_types": [
        "dinner"
      ],
      "sections": [],
      "source_hints": [],
      "item_texts": [
        "Garlic caper chicken"
      ],
      "count": 1
    },
    {
      "url": null,
      "urls": [],
      "link_texts": [],
      "menu_files": [
        "Menus/Menu week of 1-31-22.md"
      ],
      "menu_weeks": [
        "2022-01-31"
      ],
      "menu_seasons": [
        "winter"
      ],
      "meal_types": [
        "dinner"
      ],
      "sections": [],
      "source_hints": [],
      "item_texts": [
        "Steaks"
      ],
      "count": 1
    },
    {
      "url": null,
      "urls": [],
      "link_texts": [],
      "menu_files": [
        "Menus/Menu week of 1-31-22.md"
      ],
      "menu_weeks": [
        "2022-01-31"
      ],
      "menu_seasons": [
        "winter"
      ],
      "meal_types": [
        "dinner"
      ],
      "sections": [],
      "source_hints": [],
      "item_texts": [
        "Blue apron gnocchi"
      ],
      "count": 1
    },
    {
      "url": null,
      "urls": [],
      "link_texts": [],
      "menu_files": [
        "Menus/Menu week of 1-31-22.md"
      ],
      "menu_weeks": [
        "2022-01-31"
      ],
      "menu_seasons": [
        "winter"
      ],
      "meal_types": [
        "dinner"
      ],
      "sections": [],
      "source_hints": [],
      "item_texts": [
        "Instant pot wild rice soup"
      ],
      "count": 1
    },
    {
      "url": null,
      "urls": [],
      "link_texts": [],
      "menu_files": [
        "Menus/Menu week of 1-31-22.md"
      ],
      "menu_weeks": [
        "2022-01-31"
      ],
      "menu_seasons": [
        "winter"
      ],
      "meal_types": [
        "dinner"
      ],
      "sections": [],
      "source_hints": [],
      "item_texts": [
        "Orange salmon and fried rice"
      ],
      "count": 1
    },
    {
      "url": null,
      "urls": [],
      "link_texts": [],
      "menu_files": [
        "Menus/Menu week of 1-31-22.md"
      ],
      "menu_weeks": [
        "2022-01-31"
      ],
      "menu_seasons": [
        "winter"
      ],
      "meal_types": [
        "dinner"
      ],
      "sections": [],
      "source_hints": [],
      "item_texts": [
        "Spicy shrimp tacos with garlic cilantro lime slaw"
      ],
      "count": 1
    },
    {
      "url": null,
      "urls": [],
      "link_texts": [],
      "menu_files": [
        "Menus/Menu week of 1-31-22.md"
      ],
      "menu_weeks": [
        "2022-01-31"
      ],
      "menu_seasons": [
        "winter"
      ],
      "meal_types": [
        "dinner"
      ],
      "sections": [],
      "source_hints": [],
      "item_texts": [
        "Blue apron chicken"
      ],
      "count": 1
    },
    {
      "url": null,
      "urls": [],
      "link_texts": [],
      "menu_files": [
        "Menus/Menu week of 1-31-22.md"
      ],
      "menu_weeks": [
        "2022-01-31"
      ],
      "menu_seasons": [
        "winter"
      ],
      "meal_types": [
        "snack"
      ],
      "sections": [],
      "source_hints": [],
      "item_texts": [
        "Snack: cookie dough energy bites"
      ],
      "count": 1
    },
    {
      "url": null,
      "urls": [],
      "link_texts": [],
      "menu_files": [
        "Menus/Menu week of 1-31-22.md"
      ],
      "menu_weeks": [
        "2022-01-31"
      ],
      "menu_seasons": [
        "winter"
      ],
      "meal_types": [
        "dinner"
      ],
      "sections": [],
      "source_hints": [],
      "item_texts": [
        "Anytime: simple greens salad"
      ],
      "count": 1
    },
    {
      "url": null,
      "urls": [],
      "link_texts": [],
      "menu_files": [
        "Menus/Menu week of 1-4-25.md"
      ],
      "menu_weeks": [
        "2025-01-04"
      ],
      "menu_seasons": [
        "winter"
      ],
      "meal_types": [
        "dinner"
      ],
      "sections": [],
      "source_hints": [],
      "item_texts": [
        "Chili"
      ],
      "count": 1
    },
    {
      "url": null,
      "urls": [],
      "link_texts": [],
      "menu_files": [
        "Menus/Menu week of 1-9-24.md"
      ],
      "menu_weeks": [
        "2024-01-09"
      ],
      "menu_seasons": [
        "winter"
      ],
      "meal_types": [
        "dinner"
      ],
      "sections": [],
      "source_hints": [],
      "item_texts": [
        "5 ingredient tomato soup (Pinch of Yum) and grilled cheese"
      ],
      "count": 1
    },
    {
      "url": null,
      "urls": [],
      "link_texts": [],
      "menu_files": [
        "Menus/Menu week of 1-9-24.md"
      ],
      "menu_weeks": [
        "2024-01-09"
      ],
      "menu_seasons": [
        "winter"
      ],
      "meal_types": [
        "dinner"
      ],
      "sections": [],
      "source_hints": [
        "gimme some oven"
      ],
      "item_texts": [
        "Gnocchi with Brussels, Chicken sausage, and pesto (gimme some oven)"
      ],
      "count": 1
    },
    {
      "url": null,
      "urls": [],
      "link_texts": [],
      "menu_files": [
        "Menus/Menu week of 10-1-23.md"
      ],
      "menu_weeks": [
        "2023-10-01"
      ],
      "menu_seasons": [
        "fall"
      ],
      "meal_types": [
        "dinner"
      ],
      "sections": [],
      "source_hints": [],
      "item_texts": [
        "Roasted honey nut squash and chickpeas with hot honey (NYT cooking) - make with cous cous"
      ],
      "count": 1
    },
    {
      "url": null,
      "urls": [],
      "link_texts": [],
      "menu_files": [
        "Menus/Menu week of 10-1-23.md"
      ],
      "menu_weeks": [
        "2023-10-01"
      ],
      "menu_seasons": [
        "fall"
      ],
      "meal_types": [
        "dinner"
      ],
      "sections": [],
      "source_hints": [],
      "item_texts": [
        "Zoo Boo pick up something"
      ],
      "count": 1
    },
    {
      "url": null,
      "urls": [],
      "link_texts": [],
      "menu_files": [
        "Menus/Menu week of 10-1-23.md"
      ],
      "menu_weeks": [
        "2023-10-01"
      ],
      "menu_seasons": [
        "fall"
      ],
      "meal_types": [
        "dinner"
      ],
      "sections": [],
      "source_hints": [],
      "item_texts": [
        "Grilled steak, roasted broccoli, potatoes"
      ],
      "count": 1
    },
    {
      "url": null,
      "urls": [],
      "link_texts": [],
      "menu_files": [
        "Menus/Menu week of 10-10-21.md"
      ],
      "menu_weeks": [
        "2021-10-10"
      ],
      "menu_seasons": [
        "fall"
      ],
      "meal_types": [
        "dinner"
      ],
      "sections": [],
      "source_hints": [],
      "item_texts": [
        "Burgers and bagged salad, frozen sweet potato fries"
      ],
      "count": 1
    },
    {
      "url": null,
      "urls": [],
      "link_texts": [],
      "menu_files": [
        "Menus/Menu week of 10-10-21.md"
      ],
      "menu_weeks": [
        "2021-10-10"
      ],
      "menu_seasons": [
        "fall"
      ],
      "meal_types": [
        "dinner"
      ],
      "sections": [],
      "source_hints": [
        "with $$ dear mom greens"
      ],
      "item_texts": [
        "Italian beef and salad (with $$ dear mom greens)"
      ],
      "count": 1
    },
    {
      "url": null,
      "urls": [],
      "link_texts": [],
      "menu_files": [
        "Menus/Menu week of 10-10-21.md"
      ],
      "menu_weeks": [
        "2021-10-10"
      ],
      "menu_seasons": [
        "fall"
      ],
      "meal_types": [
        "dinner"
      ],
      "sections": [],
      "source_hints": [],
      "item_texts": [
        "BLTAs"
      ],
      "count": 1
    },
    {
      "url": null,
      "urls": [],
      "link_texts": [],
      "menu_files": [
        "Menus/Menu week of 10-10-21.md"
      ],
      "menu_weeks": [
        "2021-10-10"
      ],
      "menu_seasons": [
        "fall"
      ],
      "meal_types": [
        "dinner"
      ],
      "sections": [],
      "source_hints": [],
      "item_texts": [
        "Sheet pan sausage and peppers (serve as sandwiches with provolone and pasta sauce) - Get baguette from Amelia\u2019s"
      ],
      "count": 1
    },
    {
      "url": null,
      "urls": [],
      "link_texts": [],
      "menu_files": [
        "Menus/Menu week of 10-10-21.md"
      ],
      "menu_weeks": [
        "2021-10-10"
      ],
      "menu_seasons": [
        "fall"
      ],
      "meal_types": [
        "dinner"
      ],
      "sections": [],
      "source_hints": [],
      "item_texts": [
        "Moe\u2019s casseroles"
      ],
      "count": 1
    },
    {
      "url": null,
      "urls": [],
      "link_texts": [],
      "menu_files": [
        "Menus/Menu week of 10-10-21.md"
      ],
      "menu_weeks": [
        "2021-10-10"
      ],
      "menu_seasons": [
        "fall"
      ],
      "meal_types": [
        "dinner"
      ],
      "sections": [],
      "source_hints": [],
      "item_texts": [
        "Fy"
      ],
      "count": 1
    },
    {
      "url": null,
      "urls": [],
      "link_texts": [],
      "menu_files": [
        "Menus/Menu week of 10-13-22.md"
      ],
      "menu_weeks": [
        "2022-10-13"
      ],
      "menu_seasons": [
        "fall"
      ],
      "meal_types": [
        "dinner"
      ],
      "sections": [],
      "source_hints": [],
      "item_texts": [
        "Roasted veggie pitas with avocado dip"
      ],
      "count": 1
    },
    {
      "url": null,
      "urls": [],
      "link_texts": [],
      "menu_files": [
        "Menus/Menu week of 10-13-22.md"
      ],
      "menu_weeks": [
        "2022-10-13"
      ],
      "menu_seasons": [
        "fall"
      ],
      "meal_types": [
        "dinner"
      ],
      "sections": [],
      "source_hints": [],
      "item_texts": [
        "Crunchwrap Supreme"
      ],
      "count": 1
    },
    {
      "url": null,
      "urls": [],
      "link_texts": [],
      "menu_files": [
        "Menus/Menu week of 10-13-22.md"
      ],
      "menu_weeks": [
        "2022-10-13"
      ],
      "menu_seasons": [
        "fall"
      ],
      "meal_types": [
        "dinner"
      ],
      "sections": [],
      "source_hints": [],
      "item_texts": [
        "Crockpot chicken gnocchi soup"
      ],
      "count": 1
    },
    {
      "url": null,
      "urls": [],
      "link_texts": [],
      "menu_files": [
        "Menus/Menu week of 10-13-22.md"
      ],
      "menu_weeks": [
        "2022-10-13"
      ],
      "menu_seasons": [
        "fall"
      ],
      "meal_types": [
        "dinner"
      ],
      "sections": [],
      "source_hints": [],
      "item_texts": [
        "Saucy gochujang noodles with chicken"
      ],
      "count": 1
    },
    {
      "url": null,
      "urls": [],
      "link_texts": [],
      "menu_files": [
        "Menus/Menu week of 10-13-22.md"
      ],
      "menu_weeks": [
        "2022-10-13"
      ],
      "menu_seasons": [
        "fall"
      ],
      "meal_types": [
        "dinner"
      ],
      "sections": [],
      "source_hints": [],
      "item_texts": [
        "Steak"
      ],
      "count": 1
    },
    {
      "url": null,
      "urls": [],
      "link_texts": [],
      "menu_files": [
        "Menus/Menu week of 10-15-17.md"
      ],
      "menu_weeks": [
        "2017-10-15"
      ],
      "menu_seasons": [
        "fall"
      ],
      "meal_types": [
        "dinner"
      ],
      "sections": [],
      "source_hints": [],
      "item_texts": [
        "Roasted chicken thighs with delicata squash"
      ],
      "count": 1
    },
    {
      "url": null,
      "urls": [],
      "link_texts": [],
      "menu_files": [
        "Menus/Menu week of 10-15-17.md"
      ],
      "menu_weeks": [
        "2017-10-15"
      ],
      "menu_seasons": [
        "fall"
      ],
      "meal_types": [
        "dinner"
      ],
      "sections": [],
      "source_hints": [],
      "item_texts": [
        "Sunday morning: eggs and chard, bacon, potatoes?"
      ],
      "count": 1
    },
    {
      "url": null,
      "urls": [],
      "link_texts": [],
      "menu_files": [
        "Menus/Menu week of 10-15-17.md"
      ],
      "menu_weeks": [
        "2017-10-15"
      ],
      "menu_seasons": [
        "fall"
      ],
      "meal_types": [
        "dinner"
      ],
      "sections": [],
      "source_hints": [],
      "item_texts": [
        "Cauliflower walnut taco bowls (radishes!!!) with saut\u00e9ed peppers and onions"
      ],
      "count": 1
    },
    {
      "url": null,
      "urls": [],
      "link_texts": [],
      "menu_files": [
        "Menus/Menu week of 10-15-17.md"
      ],
      "menu_weeks": [
        "2017-10-15"
      ],
      "menu_seasons": [
        "fall"
      ],
      "meal_types": [
        "dinner"
      ],
      "sections": [],
      "source_hints": [],
      "item_texts": [
        "Orzo with feta, tomatoes, and dill"
      ],
      "count": 1
    },
    {
      "url": null,
      "urls": [],
      "link_texts": [],
      "menu_files": [
        "Menus/Menu week of 10-18-20.md"
      ],
      "menu_weeks": [
        "2020-10-18"
      ],
      "menu_seasons": [
        "fall"
      ],
      "meal_types": [
        "dinner"
      ],
      "sections": [],
      "source_hints": [],
      "item_texts": [
        "Cider braised pot roast with caramelized onions and cauliflower rice (takes 3-4 hours in oven)"
      ],
      "count": 1
    },
    {
      "url": null,
      "urls": [],
      "link_texts": [],
      "menu_files": [
        "Menus/Menu week of 10-18-20.md"
      ],
      "menu_weeks": [
        "2020-10-18"
      ],
      "menu_seasons": [
        "fall"
      ],
      "meal_types": [
        "dinner"
      ],
      "sections": [],
      "source_hints": [],
      "item_texts": [
        "Feel good fall salad"
      ],
      "count": 1
    },
    {
      "url": null,
      "urls": [],
      "link_texts": [],
      "menu_files": [
        "Menus/Menu week of 10-18-20.md"
      ],
      "menu_weeks": [
        "2020-10-18"
      ],
      "menu_seasons": [
        "fall"
      ],
      "meal_types": [
        "dinner"
      ],
      "sections": [],
      "source_hints": [
        "slow cooker"
      ],
      "item_texts": [
        "Short rib tacos with pepper mustard slaw (slow cooker)"
      ],
      "count": 1
    },
    {
      "url": null,
      "urls": [],
      "link_texts": [],
      "menu_files": [
        "Menus/Menu week of 10-18-20.md"
      ],
      "menu_weeks": [
        "2020-10-18"
      ],
      "menu_seasons": [
        "fall"
      ],
      "meal_types": [
        "dinner"
      ],
      "sections": [],
      "source_hints": [],
      "item_texts": [
        "Sunday: Brown butter gnocchi with roasted butternut squash and kale"
      ],
      "count": 1
    },
    {
      "url": null,
      "urls": [],
      "link_texts": [],
      "menu_files": [
        "Menus/Menu week of 10-18-20.md"
      ],
      "menu_weeks": [
        "2020-10-18"
      ],
      "menu_seasons": [
        "fall"
      ],
      "meal_types": [
        "dinner"
      ],
      "sections": [],
      "source_hints": [],
      "item_texts": [
        "Quesadillas and pico"
      ],
      "count": 1
    },
    {
      "url": null,
      "urls": [],
      "link_texts": [],
      "menu_files": [
        "Menus/Menu week of 10-18-20.md"
      ],
      "menu_weeks": [
        "2020-10-18"
      ],
      "menu_seasons": [
        "fall"
      ],
      "meal_types": [
        "dinner"
      ],
      "sections": [],
      "source_hints": [],
      "item_texts": [
        "Precooked brats"
      ],
      "count": 1
    },
    {
      "url": null,
      "urls": [],
      "link_texts": [],
      "menu_files": [
        "Menus/Menu week of 10-18-20.md"
      ],
      "menu_weeks": [
        "2020-10-18"
      ],
      "menu_seasons": [
        "fall"
      ],
      "meal_types": [
        "dinner"
      ],
      "sections": [],
      "source_hints": [],
      "item_texts": [
        "Roast and/or chop one of the butternut squash"
      ],
      "count": 1
    },
    {
      "url": null,
      "urls": [],
      "link_texts": [],
      "menu_files": [
        "Menus/Menu week of 10-18-20.md"
      ],
      "menu_weeks": [
        "2020-10-18"
      ],
      "menu_seasons": [
        "fall"
      ],
      "meal_types": [
        "dinner"
      ],
      "sections": [],
      "source_hints": [],
      "item_texts": [
        "Dice and freeze tomatoes"
      ],
      "count": 1
    },
    {
      "url": null,
      "urls": [],
      "link_texts": [],
      "menu_files": [
        "Menus/Menu week of 10-18-20.md"
      ],
      "menu_weeks": [
        "2020-10-18"
      ],
      "menu_seasons": [
        "fall"
      ],
      "meal_types": [
        "dinner"
      ],
      "sections": [],
      "source_hints": [],
      "item_texts": [
        "Make granola"
      ],
      "count": 1
    },
    {
      "url": null,
      "urls": [],
      "link_texts": [],
      "menu_files": [
        "Menus/Menu week of 10-18-20.md"
      ],
      "menu_weeks": [
        "2020-10-18"
      ],
      "menu_seasons": [
        "fall"
      ],
      "meal_types": [
        "dinner"
      ],
      "sections": [],
      "source_hints": [],
      "item_texts": [
        "Make pico with baby tomatoes"
      ],
      "count": 1
    },
    {
      "url": null,
      "urls": [],
      "link_texts": [],
      "menu_files": [
        "Menus/Menu week of 10-18-20.md"
      ],
      "menu_weeks": [
        "2020-10-18"
      ],
      "menu_seasons": [
        "fall"
      ],
      "meal_types": [
        "dinner"
      ],
      "sections": [],
      "source_hints": [],
      "item_texts": [
        "Quick-pickle banana peppers"
      ],
      "count": 1
    },
    {
      "url": null,
      "urls": [],
      "link_texts": [],
      "menu_files": [
        "Menus/Menu week of 10-18-20.md"
      ],
      "menu_weeks": [
        "2020-10-18"
      ],
      "menu_seasons": [
        "fall"
      ],
      "meal_types": [
        "dinner"
      ],
      "sections": [],
      "source_hints": [],
      "item_texts": [
        "Harvest the green onions from garden"
      ],
      "count": 1
    },
    {
      "url": null,
      "urls": [],
      "link_texts": [],
      "menu_files": [
        "Menus/Menu week of 10-21-19.md"
      ],
      "menu_weeks": [
        "2019-10-21"
      ],
      "menu_seasons": [
        "fall"
      ],
      "meal_types": [
        "dinner"
      ],
      "sections": [],
      "source_hints": [],
      "item_texts": [
        "Maple roasted chicken thighs and winter squashSalmon cakes and slaw"
      ],
      "count": 1
    },
    {
      "url": null,
      "urls": [],
      "link_texts": [],
      "menu_files": [
        "Menus/Menu week of 10-21-19.md"
      ],
      "menu_weeks": [
        "2019-10-21"
      ],
      "menu_seasons": [
        "fall"
      ],
      "meal_types": [
        "dinner"
      ],
      "sections": [],
      "source_hints": [],
      "item_texts": [
        "Halloween: chili and cornbread"
      ],
      "count": 1
    },
    {
      "url": null,
      "urls": [],
      "link_texts": [],
      "menu_files": [
        "Menus/Menu week of 10-21-19.md"
      ],
      "menu_weeks": [
        "2019-10-21"
      ],
      "menu_seasons": [
        "fall"
      ],
      "meal_types": [
        "dinner"
      ],
      "sections": [],
      "source_hints": [],
      "item_texts": [
        "Ratatouille and crusty bread"
      ],
      "count": 1
    },
    {
      "url": null,
      "urls": [],
      "link_texts": [],
      "menu_files": [
        "Menus/Menu week of 10-21-19.md"
      ],
      "menu_weeks": [
        "2019-10-21"
      ],
      "menu_seasons": [
        "fall"
      ],
      "meal_types": [
        "dinner"
      ],
      "sections": [],
      "source_hints": [],
      "item_texts": [
        "Rosemary Chicken noodle soup, salad"
      ],
      "count": 1
    },
    {
      "url": null,
      "urls": [],
      "link_texts": [],
      "menu_files": [
        "Menus/Menu week of 10-22-25.md"
      ],
      "menu_weeks": [
        "2025-10-22"
      ],
      "menu_seasons": [
        "fall"
      ],
      "meal_types": [
        "dinner"
      ],
      "sections": [],
      "source_hints": [],
      "item_texts": [
        "Halloween: Chili and cornbread"
      ],
      "count": 1
    },
    {
      "url": null,
      "urls": [],
      "link_texts": [],
      "menu_files": [
        "Menus/Menu week of 10-22-25.md"
      ],
      "menu_weeks": [
        "2025-10-22"
      ],
      "menu_seasons": [
        "fall"
      ],
      "meal_types": [
        "dinner"
      ],
      "sections": [],
      "source_hints": [],
      "item_texts": [
        "Halloween: Chili and cornbread"
      ],
      "count": 1
    },
    {
      "url": null,
      "urls": [],
      "link_texts": [],
      "menu_files": [
        "Menus/Menu week of 10-22-25.md"
      ],
      "menu_weeks": [
        "2025-10-22"
      ],
      "menu_seasons": [
        "fall"
      ],
      "meal_types": [
        "dinner"
      ],
      "sections": [],
      "source_hints": [],
      "item_texts": [
        "Double recipes to bring to Jill Tuesday 10/28:"
      ],
      "count": 1
    },
    {
      "url": null,
      "urls": [],
      "link_texts": [],
      "menu_files": [
        "Menus/Menu week of 10-23-24.md"
      ],
      "menu_weeks": [
        "2024-10-23"
      ],
      "menu_seasons": [
        "fall"
      ],
      "meal_types": [
        "dinner"
      ],
      "sections": [],
      "source_hints": [],
      "item_texts": [
        "Yellow curry"
      ],
      "count": 1
    },
    {
      "url": null,
      "urls": [],
      "link_texts": [],
      "menu_files": [
        "Menus/Menu week of 10-23-24.md"
      ],
      "menu_weeks": [
        "2024-10-23"
      ],
      "menu_seasons": [
        "fall"
      ],
      "meal_types": [
        "dinner"
      ],
      "sections": [],
      "source_hints": [
        "lots"
      ],
      "item_texts": [
        "Poblanos (lots)"
      ],
      "count": 1
    },
    {
      "url": null,
      "urls": [],
      "link_texts": [],
      "menu_files": [
        "Menus/Menu week of 10-25-18.md"
      ],
      "menu_weeks": [
        "2018-10-25"
      ],
      "menu_seasons": [
        "fall"
      ],
      "meal_types": [
        "dinner"
      ],
      "sections": [],
      "source_hints": [],
      "item_texts": [
        "Friday: Mimi Blue meatballs"
      ],
      "count": 1
    },
    {
      "url": null,
      "urls": [],
      "link_texts": [],
      "menu_files": [
        "Menus/Menu week of 10-25-18.md"
      ],
      "menu_weeks": [
        "2018-10-25"
      ],
      "menu_seasons": [
        "fall"
      ],
      "meal_types": [
        "dinner"
      ],
      "sections": [],
      "source_hints": [],
      "item_texts": [
        "Monday: salad and dinner rolls"
      ],
      "count": 1
    },
    {
      "url": null,
      "urls": [],
      "link_texts": [],
      "menu_files": [
        "Menus/Menu week of 10-25-18.md"
      ],
      "menu_weeks": [
        "2018-10-25"
      ],
      "menu_seasons": [
        "fall"
      ],
      "meal_types": [
        "dinner"
      ],
      "sections": [],
      "source_hints": [
        "book club at center point"
      ],
      "item_texts": [
        "Tuesday: jimmy johns or similar (book club at center point)"
      ],
      "count": 1
    },
    {
      "url": null,
      "urls": [],
      "link_texts": [],
      "menu_files": [
        "Menus/Menu week of 10-25-18.md"
      ],
      "menu_weeks": [
        "2018-10-25"
      ],
      "menu_seasons": [
        "fall"
      ],
      "meal_types": [
        "dinner"
      ],
      "sections": [],
      "source_hints": [],
      "item_texts": [
        "Wed spooky season: chili, cornbread muffins"
      ],
      "count": 1
    },
    {
      "url": null,
      "urls": [],
      "link_texts": [],
      "menu_files": [
        "Menus/Menu week of 10-25-18.md"
      ],
      "menu_weeks": [
        "2018-10-25"
      ],
      "menu_seasons": [
        "fall"
      ],
      "meal_types": [
        "dinner"
      ],
      "sections": [],
      "source_hints": [],
      "item_texts": [
        "Thursday: pan-seared chicken with roasted honey nut squash and apple"
      ],
      "count": 1
    },
    {
      "url": null,
      "urls": [],
      "link_texts": [],
      "menu_files": [
        "Menus/Menu week of 10-25-18.md"
      ],
      "menu_weeks": [
        "2018-10-25"
      ],
      "menu_seasons": [
        "fall"
      ],
      "meal_types": [
        "dinner"
      ],
      "sections": [],
      "source_hints": [],
      "item_texts": [
        "Friday weenie roast: garlic Spaghetti squash with herbs"
      ],
      "count": 1
    },
    {
      "url": null,
      "urls": [],
      "link_texts": [],
      "menu_files": [
        "Menus/Menu week of 10-25-18.md"
      ],
      "menu_weeks": [
        "2018-10-25"
      ],
      "menu_seasons": [
        "fall"
      ],
      "meal_types": [
        "dinner"
      ],
      "sections": [],
      "source_hints": [],
      "item_texts": [
        "Saturday: pizza?"
      ],
      "count": 1
    },
    {
      "url": null,
      "urls": [],
      "link_texts": [],
      "menu_files": [
        "Menus/Menu week of 10-26-23.md"
      ],
      "menu_weeks": [
        "2023-10-26"
      ],
      "menu_seasons": [
        "fall"
      ],
      "meal_types": [
        "dinner"
      ],
      "sections": [],
      "source_hints": [],
      "item_texts": [
        "Chili (Halloween) and salad"
      ],
      "count": 1
    },
    {
      "url": null,
      "urls": [],
      "link_texts": [],
      "menu_files": [
        "Menus/Menu week of 10-26-23.md"
      ],
      "menu_weeks": [
        "2023-10-26"
      ],
      "menu_seasons": [
        "fall"
      ],
      "meal_types": [
        "dinner"
      ],
      "sections": [],
      "source_hints": [],
      "item_texts": [
        "Crispy Black bean tacos"
      ],
      "count": 1
    },
    {
      "url": null,
      "urls": [],
      "link_texts": [],
      "menu_files": [
        "Menus/Menu week of 10-26-23.md"
      ],
      "menu_weeks": [
        "2023-10-26"
      ],
      "menu_seasons": [
        "fall"
      ],
      "meal_types": [
        "dinner"
      ],
      "sections": [],
      "source_hints": [],
      "item_texts": [
        "Chicken lettuce wraps with Lime drench"
      ],
      "count": 1
    },
    {
      "url": null,
      "urls": [],
      "link_texts": [],
      "menu_files": [
        "Menus/Menu week of 10-26-23.md"
      ],
      "menu_weeks": [
        "2023-10-26"
      ],
      "menu_seasons": [
        "fall"
      ],
      "meal_types": [
        "dinner"
      ],
      "sections": [],
      "source_hints": [],
      "item_texts": [
        "Lemongrass meatball bowls"
      ],
      "count": 1
    },
    {
      "url": null,
      "urls": [],
      "link_texts": [],
      "menu_files": [
        "Menus/Menu week of 10-26-23.md"
      ],
      "menu_weeks": [
        "2023-10-26"
      ],
      "menu_seasons": [
        "fall"
      ],
      "meal_types": [
        "dinner"
      ],
      "sections": [],
      "source_hints": [],
      "item_texts": [
        "Parsnips"
      ],
      "count": 1
    },
    {
      "url": null,
      "urls": [],
      "link_texts": [],
      "menu_files": [
        "Menus/Menu week of 10-26-23.md"
      ],
      "menu_weeks": [
        "2023-10-26"
      ],
      "menu_seasons": [
        "fall"
      ],
      "meal_types": [
        "dinner"
      ],
      "sections": [],
      "source_hints": [],
      "item_texts": [
        "Butternut squash"
      ],
      "count": 1
    },
    {
      "url": null,
      "urls": [],
      "link_texts": [],
      "menu_files": [
        "Menus/Menu week of 10-26-23.md"
      ],
      "menu_weeks": [
        "2023-10-26"
      ],
      "menu_seasons": [
        "fall"
      ],
      "meal_types": [
        "dinner"
      ],
      "sections": [],
      "source_hints": [],
      "item_texts": [
        "Red potatoes"
      ],
      "count": 1
    },
    {
      "url": null,
      "urls": [],
      "link_texts": [],
      "menu_files": [
        "Menus/Menu week of 10-26-23.md"
      ],
      "menu_weeks": [
        "2023-10-26"
      ],
      "menu_seasons": [
        "fall"
      ],
      "meal_types": [
        "dinner"
      ],
      "sections": [],
      "source_hints": [],
      "item_texts": [
        "Purple finger line potatoes"
      ],
      "count": 1
    },
    {
      "url": null,
      "urls": [],
      "link_texts": [],
      "menu_files": [
        "Menus/Menu week of 10-26-23.md"
      ],
      "menu_weeks": [
        "2023-10-26"
      ],
      "menu_seasons": [
        "fall"
      ],
      "meal_types": [
        "dinner"
      ],
      "sections": [],
      "source_hints": [],
      "item_texts": [
        "Delicate squash"
      ],
      "count": 1
    },
    {
      "url": null,
      "urls": [],
      "link_texts": [],
      "menu_files": [
        "Menus/Menu week of 10-27-22.md"
      ],
      "menu_weeks": [
        "2022-10-27"
      ],
      "menu_seasons": [
        "fall"
      ],
      "meal_types": [
        "dinner"
      ],
      "sections": [],
      "source_hints": [],
      "item_texts": [
        "Broccoli cheese soup"
      ],
      "count": 1
    },
    {
      "url": null,
      "urls": [],
      "link_texts": [],
      "menu_files": [
        "Menus/Menu week of 10-27-22.md"
      ],
      "menu_weeks": [
        "2022-10-27"
      ],
      "menu_seasons": [
        "fall"
      ],
      "meal_types": [
        "dinner"
      ],
      "sections": [],
      "source_hints": [],
      "item_texts": [
        "Date night rigatoni with sausage and kale"
      ],
      "count": 1
    },
    {
      "url": null,
      "urls": [],
      "link_texts": [],
      "menu_files": [
        "Menus/Menu week of 10-27-22.md"
      ],
      "menu_weeks": [
        "2022-10-27"
      ],
      "menu_seasons": [
        "fall"
      ],
      "meal_types": [
        "dinner"
      ],
      "sections": [],
      "source_hints": [],
      "item_texts": [
        "Chicken pot pie with biscuits"
      ],
      "count": 1
    },
    {
      "url": null,
      "urls": [],
      "link_texts": [],
      "menu_files": [
        "Menus/Menu week of 10-27-22.md"
      ],
      "menu_weeks": [
        "2022-10-27"
      ],
      "menu_seasons": [
        "fall"
      ],
      "meal_types": [
        "dinner"
      ],
      "sections": [],
      "source_hints": [],
      "item_texts": [
        "Halloween: \u201cSunday\u201d chili"
      ],
      "count": 1
    },
    {
      "url": null,
      "urls": [],
      "link_texts": [],
      "menu_files": [
        "Menus/Menu week of 10-27-22.md"
      ],
      "menu_weeks": [
        "2022-10-27"
      ],
      "menu_seasons": [
        "fall"
      ],
      "meal_types": [
        "dinner"
      ],
      "sections": [],
      "source_hints": [],
      "item_texts": [
        "Baked shrimp with feta and grilled sourdough"
      ],
      "count": 1
    },
    {
      "url": null,
      "urls": [],
      "link_texts": [],
      "menu_files": [
        "Menus/Menu week of 10-27-22.md"
      ],
      "menu_weeks": [
        "2022-10-27"
      ],
      "menu_seasons": [
        "fall"
      ],
      "meal_types": [
        "dinner"
      ],
      "sections": [],
      "source_hints": [],
      "item_texts": [
        "Crunchy roll bowls"
      ],
      "count": 1
    },
    {
      "url": null,
      "urls": [],
      "link_texts": [],
      "menu_files": [
        "Menus/Menu week of 10-31-17.md"
      ],
      "menu_weeks": [
        "2017-10-31"
      ],
      "menu_seasons": [
        "fall"
      ],
      "meal_types": [
        "dinner"
      ],
      "sections": [],
      "source_hints": [],
      "item_texts": [
        "Tuesday: Chili"
      ],
      "count": 1
    },
    {
      "url": null,
      "urls": [],
      "link_texts": [],
      "menu_files": [
        "Menus/Menu week of 10-31-17.md"
      ],
      "menu_weeks": [
        "2017-10-31"
      ],
      "menu_seasons": [
        "fall"
      ],
      "meal_types": [
        "dinner"
      ],
      "sections": [],
      "source_hints": [],
      "item_texts": [
        "Thursday: Alicia babysit for Missy, Sean on own"
      ],
      "count": 1
    },
    {
      "url": null,
      "urls": [],
      "link_texts": [],
      "menu_files": [
        "Menus/Menu week of 10-31-17.md"
      ],
      "menu_weeks": [
        "2017-10-31"
      ],
      "menu_seasons": [
        "fall"
      ],
      "meal_types": [
        "dinner"
      ],
      "sections": [],
      "source_hints": [],
      "item_texts": [
        "Friday: Taste of Thanksgiving"
      ],
      "count": 1
    },
    {
      "url": null,
      "urls": [],
      "link_texts": [],
      "menu_files": [
        "Menus/Menu week of 10-31-17.md"
      ],
      "menu_weeks": [
        "2017-10-31"
      ],
      "menu_seasons": [
        "fall"
      ],
      "meal_types": [
        "dinner"
      ],
      "sections": [],
      "source_hints": [],
      "item_texts": [
        "Saturday: Turnips with Bacon and Orange (Dooley pg 209), pork chops with apples and onions"
      ],
      "count": 1
    },
    {
      "url": null,
      "urls": [],
      "link_texts": [],
      "menu_files": [
        "Menus/Menu week of 10-31-17.md"
      ],
      "menu_weeks": [
        "2017-10-31"
      ],
      "menu_seasons": [
        "fall"
      ],
      "meal_types": [
        "dinner"
      ],
      "sections": [],
      "source_hints": [],
      "item_texts": [
        "Sunday: Beets and caramelized onions with feta, chicken and honey mustard?"
      ],
      "count": 1
    },
    {
      "url": null,
      "urls": [],
      "link_texts": [],
      "menu_files": [
        "Menus/Menu week of 10-31-17.md"
      ],
      "menu_weeks": [
        "2017-10-31"
      ],
      "menu_seasons": [
        "fall"
      ],
      "meal_types": [
        "dinner"
      ],
      "sections": [],
      "source_hints": [],
      "item_texts": [
        "Tuesday: balsamic roasted fingerling potatoes and Brussels sprouts, baked tilapia with pecan rosemary topping"
      ],
      "count": 1
    },
    {
      "url": null,
      "urls": [],
      "link_texts": [],
      "menu_files": [
        "Menus/Menu week of 10-4-20.md"
      ],
      "menu_weeks": [
        "2020-10-04"
      ],
      "menu_seasons": [
        "fall"
      ],
      "meal_types": [
        "dinner"
      ],
      "sections": [],
      "source_hints": [],
      "item_texts": [
        "Burgers and roasted potatoes/turnips"
      ],
      "count": 1
    },
    {
      "url": null,
      "urls": [],
      "link_texts": [],
      "menu_files": [
        "Menus/Menu week of 10-4-20.md"
      ],
      "menu_weeks": [
        "2020-10-04"
      ],
      "menu_seasons": [
        "fall"
      ],
      "meal_types": [
        "dinner"
      ],
      "sections": [],
      "source_hints": [],
      "item_texts": [
        "Sheet pan salmon with bok choy"
      ],
      "count": 1
    },
    {
      "url": null,
      "urls": [],
      "link_texts": [],
      "menu_files": [
        "Menus/Menu week of 10-4-20.md"
      ],
      "menu_weeks": [
        "2020-10-04"
      ],
      "menu_seasons": [
        "fall"
      ],
      "meal_types": [
        "dinner"
      ],
      "sections": [],
      "source_hints": [],
      "item_texts": [
        "Chickpea curry"
      ],
      "count": 1
    },
    {
      "url": null,
      "urls": [],
      "link_texts": [],
      "menu_files": [
        "Menus/Menu week of 10-4-20.md"
      ],
      "menu_weeks": [
        "2020-10-04"
      ],
      "menu_seasons": [
        "fall"
      ],
      "meal_types": [
        "dinner"
      ],
      "sections": [],
      "source_hints": [],
      "item_texts": [
        "Weekend: Pumpkin cinnamon rolls"
      ],
      "count": 1
    },
    {
      "url": null,
      "urls": [],
      "link_texts": [],
      "menu_files": [
        "Menus/Menu week of 10-4-2019.md"
      ],
      "menu_weeks": [
        "2019-10-04"
      ],
      "menu_seasons": [
        "fall"
      ],
      "meal_types": [
        "dinner"
      ],
      "sections": [],
      "source_hints": [],
      "item_texts": [
        "Pan-seared pork chops with roasted butternut squash and apple"
      ],
      "count": 1
    },
    {
      "url": null,
      "urls": [],
      "link_texts": [],
      "menu_files": [
        "Menus/Menu week of 10-4-2019.md"
      ],
      "menu_weeks": [
        "2019-10-04"
      ],
      "menu_seasons": [
        "fall"
      ],
      "meal_types": [
        "dinner"
      ],
      "sections": [],
      "source_hints": [],
      "item_texts": [
        "Irish potato soup"
      ],
      "count": 1
    },
    {
      "url": null,
      "urls": [],
      "link_texts": [],
      "menu_files": [
        "Menus/Menu week of 10-4-2019.md"
      ],
      "menu_weeks": [
        "2019-10-04"
      ],
      "menu_seasons": [
        "fall"
      ],
      "meal_types": [
        "dinner"
      ],
      "sections": [],
      "source_hints": [],
      "item_texts": [
        "Italian drunken noodles"
      ],
      "count": 1
    },
    {
      "url": null,
      "urls": [],
      "link_texts": [],
      "menu_files": [
        "Menus/Menu week of 10-4-2019.md"
      ],
      "menu_weeks": [
        "2019-10-04"
      ],
      "menu_seasons": [
        "fall"
      ],
      "meal_types": [
        "dinner"
      ],
      "sections": [],
      "source_hints": [],
      "item_texts": [
        "Burgers and apple spinach salad"
      ],
      "count": 1
    },
    {
      "url": null,
      "urls": [],
      "link_texts": [],
      "menu_files": [
        "Menus/Menu week of 10-4-2019.md"
      ],
      "menu_weeks": [
        "2019-10-04"
      ],
      "menu_seasons": [
        "fall"
      ],
      "meal_types": [
        "dinner"
      ],
      "sections": [],
      "source_hints": [
        "use spinach instead of kale"
      ],
      "item_texts": [
        "Sweet potato salad (use spinach instead of kale)"
      ],
      "count": 1
    },
    {
      "url": null,
      "urls": [],
      "link_texts": [],
      "menu_files": [
        "Menus/Menu week of 10-6-18.md"
      ],
      "menu_weeks": [
        "2018-10-06"
      ],
      "menu_seasons": [
        "fall"
      ],
      "meal_types": [
        "dinner"
      ],
      "sections": [],
      "source_hints": [],
      "item_texts": [
        "Ribs and coleslaw and green beans"
      ],
      "count": 1
    },
    {
      "url": null,
      "urls": [],
      "link_texts": [],
      "menu_files": [
        "Menus/Menu week of 10-6-18.md"
      ],
      "menu_weeks": [
        "2018-10-06"
      ],
      "menu_seasons": [
        "fall"
      ],
      "meal_types": [
        "dinner"
      ],
      "sections": [],
      "source_hints": [],
      "item_texts": [
        "Caprese pasta salad"
      ],
      "count": 1
    },
    {
      "url": null,
      "urls": [],
      "link_texts": [],
      "menu_files": [
        "Menus/Menu week of 10-6-18.md"
      ],
      "menu_weeks": [
        "2018-10-06"
      ],
      "menu_seasons": [
        "fall"
      ],
      "meal_types": [
        "dinner"
      ],
      "sections": [],
      "source_hints": [],
      "item_texts": [
        "Potato soup and dinner rolls"
      ],
      "count": 1
    },
    {
      "url": null,
      "urls": [],
      "link_texts": [],
      "menu_files": [
        "Menus/Menu week of 10-6-18.md"
      ],
      "menu_weeks": [
        "2018-10-06"
      ],
      "menu_seasons": [
        "fall"
      ],
      "meal_types": [
        "dinner"
      ],
      "sections": [],
      "source_hints": [],
      "item_texts": [
        "Salad and rolls"
      ],
      "count": 1
    },
    {
      "url": null,
      "urls": [],
      "link_texts": [],
      "menu_files": [
        "Menus/Menu week of 10-6-18.md"
      ],
      "menu_weeks": [
        "2018-10-06"
      ],
      "menu_seasons": [
        "fall"
      ],
      "meal_types": [
        "dinner"
      ],
      "sections": [],
      "source_hints": [],
      "item_texts": [
        "Morracan stew packet"
      ],
      "count": 1
    },
    {
      "url": null,
      "urls": [],
      "link_texts": [],
      "menu_files": [
        "Menus/Menu week of 10-6-22.md"
      ],
      "menu_weeks": [
        "2022-10-06"
      ],
      "menu_seasons": [
        "fall"
      ],
      "meal_types": [
        "dinner"
      ],
      "sections": [],
      "source_hints": [],
      "item_texts": [
        "Chipotle Orange Shrimp with Cilantro rice"
      ],
      "count": 1
    },
    {
      "url": null,
      "urls": [],
      "link_texts": [],
      "menu_files": [
        "Menus/Menu week of 10-6-22.md"
      ],
      "menu_weeks": [
        "2022-10-06"
      ],
      "menu_seasons": [
        "fall"
      ],
      "meal_types": [
        "dinner"
      ],
      "sections": [],
      "source_hints": [
        "or in our case, soba cause that\u2019s what the store had"
      ],
      "item_texts": [
        "Black pepper stir fried udon (or in our case, soba cause that\u2019s what the store had)"
      ],
      "count": 1
    },
    {
      "url": null,
      "urls": [],
      "link_texts": [],
      "menu_files": [
        "Menus/Menu week of 10-6-22.md"
      ],
      "menu_weeks": [
        "2022-10-06"
      ],
      "menu_seasons": [
        "fall"
      ],
      "meal_types": [
        "dinner"
      ],
      "sections": [],
      "source_hints": [],
      "item_texts": [
        "Instant Pot Pasta with meatballs"
      ],
      "count": 1
    },
    {
      "url": null,
      "urls": [],
      "link_texts": [],
      "menu_files": [
        "Menus/Menu week of 10-7-17.md"
      ],
      "menu_weeks": [
        "2017-10-07"
      ],
      "menu_seasons": [
        "fall"
      ],
      "meal_types": [
        "dinner"
      ],
      "sections": [],
      "source_hints": [],
      "item_texts": [
        "Chicken fajitas and roasted tomatillo salsa, black beans, radishes"
      ],
      "count": 1
    },
    {
      "url": null,
      "urls": [],
      "link_texts": [],
      "menu_files": [
        "Menus/Menu week of 10-7-17.md"
      ],
      "menu_weeks": [
        "2017-10-07"
      ],
      "menu_seasons": [
        "fall"
      ],
      "meal_types": [
        "dinner"
      ],
      "sections": [],
      "source_hints": [],
      "item_texts": [
        "Lemon braised chicken and beans with mint pesto and arugula salad"
      ],
      "count": 1
    },
    {
      "url": null,
      "urls": [],
      "link_texts": [],
      "menu_files": [
        "Menus/Menu week of 10-7-17.md"
      ],
      "menu_weeks": [
        "2017-10-07"
      ],
      "menu_seasons": [
        "fall"
      ],
      "meal_types": [
        "dinner"
      ],
      "sections": [],
      "source_hints": [],
      "item_texts": [
        "Brats and apple/mustard slaw, roasted veggies, potatoes with dill, etc"
      ],
      "count": 1
    },
    {
      "url": null,
      "urls": [],
      "link_texts": [],
      "menu_files": [
        "Menus/Menu week of 11-1-20.md"
      ],
      "menu_weeks": [
        "2020-11-01"
      ],
      "menu_seasons": [
        "fall"
      ],
      "meal_types": [
        "dinner"
      ],
      "sections": [],
      "source_hints": [],
      "item_texts": [
        "Roasted chicken thighs with delicata squash"
      ],
      "count": 1
    },
    {
      "url": null,
      "urls": [],
      "link_texts": [],
      "menu_files": [
        "Menus/Menu week of 11-1-20.md"
      ],
      "menu_weeks": [
        "2020-11-01"
      ],
      "menu_seasons": [
        "fall"
      ],
      "meal_types": [
        "dinner"
      ],
      "sections": [],
      "source_hints": [],
      "item_texts": [
        "Simmered daikon radish with chicken in yuzu sauce"
      ],
      "count": 1
    },
    {
      "url": null,
      "urls": [],
      "link_texts": [],
      "menu_files": [
        "Menus/Menu week of 11-1-20.md"
      ],
      "menu_weeks": [
        "2020-11-01"
      ],
      "menu_seasons": [
        "fall"
      ],
      "meal_types": [
        "dinner"
      ],
      "sections": [],
      "source_hints": [
        "Use Pinch of Yum back pocket stir fry sauce recipe"
      ],
      "item_texts": [
        "Stir fry with tofu, bell peppers, onions radishes, a little cauliflower (Use Pinch of Yum back pocket stir fry sauce recipe)"
      ],
      "count": 1
    },
    {
      "url": null,
      "urls": [],
      "link_texts": [],
      "menu_files": [
        "Menus/Menu week of 11-1-20.md"
      ],
      "menu_weeks": [
        "2020-11-01"
      ],
      "menu_seasons": [
        "fall"
      ],
      "meal_types": [
        "dinner"
      ],
      "sections": [],
      "source_hints": [],
      "item_texts": [
        "Thursday: Grilling steak and fennel, roasted purple fingerling potatoes"
      ],
      "count": 1
    },
    {
      "url": null,
      "urls": [],
      "link_texts": [],
      "menu_files": [
        "Menus/Menu week of 11-1-20.md"
      ],
      "menu_weeks": [
        "2020-11-01"
      ],
      "menu_seasons": [
        "fall"
      ],
      "meal_types": [
        "dinner"
      ],
      "sections": [],
      "source_hints": [],
      "item_texts": [
        "Slow cooker butternut squash with tortellini"
      ],
      "count": 1
    },
    {
      "url": null,
      "urls": [],
      "link_texts": [],
      "menu_files": [
        "Menus/Menu week of 11-1-20.md"
      ],
      "menu_weeks": [
        "2020-11-01"
      ],
      "menu_seasons": [
        "fall"
      ],
      "meal_types": [
        "dinner"
      ],
      "sections": [],
      "source_hints": [],
      "item_texts": [
        "Delicata squash"
      ],
      "count": 1
    },
    {
      "url": null,
      "urls": [],
      "link_texts": [],
      "menu_files": [
        "Menus/Menu week of 11-10-17.md"
      ],
      "menu_weeks": [
        "2017-11-10"
      ],
      "menu_seasons": [
        "fall"
      ],
      "meal_types": [
        "dinner"
      ],
      "sections": [],
      "source_hints": [],
      "item_texts": [
        "Friday: Beets and caramelized onions with feta, chicken strips and honey mustard"
      ],
      "count": 1
    },
    {
      "url": null,
      "urls": [],
      "link_texts": [],
      "menu_files": [
        "Menus/Menu week of 11-10-17.md"
      ],
      "menu_weeks": [
        "2017-11-10"
      ],
      "menu_seasons": [
        "fall"
      ],
      "meal_types": [
        "dinner"
      ],
      "sections": [],
      "source_hints": [],
      "item_texts": [
        "Saturday: balsamic roasted fingerling potatoes and Brussels sprouts, steak, \ud83c\udf77"
      ],
      "count": 1
    },
    {
      "url": null,
      "urls": [],
      "link_texts": [],
      "menu_files": [
        "Menus/Menu week of 11-10-17.md"
      ],
      "menu_weeks": [
        "2017-11-10"
      ],
      "menu_seasons": [
        "fall"
      ],
      "meal_types": [
        "dinner"
      ],
      "sections": [],
      "source_hints": [],
      "item_texts": [
        "Sunday: Pot roast with potatoes, carrots, onion, green beans"
      ],
      "count": 1
    },
    {
      "url": null,
      "urls": [],
      "link_texts": [],
      "menu_files": [
        "Menus/Menu week of 11-10-17.md"
      ],
      "menu_weeks": [
        "2017-11-10"
      ],
      "menu_seasons": [
        "fall"
      ],
      "meal_types": [
        "dinner"
      ],
      "sections": [],
      "source_hints": [],
      "item_texts": [
        "Butternut squash apple soup with sage parm croutons"
      ],
      "count": 1
    },
    {
      "url": null,
      "urls": [],
      "link_texts": [],
      "menu_files": [
        "Menus/Menu week of 11-10-17.md"
      ],
      "menu_weeks": [
        "2017-11-10"
      ],
      "menu_seasons": [
        "fall"
      ],
      "meal_types": [
        "dinner"
      ],
      "sections": [],
      "source_hints": [],
      "item_texts": [
        "Pan burgers, roasted parsnips"
      ],
      "count": 1
    },
    {
      "url": null,
      "urls": [],
      "link_texts": [],
      "menu_files": [
        "Menus/Menu week of 11-10-17.md"
      ],
      "menu_weeks": [
        "2017-11-10"
      ],
      "menu_seasons": [
        "fall"
      ],
      "meal_types": [
        "dinner"
      ],
      "sections": [],
      "source_hints": [],
      "item_texts": [
        "Senegalese soup"
      ],
      "count": 1
    },
    {
      "url": null,
      "urls": [],
      "link_texts": [],
      "menu_files": [
        "Menus/Menu week of 11-10-17.md"
      ],
      "menu_weeks": [
        "2017-11-10"
      ],
      "menu_seasons": [
        "fall"
      ],
      "meal_types": [
        "dinner"
      ],
      "sections": [],
      "source_hints": [],
      "item_texts": [
        "Gravy"
      ],
      "count": 1
    },
    {
      "url": null,
      "urls": [],
      "link_texts": [],
      "menu_files": [
        "Menus/Menu week of 11-10-17.md"
      ],
      "menu_weeks": [
        "2017-11-10"
      ],
      "menu_seasons": [
        "fall"
      ],
      "meal_types": [
        "dinner"
      ],
      "sections": [],
      "source_hints": [],
      "item_texts": [
        "Cider"
      ],
      "count": 1
    },
    {
      "url": null,
      "urls": [],
      "link_texts": [],
      "menu_files": [
        "Menus/Menu week of 11-10-17.md"
      ],
      "menu_weeks": [
        "2017-11-10"
      ],
      "menu_seasons": [
        "fall"
      ],
      "meal_types": [
        "dinner"
      ],
      "sections": [],
      "source_hints": [
        "make with veggie broth"
      ],
      "item_texts": [
        "Stuffing (make with veggie broth)"
      ],
      "count": 1
    },
    {
      "url": null,
      "urls": [],
      "link_texts": [],
      "menu_files": [
        "Menus/Menu week of 11-10-17.md"
      ],
      "menu_weeks": [
        "2017-11-10"
      ],
      "menu_seasons": [
        "fall"
      ],
      "meal_types": [
        "dinner"
      ],
      "sections": [],
      "source_hints": [],
      "item_texts": [
        "Apples plus caramel"
      ],
      "count": 1
    },
    {
      "url": null,
      "urls": [],
      "link_texts": [],
      "menu_files": [
        "Menus/Menu week of 11-10-17.md"
      ],
      "menu_weeks": [
        "2017-11-10"
      ],
      "menu_seasons": [
        "fall"
      ],
      "meal_types": [
        "dinner"
      ],
      "sections": [],
      "source_hints": [],
      "item_texts": [
        "Hummus and carrots"
      ],
      "count": 1
    },
    {
      "url": null,
      "urls": [],
      "link_texts": [],
      "menu_files": [
        "Menus/Menu week of 11-10-17.md"
      ],
      "menu_weeks": [
        "2017-11-10"
      ],
      "menu_seasons": [
        "fall"
      ],
      "meal_types": [
        "dinner"
      ],
      "sections": [],
      "source_hints": [],
      "item_texts": [
        "Crackers, goat cheese, Katy\u2019s port wine cranberry sauce"
      ],
      "count": 1
    },
    {
      "url": null,
      "urls": [],
      "link_texts": [],
      "menu_files": [
        "Menus/Menu week of 11-12-22.md"
      ],
      "menu_weeks": [
        "2022-11-12"
      ],
      "menu_seasons": [
        "fall"
      ],
      "meal_types": [
        "dinner"
      ],
      "sections": [],
      "source_hints": [],
      "item_texts": [
        "Lemon pepper noodles with zucchini and squash and some butter sauce we make up. Maybe chicken if we have our shit together."
      ],
      "count": 1
    },
    {
      "url": null,
      "urls": [],
      "link_texts": [],
      "menu_files": [
        "Menus/Menu week of 11-12-22.md"
      ],
      "menu_weeks": [
        "2022-11-12"
      ],
      "menu_seasons": [
        "fall"
      ],
      "meal_types": [
        "dinner"
      ],
      "sections": [],
      "source_hints": [
        "Pinch of yum"
      ],
      "item_texts": [
        "Instant Pot Pot Roast (Pinch of yum)"
      ],
      "count": 1
    },
    {
      "url": null,
      "urls": [],
      "link_texts": [],
      "menu_files": [
        "Menus/Menu week of 11-12-22.md"
      ],
      "menu_weeks": [
        "2022-11-12"
      ],
      "menu_seasons": [
        "fall"
      ],
      "meal_types": [
        "dinner"
      ],
      "sections": [],
      "source_hints": [],
      "item_texts": [
        "Smoky Beans and Greens Tacos"
      ],
      "count": 1
    },
    {
      "url": null,
      "urls": [],
      "link_texts": [],
      "menu_files": [
        "Menus/Menu week of 11-12-22.md"
      ],
      "menu_weeks": [
        "2022-11-12"
      ],
      "menu_seasons": [
        "fall"
      ],
      "meal_types": [
        "dinner"
      ],
      "sections": [],
      "source_hints": [],
      "item_texts": [
        "Red Curry Lentils"
      ],
      "count": 1
    },
    {
      "url": null,
      "urls": [],
      "link_texts": [],
      "menu_files": [
        "Menus/Menu week of 11-16-20.md"
      ],
      "menu_weeks": [
        "2020-11-16"
      ],
      "menu_seasons": [
        "fall"
      ],
      "meal_types": [
        "snack"
      ],
      "sections": [],
      "source_hints": [],
      "item_texts": [
        "Snack: Hummus and radishes, yacon"
      ],
      "count": 1
    },
    {
      "url": null,
      "urls": [],
      "link_texts": [],
      "menu_files": [
        "Menus/Menu week of 11-16-20.md"
      ],
      "menu_weeks": [
        "2020-11-16"
      ],
      "menu_seasons": [
        "fall"
      ],
      "meal_types": [
        "dinner"
      ],
      "sections": [],
      "source_hints": [
        "add pan-fried daikon"
      ],
      "item_texts": [
        "Kale fried rice (add pan-fried daikon)"
      ],
      "count": 1
    },
    {
      "url": null,
      "urls": [],
      "link_texts": [],
      "menu_files": [
        "Menus/Menu week of 11-16-20.md"
      ],
      "menu_weeks": [
        "2020-11-16"
      ],
      "menu_seasons": [
        "fall"
      ],
      "meal_types": [
        "dinner"
      ],
      "sections": [],
      "source_hints": [],
      "item_texts": [
        "Butternut squash macaroni and cheese"
      ],
      "count": 1
    },
    {
      "url": null,
      "urls": [],
      "link_texts": [],
      "menu_files": [
        "Menus/Menu week of 11-16-20.md"
      ],
      "menu_weeks": [
        "2020-11-16"
      ],
      "menu_seasons": [
        "fall"
      ],
      "meal_types": [
        "dinner"
      ],
      "sections": [],
      "source_hints": [],
      "item_texts": [
        "Side 2: Roasted purple top turnips"
      ],
      "count": 1
    },
    {
      "url": null,
      "urls": [],
      "link_texts": [],
      "menu_files": [
        "Menus/Menu week of 11-16-20.md"
      ],
      "menu_weeks": [
        "2020-11-16"
      ],
      "menu_seasons": [
        "fall"
      ],
      "meal_types": [
        "dinner"
      ],
      "sections": [],
      "source_hints": [],
      "item_texts": [
        "Slow cooker apple cider pulled pork"
      ],
      "count": 1
    },
    {
      "url": null,
      "urls": [],
      "link_texts": [],
      "menu_files": [
        "Menus/Menu week of 11-16-20.md"
      ],
      "menu_weeks": [
        "2020-11-16"
      ],
      "menu_seasons": [
        "fall"
      ],
      "meal_types": [
        "dinner"
      ],
      "sections": [],
      "source_hints": [],
      "item_texts": [
        "Side 1: Napa cabbage salad with mandarins and yacon"
      ],
      "count": 1
    },
    {
      "url": null,
      "urls": [],
      "link_texts": [],
      "menu_files": [
        "Menus/Menu week of 11-16-20.md"
      ],
      "menu_weeks": [
        "2020-11-16"
      ],
      "menu_seasons": [
        "fall"
      ],
      "meal_types": [
        "dinner"
      ],
      "sections": [],
      "source_hints": [],
      "item_texts": [
        "Potato leek soup"
      ],
      "count": 1
    },
    {
      "url": null,
      "urls": [],
      "link_texts": [],
      "menu_files": [
        "Menus/Menu week of 11-16-20.md"
      ],
      "menu_weeks": [
        "2020-11-16"
      ],
      "menu_seasons": [
        "fall"
      ],
      "meal_types": [
        "dinner"
      ],
      "sections": [],
      "source_hints": [],
      "item_texts": [
        "Monday: Feel good fall salad (sweet potatoes) and baguette"
      ],
      "count": 1
    },
    {
      "url": null,
      "urls": [],
      "link_texts": [],
      "menu_files": [
        "Menus/Menu week of 11-18-19.md"
      ],
      "menu_weeks": [
        "2019-11-18"
      ],
      "menu_seasons": [
        "fall"
      ],
      "meal_types": [
        "dinner"
      ],
      "sections": [],
      "source_hints": [],
      "item_texts": [
        "Moroccan chickpeas (from frozen - instant pot) and cous cous, cucumber"
      ],
      "count": 1
    },
    {
      "url": null,
      "urls": [],
      "link_texts": [],
      "menu_files": [
        "Menus/Menu week of 11-18-19.md"
      ],
      "menu_weeks": [
        "2019-11-18"
      ],
      "menu_seasons": [
        "fall"
      ],
      "meal_types": [
        "dinner"
      ],
      "sections": [],
      "source_hints": [],
      "item_texts": [
        "Potato soup and salad"
      ],
      "count": 1
    },
    {
      "url": null,
      "urls": [],
      "link_texts": [],
      "menu_files": [
        "Menus/Menu week of 11-18-19.md"
      ],
      "menu_weeks": [
        "2019-11-18"
      ],
      "menu_seasons": [
        "fall"
      ],
      "meal_types": [
        "dinner"
      ],
      "sections": [],
      "source_hints": [
        "pear and goat cheese"
      ],
      "item_texts": [
        "Salad (pear and goat cheese)"
      ],
      "count": 1
    },
    {
      "url": null,
      "urls": [],
      "link_texts": [],
      "menu_files": [
        "Menus/Menu week of 11-18-19.md"
      ],
      "menu_weeks": [
        "2019-11-18"
      ],
      "menu_seasons": [
        "fall"
      ],
      "meal_types": [
        "dinner"
      ],
      "sections": [],
      "source_hints": [],
      "item_texts": [
        "Tortellini and pesto"
      ],
      "count": 1
    },
    {
      "url": null,
      "urls": [],
      "link_texts": [],
      "menu_files": [
        "Menus/Menu week of 11-19-22.md"
      ],
      "menu_weeks": [
        "2022-11-19"
      ],
      "menu_seasons": [
        "fall"
      ],
      "meal_types": [
        "dinner"
      ],
      "sections": [],
      "source_hints": [],
      "item_texts": [
        "Chicken Tortilla Soup"
      ],
      "count": 1
    },
    {
      "url": null,
      "urls": [],
      "link_texts": [],
      "menu_files": [
        "Menus/Menu week of 11-19-22.md"
      ],
      "menu_weeks": [
        "2022-11-19"
      ],
      "menu_seasons": [
        "fall"
      ],
      "meal_types": [
        "dinner"
      ],
      "sections": [],
      "source_hints": [],
      "item_texts": [
        "Millionaire Gnocchi with Red Sauce"
      ],
      "count": 1
    },
    {
      "url": null,
      "urls": [],
      "link_texts": [],
      "menu_files": [
        "Menus/Menu week of 11-19-22.md"
      ],
      "menu_weeks": [
        "2022-11-19"
      ],
      "menu_seasons": [
        "fall"
      ],
      "meal_types": [
        "dinner"
      ],
      "sections": [],
      "source_hints": [],
      "item_texts": [
        "Creamy Kale pasta"
      ],
      "count": 1
    },
    {
      "url": null,
      "urls": [],
      "link_texts": [],
      "menu_files": [
        "Menus/Menu week of 11-19-22.md"
      ],
      "menu_weeks": [
        "2022-11-19"
      ],
      "menu_seasons": [
        "fall"
      ],
      "meal_types": [
        "dinner"
      ],
      "sections": [],
      "source_hints": [],
      "item_texts": [
        "Instant Pot Tandoori-Inspired Chicken"
      ],
      "count": 1
    },
    {
      "url": null,
      "urls": [],
      "link_texts": [],
      "menu_files": [
        "Menus/Menu week of 11-19-22.md"
      ],
      "menu_weeks": [
        "2022-11-19"
      ],
      "menu_seasons": [
        "fall"
      ],
      "meal_types": [
        "dinner"
      ],
      "sections": [],
      "source_hints": [],
      "item_texts": [
        "Chipotle Quinoa Burgers"
      ],
      "count": 1
    },
    {
      "url": null,
      "urls": [],
      "link_texts": [],
      "menu_files": [
        "Menus/Menu week of 11-19-22.md"
      ],
      "menu_weeks": [
        "2022-11-19"
      ],
      "menu_seasons": [
        "fall"
      ],
      "meal_types": [
        "dinner"
      ],
      "sections": [],
      "source_hints": [],
      "item_texts": [
        "Apple pie"
      ],
      "count": 1
    },
    {
      "url": null,
      "urls": [],
      "link_texts": [],
      "menu_files": [
        "Menus/Menu week of 11-19-22.md"
      ],
      "menu_weeks": [
        "2022-11-19"
      ],
      "menu_seasons": [
        "fall"
      ],
      "meal_types": [
        "dinner"
      ],
      "sections": [],
      "source_hints": [],
      "item_texts": [
        "Mashed potatoes"
      ],
      "count": 1
    },
    {
      "url": null,
      "urls": [],
      "link_texts": [],
      "menu_files": [
        "Menus/Menu week of 11-19-22.md"
      ],
      "menu_weeks": [
        "2022-11-19"
      ],
      "menu_seasons": [
        "fall"
      ],
      "meal_types": [
        "dinner"
      ],
      "sections": [],
      "source_hints": [],
      "item_texts": [
        "Cranberry sauce"
      ],
      "count": 1
    },
    {
      "url": null,
      "urls": [],
      "link_texts": [],
      "menu_files": [
        "Menus/Menu week of 11-19-22.md"
      ],
      "menu_weeks": [
        "2022-11-19"
      ],
      "menu_seasons": [
        "fall"
      ],
      "meal_types": [
        "dinner"
      ],
      "sections": [],
      "source_hints": [],
      "item_texts": [
        "Green bean casserole"
      ],
      "count": 1
    },
    {
      "url": null,
      "urls": [],
      "link_texts": [],
      "menu_files": [
        "Menus/Menu week of 11-19-22.md"
      ],
      "menu_weeks": [
        "2022-11-19"
      ],
      "menu_seasons": [
        "fall"
      ],
      "meal_types": [
        "dinner"
      ],
      "sections": [],
      "source_hints": [],
      "item_texts": [
        "Gravy"
      ],
      "count": 1
    },
    {
      "url": null,
      "urls": [],
      "link_texts": [],
      "menu_files": [
        "Menus/Menu week of 11-19-22.md"
      ],
      "menu_weeks": [
        "2022-11-19"
      ],
      "menu_seasons": [
        "fall"
      ],
      "meal_types": [
        "dinner"
      ],
      "sections": [],
      "source_hints": [],
      "item_texts": [
        "Stuffing"
      ],
      "count": 1
    },
    {
      "url": null,
      "urls": [],
      "link_texts": [],
      "menu_files": [
        "Menus/Menu week of 11-19-22.md"
      ],
      "menu_weeks": [
        "2022-11-19"
      ],
      "menu_seasons": [
        "fall"
      ],
      "meal_types": [
        "dinner"
      ],
      "sections": [],
      "source_hints": [],
      "item_texts": [
        "Appetizers"
      ],
      "count": 1
    },
    {
      "url": null,
      "urls": [],
      "link_texts": [],
      "menu_files": [
        "Menus/Menu week of 11-19-22.md"
      ],
      "menu_weeks": [
        "2022-11-19"
      ],
      "menu_seasons": [
        "fall"
      ],
      "meal_types": [
        "dinner"
      ],
      "sections": [],
      "source_hints": [],
      "item_texts": [
        "Pumpkin pie"
      ],
      "count": 1
    },
    {
      "url": null,
      "urls": [],
      "link_texts": [],
      "menu_files": [
        "Menus/Menu week of 11-19-22.md"
      ],
      "menu_weeks": [
        "2022-11-19"
      ],
      "menu_seasons": [
        "fall"
      ],
      "meal_types": [
        "dinner"
      ],
      "sections": [],
      "source_hints": [],
      "item_texts": [
        "Rolls"
      ],
      "count": 1
    },
    {
      "url": null,
      "urls": [],
      "link_texts": [],
      "menu_files": [
        "Menus/Menu week of 11-19-22.md"
      ],
      "menu_weeks": [
        "2022-11-19"
      ],
      "menu_seasons": [
        "fall"
      ],
      "meal_types": [
        "dinner"
      ],
      "sections": [],
      "source_hints": [],
      "item_texts": [
        "German cucumber dill salad"
      ],
      "count": 1
    },
    {
      "url": null,
      "urls": [],
      "link_texts": [],
      "menu_files": [
        "Menus/Menu week of 11-19-22.md"
      ],
      "menu_weeks": [
        "2022-11-19"
      ],
      "menu_seasons": [
        "fall"
      ],
      "meal_types": [
        "dinner"
      ],
      "sections": [],
      "source_hints": [],
      "item_texts": [
        "Claus german sausages"
      ],
      "count": 1
    },
    {
      "url": null,
      "urls": [],
      "link_texts": [],
      "menu_files": [
        "Menus/Menu week of 11-19-22.md"
      ],
      "menu_weeks": [
        "2022-11-19"
      ],
      "menu_seasons": [
        "fall"
      ],
      "meal_types": [
        "dinner"
      ],
      "sections": [],
      "source_hints": [],
      "item_texts": [
        "Kniffle"
      ],
      "count": 1
    },
    {
      "url": null,
      "urls": [],
      "link_texts": [],
      "menu_files": [
        "Menus/Menu week of 11-19-22.md"
      ],
      "menu_weeks": [
        "2022-11-19"
      ],
      "menu_seasons": [
        "fall"
      ],
      "meal_types": [
        "dinner"
      ],
      "sections": [],
      "source_hints": [],
      "item_texts": [
        "Saurkraut"
      ],
      "count": 1
    },
    {
      "url": null,
      "urls": [],
      "link_texts": [],
      "menu_files": [
        "Menus/Menu week of 11-24-23.md"
      ],
      "menu_weeks": [
        "2023-11-24"
      ],
      "menu_seasons": [
        "fall"
      ],
      "meal_types": [
        "dinner"
      ],
      "sections": [],
      "source_hints": [
        "Cheese and crackers"
      ],
      "item_texts": [
        "Appetizer (Cheese and crackers)"
      ],
      "count": 1
    },
    {
      "url": null,
      "urls": [],
      "link_texts": [],
      "menu_files": [
        "Menus/Menu week of 11-24-23.md"
      ],
      "menu_weeks": [
        "2023-11-24"
      ],
      "menu_seasons": [
        "fall"
      ],
      "meal_types": [
        "dinner"
      ],
      "sections": [],
      "source_hints": [
        "veggie tray"
      ],
      "item_texts": [
        "Appetizer (veggie tray)"
      ],
      "count": 1
    },
    {
      "url": null,
      "urls": [],
      "link_texts": [],
      "menu_files": [
        "Menus/Menu week of 11-24-23.md"
      ],
      "menu_weeks": [
        "2023-11-24"
      ],
      "menu_seasons": [
        "fall"
      ],
      "meal_types": [
        "dinner"
      ],
      "sections": [],
      "source_hints": [
        "Larry"
      ],
      "item_texts": [
        "Knopfle (Larry)"
      ],
      "count": 1
    },
    {
      "url": null,
      "urls": [],
      "link_texts": [],
      "menu_files": [
        "Menus/Menu week of 11-24-23.md"
      ],
      "menu_weeks": [
        "2023-11-24"
      ],
      "menu_seasons": [
        "fall"
      ],
      "meal_types": [
        "dinner"
      ],
      "sections": [],
      "source_hints": [],
      "item_texts": [
        "Pinch of Yum House Favorite Roasted Brussels Sprouts"
      ],
      "count": 1
    },
    {
      "url": null,
      "urls": [],
      "link_texts": [],
      "menu_files": [
        "Menus/Menu week of 11-24-23.md"
      ],
      "menu_weeks": [
        "2023-11-24"
      ],
      "menu_seasons": [
        "fall"
      ],
      "meal_types": [
        "dinner"
      ],
      "sections": [],
      "source_hints": [],
      "item_texts": [
        "Saur Kraut"
      ],
      "count": 1
    },
    {
      "url": null,
      "urls": [],
      "link_texts": [],
      "menu_files": [
        "Menus/Menu week of 11-24-23.md"
      ],
      "menu_weeks": [
        "2023-11-24"
      ],
      "menu_seasons": [
        "fall"
      ],
      "meal_types": [
        "dinner"
      ],
      "sections": [],
      "source_hints": [],
      "item_texts": [
        "Sausages"
      ],
      "count": 1
    },
    {
      "url": null,
      "urls": [],
      "link_texts": [],
      "menu_files": [
        "Menus/Menu week of 11-24-23.md"
      ],
      "menu_weeks": [
        "2023-11-24"
      ],
      "menu_seasons": [
        "fall"
      ],
      "meal_types": [
        "dinner"
      ],
      "sections": [],
      "source_hints": [
        "Pinch of Yum"
      ],
      "item_texts": [
        "Ginger Peanut Chicken with coconut rice (Pinch of Yum)"
      ],
      "count": 1
    },
    {
      "url": null,
      "urls": [],
      "link_texts": [],
      "menu_files": [
        "Menus/Menu week of 11-24-23.md"
      ],
      "menu_weeks": [
        "2023-11-24"
      ],
      "menu_seasons": [
        "fall"
      ],
      "meal_types": [
        "dinner"
      ],
      "sections": [],
      "source_hints": [],
      "item_texts": [
        "Smoky beans and greens tacos"
      ],
      "count": 1
    },
    {
      "url": null,
      "urls": [],
      "link_texts": [],
      "menu_files": [
        "Menus/Menu week of 11-24-23.md"
      ],
      "menu_weeks": [
        "2023-11-24"
      ],
      "menu_seasons": [
        "fall"
      ],
      "meal_types": [
        "dinner"
      ],
      "sections": [],
      "source_hints": [],
      "item_texts": [
        "Egg Waffles with Romesco and Goat Cheese"
      ],
      "count": 1
    },
    {
      "url": null,
      "urls": [],
      "link_texts": [],
      "menu_files": [
        "Menus/Menu week of 11-24-23.md"
      ],
      "menu_weeks": [
        "2023-11-24"
      ],
      "menu_seasons": [
        "fall"
      ],
      "meal_types": [
        "dinner"
      ],
      "sections": [],
      "source_hints": [],
      "item_texts": [
        "Instant Pot Pot Roast"
      ],
      "count": 1
    },
    {
      "url": null,
      "urls": [],
      "link_texts": [],
      "menu_files": [
        "Menus/Menu week of 11-24-23.md"
      ],
      "menu_weeks": [
        "2023-11-24"
      ],
      "menu_seasons": [
        "fall"
      ],
      "meal_types": [
        "dinner"
      ],
      "sections": [],
      "source_hints": [],
      "item_texts": [
        "Hot Honey Salmon"
      ],
      "count": 1
    },
    {
      "url": null,
      "urls": [],
      "link_texts": [],
      "menu_files": [
        "Menus/Menu week of 11-24-23.md"
      ],
      "menu_weeks": [
        "2023-11-24"
      ],
      "menu_seasons": [
        "fall"
      ],
      "meal_types": [
        "dinner"
      ],
      "sections": [],
      "source_hints": [],
      "item_texts": [
        "Creamy Mushroom Soup"
      ],
      "count": 1
    },
    {
      "url": null,
      "urls": [],
      "link_texts": [],
      "menu_files": [
        "Menus/Menu week of 11-28-19.md"
      ],
      "menu_weeks": [
        "2019-11-28"
      ],
      "menu_seasons": [
        "fall"
      ],
      "meal_types": [
        "dinner"
      ],
      "sections": [],
      "source_hints": [],
      "item_texts": [
        "Apple pie"
      ],
      "count": 1
    },
    {
      "url": null,
      "urls": [],
      "link_texts": [],
      "menu_files": [
        "Menus/Menu week of 11-28-19.md"
      ],
      "menu_weeks": [
        "2019-11-28"
      ],
      "menu_seasons": [
        "fall"
      ],
      "meal_types": [
        "dinner"
      ],
      "sections": [],
      "source_hints": [],
      "item_texts": [
        "Mashed Potatoes"
      ],
      "count": 1
    },
    {
      "url": null,
      "urls": [],
      "link_texts": [],
      "menu_files": [
        "Menus/Menu week of 11-28-19.md"
      ],
      "menu_weeks": [
        "2019-11-28"
      ],
      "menu_seasons": [
        "fall"
      ],
      "meal_types": [
        "dinner"
      ],
      "sections": [],
      "source_hints": [],
      "item_texts": [
        "Green bean casserole"
      ],
      "count": 1
    },
    {
      "url": null,
      "urls": [],
      "link_texts": [],
      "menu_files": [
        "Menus/Menu week of 11-28-19.md"
      ],
      "menu_weeks": [
        "2019-11-28"
      ],
      "menu_seasons": [
        "fall"
      ],
      "meal_types": [
        "dinner"
      ],
      "sections": [],
      "source_hints": [],
      "item_texts": [
        "Gravy"
      ],
      "count": 1
    },
    {
      "url": null,
      "urls": [],
      "link_texts": [],
      "menu_files": [
        "Menus/Menu week of 11-28-19.md"
      ],
      "menu_weeks": [
        "2019-11-28"
      ],
      "menu_seasons": [
        "fall"
      ],
      "meal_types": [
        "dinner"
      ],
      "sections": [],
      "source_hints": [],
      "item_texts": [
        "Herb and Garlic Marinated Olives"
      ],
      "count": 1
    },
    {
      "url": null,
      "urls": [],
      "link_texts": [],
      "menu_files": [
        "Menus/Menu week of 11-28-19.md"
      ],
      "menu_weeks": [
        "2019-11-28"
      ],
      "menu_seasons": [
        "fall"
      ],
      "meal_types": [
        "dinner"
      ],
      "sections": [],
      "source_hints": [],
      "item_texts": [
        "Verde chicken enchilada casserole"
      ],
      "count": 1
    },
    {
      "url": null,
      "urls": [],
      "link_texts": [],
      "menu_files": [
        "Menus/Menu week of 11-28-19.md"
      ],
      "menu_weeks": [
        "2019-11-28"
      ],
      "menu_seasons": [
        "fall"
      ],
      "meal_types": [
        "dinner"
      ],
      "sections": [],
      "source_hints": [],
      "item_texts": [
        "Flank steak and roasted Brussels sprouts"
      ],
      "count": 1
    },
    {
      "url": null,
      "urls": [],
      "link_texts": [],
      "menu_files": [
        "Menus/Menu week of 11-3-21.md"
      ],
      "menu_weeks": [
        "2021-11-03"
      ],
      "menu_seasons": [
        "fall"
      ],
      "meal_types": [
        "dinner"
      ],
      "sections": [],
      "source_hints": [],
      "item_texts": [
        "Chili"
      ],
      "count": 1
    },
    {
      "url": null,
      "urls": [],
      "link_texts": [],
      "menu_files": [
        "Menus/Menu week of 11-3-21.md"
      ],
      "menu_weeks": [
        "2021-11-03"
      ],
      "menu_seasons": [
        "fall"
      ],
      "meal_types": [
        "dinner"
      ],
      "sections": [],
      "source_hints": [],
      "item_texts": [
        "Ham and Swiss sliders"
      ],
      "count": 1
    },
    {
      "url": null,
      "urls": [],
      "link_texts": [],
      "menu_files": [
        "Menus/Menu week of 11-3-21.md"
      ],
      "menu_weeks": [
        "2021-11-03"
      ],
      "menu_seasons": [
        "fall"
      ],
      "meal_types": [
        "dinner"
      ],
      "sections": [],
      "source_hints": [],
      "item_texts": [
        "Gnocchi, saut\u00e9ed peppers and onions"
      ],
      "count": 1
    },
    {
      "url": null,
      "urls": [],
      "link_texts": [],
      "menu_files": [
        "Menus/Menu week of 11-3-21.md"
      ],
      "menu_weeks": [
        "2021-11-03"
      ],
      "menu_seasons": [
        "fall"
      ],
      "meal_types": [
        "dinner"
      ],
      "sections": [],
      "source_hints": [],
      "item_texts": [
        "Peruvian-Style Grilled Chicken with Green Sauce and grilled cauliflower"
      ],
      "count": 1
    },
    {
      "url": null,
      "urls": [],
      "link_texts": [],
      "menu_files": [
        "Menus/Menu week of 11-3-21.md"
      ],
      "menu_weeks": [
        "2021-11-03"
      ],
      "menu_seasons": [
        "fall"
      ],
      "meal_types": [
        "dinner"
      ],
      "sections": [],
      "source_hints": [],
      "item_texts": [
        "Jalape\u00f1o poppers"
      ],
      "count": 1
    },
    {
      "url": null,
      "urls": [],
      "link_texts": [],
      "menu_files": [
        "Menus/Menu week of 11-6-18.md"
      ],
      "menu_weeks": [
        "2018-11-06"
      ],
      "menu_seasons": [
        "fall"
      ],
      "meal_types": [
        "dinner"
      ],
      "sections": [],
      "source_hints": [],
      "item_texts": [
        "Tuesday: pizza"
      ],
      "count": 1
    },
    {
      "url": null,
      "urls": [],
      "link_texts": [],
      "menu_files": [
        "Menus/Menu week of 11-6-18.md"
      ],
      "menu_weeks": [
        "2018-11-06"
      ],
      "menu_seasons": [
        "fall"
      ],
      "meal_types": [
        "dinner"
      ],
      "sections": [],
      "source_hints": [],
      "item_texts": [
        "Butternut squash apple soup with sage Parmesan croutons"
      ],
      "count": 1
    },
    {
      "url": null,
      "urls": [],
      "link_texts": [],
      "menu_files": [
        "Menus/Menu week of 11-6-18.md"
      ],
      "menu_weeks": [
        "2018-11-06"
      ],
      "menu_seasons": [
        "fall"
      ],
      "meal_types": [
        "dinner"
      ],
      "sections": [],
      "source_hints": [],
      "item_texts": [
        "Goat cheese, beets, pecan salad and bread"
      ],
      "count": 1
    },
    {
      "url": null,
      "urls": [],
      "link_texts": [],
      "menu_files": [
        "Menus/Menu week of 11-6-18.md"
      ],
      "menu_weeks": [
        "2018-11-06"
      ],
      "menu_seasons": [
        "fall"
      ],
      "meal_types": [
        "dinner"
      ],
      "sections": [],
      "source_hints": [],
      "item_texts": [
        "Spaghetti squash casserole"
      ],
      "count": 1
    },
    {
      "url": null,
      "urls": [],
      "link_texts": [],
      "menu_files": [
        "Menus/Menu week of 11-6-18.md"
      ],
      "menu_weeks": [
        "2018-11-06"
      ],
      "menu_seasons": [
        "fall"
      ],
      "meal_types": [
        "dinner"
      ],
      "sections": [],
      "source_hints": [],
      "item_texts": [
        "Broccoli beef"
      ],
      "count": 1
    },
    {
      "url": null,
      "urls": [],
      "link_texts": [],
      "menu_files": [
        "Menus/Menu week of 11-6-18.md"
      ],
      "menu_weeks": [
        "2018-11-06"
      ],
      "menu_seasons": [
        "fall"
      ],
      "meal_types": [
        "dinner"
      ],
      "sections": [],
      "source_hints": [],
      "item_texts": [
        "Sheet pan chicken tikka"
      ],
      "count": 1
    },
    {
      "url": null,
      "urls": [],
      "link_texts": [],
      "menu_files": [
        "Menus/Menu week of 11-6-18.md"
      ],
      "menu_weeks": [
        "2018-11-06"
      ],
      "menu_seasons": [
        "fall"
      ],
      "meal_types": [
        "dinner"
      ],
      "sections": [],
      "source_hints": [],
      "item_texts": [
        "Colcannon"
      ],
      "count": 1
    },
    {
      "url": null,
      "urls": [],
      "link_texts": [],
      "menu_files": [
        "Menus/Menu week of 11-6-18.md"
      ],
      "menu_weeks": [
        "2018-11-06"
      ],
      "menu_seasons": [
        "fall"
      ],
      "meal_types": [
        "dinner"
      ],
      "sections": [],
      "source_hints": [],
      "item_texts": [
        "Burgers and turnips"
      ],
      "count": 1
    },
    {
      "url": null,
      "urls": [],
      "link_texts": [],
      "menu_files": [
        "Menus/Menu week of 11-6-19.md"
      ],
      "menu_weeks": [
        "2019-11-06"
      ],
      "menu_seasons": [
        "fall"
      ],
      "meal_types": [
        "dinner"
      ],
      "sections": [],
      "source_hints": [
        "peppers and onions, salsa, sour cream, black beans, rice, avocado, frozen corn"
      ],
      "item_texts": [
        "Cauliflower walnut Burrito bowls (peppers and onions, salsa, sour cream, black beans, rice, avocado, frozen corn)"
      ],
      "count": 1
    },
    {
      "url": null,
      "urls": [],
      "link_texts": [],
      "menu_files": [
        "Menus/Menu week of 11-6-19.md"
      ],
      "menu_weeks": [
        "2019-11-06"
      ],
      "menu_seasons": [
        "fall"
      ],
      "meal_types": [
        "dinner"
      ],
      "sections": [],
      "source_hints": [],
      "item_texts": [
        "Crock pot Irish stew"
      ],
      "count": 1
    },
    {
      "url": null,
      "urls": [],
      "link_texts": [],
      "menu_files": [
        "Menus/Menu week of 11-6-19.md"
      ],
      "menu_weeks": [
        "2019-11-06"
      ],
      "menu_seasons": [
        "fall"
      ],
      "meal_types": [
        "dinner"
      ],
      "sections": [],
      "source_hints": [],
      "item_texts": [
        "Tandoori chicken (from frozen - instant pot), add roasted cauliflower and potatoes"
      ],
      "count": 1
    },
    {
      "url": null,
      "urls": [],
      "link_texts": [],
      "menu_files": [
        "Menus/Menu week of 11-6-19.md"
      ],
      "menu_weeks": [
        "2019-11-06"
      ],
      "menu_seasons": [
        "fall"
      ],
      "meal_types": [
        "dinner"
      ],
      "sections": [],
      "source_hints": [
        "from frozen - instant pot"
      ],
      "item_texts": [
        "Detox lentil soup and bread (from frozen - instant pot)"
      ],
      "count": 1
    },
    {
      "url": null,
      "urls": [],
      "link_texts": [],
      "menu_files": [
        "Menus/Menu week of 11-6-19.md"
      ],
      "menu_weeks": [
        "2019-11-06"
      ],
      "menu_seasons": [
        "fall"
      ],
      "meal_types": [
        "dinner"
      ],
      "sections": [],
      "source_hints": [],
      "item_texts": [
        "Vegetarian enchiladas verde"
      ],
      "count": 1
    },
    {
      "url": null,
      "urls": [],
      "link_texts": [],
      "menu_files": [
        "Menus/Menu week of 11-8-23.md"
      ],
      "menu_weeks": [
        "2023-11-08"
      ],
      "menu_seasons": [
        "fall"
      ],
      "meal_types": [
        "dinner"
      ],
      "sections": [],
      "source_hints": [],
      "item_texts": [
        "Steak, roasted carrots and purple fingerling potatoes"
      ],
      "count": 1
    },
    {
      "url": null,
      "urls": [],
      "link_texts": [],
      "menu_files": [
        "Menus/Menu week of 11-8-23.md"
      ],
      "menu_weeks": [
        "2023-11-08"
      ],
      "menu_seasons": [
        "fall"
      ],
      "meal_types": [
        "dinner"
      ],
      "sections": [],
      "source_hints": [],
      "item_texts": [
        "Chicken fingers and roasted broccoli/potatoes"
      ],
      "count": 1
    },
    {
      "url": null,
      "urls": [],
      "link_texts": [],
      "menu_files": [
        "Menus/Menu week of 11-8-23.md"
      ],
      "menu_weeks": [
        "2023-11-08"
      ],
      "menu_seasons": [
        "fall"
      ],
      "meal_types": [
        "dinner"
      ],
      "sections": [],
      "source_hints": [],
      "item_texts": [
        "Black bean tacos"
      ],
      "count": 1
    },
    {
      "url": null,
      "urls": [],
      "link_texts": [],
      "menu_files": [
        "Menus/Menu week of 11-8-23.md"
      ],
      "menu_weeks": [
        "2023-11-08"
      ],
      "menu_seasons": [
        "fall"
      ],
      "meal_types": [
        "dinner"
      ],
      "sections": [],
      "source_hints": [],
      "item_texts": [
        "Ginger peanut chicken"
      ],
      "count": 1
    },
    {
      "url": null,
      "urls": [],
      "link_texts": [],
      "menu_files": [
        "Menus/Menu week of 11-8-23.md"
      ],
      "menu_weeks": [
        "2023-11-08"
      ],
      "menu_seasons": [
        "fall"
      ],
      "meal_types": [
        "dinner"
      ],
      "sections": [],
      "source_hints": [],
      "item_texts": [
        "Mushroom Penne with Walnut pesto"
      ],
      "count": 1
    },
    {
      "url": null,
      "urls": [],
      "link_texts": [],
      "menu_files": [
        "Menus/Menu week of 11-8-23.md"
      ],
      "menu_weeks": [
        "2023-11-08"
      ],
      "menu_seasons": [
        "fall"
      ],
      "meal_types": [
        "dinner"
      ],
      "sections": [],
      "source_hints": [],
      "item_texts": [
        "Sheet pan meatballs with tomato salad and green sauce"
      ],
      "count": 1
    },
    {
      "url": null,
      "urls": [],
      "link_texts": [],
      "menu_files": [
        "Menus/Menu week of 12-10-23.md"
      ],
      "menu_weeks": [
        "2023-12-10"
      ],
      "menu_seasons": [
        "winter"
      ],
      "meal_types": [
        "dinner"
      ],
      "sections": [],
      "source_hints": [],
      "item_texts": [
        "Creamy Tortellini Soup"
      ],
      "count": 1
    },
    {
      "url": null,
      "urls": [],
      "link_texts": [],
      "menu_files": [
        "Menus/Menu week of 12-10-23.md"
      ],
      "menu_weeks": [
        "2023-12-10"
      ],
      "menu_seasons": [
        "winter"
      ],
      "meal_types": [
        "dinner"
      ],
      "sections": [],
      "source_hints": [],
      "item_texts": [
        "Chicken teriyaki burgers with sesame slaw"
      ],
      "count": 1
    },
    {
      "url": null,
      "urls": [],
      "link_texts": [],
      "menu_files": [
        "Menus/Menu week of 12-10-23.md"
      ],
      "menu_weeks": [
        "2023-12-10"
      ],
      "menu_seasons": [
        "winter"
      ],
      "meal_types": [
        "dinner"
      ],
      "sections": [],
      "source_hints": [],
      "item_texts": [
        "Easy crockpot carnitas"
      ],
      "count": 1
    },
    {
      "url": null,
      "urls": [],
      "link_texts": [],
      "menu_files": [
        "Menus/Menu week of 12-10-23.md"
      ],
      "menu_weeks": [
        "2023-12-10"
      ],
      "menu_seasons": [
        "winter"
      ],
      "meal_types": [
        "dinner"
      ],
      "sections": [],
      "source_hints": [],
      "item_texts": [
        "Greek Baked Orzo"
      ],
      "count": 1
    },
    {
      "url": null,
      "urls": [],
      "link_texts": [],
      "menu_files": [
        "Menus/Menu week of 12-10-23.md"
      ],
      "menu_weeks": [
        "2023-12-10"
      ],
      "menu_seasons": [
        "winter"
      ],
      "meal_types": [
        "dinner"
      ],
      "sections": [],
      "source_hints": [
        "Pinch of Yum - contest"
      ],
      "item_texts": [
        "Vegetarian shepherd\u2019s Pie (Pinch of Yum - contest)"
      ],
      "count": 1
    },
    {
      "url": null,
      "urls": [],
      "link_texts": [],
      "menu_files": [
        "Menus/Menu week of 12-10-23.md"
      ],
      "menu_weeks": [
        "2023-12-10"
      ],
      "menu_seasons": [
        "winter"
      ],
      "meal_types": [
        "dinner"
      ],
      "sections": [],
      "source_hints": [
        "Pinch of Yum - contest"
      ],
      "item_texts": [
        "Chicken Pot Pie with Biscuits (Pinch of Yum - contest)"
      ],
      "count": 1
    },
    {
      "url": null,
      "urls": [],
      "link_texts": [],
      "menu_files": [
        "Menus/Menu week of 12-15-17.md"
      ],
      "menu_weeks": [
        "2017-12-15"
      ],
      "menu_seasons": [
        "winter"
      ],
      "meal_types": [
        "dinner"
      ],
      "sections": [],
      "source_hints": [],
      "item_texts": [
        "Saturday: France 44"
      ],
      "count": 1
    },
    {
      "url": null,
      "urls": [],
      "link_texts": [],
      "menu_files": [
        "Menus/Menu week of 12-15-17.md"
      ],
      "menu_weeks": [
        "2017-12-15"
      ],
      "menu_seasons": [
        "winter"
      ],
      "meal_types": [
        "dinner"
      ],
      "sections": [],
      "source_hints": [],
      "item_texts": [
        "Sunday:crispy potato, chorizo and green chili hash"
      ],
      "count": 1
    },
    {
      "url": null,
      "urls": [],
      "link_texts": [],
      "menu_files": [
        "Menus/Menu week of 12-15-17.md"
      ],
      "menu_weeks": [
        "2017-12-15"
      ],
      "menu_seasons": [
        "winter"
      ],
      "meal_types": [
        "dinner"
      ],
      "sections": [],
      "source_hints": [],
      "item_texts": [
        "Monday: bulgar salad"
      ],
      "count": 1
    },
    {
      "url": null,
      "urls": [],
      "link_texts": [],
      "menu_files": [
        "Menus/Menu week of 12-15-17.md"
      ],
      "menu_weeks": [
        "2017-12-15"
      ],
      "menu_seasons": [
        "winter"
      ],
      "meal_types": [
        "dinner"
      ],
      "sections": [],
      "source_hints": [],
      "item_texts": [
        "Tuesday: Alicia book Club"
      ],
      "count": 1
    },
    {
      "url": null,
      "urls": [],
      "link_texts": [],
      "menu_files": [
        "Menus/Menu week of 12-15-17.md"
      ],
      "menu_weeks": [
        "2017-12-15"
      ],
      "menu_seasons": [
        "winter"
      ],
      "meal_types": [
        "dinner"
      ],
      "sections": [],
      "source_hints": [],
      "item_texts": [
        "Wednesday: cauliflower potato and green pea daal, rice"
      ],
      "count": 1
    },
    {
      "url": null,
      "urls": [],
      "link_texts": [],
      "menu_files": [
        "Menus/Menu week of 12-15-17.md"
      ],
      "menu_weeks": [
        "2017-12-15"
      ],
      "menu_seasons": [
        "winter"
      ],
      "meal_types": [
        "dinner"
      ],
      "sections": [],
      "source_hints": [],
      "item_texts": [
        "Thursday: leftovers"
      ],
      "count": 1
    },
    {
      "url": null,
      "urls": [],
      "link_texts": [],
      "menu_files": [
        "Menus/Menu week of 12-16-19.md"
      ],
      "menu_weeks": [
        "2019-12-16"
      ],
      "menu_seasons": [
        "winter"
      ],
      "meal_types": [
        "dinner"
      ],
      "sections": [],
      "source_hints": [],
      "item_texts": [
        "Creamy tortellini soup and bread, spinach, goat cheese pear salad"
      ],
      "count": 1
    },
    {
      "url": null,
      "urls": [],
      "link_texts": [],
      "menu_files": [
        "Menus/Menu week of 12-16-19.md"
      ],
      "menu_weeks": [
        "2019-12-16"
      ],
      "menu_seasons": [
        "winter"
      ],
      "meal_types": [
        "dinner"
      ],
      "sections": [],
      "source_hints": [],
      "item_texts": [
        "Friday: Peanut butter blossoms and sugar cookies"
      ],
      "count": 1
    },
    {
      "url": null,
      "urls": [],
      "link_texts": [],
      "menu_files": [
        "Menus/Menu week of 12-16-19.md"
      ],
      "menu_weeks": [
        "2019-12-16"
      ],
      "menu_seasons": [
        "winter"
      ],
      "meal_types": [
        "dinner"
      ],
      "sections": [],
      "source_hints": [],
      "item_texts": [
        "Vegetable soup and bread"
      ],
      "count": 1
    },
    {
      "url": null,
      "urls": [],
      "link_texts": [],
      "menu_files": [
        "Menus/Menu week of 12-16-19.md"
      ],
      "menu_weeks": [
        "2019-12-16"
      ],
      "menu_seasons": [
        "winter"
      ],
      "meal_types": [
        "dinner"
      ],
      "sections": [],
      "source_hints": [],
      "item_texts": [
        "Whatever beer Sean wants"
      ],
      "count": 1
    },
    {
      "url": null,
      "urls": [],
      "link_texts": [],
      "menu_files": [
        "Menus/Menu week of 12-16-19.md"
      ],
      "menu_weeks": [
        "2019-12-16"
      ],
      "menu_seasons": [
        "winter"
      ],
      "meal_types": [
        "dinner"
      ],
      "sections": [],
      "source_hints": [],
      "item_texts": [
        "1 pan baked ham and swiss sliders"
      ],
      "count": 1
    },
    {
      "url": null,
      "urls": [],
      "link_texts": [],
      "menu_files": [
        "Menus/Menu week of 12-16-19.md"
      ],
      "menu_weeks": [
        "2019-12-16"
      ],
      "menu_seasons": [
        "winter"
      ],
      "meal_types": [
        "dinner"
      ],
      "sections": [],
      "source_hints": [],
      "item_texts": [
        "Hummus"
      ],
      "count": 1
    },
    {
      "url": null,
      "urls": [],
      "link_texts": [],
      "menu_files": [
        "Menus/Menu week of 12-16-19.md"
      ],
      "menu_weeks": [
        "2019-12-16"
      ],
      "menu_seasons": [
        "winter"
      ],
      "meal_types": [
        "dinner"
      ],
      "sections": [],
      "source_hints": [],
      "item_texts": [
        "Pita bread"
      ],
      "count": 1
    },
    {
      "url": null,
      "urls": [],
      "link_texts": [],
      "menu_files": [
        "Menus/Menu week of 12-17-18.md"
      ],
      "menu_weeks": [
        "2018-12-17"
      ],
      "menu_seasons": [
        "winter"
      ],
      "meal_types": [
        "dinner"
      ],
      "sections": [],
      "source_hints": [],
      "item_texts": [
        "Monday: Butternut squash quinoa chili"
      ],
      "count": 1
    },
    {
      "url": null,
      "urls": [],
      "link_texts": [],
      "menu_files": [
        "Menus/Menu week of 12-17-18.md"
      ],
      "menu_weeks": [
        "2018-12-17"
      ],
      "menu_seasons": [
        "winter"
      ],
      "meal_types": [
        "dinner"
      ],
      "sections": [],
      "source_hints": [],
      "item_texts": [
        "Tuesday: pizza"
      ],
      "count": 1
    },
    {
      "url": null,
      "urls": [],
      "link_texts": [],
      "menu_files": [
        "Menus/Menu week of 12-17-18.md"
      ],
      "menu_weeks": [
        "2018-12-17"
      ],
      "menu_seasons": [
        "winter"
      ],
      "meal_types": [
        "dinner"
      ],
      "sections": [],
      "source_hints": [],
      "item_texts": [
        "Wednesday: Quick and easy lentil quesadillas and magic green sauce"
      ],
      "count": 1
    },
    {
      "url": null,
      "urls": [],
      "link_texts": [],
      "menu_files": [
        "Menus/Menu week of 12-17-18.md"
      ],
      "menu_weeks": [
        "2018-12-17"
      ],
      "menu_seasons": [
        "winter"
      ],
      "meal_types": [
        "dinner"
      ],
      "sections": [],
      "source_hints": [],
      "item_texts": [
        "Thursday: quinoa salad with apple, chickpeas, toasted almonds, and apple cider vinaigrette"
      ],
      "count": 1
    },
    {
      "url": null,
      "urls": [],
      "link_texts": [],
      "menu_files": [
        "Menus/Menu week of 12-17-18.md"
      ],
      "menu_weeks": [
        "2018-12-17"
      ],
      "menu_seasons": [
        "winter"
      ],
      "meal_types": [
        "dinner"
      ],
      "sections": [],
      "source_hints": [
        "cousins night out - don\u2019t know if this included dinner"
      ],
      "item_texts": [
        "Friday: crispy chicken bacon pesto gnocchi skillet - add asparagus (cousins night out - don\u2019t know if this included dinner)"
      ],
      "count": 1
    },
    {
      "url": null,
      "urls": [],
      "link_texts": [],
      "menu_files": [
        "Menus/Menu week of 12-17-18.md"
      ],
      "menu_weeks": [
        "2018-12-17"
      ],
      "menu_seasons": [
        "winter"
      ],
      "meal_types": [
        "dinner"
      ],
      "sections": [],
      "source_hints": [],
      "item_texts": [
        "Saturday: Christmas festivities begin \ud83c\udf84\ud83c\udf85\ud83c\udffc\ud83c\udf85\ud83c\udfff\u2603\ufe0f\ud83e\udd8c"
      ],
      "count": 1
    },
    {
      "url": null,
      "urls": [],
      "link_texts": [],
      "menu_files": [
        "Menus/Menu week of 12-19-24.md"
      ],
      "menu_weeks": [
        "2024-12-19"
      ],
      "menu_seasons": [
        "winter"
      ],
      "meal_types": [
        "dinner"
      ],
      "sections": [],
      "source_hints": [],
      "item_texts": [
        "Chicken nuggets, broccoli, sweet potato fries"
      ],
      "count": 1
    },
    {
      "url": null,
      "urls": [],
      "link_texts": [],
      "menu_files": [
        "Menus/Menu week of 12-19-24.md"
      ],
      "menu_weeks": [
        "2024-12-19"
      ],
      "menu_seasons": [
        "winter"
      ],
      "meal_types": [
        "breakfast"
      ],
      "sections": [],
      "source_hints": [],
      "item_texts": [
        "Breakfast: Bacon potato and egg casserole leftovers, monkey rolls, fruit"
      ],
      "count": 1
    },
    {
      "url": null,
      "urls": [],
      "link_texts": [],
      "menu_files": [
        "Menus/Menu week of 12-19-25.md"
      ],
      "menu_weeks": [
        "2025-12-19"
      ],
      "menu_seasons": [
        "winter"
      ],
      "meal_types": [
        "breakfast"
      ],
      "sections": [],
      "source_hints": [],
      "item_texts": [
        "Christmas morning breakfast:"
      ],
      "count": 1
    },
    {
      "url": null,
      "urls": [],
      "link_texts": [],
      "menu_files": [
        "Menus/Menu week of 12-19-25.md"
      ],
      "menu_weeks": [
        "2025-12-19"
      ],
      "menu_seasons": [
        "winter"
      ],
      "meal_types": [
        "dinner"
      ],
      "sections": [],
      "source_hints": [],
      "item_texts": [
        "bacon"
      ],
      "count": 1
    },
    {
      "url": null,
      "urls": [],
      "link_texts": [],
      "menu_files": [
        "Menus/Menu week of 12-19-25.md"
      ],
      "menu_weeks": [
        "2025-12-19"
      ],
      "menu_seasons": [
        "winter"
      ],
      "meal_types": [
        "dinner"
      ],
      "sections": [],
      "source_hints": [],
      "item_texts": [
        "eggs"
      ],
      "count": 1
    },
    {
      "url": null,
      "urls": [],
      "link_texts": [],
      "menu_files": [
        "Menus/Menu week of 12-21-20.md"
      ],
      "menu_weeks": [
        "2020-12-21"
      ],
      "menu_seasons": [
        "winter"
      ],
      "meal_types": [
        "dinner"
      ],
      "sections": [],
      "source_hints": [],
      "item_texts": [
        "Tuesday: Daikon with Chicken in yuzu sauce"
      ],
      "count": 1
    },
    {
      "url": null,
      "urls": [],
      "link_texts": [],
      "menu_files": [
        "Menus/Menu week of 12-21-20.md"
      ],
      "menu_weeks": [
        "2020-12-21"
      ],
      "menu_seasons": [
        "winter"
      ],
      "meal_types": [
        "dinner"
      ],
      "sections": [],
      "source_hints": [],
      "item_texts": [
        "Christmas morning: Vanilla Honey French toast and bacon"
      ],
      "count": 1
    },
    {
      "url": null,
      "urls": [],
      "link_texts": [],
      "menu_files": [
        "Menus/Menu week of 12-21-20.md"
      ],
      "menu_weeks": [
        "2020-12-21"
      ],
      "menu_seasons": [
        "winter"
      ],
      "meal_types": [
        "dinner"
      ],
      "sections": [],
      "source_hints": [],
      "item_texts": [
        "Christmas eve: Ham rounds and peanut butter cookies"
      ],
      "count": 1
    },
    {
      "url": null,
      "urls": [],
      "link_texts": [],
      "menu_files": [
        "Menus/Menu week of 12-21-20.md"
      ],
      "menu_weeks": [
        "2020-12-21"
      ],
      "menu_seasons": [
        "winter"
      ],
      "meal_types": [
        "dinner"
      ],
      "sections": [],
      "source_hints": [],
      "item_texts": [
        "Wednesday: Chicken tacos; napa cabbage slaw with honey lime dressing, avocado"
      ],
      "count": 1
    },
    {
      "url": null,
      "urls": [],
      "link_texts": [],
      "menu_files": [
        "Menus/Menu week of 12-21-20.md"
      ],
      "menu_weeks": [
        "2020-12-21"
      ],
      "menu_seasons": [
        "winter"
      ],
      "meal_types": [
        "dinner"
      ],
      "sections": [],
      "source_hints": [],
      "item_texts": [
        "Monday: Pizza"
      ],
      "count": 1
    },
    {
      "url": null,
      "urls": [],
      "link_texts": [],
      "menu_files": [
        "Menus/Menu week of 12-22-21.md"
      ],
      "menu_weeks": [
        "2021-12-22"
      ],
      "menu_seasons": [
        "winter"
      ],
      "meal_types": [
        "breakfast"
      ],
      "sections": [],
      "source_hints": [],
      "item_texts": [
        "Christmas breakfast: avocado toast with bacon, egg, tomato, cinnamon rolls"
      ],
      "count": 1
    },
    {
      "url": null,
      "urls": [],
      "link_texts": [],
      "menu_files": [
        "Menus/Menu week of 12-22-21.md"
      ],
      "menu_weeks": [
        "2021-12-22"
      ],
      "menu_seasons": [
        "winter"
      ],
      "meal_types": [
        "dinner"
      ],
      "sections": [],
      "source_hints": [],
      "item_texts": [
        "Christmas dinner: truffle oil cheesy pasta and bagged salad"
      ],
      "count": 1
    },
    {
      "url": null,
      "urls": [],
      "link_texts": [],
      "menu_files": [
        "Menus/Menu week of 12-22-21.md"
      ],
      "menu_weeks": [
        "2021-12-22"
      ],
      "menu_seasons": [
        "winter"
      ],
      "meal_types": [
        "dinner"
      ],
      "sections": [],
      "source_hints": [],
      "item_texts": [
        "Christmas Eve: spinach and artichoke dip, veggie tray, cider,"
      ],
      "count": 1
    },
    {
      "url": null,
      "urls": [],
      "link_texts": [],
      "menu_files": [
        "Menus/Menu week of 12-22-21.md"
      ],
      "menu_weeks": [
        "2021-12-22"
      ],
      "menu_seasons": [
        "winter"
      ],
      "meal_types": [
        "dinner"
      ],
      "sections": [],
      "source_hints": [
        "A Couple Cooks"
      ],
      "item_texts": [
        "Vegetarian tortellini soup (A Couple Cooks)"
      ],
      "count": 1
    },
    {
      "url": null,
      "urls": [],
      "link_texts": [],
      "menu_files": [
        "Menus/Menu week of 12-22-21.md"
      ],
      "menu_weeks": [
        "2021-12-22"
      ],
      "menu_seasons": [
        "winter"
      ],
      "meal_types": [
        "dinner"
      ],
      "sections": [],
      "source_hints": [],
      "item_texts": [
        "Blue Apron meal pork"
      ],
      "count": 1
    },
    {
      "url": null,
      "urls": [],
      "link_texts": [],
      "menu_files": [
        "Menus/Menu week of 12-22-21.md"
      ],
      "menu_weeks": [
        "2021-12-22"
      ],
      "menu_seasons": [
        "winter"
      ],
      "meal_types": [
        "dinner"
      ],
      "sections": [],
      "source_hints": [],
      "item_texts": [
        "Blue apron meal noodles"
      ],
      "count": 1
    },
    {
      "url": null,
      "urls": [],
      "link_texts": [],
      "menu_files": [
        "Menus/Menu week of 12-22-21.md"
      ],
      "menu_weeks": [
        "2021-12-22"
      ],
      "menu_seasons": [
        "winter"
      ],
      "meal_types": [
        "dinner"
      ],
      "sections": [],
      "source_hints": [],
      "item_texts": [
        "Blue apron meal curry baked chicken and roasted veggies"
      ],
      "count": 1
    },
    {
      "url": null,
      "urls": [],
      "link_texts": [],
      "menu_files": [
        "Menus/Menu week of 12-27-22.md"
      ],
      "menu_weeks": [
        "2022-12-27"
      ],
      "menu_seasons": [
        "winter"
      ],
      "meal_types": [
        "dinner"
      ],
      "sections": [],
      "source_hints": [
        "marinade in freezer"
      ],
      "item_texts": [
        "Instant Pot Korean beef tacos (marinade in freezer)"
      ],
      "count": 1
    },
    {
      "url": null,
      "urls": [],
      "link_texts": [],
      "menu_files": [
        "Menus/Menu week of 12-27-22.md"
      ],
      "menu_weeks": [
        "2022-12-27"
      ],
      "menu_seasons": [
        "winter"
      ],
      "meal_types": [
        "dinner"
      ],
      "sections": [],
      "source_hints": [],
      "item_texts": [
        "BBQ jackfruit sandwiches with sweet potato fries"
      ],
      "count": 1
    },
    {
      "url": null,
      "urls": [],
      "link_texts": [],
      "menu_files": [
        "Menus/Menu week of 12-27-22.md"
      ],
      "menu_weeks": [
        "2022-12-27"
      ],
      "menu_seasons": [
        "winter"
      ],
      "meal_types": [
        "dinner"
      ],
      "sections": [],
      "source_hints": [],
      "item_texts": [
        "Sweet potato black bean bowls"
      ],
      "count": 1
    },
    {
      "url": null,
      "urls": [],
      "link_texts": [],
      "menu_files": [
        "Menus/Menu week of 12-27-22.md"
      ],
      "menu_weeks": [
        "2022-12-27"
      ],
      "menu_seasons": [
        "winter"
      ],
      "meal_types": [
        "dinner"
      ],
      "sections": [],
      "source_hints": [],
      "item_texts": [
        "Instant Pot Ground beef and pasta"
      ],
      "count": 1
    },
    {
      "url": null,
      "urls": [],
      "link_texts": [],
      "menu_files": [
        "Menus/Menu week of 12-27-22.md"
      ],
      "menu_weeks": [
        "2022-12-27"
      ],
      "menu_seasons": [
        "winter"
      ],
      "meal_types": [
        "dinner"
      ],
      "sections": [],
      "source_hints": [],
      "item_texts": [
        "Tomato soup and fancy bread"
      ],
      "count": 1
    },
    {
      "url": null,
      "urls": [],
      "link_texts": [],
      "menu_files": [
        "Menus/Menu week of 12-27-22.md"
      ],
      "menu_weeks": [
        "2022-12-27"
      ],
      "menu_seasons": [
        "winter"
      ],
      "meal_types": [
        "dinner"
      ],
      "sections": [],
      "source_hints": [],
      "item_texts": [
        "Leftover corned beef sandwiches and bagged salad"
      ],
      "count": 1
    },
    {
      "url": null,
      "urls": [],
      "link_texts": [],
      "menu_files": [
        "Menus/Menu week of 12-27-22.md"
      ],
      "menu_weeks": [
        "2022-12-27"
      ],
      "menu_seasons": [
        "winter"
      ],
      "meal_types": [
        "dinner"
      ],
      "sections": [],
      "source_hints": [],
      "item_texts": [
        "Ang\u2019s Chicken Wraps and roasted broccoli"
      ],
      "count": 1
    },
    {
      "url": null,
      "urls": [],
      "link_texts": [],
      "menu_files": [
        "Menus/Menu week of 12-27-22.md"
      ],
      "menu_weeks": [
        "2022-12-27"
      ],
      "menu_seasons": [
        "winter"
      ],
      "meal_types": [
        "dinner"
      ],
      "sections": [],
      "source_hints": [],
      "item_texts": [
        "Panang Curry"
      ],
      "count": 1
    },
    {
      "url": null,
      "urls": [],
      "link_texts": [],
      "menu_files": [
        "Menus/Menu week of 12-27-22.md"
      ],
      "menu_weeks": [
        "2022-12-27"
      ],
      "menu_seasons": [
        "winter"
      ],
      "meal_types": [
        "dinner"
      ],
      "sections": [],
      "source_hints": [],
      "item_texts": [
        "Orange juice"
      ],
      "count": 1
    },
    {
      "url": null,
      "urls": [],
      "link_texts": [],
      "menu_files": [
        "Menus/Menu week of 12-27-22.md"
      ],
      "menu_weeks": [
        "2022-12-27"
      ],
      "menu_seasons": [
        "winter"
      ],
      "meal_types": [
        "dinner"
      ],
      "sections": [],
      "source_hints": [],
      "item_texts": [
        "Fruit"
      ],
      "count": 1
    },
    {
      "url": null,
      "urls": [],
      "link_texts": [],
      "menu_files": [
        "Menus/Menu week of 12-27-22.md"
      ],
      "menu_weeks": [
        "2022-12-27"
      ],
      "menu_seasons": [
        "winter"
      ],
      "meal_types": [
        "dinner"
      ],
      "sections": [],
      "source_hints": [],
      "item_texts": [
        "Cinnamon rolls"
      ],
      "count": 1
    },
    {
      "url": null,
      "urls": [],
      "link_texts": [],
      "menu_files": [
        "Menus/Menu week of 12-27-22.md"
      ],
      "menu_weeks": [
        "2022-12-27"
      ],
      "menu_seasons": [
        "winter"
      ],
      "meal_types": [
        "dinner"
      ],
      "sections": [],
      "source_hints": [],
      "item_texts": [
        "Bacon, potato, and egg casserole"
      ],
      "count": 1
    },
    {
      "url": null,
      "urls": [],
      "link_texts": [],
      "menu_files": [
        "Menus/Menu week of 12-27-22.md"
      ],
      "menu_weeks": [
        "2022-12-27"
      ],
      "menu_seasons": [
        "winter"
      ],
      "meal_types": [
        "dinner"
      ],
      "sections": [],
      "source_hints": [],
      "item_texts": [
        "Corned beef, cabbage, potatoes"
      ],
      "count": 1
    },
    {
      "url": null,
      "urls": [],
      "link_texts": [],
      "menu_files": [
        "Menus/Menu week of 12-28-23.md"
      ],
      "menu_weeks": [
        "2023-12-28"
      ],
      "menu_seasons": [
        "winter"
      ],
      "meal_types": [
        "dinner"
      ],
      "sections": [],
      "source_hints": [],
      "item_texts": [
        "Crispy chicken tikka bowls"
      ],
      "count": 1
    },
    {
      "url": null,
      "urls": [],
      "link_texts": [],
      "menu_files": [
        "Menus/Menu week of 12-28-23.md"
      ],
      "menu_weeks": [
        "2023-12-28"
      ],
      "menu_seasons": [
        "winter"
      ],
      "meal_types": [
        "dinner"
      ],
      "sections": [],
      "source_hints": [],
      "item_texts": [
        "Gnocchi pesto brussels chicken sausage"
      ],
      "count": 1
    },
    {
      "url": null,
      "urls": [],
      "link_texts": [],
      "menu_files": [
        "Menus/Menu week of 12-28-23.md"
      ],
      "menu_weeks": [
        "2023-12-28"
      ],
      "menu_seasons": [
        "winter"
      ],
      "meal_types": [
        "dinner"
      ],
      "sections": [],
      "source_hints": [],
      "item_texts": [
        "New Year\u2019s Day at Haley\u2019s"
      ],
      "count": 1
    },
    {
      "url": null,
      "urls": [],
      "link_texts": [],
      "menu_files": [
        "Menus/Menu week of 12-28-23.md"
      ],
      "menu_weeks": [
        "2023-12-28"
      ],
      "menu_seasons": [
        "winter"
      ],
      "meal_types": [
        "dinner"
      ],
      "sections": [],
      "source_hints": [],
      "item_texts": [
        "Vegetarian chili"
      ],
      "count": 1
    },
    {
      "url": null,
      "urls": [],
      "link_texts": [],
      "menu_files": [
        "Menus/Menu week of 12-28-23.md"
      ],
      "menu_weeks": [
        "2023-12-28"
      ],
      "menu_seasons": [
        "winter"
      ],
      "meal_types": [
        "dinner"
      ],
      "sections": [],
      "source_hints": [],
      "item_texts": [
        "12/30 Date day"
      ],
      "count": 1
    },
    {
      "url": null,
      "urls": [],
      "link_texts": [],
      "menu_files": [
        "Menus/Menu week of 12-28-23.md"
      ],
      "menu_weeks": [
        "2023-12-28"
      ],
      "menu_seasons": [
        "winter"
      ],
      "meal_types": [
        "dinner"
      ],
      "sections": [],
      "source_hints": [],
      "item_texts": [
        "Roasted cauliflower hummus bowls"
      ],
      "count": 1
    },
    {
      "url": null,
      "urls": [],
      "link_texts": [],
      "menu_files": [
        "Menus/Menu week of 12-3-17.md"
      ],
      "menu_weeks": [
        "2017-12-03"
      ],
      "menu_seasons": [
        "winter"
      ],
      "meal_types": [
        "dinner"
      ],
      "sections": [],
      "source_hints": [],
      "item_texts": [
        "Spaghetti squash pizza boats"
      ],
      "count": 1
    },
    {
      "url": null,
      "urls": [],
      "link_texts": [],
      "menu_files": [
        "Menus/Menu week of 12-3-17.md"
      ],
      "menu_weeks": [
        "2017-12-03"
      ],
      "menu_seasons": [
        "winter"
      ],
      "meal_types": [
        "dinner"
      ],
      "sections": [],
      "source_hints": [],
      "item_texts": [
        "Spring detox cauliflower salad"
      ],
      "count": 1
    },
    {
      "url": null,
      "urls": [],
      "link_texts": [],
      "menu_files": [
        "Menus/Menu week of 12-3-17.md"
      ],
      "menu_weeks": [
        "2017-12-03"
      ],
      "menu_seasons": [
        "winter"
      ],
      "meal_types": [
        "dinner"
      ],
      "sections": [],
      "source_hints": [],
      "item_texts": [
        "Chorizo and butternut squash lentil soup"
      ],
      "count": 1
    },
    {
      "url": null,
      "urls": [],
      "link_texts": [],
      "menu_files": [
        "Menus/Menu week of 12-3-17.md"
      ],
      "menu_weeks": [
        "2017-12-03"
      ],
      "menu_seasons": [
        "winter"
      ],
      "meal_types": [
        "dinner"
      ],
      "sections": [],
      "source_hints": [],
      "item_texts": [
        "Cauliflower walnut burrito bowls"
      ],
      "count": 1
    },
    {
      "url": null,
      "urls": [],
      "link_texts": [],
      "menu_files": [
        "Menus/Menu week of 12-3-17.md"
      ],
      "menu_weeks": [
        "2017-12-03"
      ],
      "menu_seasons": [
        "winter"
      ],
      "meal_types": [
        "dinner"
      ],
      "sections": [],
      "source_hints": [],
      "item_texts": [
        "Baked ham and Swiss sliders, salad with raspberries, spinach, goat cheese"
      ],
      "count": 1
    },
    {
      "url": null,
      "urls": [],
      "link_texts": [],
      "menu_files": [
        "Menus/Menu week of 12-3-22.md"
      ],
      "menu_weeks": [
        "2022-12-03"
      ],
      "menu_seasons": [
        "winter"
      ],
      "meal_types": [
        "dinner"
      ],
      "sections": [],
      "source_hints": [],
      "item_texts": [
        "Cozy veggie korma"
      ],
      "count": 1
    },
    {
      "url": null,
      "urls": [],
      "link_texts": [],
      "menu_files": [
        "Menus/Menu week of 12-3-22.md"
      ],
      "menu_weeks": [
        "2022-12-03"
      ],
      "menu_seasons": [
        "winter"
      ],
      "meal_types": [
        "dinner"
      ],
      "sections": [],
      "source_hints": [
        "use the butcher box chicken nuggets"
      ],
      "item_texts": [
        "Crispy chicken tikka bowls (use the butcher box chicken nuggets)"
      ],
      "count": 1
    },
    {
      "url": null,
      "urls": [],
      "link_texts": [],
      "menu_files": [
        "Menus/Menu week of 12-3-22.md"
      ],
      "menu_weeks": [
        "2022-12-03"
      ],
      "menu_seasons": [
        "winter"
      ],
      "meal_types": [
        "dinner"
      ],
      "sections": [],
      "source_hints": [],
      "item_texts": [
        "Instant pot korean beef tacos"
      ],
      "count": 1
    },
    {
      "url": null,
      "urls": [],
      "link_texts": [],
      "menu_files": [
        "Menus/Menu week of 12-3-22.md"
      ],
      "menu_weeks": [
        "2022-12-03"
      ],
      "menu_seasons": [
        "winter"
      ],
      "meal_types": [
        "dinner"
      ],
      "sections": [],
      "source_hints": [
        "with leftover masala sauce"
      ],
      "item_texts": [
        "Chicken tikka masala (with leftover masala sauce)"
      ],
      "count": 1
    },
    {
      "url": null,
      "urls": [],
      "link_texts": [],
      "menu_files": [
        "Menus/Menu week of 12-3-22.md"
      ],
      "menu_weeks": [
        "2022-12-03"
      ],
      "menu_seasons": [
        "winter"
      ],
      "meal_types": [
        "dinner"
      ],
      "sections": [],
      "source_hints": [
        "pinch of yum"
      ],
      "item_texts": [
        "Red pepper pasta with roasted cauliflower (pinch of yum)"
      ],
      "count": 1
    },
    {
      "url": null,
      "urls": [],
      "link_texts": [],
      "menu_files": [
        "Menus/Menu week of 12-3-22.md"
      ],
      "menu_weeks": [
        "2022-12-03"
      ],
      "menu_seasons": [
        "winter"
      ],
      "meal_types": [
        "dinner"
      ],
      "sections": [],
      "source_hints": [
        "pinch of yum"
      ],
      "item_texts": [
        "Life changing beef stew (pinch of yum)"
      ],
      "count": 1
    },
    {
      "url": null,
      "urls": [],
      "link_texts": [],
      "menu_files": [
        "Menus/Menu week of 12-31-19.md"
      ],
      "menu_weeks": [
        "2019-12-31"
      ],
      "menu_seasons": [
        "winter"
      ],
      "meal_types": [
        "dinner"
      ],
      "sections": [],
      "source_hints": [],
      "item_texts": [
        "Spicy Thai chicken and quinoa, bagged salad"
      ],
      "count": 1
    },
    {
      "url": null,
      "urls": [],
      "link_texts": [],
      "menu_files": [
        "Menus/Menu week of 12-31-19.md"
      ],
      "menu_weeks": [
        "2019-12-31"
      ],
      "menu_seasons": [
        "winter"
      ],
      "meal_types": [
        "dinner"
      ],
      "sections": [],
      "source_hints": [],
      "item_texts": [
        "Instant Pot red curry lentils"
      ],
      "count": 1
    },
    {
      "url": null,
      "urls": [],
      "link_texts": [],
      "menu_files": [
        "Menus/Menu week of 12-31-19.md"
      ],
      "menu_weeks": [
        "2019-12-31"
      ],
      "menu_seasons": [
        "winter"
      ],
      "meal_types": [
        "dinner"
      ],
      "sections": [],
      "source_hints": [],
      "item_texts": [
        "Rosemary Chicken Thighs with Apples and Brussels Sprouts"
      ],
      "count": 1
    },
    {
      "url": null,
      "urls": [],
      "link_texts": [],
      "menu_files": [
        "Menus/Menu week of 12-31-19.md"
      ],
      "menu_weeks": [
        "2019-12-31"
      ],
      "menu_seasons": [
        "winter"
      ],
      "meal_types": [
        "dinner"
      ],
      "sections": [],
      "source_hints": [],
      "item_texts": [
        "Red pepper cashew pasta"
      ],
      "count": 1
    },
    {
      "url": null,
      "urls": [],
      "link_texts": [],
      "menu_files": [
        "Menus/Menu week of 12-31-19.md"
      ],
      "menu_weeks": [
        "2019-12-31"
      ],
      "menu_seasons": [
        "winter"
      ],
      "meal_types": [
        "dinner"
      ],
      "sections": [],
      "source_hints": [],
      "item_texts": [
        "New years: Corned beef and cabbage, roasted yellow potatoes"
      ],
      "count": 1
    },
    {
      "url": null,
      "urls": [],
      "link_texts": [],
      "menu_files": [
        "Menus/Menu week of 12-31-19.md"
      ],
      "menu_weeks": [
        "2019-12-31"
      ],
      "menu_seasons": [
        "winter"
      ],
      "meal_types": [
        "breakfast"
      ],
      "sections": [],
      "source_hints": [],
      "item_texts": [
        "Make Breakfast balls"
      ],
      "count": 1
    },
    {
      "url": null,
      "urls": [],
      "link_texts": [],
      "menu_files": [
        "Menus/Menu week of 12-31-19.md"
      ],
      "menu_weeks": [
        "2019-12-31"
      ],
      "menu_seasons": [
        "winter"
      ],
      "meal_types": [
        "lunch"
      ],
      "sections": [],
      "source_hints": [],
      "item_texts": [
        "Lunch prep: Greek orzo salad in a jar"
      ],
      "count": 1
    },
    {
      "url": null,
      "urls": [],
      "link_texts": [],
      "menu_files": [
        "Menus/Menu week of 12-31-2020.md"
      ],
      "menu_weeks": [
        "2020-12-31"
      ],
      "menu_seasons": [
        "winter"
      ],
      "meal_types": [
        "dinner"
      ],
      "sections": [],
      "source_hints": [
        "slice radishes"
      ],
      "item_texts": [
        "Sweet potato black bean quesadillas (slice radishes)"
      ],
      "count": 1
    },
    {
      "url": null,
      "urls": [],
      "link_texts": [],
      "menu_files": [
        "Menus/Menu week of 12-31-2020.md"
      ],
      "menu_weeks": [
        "2020-12-31"
      ],
      "menu_seasons": [
        "winter"
      ],
      "meal_types": [
        "dinner"
      ],
      "sections": [],
      "source_hints": [],
      "item_texts": [
        "Root vegetable stew and bread"
      ],
      "count": 1
    },
    {
      "url": null,
      "urls": [],
      "link_texts": [],
      "menu_files": [
        "Menus/Menu week of 12-31-2020.md"
      ],
      "menu_weeks": [
        "2020-12-31"
      ],
      "menu_seasons": [
        "winter"
      ],
      "meal_types": [
        "breakfast"
      ],
      "sections": [],
      "source_hints": [],
      "item_texts": [
        "Breakfast: Croque Madame"
      ],
      "count": 1
    },
    {
      "url": null,
      "urls": [],
      "link_texts": [],
      "menu_files": [
        "Menus/Menu week of 12-31-2020.md"
      ],
      "menu_weeks": [
        "2020-12-31"
      ],
      "menu_seasons": [
        "winter"
      ],
      "meal_types": [
        "dinner"
      ],
      "sections": [],
      "source_hints": [],
      "item_texts": [
        "Baby greens salad with goat cheese, beets, and candied pecans"
      ],
      "count": 1
    },
    {
      "url": null,
      "urls": [],
      "link_texts": [],
      "menu_files": [
        "Menus/Menu week of 12-31-2020.md"
      ],
      "menu_weeks": [
        "2020-12-31"
      ],
      "menu_seasons": [
        "winter"
      ],
      "meal_types": [
        "dinner"
      ],
      "sections": [],
      "source_hints": [],
      "item_texts": [
        "Brioche bread"
      ],
      "count": 1
    },
    {
      "url": null,
      "urls": [],
      "link_texts": [],
      "menu_files": [
        "Menus/Menu week of 12-31-2020.md"
      ],
      "menu_weeks": [
        "2020-12-31"
      ],
      "menu_seasons": [
        "winter"
      ],
      "meal_types": [
        "dinner"
      ],
      "sections": [],
      "source_hints": [],
      "item_texts": [
        "Yacon"
      ],
      "count": 1
    },
    {
      "url": null,
      "urls": [],
      "link_texts": [],
      "menu_files": [
        "Menus/Menu week of 12-31-2020.md"
      ],
      "menu_weeks": [
        "2020-12-31"
      ],
      "menu_seasons": [
        "winter"
      ],
      "meal_types": [
        "dinner"
      ],
      "sections": [],
      "source_hints": [],
      "item_texts": [
        "Diakon"
      ],
      "count": 1
    },
    {
      "url": null,
      "urls": [],
      "link_texts": [],
      "menu_files": [
        "Menus/Menu week of 12-31-2020.md"
      ],
      "menu_weeks": [
        "2020-12-31"
      ],
      "menu_seasons": [
        "winter"
      ],
      "meal_types": [
        "dinner"
      ],
      "sections": [],
      "source_hints": [],
      "item_texts": [
        "Radishes"
      ],
      "count": 1
    },
    {
      "url": null,
      "urls": [],
      "link_texts": [],
      "menu_files": [
        "Menus/Menu week of 12-31-2020.md"
      ],
      "menu_weeks": [
        "2020-12-31"
      ],
      "menu_seasons": [
        "winter"
      ],
      "meal_types": [
        "dinner"
      ],
      "sections": [],
      "source_hints": [],
      "item_texts": [
        "Beets"
      ],
      "count": 1
    },
    {
      "url": null,
      "urls": [],
      "link_texts": [],
      "menu_files": [
        "Menus/Menu week of 12-31-2020.md"
      ],
      "menu_weeks": [
        "2020-12-31"
      ],
      "menu_seasons": [
        "winter"
      ],
      "meal_types": [
        "dinner"
      ],
      "sections": [],
      "source_hints": [],
      "item_texts": [
        "Rutabaga"
      ],
      "count": 1
    },
    {
      "url": null,
      "urls": [],
      "link_texts": [],
      "menu_files": [
        "Menus/Menu week of 12-31-2020.md"
      ],
      "menu_weeks": [
        "2020-12-31"
      ],
      "menu_seasons": [
        "winter"
      ],
      "meal_types": [
        "dinner"
      ],
      "sections": [],
      "source_hints": [],
      "item_texts": [
        "Delicata squash"
      ],
      "count": 1
    },
    {
      "url": null,
      "urls": [],
      "link_texts": [],
      "menu_files": [
        "Menus/Menu week of 12-31-2020.md"
      ],
      "menu_weeks": [
        "2020-12-31"
      ],
      "menu_seasons": [
        "winter"
      ],
      "meal_types": [
        "dinner"
      ],
      "sections": [],
      "source_hints": [],
      "item_texts": [
        "Butternut squash"
      ],
      "count": 1
    },
    {
      "url": null,
      "urls": [],
      "link_texts": [],
      "menu_files": [
        "Menus/Menu week of 12-31-2020.md"
      ],
      "menu_weeks": [
        "2020-12-31"
      ],
      "menu_seasons": [
        "winter"
      ],
      "meal_types": [
        "dinner"
      ],
      "sections": [],
      "source_hints": [],
      "item_texts": [
        "Weird ass sweet potatoes"
      ],
      "count": 1
    },
    {
      "url": null,
      "urls": [],
      "link_texts": [],
      "menu_files": [
        "Menus/Menu week of 12-4-18.md"
      ],
      "menu_weeks": [
        "2018-12-04"
      ],
      "menu_seasons": [
        "winter"
      ],
      "meal_types": [
        "dinner"
      ],
      "sections": [],
      "source_hints": [],
      "item_texts": [
        "Tuesday: Chicken Noodle Soup"
      ],
      "count": 1
    },
    {
      "url": null,
      "urls": [],
      "link_texts": [],
      "menu_files": [
        "Menus/Menu week of 12-4-18.md"
      ],
      "menu_weeks": [
        "2018-12-04"
      ],
      "menu_seasons": [
        "winter"
      ],
      "meal_types": [
        "dinner"
      ],
      "sections": [],
      "source_hints": [],
      "item_texts": [
        "Wednesday: bulgar salad"
      ],
      "count": 1
    },
    {
      "url": null,
      "urls": [],
      "link_texts": [],
      "menu_files": [
        "Menus/Menu week of 12-4-18.md"
      ],
      "menu_weeks": [
        "2018-12-04"
      ],
      "menu_seasons": [
        "winter"
      ],
      "meal_types": [
        "dinner"
      ],
      "sections": [],
      "source_hints": [
        "make cous cous"
      ],
      "item_texts": [
        "Thursday: leftover tangine (make cous cous)"
      ],
      "count": 1
    },
    {
      "url": null,
      "urls": [],
      "link_texts": [],
      "menu_files": [
        "Menus/Menu week of 12-4-18.md"
      ],
      "menu_weeks": [
        "2018-12-04"
      ],
      "menu_seasons": [
        "winter"
      ],
      "meal_types": [
        "dinner"
      ],
      "sections": [],
      "source_hints": [],
      "item_texts": [
        "Tamales rice and beans"
      ],
      "count": 1
    },
    {
      "url": null,
      "urls": [],
      "link_texts": [],
      "menu_files": [
        "Menus/Menu week of 12-4-18.md"
      ],
      "menu_weeks": [
        "2018-12-04"
      ],
      "menu_seasons": [
        "winter"
      ],
      "meal_types": [
        "dinner"
      ],
      "sections": [],
      "source_hints": [],
      "item_texts": [
        "4 cheese garlic spaghetti squash and chicken"
      ],
      "count": 1
    },
    {
      "url": null,
      "urls": [],
      "link_texts": [],
      "menu_files": [
        "Menus/Menu week of 12-4-18.md"
      ],
      "menu_weeks": [
        "2018-12-04"
      ],
      "menu_seasons": [
        "winter"
      ],
      "meal_types": [
        "dinner"
      ],
      "sections": [],
      "source_hints": [],
      "item_texts": [
        "Ribeye steaks, purple potatoes, and green beans"
      ],
      "count": 1
    },
    {
      "url": null,
      "urls": [],
      "link_texts": [],
      "menu_files": [
        "Menus/Menu week of 12-4-25.md"
      ],
      "menu_weeks": [
        "2025-12-04"
      ],
      "menu_seasons": [
        "winter"
      ],
      "meal_types": [
        "dinner"
      ],
      "sections": [],
      "source_hints": [],
      "item_texts": [
        "Chicken nuggets, sweet potato fries, broccoli salad"
      ],
      "count": 1
    },
    {
      "url": null,
      "urls": [],
      "link_texts": [],
      "menu_files": [
        "Menus/Menu week of 12-7-19.md"
      ],
      "menu_weeks": [
        "2019-12-07"
      ],
      "menu_seasons": [
        "winter"
      ],
      "meal_types": [
        "dinner"
      ],
      "sections": [],
      "source_hints": [],
      "item_texts": [
        "Vegetarian chili"
      ],
      "count": 1
    },
    {
      "url": null,
      "urls": [],
      "link_texts": [],
      "menu_files": [
        "Menus/Menu week of 12-7-19.md"
      ],
      "menu_weeks": [
        "2019-12-07"
      ],
      "menu_seasons": [
        "winter"
      ],
      "meal_types": [
        "dinner"
      ],
      "sections": [],
      "source_hints": [],
      "item_texts": [
        "Spaghetti squash pizza boats"
      ],
      "count": 1
    },
    {
      "url": null,
      "urls": [],
      "link_texts": [],
      "menu_files": [
        "Menus/Menu week of 12-7-19.md"
      ],
      "menu_weeks": [
        "2019-12-07"
      ],
      "menu_seasons": [
        "winter"
      ],
      "meal_types": [
        "dinner"
      ],
      "sections": [],
      "source_hints": [],
      "item_texts": [
        "Gnocchi and zucchini and squash"
      ],
      "count": 1
    },
    {
      "url": null,
      "urls": [],
      "link_texts": [],
      "menu_files": [
        "Menus/Menu week of 12-7-20.md"
      ],
      "menu_weeks": [
        "2020-12-07"
      ],
      "menu_seasons": [
        "winter"
      ],
      "meal_types": [
        "dinner"
      ],
      "sections": [],
      "source_hints": [],
      "item_texts": [
        "Daikon with Chicken in yuzu sauce x2"
      ],
      "count": 1
    },
    {
      "url": null,
      "urls": [],
      "link_texts": [],
      "menu_files": [
        "Menus/Menu week of 12-7-20.md"
      ],
      "menu_weeks": [
        "2020-12-07"
      ],
      "menu_seasons": [
        "winter"
      ],
      "meal_types": [
        "dinner"
      ],
      "sections": [],
      "source_hints": [],
      "item_texts": [
        "Steak, roasted beets, purple potatoes"
      ],
      "count": 1
    },
    {
      "url": null,
      "urls": [],
      "link_texts": [],
      "menu_files": [
        "Menus/Menu week of 12-7-20.md"
      ],
      "menu_weeks": [
        "2020-12-07"
      ],
      "menu_seasons": [
        "winter"
      ],
      "meal_types": [
        "dinner"
      ],
      "sections": [],
      "source_hints": [],
      "item_texts": [
        "Coconut lentil curry with rainbow chard"
      ],
      "count": 1
    },
    {
      "url": null,
      "urls": [],
      "link_texts": [],
      "menu_files": [
        "Menus/Menu week of 12-7-20.md"
      ],
      "menu_weeks": [
        "2020-12-07"
      ],
      "menu_seasons": [
        "winter"
      ],
      "meal_types": [
        "dinner"
      ],
      "sections": [],
      "source_hints": [],
      "item_texts": [
        "Roasted delicata squash salad"
      ],
      "count": 1
    },
    {
      "url": null,
      "urls": [],
      "link_texts": [],
      "menu_files": [
        "Menus/Menu week of 12-8-21.md"
      ],
      "menu_weeks": [
        "2021-12-08"
      ],
      "menu_seasons": [
        "winter"
      ],
      "meal_types": [
        "dinner"
      ],
      "sections": [],
      "source_hints": [],
      "item_texts": [
        "Blue Apron meal #4"
      ],
      "count": 1
    },
    {
      "url": null,
      "urls": [],
      "link_texts": [],
      "menu_files": [
        "Menus/Menu week of 12-8-21.md"
      ],
      "menu_weeks": [
        "2021-12-08"
      ],
      "menu_seasons": [
        "winter"
      ],
      "meal_types": [
        "dinner"
      ],
      "sections": [],
      "source_hints": [],
      "item_texts": [
        "Blue Apron meal #3"
      ],
      "count": 1
    },
    {
      "url": null,
      "urls": [],
      "link_texts": [],
      "menu_files": [
        "Menus/Menu week of 12-8-21.md"
      ],
      "menu_weeks": [
        "2021-12-08"
      ],
      "menu_seasons": [
        "winter"
      ],
      "meal_types": [
        "dinner"
      ],
      "sections": [],
      "source_hints": [],
      "item_texts": [
        "Blue Apron meal #2"
      ],
      "count": 1
    },
    {
      "url": null,
      "urls": [],
      "link_texts": [],
      "menu_files": [
        "Menus/Menu week of 12-8-21.md"
      ],
      "menu_weeks": [
        "2021-12-08"
      ],
      "menu_seasons": [
        "winter"
      ],
      "meal_types": [
        "dinner"
      ],
      "sections": [],
      "source_hints": [],
      "item_texts": [
        "Blue Apron meal #1"
      ],
      "count": 1
    },
    {
      "url": null,
      "urls": [],
      "link_texts": [],
      "menu_files": [
        "Menus/Menu week of 2-14-19.md"
      ],
      "menu_weeks": [
        "2019-02-14"
      ],
      "menu_seasons": [
        "winter"
      ],
      "meal_types": [
        "dinner"
      ],
      "sections": [],
      "source_hints": [],
      "item_texts": [
        "Steak and roasted root vegetables"
      ],
      "count": 1
    },
    {
      "url": null,
      "urls": [],
      "link_texts": [],
      "menu_files": [
        "Menus/Menu week of 2-14-19.md"
      ],
      "menu_weeks": [
        "2019-02-14"
      ],
      "menu_seasons": [
        "winter"
      ],
      "meal_types": [
        "dinner"
      ],
      "sections": [],
      "source_hints": [],
      "item_texts": [
        "Greek quinoa salad"
      ],
      "count": 1
    },
    {
      "url": null,
      "urls": [],
      "link_texts": [],
      "menu_files": [
        "Menus/Menu week of 2-14-19.md"
      ],
      "menu_weeks": [
        "2019-02-14"
      ],
      "menu_seasons": [
        "winter"
      ],
      "meal_types": [
        "dinner"
      ],
      "sections": [],
      "source_hints": [],
      "item_texts": [
        "Bucatini all\u2019Amatriciana"
      ],
      "count": 1
    },
    {
      "url": null,
      "urls": [],
      "link_texts": [],
      "menu_files": [
        "Menus/Menu week of 2-14-19.md"
      ],
      "menu_weeks": [
        "2019-02-14"
      ],
      "menu_seasons": [
        "winter"
      ],
      "meal_types": [
        "dinner"
      ],
      "sections": [],
      "source_hints": [],
      "item_texts": [
        "Autumn wild rice soup (slow cooker) and spinach salad"
      ],
      "count": 1
    },
    {
      "url": null,
      "urls": [],
      "link_texts": [],
      "menu_files": [
        "Menus/Menu week of 2-14-19.md"
      ],
      "menu_weeks": [
        "2019-02-14"
      ],
      "menu_seasons": [
        "winter"
      ],
      "meal_types": [
        "dinner"
      ],
      "sections": [],
      "source_hints": [],
      "item_texts": [
        "Pepperoncini chicken noodle soup"
      ],
      "count": 1
    },
    {
      "url": null,
      "urls": [],
      "link_texts": [],
      "menu_files": [
        "Menus/Menu week of 2-14-19.md"
      ],
      "menu_weeks": [
        "2019-02-14"
      ],
      "menu_seasons": [
        "winter"
      ],
      "meal_types": [
        "dinner"
      ],
      "sections": [],
      "source_hints": [],
      "item_texts": [
        "Egg roll bowls"
      ],
      "count": 1
    },
    {
      "url": null,
      "urls": [],
      "link_texts": [],
      "menu_files": [
        "Menus/Menu week of 2-14-19.md"
      ],
      "menu_weeks": [
        "2019-02-14"
      ],
      "menu_seasons": [
        "winter"
      ],
      "meal_types": [
        "dinner"
      ],
      "sections": [],
      "source_hints": [],
      "item_texts": [
        "Pizza"
      ],
      "count": 1
    },
    {
      "url": null,
      "urls": [],
      "link_texts": [],
      "menu_files": [
        "Menus/Menu week of 2-14-19.md"
      ],
      "menu_weeks": [
        "2019-02-14"
      ],
      "menu_seasons": [
        "winter"
      ],
      "meal_types": [
        "dinner"
      ],
      "sections": [],
      "source_hints": [],
      "item_texts": [
        "Instant pot chicken tikka masala"
      ],
      "count": 1
    },
    {
      "url": null,
      "urls": [],
      "link_texts": [],
      "menu_files": [
        "Menus/Menu week of 2-16-24.md"
      ],
      "menu_weeks": [
        "2024-02-16"
      ],
      "menu_seasons": [
        "winter"
      ],
      "meal_types": [
        "dinner"
      ],
      "sections": [],
      "source_hints": [
        "damn delicious"
      ],
      "item_texts": [
        "Instant pot ground beef and pasta (damn delicious)"
      ],
      "count": 1
    },
    {
      "url": null,
      "urls": [],
      "link_texts": [],
      "menu_files": [
        "Menus/Menu week of 2-16-24.md"
      ],
      "menu_weeks": [
        "2024-02-16"
      ],
      "menu_seasons": [
        "winter"
      ],
      "meal_types": [
        "dinner"
      ],
      "sections": [],
      "source_hints": [],
      "item_texts": [
        "Chicago hot dogs and salad"
      ],
      "count": 1
    },
    {
      "url": null,
      "urls": [],
      "link_texts": [],
      "menu_files": [
        "Menus/Menu week of 2-16-24.md"
      ],
      "menu_weeks": [
        "2024-02-16"
      ],
      "menu_seasons": [
        "winter"
      ],
      "meal_types": [
        "dinner"
      ],
      "sections": [],
      "source_hints": [],
      "item_texts": [
        "Chicken tenders, broccoli, sweet potato fries"
      ],
      "count": 1
    },
    {
      "url": null,
      "urls": [],
      "link_texts": [],
      "menu_files": [
        "Menus/Menu week of 2-16-24.md"
      ],
      "menu_weeks": [
        "2024-02-16"
      ],
      "menu_seasons": [
        "winter"
      ],
      "meal_types": [
        "dinner"
      ],
      "sections": [],
      "source_hints": [],
      "item_texts": [
        "5 ingredient tomato soup (Pinch of Yum) and grilled cheese"
      ],
      "count": 1
    },
    {
      "url": null,
      "urls": [],
      "link_texts": [],
      "menu_files": [
        "Menus/Menu week of 2-16-24.md"
      ],
      "menu_weeks": [
        "2024-02-16"
      ],
      "menu_seasons": [
        "winter"
      ],
      "meal_types": [
        "dinner"
      ],
      "sections": [],
      "source_hints": [
        "Half Baked Harvest"
      ],
      "item_texts": [
        "Sheet Pan Chicken Tzatziki and sweet potatoes (Half Baked Harvest)"
      ],
      "count": 1
    },
    {
      "url": null,
      "urls": [],
      "link_texts": [],
      "menu_files": [
        "Menus/Menu week of 2-19-18.md"
      ],
      "menu_weeks": [
        "2018-02-19"
      ],
      "menu_seasons": [
        "winter"
      ],
      "meal_types": [
        "dinner"
      ],
      "sections": [],
      "source_hints": [],
      "item_texts": [
        "Cilantro lime chicken meatball bowls"
      ],
      "count": 1
    },
    {
      "url": null,
      "urls": [],
      "link_texts": [],
      "menu_files": [
        "Menus/Menu week of 2-19-18.md"
      ],
      "menu_weeks": [
        "2018-02-19"
      ],
      "menu_seasons": [
        "winter"
      ],
      "meal_types": [
        "dinner"
      ],
      "sections": [],
      "source_hints": [],
      "item_texts": [
        "One pan broccoli quinoa skillet"
      ],
      "count": 1
    },
    {
      "url": null,
      "urls": [],
      "link_texts": [],
      "menu_files": [
        "Menus/Menu week of 2-19-18.md"
      ],
      "menu_weeks": [
        "2018-02-19"
      ],
      "menu_seasons": [
        "winter"
      ],
      "meal_types": [
        "dinner"
      ],
      "sections": [],
      "source_hints": [],
      "item_texts": [
        "Saturday: slow cooker beef stroganoff"
      ],
      "count": 1
    },
    {
      "url": null,
      "urls": [],
      "link_texts": [],
      "menu_files": [
        "Menus/Menu week of 2-19-18.md"
      ],
      "menu_weeks": [
        "2018-02-19"
      ],
      "menu_seasons": [
        "winter"
      ],
      "meal_types": [
        "dinner"
      ],
      "sections": [],
      "source_hints": [],
      "item_texts": [
        "5 ingredient green curry"
      ],
      "count": 1
    },
    {
      "url": null,
      "urls": [],
      "link_texts": [],
      "menu_files": [
        "Menus/Menu week of 2-19-18.md"
      ],
      "menu_weeks": [
        "2018-02-19"
      ],
      "menu_seasons": [
        "winter"
      ],
      "meal_types": [
        "dinner"
      ],
      "sections": [],
      "source_hints": [],
      "item_texts": [
        "Cauliflower, potato, and green pea daal"
      ],
      "count": 1
    },
    {
      "url": null,
      "urls": [],
      "link_texts": [],
      "menu_files": [
        "Menus/Menu week of 2-2-24.md"
      ],
      "menu_weeks": [
        "2024-02-02"
      ],
      "menu_seasons": [
        "winter"
      ],
      "meal_types": [
        "dinner"
      ],
      "sections": [],
      "source_hints": [
        "Dishing Out Health"
      ],
      "item_texts": [
        "BBQ Ranch Chickpea Quinoa bowls (Dishing Out Health)"
      ],
      "count": 1
    },
    {
      "url": null,
      "urls": [],
      "link_texts": [],
      "menu_files": [
        "Menus/Menu week of 2-2-24.md"
      ],
      "menu_weeks": [
        "2024-02-02"
      ],
      "menu_seasons": [
        "winter"
      ],
      "meal_types": [
        "dinner"
      ],
      "sections": [],
      "source_hints": [],
      "item_texts": [
        "Classic chili"
      ],
      "count": 1
    },
    {
      "url": null,
      "urls": [],
      "link_texts": [],
      "menu_files": [
        "Menus/Menu week of 2-2-24.md"
      ],
      "menu_weeks": [
        "2024-02-02"
      ],
      "menu_seasons": [
        "winter"
      ],
      "meal_types": [
        "dinner"
      ],
      "sections": [],
      "source_hints": [],
      "item_texts": [
        "Red pepper cashew pasta with cauliflower"
      ],
      "count": 1
    },
    {
      "url": null,
      "urls": [],
      "link_texts": [],
      "menu_files": [
        "Menus/Menu week of 2-2-24.md"
      ],
      "menu_weeks": [
        "2024-02-02"
      ],
      "menu_seasons": [
        "winter"
      ],
      "meal_types": [
        "dinner"
      ],
      "sections": [],
      "source_hints": [
        "Mel\u2019s kitchen cafe"
      ],
      "item_texts": [
        "Easy Chicken Enchilada Casserole (Mel\u2019s kitchen cafe)"
      ],
      "count": 1
    },
    {
      "url": null,
      "urls": [],
      "link_texts": [],
      "menu_files": [
        "Menus/Menu week of 2-20-23.md"
      ],
      "menu_weeks": [
        "2023-02-20"
      ],
      "menu_seasons": [
        "winter"
      ],
      "meal_types": [
        "dinner"
      ],
      "sections": [],
      "source_hints": [
        "Pinch of yum"
      ],
      "item_texts": [
        "Chopped thai salad (Pinch of yum)"
      ],
      "count": 1
    },
    {
      "url": null,
      "urls": [],
      "link_texts": [],
      "menu_files": [
        "Menus/Menu week of 2-20-23.md"
      ],
      "menu_weeks": [
        "2023-02-20"
      ],
      "menu_seasons": [
        "winter"
      ],
      "meal_types": [
        "dinner"
      ],
      "sections": [],
      "source_hints": [],
      "item_texts": [
        "Saucy gochujang noodles"
      ],
      "count": 1
    },
    {
      "url": null,
      "urls": [],
      "link_texts": [],
      "menu_files": [
        "Menus/Menu week of 2-20-23.md"
      ],
      "menu_weeks": [
        "2023-02-20"
      ],
      "menu_seasons": [
        "winter"
      ],
      "meal_types": [
        "dinner"
      ],
      "sections": [],
      "source_hints": [],
      "item_texts": [
        "Kimchi grilled cheese"
      ],
      "count": 1
    },
    {
      "url": null,
      "urls": [],
      "link_texts": [],
      "menu_files": [
        "Menus/Menu week of 2-20-23.md"
      ],
      "menu_weeks": [
        "2023-02-20"
      ],
      "menu_seasons": [
        "winter"
      ],
      "meal_types": [
        "dinner"
      ],
      "sections": [],
      "source_hints": [],
      "item_texts": [
        "Cauliflower soup"
      ],
      "count": 1
    },
    {
      "url": null,
      "urls": [],
      "link_texts": [],
      "menu_files": [
        "Menus/Menu week of 2-20-23.md"
      ],
      "menu_weeks": [
        "2023-02-20"
      ],
      "menu_seasons": [
        "winter"
      ],
      "meal_types": [
        "dinner"
      ],
      "sections": [],
      "source_hints": [],
      "item_texts": [
        "Instant pot ground beef and pasta"
      ],
      "count": 1
    },
    {
      "url": null,
      "urls": [],
      "link_texts": [],
      "menu_files": [
        "Menus/Menu week of 2-20-23.md"
      ],
      "menu_weeks": [
        "2023-02-20"
      ],
      "menu_seasons": [
        "winter"
      ],
      "meal_types": [
        "dinner"
      ],
      "sections": [],
      "source_hints": [],
      "item_texts": [
        "Order pizza one night"
      ],
      "count": 1
    },
    {
      "url": null,
      "urls": [],
      "link_texts": [],
      "menu_files": [
        "Menus/Menu week of 2-20-23.md"
      ],
      "menu_weeks": [
        "2023-02-20"
      ],
      "menu_seasons": [
        "winter"
      ],
      "meal_types": [
        "dinner"
      ],
      "sections": [],
      "source_hints": [
        "Thursday"
      ],
      "item_texts": [
        "Quick and easy lentil quesadillas with Magic green sauce (Thursday)"
      ],
      "count": 1
    },
    {
      "url": null,
      "urls": [],
      "link_texts": [],
      "menu_files": [
        "Menus/Menu week of 2-23-20.md"
      ],
      "menu_weeks": [
        "2020-02-23"
      ],
      "menu_seasons": [
        "winter"
      ],
      "meal_types": [
        "dinner"
      ],
      "sections": [],
      "source_hints": [
        "vegetarian"
      ],
      "item_texts": [
        "Sweet potato black bean quesadillas (vegetarian)"
      ],
      "count": 1
    },
    {
      "url": null,
      "urls": [],
      "link_texts": [],
      "menu_files": [
        "Menus/Menu week of 2-23-20.md"
      ],
      "menu_weeks": [
        "2020-02-23"
      ],
      "menu_seasons": [
        "winter"
      ],
      "meal_types": [
        "dinner"
      ],
      "sections": [],
      "source_hints": [],
      "item_texts": [
        "Buffalo chicken wontons and apples"
      ],
      "count": 1
    },
    {
      "url": null,
      "urls": [],
      "link_texts": [],
      "menu_files": [
        "Menus/Menu week of 2-23-20.md"
      ],
      "menu_weeks": [
        "2020-02-23"
      ],
      "menu_seasons": [
        "winter"
      ],
      "meal_types": [
        "dinner"
      ],
      "sections": [],
      "source_hints": [
        "vegetarian"
      ],
      "item_texts": [
        "Mediterranean cous cous bowls (vegetarian)"
      ],
      "count": 1
    },
    {
      "url": null,
      "urls": [],
      "link_texts": [],
      "menu_files": [
        "Menus/Menu week of 2-23-20.md"
      ],
      "menu_weeks": [
        "2020-02-23"
      ],
      "menu_seasons": [
        "winter"
      ],
      "meal_types": [
        "dinner"
      ],
      "sections": [],
      "source_hints": [
        "use red potatoes also"
      ],
      "item_texts": [
        "Rosemary chicken thighs with apples and brussels sprouts (use red potatoes also)"
      ],
      "count": 1
    },
    {
      "url": null,
      "urls": [],
      "link_texts": [],
      "menu_files": [
        "Menus/Menu week of 2-23-20.md"
      ],
      "menu_weeks": [
        "2020-02-23"
      ],
      "menu_seasons": [
        "winter"
      ],
      "meal_types": [
        "dinner"
      ],
      "sections": [],
      "source_hints": [
        "vegetarian"
      ],
      "item_texts": [
        "Bulgar salad (vegetarian)"
      ],
      "count": 1
    },
    {
      "url": null,
      "urls": [],
      "link_texts": [],
      "menu_files": [
        "Menus/Menu week of 2-23-20.md"
      ],
      "menu_weeks": [
        "2020-02-23"
      ],
      "menu_seasons": [
        "winter"
      ],
      "meal_types": [
        "dinner"
      ],
      "sections": [],
      "source_hints": [
        "vegetarian"
      ],
      "item_texts": [
        "Ash Wednesday: Black bean soup (vegetarian)"
      ],
      "count": 1
    },
    {
      "url": null,
      "urls": [],
      "link_texts": [],
      "menu_files": [
        "Menus/Menu week of 2-23-20.md"
      ],
      "menu_weeks": [
        "2020-02-23"
      ],
      "menu_seasons": [
        "winter"
      ],
      "meal_types": [
        "dinner"
      ],
      "sections": [],
      "source_hints": [
        "vegetarian"
      ],
      "item_texts": [
        "Peanut noodles with roasted broccoli (vegetarian)"
      ],
      "count": 1
    },
    {
      "url": null,
      "urls": [],
      "link_texts": [],
      "menu_files": [
        "Menus/Menu week of 2-23-20.md"
      ],
      "menu_weeks": [
        "2020-02-23"
      ],
      "menu_seasons": [
        "winter"
      ],
      "meal_types": [
        "dinner"
      ],
      "sections": [],
      "source_hints": [],
      "item_texts": [
        "Instant Pot Pot roast"
      ],
      "count": 1
    },
    {
      "url": null,
      "urls": [],
      "link_texts": [],
      "menu_files": [
        "Menus/Menu week of 2-23-21.md"
      ],
      "menu_weeks": [
        "2021-02-23"
      ],
      "menu_seasons": [
        "winter"
      ],
      "meal_types": [
        "dinner"
      ],
      "sections": [],
      "source_hints": [],
      "item_texts": [
        "Black bean soup with cilantro-lime rice, avocado and quick pico"
      ],
      "count": 1
    },
    {
      "url": null,
      "urls": [],
      "link_texts": [],
      "menu_files": [
        "Menus/Menu week of 2-23-21.md"
      ],
      "menu_weeks": [
        "2021-02-23"
      ],
      "menu_seasons": [
        "winter"
      ],
      "meal_types": [
        "dinner"
      ],
      "sections": [],
      "source_hints": [],
      "item_texts": [
        "Whole wheat Pasta Salad with Salmon, tomatoes, and herb dressing"
      ],
      "count": 1
    },
    {
      "url": null,
      "urls": [],
      "link_texts": [],
      "menu_files": [
        "Menus/Menu week of 2-27-22.md"
      ],
      "menu_weeks": [
        "2022-02-27"
      ],
      "menu_seasons": [
        "winter"
      ],
      "meal_types": [
        "dinner"
      ],
      "sections": [],
      "source_hints": [],
      "item_texts": [
        "Friday (Lent) - sweet potato tacos"
      ],
      "count": 1
    },
    {
      "url": null,
      "urls": [],
      "link_texts": [],
      "menu_files": [
        "Menus/Menu week of 2-27-22.md"
      ],
      "menu_weeks": [
        "2022-02-27"
      ],
      "menu_seasons": [
        "winter"
      ],
      "meal_types": [
        "dinner"
      ],
      "sections": [],
      "source_hints": [],
      "item_texts": [
        "Sunday - steaks"
      ],
      "count": 1
    },
    {
      "url": null,
      "urls": [],
      "link_texts": [],
      "menu_files": [
        "Menus/Menu week of 2-27-22.md"
      ],
      "menu_weeks": [
        "2022-02-27"
      ],
      "menu_seasons": [
        "winter"
      ],
      "meal_types": [
        "dinner"
      ],
      "sections": [],
      "source_hints": [],
      "item_texts": [
        "Tuesday - Fat Tuesday order out"
      ],
      "count": 1
    },
    {
      "url": null,
      "urls": [],
      "link_texts": [],
      "menu_files": [
        "Menus/Menu week of 2-27-22.md"
      ],
      "menu_weeks": [
        "2022-02-27"
      ],
      "menu_seasons": [
        "winter"
      ],
      "meal_types": [
        "dinner"
      ],
      "sections": [],
      "source_hints": [
        "use frozen tomatoes"
      ],
      "item_texts": [
        "Wednesday (Ash) - vegetarian chili, salad, bread (use frozen tomatoes)"
      ],
      "count": 1
    },
    {
      "url": null,
      "urls": [],
      "link_texts": [],
      "menu_files": [
        "Menus/Menu week of 2-27-22.md"
      ],
      "menu_weeks": [
        "2022-02-27"
      ],
      "menu_seasons": [
        "winter"
      ],
      "meal_types": [
        "dinner"
      ],
      "sections": [],
      "source_hints": [],
      "item_texts": [
        "Thursday -Seared chicken and sherry pan sauce"
      ],
      "count": 1
    },
    {
      "url": null,
      "urls": [],
      "link_texts": [],
      "menu_files": [
        "Menus/Menu week of 2-27-22.md"
      ],
      "menu_weeks": [
        "2022-02-27"
      ],
      "menu_seasons": [
        "winter"
      ],
      "meal_types": [
        "dinner"
      ],
      "sections": [],
      "source_hints": [],
      "item_texts": [
        "Chicken meatballs with peppers and orzo"
      ],
      "count": 1
    },
    {
      "url": null,
      "urls": [],
      "link_texts": [],
      "menu_files": [
        "Menus/Menu week of 2-27-22.md"
      ],
      "menu_weeks": [
        "2022-02-27"
      ],
      "menu_seasons": [
        "winter"
      ],
      "meal_types": [
        "dinner"
      ],
      "sections": [],
      "source_hints": [],
      "item_texts": [
        "Pork chorizo and fig bake"
      ],
      "count": 1
    },
    {
      "url": null,
      "urls": [],
      "link_texts": [],
      "menu_files": [
        "Menus/Menu week of 2-27-22.md"
      ],
      "menu_weeks": [
        "2022-02-27"
      ],
      "menu_seasons": [
        "winter"
      ],
      "meal_types": [
        "dinner"
      ],
      "sections": [],
      "source_hints": [],
      "item_texts": [
        "Miso butter steaks and rice"
      ],
      "count": 1
    },
    {
      "url": null,
      "urls": [],
      "link_texts": [],
      "menu_files": [
        "Menus/Menu week of 2-27-25.md"
      ],
      "menu_weeks": [
        "2025-02-27"
      ],
      "menu_seasons": [
        "winter"
      ],
      "meal_types": [
        "dinner"
      ],
      "sections": [],
      "source_hints": [],
      "item_texts": [
        "Chicken nuggets, broccoli, sweet potato fries"
      ],
      "count": 1
    },
    {
      "url": null,
      "urls": [],
      "link_texts": [],
      "menu_files": [
        "Menus/Menu week of 2-27-25.md"
      ],
      "menu_weeks": [
        "2025-02-27"
      ],
      "menu_seasons": [
        "winter"
      ],
      "meal_types": [
        "dinner"
      ],
      "sections": [],
      "source_hints": [],
      "item_texts": [
        "Chili"
      ],
      "count": 1
    },
    {
      "url": null,
      "urls": [],
      "link_texts": [],
      "menu_files": [
        "Menus/Menu week of 2-29-24.md"
      ],
      "menu_weeks": [
        "2024-02-29"
      ],
      "menu_seasons": [
        "winter"
      ],
      "meal_types": [
        "dinner"
      ],
      "sections": [],
      "source_hints": [
        "Pinch of Yum"
      ],
      "item_texts": [
        "Instant pot Chicken and Dumplings (Pinch of Yum)"
      ],
      "count": 1
    },
    {
      "url": null,
      "urls": [],
      "link_texts": [],
      "menu_files": [
        "Menus/Menu week of 2-29-24.md"
      ],
      "menu_weeks": [
        "2024-02-29"
      ],
      "menu_seasons": [
        "winter"
      ],
      "meal_types": [
        "dinner"
      ],
      "sections": [],
      "source_hints": [
        "Cookie and Kate"
      ],
      "item_texts": [
        "Vegetarian Chili (Cookie and Kate)"
      ],
      "count": 1
    },
    {
      "url": null,
      "urls": [],
      "link_texts": [],
      "menu_files": [
        "Menus/Menu week of 2-29-24.md"
      ],
      "menu_weeks": [
        "2024-02-29"
      ],
      "menu_seasons": [
        "winter"
      ],
      "meal_types": [
        "dinner"
      ],
      "sections": [],
      "source_hints": [
        "Half Baked Harvest"
      ],
      "item_texts": [
        "Lemon Brown Butter Salmon (Half Baked Harvest)"
      ],
      "count": 1
    },
    {
      "url": null,
      "urls": [],
      "link_texts": [],
      "menu_files": [
        "Menus/Menu week of 2-29-24.md"
      ],
      "menu_weeks": [
        "2024-02-29"
      ],
      "menu_seasons": [
        "winter"
      ],
      "meal_types": [
        "dinner"
      ],
      "sections": [],
      "source_hints": [],
      "item_texts": [
        "Instant pot Italian beef sandwiches (Pinch of Yum) and Veggie chips"
      ],
      "count": 1
    },
    {
      "url": null,
      "urls": [],
      "link_texts": [],
      "menu_files": [
        "Menus/Menu week of 2-29-24.md"
      ],
      "menu_weeks": [
        "2024-02-29"
      ],
      "menu_seasons": [
        "winter"
      ],
      "meal_types": [
        "dinner"
      ],
      "sections": [],
      "source_hints": [
        "Well Plated"
      ],
      "item_texts": [
        "Chicken broccoli alfredo (Well Plated)"
      ],
      "count": 1
    },
    {
      "url": null,
      "urls": [],
      "link_texts": [],
      "menu_files": [
        "Menus/Menu week of 2-6-21.md"
      ],
      "menu_weeks": [
        "2021-02-06"
      ],
      "menu_seasons": [
        "winter"
      ],
      "meal_types": [
        "dinner"
      ],
      "sections": [],
      "source_hints": [],
      "item_texts": [
        "Homemade vegetarian chili"
      ],
      "count": 1
    },
    {
      "url": null,
      "urls": [],
      "link_texts": [],
      "menu_files": [
        "Menus/Menu week of 2-6-21.md"
      ],
      "menu_weeks": [
        "2021-02-06"
      ],
      "menu_seasons": [
        "winter"
      ],
      "meal_types": [
        "dinner"
      ],
      "sections": [],
      "source_hints": [
        "Crockpot"
      ],
      "item_texts": [
        "Butternut squash tortellini (Crockpot)"
      ],
      "count": 1
    },
    {
      "url": null,
      "urls": [],
      "link_texts": [],
      "menu_files": [
        "Menus/Menu week of 2-6-21.md"
      ],
      "menu_weeks": [
        "2021-02-06"
      ],
      "menu_seasons": [
        "winter"
      ],
      "meal_types": [
        "dinner"
      ],
      "sections": [],
      "source_hints": [],
      "item_texts": [
        "Valentine\u2019s Day: Sage Lemon Butter Chicken Piccata with Mashed Cauliflower"
      ],
      "count": 1
    },
    {
      "url": null,
      "urls": [],
      "link_texts": [],
      "menu_files": [
        "Menus/Menu week of 2-6-21.md"
      ],
      "menu_weeks": [
        "2021-02-06"
      ],
      "menu_seasons": [
        "winter"
      ],
      "meal_types": [
        "dinner"
      ],
      "sections": [],
      "source_hints": [],
      "item_texts": [
        "Quick and easy lentil quesadillas (crockpot) and magic green sauce"
      ],
      "count": 1
    },
    {
      "url": null,
      "urls": [],
      "link_texts": [],
      "menu_files": [
        "Menus/Menu week of 2-6-21.md"
      ],
      "menu_weeks": [
        "2021-02-06"
      ],
      "menu_seasons": [
        "winter"
      ],
      "meal_types": [
        "dinner"
      ],
      "sections": [],
      "source_hints": [],
      "item_texts": [
        "Sheet pan chicken pitas with tzatziki"
      ],
      "count": 1
    },
    {
      "url": null,
      "urls": [],
      "link_texts": [],
      "menu_files": [
        "Menus/Menu week of 2-6-23.md"
      ],
      "menu_weeks": [
        "2023-02-06"
      ],
      "menu_seasons": [
        "winter"
      ],
      "meal_types": [
        "dinner"
      ],
      "sections": [],
      "source_hints": [],
      "item_texts": [
        "Sesame beef and broccoli"
      ],
      "count": 1
    },
    {
      "url": null,
      "urls": [],
      "link_texts": [],
      "menu_files": [
        "Menus/Menu week of 2-6-23.md"
      ],
      "menu_weeks": [
        "2023-02-06"
      ],
      "menu_seasons": [
        "winter"
      ],
      "meal_types": [
        "dinner"
      ],
      "sections": [],
      "source_hints": [],
      "item_texts": [
        "Brussels sprouts tacos"
      ],
      "count": 1
    },
    {
      "url": null,
      "urls": [],
      "link_texts": [],
      "menu_files": [
        "Menus/Menu week of 2-6-23.md"
      ],
      "menu_weeks": [
        "2023-02-06"
      ],
      "menu_seasons": [
        "winter"
      ],
      "meal_types": [
        "dinner"
      ],
      "sections": [],
      "source_hints": [],
      "item_texts": [
        "Crockpot chili"
      ],
      "count": 1
    },
    {
      "url": null,
      "urls": [],
      "link_texts": [],
      "menu_files": [
        "Menus/Menu week of 2-6-23.md"
      ],
      "menu_weeks": [
        "2023-02-06"
      ],
      "menu_seasons": [
        "winter"
      ],
      "meal_types": [
        "dinner"
      ],
      "sections": [],
      "source_hints": [],
      "item_texts": [
        "Creamy red pepper pasta"
      ],
      "count": 1
    },
    {
      "url": null,
      "urls": [],
      "link_texts": [],
      "menu_files": [
        "Menus/Menu week of 2-6-23.md"
      ],
      "menu_weeks": [
        "2023-02-06"
      ],
      "menu_seasons": [
        "winter"
      ],
      "meal_types": [
        "dinner"
      ],
      "sections": [],
      "source_hints": [],
      "item_texts": [
        "Ginger peanut chicken"
      ],
      "count": 1
    },
    {
      "url": null,
      "urls": [],
      "link_texts": [],
      "menu_files": [
        "Menus/Menu week of 2-8-20.md"
      ],
      "menu_weeks": [
        "2020-02-08"
      ],
      "menu_seasons": [
        "winter"
      ],
      "meal_types": [
        "dinner"
      ],
      "sections": [],
      "source_hints": [
        "use red cabbage"
      ],
      "item_texts": [
        "Thai summer rolls with peanut sauce (use red cabbage)"
      ],
      "count": 1
    },
    {
      "url": null,
      "urls": [],
      "link_texts": [],
      "menu_files": [
        "Menus/Menu week of 2-8-20.md"
      ],
      "menu_weeks": [
        "2020-02-08"
      ],
      "menu_seasons": [
        "winter"
      ],
      "meal_types": [
        "dinner"
      ],
      "sections": [],
      "source_hints": [],
      "item_texts": [
        "Crispy autumn veg burgers with apple cider slaw, sweet potato fries"
      ],
      "count": 1
    },
    {
      "url": null,
      "urls": [],
      "link_texts": [],
      "menu_files": [
        "Menus/Menu week of 2-8-20.md"
      ],
      "menu_weeks": [
        "2020-02-08"
      ],
      "menu_seasons": [
        "winter"
      ],
      "meal_types": [
        "dinner"
      ],
      "sections": [],
      "source_hints": [],
      "item_texts": [
        "Steak, roasted parsnips, strawberry balsamic goat cheese saladChicago dogs and sweet potato fries or make a red cabbage slaw"
      ],
      "count": 1
    },
    {
      "url": null,
      "urls": [],
      "link_texts": [],
      "menu_files": [
        "Menus/Menu week of 2-8-20.md"
      ],
      "menu_weeks": [
        "2020-02-08"
      ],
      "menu_seasons": [
        "winter"
      ],
      "meal_types": [
        "dinner"
      ],
      "sections": [],
      "source_hints": [],
      "item_texts": [
        "Mels Buddha bowls (chicken) with peanut sauce"
      ],
      "count": 1
    },
    {
      "url": null,
      "urls": [],
      "link_texts": [],
      "menu_files": [
        "Menus/Menu week of 2-8-20.md"
      ],
      "menu_weeks": [
        "2020-02-08"
      ],
      "menu_seasons": [
        "winter"
      ],
      "meal_types": [
        "dinner"
      ],
      "sections": [],
      "source_hints": [],
      "item_texts": [
        "Cashew tofu stir fry"
      ],
      "count": 1
    },
    {
      "url": null,
      "urls": [],
      "link_texts": [],
      "menu_files": [
        "Menus/Menu week of 2-8-20.md"
      ],
      "menu_weeks": [
        "2020-02-08"
      ],
      "menu_seasons": [
        "winter"
      ],
      "meal_types": [
        "dinner"
      ],
      "sections": [],
      "source_hints": [],
      "item_texts": [
        "Puppy chow"
      ],
      "count": 1
    },
    {
      "url": null,
      "urls": [],
      "link_texts": [],
      "menu_files": [
        "Menus/Menu week of 2-8-20.md"
      ],
      "menu_weeks": [
        "2020-02-08"
      ],
      "menu_seasons": [
        "winter"
      ],
      "meal_types": [
        "dinner"
      ],
      "sections": [],
      "source_hints": [],
      "item_texts": [
        "Warm black bean dip"
      ],
      "count": 1
    },
    {
      "url": null,
      "urls": [],
      "link_texts": [],
      "menu_files": [
        "Menus/Menu week of 2-8-20.md"
      ],
      "menu_weeks": [
        "2020-02-08"
      ],
      "menu_seasons": [
        "winter"
      ],
      "meal_types": [
        "dinner"
      ],
      "sections": [],
      "source_hints": [],
      "item_texts": [
        "Fruit"
      ],
      "count": 1
    },
    {
      "url": null,
      "urls": [],
      "link_texts": [],
      "menu_files": [
        "Menus/Menu week of 2-8-20.md"
      ],
      "menu_weeks": [
        "2020-02-08"
      ],
      "menu_seasons": [
        "winter"
      ],
      "meal_types": [
        "dinner"
      ],
      "sections": [],
      "source_hints": [],
      "item_texts": [
        "Pizza bites"
      ],
      "count": 1
    },
    {
      "url": null,
      "urls": [],
      "link_texts": [],
      "menu_files": [
        "Menus/Menu week of 2-8-20.md"
      ],
      "menu_weeks": [
        "2020-02-08"
      ],
      "menu_seasons": [
        "winter"
      ],
      "meal_types": [
        "dinner"
      ],
      "sections": [],
      "source_hints": [],
      "item_texts": [
        "Feta stuffed buffalo chicken meatballs"
      ],
      "count": 1
    },
    {
      "url": null,
      "urls": [],
      "link_texts": [],
      "menu_files": [
        "Menus/Menu week of 2-8-20.md"
      ],
      "menu_weeks": [
        "2020-02-08"
      ],
      "menu_seasons": [
        "winter"
      ],
      "meal_types": [
        "dinner"
      ],
      "sections": [],
      "source_hints": [],
      "item_texts": [
        "Zesty Lime Shrimp and Avocado salad"
      ],
      "count": 1
    },
    {
      "url": null,
      "urls": [],
      "link_texts": [],
      "menu_files": [
        "Menus/Menu week of 3-1-19.md"
      ],
      "menu_weeks": [
        "2019-03-01"
      ],
      "menu_seasons": [
        "spring"
      ],
      "meal_types": [
        "breakfast"
      ],
      "sections": [],
      "source_hints": [],
      "item_texts": [
        "Saturday breakfast: avocado toast with over-easy eggs and bacon"
      ],
      "count": 1
    },
    {
      "url": null,
      "urls": [],
      "link_texts": [],
      "menu_files": [
        "Menus/Menu week of 3-1-19.md"
      ],
      "menu_weeks": [
        "2019-03-01"
      ],
      "menu_seasons": [
        "spring"
      ],
      "meal_types": [
        "dinner"
      ],
      "sections": [],
      "source_hints": [],
      "item_texts": [
        "Easy green curry with tofu, red bell pepper, mushrooms, and leftover other veggies"
      ],
      "count": 1
    },
    {
      "url": null,
      "urls": [],
      "link_texts": [],
      "menu_files": [
        "Menus/Menu week of 3-1-19.md"
      ],
      "menu_weeks": [
        "2019-03-01"
      ],
      "menu_seasons": [
        "spring"
      ],
      "meal_types": [
        "dinner"
      ],
      "sections": [],
      "source_hints": [],
      "item_texts": [
        "Sunday: Fettucini with preserved lemon and roasted garlic, salad"
      ],
      "count": 1
    },
    {
      "url": null,
      "urls": [],
      "link_texts": [],
      "menu_files": [
        "Menus/Menu week of 3-1-19.md"
      ],
      "menu_weeks": [
        "2019-03-01"
      ],
      "menu_seasons": [
        "spring"
      ],
      "meal_types": [
        "dinner"
      ],
      "sections": [],
      "source_hints": [],
      "item_texts": [
        "Ash Wednesday: tomato soup and grilled cheese"
      ],
      "count": 1
    },
    {
      "url": null,
      "urls": [],
      "link_texts": [],
      "menu_files": [
        "Menus/Menu week of 3-1-19.md"
      ],
      "menu_weeks": [
        "2019-03-01"
      ],
      "menu_seasons": [
        "spring"
      ],
      "meal_types": [
        "dinner"
      ],
      "sections": [],
      "source_hints": [],
      "item_texts": [
        "Chicken guacamole taquitos"
      ],
      "count": 1
    },
    {
      "url": null,
      "urls": [],
      "link_texts": [],
      "menu_files": [
        "Menus/Menu week of 3-1-19.md"
      ],
      "menu_weeks": [
        "2019-03-01"
      ],
      "menu_seasons": [
        "spring"
      ],
      "meal_types": [
        "dinner"
      ],
      "sections": [],
      "source_hints": [],
      "item_texts": [
        "Spicy thai chicken and quinoa, roasted broccoli"
      ],
      "count": 1
    },
    {
      "url": null,
      "urls": [],
      "link_texts": [],
      "menu_files": [
        "Menus/Menu week of 3-1-19.md"
      ],
      "menu_weeks": [
        "2019-03-01"
      ],
      "menu_seasons": [
        "spring"
      ],
      "meal_types": [
        "breakfast"
      ],
      "sections": [],
      "source_hints": [],
      "item_texts": [
        "Monday work: breakfast balls"
      ],
      "count": 1
    },
    {
      "url": null,
      "urls": [],
      "link_texts": [],
      "menu_files": [
        "Menus/Menu week of 3-12-22.md"
      ],
      "menu_weeks": [
        "2022-03-12"
      ],
      "menu_seasons": [
        "spring"
      ],
      "meal_types": [
        "dinner"
      ],
      "sections": [],
      "source_hints": [],
      "item_texts": [
        "Sweet potato tacos"
      ],
      "count": 1
    },
    {
      "url": null,
      "urls": [],
      "link_texts": [],
      "menu_files": [
        "Menus/Menu week of 3-12-22.md"
      ],
      "menu_weeks": [
        "2022-03-12"
      ],
      "menu_seasons": [
        "spring"
      ],
      "meal_types": [
        "dinner"
      ],
      "sections": [],
      "source_hints": [],
      "item_texts": [
        "Sausage pizza blue apron"
      ],
      "count": 1
    },
    {
      "url": null,
      "urls": [],
      "link_texts": [],
      "menu_files": [
        "Menus/Menu week of 3-12-22.md"
      ],
      "menu_weeks": [
        "2022-03-12"
      ],
      "menu_seasons": [
        "spring"
      ],
      "meal_types": [
        "dinner"
      ],
      "sections": [],
      "source_hints": [],
      "item_texts": [
        "Vegetarian blue apron"
      ],
      "count": 1
    },
    {
      "url": null,
      "urls": [],
      "link_texts": [],
      "menu_files": [
        "Menus/Menu week of 3-12-22.md"
      ],
      "menu_weeks": [
        "2022-03-12"
      ],
      "menu_seasons": [
        "spring"
      ],
      "meal_types": [
        "dinner"
      ],
      "sections": [],
      "source_hints": [],
      "item_texts": [
        "Corned beef, cabbage, and potatoes"
      ],
      "count": 1
    },
    {
      "url": null,
      "urls": [],
      "link_texts": [],
      "menu_files": [
        "Menus/Menu week of 3-12-24.md"
      ],
      "menu_weeks": [
        "2024-03-12"
      ],
      "menu_seasons": [
        "spring"
      ],
      "meal_types": [
        "dinner"
      ],
      "sections": [],
      "source_hints": [],
      "item_texts": [
        "Bacon, eggs, tomatoes, bread (amelia\u2019s?), bangers from garage freezer?"
      ],
      "count": 1
    },
    {
      "url": null,
      "urls": [],
      "link_texts": [],
      "menu_files": [
        "Menus/Menu week of 3-12-24.md"
      ],
      "menu_weeks": [
        "2024-03-12"
      ],
      "menu_seasons": [
        "spring"
      ],
      "meal_types": [
        "dinner"
      ],
      "sections": [],
      "source_hints": [],
      "item_texts": [
        "Corned beef, cabbage, potatoes"
      ],
      "count": 1
    },
    {
      "url": null,
      "urls": [],
      "link_texts": [],
      "menu_files": [
        "Menus/Menu week of 3-12-24.md"
      ],
      "menu_weeks": [
        "2024-03-12"
      ],
      "menu_seasons": [
        "spring"
      ],
      "meal_types": [
        "dinner"
      ],
      "sections": [],
      "source_hints": [
        "half baked harvest"
      ],
      "item_texts": [
        "One pot broccoli cheese pesto pasta (half baked harvest)"
      ],
      "count": 1
    },
    {
      "url": null,
      "urls": [],
      "link_texts": [],
      "menu_files": [
        "Menus/Menu week of 3-12-24.md"
      ],
      "menu_weeks": [
        "2024-03-12"
      ],
      "menu_seasons": [
        "spring"
      ],
      "meal_types": [
        "dinner"
      ],
      "sections": [],
      "source_hints": [],
      "item_texts": [
        "Corned beef and cabbage grilled cheese and sweet potato fries"
      ],
      "count": 1
    },
    {
      "url": null,
      "urls": [],
      "link_texts": [],
      "menu_files": [
        "Menus/Menu week of 3-12-24.md"
      ],
      "menu_weeks": [
        "2024-03-12"
      ],
      "menu_seasons": [
        "spring"
      ],
      "meal_types": [
        "dinner"
      ],
      "sections": [],
      "source_hints": [],
      "item_texts": [
        "Black bean soup (Iowa girl eats) with cilantro lime rice (Iowa Girl eats) and quesadillas"
      ],
      "count": 1
    },
    {
      "url": null,
      "urls": [],
      "link_texts": [],
      "menu_files": [
        "Menus/Menu week of 3-12-24.md"
      ],
      "menu_weeks": [
        "2024-03-12"
      ],
      "menu_seasons": [
        "spring"
      ],
      "meal_types": [
        "dinner"
      ],
      "sections": [],
      "source_hints": [
        "Half baked harvest"
      ],
      "item_texts": [
        "Crockpot Thai Yellow Curry Chicken with Garlic Rice (Half baked harvest)"
      ],
      "count": 1
    },
    {
      "url": null,
      "urls": [],
      "link_texts": [],
      "menu_files": [
        "Menus/Menu week of 3-12-24.md"
      ],
      "menu_weeks": [
        "2024-03-12"
      ],
      "menu_seasons": [
        "spring"
      ],
      "meal_types": [
        "dinner"
      ],
      "sections": [],
      "source_hints": [],
      "item_texts": [
        "BBQ jackfruit sandwiches with roasted broccoli or sweet potato fries"
      ],
      "count": 1
    },
    {
      "url": null,
      "urls": [],
      "link_texts": [],
      "menu_files": [
        "Menus/Menu week of 3-12-25.md"
      ],
      "menu_weeks": [
        "2025-03-12"
      ],
      "menu_seasons": [
        "spring"
      ],
      "meal_types": [
        "dinner"
      ],
      "sections": [],
      "source_hints": [],
      "item_texts": [
        "Corned beef, cabbage, potatoes"
      ],
      "count": 1
    },
    {
      "url": null,
      "urls": [],
      "link_texts": [],
      "menu_files": [
        "Menus/Menu week of 3-14-18.md"
      ],
      "menu_weeks": [
        "2018-03-14"
      ],
      "menu_seasons": [
        "spring"
      ],
      "meal_types": [
        "dinner"
      ],
      "sections": [],
      "source_hints": [],
      "item_texts": [
        "Wednesday: Balsamic roasted veggie and white bean pasta"
      ],
      "count": 1
    },
    {
      "url": null,
      "urls": [],
      "link_texts": [],
      "menu_files": [
        "Menus/Menu week of 3-14-18.md"
      ],
      "menu_weeks": [
        "2018-03-14"
      ],
      "menu_seasons": [
        "spring"
      ],
      "meal_types": [
        "dinner"
      ],
      "sections": [],
      "source_hints": [],
      "item_texts": [
        "Thursday: spicy Thai chicken and quinoa, cucumber lime mint salad"
      ],
      "count": 1
    },
    {
      "url": null,
      "urls": [],
      "link_texts": [],
      "menu_files": [
        "Menus/Menu week of 3-14-18.md"
      ],
      "menu_weeks": [
        "2018-03-14"
      ],
      "menu_seasons": [
        "spring"
      ],
      "meal_types": [
        "dinner"
      ],
      "sections": [],
      "source_hints": [],
      "item_texts": [
        "Friday: vegetarian chili, bread, maybe arugula salad"
      ],
      "count": 1
    },
    {
      "url": null,
      "urls": [],
      "link_texts": [],
      "menu_files": [
        "Menus/Menu week of 3-14-18.md"
      ],
      "menu_weeks": [
        "2018-03-14"
      ],
      "menu_seasons": [
        "spring"
      ],
      "meal_types": [
        "dinner"
      ],
      "sections": [],
      "source_hints": [],
      "item_texts": [
        "Cheese and crackers"
      ],
      "count": 1
    },
    {
      "url": null,
      "urls": [],
      "link_texts": [],
      "menu_files": [
        "Menus/Menu week of 3-14-18.md"
      ],
      "menu_weeks": [
        "2018-03-14"
      ],
      "menu_seasons": [
        "spring"
      ],
      "meal_types": [
        "dinner"
      ],
      "sections": [],
      "source_hints": [
        "carrots, cucumbers, celery"
      ],
      "item_texts": [
        "Hummus and veggies (carrots, cucumbers, celery)"
      ],
      "count": 1
    },
    {
      "url": null,
      "urls": [],
      "link_texts": [],
      "menu_files": [
        "Menus/Menu week of 3-14-18.md"
      ],
      "menu_weeks": [
        "2018-03-14"
      ],
      "menu_seasons": [
        "spring"
      ],
      "meal_types": [
        "dinner"
      ],
      "sections": [],
      "source_hints": [
        "Rachel bringing"
      ],
      "item_texts": [
        "Cupcakes (Rachel bringing)"
      ],
      "count": 1
    },
    {
      "url": null,
      "urls": [],
      "link_texts": [],
      "menu_files": [
        "Menus/Menu week of 3-14-18.md"
      ],
      "menu_weeks": [
        "2018-03-14"
      ],
      "menu_seasons": [
        "spring"
      ],
      "meal_types": [
        "dinner"
      ],
      "sections": [],
      "source_hints": [],
      "item_texts": [
        "Double fudge Irish cream cookies"
      ],
      "count": 1
    },
    {
      "url": null,
      "urls": [],
      "link_texts": [],
      "menu_files": [
        "Menus/Menu week of 3-14-18.md"
      ],
      "menu_weeks": [
        "2018-03-14"
      ],
      "menu_seasons": [
        "spring"
      ],
      "meal_types": [
        "dinner"
      ],
      "sections": [],
      "source_hints": [
        "Maggie"
      ],
      "item_texts": [
        "Irish soda bread muffins (Maggie)"
      ],
      "count": 1
    },
    {
      "url": null,
      "urls": [],
      "link_texts": [],
      "menu_files": [
        "Menus/Menu week of 3-14-18.md"
      ],
      "menu_weeks": [
        "2018-03-14"
      ],
      "menu_seasons": [
        "spring"
      ],
      "meal_types": [
        "breakfast"
      ],
      "sections": [],
      "source_hints": [],
      "item_texts": [
        "Sunday: Irish breakfast"
      ],
      "count": 1
    },
    {
      "url": null,
      "urls": [],
      "link_texts": [],
      "menu_files": [
        "Menus/Menu week of 3-14-18.md"
      ],
      "menu_weeks": [
        "2018-03-14"
      ],
      "menu_seasons": [
        "spring"
      ],
      "meal_types": [
        "dinner"
      ],
      "sections": [],
      "source_hints": [],
      "item_texts": [
        "Sunday: corned beef and cabbage, potatoes"
      ],
      "count": 1
    },
    {
      "url": null,
      "urls": [],
      "link_texts": [],
      "menu_files": [
        "Menus/Menu week of 3-14-18.md"
      ],
      "menu_weeks": [
        "2018-03-14"
      ],
      "menu_seasons": [
        "spring"
      ],
      "meal_types": [
        "dinner"
      ],
      "sections": [],
      "source_hints": [],
      "item_texts": [
        "Monday: bulgar salad"
      ],
      "count": 1
    },
    {
      "url": null,
      "urls": [],
      "link_texts": [],
      "menu_files": [
        "Menus/Menu week of 3-14-18.md"
      ],
      "menu_weeks": [
        "2018-03-14"
      ],
      "menu_seasons": [
        "spring"
      ],
      "meal_types": [
        "snack"
      ],
      "sections": [],
      "source_hints": [],
      "item_texts": [
        "Tuesday: leftovers/snack Alicia book club"
      ],
      "count": 1
    },
    {
      "url": null,
      "urls": [],
      "link_texts": [],
      "menu_files": [
        "Menus/Menu week of 3-14-18.md"
      ],
      "menu_weeks": [
        "2018-03-14"
      ],
      "menu_seasons": [
        "spring"
      ],
      "meal_types": [
        "dinner"
      ],
      "sections": [],
      "source_hints": [],
      "item_texts": [
        "Wednesday: corned beef, Irish cheddar cabbage sandwiches"
      ],
      "count": 1
    },
    {
      "url": null,
      "urls": [],
      "link_texts": [],
      "menu_files": [
        "Menus/Menu week of 3-14-18.md"
      ],
      "menu_weeks": [
        "2018-03-14"
      ],
      "menu_seasons": [
        "spring"
      ],
      "meal_types": [
        "dinner"
      ],
      "sections": [],
      "source_hints": [],
      "item_texts": [
        "Thursday: colcannon"
      ],
      "count": 1
    },
    {
      "url": null,
      "urls": [],
      "link_texts": [],
      "menu_files": [
        "Menus/Menu week of 3-14-18.md"
      ],
      "menu_weeks": [
        "2018-03-14"
      ],
      "menu_seasons": [
        "spring"
      ],
      "meal_types": [
        "dinner"
      ],
      "sections": [],
      "source_hints": [],
      "item_texts": [
        "Friday: Lorde concert - dinner out for fish and chips?"
      ],
      "count": 1
    },
    {
      "url": null,
      "urls": [],
      "link_texts": [],
      "menu_files": [
        "Menus/Menu week of 3-14-18.md"
      ],
      "menu_weeks": [
        "2018-03-14"
      ],
      "menu_seasons": [
        "spring"
      ],
      "meal_types": [
        "dinner"
      ],
      "sections": [],
      "source_hints": [],
      "item_texts": [
        "Bulgar again"
      ],
      "count": 1
    },
    {
      "url": null,
      "urls": [],
      "link_texts": [],
      "menu_files": [
        "Menus/Menu week of 3-14-18.md"
      ],
      "menu_weeks": [
        "2018-03-14"
      ],
      "menu_seasons": [
        "spring"
      ],
      "meal_types": [
        "dinner"
      ],
      "sections": [],
      "source_hints": [],
      "item_texts": [
        "Pizza"
      ],
      "count": 1
    },
    {
      "url": null,
      "urls": [],
      "link_texts": [],
      "menu_files": [
        "Menus/Menu week of 3-14-18.md"
      ],
      "menu_weeks": [
        "2018-03-14"
      ],
      "menu_seasons": [
        "spring"
      ],
      "meal_types": [
        "dinner"
      ],
      "sections": [],
      "source_hints": [
        "double batch"
      ],
      "item_texts": [
        "spicy Thai chicken and quinoa, cucumber lime mint salad (double batch)"
      ],
      "count": 1
    },
    {
      "url": null,
      "urls": [],
      "link_texts": [],
      "menu_files": [
        "Menus/Menu week of 3-14-18.md"
      ],
      "menu_weeks": [
        "2018-03-14"
      ],
      "menu_seasons": [
        "spring"
      ],
      "meal_types": [
        "dinner"
      ],
      "sections": [],
      "source_hints": [],
      "item_texts": [
        "Apples and bananas for the kids"
      ],
      "count": 1
    },
    {
      "url": null,
      "urls": [],
      "link_texts": [],
      "menu_files": [
        "Menus/Menu week of 3-14-18.md"
      ],
      "menu_weeks": [
        "2018-03-14"
      ],
      "menu_seasons": [
        "spring"
      ],
      "meal_types": [
        "dinner"
      ],
      "sections": [],
      "source_hints": [],
      "item_texts": [
        "Cheese for the kids"
      ],
      "count": 1
    },
    {
      "url": null,
      "urls": [],
      "link_texts": [],
      "menu_files": [
        "Menus/Menu week of 3-14-18.md"
      ],
      "menu_weeks": [
        "2018-03-14"
      ],
      "menu_seasons": [
        "spring"
      ],
      "meal_types": [
        "dinner"
      ],
      "sections": [],
      "source_hints": [],
      "item_texts": [
        "Chips and salsa"
      ],
      "count": 1
    },
    {
      "url": null,
      "urls": [],
      "link_texts": [],
      "menu_files": [
        "Menus/Menu week of 3-15-19.md"
      ],
      "menu_weeks": [
        "2019-03-15"
      ],
      "menu_seasons": [
        "spring"
      ],
      "meal_types": [
        "dinner"
      ],
      "sections": [],
      "source_hints": [],
      "item_texts": [
        "Sheet pan baked salmon and asparagus"
      ],
      "count": 1
    },
    {
      "url": null,
      "urls": [],
      "link_texts": [],
      "menu_files": [
        "Menus/Menu week of 3-15-19.md"
      ],
      "menu_weeks": [
        "2019-03-15"
      ],
      "menu_seasons": [
        "spring"
      ],
      "meal_types": [
        "dinner"
      ],
      "sections": [],
      "source_hints": [],
      "item_texts": [
        "Weekend: Corned beef and cabbage"
      ],
      "count": 1
    },
    {
      "url": null,
      "urls": [],
      "link_texts": [],
      "menu_files": [
        "Menus/Menu week of 3-15-19.md"
      ],
      "menu_weeks": [
        "2019-03-15"
      ],
      "menu_seasons": [
        "spring"
      ],
      "meal_types": [
        "breakfast"
      ],
      "sections": [],
      "source_hints": [
        "make soda bread muffins"
      ],
      "item_texts": [
        "Weekend: Irish breakfast (make soda bread muffins)"
      ],
      "count": 1
    },
    {
      "url": null,
      "urls": [],
      "link_texts": [],
      "menu_files": [
        "Menus/Menu week of 3-15-19.md"
      ],
      "menu_weeks": [
        "2019-03-15"
      ],
      "menu_seasons": [
        "spring"
      ],
      "meal_types": [
        "dinner"
      ],
      "sections": [],
      "source_hints": [],
      "item_texts": [
        "Salad (feta, cranberries, apple, walnuts) and dinner rolls"
      ],
      "count": 1
    },
    {
      "url": null,
      "urls": [],
      "link_texts": [],
      "menu_files": [
        "Menus/Menu week of 3-15-19.md"
      ],
      "menu_weeks": [
        "2019-03-15"
      ],
      "menu_seasons": [
        "spring"
      ],
      "meal_types": [
        "dinner"
      ],
      "sections": [],
      "source_hints": [],
      "item_texts": [
        "Leftovers: Corned beef sandwiches"
      ],
      "count": 1
    },
    {
      "url": null,
      "urls": [],
      "link_texts": [],
      "menu_files": [
        "Menus/Menu week of 3-15-19.md"
      ],
      "menu_weeks": [
        "2019-03-15"
      ],
      "menu_seasons": [
        "spring"
      ],
      "meal_types": [
        "dinner"
      ],
      "sections": [],
      "source_hints": [],
      "item_texts": [
        "Sesame noodle bowls"
      ],
      "count": 1
    },
    {
      "url": null,
      "urls": [],
      "link_texts": [],
      "menu_files": [
        "Menus/Menu week of 3-15-19.md"
      ],
      "menu_weeks": [
        "2019-03-15"
      ],
      "menu_seasons": [
        "spring"
      ],
      "meal_types": [
        "dinner"
      ],
      "sections": [],
      "source_hints": [],
      "item_texts": [
        "Crockpot quinoa chicken primavera"
      ],
      "count": 1
    },
    {
      "url": null,
      "urls": [],
      "link_texts": [],
      "menu_files": [
        "Menus/Menu week of 3-15-19.md"
      ],
      "menu_weeks": [
        "2019-03-15"
      ],
      "menu_seasons": [
        "spring"
      ],
      "meal_types": [
        "dinner"
      ],
      "sections": [],
      "source_hints": [],
      "item_texts": [
        "baked falafel with spicy feta dip, salad"
      ],
      "count": 1
    },
    {
      "url": null,
      "urls": [],
      "link_texts": [],
      "menu_files": [
        "Menus/Menu week of 3-19-21.md"
      ],
      "menu_weeks": [
        "2021-03-19"
      ],
      "menu_seasons": [
        "spring"
      ],
      "meal_types": [
        "dinner"
      ],
      "sections": [],
      "source_hints": [],
      "item_texts": [
        "Baked falafel with spicy feta dip, bagged salad"
      ],
      "count": 1
    },
    {
      "url": null,
      "urls": [],
      "link_texts": [],
      "menu_files": [
        "Menus/Menu week of 3-19-21.md"
      ],
      "menu_weeks": [
        "2021-03-19"
      ],
      "menu_seasons": [
        "spring"
      ],
      "meal_types": [
        "dinner"
      ],
      "sections": [],
      "source_hints": [],
      "item_texts": [
        "Crockpot quinoa chicken primavera"
      ],
      "count": 1
    },
    {
      "url": null,
      "urls": [],
      "link_texts": [],
      "menu_files": [
        "Menus/Menu week of 3-19-21.md"
      ],
      "menu_weeks": [
        "2021-03-19"
      ],
      "menu_seasons": [
        "spring"
      ],
      "meal_types": [
        "dinner"
      ],
      "sections": [],
      "source_hints": [],
      "item_texts": [
        "Easy pepper steak and rice"
      ],
      "count": 1
    },
    {
      "url": null,
      "urls": [],
      "link_texts": [],
      "menu_files": [
        "Menus/Menu week of 3-19-21.md"
      ],
      "menu_weeks": [
        "2021-03-19"
      ],
      "menu_seasons": [
        "spring"
      ],
      "meal_types": [
        "dinner"
      ],
      "sections": [],
      "source_hints": [],
      "item_texts": [
        "Burgers and sweet potato fries"
      ],
      "count": 1
    },
    {
      "url": null,
      "urls": [],
      "link_texts": [],
      "menu_files": [
        "Menus/Menu week of 3-20-23.md"
      ],
      "menu_weeks": [
        "2023-03-20"
      ],
      "menu_seasons": [
        "spring"
      ],
      "meal_types": [
        "dinner"
      ],
      "sections": [],
      "source_hints": [],
      "item_texts": [
        "Leftover corned beef sandwiches and sweet potato fries"
      ],
      "count": 1
    },
    {
      "url": null,
      "urls": [],
      "link_texts": [],
      "menu_files": [
        "Menus/Menu week of 3-20-23.md"
      ],
      "menu_weeks": [
        "2023-03-20"
      ],
      "menu_seasons": [
        "spring"
      ],
      "meal_types": [
        "dinner"
      ],
      "sections": [],
      "source_hints": [],
      "item_texts": [
        "Corned beef, cabbage, and potatoes"
      ],
      "count": 1
    },
    {
      "url": null,
      "urls": [],
      "link_texts": [],
      "menu_files": [
        "Menus/Menu week of 3-20-23.md"
      ],
      "menu_weeks": [
        "2023-03-20"
      ],
      "menu_seasons": [
        "spring"
      ],
      "meal_types": [
        "dinner"
      ],
      "sections": [],
      "source_hints": [],
      "item_texts": [
        "The Olivers Salad"
      ],
      "count": 1
    },
    {
      "url": null,
      "urls": [],
      "link_texts": [],
      "menu_files": [
        "Menus/Menu week of 3-20-23.md"
      ],
      "menu_weeks": [
        "2023-03-20"
      ],
      "menu_seasons": [
        "spring"
      ],
      "meal_types": [
        "dinner"
      ],
      "sections": [],
      "source_hints": [],
      "item_texts": [
        "Coconut curry ramen"
      ],
      "count": 1
    },
    {
      "url": null,
      "urls": [],
      "link_texts": [],
      "menu_files": [
        "Menus/Menu week of 3-20-23.md"
      ],
      "menu_weeks": [
        "2023-03-20"
      ],
      "menu_seasons": [
        "spring"
      ],
      "meal_types": [
        "dinner"
      ],
      "sections": [],
      "source_hints": [],
      "item_texts": [
        "Three cheese baked Gnocchi"
      ],
      "count": 1
    },
    {
      "url": null,
      "urls": [],
      "link_texts": [],
      "menu_files": [
        "Menus/Menu week of 3-20-23.md"
      ],
      "menu_weeks": [
        "2023-03-20"
      ],
      "menu_seasons": [
        "spring"
      ],
      "meal_types": [
        "dinner"
      ],
      "sections": [],
      "source_hints": [],
      "item_texts": [
        "Loaded BBQ Baked potatoes"
      ],
      "count": 1
    },
    {
      "url": null,
      "urls": [],
      "link_texts": [],
      "menu_files": [
        "Menus/Menu week of 3-21-20.md"
      ],
      "menu_weeks": [
        "2020-03-21"
      ],
      "menu_seasons": [
        "spring"
      ],
      "meal_types": [
        "dinner"
      ],
      "sections": [],
      "source_hints": [],
      "item_texts": [
        "Red curry lentils"
      ],
      "count": 1
    },
    {
      "url": null,
      "urls": [],
      "link_texts": [],
      "menu_files": [
        "Menus/Menu week of 3-21-20.md"
      ],
      "menu_weeks": [
        "2020-03-21"
      ],
      "menu_seasons": [
        "spring"
      ],
      "meal_types": [
        "dinner"
      ],
      "sections": [],
      "source_hints": [
        "freeze"
      ],
      "item_texts": [
        "Detox lentil soup (freeze)"
      ],
      "count": 1
    },
    {
      "url": null,
      "urls": [],
      "link_texts": [],
      "menu_files": [
        "Menus/Menu week of 3-21-20.md"
      ],
      "menu_weeks": [
        "2020-03-21"
      ],
      "menu_seasons": [
        "spring"
      ],
      "meal_types": [
        "lunch"
      ],
      "sections": [],
      "source_hints": [],
      "item_texts": [
        "Lunch? Winter rainbow quinoa salad"
      ],
      "count": 1
    },
    {
      "url": null,
      "urls": [],
      "link_texts": [],
      "menu_files": [
        "Menus/Menu week of 3-21-20.md"
      ],
      "menu_weeks": [
        "2020-03-21"
      ],
      "menu_seasons": [
        "spring"
      ],
      "meal_types": [
        "dinner"
      ],
      "sections": [],
      "source_hints": [],
      "item_texts": [
        "Sweet potato and black bean tostadas"
      ],
      "count": 1
    },
    {
      "url": null,
      "urls": [],
      "link_texts": [],
      "menu_files": [
        "Menus/Menu week of 3-21-20.md"
      ],
      "menu_weeks": [
        "2020-03-21"
      ],
      "menu_seasons": [
        "spring"
      ],
      "meal_types": [
        "dinner"
      ],
      "sections": [],
      "source_hints": [],
      "item_texts": [
        "Pizza"
      ],
      "count": 1
    },
    {
      "url": null,
      "urls": [],
      "link_texts": [],
      "menu_files": [
        "Menus/Menu week of 3-21-20.md"
      ],
      "menu_weeks": [
        "2020-03-21"
      ],
      "menu_seasons": [
        "spring"
      ],
      "meal_types": [
        "dinner"
      ],
      "sections": [],
      "source_hints": [],
      "item_texts": [
        "Best easy fish tacos"
      ],
      "count": 1
    },
    {
      "url": null,
      "urls": [],
      "link_texts": [],
      "menu_files": [
        "Menus/Menu week of 3-21-20.md"
      ],
      "menu_weeks": [
        "2020-03-21"
      ],
      "menu_seasons": [
        "spring"
      ],
      "meal_types": [
        "dinner"
      ],
      "sections": [],
      "source_hints": [],
      "item_texts": [
        "One Pot Creamy Asparagus and Bacon Pasta"
      ],
      "count": 1
    },
    {
      "url": null,
      "urls": [],
      "link_texts": [],
      "menu_files": [
        "Menus/Menu week of 3-24-24.md"
      ],
      "menu_weeks": [
        "2024-03-24"
      ],
      "menu_seasons": [
        "spring"
      ],
      "meal_types": [
        "dinner"
      ],
      "sections": [],
      "source_hints": [
        "Aggie\u2019s Kitchen"
      ],
      "item_texts": [
        "Healthy Chicken tortilla soup (Aggie\u2019s Kitchen)"
      ],
      "count": 1
    },
    {
      "url": null,
      "urls": [],
      "link_texts": [],
      "menu_files": [
        "Menus/Menu week of 3-24-24.md"
      ],
      "menu_weeks": [
        "2024-03-24"
      ],
      "menu_seasons": [
        "spring"
      ],
      "meal_types": [
        "dinner"
      ],
      "sections": [],
      "source_hints": [],
      "item_texts": [
        "BBQ jackfruit sandwiches and roasted broccoli and sweet potato fries"
      ],
      "count": 1
    },
    {
      "url": null,
      "urls": [],
      "link_texts": [],
      "menu_files": [
        "Menus/Menu week of 3-24-24.md"
      ],
      "menu_weeks": [
        "2024-03-24"
      ],
      "menu_seasons": [
        "spring"
      ],
      "meal_types": [
        "dinner"
      ],
      "sections": [],
      "source_hints": [],
      "item_texts": [
        "Asparagus pasta with Lemon (A couple cooks) add frozen chicken tenders"
      ],
      "count": 1
    },
    {
      "url": null,
      "urls": [],
      "link_texts": [],
      "menu_files": [
        "Menus/Menu week of 3-24-24.md"
      ],
      "menu_weeks": [
        "2024-03-24"
      ],
      "menu_seasons": [
        "spring"
      ],
      "meal_types": [
        "dinner"
      ],
      "sections": [],
      "source_hints": [
        "Half Baked Harvest"
      ],
      "item_texts": [
        "30 Minute Thai Basil Beef noodles (Half Baked Harvest)"
      ],
      "count": 1
    },
    {
      "url": null,
      "urls": [],
      "link_texts": [],
      "menu_files": [
        "Menus/Menu week of 3-24-24.md"
      ],
      "menu_weeks": [
        "2024-03-24"
      ],
      "menu_seasons": [
        "spring"
      ],
      "meal_types": [
        "dinner"
      ],
      "sections": [],
      "source_hints": [],
      "item_texts": [
        "Marry Me Chicken (Pinch of Yum) with mashed potatoes, bagged salad. Use frozen chicken tenders"
      ],
      "count": 1
    },
    {
      "url": null,
      "urls": [],
      "link_texts": [],
      "menu_files": [
        "Menus/Menu week of 3-29-22.md"
      ],
      "menu_weeks": [
        "2022-03-29"
      ],
      "menu_seasons": [
        "spring"
      ],
      "meal_types": [
        "dinner"
      ],
      "sections": [],
      "source_hints": [],
      "item_texts": [
        "Chicken meatballs with peppers and orzo"
      ],
      "count": 1
    },
    {
      "url": null,
      "urls": [],
      "link_texts": [],
      "menu_files": [
        "Menus/Menu week of 3-29-22.md"
      ],
      "menu_weeks": [
        "2022-03-29"
      ],
      "menu_seasons": [
        "spring"
      ],
      "meal_types": [
        "dinner"
      ],
      "sections": [],
      "source_hints": [],
      "item_texts": [
        "Blue apron steak tacos"
      ],
      "count": 1
    },
    {
      "url": null,
      "urls": [],
      "link_texts": [],
      "menu_files": [
        "Menus/Menu week of 3-29-22.md"
      ],
      "menu_weeks": [
        "2022-03-29"
      ],
      "menu_seasons": [
        "spring"
      ],
      "meal_types": [
        "dinner"
      ],
      "sections": [],
      "source_hints": [],
      "item_texts": [
        "Blue apron tilapia"
      ],
      "count": 1
    },
    {
      "url": null,
      "urls": [],
      "link_texts": [],
      "menu_files": [
        "Menus/Menu week of 3-29-22.md"
      ],
      "menu_weeks": [
        "2022-03-29"
      ],
      "menu_seasons": [
        "spring"
      ],
      "meal_types": [
        "dinner"
      ],
      "sections": [],
      "source_hints": [],
      "item_texts": [
        "Blue apron chorizo bake"
      ],
      "count": 1
    },
    {
      "url": null,
      "urls": [],
      "link_texts": [],
      "menu_files": [
        "Menus/Menu week of 3-29-22.md"
      ],
      "menu_weeks": [
        "2022-03-29"
      ],
      "menu_seasons": [
        "spring"
      ],
      "meal_types": [
        "dinner"
      ],
      "sections": [],
      "source_hints": [],
      "item_texts": [
        "Blue apron 3"
      ],
      "count": 1
    },
    {
      "url": null,
      "urls": [],
      "link_texts": [],
      "menu_files": [
        "Menus/Menu week of 3-29-22.md"
      ],
      "menu_weeks": [
        "2022-03-29"
      ],
      "menu_seasons": [
        "spring"
      ],
      "meal_types": [
        "dinner"
      ],
      "sections": [],
      "source_hints": [],
      "item_texts": [
        "Blue apron 2"
      ],
      "count": 1
    },
    {
      "url": null,
      "urls": [],
      "link_texts": [],
      "menu_files": [
        "Menus/Menu week of 3-29-22.md"
      ],
      "menu_weeks": [
        "2022-03-29"
      ],
      "menu_seasons": [
        "spring"
      ],
      "meal_types": [
        "dinner"
      ],
      "sections": [],
      "source_hints": [],
      "item_texts": [
        "Blue apron 1"
      ],
      "count": 1
    },
    {
      "url": null,
      "urls": [],
      "link_texts": [],
      "menu_files": [
        "Menus/Menu week of 3-31-18.md"
      ],
      "menu_weeks": [
        "2018-03-31"
      ],
      "menu_seasons": [
        "spring"
      ],
      "meal_types": [
        "dinner"
      ],
      "sections": [],
      "source_hints": [],
      "item_texts": [
        "Chili"
      ],
      "count": 1
    },
    {
      "url": null,
      "urls": [],
      "link_texts": [],
      "menu_files": [
        "Menus/Menu week of 3-31-18.md"
      ],
      "menu_weeks": [
        "2018-03-31"
      ],
      "menu_seasons": [
        "spring"
      ],
      "meal_types": [
        "breakfast"
      ],
      "sections": [],
      "source_hints": [],
      "item_texts": [
        "Easter breakfast: eggs, bacon, potatoes, blackberries"
      ],
      "count": 1
    },
    {
      "url": null,
      "urls": [],
      "link_texts": [],
      "menu_files": [
        "Menus/Menu week of 3-31-18.md"
      ],
      "menu_weeks": [
        "2018-03-31"
      ],
      "menu_seasons": [
        "spring"
      ],
      "meal_types": [
        "dessert"
      ],
      "sections": [],
      "source_hints": [],
      "item_texts": [
        "Easter dinner: lemon asparagus truffle pasta, salad (skinnytaste house salad), dessert: ice cream"
      ],
      "count": 1
    },
    {
      "url": null,
      "urls": [],
      "link_texts": [],
      "menu_files": [
        "Menus/Menu week of 3-31-18.md"
      ],
      "menu_weeks": [
        "2018-03-31"
      ],
      "menu_seasons": [
        "spring"
      ],
      "meal_types": [
        "dinner"
      ],
      "sections": [],
      "source_hints": [],
      "item_texts": [
        "Chickpea tikka masala with green rice (cookie and Kate p. 157)"
      ],
      "count": 1
    },
    {
      "url": null,
      "urls": [],
      "link_texts": [],
      "menu_files": [
        "Menus/Menu week of 3-31-18.md"
      ],
      "menu_weeks": [
        "2018-03-31"
      ],
      "menu_seasons": [
        "spring"
      ],
      "meal_types": [
        "dinner"
      ],
      "sections": [],
      "source_hints": [],
      "item_texts": [
        "Quinoa salad with apple, chickpeas, toasted almonds, and apple cider vinaigrette"
      ],
      "count": 1
    },
    {
      "url": null,
      "urls": [],
      "link_texts": [],
      "menu_files": [
        "Menus/Menu week of 3-31-18.md"
      ],
      "menu_weeks": [
        "2018-03-31"
      ],
      "menu_seasons": [
        "spring"
      ],
      "meal_types": [
        "dinner"
      ],
      "sections": [],
      "source_hints": [],
      "item_texts": [
        "Sheet pan green chili beef nachos"
      ],
      "count": 1
    },
    {
      "url": null,
      "urls": [],
      "link_texts": [],
      "menu_files": [
        "Menus/Menu week of 3-31-18.md"
      ],
      "menu_weeks": [
        "2018-03-31"
      ],
      "menu_seasons": [
        "spring"
      ],
      "meal_types": [
        "dinner"
      ],
      "sections": [],
      "source_hints": [],
      "item_texts": [
        "French onion soup"
      ],
      "count": 1
    },
    {
      "url": null,
      "urls": [],
      "link_texts": [],
      "menu_files": [
        "Menus/Menu week of 3-31-18.md"
      ],
      "menu_weeks": [
        "2018-03-31"
      ],
      "menu_seasons": [
        "spring"
      ],
      "meal_types": [
        "dinner"
      ],
      "sections": [],
      "source_hints": [],
      "item_texts": [
        "Skyline and salad"
      ],
      "count": 1
    },
    {
      "url": null,
      "urls": [],
      "link_texts": [],
      "menu_files": [
        "Menus/Menu week of 3-5-23.md"
      ],
      "menu_weeks": [
        "2023-03-05"
      ],
      "menu_seasons": [
        "spring"
      ],
      "meal_types": [
        "dinner"
      ],
      "sections": [],
      "source_hints": [],
      "item_texts": [
        "Frozen chicken nuggets, bagged salad, sweet potato fries"
      ],
      "count": 1
    },
    {
      "url": null,
      "urls": [],
      "link_texts": [],
      "menu_files": [
        "Menus/Menu week of 3-5-23.md"
      ],
      "menu_weeks": [
        "2023-03-05"
      ],
      "menu_seasons": [
        "spring"
      ],
      "meal_types": [
        "dinner"
      ],
      "sections": [],
      "source_hints": [
        "Wednesday"
      ],
      "item_texts": [
        "Slow cooker beef stew (Damn Delicious) (Wednesday)"
      ],
      "count": 1
    },
    {
      "url": null,
      "urls": [],
      "link_texts": [],
      "menu_files": [
        "Menus/Menu week of 3-5-23.md"
      ],
      "menu_weeks": [
        "2023-03-05"
      ],
      "menu_seasons": [
        "spring"
      ],
      "meal_types": [
        "dinner"
      ],
      "sections": [],
      "source_hints": [
        "use up frozen"
      ],
      "item_texts": [
        "Ribeye steaks, asparagus, sweet potato fries (use up frozen)"
      ],
      "count": 1
    },
    {
      "url": null,
      "urls": [],
      "link_texts": [],
      "menu_files": [
        "Menus/Menu week of 3-5-23.md"
      ],
      "menu_weeks": [
        "2023-03-05"
      ],
      "menu_seasons": [
        "spring"
      ],
      "meal_types": [
        "dinner"
      ],
      "sections": [],
      "source_hints": [],
      "item_texts": [
        "Date night rigatoni"
      ],
      "count": 1
    },
    {
      "url": null,
      "urls": [],
      "link_texts": [],
      "menu_files": [
        "Menus/Menu week of 3-5-23.md"
      ],
      "menu_weeks": [
        "2023-03-05"
      ],
      "menu_seasons": [
        "spring"
      ],
      "meal_types": [
        "dinner"
      ],
      "sections": [],
      "source_hints": [
        "Friday"
      ],
      "item_texts": [
        "Spicy shrimp veracruz (Friday)"
      ],
      "count": 1
    },
    {
      "url": null,
      "urls": [],
      "link_texts": [],
      "menu_files": [
        "Menus/Menu week of 3-5-23.md"
      ],
      "menu_weeks": [
        "2023-03-05"
      ],
      "menu_seasons": [
        "spring"
      ],
      "meal_types": [
        "dinner"
      ],
      "sections": [],
      "source_hints": [
        "Tuesday"
      ],
      "item_texts": [
        "Chopped salad pizza (maybe, or maybe just pizza and salad) (Tuesday)"
      ],
      "count": 1
    },
    {
      "url": null,
      "urls": [],
      "link_texts": [],
      "menu_files": [
        "Menus/Menu week of 3-5-23.md"
      ],
      "menu_weeks": [
        "2023-03-05"
      ],
      "menu_seasons": [
        "spring"
      ],
      "meal_types": [
        "dinner"
      ],
      "sections": [],
      "source_hints": [
        "Monday"
      ],
      "item_texts": [
        "Ginger chicken meatball sandos (Monday)"
      ],
      "count": 1
    },
    {
      "url": null,
      "urls": [],
      "link_texts": [],
      "menu_files": [
        "Menus/Menu week of 3-7-20.md"
      ],
      "menu_weeks": [
        "2020-03-07"
      ],
      "menu_seasons": [
        "spring"
      ],
      "meal_types": [
        "dinner"
      ],
      "sections": [],
      "source_hints": [],
      "item_texts": [
        "Healthy Orange chicken"
      ],
      "count": 1
    },
    {
      "url": null,
      "urls": [],
      "link_texts": [],
      "menu_files": [
        "Menus/Menu week of 3-7-20.md"
      ],
      "menu_weeks": [
        "2020-03-07"
      ],
      "menu_seasons": [
        "spring"
      ],
      "meal_types": [
        "dinner"
      ],
      "sections": [],
      "source_hints": [
        "Vegetarian"
      ],
      "item_texts": [
        "Curried tomato tortellini soup (Vegetarian)"
      ],
      "count": 1
    },
    {
      "url": null,
      "urls": [],
      "link_texts": [],
      "menu_files": [
        "Menus/Menu week of 3-7-20.md"
      ],
      "menu_weeks": [
        "2020-03-07"
      ],
      "menu_seasons": [
        "spring"
      ],
      "meal_types": [
        "dinner"
      ],
      "sections": [],
      "source_hints": [
        "need to make dough"
      ],
      "item_texts": [
        "Corned beef and cabbagePizza (need to make dough)"
      ],
      "count": 1
    },
    {
      "url": null,
      "urls": [],
      "link_texts": [],
      "menu_files": [
        "Menus/Menu week of 3-7-20.md"
      ],
      "menu_weeks": [
        "2020-03-07"
      ],
      "menu_seasons": [
        "spring"
      ],
      "meal_types": [
        "dinner"
      ],
      "sections": [],
      "source_hints": [
        "Vegetarian"
      ],
      "item_texts": [
        "Easy weeknight peanut noodles with roasted broccoli (double) (Vegetarian)"
      ],
      "count": 1
    },
    {
      "url": null,
      "urls": [],
      "link_texts": [],
      "menu_files": [
        "Menus/Menu week of 3-7-20.md"
      ],
      "menu_weeks": [
        "2020-03-07"
      ],
      "menu_seasons": [
        "spring"
      ],
      "meal_types": [
        "dinner"
      ],
      "sections": [],
      "source_hints": [
        "serve with quinoa"
      ],
      "item_texts": [
        "Korean beef bowls (serve with quinoa)"
      ],
      "count": 1
    },
    {
      "url": null,
      "urls": [],
      "link_texts": [],
      "menu_files": [
        "Menus/Menu week of 3-7-20.md"
      ],
      "menu_weeks": [
        "2020-03-07"
      ],
      "menu_seasons": [
        "spring"
      ],
      "meal_types": [
        "dinner"
      ],
      "sections": [],
      "source_hints": [],
      "item_texts": [
        "Steak and roasted parsnips and beets"
      ],
      "count": 1
    },
    {
      "url": null,
      "urls": [],
      "link_texts": [],
      "menu_files": [
        "Menus/Menu week of 3-7-20.md"
      ],
      "menu_weeks": [
        "2020-03-07"
      ],
      "menu_seasons": [
        "spring"
      ],
      "meal_types": [
        "breakfast"
      ],
      "sections": [],
      "source_hints": [],
      "item_texts": [
        "Meal prep breakfast sandwiches"
      ],
      "count": 1
    },
    {
      "url": null,
      "urls": [],
      "link_texts": [],
      "menu_files": [
        "Menus/Menu week of 3-9-21.md"
      ],
      "menu_weeks": [
        "2021-03-09"
      ],
      "menu_seasons": [
        "spring"
      ],
      "meal_types": [
        "dinner"
      ],
      "sections": [],
      "source_hints": [],
      "item_texts": [
        "St Patrick\u2019s Day: Corned beef, cabbage, and potatoes"
      ],
      "count": 1
    },
    {
      "url": null,
      "urls": [],
      "link_texts": [],
      "menu_files": [
        "Menus/Menu week of 3-9-21.md"
      ],
      "menu_weeks": [
        "2021-03-09"
      ],
      "menu_seasons": [
        "spring"
      ],
      "meal_types": [
        "dinner"
      ],
      "sections": [],
      "source_hints": [],
      "item_texts": [
        "Crockpot white chicken chili"
      ],
      "count": 1
    },
    {
      "url": null,
      "urls": [],
      "link_texts": [],
      "menu_files": [
        "Menus/Menu week of 3-9-21.md"
      ],
      "menu_weeks": [
        "2021-03-09"
      ],
      "menu_seasons": [
        "spring"
      ],
      "meal_types": [
        "breakfast"
      ],
      "sections": [],
      "source_hints": [],
      "item_texts": [
        "Weekend: Irish breakfast, soda bread muffins"
      ],
      "count": 1
    },
    {
      "url": null,
      "urls": [],
      "link_texts": [],
      "menu_files": [
        "Menus/Menu week of 3-9-21.md"
      ],
      "menu_weeks": [
        "2021-03-09"
      ],
      "menu_seasons": [
        "spring"
      ],
      "meal_types": [
        "dinner"
      ],
      "sections": [],
      "source_hints": [],
      "item_texts": [
        "Pasta with goat cheese, chicken, asparagus, and mushrooms"
      ],
      "count": 1
    },
    {
      "url": null,
      "urls": [],
      "link_texts": [],
      "menu_files": [
        "Menus/Menu week of 4-10-19.md"
      ],
      "menu_weeks": [
        "2019-04-10"
      ],
      "menu_seasons": [
        "spring"
      ],
      "meal_types": [
        "dinner"
      ],
      "sections": [],
      "source_hints": [],
      "item_texts": [
        "Wednesday: Tandoori chicken and salad"
      ],
      "count": 1
    },
    {
      "url": null,
      "urls": [],
      "link_texts": [],
      "menu_files": [
        "Menus/Menu week of 4-10-19.md"
      ],
      "menu_weeks": [
        "2019-04-10"
      ],
      "menu_seasons": [
        "spring"
      ],
      "meal_types": [
        "dinner"
      ],
      "sections": [],
      "source_hints": [],
      "item_texts": [
        "Roasted red pepper cauliflower pasta"
      ],
      "count": 1
    },
    {
      "url": null,
      "urls": [],
      "link_texts": [],
      "menu_files": [
        "Menus/Menu week of 4-10-19.md"
      ],
      "menu_weeks": [
        "2019-04-10"
      ],
      "menu_seasons": [
        "spring"
      ],
      "meal_types": [
        "dinner"
      ],
      "sections": [],
      "source_hints": [],
      "item_texts": [
        "Crispy chicken, bacon, pesto gnocchi skillet"
      ],
      "count": 1
    },
    {
      "url": null,
      "urls": [],
      "link_texts": [],
      "menu_files": [
        "Menus/Menu week of 4-10-19.md"
      ],
      "menu_weeks": [
        "2019-04-10"
      ],
      "menu_seasons": [
        "spring"
      ],
      "meal_types": [
        "dinner"
      ],
      "sections": [],
      "source_hints": [],
      "item_texts": [
        "5 ingredient green curry with tofu"
      ],
      "count": 1
    },
    {
      "url": null,
      "urls": [],
      "link_texts": [],
      "menu_files": [
        "Menus/Menu week of 4-10-19.md"
      ],
      "menu_weeks": [
        "2019-04-10"
      ],
      "menu_seasons": [
        "spring"
      ],
      "meal_types": [
        "dinner"
      ],
      "sections": [],
      "source_hints": [
        "Andrea and Cliff\u2019s"
      ],
      "item_texts": [
        "Friday: Panera creamy tomato soup, grilled cheese, every day italian salad, chocolate chip cookies (Andrea and Cliff\u2019s)"
      ],
      "count": 1
    },
    {
      "url": null,
      "urls": [],
      "link_texts": [],
      "menu_files": [
        "Menus/Menu week of 4-10-19.md"
      ],
      "menu_weeks": [
        "2019-04-10"
      ],
      "menu_seasons": [
        "spring"
      ],
      "meal_types": [
        "dinner"
      ],
      "sections": [],
      "source_hints": [],
      "item_texts": [
        "Pizza"
      ],
      "count": 1
    },
    {
      "url": null,
      "urls": [],
      "link_texts": [],
      "menu_files": [
        "Menus/Menu week of 4-10-19.md"
      ],
      "menu_weeks": [
        "2019-04-10"
      ],
      "menu_seasons": [
        "spring"
      ],
      "meal_types": [
        "dinner"
      ],
      "sections": [],
      "source_hints": [],
      "item_texts": [
        "Quinoa stuffed peppers"
      ],
      "count": 1
    },
    {
      "url": null,
      "urls": [],
      "link_texts": [],
      "menu_files": [
        "Menus/Menu week of 4-10-22.md"
      ],
      "menu_weeks": [
        "2022-04-10"
      ],
      "menu_seasons": [
        "spring"
      ],
      "meal_types": [
        "dinner"
      ],
      "sections": [],
      "source_hints": [],
      "item_texts": [
        "slow cooker vegetarian chili (gimme some oven) and quesadillas"
      ],
      "count": 1
    },
    {
      "url": null,
      "urls": [],
      "link_texts": [],
      "menu_files": [
        "Menus/Menu week of 4-10-22.md"
      ],
      "menu_weeks": [
        "2022-04-10"
      ],
      "menu_seasons": [
        "spring"
      ],
      "meal_types": [
        "dinner"
      ],
      "sections": [],
      "source_hints": [],
      "item_texts": [
        "Smokey beans and greens tacos with aji verde"
      ],
      "count": 1
    },
    {
      "url": null,
      "urls": [],
      "link_texts": [],
      "menu_files": [
        "Menus/Menu week of 4-10-22.md"
      ],
      "menu_weeks": [
        "2022-04-10"
      ],
      "menu_seasons": [
        "spring"
      ],
      "meal_types": [
        "dinner"
      ],
      "sections": [],
      "source_hints": [],
      "item_texts": [
        "Creamy red pepper pasta with blistered tomatoes"
      ],
      "count": 1
    },
    {
      "url": null,
      "urls": [],
      "link_texts": [],
      "menu_files": [
        "Menus/Menu week of 4-10-22.md"
      ],
      "menu_weeks": [
        "2022-04-10"
      ],
      "menu_seasons": [
        "spring"
      ],
      "meal_types": [
        "dinner"
      ],
      "sections": [],
      "source_hints": [],
      "item_texts": [
        "Blue apron chicken"
      ],
      "count": 1
    },
    {
      "url": null,
      "urls": [],
      "link_texts": [],
      "menu_files": [
        "Menus/Menu week of 4-10-22.md"
      ],
      "menu_weeks": [
        "2022-04-10"
      ],
      "menu_seasons": [
        "spring"
      ],
      "meal_types": [
        "dinner"
      ],
      "sections": [],
      "source_hints": [],
      "item_texts": [
        "Blue apron quiche"
      ],
      "count": 1
    },
    {
      "url": null,
      "urls": [],
      "link_texts": [],
      "menu_files": [
        "Menus/Menu week of 4-10-22.md"
      ],
      "menu_weeks": [
        "2022-04-10"
      ],
      "menu_seasons": [
        "spring"
      ],
      "meal_types": [
        "dinner"
      ],
      "sections": [],
      "source_hints": [],
      "item_texts": [
        "Easter dinner: lemon chicken skewers with creamy feta sauce (half baked harvest), roasted yellow potatoes, flatbread"
      ],
      "count": 1
    },
    {
      "url": null,
      "urls": [],
      "link_texts": [],
      "menu_files": [
        "Menus/Menu week of 4-10-22.md"
      ],
      "menu_weeks": [
        "2022-04-10"
      ],
      "menu_seasons": [
        "spring"
      ],
      "meal_types": [
        "breakfast"
      ],
      "sections": [],
      "source_hints": [],
      "item_texts": [
        "Easter breakfast: monkeys, eggs, moms fancy bacon, fruit"
      ],
      "count": 1
    },
    {
      "url": null,
      "urls": [],
      "link_texts": [],
      "menu_files": [
        "Menus/Menu week of 4-10-22.md"
      ],
      "menu_weeks": [
        "2022-04-10"
      ],
      "menu_seasons": [
        "spring"
      ],
      "meal_types": [
        "dinner"
      ],
      "sections": [],
      "source_hints": [],
      "item_texts": [
        "Saturday: order out"
      ],
      "count": 1
    },
    {
      "url": null,
      "urls": [],
      "link_texts": [],
      "menu_files": [
        "Menus/Menu week of 4-10-22.md"
      ],
      "menu_weeks": [
        "2022-04-10"
      ],
      "menu_seasons": [
        "spring"
      ],
      "meal_types": [
        "dinner"
      ],
      "sections": [],
      "source_hints": [],
      "item_texts": [
        "Friday: mac and cheese and salad"
      ],
      "count": 1
    },
    {
      "url": null,
      "urls": [],
      "link_texts": [],
      "menu_files": [
        "Menus/Menu week of 4-10-22.md"
      ],
      "menu_weeks": [
        "2022-04-10"
      ],
      "menu_seasons": [
        "spring"
      ],
      "meal_types": [
        "dinner"
      ],
      "sections": [],
      "source_hints": [],
      "item_texts": [
        "Blue apron salmon"
      ],
      "count": 1
    },
    {
      "url": null,
      "urls": [],
      "link_texts": [],
      "menu_files": [
        "Menus/Menu week of 4-10-22.md"
      ],
      "menu_weeks": [
        "2022-04-10"
      ],
      "menu_seasons": [
        "spring"
      ],
      "meal_types": [
        "dinner"
      ],
      "sections": [],
      "source_hints": [],
      "item_texts": [
        "Monday: Chicken meatballs with peppers and orzo"
      ],
      "count": 1
    },
    {
      "url": null,
      "urls": [],
      "link_texts": [],
      "menu_files": [
        "Menus/Menu week of 4-13-21.md"
      ],
      "menu_weeks": [
        "2021-04-13"
      ],
      "menu_seasons": [
        "spring"
      ],
      "meal_types": [
        "dinner"
      ],
      "sections": [],
      "source_hints": [
        "make chicken in instant pot"
      ],
      "item_texts": [
        "Easy chicken enchilada casserole (make chicken in instant pot)"
      ],
      "count": 1
    },
    {
      "url": null,
      "urls": [],
      "link_texts": [],
      "menu_files": [
        "Menus/Menu week of 4-13-21.md"
      ],
      "menu_weeks": [
        "2021-04-13"
      ],
      "menu_seasons": [
        "spring"
      ],
      "meal_types": [
        "dinner"
      ],
      "sections": [],
      "source_hints": [],
      "item_texts": [
        "Panera Creamy Tomato Soup and grilled cheese"
      ],
      "count": 1
    },
    {
      "url": null,
      "urls": [],
      "link_texts": [],
      "menu_files": [
        "Menus/Menu week of 4-13-21.md"
      ],
      "menu_weeks": [
        "2021-04-13"
      ],
      "menu_seasons": [
        "spring"
      ],
      "meal_types": [
        "dinner"
      ],
      "sections": [],
      "source_hints": [],
      "item_texts": [
        "Filipino bbq on grill, grilled peppers and zucchini/squash"
      ],
      "count": 1
    },
    {
      "url": null,
      "urls": [],
      "link_texts": [],
      "menu_files": [
        "Menus/Menu week of 4-13-21.md"
      ],
      "menu_weeks": [
        "2021-04-13"
      ],
      "menu_seasons": [
        "spring"
      ],
      "meal_types": [
        "dinner"
      ],
      "sections": [],
      "source_hints": [
        "Lemon brown butter salmon with potatoes and parmesan asparagus skip the arugula salad in the recipe"
      ],
      "item_texts": [
        "(Lemon brown butter salmon with potatoes and parmesan asparagus skip the arugula salad in the recipe)"
      ],
      "count": 1
    },
    {
      "url": null,
      "urls": [],
      "link_texts": [],
      "menu_files": [
        "Menus/Menu week of 4-16-18.md"
      ],
      "menu_weeks": [
        "2018-04-16"
      ],
      "menu_seasons": [
        "spring"
      ],
      "meal_types": [
        "dinner"
      ],
      "sections": [],
      "source_hints": [],
      "item_texts": [
        "Curried satay veggie bowls"
      ],
      "count": 1
    },
    {
      "url": null,
      "urls": [],
      "link_texts": [],
      "menu_files": [
        "Menus/Menu week of 4-16-18.md"
      ],
      "menu_weeks": [
        "2018-04-16"
      ],
      "menu_seasons": [
        "spring"
      ],
      "meal_types": [
        "dinner"
      ],
      "sections": [],
      "source_hints": [],
      "item_texts": [
        "Buffalo cauliflower tacos with avocado crema"
      ],
      "count": 1
    },
    {
      "url": null,
      "urls": [],
      "link_texts": [],
      "menu_files": [
        "Menus/Menu week of 4-16-18.md"
      ],
      "menu_weeks": [
        "2018-04-16"
      ],
      "menu_seasons": [
        "spring"
      ],
      "meal_types": [
        "dinner"
      ],
      "sections": [],
      "source_hints": [],
      "item_texts": [
        "Crispy chicken bacon and pesto gnocchi skillet with cherry tomatoes"
      ],
      "count": 1
    },
    {
      "url": null,
      "urls": [],
      "link_texts": [],
      "menu_files": [
        "Menus/Menu week of 4-16-18.md"
      ],
      "menu_weeks": [
        "2018-04-16"
      ],
      "menu_seasons": [
        "spring"
      ],
      "meal_types": [
        "dinner"
      ],
      "sections": [],
      "source_hints": [],
      "item_texts": [
        "Spicy peanut chicken soba noodle salad"
      ],
      "count": 1
    },
    {
      "url": null,
      "urls": [],
      "link_texts": [],
      "menu_files": [
        "Menus/Menu week of 4-16-18.md"
      ],
      "menu_weeks": [
        "2018-04-16"
      ],
      "menu_seasons": [
        "spring"
      ],
      "meal_types": [
        "dinner"
      ],
      "sections": [],
      "source_hints": [],
      "item_texts": [
        "Pizza"
      ],
      "count": 1
    },
    {
      "url": null,
      "urls": [],
      "link_texts": [],
      "menu_files": [
        "Menus/Menu week of 4-16-18.md"
      ],
      "menu_weeks": [
        "2018-04-16"
      ],
      "menu_seasons": [
        "spring"
      ],
      "meal_types": [
        "dinner"
      ],
      "sections": [],
      "source_hints": [],
      "item_texts": [
        "Fajitas"
      ],
      "count": 1
    },
    {
      "url": null,
      "urls": [],
      "link_texts": [],
      "menu_files": [
        "Menus/Menu week of 4-2-2020.md"
      ],
      "menu_weeks": [
        "2020-04-02"
      ],
      "menu_seasons": [
        "spring"
      ],
      "meal_types": [
        "dinner"
      ],
      "sections": [],
      "source_hints": [
        "freeze"
      ],
      "item_texts": [
        "Quinoa Stuffed peppers (freeze)"
      ],
      "count": 1
    },
    {
      "url": null,
      "urls": [],
      "link_texts": [],
      "menu_files": [
        "Menus/Menu week of 4-2-2020.md"
      ],
      "menu_weeks": [
        "2020-04-02"
      ],
      "menu_seasons": [
        "spring"
      ],
      "meal_types": [
        "dinner"
      ],
      "sections": [],
      "source_hints": [],
      "item_texts": [
        "Pizza"
      ],
      "count": 1
    },
    {
      "url": null,
      "urls": [],
      "link_texts": [],
      "menu_files": [
        "Menus/Menu week of 4-2-2020.md"
      ],
      "menu_weeks": [
        "2020-04-02"
      ],
      "menu_seasons": [
        "spring"
      ],
      "meal_types": [
        "dinner"
      ],
      "sections": [],
      "source_hints": [],
      "item_texts": [
        "Lemon asparagus chicken"
      ],
      "count": 1
    },
    {
      "url": null,
      "urls": [],
      "link_texts": [],
      "menu_files": [
        "Menus/Menu week of 4-2-2020.md"
      ],
      "menu_weeks": [
        "2020-04-02"
      ],
      "menu_seasons": [
        "spring"
      ],
      "meal_types": [
        "dinner"
      ],
      "sections": [],
      "source_hints": [],
      "item_texts": [
        "Easter: ham, mustard sauce, sweet potatoes, green bean casserole, carrot cake cheesecake"
      ],
      "count": 1
    },
    {
      "url": null,
      "urls": [],
      "link_texts": [],
      "menu_files": [
        "Menus/Menu week of 4-2-2020.md"
      ],
      "menu_weeks": [
        "2020-04-02"
      ],
      "menu_seasons": [
        "spring"
      ],
      "meal_types": [
        "dinner"
      ],
      "sections": [],
      "source_hints": [],
      "item_texts": [
        "Black bean soup"
      ],
      "count": 1
    },
    {
      "url": null,
      "urls": [],
      "link_texts": [],
      "menu_files": [
        "Menus/Menu week of 4-2-2020.md"
      ],
      "menu_weeks": [
        "2020-04-02"
      ],
      "menu_seasons": [
        "spring"
      ],
      "meal_types": [
        "dinner"
      ],
      "sections": [],
      "source_hints": [],
      "item_texts": [
        "Greek quinoa salad"
      ],
      "count": 1
    },
    {
      "url": null,
      "urls": [],
      "link_texts": [],
      "menu_files": [
        "Menus/Menu week of 4-2-2020.md"
      ],
      "menu_weeks": [
        "2020-04-02"
      ],
      "menu_seasons": [
        "spring"
      ],
      "meal_types": [
        "dinner"
      ],
      "sections": [],
      "source_hints": [],
      "item_texts": [
        "Pasta with goat cheese, asparagus, mushrooms, and chicken"
      ],
      "count": 1
    },
    {
      "url": null,
      "urls": [],
      "link_texts": [],
      "menu_files": [
        "Menus/Menu week of 4-2-2020.md"
      ],
      "menu_weeks": [
        "2020-04-02"
      ],
      "menu_seasons": [
        "spring"
      ],
      "meal_types": [
        "dinner"
      ],
      "sections": [],
      "source_hints": [],
      "item_texts": [
        "Burgers and asparagus"
      ],
      "count": 1
    },
    {
      "url": null,
      "urls": [],
      "link_texts": [],
      "menu_files": [
        "Menus/Menu week of 4-20-24.md"
      ],
      "menu_weeks": [
        "2024-04-20"
      ],
      "menu_seasons": [
        "spring"
      ],
      "meal_types": [
        "dinner"
      ],
      "sections": [],
      "source_hints": [],
      "item_texts": [
        "Coconut Lime Grilled Chicken (pinch of yum) with zucchini and squash"
      ],
      "count": 1
    },
    {
      "url": null,
      "urls": [],
      "link_texts": [],
      "menu_files": [
        "Menus/Menu week of 4-20-24.md"
      ],
      "menu_weeks": [
        "2024-04-20"
      ],
      "menu_seasons": [
        "spring"
      ],
      "meal_types": [
        "dinner"
      ],
      "sections": [],
      "source_hints": [],
      "item_texts": [
        "Tomato soup and grilled cheese"
      ],
      "count": 1
    },
    {
      "url": null,
      "urls": [],
      "link_texts": [],
      "menu_files": [
        "Menus/Menu week of 4-20-24.md"
      ],
      "menu_weeks": [
        "2024-04-20"
      ],
      "menu_seasons": [
        "spring"
      ],
      "meal_types": [
        "dinner"
      ],
      "sections": [],
      "source_hints": [],
      "item_texts": [
        "BBQ jackfruit sandwiches, sweet potato fries, fruit"
      ],
      "count": 1
    },
    {
      "url": null,
      "urls": [],
      "link_texts": [],
      "menu_files": [
        "Menus/Menu week of 4-20-24.md"
      ],
      "menu_weeks": [
        "2024-04-20"
      ],
      "menu_seasons": [
        "spring"
      ],
      "meal_types": [
        "dinner"
      ],
      "sections": [],
      "source_hints": [],
      "item_texts": [
        "Buffalo Ranch chopped salad kit with chicken fingers"
      ],
      "count": 1
    },
    {
      "url": null,
      "urls": [],
      "link_texts": [],
      "menu_files": [
        "Menus/Menu week of 4-20-24.md"
      ],
      "menu_weeks": [
        "2024-04-20"
      ],
      "menu_seasons": [
        "spring"
      ],
      "meal_types": [
        "dinner"
      ],
      "sections": [],
      "source_hints": [
        "Pinch of Yum"
      ],
      "item_texts": [
        "Creamy red pepper pasta with blistered tomatoes (Pinch of Yum)"
      ],
      "count": 1
    },
    {
      "url": null,
      "urls": [],
      "link_texts": [],
      "menu_files": [
        "Menus/Menu week of 4-20-24.md"
      ],
      "menu_weeks": [
        "2024-04-20"
      ],
      "menu_seasons": [
        "spring"
      ],
      "meal_types": [
        "dinner"
      ],
      "sections": [],
      "source_hints": [
        "Pinch of Yum"
      ],
      "item_texts": [
        "Crispy chicken tikka bowls (Pinch of Yum)"
      ],
      "count": 1
    },
    {
      "url": null,
      "urls": [],
      "link_texts": [],
      "menu_files": [
        "Menus/Menu week of 4-21-19.md"
      ],
      "menu_weeks": [
        "2019-04-21"
      ],
      "menu_seasons": [
        "spring"
      ],
      "meal_types": [
        "dinner"
      ],
      "sections": [],
      "source_hints": [],
      "item_texts": [
        "Easter Sunday: ham, mustard sauce, asparagus, sean family sweet potatoes, green bean casserole, dinner rolls"
      ],
      "count": 1
    },
    {
      "url": null,
      "urls": [],
      "link_texts": [],
      "menu_files": [
        "Menus/Menu week of 4-21-19.md"
      ],
      "menu_weeks": [
        "2019-04-21"
      ],
      "menu_seasons": [
        "spring"
      ],
      "meal_types": [
        "dinner"
      ],
      "sections": [],
      "source_hints": [],
      "item_texts": [
        "Strawberry faro salad with avocado and feta"
      ],
      "count": 1
    },
    {
      "url": null,
      "urls": [],
      "link_texts": [],
      "menu_files": [
        "Menus/Menu week of 4-21-19.md"
      ],
      "menu_weeks": [
        "2019-04-21"
      ],
      "menu_seasons": [
        "spring"
      ],
      "meal_types": [
        "dinner"
      ],
      "sections": [],
      "source_hints": [],
      "item_texts": [
        "Burrito bowls with cauliflower walnut taco meat"
      ],
      "count": 1
    },
    {
      "url": null,
      "urls": [],
      "link_texts": [],
      "menu_files": [
        "Menus/Menu week of 4-21-19.md"
      ],
      "menu_weeks": [
        "2019-04-21"
      ],
      "menu_seasons": [
        "spring"
      ],
      "meal_types": [
        "dinner"
      ],
      "sections": [],
      "source_hints": [],
      "item_texts": [
        "Beef rag\u00fa with spaghetti, bag salad"
      ],
      "count": 1
    },
    {
      "url": null,
      "urls": [],
      "link_texts": [],
      "menu_files": [
        "Menus/Menu week of 4-21-19.md"
      ],
      "menu_weeks": [
        "2019-04-21"
      ],
      "menu_seasons": [
        "spring"
      ],
      "meal_types": [
        "dinner"
      ],
      "sections": [],
      "source_hints": [],
      "item_texts": [
        "Egg salad and dill roasted potatoes"
      ],
      "count": 1
    },
    {
      "url": null,
      "urls": [],
      "link_texts": [],
      "menu_files": [
        "Menus/Menu week of 4-21-19.md"
      ],
      "menu_weeks": [
        "2019-04-21"
      ],
      "menu_seasons": [
        "spring"
      ],
      "meal_types": [
        "dinner"
      ],
      "sections": [],
      "source_hints": [],
      "item_texts": [
        "Burgers, zucchini and squash, sweet potato fries"
      ],
      "count": 1
    },
    {
      "url": null,
      "urls": [],
      "link_texts": [],
      "menu_files": [
        "Menus/Menu week of 4-22-20.md"
      ],
      "menu_weeks": [
        "2020-04-22"
      ],
      "menu_seasons": [
        "spring"
      ],
      "meal_types": [
        "dinner"
      ],
      "sections": [],
      "source_hints": [
        "freeze"
      ],
      "item_texts": [
        "Quinoa Stuffed peppers (freeze)"
      ],
      "count": 1
    },
    {
      "url": null,
      "urls": [],
      "link_texts": [],
      "menu_files": [
        "Menus/Menu week of 4-22-20.md"
      ],
      "menu_weeks": [
        "2020-04-22"
      ],
      "menu_seasons": [
        "spring"
      ],
      "meal_types": [
        "dinner"
      ],
      "sections": [],
      "source_hints": [],
      "item_texts": [
        "Instant Pot Italian beef sandwiches, bagged side salad"
      ],
      "count": 1
    },
    {
      "url": null,
      "urls": [],
      "link_texts": [],
      "menu_files": [
        "Menus/Menu week of 4-22-20.md"
      ],
      "menu_weeks": [
        "2020-04-22"
      ],
      "menu_seasons": [
        "spring"
      ],
      "meal_types": [
        "dinner"
      ],
      "sections": [],
      "source_hints": [
        "veg"
      ],
      "item_texts": [
        "Bulgar salad (veg)"
      ],
      "count": 1
    },
    {
      "url": null,
      "urls": [],
      "link_texts": [],
      "menu_files": [
        "Menus/Menu week of 4-22-20.md"
      ],
      "menu_weeks": [
        "2020-04-22"
      ],
      "menu_seasons": [
        "spring"
      ],
      "meal_types": [
        "dinner"
      ],
      "sections": [],
      "source_hints": [
        "veg"
      ],
      "item_texts": [
        "Panzanella with marinated chickpeas and chimichurri (veg)"
      ],
      "count": 1
    },
    {
      "url": null,
      "urls": [],
      "link_texts": [],
      "menu_files": [
        "Menus/Menu week of 4-22-20.md"
      ],
      "menu_weeks": [
        "2020-04-22"
      ],
      "menu_seasons": [
        "spring"
      ],
      "meal_types": [
        "dinner"
      ],
      "sections": [],
      "source_hints": [],
      "item_texts": [
        "Italian drunken noodles"
      ],
      "count": 1
    },
    {
      "url": null,
      "urls": [],
      "link_texts": [],
      "menu_files": [
        "Menus/Menu week of 4-22-20.md"
      ],
      "menu_weeks": [
        "2020-04-22"
      ],
      "menu_seasons": [
        "spring"
      ],
      "meal_types": [
        "dinner"
      ],
      "sections": [],
      "source_hints": [],
      "item_texts": [
        "Sheet pan chicken pitas with tzatziki"
      ],
      "count": 1
    },
    {
      "url": null,
      "urls": [],
      "link_texts": [],
      "menu_files": [
        "Menus/Menu week of 4-22-20.md"
      ],
      "menu_weeks": [
        "2020-04-22"
      ],
      "menu_seasons": [
        "spring"
      ],
      "meal_types": [
        "dinner"
      ],
      "sections": [],
      "source_hints": [],
      "item_texts": [
        "Caesar salad"
      ],
      "count": 1
    },
    {
      "url": null,
      "urls": [],
      "link_texts": [],
      "menu_files": [
        "Menus/Menu week of 4-22-20.md"
      ],
      "menu_weeks": [
        "2020-04-22"
      ],
      "menu_seasons": [
        "spring"
      ],
      "meal_types": [
        "dinner"
      ],
      "sections": [],
      "source_hints": [],
      "item_texts": [
        "Egg sal san"
      ],
      "count": 1
    },
    {
      "url": null,
      "urls": [],
      "link_texts": [],
      "menu_files": [
        "Menus/Menu week of 4-22-20.md"
      ],
      "menu_weeks": [
        "2020-04-22"
      ],
      "menu_seasons": [
        "spring"
      ],
      "meal_types": [
        "breakfast"
      ],
      "sections": [],
      "source_hints": [],
      "item_texts": [
        "Weekend breakfast: Instant Pot steel cut oats"
      ],
      "count": 1
    },
    {
      "url": null,
      "urls": [],
      "link_texts": [],
      "menu_files": [
        "Menus/Menu week of 4-23-23.md"
      ],
      "menu_weeks": [
        "2023-04-23"
      ],
      "menu_seasons": [
        "spring"
      ],
      "meal_types": [
        "dinner"
      ],
      "sections": [],
      "source_hints": [
        "Skinnytaste"
      ],
      "item_texts": [
        "Roasted sweet potato black bean bowls (Skinnytaste)"
      ],
      "count": 1
    },
    {
      "url": null,
      "urls": [],
      "link_texts": [],
      "menu_files": [
        "Menus/Menu week of 4-23-23.md"
      ],
      "menu_weeks": [
        "2023-04-23"
      ],
      "menu_seasons": [
        "spring"
      ],
      "meal_types": [
        "dinner"
      ],
      "sections": [],
      "source_hints": [],
      "item_texts": [
        "Instant pot bbq pulled pork (Damn Delicious), slaw, and sweet potato fries"
      ],
      "count": 1
    },
    {
      "url": null,
      "urls": [],
      "link_texts": [],
      "menu_files": [
        "Menus/Menu week of 4-23-23.md"
      ],
      "menu_weeks": [
        "2023-04-23"
      ],
      "menu_seasons": [
        "spring"
      ],
      "meal_types": [
        "dinner"
      ],
      "sections": [],
      "source_hints": [],
      "item_texts": [
        "Roasted red pepper pasta with cauliflower (Pinch of Yum) - pasta sauce in freezer"
      ],
      "count": 1
    },
    {
      "url": null,
      "urls": [],
      "link_texts": [],
      "menu_files": [
        "Menus/Menu week of 4-23-23.md"
      ],
      "menu_weeks": [
        "2023-04-23"
      ],
      "menu_seasons": [
        "spring"
      ],
      "meal_types": [
        "dinner"
      ],
      "sections": [],
      "source_hints": [],
      "item_texts": [
        "Steak, asparagus, potatoes"
      ],
      "count": 1
    },
    {
      "url": null,
      "urls": [],
      "link_texts": [],
      "menu_files": [
        "Menus/Menu week of 4-28-22.md"
      ],
      "menu_weeks": [
        "2022-04-28"
      ],
      "menu_seasons": [
        "spring"
      ],
      "meal_types": [
        "dinner"
      ],
      "sections": [],
      "source_hints": [],
      "item_texts": [
        "Sheet pan chicken pitas"
      ],
      "count": 1
    },
    {
      "url": null,
      "urls": [],
      "link_texts": [],
      "menu_files": [
        "Menus/Menu week of 4-28-22.md"
      ],
      "menu_weeks": [
        "2022-04-28"
      ],
      "menu_seasons": [
        "spring"
      ],
      "meal_types": [
        "dinner"
      ],
      "sections": [],
      "source_hints": [],
      "item_texts": [
        "Burgers and grilled asparagus, chips"
      ],
      "count": 1
    },
    {
      "url": null,
      "urls": [],
      "link_texts": [],
      "menu_files": [
        "Menus/Menu week of 4-28-22.md"
      ],
      "menu_weeks": [
        "2022-04-28"
      ],
      "menu_seasons": [
        "spring"
      ],
      "meal_types": [
        "dinner"
      ],
      "sections": [],
      "source_hints": [],
      "item_texts": [
        "Skyline and bagged salad"
      ],
      "count": 1
    },
    {
      "url": null,
      "urls": [],
      "link_texts": [],
      "menu_files": [
        "Menus/Menu week of 4-28-22.md"
      ],
      "menu_weeks": [
        "2022-04-28"
      ],
      "menu_seasons": [
        "spring"
      ],
      "meal_types": [
        "dinner"
      ],
      "sections": [],
      "source_hints": [],
      "item_texts": [
        "Egg sal san"
      ],
      "count": 1
    },
    {
      "url": null,
      "urls": [],
      "link_texts": [],
      "menu_files": [
        "Menus/Menu week of 4-28-25.md"
      ],
      "menu_weeks": [
        "2025-04-28"
      ],
      "menu_seasons": [
        "spring"
      ],
      "meal_types": [
        "dinner"
      ],
      "sections": [],
      "source_hints": [],
      "item_texts": [
        "Sub mango for pineapple"
      ],
      "count": 1
    },
    {
      "url": null,
      "urls": [],
      "link_texts": [],
      "menu_files": [
        "Menus/Menu week of 4-28-25.md"
      ],
      "menu_weeks": [
        "2025-04-28"
      ],
      "menu_seasons": [
        "spring"
      ],
      "meal_types": [
        "dinner"
      ],
      "sections": [],
      "source_hints": [],
      "item_texts": [
        "Chicken nuggets, broccoli, sweet potato fries"
      ],
      "count": 1
    },
    {
      "url": null,
      "urls": [],
      "link_texts": [],
      "menu_files": [
        "Menus/Menu week of 4-3-21.md"
      ],
      "menu_weeks": [
        "2021-04-03"
      ],
      "menu_seasons": [
        "spring"
      ],
      "meal_types": [
        "dinner"
      ],
      "sections": [],
      "source_hints": [],
      "item_texts": [
        "Bacon"
      ],
      "count": 1
    },
    {
      "url": null,
      "urls": [],
      "link_texts": [],
      "menu_files": [
        "Menus/Menu week of 4-3-21.md"
      ],
      "menu_weeks": [
        "2021-04-03"
      ],
      "menu_seasons": [
        "spring"
      ],
      "meal_types": [
        "dinner"
      ],
      "sections": [],
      "source_hints": [
        "mom bringing"
      ],
      "item_texts": [
        "Fruit (mom bringing)"
      ],
      "count": 1
    },
    {
      "url": null,
      "urls": [],
      "link_texts": [],
      "menu_files": [
        "Menus/Menu week of 4-3-21.md"
      ],
      "menu_weeks": [
        "2021-04-03"
      ],
      "menu_seasons": [
        "spring"
      ],
      "meal_types": [
        "dinner"
      ],
      "sections": [],
      "source_hints": [
        "make Saturday and refrigerate"
      ],
      "item_texts": [
        "Spring vegetable egg casserole (make Saturday and refrigerate)"
      ],
      "count": 1
    },
    {
      "url": null,
      "urls": [],
      "link_texts": [],
      "menu_files": [
        "Menus/Menu week of 4-3-21.md"
      ],
      "menu_weeks": [
        "2021-04-03"
      ],
      "menu_seasons": [
        "spring"
      ],
      "meal_types": [
        "dinner"
      ],
      "sections": [],
      "source_hints": [
        "make Saturday and refrigerate"
      ],
      "item_texts": [
        "Cinnamon rolls (make Saturday and refrigerate)"
      ],
      "count": 1
    },
    {
      "url": null,
      "urls": [],
      "link_texts": [],
      "menu_files": [
        "Menus/Menu week of 4-3-21.md"
      ],
      "menu_weeks": [
        "2021-04-03"
      ],
      "menu_seasons": [
        "spring"
      ],
      "meal_types": [
        "dinner"
      ],
      "sections": [],
      "source_hints": [],
      "item_texts": [
        "Easter dinner: Grilled Sausage and Peppers with Garlic Aioli, Everyday Italian salad"
      ],
      "count": 1
    },
    {
      "url": null,
      "urls": [],
      "link_texts": [],
      "menu_files": [
        "Menus/Menu week of 4-3-21.md"
      ],
      "menu_weeks": [
        "2021-04-03"
      ],
      "menu_seasons": [
        "spring"
      ],
      "meal_types": [
        "dinner"
      ],
      "sections": [],
      "source_hints": [],
      "item_texts": [
        "Spring pasta salad with honey mustard dressing"
      ],
      "count": 1
    },
    {
      "url": null,
      "urls": [],
      "link_texts": [],
      "menu_files": [
        "Menus/Menu week of 4-3-21.md"
      ],
      "menu_weeks": [
        "2021-04-03"
      ],
      "menu_seasons": [
        "spring"
      ],
      "meal_types": [
        "dinner"
      ],
      "sections": [],
      "source_hints": [],
      "item_texts": [
        "Chili"
      ],
      "count": 1
    },
    {
      "url": null,
      "urls": [],
      "link_texts": [],
      "menu_files": [
        "Menus/Menu week of 4-3-21.md"
      ],
      "menu_weeks": [
        "2021-04-03"
      ],
      "menu_seasons": [
        "spring"
      ],
      "meal_types": [
        "lunch"
      ],
      "sections": [],
      "source_hints": [],
      "item_texts": [
        "Lunch: Egg Salad Sandwiches"
      ],
      "count": 1
    },
    {
      "url": null,
      "urls": [],
      "link_texts": [],
      "menu_files": [
        "Menus/Menu week of 4-4-24.md"
      ],
      "menu_weeks": [
        "2024-04-04"
      ],
      "menu_seasons": [
        "spring"
      ],
      "meal_types": [
        "dinner"
      ],
      "sections": [],
      "source_hints": [
        "did we like this recipe?"
      ],
      "item_texts": [
        "Red Chile tostadas with eggs (did we like this recipe?)"
      ],
      "count": 1
    },
    {
      "url": null,
      "urls": [],
      "link_texts": [],
      "menu_files": [
        "Menus/Menu week of 4-4-24.md"
      ],
      "menu_weeks": [
        "2024-04-04"
      ],
      "menu_seasons": [
        "spring"
      ],
      "meal_types": [
        "dinner"
      ],
      "sections": [],
      "source_hints": [],
      "item_texts": [
        "Grilling: brats"
      ],
      "count": 1
    },
    {
      "url": null,
      "urls": [],
      "link_texts": [],
      "menu_files": [
        "Menus/Menu week of 4-4-24.md"
      ],
      "menu_weeks": [
        "2024-04-04"
      ],
      "menu_seasons": [
        "spring"
      ],
      "meal_types": [
        "lunch"
      ],
      "sections": [],
      "source_hints": [],
      "item_texts": [
        "Lunch/snacks for eclipse day?"
      ],
      "count": 1
    },
    {
      "url": null,
      "urls": [],
      "link_texts": [],
      "menu_files": [
        "Menus/Menu week of 4-4-24.md"
      ],
      "menu_weeks": [
        "2024-04-04"
      ],
      "menu_seasons": [
        "spring"
      ],
      "meal_types": [
        "dinner"
      ],
      "sections": [],
      "source_hints": [],
      "item_texts": [
        "Instant pot carnitas"
      ],
      "count": 1
    },
    {
      "url": null,
      "urls": [],
      "link_texts": [],
      "menu_files": [
        "Menus/Menu week of 4-5-23.md"
      ],
      "menu_weeks": [
        "2023-04-05"
      ],
      "menu_seasons": [
        "spring"
      ],
      "meal_types": [
        "dinner"
      ],
      "sections": [],
      "source_hints": [],
      "item_texts": [
        "Coconut Lime Grilled Chicken"
      ],
      "count": 1
    },
    {
      "url": null,
      "urls": [],
      "link_texts": [],
      "menu_files": [
        "Menus/Menu week of 4-5-23.md"
      ],
      "menu_weeks": [
        "2023-04-05"
      ],
      "menu_seasons": [
        "spring"
      ],
      "meal_types": [
        "dinner"
      ],
      "sections": [],
      "source_hints": [],
      "item_texts": [
        "Vegan mega burritos"
      ],
      "count": 1
    },
    {
      "url": null,
      "urls": [],
      "link_texts": [],
      "menu_files": [
        "Menus/Menu week of 4-5-23.md"
      ],
      "menu_weeks": [
        "2023-04-05"
      ],
      "menu_seasons": [
        "spring"
      ],
      "meal_types": [
        "dinner"
      ],
      "sections": [],
      "source_hints": [],
      "item_texts": [
        "Korean BBQ Rice bowls"
      ],
      "count": 1
    },
    {
      "url": null,
      "urls": [],
      "link_texts": [],
      "menu_files": [
        "Menus/Menu week of 4-5-23.md"
      ],
      "menu_weeks": [
        "2023-04-05"
      ],
      "menu_seasons": [
        "spring"
      ],
      "meal_types": [
        "dinner"
      ],
      "sections": [],
      "source_hints": [],
      "item_texts": [
        "Lemon Herb Pasta Salad"
      ],
      "count": 1
    },
    {
      "url": null,
      "urls": [],
      "link_texts": [],
      "menu_files": [
        "Menus/Menu week of 4-5-23.md"
      ],
      "menu_weeks": [
        "2023-04-05"
      ],
      "menu_seasons": [
        "spring"
      ],
      "meal_types": [
        "dinner"
      ],
      "sections": [],
      "source_hints": [],
      "item_texts": [
        "Harissa meatballs with whipped feta"
      ],
      "count": 1
    },
    {
      "url": null,
      "urls": [],
      "link_texts": [],
      "menu_files": [
        "Menus/Menu week of 4-5-23.md"
      ],
      "menu_weeks": [
        "2023-04-05"
      ],
      "menu_seasons": [
        "spring"
      ],
      "meal_types": [
        "dinner"
      ],
      "sections": [],
      "source_hints": [],
      "item_texts": [
        "Basic + Awesome Chicken Quinoa salad"
      ],
      "count": 1
    },
    {
      "url": null,
      "urls": [],
      "link_texts": [],
      "menu_files": [
        "Menus/Menu week of 5-1-21.md"
      ],
      "menu_weeks": [
        "2021-05-01"
      ],
      "menu_seasons": [
        "spring"
      ],
      "meal_types": [
        "dinner"
      ],
      "sections": [],
      "source_hints": [],
      "item_texts": [
        "Gnocchi, peppers and onions, sauce"
      ],
      "count": 1
    },
    {
      "url": null,
      "urls": [],
      "link_texts": [],
      "menu_files": [
        "Menus/Menu week of 5-1-21.md"
      ],
      "menu_weeks": [
        "2021-05-01"
      ],
      "menu_seasons": [
        "spring"
      ],
      "meal_types": [
        "dinner"
      ],
      "sections": [],
      "source_hints": [],
      "item_texts": [
        "Instant Pot chicken and dumplings"
      ],
      "count": 1
    },
    {
      "url": null,
      "urls": [],
      "link_texts": [],
      "menu_files": [
        "Menus/Menu week of 5-1-21.md"
      ],
      "menu_weeks": [
        "2021-05-01"
      ],
      "menu_seasons": [
        "spring"
      ],
      "meal_types": [
        "dinner"
      ],
      "sections": [],
      "source_hints": [],
      "item_texts": [
        "Panzanella salad with marinated chickpeas"
      ],
      "count": 1
    },
    {
      "url": null,
      "urls": [],
      "link_texts": [],
      "menu_files": [
        "Menus/Menu week of 5-1-21.md"
      ],
      "menu_weeks": [
        "2021-05-01"
      ],
      "menu_seasons": [
        "spring"
      ],
      "meal_types": [
        "dinner"
      ],
      "sections": [],
      "source_hints": [],
      "item_texts": [
        "Balsamic roasted veggie and white bean pasta"
      ],
      "count": 1
    },
    {
      "url": null,
      "urls": [],
      "link_texts": [],
      "menu_files": [
        "Menus/Menu week of 5-1-21.md"
      ],
      "menu_weeks": [
        "2021-05-01"
      ],
      "menu_seasons": [
        "spring"
      ],
      "meal_types": [
        "dinner"
      ],
      "sections": [],
      "source_hints": [
        "star tribune recipe"
      ],
      "item_texts": [
        "Soy-honey glazed Salmon sushi bowl (star tribune recipe)"
      ],
      "count": 1
    },
    {
      "url": null,
      "urls": [],
      "link_texts": [],
      "menu_files": [
        "Menus/Menu week of 5-1-21.md"
      ],
      "menu_weeks": [
        "2021-05-01"
      ],
      "menu_seasons": [
        "spring"
      ],
      "meal_types": [
        "dinner"
      ],
      "sections": [],
      "source_hints": [],
      "item_texts": [
        "Burgers and sweet potato fries"
      ],
      "count": 1
    },
    {
      "url": null,
      "urls": [],
      "link_texts": [],
      "menu_files": [
        "Menus/Menu week of 5-1-21.md"
      ],
      "menu_weeks": [
        "2021-05-01"
      ],
      "menu_seasons": [
        "spring"
      ],
      "meal_types": [
        "breakfast"
      ],
      "sections": [],
      "source_hints": [],
      "item_texts": [
        "Irish breakfast"
      ],
      "count": 1
    },
    {
      "url": null,
      "urls": [],
      "link_texts": [],
      "menu_files": [
        "Menus/Menu week of 5-1-24.md"
      ],
      "menu_weeks": [
        "2024-05-01"
      ],
      "menu_seasons": [
        "spring"
      ],
      "meal_types": [
        "dinner"
      ],
      "sections": [],
      "source_hints": [
        "Gimme some oven"
      ],
      "item_texts": [
        "Sweet potato tacos (Gimme some oven)"
      ],
      "count": 1
    },
    {
      "url": null,
      "urls": [],
      "link_texts": [],
      "menu_files": [
        "Menus/Menu week of 5-1-24.md"
      ],
      "menu_weeks": [
        "2024-05-01"
      ],
      "menu_seasons": [
        "spring"
      ],
      "meal_types": [
        "dinner"
      ],
      "sections": [],
      "source_hints": [
        "Pinch of Yum"
      ],
      "item_texts": [
        "BBQ jackfruit sandwiches, sweet potato fries, broccoli (Pinch of Yum)"
      ],
      "count": 1
    },
    {
      "url": null,
      "urls": [],
      "link_texts": [],
      "menu_files": [
        "Menus/Menu week of 5-1-24.md"
      ],
      "menu_weeks": [
        "2024-05-01"
      ],
      "menu_seasons": [
        "spring"
      ],
      "meal_types": [
        "dinner"
      ],
      "sections": [],
      "source_hints": [
        "Pinch of Yum"
      ],
      "item_texts": [
        "Marry me chicken with mashed potatoes and a side salad (Pinch of Yum)"
      ],
      "count": 1
    },
    {
      "url": null,
      "urls": [],
      "link_texts": [],
      "menu_files": [
        "Menus/Menu week of 5-1-24.md"
      ],
      "menu_weeks": [
        "2024-05-01"
      ],
      "menu_seasons": [
        "spring"
      ],
      "meal_types": [
        "dinner"
      ],
      "sections": [],
      "source_hints": [
        "Damn delicious"
      ],
      "item_texts": [
        "Instant Pot Ground Beef and pasta (Damn delicious)"
      ],
      "count": 1
    },
    {
      "url": null,
      "urls": [],
      "link_texts": [],
      "menu_files": [
        "Menus/Menu week of 5-1-24.md"
      ],
      "menu_weeks": [
        "2024-05-01"
      ],
      "menu_seasons": [
        "spring"
      ],
      "meal_types": [
        "dinner"
      ],
      "sections": [],
      "source_hints": [],
      "item_texts": [
        "Chickpea, date, and avocado salad with za\u2019atar vinaigrette (Gimme Some Oven) add feta"
      ],
      "count": 1
    },
    {
      "url": null,
      "urls": [],
      "link_texts": [],
      "menu_files": [
        "Menus/Menu week of 5-1-24.md"
      ],
      "menu_weeks": [
        "2024-05-01"
      ],
      "menu_seasons": [
        "spring"
      ],
      "meal_types": [
        "dinner"
      ],
      "sections": [],
      "source_hints": [
        "Pinch of Yum"
      ],
      "item_texts": [
        "Red chile toastadas with eggs (Pinch of Yum)"
      ],
      "count": 1
    },
    {
      "url": null,
      "urls": [],
      "link_texts": [],
      "menu_files": [
        "Menus/Menu week of 5-15-25.md"
      ],
      "menu_weeks": [
        "2025-05-15"
      ],
      "menu_seasons": [
        "spring"
      ],
      "meal_types": [
        "dinner"
      ],
      "sections": [],
      "source_hints": [],
      "item_texts": [
        "Grilled burgers, zucchini and squash, roasted yellow potatoes"
      ],
      "count": 1
    },
    {
      "url": null,
      "urls": [],
      "link_texts": [],
      "menu_files": [
        "Menus/Menu week of 5-17-24.md"
      ],
      "menu_weeks": [
        "2024-05-17"
      ],
      "menu_seasons": [
        "spring"
      ],
      "meal_types": [
        "dinner"
      ],
      "sections": [],
      "source_hints": [],
      "item_texts": [
        "Can add a little quinoa"
      ],
      "count": 1
    },
    {
      "url": null,
      "urls": [],
      "link_texts": [],
      "menu_files": [
        "Menus/Menu week of 5-17-24.md"
      ],
      "menu_weeks": [
        "2024-05-17"
      ],
      "menu_seasons": [
        "spring"
      ],
      "meal_types": [
        "dinner"
      ],
      "sections": [],
      "source_hints": [],
      "item_texts": [
        "1 lb chicken breasts"
      ],
      "count": 1
    },
    {
      "url": null,
      "urls": [],
      "link_texts": [],
      "menu_files": [
        "Menus/Menu week of 5-17-24.md"
      ],
      "menu_weeks": [
        "2024-05-17"
      ],
      "menu_seasons": [
        "spring"
      ],
      "meal_types": [
        "dinner"
      ],
      "sections": [],
      "source_hints": [],
      "item_texts": [
        "1 lb chicken sausage"
      ],
      "count": 1
    },
    {
      "url": null,
      "urls": [],
      "link_texts": [],
      "menu_files": [
        "Menus/Menu week of 5-18-22.md"
      ],
      "menu_weeks": [
        "2022-05-18"
      ],
      "menu_seasons": [
        "spring"
      ],
      "meal_types": [
        "dinner"
      ],
      "sections": [],
      "source_hints": [],
      "item_texts": [
        "Grilled sausage and peppers with garlic aioli"
      ],
      "count": 1
    },
    {
      "url": null,
      "urls": [],
      "link_texts": [],
      "menu_files": [
        "Menus/Menu week of 5-18-22.md"
      ],
      "menu_weeks": [
        "2022-05-18"
      ],
      "menu_seasons": [
        "spring"
      ],
      "meal_types": [
        "dinner"
      ],
      "sections": [],
      "source_hints": [
        "Damn Delicious"
      ],
      "item_texts": [
        "Instant Pot chicken tacos (Damn Delicious)"
      ],
      "count": 1
    },
    {
      "url": null,
      "urls": [],
      "link_texts": [],
      "menu_files": [
        "Menus/Menu week of 5-18-22.md"
      ],
      "menu_weeks": [
        "2022-05-18"
      ],
      "menu_seasons": [
        "spring"
      ],
      "meal_types": [
        "dinner"
      ],
      "sections": [],
      "source_hints": [],
      "item_texts": [
        "Panang chicken curry and rice"
      ],
      "count": 1
    },
    {
      "url": null,
      "urls": [],
      "link_texts": [],
      "menu_files": [
        "Menus/Menu week of 5-18-22.md"
      ],
      "menu_weeks": [
        "2022-05-18"
      ],
      "menu_seasons": [
        "spring"
      ],
      "meal_types": [
        "dinner"
      ],
      "sections": [],
      "source_hints": [],
      "item_texts": [
        "Panzanella salad with marinated chickpeas and chimichurri"
      ],
      "count": 1
    },
    {
      "url": null,
      "urls": [],
      "link_texts": [],
      "menu_files": [
        "Menus/Menu week of 5-18-22.md"
      ],
      "menu_weeks": [
        "2022-05-18"
      ],
      "menu_seasons": [
        "spring"
      ],
      "meal_types": [
        "dinner"
      ],
      "sections": [],
      "source_hints": [],
      "item_texts": [
        "BBQ Jackfruit sandwiches and slaw"
      ],
      "count": 1
    },
    {
      "url": null,
      "urls": [],
      "link_texts": [],
      "menu_files": [
        "Menus/Menu week of 5-18-22.md"
      ],
      "menu_weeks": [
        "2022-05-18"
      ],
      "menu_seasons": [
        "spring"
      ],
      "meal_types": [
        "dinner"
      ],
      "sections": [],
      "source_hints": [],
      "item_texts": [
        "Instant pot ground beef and pasta"
      ],
      "count": 1
    },
    {
      "url": null,
      "urls": [],
      "link_texts": [],
      "menu_files": [
        "Menus/Menu week of 5-18-22.md"
      ],
      "menu_weeks": [
        "2022-05-18"
      ],
      "menu_seasons": [
        "spring"
      ],
      "meal_types": [
        "dinner"
      ],
      "sections": [],
      "source_hints": [],
      "item_texts": [
        "Skyline and bagged salad"
      ],
      "count": 1
    },
    {
      "url": null,
      "urls": [],
      "link_texts": [],
      "menu_files": [
        "Menus/Menu week of 5-19-21.md"
      ],
      "menu_weeks": [
        "2021-05-19"
      ],
      "menu_seasons": [
        "spring"
      ],
      "meal_types": [
        "dinner"
      ],
      "sections": [],
      "source_hints": [],
      "item_texts": [
        "Instant pot chicken and dumplings"
      ],
      "count": 1
    },
    {
      "url": null,
      "urls": [],
      "link_texts": [],
      "menu_files": [
        "Menus/Menu week of 5-19-21.md"
      ],
      "menu_weeks": [
        "2021-05-19"
      ],
      "menu_seasons": [
        "spring"
      ],
      "meal_types": [
        "dinner"
      ],
      "sections": [],
      "source_hints": [],
      "item_texts": [
        "Whole Wheat pasta salad with salmon, tomatoes, and herb dressing"
      ],
      "count": 1
    },
    {
      "url": null,
      "urls": [],
      "link_texts": [],
      "menu_files": [
        "Menus/Menu week of 5-19-21.md"
      ],
      "menu_weeks": [
        "2021-05-19"
      ],
      "menu_seasons": [
        "spring"
      ],
      "meal_types": [
        "dinner"
      ],
      "sections": [],
      "source_hints": [],
      "item_texts": [
        "Panzanilla salad with marinated chickpeas"
      ],
      "count": 1
    },
    {
      "url": null,
      "urls": [],
      "link_texts": [],
      "menu_files": [
        "Menus/Menu week of 5-19-21.md"
      ],
      "menu_weeks": [
        "2021-05-19"
      ],
      "menu_seasons": [
        "spring"
      ],
      "meal_types": [
        "dinner"
      ],
      "sections": [],
      "source_hints": [],
      "item_texts": [
        "Baked oatmeal"
      ],
      "count": 1
    },
    {
      "url": null,
      "urls": [],
      "link_texts": [],
      "menu_files": [
        "Menus/Menu week of 5-21-23.md"
      ],
      "menu_weeks": [
        "2023-05-21"
      ],
      "menu_seasons": [
        "spring"
      ],
      "meal_types": [
        "dinner"
      ],
      "sections": [],
      "source_hints": [],
      "item_texts": [
        "Smash burgers, sweet potato fries, bagged salad"
      ],
      "count": 1
    },
    {
      "url": null,
      "urls": [],
      "link_texts": [],
      "menu_files": [
        "Menus/Menu week of 5-21-23.md"
      ],
      "menu_weeks": [
        "2023-05-21"
      ],
      "menu_seasons": [
        "spring"
      ],
      "meal_types": [
        "dinner"
      ],
      "sections": [],
      "source_hints": [],
      "item_texts": [
        "Cashew Crunch Salad with chickpeas"
      ],
      "count": 1
    },
    {
      "url": null,
      "urls": [],
      "link_texts": [],
      "menu_files": [
        "Menus/Menu week of 5-21-23.md"
      ],
      "menu_weeks": [
        "2023-05-21"
      ],
      "menu_seasons": [
        "spring"
      ],
      "meal_types": [
        "dinner"
      ],
      "sections": [],
      "source_hints": [],
      "item_texts": [
        "Creamy Red Pepper Pasta and Blistered Tomatoes"
      ],
      "count": 1
    },
    {
      "url": null,
      "urls": [],
      "link_texts": [],
      "menu_files": [
        "Menus/Menu week of 5-21-23.md"
      ],
      "menu_weeks": [
        "2023-05-21"
      ],
      "menu_seasons": [
        "spring"
      ],
      "meal_types": [
        "dinner"
      ],
      "sections": [],
      "source_hints": [],
      "item_texts": [
        "1 lb 85/25 ground beef"
      ],
      "count": 1
    },
    {
      "url": null,
      "urls": [],
      "link_texts": [],
      "menu_files": [
        "Menus/Menu week of 5-21-23.md"
      ],
      "menu_weeks": [
        "2023-05-21"
      ],
      "menu_seasons": [
        "spring"
      ],
      "meal_types": [
        "dinner"
      ],
      "sections": [],
      "source_hints": [],
      "item_texts": [
        "Pork shoulder"
      ],
      "count": 1
    },
    {
      "url": null,
      "urls": [],
      "link_texts": [],
      "menu_files": [
        "Menus/Menu week of 5-22-19.md"
      ],
      "menu_weeks": [
        "2019-05-22"
      ],
      "menu_seasons": [
        "spring"
      ],
      "meal_types": [
        "dinner"
      ],
      "sections": [],
      "source_hints": [],
      "item_texts": [
        "Sheet pan chicken tikka"
      ],
      "count": 1
    },
    {
      "url": null,
      "urls": [],
      "link_texts": [],
      "menu_files": [
        "Menus/Menu week of 5-22-19.md"
      ],
      "menu_weeks": [
        "2019-05-22"
      ],
      "menu_seasons": [
        "spring"
      ],
      "meal_types": [
        "dinner"
      ],
      "sections": [],
      "source_hints": [],
      "item_texts": [
        "Pizza"
      ],
      "count": 1
    },
    {
      "url": null,
      "urls": [],
      "link_texts": [],
      "menu_files": [
        "Menus/Menu week of 5-22-19.md"
      ],
      "menu_weeks": [
        "2019-05-22"
      ],
      "menu_seasons": [
        "spring"
      ],
      "meal_types": [
        "dinner"
      ],
      "sections": [],
      "source_hints": [],
      "item_texts": [
        "Steak, asparagus, roasted potatoes"
      ],
      "count": 1
    },
    {
      "url": null,
      "urls": [],
      "link_texts": [],
      "menu_files": [
        "Menus/Menu week of 5-22-19.md"
      ],
      "menu_weeks": [
        "2019-05-22"
      ],
      "menu_seasons": [
        "spring"
      ],
      "meal_types": [
        "dinner"
      ],
      "sections": [],
      "source_hints": [],
      "item_texts": [
        "strawberry spinach salad"
      ],
      "count": 1
    },
    {
      "url": null,
      "urls": [],
      "link_texts": [],
      "menu_files": [
        "Menus/Menu week of 5-22-19.md"
      ],
      "menu_weeks": [
        "2019-05-22"
      ],
      "menu_seasons": [
        "spring"
      ],
      "meal_types": [
        "dinner"
      ],
      "sections": [],
      "source_hints": [],
      "item_texts": [
        "balsamic roasted veggie and white bean pasta"
      ],
      "count": 1
    },
    {
      "url": null,
      "urls": [],
      "link_texts": [],
      "menu_files": [
        "Menus/Menu week of 5-22-19.md"
      ],
      "menu_weeks": [
        "2019-05-22"
      ],
      "menu_seasons": [
        "spring"
      ],
      "meal_types": [
        "dinner"
      ],
      "sections": [],
      "source_hints": [],
      "item_texts": [
        "honey mustard grilled salmon with avocado basil sauce, summer cous cous salad"
      ],
      "count": 1
    },
    {
      "url": null,
      "urls": [],
      "link_texts": [],
      "menu_files": [
        "Menus/Menu week of 5-22-19.md"
      ],
      "menu_weeks": [
        "2019-05-22"
      ],
      "menu_seasons": [
        "spring"
      ],
      "meal_types": [
        "dinner"
      ],
      "sections": [],
      "source_hints": [],
      "item_texts": [
        "Sweet potato and black bean tostadas"
      ],
      "count": 1
    },
    {
      "url": null,
      "urls": [],
      "link_texts": [],
      "menu_files": [
        "Menus/Menu week of 5-22-19.md"
      ],
      "menu_weeks": [
        "2019-05-22"
      ],
      "menu_seasons": [
        "spring"
      ],
      "meal_types": [
        "dinner"
      ],
      "sections": [],
      "source_hints": [],
      "item_texts": [
        "Bachelor chicken fajitas"
      ],
      "count": 1
    },
    {
      "url": null,
      "urls": [],
      "link_texts": [],
      "menu_files": [
        "Menus/Menu week of 5-22-19.md"
      ],
      "menu_weeks": [
        "2019-05-22"
      ],
      "menu_seasons": [
        "spring"
      ],
      "meal_types": [
        "dinner"
      ],
      "sections": [],
      "source_hints": [],
      "item_texts": [
        "Tortellini soup and grilled cheese?"
      ],
      "count": 1
    },
    {
      "url": null,
      "urls": [],
      "link_texts": [],
      "menu_files": [
        "Menus/Menu week of 5-22-19.md"
      ],
      "menu_weeks": [
        "2019-05-22"
      ],
      "menu_seasons": [
        "spring"
      ],
      "meal_types": [
        "dinner"
      ],
      "sections": [],
      "source_hints": [],
      "item_texts": [
        "Bagel egg and cheese sandwiches"
      ],
      "count": 1
    },
    {
      "url": null,
      "urls": [],
      "link_texts": [],
      "menu_files": [
        "Menus/Menu week of 5-22-20.md"
      ],
      "menu_weeks": [
        "2020-05-22"
      ],
      "menu_seasons": [
        "spring"
      ],
      "meal_types": [
        "dinner"
      ],
      "sections": [],
      "source_hints": [],
      "item_texts": [
        "Grilled sausage and peppers with garlic aioli"
      ],
      "count": 1
    },
    {
      "url": null,
      "urls": [],
      "link_texts": [],
      "menu_files": [
        "Menus/Menu week of 5-22-20.md"
      ],
      "menu_weeks": [
        "2020-05-22"
      ],
      "menu_seasons": [
        "spring"
      ],
      "meal_types": [
        "dinner"
      ],
      "sections": [],
      "source_hints": [],
      "item_texts": [
        "bucatini al la amatriciana"
      ],
      "count": 1
    },
    {
      "url": null,
      "urls": [],
      "link_texts": [],
      "menu_files": [
        "Menus/Menu week of 5-22-20.md"
      ],
      "menu_weeks": [
        "2020-05-22"
      ],
      "menu_seasons": [
        "spring"
      ],
      "meal_types": [
        "dinner"
      ],
      "sections": [],
      "source_hints": [],
      "item_texts": [
        "Sesame chicken salad"
      ],
      "count": 1
    },
    {
      "url": null,
      "urls": [],
      "link_texts": [],
      "menu_files": [
        "Menus/Menu week of 5-22-20.md"
      ],
      "menu_weeks": [
        "2020-05-22"
      ],
      "menu_seasons": [
        "spring"
      ],
      "meal_types": [
        "dinner"
      ],
      "sections": [],
      "source_hints": [],
      "item_texts": [
        "Pasta with goat cheese, asparagus, mushrooms"
      ],
      "count": 1
    },
    {
      "url": null,
      "urls": [],
      "link_texts": [],
      "menu_files": [
        "Menus/Menu week of 5-26-25.md"
      ],
      "menu_weeks": [
        "2025-05-26"
      ],
      "menu_seasons": [
        "spring"
      ],
      "meal_types": [
        "dinner"
      ],
      "sections": [],
      "source_hints": [],
      "item_texts": [
        "Frozen gyros and cucumber and hummus"
      ],
      "count": 1
    },
    {
      "url": null,
      "urls": [],
      "link_texts": [],
      "menu_files": [
        "Menus/Menu week of 5-26-25.md"
      ],
      "menu_weeks": [
        "2025-05-26"
      ],
      "menu_seasons": [
        "spring"
      ],
      "meal_types": [
        "dinner"
      ],
      "sections": [],
      "source_hints": [],
      "item_texts": [
        "Little potatoes"
      ],
      "count": 1
    },
    {
      "url": null,
      "urls": [],
      "link_texts": [],
      "menu_files": [
        "Menus/Menu week of 5-30-24.md"
      ],
      "menu_weeks": [
        "2024-05-30"
      ],
      "menu_seasons": [
        "spring"
      ],
      "meal_types": [
        "dinner"
      ],
      "sections": [],
      "source_hints": [],
      "item_texts": [
        "Chicken nuggets, broccoli, sweet potato fries"
      ],
      "count": 1
    },
    {
      "url": null,
      "urls": [],
      "link_texts": [],
      "menu_files": [
        "Menus/Menu week of 5-30-24.md"
      ],
      "menu_weeks": [
        "2024-05-30"
      ],
      "menu_seasons": [
        "spring"
      ],
      "meal_types": [
        "dinner"
      ],
      "sections": [],
      "source_hints": [],
      "item_texts": [
        "Burgers, Corn watermelon"
      ],
      "count": 1
    },
    {
      "url": null,
      "urls": [],
      "link_texts": [],
      "menu_files": [
        "Menus/Menu week of 5-6-19.md"
      ],
      "menu_weeks": [
        "2019-05-06"
      ],
      "menu_seasons": [
        "spring"
      ],
      "meal_types": [
        "dinner"
      ],
      "sections": [],
      "source_hints": [],
      "item_texts": [
        "Buddha bowls with chicken"
      ],
      "count": 1
    },
    {
      "url": null,
      "urls": [],
      "link_texts": [],
      "menu_files": [
        "Menus/Menu week of 5-6-19.md"
      ],
      "menu_weeks": [
        "2019-05-06"
      ],
      "menu_seasons": [
        "spring"
      ],
      "meal_types": [
        "dinner"
      ],
      "sections": [],
      "source_hints": [],
      "item_texts": [
        "Spinach strawberry salad with poppyseed dressing"
      ],
      "count": 1
    },
    {
      "url": null,
      "urls": [],
      "link_texts": [],
      "menu_files": [
        "Menus/Menu week of 5-6-19.md"
      ],
      "menu_weeks": [
        "2019-05-06"
      ],
      "menu_seasons": [
        "spring"
      ],
      "meal_types": [
        "dinner"
      ],
      "sections": [],
      "source_hints": [],
      "item_texts": [
        "Chicago dogs and roasted carrots"
      ],
      "count": 1
    },
    {
      "url": null,
      "urls": [],
      "link_texts": [],
      "menu_files": [
        "Menus/Menu week of 5-6-19.md"
      ],
      "menu_weeks": [
        "2019-05-06"
      ],
      "menu_seasons": [
        "spring"
      ],
      "meal_types": [
        "dinner"
      ],
      "sections": [],
      "source_hints": [],
      "item_texts": [
        "gnocchi with pesto and zucchini and squash"
      ],
      "count": 1
    },
    {
      "url": null,
      "urls": [],
      "link_texts": [],
      "menu_files": [
        "Menus/Menu week of 5-6-19.md"
      ],
      "menu_weeks": [
        "2019-05-06"
      ],
      "menu_seasons": [
        "spring"
      ],
      "meal_types": [
        "dinner"
      ],
      "sections": [],
      "source_hints": [],
      "item_texts": [
        "pasta with goat cheese, chicken, asparagus, and mushrooms"
      ],
      "count": 1
    },
    {
      "url": null,
      "urls": [],
      "link_texts": [],
      "menu_files": [
        "Menus/Menu week of 5-6-19.md"
      ],
      "menu_weeks": [
        "2019-05-06"
      ],
      "menu_seasons": [
        "spring"
      ],
      "meal_types": [
        "breakfast"
      ],
      "sections": [],
      "source_hints": [],
      "item_texts": [
        "Birthday breakfast: egg bacon bagel sandwich"
      ],
      "count": 1
    },
    {
      "url": null,
      "urls": [],
      "link_texts": [],
      "menu_files": [
        "Menus/Menu week of 5-7-18.md"
      ],
      "menu_weeks": [
        "2018-05-07"
      ],
      "menu_seasons": [
        "spring"
      ],
      "meal_types": [
        "dinner"
      ],
      "sections": [],
      "source_hints": [],
      "item_texts": [
        "Monday: fajitas"
      ],
      "count": 1
    },
    {
      "url": null,
      "urls": [],
      "link_texts": [],
      "menu_files": [
        "Menus/Menu week of 5-7-18.md"
      ],
      "menu_weeks": [
        "2018-05-07"
      ],
      "menu_seasons": [
        "spring"
      ],
      "meal_types": [
        "dinner"
      ],
      "sections": [],
      "source_hints": [],
      "item_texts": [
        "Tuesday: homemade vegetarian chili"
      ],
      "count": 1
    },
    {
      "url": null,
      "urls": [],
      "link_texts": [],
      "menu_files": [
        "Menus/Menu week of 5-7-18.md"
      ],
      "menu_weeks": [
        "2018-05-07"
      ],
      "menu_seasons": [
        "spring"
      ],
      "meal_types": [
        "dinner"
      ],
      "sections": [],
      "source_hints": [],
      "item_texts": [
        "Wednesday: dinner at Fasika or Dillas"
      ],
      "count": 1
    },
    {
      "url": null,
      "urls": [],
      "link_texts": [],
      "menu_files": [
        "Menus/Menu week of 5-7-18.md"
      ],
      "menu_weeks": [
        "2018-05-07"
      ],
      "menu_seasons": [
        "spring"
      ],
      "meal_types": [
        "lunch"
      ],
      "sections": [],
      "source_hints": [],
      "item_texts": [
        "Thursday lunch: Matt\u2019s bar"
      ],
      "count": 1
    },
    {
      "url": null,
      "urls": [],
      "link_texts": [],
      "menu_files": [
        "Menus/Menu week of 5-7-18.md"
      ],
      "menu_weeks": [
        "2018-05-07"
      ],
      "menu_seasons": [
        "spring"
      ],
      "meal_types": [
        "dinner"
      ],
      "sections": [],
      "source_hints": [
        "with chicken?"
      ],
      "item_texts": [
        "Thursday dinner: Greek quinoa salad (with chicken?)"
      ],
      "count": 1
    },
    {
      "url": null,
      "urls": [],
      "link_texts": [],
      "menu_files": [
        "Menus/Menu week of 5-7-20.md"
      ],
      "menu_weeks": [
        "2020-05-07"
      ],
      "menu_seasons": [
        "spring"
      ],
      "meal_types": [
        "dinner"
      ],
      "sections": [],
      "source_hints": [],
      "item_texts": [
        "Ribs, corn, cilantro lime cucumber salad"
      ],
      "count": 1
    },
    {
      "url": null,
      "urls": [],
      "link_texts": [],
      "menu_files": [
        "Menus/Menu week of 5-7-20.md"
      ],
      "menu_weeks": [
        "2020-05-07"
      ],
      "menu_seasons": [
        "spring"
      ],
      "meal_types": [
        "dinner"
      ],
      "sections": [],
      "source_hints": [],
      "item_texts": [
        "Panzanella with Marinated Chickpeas and chimichurri"
      ],
      "count": 1
    },
    {
      "url": null,
      "urls": [],
      "link_texts": [],
      "menu_files": [
        "Menus/Menu week of 5-7-20.md"
      ],
      "menu_weeks": [
        "2020-05-07"
      ],
      "menu_seasons": [
        "spring"
      ],
      "meal_types": [
        "dinner"
      ],
      "sections": [],
      "source_hints": [],
      "item_texts": [
        "Crockpot White Chicken chili"
      ],
      "count": 1
    },
    {
      "url": null,
      "urls": [],
      "link_texts": [],
      "menu_files": [
        "Menus/Menu week of 5-8-23.md"
      ],
      "menu_weeks": [
        "2023-05-08"
      ],
      "menu_seasons": [
        "spring"
      ],
      "meal_types": [
        "dinner"
      ],
      "sections": [],
      "source_hints": [
        "Pinch of Yum"
      ],
      "item_texts": [
        "Instant Pot Korean beef tacos (Pinch of Yum)"
      ],
      "count": 1
    },
    {
      "url": null,
      "urls": [],
      "link_texts": [],
      "menu_files": [
        "Menus/Menu week of 5-8-23.md"
      ],
      "menu_weeks": [
        "2023-05-08"
      ],
      "menu_seasons": [
        "spring"
      ],
      "meal_types": [
        "dinner"
      ],
      "sections": [],
      "source_hints": [
        "Pinch of yum"
      ],
      "item_texts": [
        "Coconut curry salmon (Pinch of yum)"
      ],
      "count": 1
    },
    {
      "url": null,
      "urls": [],
      "link_texts": [],
      "menu_files": [
        "Menus/Menu week of 5-8-23.md"
      ],
      "menu_weeks": [
        "2023-05-08"
      ],
      "menu_seasons": [
        "spring"
      ],
      "meal_types": [
        "dinner"
      ],
      "sections": [],
      "source_hints": [
        "pinch of yum"
      ],
      "item_texts": [
        "Smash burgers and bagged salad (pinch of yum)"
      ],
      "count": 1
    },
    {
      "url": null,
      "urls": [],
      "link_texts": [],
      "menu_files": [
        "Menus/Menu week of 5-8-23.md"
      ],
      "menu_weeks": [
        "2023-05-08"
      ],
      "menu_seasons": [
        "spring"
      ],
      "meal_types": [
        "dinner"
      ],
      "sections": [],
      "source_hints": [],
      "item_texts": [
        "Red Chile tostadas with eggs"
      ],
      "count": 1
    },
    {
      "url": null,
      "urls": [],
      "link_texts": [],
      "menu_files": [
        "Menus/Menu week of 5-8-23.md"
      ],
      "menu_weeks": [
        "2023-05-08"
      ],
      "menu_seasons": [
        "spring"
      ],
      "meal_types": [
        "dinner"
      ],
      "sections": [],
      "source_hints": [
        "Pinch of yum"
      ],
      "item_texts": [
        "Tofu brown rice lettuce wraps (Pinch of yum)"
      ],
      "count": 1
    },
    {
      "url": null,
      "urls": [],
      "link_texts": [],
      "menu_files": [
        "Menus/Menu week of 5-8-23.md"
      ],
      "menu_weeks": [
        "2023-05-08"
      ],
      "menu_seasons": [
        "spring"
      ],
      "meal_types": [
        "dinner"
      ],
      "sections": [],
      "source_hints": [
        "pinch of yum"
      ],
      "item_texts": [
        "Chicken quinoa salad (pinch of yum)"
      ],
      "count": 1
    },
    {
      "url": null,
      "urls": [],
      "link_texts": [],
      "menu_files": [
        "Menus/Menu week of 5-8-23.md"
      ],
      "menu_weeks": [
        "2023-05-08"
      ],
      "menu_seasons": [
        "spring"
      ],
      "meal_types": [
        "dinner"
      ],
      "sections": [],
      "source_hints": [],
      "item_texts": [
        "2 lbs top sirloin"
      ],
      "count": 1
    },
    {
      "url": null,
      "urls": [],
      "link_texts": [],
      "menu_files": [
        "Menus/Menu week of 5-8-23.md"
      ],
      "menu_weeks": [
        "2023-05-08"
      ],
      "menu_seasons": [
        "spring"
      ],
      "meal_types": [
        "dinner"
      ],
      "sections": [],
      "source_hints": [],
      "item_texts": [
        "1 lb ground beef"
      ],
      "count": 1
    },
    {
      "url": null,
      "urls": [],
      "link_texts": [],
      "menu_files": [
        "Menus/Menu week of 5-8-23.md"
      ],
      "menu_weeks": [
        "2023-05-08"
      ],
      "menu_seasons": [
        "spring"
      ],
      "meal_types": [
        "dinner"
      ],
      "sections": [],
      "source_hints": [],
      "item_texts": [
        "1 package chicken tenders"
      ],
      "count": 1
    },
    {
      "url": null,
      "urls": [],
      "link_texts": [],
      "menu_files": [
        "Menus/Menu week of 5-8-23.md"
      ],
      "menu_weeks": [
        "2023-05-08"
      ],
      "menu_seasons": [
        "spring"
      ],
      "meal_types": [
        "dinner"
      ],
      "sections": [],
      "source_hints": [],
      "item_texts": [
        "1.5 lbs salmon"
      ],
      "count": 1
    },
    {
      "url": null,
      "urls": [],
      "link_texts": [],
      "menu_files": [
        "Menus/Menu week of 6-1-21.md"
      ],
      "menu_weeks": [
        "2021-06-01"
      ],
      "menu_seasons": [
        "summer"
      ],
      "meal_types": [
        "dinner"
      ],
      "sections": [],
      "source_hints": [],
      "item_texts": [
        "Floating taco bowls with quick pico"
      ],
      "count": 1
    },
    {
      "url": null,
      "urls": [],
      "link_texts": [],
      "menu_files": [
        "Menus/Menu week of 6-1-21.md"
      ],
      "menu_weeks": [
        "2021-06-01"
      ],
      "menu_seasons": [
        "summer"
      ],
      "meal_types": [
        "dinner"
      ],
      "sections": [],
      "source_hints": [],
      "item_texts": [
        "Panzanilla salad with marinated chickpeas"
      ],
      "count": 1
    },
    {
      "url": null,
      "urls": [],
      "link_texts": [],
      "menu_files": [
        "Menus/Menu week of 6-1-21.md"
      ],
      "menu_weeks": [
        "2021-06-01"
      ],
      "menu_seasons": [
        "summer"
      ],
      "meal_types": [
        "dinner"
      ],
      "sections": [],
      "source_hints": [],
      "item_texts": [
        "Green pepper, onion, gnocchi"
      ],
      "count": 1
    },
    {
      "url": null,
      "urls": [],
      "link_texts": [],
      "menu_files": [
        "Menus/Menu week of 6-1-21.md"
      ],
      "menu_weeks": [
        "2021-06-01"
      ],
      "menu_seasons": [
        "summer"
      ],
      "meal_types": [
        "dinner"
      ],
      "sections": [],
      "source_hints": [],
      "item_texts": [
        "Strawberry crunch salad and baguette"
      ],
      "count": 1
    },
    {
      "url": null,
      "urls": [],
      "link_texts": [],
      "menu_files": [
        "Menus/Menu week of 6-1-21.md"
      ],
      "menu_weeks": [
        "2021-06-01"
      ],
      "menu_seasons": [
        "summer"
      ],
      "meal_types": [
        "dinner"
      ],
      "sections": [],
      "source_hints": [],
      "item_texts": [
        "Bulger Salad"
      ],
      "count": 1
    },
    {
      "url": null,
      "urls": [],
      "link_texts": [],
      "menu_files": [
        "Menus/Menu week of 6-1-22.md"
      ],
      "menu_weeks": [
        "2022-06-01"
      ],
      "menu_seasons": [
        "summer"
      ],
      "meal_types": [
        "dinner"
      ],
      "sections": [],
      "source_hints": [],
      "item_texts": [
        "Roasted cauliflower burrito bowls"
      ],
      "count": 1
    },
    {
      "url": null,
      "urls": [],
      "link_texts": [],
      "menu_files": [
        "Menus/Menu week of 6-1-22.md"
      ],
      "menu_weeks": [
        "2022-06-01"
      ],
      "menu_seasons": [
        "summer"
      ],
      "meal_types": [
        "dinner"
      ],
      "sections": [],
      "source_hints": [],
      "item_texts": [
        "Burgers and sweet potato fries"
      ],
      "count": 1
    },
    {
      "url": null,
      "urls": [],
      "link_texts": [],
      "menu_files": [
        "Menus/Menu week of 6-1-22.md"
      ],
      "menu_weeks": [
        "2022-06-01"
      ],
      "menu_seasons": [
        "summer"
      ],
      "meal_types": [
        "dinner"
      ],
      "sections": [],
      "source_hints": [],
      "item_texts": [
        "Italian drunken noodles"
      ],
      "count": 1
    },
    {
      "url": null,
      "urls": [],
      "link_texts": [],
      "menu_files": [
        "Menus/Menu week of 6-1-22.md"
      ],
      "menu_weeks": [
        "2022-06-01"
      ],
      "menu_seasons": [
        "summer"
      ],
      "meal_types": [
        "dinner"
      ],
      "sections": [],
      "source_hints": [],
      "item_texts": [
        "Bread salad"
      ],
      "count": 1
    },
    {
      "url": null,
      "urls": [],
      "link_texts": [],
      "menu_files": [
        "Menus/Menu week of 6-10-18.md"
      ],
      "menu_weeks": [
        "2018-06-10"
      ],
      "menu_seasons": [
        "summer"
      ],
      "meal_types": [
        "dinner"
      ],
      "sections": [],
      "source_hints": [],
      "item_texts": [
        "Sunday: Strawberry poppyseed salad"
      ],
      "count": 1
    },
    {
      "url": null,
      "urls": [],
      "link_texts": [],
      "menu_files": [
        "Menus/Menu week of 6-10-18.md"
      ],
      "menu_weeks": [
        "2018-06-10"
      ],
      "menu_seasons": [
        "summer"
      ],
      "meal_types": [
        "dinner"
      ],
      "sections": [],
      "source_hints": [],
      "item_texts": [
        "Monday: Pizza"
      ],
      "count": 1
    },
    {
      "url": null,
      "urls": [],
      "link_texts": [],
      "menu_files": [
        "Menus/Menu week of 6-10-18.md"
      ],
      "menu_weeks": [
        "2018-06-10"
      ],
      "menu_seasons": [
        "summer"
      ],
      "meal_types": [
        "dinner"
      ],
      "sections": [],
      "source_hints": [],
      "item_texts": [
        "Steak and asparagus and bread"
      ],
      "count": 1
    },
    {
      "url": null,
      "urls": [],
      "link_texts": [],
      "menu_files": [
        "Menus/Menu week of 6-10-18.md"
      ],
      "menu_weeks": [
        "2018-06-10"
      ],
      "menu_seasons": [
        "summer"
      ],
      "meal_types": [
        "dinner"
      ],
      "sections": [],
      "source_hints": [],
      "item_texts": [
        "Friday: beer brats, apple slaw, sweet potato fries"
      ],
      "count": 1
    },
    {
      "url": null,
      "urls": [],
      "link_texts": [],
      "menu_files": [
        "Menus/Menu week of 6-10-18.md"
      ],
      "menu_weeks": [
        "2018-06-10"
      ],
      "menu_seasons": [
        "summer"
      ],
      "meal_types": [
        "dinner"
      ],
      "sections": [],
      "source_hints": [],
      "item_texts": [
        "Pesto pasta salad"
      ],
      "count": 1
    },
    {
      "url": null,
      "urls": [],
      "link_texts": [],
      "menu_files": [
        "Menus/Menu week of 6-10-18.md"
      ],
      "menu_weeks": [
        "2018-06-10"
      ],
      "menu_seasons": [
        "summer"
      ],
      "meal_types": [
        "dinner"
      ],
      "sections": [],
      "source_hints": [],
      "item_texts": [
        "Cauliflower \ud83c\udf2f bowls"
      ],
      "count": 1
    },
    {
      "url": null,
      "urls": [],
      "link_texts": [],
      "menu_files": [
        "Menus/Menu week of 6-12-24.md"
      ],
      "menu_weeks": [
        "2024-06-12"
      ],
      "menu_seasons": [
        "summer"
      ],
      "meal_types": [
        "dinner"
      ],
      "sections": [],
      "source_hints": [],
      "item_texts": [
        "Radishes"
      ],
      "count": 1
    },
    {
      "url": null,
      "urls": [],
      "link_texts": [],
      "menu_files": [
        "Menus/Menu week of 6-12-24.md"
      ],
      "menu_weeks": [
        "2024-06-12"
      ],
      "menu_seasons": [
        "summer"
      ],
      "meal_types": [
        "dinner"
      ],
      "sections": [],
      "source_hints": [],
      "item_texts": [
        "Chives"
      ],
      "count": 1
    },
    {
      "url": null,
      "urls": [],
      "link_texts": [],
      "menu_files": [
        "Menus/Menu week of 6-12-24.md"
      ],
      "menu_weeks": [
        "2024-06-12"
      ],
      "menu_seasons": [
        "summer"
      ],
      "meal_types": [
        "dinner"
      ],
      "sections": [],
      "source_hints": [],
      "item_texts": [
        "Baby bok choy"
      ],
      "count": 1
    },
    {
      "url": null,
      "urls": [],
      "link_texts": [],
      "menu_files": [
        "Menus/Menu week of 6-13-25.md"
      ],
      "menu_weeks": [
        "2025-06-13"
      ],
      "menu_seasons": [
        "summer"
      ],
      "meal_types": [
        "dinner"
      ],
      "sections": [],
      "source_hints": [
        "cous cous, ground beef with greek spices, tzatziki, feta, cucumber, tomato, hummus, etc."
      ],
      "item_texts": [
        "Ground beef bowls (cous cous, ground beef with greek spices, tzatziki, feta, cucumber, tomato, hummus, etc.)"
      ],
      "count": 1
    },
    {
      "url": null,
      "urls": [],
      "link_texts": [],
      "menu_files": [
        "Menus/Menu week of 6-13-25.md"
      ],
      "menu_weeks": [
        "2025-06-13"
      ],
      "menu_seasons": [
        "summer"
      ],
      "meal_types": [
        "dinner"
      ],
      "sections": [],
      "source_hints": [],
      "item_texts": [
        "Dinner: Out"
      ],
      "count": 1
    },
    {
      "url": null,
      "urls": [],
      "link_texts": [],
      "menu_files": [
        "Menus/Menu week of 6-13-25.md"
      ],
      "menu_weeks": [
        "2025-06-13"
      ],
      "menu_seasons": [
        "summer"
      ],
      "meal_types": [
        "breakfast"
      ],
      "sections": [],
      "source_hints": [],
      "item_texts": [
        "Breakfast: Avocado toast and eggs"
      ],
      "count": 1
    },
    {
      "url": null,
      "urls": [],
      "link_texts": [],
      "menu_files": [
        "Menus/Menu week of 6-13-25.md"
      ],
      "menu_weeks": [
        "2025-06-13"
      ],
      "menu_seasons": [
        "summer"
      ],
      "meal_types": [
        "dinner"
      ],
      "sections": [],
      "source_hints": [],
      "item_texts": [
        "Cinnamon Rhubarb bread"
      ],
      "count": 1
    },
    {
      "url": null,
      "urls": [],
      "link_texts": [],
      "menu_files": [
        "Menus/Menu week of 6-13-25.md"
      ],
      "menu_weeks": [
        "2025-06-13"
      ],
      "menu_seasons": [
        "summer"
      ],
      "meal_types": [
        "dinner"
      ],
      "sections": [],
      "source_hints": [],
      "item_texts": [
        "Romaine lettuce"
      ],
      "count": 1
    },
    {
      "url": null,
      "urls": [],
      "link_texts": [],
      "menu_files": [
        "Menus/Menu week of 6-13-25.md"
      ],
      "menu_weeks": [
        "2025-06-13"
      ],
      "menu_seasons": [
        "summer"
      ],
      "meal_types": [
        "dinner"
      ],
      "sections": [],
      "source_hints": [],
      "item_texts": [
        "Rhubarb - Cinnamon Rhubarb bread"
      ],
      "count": 1
    },
    {
      "url": null,
      "urls": [],
      "link_texts": [],
      "menu_files": [
        "Menus/Menu week of 6-13-25.md"
      ],
      "menu_weeks": [
        "2025-06-13"
      ],
      "menu_seasons": [
        "summer"
      ],
      "meal_types": [
        "dinner"
      ],
      "sections": [],
      "source_hints": [],
      "item_texts": [
        "Focaccia"
      ],
      "count": 1
    },
    {
      "url": null,
      "urls": [],
      "link_texts": [],
      "menu_files": [
        "Menus/Menu week of 6-13-25.md"
      ],
      "menu_weeks": [
        "2025-06-13"
      ],
      "menu_seasons": [
        "summer"
      ],
      "meal_types": [
        "dinner"
      ],
      "sections": [],
      "source_hints": [],
      "item_texts": [
        "Microgreens"
      ],
      "count": 1
    },
    {
      "url": null,
      "urls": [],
      "link_texts": [],
      "menu_files": [
        "Menus/Menu week of 6-16-22.md"
      ],
      "menu_weeks": [
        "2022-06-16"
      ],
      "menu_seasons": [
        "summer"
      ],
      "meal_types": [
        "dinner"
      ],
      "sections": [],
      "source_hints": [],
      "item_texts": [
        "Frozen pizza or skyline and salad"
      ],
      "count": 1
    },
    {
      "url": null,
      "urls": [],
      "link_texts": [],
      "menu_files": [
        "Menus/Menu week of 6-16-22.md"
      ],
      "menu_weeks": [
        "2022-06-16"
      ],
      "menu_seasons": [
        "summer"
      ],
      "meal_types": [
        "dinner"
      ],
      "sections": [],
      "source_hints": [],
      "item_texts": [
        "Cashew tofu and rice"
      ],
      "count": 1
    },
    {
      "url": null,
      "urls": [],
      "link_texts": [],
      "menu_files": [
        "Menus/Menu week of 6-16-22.md"
      ],
      "menu_weeks": [
        "2022-06-16"
      ],
      "menu_seasons": [
        "summer"
      ],
      "meal_types": [
        "dinner"
      ],
      "sections": [],
      "source_hints": [],
      "item_texts": [
        "Mediterranean couscous bowls"
      ],
      "count": 1
    },
    {
      "url": null,
      "urls": [],
      "link_texts": [],
      "menu_files": [
        "Menus/Menu week of 6-16-22.md"
      ],
      "menu_weeks": [
        "2022-06-16"
      ],
      "menu_seasons": [
        "summer"
      ],
      "meal_types": [
        "dinner"
      ],
      "sections": [],
      "source_hints": [],
      "item_texts": [
        "Crispy gnocchi with zucchini, sweet corn, and basil"
      ],
      "count": 1
    },
    {
      "url": null,
      "urls": [],
      "link_texts": [],
      "menu_files": [
        "Menus/Menu week of 6-16-22.md"
      ],
      "menu_weeks": [
        "2022-06-16"
      ],
      "menu_seasons": [
        "summer"
      ],
      "meal_types": [
        "dinner"
      ],
      "sections": [],
      "source_hints": [],
      "item_texts": [
        "Whole wheat pasta salad with salmon, tomatoes, & herb dressing"
      ],
      "count": 1
    },
    {
      "url": null,
      "urls": [],
      "link_texts": [],
      "menu_files": [
        "Menus/Menu week of 6-16-22.md"
      ],
      "menu_weeks": [
        "2022-06-16"
      ],
      "menu_seasons": [
        "summer"
      ],
      "meal_types": [
        "dinner"
      ],
      "sections": [],
      "source_hints": [],
      "item_texts": [
        "Father\u2019s Day Dinner: Instant Pot Italian Beef sandwiches, bagged salad"
      ],
      "count": 1
    },
    {
      "url": null,
      "urls": [],
      "link_texts": [],
      "menu_files": [
        "Menus/Menu week of 6-16-22.md"
      ],
      "menu_weeks": [
        "2022-06-16"
      ],
      "menu_seasons": [
        "summer"
      ],
      "meal_types": [
        "breakfast"
      ],
      "sections": [],
      "source_hints": [],
      "item_texts": [
        "Father\u2019s Day breakfast: Open-faced breakfast sandwiches with runny eggs"
      ],
      "count": 1
    },
    {
      "url": null,
      "urls": [],
      "link_texts": [],
      "menu_files": [
        "Menus/Menu week of 6-16-22.md"
      ],
      "menu_weeks": [
        "2022-06-16"
      ],
      "menu_seasons": [
        "summer"
      ],
      "meal_types": [
        "dinner"
      ],
      "sections": [],
      "source_hints": [],
      "item_texts": [
        "Blackberry Pie Bars"
      ],
      "count": 1
    },
    {
      "url": null,
      "urls": [],
      "link_texts": [],
      "menu_files": [
        "Menus/Menu week of 6-19-20.md"
      ],
      "menu_weeks": [
        "2020-06-19"
      ],
      "menu_seasons": [
        "summer"
      ],
      "meal_types": [
        "dinner"
      ],
      "sections": [],
      "source_hints": [],
      "item_texts": [
        "Peruvian chicken, chips and guacamole"
      ],
      "count": 1
    },
    {
      "url": null,
      "urls": [],
      "link_texts": [],
      "menu_files": [
        "Menus/Menu week of 6-19-20.md"
      ],
      "menu_weeks": [
        "2020-06-19"
      ],
      "menu_seasons": [
        "summer"
      ],
      "meal_types": [
        "dinner"
      ],
      "sections": [],
      "source_hints": [],
      "item_texts": [
        "Bahn mi (make pickled diakon/carrots) - grill pork"
      ],
      "count": 1
    },
    {
      "url": null,
      "urls": [],
      "link_texts": [],
      "menu_files": [
        "Menus/Menu week of 6-19-20.md"
      ],
      "menu_weeks": [
        "2020-06-19"
      ],
      "menu_seasons": [
        "summer"
      ],
      "meal_types": [
        "dinner"
      ],
      "sections": [],
      "source_hints": [
        "Monday"
      ],
      "item_texts": [
        "Panzanilla salad (Monday)"
      ],
      "count": 1
    },
    {
      "url": null,
      "urls": [],
      "link_texts": [],
      "menu_files": [
        "Menus/Menu week of 6-19-20.md"
      ],
      "menu_weeks": [
        "2020-06-19"
      ],
      "menu_seasons": [
        "summer"
      ],
      "meal_types": [
        "dinner"
      ],
      "sections": [],
      "source_hints": [
        "Sunday"
      ],
      "item_texts": [
        "Leek, chard, and corn flatbread (Sunday)"
      ],
      "count": 1
    },
    {
      "url": null,
      "urls": [],
      "link_texts": [],
      "menu_files": [
        "Menus/Menu week of 6-19-20.md"
      ],
      "menu_weeks": [
        "2020-06-19"
      ],
      "menu_seasons": [
        "summer"
      ],
      "meal_types": [
        "dinner"
      ],
      "sections": [],
      "source_hints": [],
      "item_texts": [
        "Chard and eggs"
      ],
      "count": 1
    },
    {
      "url": null,
      "urls": [],
      "link_texts": [],
      "menu_files": [
        "Menus/Menu week of 6-19-20.md"
      ],
      "menu_weeks": [
        "2020-06-19"
      ],
      "menu_seasons": [
        "summer"
      ],
      "meal_types": [
        "dinner"
      ],
      "sections": [],
      "source_hints": [
        "use avocados!"
      ],
      "item_texts": [
        "Quesadillas (use avocados!)"
      ],
      "count": 1
    },
    {
      "url": null,
      "urls": [],
      "link_texts": [],
      "menu_files": [
        "Menus/Menu week of 6-19-20.md"
      ],
      "menu_weeks": [
        "2020-06-19"
      ],
      "menu_seasons": [
        "summer"
      ],
      "meal_types": [
        "dinner"
      ],
      "sections": [],
      "source_hints": [],
      "item_texts": [
        "avocado toast with bacon and eggs"
      ],
      "count": 1
    },
    {
      "url": null,
      "urls": [],
      "link_texts": [],
      "menu_files": [
        "Menus/Menu week of 6-23-19.md"
      ],
      "menu_weeks": [
        "2019-06-23"
      ],
      "menu_seasons": [
        "summer"
      ],
      "meal_types": [
        "dinner"
      ],
      "sections": [],
      "source_hints": [],
      "item_texts": [
        "greek quinoa salad"
      ],
      "count": 1
    },
    {
      "url": null,
      "urls": [],
      "link_texts": [],
      "menu_files": [
        "Menus/Menu week of 6-23-19.md"
      ],
      "menu_weeks": [
        "2019-06-23"
      ],
      "menu_seasons": [
        "summer"
      ],
      "meal_types": [
        "dinner"
      ],
      "sections": [],
      "source_hints": [],
      "item_texts": [
        "quinoa salad with apple chickpeas toasted almonds, apple cider vinaigrette"
      ],
      "count": 1
    },
    {
      "url": null,
      "urls": [],
      "link_texts": [],
      "menu_files": [
        "Menus/Menu week of 6-23-19.md"
      ],
      "menu_weeks": [
        "2019-06-23"
      ],
      "menu_seasons": [
        "summer"
      ],
      "meal_types": [
        "dinner"
      ],
      "sections": [],
      "source_hints": [],
      "item_texts": [
        "balsamic roasted veggie and white bean pasta"
      ],
      "count": 1
    },
    {
      "url": null,
      "urls": [],
      "link_texts": [],
      "menu_files": [
        "Menus/Menu week of 6-23-19.md"
      ],
      "menu_weeks": [
        "2019-06-23"
      ],
      "menu_seasons": [
        "summer"
      ],
      "meal_types": [
        "dinner"
      ],
      "sections": [],
      "source_hints": [],
      "item_texts": [
        "salmon burgers and slaw"
      ],
      "count": 1
    },
    {
      "url": null,
      "urls": [],
      "link_texts": [],
      "menu_files": [
        "Menus/Menu week of 6-23-19.md"
      ],
      "menu_weeks": [
        "2019-06-23"
      ],
      "menu_seasons": [
        "summer"
      ],
      "meal_types": [
        "dinner"
      ],
      "sections": [],
      "source_hints": [],
      "item_texts": [
        "sheet pan green chile beef nachos"
      ],
      "count": 1
    },
    {
      "url": null,
      "urls": [],
      "link_texts": [],
      "menu_files": [
        "Menus/Menu week of 6-23-19.md"
      ],
      "menu_weeks": [
        "2019-06-23"
      ],
      "menu_seasons": [
        "summer"
      ],
      "meal_types": [
        "dinner"
      ],
      "sections": [],
      "source_hints": [],
      "item_texts": [
        "Burgers and corn and zucchini/squash"
      ],
      "count": 1
    },
    {
      "url": null,
      "urls": [],
      "link_texts": [],
      "menu_files": [
        "Menus/Menu week of 6-26-23.md"
      ],
      "menu_weeks": [
        "2023-06-26"
      ],
      "menu_seasons": [
        "summer"
      ],
      "meal_types": [
        "dinner"
      ],
      "sections": [],
      "source_hints": [],
      "item_texts": [
        "Ang\u2019s chicken wraps and sweet potato fries"
      ],
      "count": 1
    },
    {
      "url": null,
      "urls": [],
      "link_texts": [],
      "menu_files": [
        "Menus/Menu week of 6-26-23.md"
      ],
      "menu_weeks": [
        "2023-06-26"
      ],
      "menu_seasons": [
        "summer"
      ],
      "meal_types": [
        "dinner"
      ],
      "sections": [],
      "source_hints": [
        "double"
      ],
      "item_texts": [
        "Instant Pot ground beef and pasta (double)"
      ],
      "count": 1
    },
    {
      "url": null,
      "urls": [],
      "link_texts": [],
      "menu_files": [
        "Menus/Menu week of 6-26-23.md"
      ],
      "menu_weeks": [
        "2023-06-26"
      ],
      "menu_seasons": [
        "summer"
      ],
      "meal_types": [
        "dinner"
      ],
      "sections": [],
      "source_hints": [],
      "item_texts": [
        "2 lb ground beef"
      ],
      "count": 1
    },
    {
      "url": null,
      "urls": [],
      "link_texts": [],
      "menu_files": [
        "Menus/Menu week of 6-26-23.md"
      ],
      "menu_weeks": [
        "2023-06-26"
      ],
      "menu_seasons": [
        "summer"
      ],
      "meal_types": [
        "dinner"
      ],
      "sections": [],
      "source_hints": [],
      "item_texts": [
        "Chicken for wraps"
      ],
      "count": 1
    },
    {
      "url": null,
      "urls": [],
      "link_texts": [],
      "menu_files": [
        "Menus/Menu week of 6-26-23.md"
      ],
      "menu_weeks": [
        "2023-06-26"
      ],
      "menu_seasons": [
        "summer"
      ],
      "meal_types": [
        "dinner"
      ],
      "sections": [],
      "source_hints": [],
      "item_texts": [
        "1 lb ground chicken"
      ],
      "count": 1
    },
    {
      "url": null,
      "urls": [],
      "link_texts": [],
      "menu_files": [
        "Menus/Menu week of 6-29-18.md"
      ],
      "menu_weeks": [
        "2018-06-29"
      ],
      "menu_seasons": [
        "summer"
      ],
      "meal_types": [
        "dinner"
      ],
      "sections": [],
      "source_hints": [],
      "item_texts": [
        "Friday: spicy Thai chicken and quinoa, bok choy"
      ],
      "count": 1
    },
    {
      "url": null,
      "urls": [],
      "link_texts": [],
      "menu_files": [
        "Menus/Menu week of 6-29-18.md"
      ],
      "menu_weeks": [
        "2018-06-29"
      ],
      "menu_seasons": [
        "summer"
      ],
      "meal_types": [
        "lunch"
      ],
      "sections": [],
      "source_hints": [],
      "item_texts": [
        "Sunday: Surly; lunch: blts"
      ],
      "count": 1
    },
    {
      "url": null,
      "urls": [],
      "link_texts": [],
      "menu_files": [
        "Menus/Menu week of 6-29-18.md"
      ],
      "menu_weeks": [
        "2018-06-29"
      ],
      "menu_seasons": [
        "summer"
      ],
      "meal_types": [
        "dinner"
      ],
      "sections": [],
      "source_hints": [],
      "item_texts": [
        "Monday: red quinoa and black bean salad with avocado"
      ],
      "count": 1
    },
    {
      "url": null,
      "urls": [],
      "link_texts": [],
      "menu_files": [
        "Menus/Menu week of 6-29-18.md"
      ],
      "menu_weeks": [
        "2018-06-29"
      ],
      "menu_seasons": [
        "summer"
      ],
      "meal_types": [
        "dinner"
      ],
      "sections": [],
      "source_hints": [],
      "item_texts": [
        "Tuesday: pasta all amatriciana"
      ],
      "count": 1
    },
    {
      "url": null,
      "urls": [],
      "link_texts": [],
      "menu_files": [
        "Menus/Menu week of 6-29-18.md"
      ],
      "menu_weeks": [
        "2018-06-29"
      ],
      "menu_seasons": [
        "summer"
      ],
      "meal_types": [
        "dinner"
      ],
      "sections": [],
      "source_hints": [
        "also use whatever burger is in freezer"
      ],
      "item_texts": [
        "4th of July: burgers, corn, fruit (also use whatever burger is in freezer)"
      ],
      "count": 1
    },
    {
      "url": null,
      "urls": [],
      "link_texts": [],
      "menu_files": [
        "Menus/Menu week of 6-29-18.md"
      ],
      "menu_weeks": [
        "2018-06-29"
      ],
      "menu_seasons": [
        "summer"
      ],
      "meal_types": [
        "dinner"
      ],
      "sections": [],
      "source_hints": [],
      "item_texts": [
        "Thursday: Lynx game"
      ],
      "count": 1
    },
    {
      "url": null,
      "urls": [],
      "link_texts": [],
      "menu_files": [
        "Menus/Menu week of 6-29-18.md"
      ],
      "menu_weeks": [
        "2018-06-29"
      ],
      "menu_seasons": [
        "summer"
      ],
      "meal_types": [
        "dinner"
      ],
      "sections": [],
      "source_hints": [],
      "item_texts": [
        "Friday: crock pot balsamic pork roast, roasted carrots, cous cous"
      ],
      "count": 1
    },
    {
      "url": null,
      "urls": [],
      "link_texts": [],
      "menu_files": [
        "Menus/Menu week of 6-3-18.md"
      ],
      "menu_weeks": [
        "2018-06-03"
      ],
      "menu_seasons": [
        "summer"
      ],
      "meal_types": [
        "dinner"
      ],
      "sections": [],
      "source_hints": [],
      "item_texts": [
        "Sunday: salad and dinner rolls"
      ],
      "count": 1
    },
    {
      "url": null,
      "urls": [],
      "link_texts": [],
      "menu_files": [
        "Menus/Menu week of 6-3-18.md"
      ],
      "menu_weeks": [
        "2018-06-03"
      ],
      "menu_seasons": [
        "summer"
      ],
      "meal_types": [
        "dinner"
      ],
      "sections": [],
      "source_hints": [],
      "item_texts": [
        "Monday: red pepper pasta with roasted cauliflower"
      ],
      "count": 1
    },
    {
      "url": null,
      "urls": [],
      "link_texts": [],
      "menu_files": [
        "Menus/Menu week of 6-3-18.md"
      ],
      "menu_weeks": [
        "2018-06-03"
      ],
      "menu_seasons": [
        "summer"
      ],
      "meal_types": [
        "dinner"
      ],
      "sections": [],
      "source_hints": [],
      "item_texts": [
        "Tuesday: sheet pan green Chile beef nachos"
      ],
      "count": 1
    },
    {
      "url": null,
      "urls": [],
      "link_texts": [],
      "menu_files": [
        "Menus/Menu week of 6-3-18.md"
      ],
      "menu_weeks": [
        "2018-06-03"
      ],
      "menu_seasons": [
        "summer"
      ],
      "meal_types": [
        "dinner"
      ],
      "sections": [],
      "source_hints": [],
      "item_texts": [
        "Wednesday: the newsroom"
      ],
      "count": 1
    },
    {
      "url": null,
      "urls": [],
      "link_texts": [],
      "menu_files": [
        "Menus/Menu week of 6-3-18.md"
      ],
      "menu_weeks": [
        "2018-06-03"
      ],
      "menu_seasons": [
        "summer"
      ],
      "meal_types": [
        "dinner"
      ],
      "sections": [],
      "source_hints": [],
      "item_texts": [
        "Thursday: lemon chicken asparagus and cous cous"
      ],
      "count": 1
    },
    {
      "url": null,
      "urls": [],
      "link_texts": [],
      "menu_files": [
        "Menus/Menu week of 6-3-18.md"
      ],
      "menu_weeks": [
        "2018-06-03"
      ],
      "menu_seasons": [
        "summer"
      ],
      "meal_types": [
        "dinner"
      ],
      "sections": [],
      "source_hints": [],
      "item_texts": [
        "Friday: Pizza"
      ],
      "count": 1
    },
    {
      "url": null,
      "urls": [],
      "link_texts": [],
      "menu_files": [
        "Menus/Menu week of 6-3-18.md"
      ],
      "menu_weeks": [
        "2018-06-03"
      ],
      "menu_seasons": [
        "summer"
      ],
      "meal_types": [
        "dinner"
      ],
      "sections": [],
      "source_hints": [],
      "item_texts": [
        "Saturday: Forepaugh\u2019s"
      ],
      "count": 1
    },
    {
      "url": null,
      "urls": [],
      "link_texts": [],
      "menu_files": [
        "Menus/Menu week of 6-3-2020.md"
      ],
      "menu_weeks": [
        "2020-06-03"
      ],
      "menu_seasons": [
        "summer"
      ],
      "meal_types": [
        "dinner"
      ],
      "sections": [],
      "source_hints": [
        "turnips"
      ],
      "item_texts": [
        "Grilled brats and corn, roasted veggies (turnips)"
      ],
      "count": 1
    },
    {
      "url": null,
      "urls": [],
      "link_texts": [],
      "menu_files": [
        "Menus/Menu week of 6-3-2020.md"
      ],
      "menu_weeks": [
        "2020-06-03"
      ],
      "menu_seasons": [
        "summer"
      ],
      "meal_types": [
        "lunch"
      ],
      "sections": [],
      "source_hints": [],
      "item_texts": [
        "Lunch - bulgar salad"
      ],
      "count": 1
    },
    {
      "url": null,
      "urls": [],
      "link_texts": [],
      "menu_files": [
        "Menus/Menu week of 6-3-2020.md"
      ],
      "menu_weeks": [
        "2020-06-03"
      ],
      "menu_seasons": [
        "summer"
      ],
      "meal_types": [
        "dinner"
      ],
      "sections": [],
      "source_hints": [],
      "item_texts": [
        "Garlic scape pesto pasta salad"
      ],
      "count": 1
    },
    {
      "url": null,
      "urls": [],
      "link_texts": [],
      "menu_files": [
        "Menus/Menu week of 6-3-2020.md"
      ],
      "menu_weeks": [
        "2020-06-03"
      ],
      "menu_seasons": [
        "summer"
      ],
      "meal_types": [
        "dinner"
      ],
      "sections": [],
      "source_hints": [
        "crock pot"
      ],
      "item_texts": [
        "Lemon Chicken and rice soup - Taste of home (crock pot)"
      ],
      "count": 1
    },
    {
      "url": null,
      "urls": [],
      "link_texts": [],
      "menu_files": [
        "Menus/Menu week of 6-3-2020.md"
      ],
      "menu_weeks": [
        "2020-06-03"
      ],
      "menu_seasons": [
        "summer"
      ],
      "meal_types": [
        "dinner"
      ],
      "sections": [],
      "source_hints": [
        "double - make with white rice"
      ],
      "item_texts": [
        "Kale fried rice (double - make with white rice)"
      ],
      "count": 1
    },
    {
      "url": null,
      "urls": [],
      "link_texts": [],
      "menu_files": [
        "Menus/Menu week of 6-3-2020.md"
      ],
      "menu_weeks": [
        "2020-06-03"
      ],
      "menu_seasons": [
        "summer"
      ],
      "meal_types": [
        "dinner"
      ],
      "sections": [],
      "source_hints": [
        "whatever is left over"
      ],
      "item_texts": [
        "Brats and roasted beets/turnips (whatever is left over)"
      ],
      "count": 1
    },
    {
      "url": null,
      "urls": [],
      "link_texts": [],
      "menu_files": [
        "Menus/Menu week of 6-3-2020.md"
      ],
      "menu_weeks": [
        "2020-06-03"
      ],
      "menu_seasons": [
        "summer"
      ],
      "meal_types": [
        "dinner"
      ],
      "sections": [],
      "source_hints": [],
      "item_texts": [
        "Sheet pan green chile beef nachos"
      ],
      "count": 1
    },
    {
      "url": null,
      "urls": [],
      "link_texts": [],
      "menu_files": [
        "Menus/Menu week of 6-3-2020.md"
      ],
      "menu_weeks": [
        "2020-06-03"
      ],
      "menu_seasons": [
        "summer"
      ],
      "meal_types": [
        "dinner"
      ],
      "sections": [],
      "source_hints": [],
      "item_texts": [
        "Black pepper stir fried noodles with bok choy"
      ],
      "count": 1
    },
    {
      "url": null,
      "urls": [],
      "link_texts": [],
      "menu_files": [
        "Menus/Menu week of 6-3-2020.md"
      ],
      "menu_weeks": [
        "2020-06-03"
      ],
      "menu_seasons": [
        "summer"
      ],
      "meal_types": [
        "dinner"
      ],
      "sections": [],
      "source_hints": [],
      "item_texts": [
        "Grilled steak salad with beets and scallions"
      ],
      "count": 1
    },
    {
      "url": null,
      "urls": [],
      "link_texts": [],
      "menu_files": [
        "Menus/Menu week of 6-3-2020.md"
      ],
      "menu_weeks": [
        "2020-06-03"
      ],
      "menu_seasons": [
        "summer"
      ],
      "meal_types": [
        "breakfast"
      ],
      "sections": [],
      "source_hints": [],
      "item_texts": [
        "Weekend breakfast: eggs, bacon"
      ],
      "count": 1
    },
    {
      "url": null,
      "urls": [],
      "link_texts": [],
      "menu_files": [
        "Menus/Menu week of 6-3-2020.md"
      ],
      "menu_weeks": [
        "2020-06-03"
      ],
      "menu_seasons": [
        "summer"
      ],
      "meal_types": [
        "dinner"
      ],
      "sections": [],
      "source_hints": [],
      "item_texts": [
        "Make garlic scape pesto"
      ],
      "count": 1
    },
    {
      "url": null,
      "urls": [],
      "link_texts": [],
      "menu_files": [
        "Menus/Menu week of 6-3-2020.md"
      ],
      "menu_weeks": [
        "2020-06-03"
      ],
      "menu_seasons": [
        "summer"
      ],
      "meal_types": [
        "dinner"
      ],
      "sections": [],
      "source_hints": [],
      "item_texts": [
        "Make pizza dough"
      ],
      "count": 1
    },
    {
      "url": null,
      "urls": [],
      "link_texts": [],
      "menu_files": [
        "Menus/Menu week of 6-3-2020.md"
      ],
      "menu_weeks": [
        "2020-06-03"
      ],
      "menu_seasons": [
        "summer"
      ],
      "meal_types": [
        "dinner"
      ],
      "sections": [],
      "source_hints": [],
      "item_texts": [
        "Make granola"
      ],
      "count": 1
    },
    {
      "url": null,
      "urls": [],
      "link_texts": [],
      "menu_files": [
        "Menus/Menu week of 6-5-23.md"
      ],
      "menu_weeks": [
        "2023-06-05"
      ],
      "menu_seasons": [
        "summer"
      ],
      "meal_types": [
        "dinner"
      ],
      "sections": [],
      "source_hints": [],
      "item_texts": [
        "Salmon, asparagus potatoes"
      ],
      "count": 1
    },
    {
      "url": null,
      "urls": [],
      "link_texts": [],
      "menu_files": [
        "Menus/Menu week of 6-5-23.md"
      ],
      "menu_weeks": [
        "2023-06-05"
      ],
      "menu_seasons": [
        "summer"
      ],
      "meal_types": [
        "dinner"
      ],
      "sections": [],
      "source_hints": [],
      "item_texts": [
        "Chicken tikka masala and cauliflower"
      ],
      "count": 1
    },
    {
      "url": null,
      "urls": [],
      "link_texts": [],
      "menu_files": [
        "Menus/Menu week of 6-5-23.md"
      ],
      "menu_weeks": [
        "2023-06-05"
      ],
      "menu_seasons": [
        "summer"
      ],
      "meal_types": [
        "dinner"
      ],
      "sections": [],
      "source_hints": [],
      "item_texts": [
        "Crispy chicken tikka bowls"
      ],
      "count": 1
    },
    {
      "url": null,
      "urls": [],
      "link_texts": [],
      "menu_files": [
        "Menus/Menu week of 6-5-23.md"
      ],
      "menu_weeks": [
        "2023-06-05"
      ],
      "menu_seasons": [
        "summer"
      ],
      "meal_types": [
        "dinner"
      ],
      "sections": [],
      "source_hints": [],
      "item_texts": [
        "Steak, grilled asparagus, roasted potatoes"
      ],
      "count": 1
    },
    {
      "url": null,
      "urls": [],
      "link_texts": [],
      "menu_files": [
        "Menus/Menu week of 6-5-23.md"
      ],
      "menu_weeks": [
        "2023-06-05"
      ],
      "menu_seasons": [
        "summer"
      ],
      "meal_types": [
        "dinner"
      ],
      "sections": [],
      "source_hints": [],
      "item_texts": [
        "Chicken fingers"
      ],
      "count": 1
    },
    {
      "url": null,
      "urls": [],
      "link_texts": [],
      "menu_files": [
        "Menus/Menu week of 6-5-23.md"
      ],
      "menu_weeks": [
        "2023-06-05"
      ],
      "menu_seasons": [
        "summer"
      ],
      "meal_types": [
        "dinner"
      ],
      "sections": [],
      "source_hints": [],
      "item_texts": [
        "Chicken thighs or other meat for udon noodles?"
      ],
      "count": 1
    },
    {
      "url": null,
      "urls": [],
      "link_texts": [],
      "menu_files": [
        "Menus/Menu week of 6-5-23.md"
      ],
      "menu_weeks": [
        "2023-06-05"
      ],
      "menu_seasons": [
        "summer"
      ],
      "meal_types": [
        "dinner"
      ],
      "sections": [],
      "source_hints": [],
      "item_texts": [
        "1.25 lbs boneless skinless chicken thighs"
      ],
      "count": 1
    },
    {
      "url": null,
      "urls": [],
      "link_texts": [],
      "menu_files": [
        "Menus/Menu week of 7-1-24.md"
      ],
      "menu_weeks": [
        "2024-07-01"
      ],
      "menu_seasons": [
        "summer"
      ],
      "meal_types": [
        "dinner"
      ],
      "sections": [],
      "source_hints": [],
      "item_texts": [
        "Radish Bean salad"
      ],
      "count": 1
    },
    {
      "url": null,
      "urls": [],
      "link_texts": [],
      "menu_files": [
        "Menus/Menu week of 7-12-20.md"
      ],
      "menu_weeks": [
        "2020-07-12"
      ],
      "menu_seasons": [
        "summer"
      ],
      "meal_types": [
        "dinner"
      ],
      "sections": [],
      "source_hints": [],
      "item_texts": [
        "Sheet pan chicken pitas with tzatiki"
      ],
      "count": 1
    },
    {
      "url": null,
      "urls": [],
      "link_texts": [],
      "menu_files": [
        "Menus/Menu week of 7-12-20.md"
      ],
      "menu_weeks": [
        "2020-07-12"
      ],
      "menu_seasons": [
        "summer"
      ],
      "meal_types": [
        "dinner"
      ],
      "sections": [],
      "source_hints": [],
      "item_texts": [
        "Beet and goat cheese salad"
      ],
      "count": 1
    },
    {
      "url": null,
      "urls": [],
      "link_texts": [],
      "menu_files": [
        "Menus/Menu week of 7-12-20.md"
      ],
      "menu_weeks": [
        "2020-07-12"
      ],
      "menu_seasons": [
        "summer"
      ],
      "meal_types": [
        "dinner"
      ],
      "sections": [],
      "source_hints": [],
      "item_texts": [
        "Roasted garlic pasta with burst cherry tomatoes"
      ],
      "count": 1
    },
    {
      "url": null,
      "urls": [],
      "link_texts": [],
      "menu_files": [
        "Menus/Menu week of 7-12-20.md"
      ],
      "menu_weeks": [
        "2020-07-12"
      ],
      "menu_seasons": [
        "summer"
      ],
      "meal_types": [
        "dinner"
      ],
      "sections": [],
      "source_hints": [],
      "item_texts": [
        "Italian sausage and peppers (italian sweet green peppers), baguette"
      ],
      "count": 1
    },
    {
      "url": null,
      "urls": [],
      "link_texts": [],
      "menu_files": [
        "Menus/Menu week of 7-12-20.md"
      ],
      "menu_weeks": [
        "2020-07-12"
      ],
      "menu_seasons": [
        "summer"
      ],
      "meal_types": [
        "dinner"
      ],
      "sections": [],
      "source_hints": [
        "cucumber salad, zucchini and squash"
      ],
      "item_texts": [
        "Carmelized onion smash burgers, whatever vegetables are left (cucumber salad, zucchini and squash)"
      ],
      "count": 1
    },
    {
      "url": null,
      "urls": [],
      "link_texts": [],
      "menu_files": [
        "Menus/Menu week of 7-12-20.md"
      ],
      "menu_weeks": [
        "2020-07-12"
      ],
      "menu_seasons": [
        "summer"
      ],
      "meal_types": [
        "dinner"
      ],
      "sections": [],
      "source_hints": [],
      "item_texts": [
        "Gnocchi, pasta sauce, and zucchini/squash"
      ],
      "count": 1
    },
    {
      "url": null,
      "urls": [],
      "link_texts": [],
      "menu_files": [
        "Menus/Menu week of 7-12-20.md"
      ],
      "menu_weeks": [
        "2020-07-12"
      ],
      "menu_seasons": [
        "summer"
      ],
      "meal_types": [
        "dinner"
      ],
      "sections": [],
      "source_hints": [
        "Sunday"
      ],
      "item_texts": [
        "Leek, chard, and corn flatbread add beets (Sunday)"
      ],
      "count": 1
    },
    {
      "url": null,
      "urls": [],
      "link_texts": [],
      "menu_files": [
        "Menus/Menu week of 7-14-24.md"
      ],
      "menu_weeks": [
        "2024-07-14"
      ],
      "menu_seasons": [
        "summer"
      ],
      "meal_types": [
        "dinner"
      ],
      "sections": [],
      "source_hints": [
        "bachelor style"
      ],
      "item_texts": [
        "Tortellini, zucchini, corn, pesto (bachelor style)"
      ],
      "count": 1
    },
    {
      "url": null,
      "urls": [],
      "link_texts": [],
      "menu_files": [
        "Menus/Menu week of 7-2-20 (vacation).md"
      ],
      "menu_weeks": [
        "2020-07-02"
      ],
      "menu_seasons": [
        "summer"
      ],
      "meal_types": [
        "breakfast"
      ],
      "sections": [
        "Breakfast"
      ],
      "source_hints": [],
      "item_texts": [
        "Granola, yogurt, berries"
      ],
      "count": 1
    },
    {
      "url": null,
      "urls": [],
      "link_texts": [],
      "menu_files": [
        "Menus/Menu week of 7-2-20 (vacation).md"
      ],
      "menu_weeks": [
        "2020-07-02"
      ],
      "menu_seasons": [
        "summer"
      ],
      "meal_types": [
        "lunch"
      ],
      "sections": [
        "Lunches"
      ],
      "source_hints": [
        "make ahead and bring - keep dressing separate"
      ],
      "item_texts": [
        "Vegetarian Italian chop salad (make ahead and bring - keep dressing separate)"
      ],
      "count": 1
    },
    {
      "url": null,
      "urls": [],
      "link_texts": [],
      "menu_files": [
        "Menus/Menu week of 7-2-20 (vacation).md"
      ],
      "menu_weeks": [
        "2020-07-02"
      ],
      "menu_seasons": [
        "summer"
      ],
      "meal_types": [
        "lunch"
      ],
      "sections": [
        "Lunches"
      ],
      "source_hints": [],
      "item_texts": [
        "Lunchmeat sandwiches, chips, cherries"
      ],
      "count": 1
    },
    {
      "url": null,
      "urls": [],
      "link_texts": [],
      "menu_files": [
        "Menus/Menu week of 7-2-20 (vacation).md"
      ],
      "menu_weeks": [
        "2020-07-02"
      ],
      "menu_seasons": [
        "summer"
      ],
      "meal_types": [
        "dinner"
      ],
      "sections": [
        "Dinner"
      ],
      "source_hints": [
        "maybe same night as charcuterie"
      ],
      "item_texts": [
        "5-ingredient pesto pasta salad (maybe same night as charcuterie)"
      ],
      "count": 1
    },
    {
      "url": null,
      "urls": [],
      "link_texts": [],
      "menu_files": [
        "Menus/Menu week of 7-2-20 (vacation).md"
      ],
      "menu_weeks": [
        "2020-07-02"
      ],
      "menu_seasons": [
        "summer"
      ],
      "meal_types": [
        "dinner"
      ],
      "sections": [
        "Dinner"
      ],
      "source_hints": [],
      "item_texts": [
        "Steak, rest of the italian chop salad"
      ],
      "count": 1
    },
    {
      "url": null,
      "urls": [],
      "link_texts": [],
      "menu_files": [
        "Menus/Menu week of 7-2-20 (vacation).md"
      ],
      "menu_weeks": [
        "2020-07-02"
      ],
      "menu_seasons": [
        "summer"
      ],
      "meal_types": [
        "dinner"
      ],
      "sections": [
        "Dinner"
      ],
      "source_hints": [],
      "item_texts": [
        "Brats and grilled corn"
      ],
      "count": 1
    },
    {
      "url": null,
      "urls": [],
      "link_texts": [],
      "menu_files": [
        "Menus/Menu week of 7-2-20 (vacation).md"
      ],
      "menu_weeks": [
        "2020-07-02"
      ],
      "menu_seasons": [
        "summer"
      ],
      "meal_types": [
        "snack"
      ],
      "sections": [
        "Snacks"
      ],
      "source_hints": [],
      "item_texts": [
        "Charcuterie (cheeses (3), meats (2), olives (2), crackers)"
      ],
      "count": 1
    },
    {
      "url": null,
      "urls": [],
      "link_texts": [],
      "menu_files": [
        "Menus/Menu week of 7-2-20 (vacation).md"
      ],
      "menu_weeks": [
        "2020-07-02"
      ],
      "menu_seasons": [
        "summer"
      ],
      "meal_types": [
        "snack"
      ],
      "sections": [
        "Snacks"
      ],
      "source_hints": [],
      "item_texts": [
        "Trail mix"
      ],
      "count": 1
    },
    {
      "url": null,
      "urls": [],
      "link_texts": [],
      "menu_files": [
        "Menus/Menu week of 7-2-20 (vacation).md"
      ],
      "menu_weeks": [
        "2020-07-02"
      ],
      "menu_seasons": [
        "summer"
      ],
      "meal_types": [
        "snack"
      ],
      "sections": [
        "Snacks"
      ],
      "source_hints": [],
      "item_texts": [
        "Peanut butter pretzel bites"
      ],
      "count": 1
    },
    {
      "url": null,
      "urls": [],
      "link_texts": [],
      "menu_files": [
        "Menus/Menu week of 7-2-20 (vacation).md"
      ],
      "menu_weeks": [
        "2020-07-02"
      ],
      "menu_seasons": [
        "summer"
      ],
      "meal_types": [
        "drink"
      ],
      "sections": [
        "Drinks"
      ],
      "source_hints": [],
      "item_texts": [
        "Coffee"
      ],
      "count": 1
    },
    {
      "url": null,
      "urls": [],
      "link_texts": [],
      "menu_files": [
        "Menus/Menu week of 7-2-20 (vacation).md"
      ],
      "menu_weeks": [
        "2020-07-02"
      ],
      "menu_seasons": [
        "summer"
      ],
      "meal_types": [
        "drink"
      ],
      "sections": [
        "Drinks"
      ],
      "source_hints": [],
      "item_texts": [
        "Beer? canned cocktail?"
      ],
      "count": 1
    },
    {
      "url": null,
      "urls": [],
      "link_texts": [],
      "menu_files": [
        "Menus/Menu week of 7-2-20 (vacation).md"
      ],
      "menu_weeks": [
        "2020-07-02"
      ],
      "menu_seasons": [
        "summer"
      ],
      "meal_types": [
        "drink"
      ],
      "sections": [
        "Drinks"
      ],
      "source_hints": [],
      "item_texts": [
        "Wine"
      ],
      "count": 1
    },
    {
      "url": null,
      "urls": [],
      "link_texts": [],
      "menu_files": [
        "Menus/Menu week of 7-2-20 (vacation).md"
      ],
      "menu_weeks": [
        "2020-07-02"
      ],
      "menu_seasons": [
        "summer"
      ],
      "meal_types": [
        "drink"
      ],
      "sections": [
        "Drinks"
      ],
      "source_hints": [],
      "item_texts": [
        "Diet coke"
      ],
      "count": 1
    },
    {
      "url": null,
      "urls": [],
      "link_texts": [],
      "menu_files": [
        "Menus/Menu week of 7-2-20 (vacation).md"
      ],
      "menu_weeks": [
        "2020-07-02"
      ],
      "menu_seasons": [
        "summer"
      ],
      "meal_types": [
        "drink"
      ],
      "sections": [
        "Drinks"
      ],
      "source_hints": [],
      "item_texts": [
        "Dr Pepper"
      ],
      "count": 1
    },
    {
      "url": null,
      "urls": [],
      "link_texts": [],
      "menu_files": [
        "Menus/Menu week of 7-20-17.md"
      ],
      "menu_weeks": [
        "2017-07-20"
      ],
      "menu_seasons": [
        "summer"
      ],
      "meal_types": [
        "dinner"
      ],
      "sections": [],
      "source_hints": [],
      "item_texts": [
        "Potato salmon cakes with garlic and chive Greek yogurt sauce and side salad with beets and goat cheese"
      ],
      "count": 1
    },
    {
      "url": null,
      "urls": [],
      "link_texts": [],
      "menu_files": [
        "Menus/Menu week of 7-20-17.md"
      ],
      "menu_weeks": [
        "2017-07-20"
      ],
      "menu_seasons": [
        "summer"
      ],
      "meal_types": [
        "dinner"
      ],
      "sections": [],
      "source_hints": [],
      "item_texts": [
        "Roasted dill potato wedges and chicken salad"
      ],
      "count": 1
    },
    {
      "url": null,
      "urls": [],
      "link_texts": [],
      "menu_files": [
        "Menus/Menu week of 7-20-17.md"
      ],
      "menu_weeks": [
        "2017-07-20"
      ],
      "menu_seasons": [
        "summer"
      ],
      "meal_types": [
        "dinner"
      ],
      "sections": [],
      "source_hints": [],
      "item_texts": [
        "Spring roll bowls with tofu"
      ],
      "count": 1
    },
    {
      "url": null,
      "urls": [],
      "link_texts": [],
      "menu_files": [
        "Menus/Menu week of 7-20-17.md"
      ],
      "menu_weeks": [
        "2017-07-20"
      ],
      "menu_seasons": [
        "summer"
      ],
      "meal_types": [
        "dinner"
      ],
      "sections": [],
      "source_hints": [],
      "item_texts": [
        "General Tsos chicken and broccoli"
      ],
      "count": 1
    },
    {
      "url": null,
      "urls": [],
      "link_texts": [],
      "menu_files": [
        "Menus/Menu week of 7-20-17.md"
      ],
      "menu_weeks": [
        "2017-07-20"
      ],
      "menu_seasons": [
        "summer"
      ],
      "meal_types": [
        "dinner"
      ],
      "sections": [],
      "source_hints": [],
      "item_texts": [
        "Leek, corn, and chard flatbread"
      ],
      "count": 1
    },
    {
      "url": null,
      "urls": [],
      "link_texts": [],
      "menu_files": [
        "Menus/Menu week of 7-20-17.md"
      ],
      "menu_weeks": [
        "2017-07-20"
      ],
      "menu_seasons": [
        "summer"
      ],
      "meal_types": [
        "dinner"
      ],
      "sections": [],
      "source_hints": [
        "and zucchini if any leftover"
      ],
      "item_texts": [
        "Garlic scape pesto and gnocchi (and zucchini if any leftover)"
      ],
      "count": 1
    },
    {
      "url": null,
      "urls": [],
      "link_texts": [],
      "menu_files": [
        "Menus/Menu week of 7-20-17.md"
      ],
      "menu_weeks": [
        "2017-07-20"
      ],
      "menu_seasons": [
        "summer"
      ],
      "meal_types": [
        "dinner"
      ],
      "sections": [],
      "source_hints": [],
      "item_texts": [
        "Kung pao chicken zoodles"
      ],
      "count": 1
    },
    {
      "url": null,
      "urls": [],
      "link_texts": [],
      "menu_files": [
        "Menus/Menu week of 7-20.md"
      ],
      "menu_weeks": [],
      "menu_seasons": [
        "unknown"
      ],
      "meal_types": [
        "dinner"
      ],
      "sections": [],
      "source_hints": [],
      "item_texts": [
        "Brats and corn on the cob"
      ],
      "count": 1
    },
    {
      "url": null,
      "urls": [],
      "link_texts": [],
      "menu_files": [
        "Menus/Menu week of 7-20.md"
      ],
      "menu_weeks": [],
      "menu_seasons": [
        "unknown"
      ],
      "meal_types": [
        "dinner"
      ],
      "sections": [],
      "source_hints": [],
      "item_texts": [
        "Gnocchi, sauce, zucchini"
      ],
      "count": 1
    },
    {
      "url": null,
      "urls": [],
      "link_texts": [],
      "menu_files": [
        "Menus/Menu week of 7-20.md"
      ],
      "menu_weeks": [],
      "menu_seasons": [
        "unknown"
      ],
      "meal_types": [
        "dinner"
      ],
      "sections": [],
      "source_hints": [],
      "item_texts": [
        "Microwave ramen"
      ],
      "count": 1
    },
    {
      "url": null,
      "urls": [],
      "link_texts": [],
      "menu_files": [
        "Menus/Menu week of 7-20.md"
      ],
      "menu_weeks": [],
      "menu_seasons": [
        "unknown"
      ],
      "meal_types": [
        "dinner"
      ],
      "sections": [],
      "source_hints": [],
      "item_texts": [
        "Chicken salad"
      ],
      "count": 1
    },
    {
      "url": null,
      "urls": [],
      "link_texts": [],
      "menu_files": [
        "Menus/Menu week of 7-20.md"
      ],
      "menu_weeks": [],
      "menu_seasons": [
        "unknown"
      ],
      "meal_types": [
        "dinner"
      ],
      "sections": [],
      "source_hints": [],
      "item_texts": [
        "Broccoli cheese soup and grilled cheese"
      ],
      "count": 1
    },
    {
      "url": null,
      "urls": [],
      "link_texts": [],
      "menu_files": [
        "Menus/Menu week of 7-21-19.md"
      ],
      "menu_weeks": [
        "2019-07-21"
      ],
      "menu_seasons": [
        "summer"
      ],
      "meal_types": [
        "dinner"
      ],
      "sections": [],
      "source_hints": [],
      "item_texts": [
        "grilled honey mustard salmon, bagged costco salad"
      ],
      "count": 1
    },
    {
      "url": null,
      "urls": [],
      "link_texts": [],
      "menu_files": [
        "Menus/Menu week of 7-21-19.md"
      ],
      "menu_weeks": [
        "2019-07-21"
      ],
      "menu_seasons": [
        "summer"
      ],
      "meal_types": [
        "dinner"
      ],
      "sections": [],
      "source_hints": [],
      "item_texts": [
        "Slow cooker carnitas, red cabbage slaw, guac"
      ],
      "count": 1
    },
    {
      "url": null,
      "urls": [],
      "link_texts": [],
      "menu_files": [
        "Menus/Menu week of 7-21-19.md"
      ],
      "menu_weeks": [
        "2019-07-21"
      ],
      "menu_seasons": [
        "summer"
      ],
      "meal_types": [
        "dinner"
      ],
      "sections": [],
      "source_hints": [],
      "item_texts": [
        "Burgers, brats, corn, zucchini, watermelon"
      ],
      "count": 1
    },
    {
      "url": null,
      "urls": [],
      "link_texts": [],
      "menu_files": [
        "Menus/Menu week of 7-21-19.md"
      ],
      "menu_weeks": [
        "2019-07-21"
      ],
      "menu_seasons": [
        "summer"
      ],
      "meal_types": [
        "dinner"
      ],
      "sections": [],
      "source_hints": [],
      "item_texts": [
        "Order pizza from Greek\u2019s pizza"
      ],
      "count": 1
    },
    {
      "url": null,
      "urls": [],
      "link_texts": [],
      "menu_files": [
        "Menus/Menu week of 7-21-19.md"
      ],
      "menu_weeks": [
        "2019-07-21"
      ],
      "menu_seasons": [
        "summer"
      ],
      "meal_types": [
        "lunch"
      ],
      "sections": [],
      "source_hints": [],
      "item_texts": [
        "Lunch: caprese grilled cheese"
      ],
      "count": 1
    },
    {
      "url": null,
      "urls": [],
      "link_texts": [],
      "menu_files": [
        "Menus/Menu week of 7-21-19.md"
      ],
      "menu_weeks": [
        "2019-07-21"
      ],
      "menu_seasons": [
        "summer"
      ],
      "meal_types": [
        "breakfast"
      ],
      "sections": [],
      "source_hints": [],
      "item_texts": [
        "Breakfast: steel cut oats, potatoes, eggs, bacon, etc."
      ],
      "count": 1
    },
    {
      "url": null,
      "urls": [],
      "link_texts": [],
      "menu_files": [
        "Menus/Menu week of 7-23-23.md"
      ],
      "menu_weeks": [
        "2023-07-23"
      ],
      "menu_seasons": [
        "summer"
      ],
      "meal_types": [
        "dinner"
      ],
      "sections": [],
      "source_hints": [],
      "item_texts": [
        "Burgers and sweet corn and bagged salad"
      ],
      "count": 1
    },
    {
      "url": null,
      "urls": [],
      "link_texts": [],
      "menu_files": [
        "Menus/Menu week of 7-23-23.md"
      ],
      "menu_weeks": [
        "2023-07-23"
      ],
      "menu_seasons": [
        "summer"
      ],
      "meal_types": [
        "dinner"
      ],
      "sections": [],
      "source_hints": [
        "Pinch of Yum"
      ],
      "item_texts": [
        "Cauliflower orange gnocchi (Pinch of Yum)"
      ],
      "count": 1
    },
    {
      "url": null,
      "urls": [],
      "link_texts": [],
      "menu_files": [
        "Menus/Menu week of 7-23-23.md"
      ],
      "menu_weeks": [
        "2023-07-23"
      ],
      "menu_seasons": [
        "summer"
      ],
      "meal_types": [
        "dinner"
      ],
      "sections": [],
      "source_hints": [],
      "item_texts": [
        "Chicken nuggets/strips (frozen) and roasted broccoli"
      ],
      "count": 1
    },
    {
      "url": null,
      "urls": [],
      "link_texts": [],
      "menu_files": [
        "Menus/Menu week of 7-23-23.md"
      ],
      "menu_weeks": [
        "2023-07-23"
      ],
      "menu_seasons": [
        "summer"
      ],
      "meal_types": [
        "dinner"
      ],
      "sections": [],
      "source_hints": [
        "Well Plated"
      ],
      "item_texts": [
        "Sheet pan sausage and peppers (Well Plated)"
      ],
      "count": 1
    },
    {
      "url": null,
      "urls": [],
      "link_texts": [],
      "menu_files": [
        "Menus/Menu week of 7-23-23.md"
      ],
      "menu_weeks": [
        "2023-07-23"
      ],
      "menu_seasons": [
        "summer"
      ],
      "meal_types": [
        "dinner"
      ],
      "sections": [],
      "source_hints": [],
      "item_texts": [
        "Saturday party: Chopped salad kits, order pizza, angel food cake cupcakes, berries"
      ],
      "count": 1
    },
    {
      "url": null,
      "urls": [],
      "link_texts": [],
      "menu_files": [
        "Menus/Menu week of 7-23-23.md"
      ],
      "menu_weeks": [
        "2023-07-23"
      ],
      "menu_seasons": [
        "summer"
      ],
      "meal_types": [
        "dinner"
      ],
      "sections": [],
      "source_hints": [],
      "item_texts": [
        "1 lb ground beef"
      ],
      "count": 1
    },
    {
      "url": null,
      "urls": [],
      "link_texts": [],
      "menu_files": [
        "Menus/Menu week of 7-23-23.md"
      ],
      "menu_weeks": [
        "2023-07-23"
      ],
      "menu_seasons": [
        "summer"
      ],
      "meal_types": [
        "dinner"
      ],
      "sections": [],
      "source_hints": [],
      "item_texts": [
        "1 lb boneless skinless chicken thighs"
      ],
      "count": 1
    },
    {
      "url": null,
      "urls": [],
      "link_texts": [],
      "menu_files": [
        "Menus/Menu week of 7-23-23.md"
      ],
      "menu_weeks": [
        "2023-07-23"
      ],
      "menu_seasons": [
        "summer"
      ],
      "meal_types": [
        "dinner"
      ],
      "sections": [],
      "source_hints": [],
      "item_texts": [
        "12 oz precooked chicken sausage"
      ],
      "count": 1
    },
    {
      "url": null,
      "urls": [],
      "link_texts": [],
      "menu_files": [
        "Menus/Menu week of 7-23-23.md"
      ],
      "menu_weeks": [
        "2023-07-23"
      ],
      "menu_seasons": [
        "summer"
      ],
      "meal_types": [
        "dinner"
      ],
      "sections": [],
      "source_hints": [],
      "item_texts": [
        "2 lbs salmon"
      ],
      "count": 1
    },
    {
      "url": null,
      "urls": [],
      "link_texts": [],
      "menu_files": [
        "Menus/Menu week of 7-25-24.md"
      ],
      "menu_weeks": [
        "2024-07-25"
      ],
      "menu_seasons": [
        "summer"
      ],
      "meal_types": [
        "dinner"
      ],
      "sections": [],
      "source_hints": [],
      "item_texts": [
        "Order pizza"
      ],
      "count": 1
    },
    {
      "url": null,
      "urls": [],
      "link_texts": [],
      "menu_files": [
        "Menus/Menu week of 7-25-24.md"
      ],
      "menu_weeks": [
        "2024-07-25"
      ],
      "menu_seasons": [
        "summer"
      ],
      "meal_types": [
        "dinner"
      ],
      "sections": [],
      "source_hints": [],
      "item_texts": [
        "banana cupcakes"
      ],
      "count": 1
    },
    {
      "url": null,
      "urls": [],
      "link_texts": [],
      "menu_files": [
        "Menus/Menu week of 7-25-24.md"
      ],
      "menu_weeks": [
        "2024-07-25"
      ],
      "menu_seasons": [
        "summer"
      ],
      "meal_types": [
        "dinner"
      ],
      "sections": [],
      "source_hints": [],
      "item_texts": [
        "ice cream"
      ],
      "count": 1
    },
    {
      "url": null,
      "urls": [],
      "link_texts": [],
      "menu_files": [
        "Menus/Menu week of 7-25-24.md"
      ],
      "menu_weeks": [
        "2024-07-25"
      ],
      "menu_seasons": [
        "summer"
      ],
      "meal_types": [
        "dinner"
      ],
      "sections": [],
      "source_hints": [],
      "item_texts": [
        "appetizers?"
      ],
      "count": 1
    },
    {
      "url": null,
      "urls": [],
      "link_texts": [],
      "menu_files": [
        "Menus/Menu week of 7-25-24.md"
      ],
      "menu_weeks": [
        "2024-07-25"
      ],
      "menu_seasons": [
        "summer"
      ],
      "meal_types": [
        "dinner"
      ],
      "sections": [],
      "source_hints": [],
      "item_texts": [
        "banana peppers"
      ],
      "count": 1
    },
    {
      "url": null,
      "urls": [],
      "link_texts": [],
      "menu_files": [
        "Menus/Menu week of 7-5-19.md"
      ],
      "menu_weeks": [
        "2019-07-05"
      ],
      "menu_seasons": [
        "summer"
      ],
      "meal_types": [
        "dinner"
      ],
      "sections": [],
      "source_hints": [],
      "item_texts": [
        "Friday: 10th st diner"
      ],
      "count": 1
    },
    {
      "url": null,
      "urls": [],
      "link_texts": [],
      "menu_files": [
        "Menus/Menu week of 7-5-19.md"
      ],
      "menu_weeks": [
        "2019-07-05"
      ],
      "menu_seasons": [
        "summer"
      ],
      "meal_types": [
        "dinner"
      ],
      "sections": [],
      "source_hints": [
        "sourdough bread, pie"
      ],
      "item_texts": [
        "Saturday: Farmer\u2019s market? (sourdough bread, pie)"
      ],
      "count": 1
    },
    {
      "url": null,
      "urls": [],
      "link_texts": [],
      "menu_files": [
        "Menus/Menu week of 7-5-19.md"
      ],
      "menu_weeks": [
        "2019-07-05"
      ],
      "menu_seasons": [
        "summer"
      ],
      "meal_types": [
        "dinner"
      ],
      "sections": [],
      "source_hints": [],
      "item_texts": [
        "Saturday: Cook out - \u201cskewers\u201d - caprese salad, cowboy caviar, peppers, onion, zucchini/squash, brats and \u201cbrats\u201d,"
      ],
      "count": 1
    },
    {
      "url": null,
      "urls": [],
      "link_texts": [],
      "menu_files": [
        "Menus/Menu week of 7-5-19.md"
      ],
      "menu_weeks": [
        "2019-07-05"
      ],
      "menu_seasons": [
        "summer"
      ],
      "meal_types": [
        "dinner"
      ],
      "sections": [],
      "source_hints": [],
      "item_texts": [
        "Sunday AM: Instant pot steel cut oats,"
      ],
      "count": 1
    },
    {
      "url": null,
      "urls": [],
      "link_texts": [],
      "menu_files": [
        "Menus/Menu week of 7-5-19.md"
      ],
      "menu_weeks": [
        "2019-07-05"
      ],
      "menu_seasons": [
        "summer"
      ],
      "meal_types": [
        "dinner"
      ],
      "sections": [],
      "source_hints": [],
      "item_texts": [
        "Monday: None"
      ],
      "count": 1
    },
    {
      "url": null,
      "urls": [],
      "link_texts": [],
      "menu_files": [
        "Menus/Menu week of 7-5-19.md"
      ],
      "menu_weeks": [
        "2019-07-05"
      ],
      "menu_seasons": [
        "summer"
      ],
      "meal_types": [
        "dinner"
      ],
      "sections": [],
      "source_hints": [],
      "item_texts": [
        "Wednesday: Carly Rae Jepson"
      ],
      "count": 1
    },
    {
      "url": null,
      "urls": [],
      "link_texts": [],
      "menu_files": [
        "Menus/Menu week of 7-5-19.md"
      ],
      "menu_weeks": [
        "2019-07-05"
      ],
      "menu_seasons": [
        "summer"
      ],
      "meal_types": [
        "dinner"
      ],
      "sections": [],
      "source_hints": [],
      "item_texts": [
        "Thursday: Lemon chicken and green beans"
      ],
      "count": 1
    },
    {
      "url": null,
      "urls": [],
      "link_texts": [],
      "menu_files": [
        "Menus/Menu week of 7-5-19.md"
      ],
      "menu_weeks": [
        "2019-07-05"
      ],
      "menu_seasons": [
        "summer"
      ],
      "meal_types": [
        "dinner"
      ],
      "sections": [],
      "source_hints": [],
      "item_texts": [
        "Stir fry noodles and tofu/spinach"
      ],
      "count": 1
    },
    {
      "url": null,
      "urls": [],
      "link_texts": [],
      "menu_files": [
        "Menus/Menu week of 7-5-19.md"
      ],
      "menu_weeks": [
        "2019-07-05"
      ],
      "menu_seasons": [
        "summer"
      ],
      "meal_types": [
        "dinner"
      ],
      "sections": [],
      "source_hints": [],
      "item_texts": [
        "brats and corn salad"
      ],
      "count": 1
    },
    {
      "url": null,
      "urls": [],
      "link_texts": [],
      "menu_files": [
        "Menus/Menu week of 7-5-19.md"
      ],
      "menu_weeks": [
        "2019-07-05"
      ],
      "menu_seasons": [
        "summer"
      ],
      "meal_types": [
        "dinner"
      ],
      "sections": [],
      "source_hints": [],
      "item_texts": [
        "Pasta with goat cheese, chicken, asparagus, and mushrooms"
      ],
      "count": 1
    },
    {
      "url": null,
      "urls": [],
      "link_texts": [],
      "menu_files": [
        "Menus/Menu week of 7-5-19.md"
      ],
      "menu_weeks": [
        "2019-07-05"
      ],
      "menu_seasons": [
        "summer"
      ],
      "meal_types": [
        "dinner"
      ],
      "sections": [],
      "source_hints": [],
      "item_texts": [
        "Pizza"
      ],
      "count": 1
    },
    {
      "url": null,
      "urls": [],
      "link_texts": [],
      "menu_files": [
        "Menus/Menu week of 7-5-25.md"
      ],
      "menu_weeks": [
        "2025-07-05"
      ],
      "menu_seasons": [
        "summer"
      ],
      "meal_types": [
        "dinner"
      ],
      "sections": [],
      "source_hints": [],
      "item_texts": [
        "For when steve is here on Thursday"
      ],
      "count": 1
    },
    {
      "url": null,
      "urls": [],
      "link_texts": [],
      "menu_files": [
        "Menus/Menu week of 7-5-25.md"
      ],
      "menu_weeks": [
        "2025-07-05"
      ],
      "menu_seasons": [
        "summer"
      ],
      "meal_types": [
        "dinner"
      ],
      "sections": [],
      "source_hints": [],
      "item_texts": [
        "Chicken nuggets, air fryer broccoli, sweet potato fries"
      ],
      "count": 1
    },
    {
      "url": null,
      "urls": [],
      "link_texts": [],
      "menu_files": [
        "Menus/Menu week of 7-5-25.md"
      ],
      "menu_weeks": [
        "2025-07-05"
      ],
      "menu_seasons": [
        "summer"
      ],
      "meal_types": [
        "dinner"
      ],
      "sections": [],
      "source_hints": [],
      "item_texts": [
        "Peach cobbler"
      ],
      "count": 1
    },
    {
      "url": null,
      "urls": [],
      "link_texts": [],
      "menu_files": [
        "Menus/Menu week of 7-8-17.md"
      ],
      "menu_weeks": [
        "2017-07-08"
      ],
      "menu_seasons": [
        "summer"
      ],
      "meal_types": [
        "dinner"
      ],
      "sections": [],
      "source_hints": [
        "and tzatziki"
      ],
      "item_texts": [
        "Greek pork pitas (and tzatziki)"
      ],
      "count": 1
    },
    {
      "url": null,
      "urls": [],
      "link_texts": [],
      "menu_files": [
        "Menus/Menu week of 7-8-17.md"
      ],
      "menu_weeks": [
        "2017-07-08"
      ],
      "menu_seasons": [
        "summer"
      ],
      "meal_types": [
        "dinner"
      ],
      "sections": [],
      "source_hints": [
        "w lots of radish"
      ],
      "item_texts": [
        "Vegetarian enchiladas verde (w lots of radish)"
      ],
      "count": 1
    },
    {
      "url": null,
      "urls": [],
      "link_texts": [],
      "menu_files": [
        "Menus/Menu week of 7-8-17.md"
      ],
      "menu_weeks": [
        "2017-07-08"
      ],
      "menu_seasons": [
        "summer"
      ],
      "meal_types": [
        "dinner"
      ],
      "sections": [],
      "source_hints": [],
      "item_texts": [
        "Leek, chard, and corn flatbread"
      ],
      "count": 1
    },
    {
      "url": null,
      "urls": [],
      "link_texts": [],
      "menu_files": [
        "Menus/Menu week of 7-8-17.md"
      ],
      "menu_weeks": [
        "2017-07-08"
      ],
      "menu_seasons": [
        "summer"
      ],
      "meal_types": [
        "dinner"
      ],
      "sections": [],
      "source_hints": [],
      "item_texts": [
        "Garlic scape beef satay with grilled zucchini"
      ],
      "count": 1
    },
    {
      "url": null,
      "urls": [],
      "link_texts": [],
      "menu_files": [
        "Menus/Menu week of 7-8-17.md"
      ],
      "menu_weeks": [
        "2017-07-08"
      ],
      "menu_seasons": [
        "summer"
      ],
      "meal_types": [
        "lunch"
      ],
      "sections": [],
      "source_hints": [
        "lunch"
      ],
      "item_texts": [
        "Kale fried rice (lunch)"
      ],
      "count": 1
    },
    {
      "url": null,
      "urls": [],
      "link_texts": [],
      "menu_files": [
        "Menus/Menu week of 7-8-22.md"
      ],
      "menu_weeks": [
        "2022-07-08"
      ],
      "menu_seasons": [
        "summer"
      ],
      "meal_types": [
        "dinner"
      ],
      "sections": [],
      "source_hints": [
        "Skinnytaste"
      ],
      "item_texts": [
        "Peruvian-style grilled chicken with aji verde sauce (Serious Eats), cuban rice and black beans (Skinnytaste)"
      ],
      "count": 1
    },
    {
      "url": null,
      "urls": [],
      "link_texts": [],
      "menu_files": [
        "Menus/Menu week of 7-8-22.md"
      ],
      "menu_weeks": [
        "2022-07-08"
      ],
