{
  "menus": [
    {
      "file": "Menus/Easter brunch.md",
      "title": "Easter brunch",
      "week_of_date": null,
      "season": "unknown",
      "items": [
        {
          "text": "",
          "section": null,
          "meal_type": "dinner",
          "season": "unknown",
          "source_hint": null,
          "links": [
            {
              "text": "https://www.twopeasandtheirpod.com/bacon-potato-and-egg-casserole/#wprm-recipe-container-39516",
              "url": "https://www.twopeasandtheirpod.com/bacon-potato-and-egg-casserole/#wprm-recipe-container-39516"
            }
          ],
          "urls": []
        },
        {
          "text": "Make the night before. Sub water for milk. only add cheese to half and not in the mix.",
          "section": null,
          "meal_type": "dinner",
          "season": "unknown",
          "source_hint": null,
          "links": [],
          "urls": []
        },
        {
          "text": "Carrot cake coffee cake - make the night before",
          "section": null,
          "meal_type": "dinner",
          "season": "unknown",
          "source_hint": null,
          "links": [
            {
              "text": "https://pinchofyum.com/carrot-cake-coffee-cake?utm_source=convertkit&utm_medium=email&utm_campaign=What+I%27m+Bringing+Back+Home+for+Easter+Weekend%21+-+17310250",
              "url": "https://pinchofyum.com/carrot-cake-coffee-cake?utm_source=convertkit&utm_medium=email&utm_campaign=What+I%27m+Bringing+Back+Home+for+Easter+Weekend%21+-+17310250"
            }
          ],
          "urls": []
        },
        {
          "text": "Use vegan butter",
          "section": null,
          "meal_type": "dinner",
          "season": "unknown",
          "source_hint": null,
          "links": [],
          "urls": []
        },
        {
          "text": "FruitMonkeys",
          "section": null,
          "meal_type": "dinner",
          "season": "unknown",
          "source_hint": null,
          "links": [],
          "urls": []
        }
      ]
    },
    {
      "file": "Menus/Easy post baby recipes.md",
      "title": "Easy post baby recipes",
      "week_of_date": null,
      "season": "unknown",
      "items": [
        {
          "text": "Spicy peanut tofu bowls",
          "section": null,
          "meal_type": "dinner",
          "season": "unknown",
          "source_hint": null,
          "links": [
            {
              "text": "Spicy Peanut Tofu Bowls",
              "url": "https://pinchofyum.com/spicy-peanut-tofu-bowls",
              "auto_added": true
            }
          ],
          "urls": []
        },
        {
          "text": "Roasted sweet potato tacos",
          "section": null,
          "meal_type": "dinner",
          "season": "unknown",
          "source_hint": null,
          "links": [
            {
              "text": "Roasted Sweet Potato Tacos",
              "url": "https://www.gimmesomeoven.com/roasted-sweet-potato-tacos/",
              "auto_added": true
            }
          ],
          "urls": []
        },
        {
          "text": "Bulgur salad",
          "section": null,
          "meal_type": "dinner",
          "season": "unknown",
          "source_hint": null,
          "links": [],
          "urls": []
        },
        {
          "text": "Roasted tomato caprese pasta salad",
          "section": null,
          "meal_type": "dinner",
          "season": "unknown",
          "source_hint": null,
          "links": [
            {
              "text": "Quick Roasted Tomato Caprese Pasta Salad",
              "url": "https://www.forkknifeswoon.com/quick-roasted-tomato-caprese-pasta-salad/",
              "auto_added": true
            }
          ],
          "urls": []
        },
        {
          "text": "Gnocchi with Brussels Sprouts, Chicken Sausage and Pesto",
          "section": null,
          "meal_type": "dinner",
          "season": "unknown",
          "source_hint": null,
          "links": [],
          "urls": []
        }
      ]
    },
    {
      "file": "Menus/Maeve\u2019s first note.md",
      "title": "Maeve\u2019s first note",
      "week_of_date": null,
      "season": "unknown",
      "items": []
    },
    {
      "file": "Menus/Menu week of 1-10-19.md",
      "title": "Menu week of 1/10/19",
      "week_of_date": "2019-01-10",
      "season": "winter",
      "items": [
        {
          "text": "Instant pot chicken chili verde",
          "section": null,
          "meal_type": "dinner",
          "season": "winter",
          "source_hint": null,
          "links": [],
          "urls": []
        },
        {
          "text": "Chicken Caesar salad",
          "section": null,
          "meal_type": "dinner",
          "season": "winter",
          "source_hint": null,
          "links": [
            {
              "text": "Best Chicken Caesar Salad with Homemade Croutons",
              "url": "https://damndelicious.net/2023/04/21/best-chicken-caesar-salad-with-homemade-croutons/",
              "auto_added": true
            }
          ],
          "urls": []
        },
        {
          "text": "Spicy peanut soup with sweet potato (instant pot)",
          "section": null,
          "meal_type": "dinner",
          "season": "winter",
          "source_hint": "instant pot",
          "links": [
            {
              "text": "Spicy Peanut Soup with Sweet Potato + Kale",
              "url": "https://pinchofyum.com/sweet-potato-peanut-soup",
              "auto_added": true
            }
          ],
          "urls": []
        },
        {
          "text": "Bulgur salad",
          "section": null,
          "meal_type": "dinner",
          "season": "winter",
          "source_hint": null,
          "links": [],
          "urls": []
        },
        {
          "text": "Salmon burgers with slaw",
          "section": null,
          "meal_type": "dinner",
          "season": "winter",
          "source_hint": null,
          "links": [
            {
              "text": "Yummy Salmon Burgers with Slaw",
              "url": "https://pinchofyum.com/yummy-salmon-burgers-slaw",
              "auto_added": true
            }
          ],
          "urls": []
        },
        {
          "text": "Chickpea cous cous bowls with tahini sauce",
          "section": null,
          "meal_type": "dinner",
          "season": "winter",
          "source_hint": null,
          "links": [
            {
              "text": "Mediterranean Couscous Bowls",
              "url": "https://www.acouplecooks.com/chickpea-couscous-bowls-tahini-sauce/",
              "auto_added": true
            }
          ],
          "urls": []
        },
        {
          "text": "Instant pot short rib ragu",
          "section": null,
          "meal_type": "dinner",
          "season": "winter",
          "source_hint": null,
          "links": [
            {
              "text": "Instant Pot Short Rib Ragu",
              "url": "https://pinchofyum.com/instant-pot-short-rib-ragu",
              "auto_added": true
            }
          ],
          "urls": []
        }
      ]
    },
    {
      "file": "Menus/Menu week of 1-11-20.md",
      "title": "Menu week of 1/11/20",
      "week_of_date": "2020-01-11",
      "season": "winter",
      "items": [
        {
          "text": "Chicken Quinoa Broccoli Casserole",
          "section": null,
          "meal_type": "dinner",
          "season": "winter",
          "source_hint": null,
          "links": [
            {
              "text": "Creamy Chicken Quinoa and Broccoli Casserole",
              "url": "https://pinchofyum.com/creamy-chicken-quinoa-broccoli-casserole",
              "auto_added": true
            }
          ],
          "urls": []
        },
        {
          "text": "Cauliflower Walnut burrito bowls (guac in freezer)",
          "section": null,
          "meal_type": "dinner",
          "season": "winter",
          "source_hint": "guac in freezer",
          "links": [],
          "urls": []
        },
        {
          "text": "Irish potato soup",
          "section": null,
          "meal_type": "dinner",
          "season": "winter",
          "source_hint": null,
          "links": [],
          "urls": []
        },
        {
          "text": "Saturday: Roasted beet, goat cheese, and candied pecan salad with amelia\u2019s bread",
          "section": null,
          "meal_type": "dinner",
          "season": "winter",
          "source_hint": null,
          "links": [],
          "urls": []
        },
        {
          "text": "Vegetarian Moo Shu",
          "section": null,
          "meal_type": "dinner",
          "season": "winter",
          "source_hint": null,
          "links": [
            {
              "text": "Vegetarian Moo Shu",
              "url": "https://www.gimmesomeoven.com/vegetarian-moo-shu/",
              "auto_added": true
            }
          ],
          "urls": []
        },
        {
          "text": "Crockpot Lentil Quesadillas with magic green sauce",
          "section": null,
          "meal_type": "dinner",
          "season": "winter",
          "source_hint": null,
          "links": [
            {
              "text": "Quick and Easy Lentil Quesadillas",
              "url": "https://pinchofyum.com/quick-and-easy-lentil-quesadillas",
              "auto_added": true
            }
          ],
          "urls": []
        },
        {
          "text": "Steak and roasted parsnips and beets",
          "section": null,
          "meal_type": "dinner",
          "season": "winter",
          "source_hint": null,
          "links": [],
          "urls": []
        },
        {
          "text": "Quinoa Crunch Salad with peanut dressing",
          "section": null,
          "meal_type": "dinner",
          "season": "winter",
          "source_hint": null,
          "links": [
            {
              "text": "Quinoa Crunch Salad with Peanut Dressing",
              "url": "https://pinchofyum.com/quinoa-crunch-salad-with-peanut-dressing",
              "auto_added": true
            }
          ],
          "urls": []
        },
        {
          "text": "Breakfast balls",
          "section": null,
          "meal_type": "breakfast",
          "season": "winter",
          "source_hint": null,
          "links": [],
          "urls": []
        }
      ]
    },
    {
      "file": "Menus/Menu week of 1-12-2021.md",
      "title": "Menu week of 1/12/2021",
      "week_of_date": "2021-01-12",
      "season": "winter",
      "items": [
        {
          "text": "Root vegetable soup (freezer) and salad",
          "section": null,
          "meal_type": "dinner",
          "season": "winter",
          "source_hint": null,
          "links": [],
          "urls": []
        },
        {
          "text": "Lunch: Vegetarian Italian Chopped Salad",
          "section": null,
          "meal_type": "lunch",
          "season": "winter",
          "source_hint": null,
          "links": [],
          "urls": []
        },
        {
          "text": "Garlicky roasted squash and ricotta pizza",
          "section": null,
          "meal_type": "dinner",
          "season": "winter",
          "source_hint": null,
          "links": [
            {
              "text": "Garlicky Roasted Squash and Ricotta Pizza",
              "url": "https://cravingsbychrissyteigen.com/blogs/recipes/squash-and-ricotta-pizza-recipe",
              "auto_added": true
            }
          ],
          "urls": []
        },
        {
          "text": "Chipotle quinoa burgers and sweet potato fries",
          "section": null,
          "meal_type": "dinner",
          "season": "winter",
          "source_hint": null,
          "links": [],
          "urls": []
        },
        {
          "text": "Cauliflower Gnocchi",
          "section": null,
          "meal_type": "dinner",
          "season": "winter",
          "source_hint": null,
          "links": [],
          "urls": []
        },
        {
          "text": "Cauliflower walnut taco meat burrito bowls",
          "section": null,
          "meal_type": "dinner",
          "season": "winter",
          "source_hint": null,
          "links": [],
          "urls": []
        },
        {
          "text": "Vegan sheet pan fajitas with chipotle queso",
          "section": null,
          "meal_type": "dinner",
          "season": "winter",
          "source_hint": null,
          "links": [],
          "urls": []
        },
        {
          "text": "Instant pot Italian Beef sandwiches",
          "section": null,
          "meal_type": "dinner",
          "season": "winter",
          "source_hint": null,
          "links": [],
          "urls": []
        }
      ]
    },
    {
      "file": "Menus/Menu week of 1-13-18.md",
      "title": "Menu week of 1/13/18",
      "week_of_date": "2018-01-13",
      "season": "winter",
      "items": [
        {
          "text": "Fried chicken, cornbread, green beans",
          "section": null,
          "meal_type": "dinner",
          "season": "winter",
          "source_hint": null,
          "links": [],
          "urls": []
        },
        {
          "text": "Squid ink pasta with shrimp and scallops",
          "section": null,
          "meal_type": "dinner",
          "season": "winter",
          "source_hint": null,
          "links": [],
          "urls": []
        },
        {
          "text": "Quick dal makhani",
          "section": null,
          "meal_type": "dinner",
          "season": "winter",
          "source_hint": null,
          "links": [],
          "urls": []
        },
        {
          "text": "Bulgar salad",
          "section": null,
          "meal_type": "dinner",
          "season": "winter",
          "source_hint": null,
          "links": [],
          "urls": []
        },
        {
          "text": "Broccoli cauliflower beef stir fry",
          "section": null,
          "meal_type": "dinner",
          "season": "winter",
          "source_hint": null,
          "links": [],
          "urls": []
        },
        {
          "text": "Pizza",
          "section": null,
          "meal_type": "dinner",
          "season": "winter",
          "source_hint": null,
          "links": [],
          "urls": []
        },
        {
          "text": "Skillet-charred fish tacos (cravings p209)",
          "section": null,
          "meal_type": "dinner",
          "season": "winter",
          "source_hint": null,
          "links": [],
          "urls": []
        },
        {
          "text": "Dark chocolate almond joy bites",
          "section": null,
          "meal_type": "dinner",
          "season": "winter",
          "source_hint": null,
          "links": [],
          "urls": []
        },
        {
          "text": "Chips and salsa",
          "section": null,
          "meal_type": "dinner",
          "season": "winter",
          "source_hint": null,
          "links": [],
          "urls": []
        },
        {
          "text": "Carrots and hummus",
          "section": null,
          "meal_type": "dinner",
          "season": "winter",
          "source_hint": null,
          "links": [],
          "urls": []
        },
        {
          "text": "Cheese and crackers (include goat cheese and port wine cranberry",
          "section": null,
          "meal_type": "dinner",
          "season": "winter",
          "source_hint": null,
          "links": [],
          "urls": []
        }
      ]
    },
    {
      "file": "Menus/Menu week of 1-13-22.md",
      "title": "Menu week of 1/13/22",
      "week_of_date": "2022-01-13",
      "season": "winter",
      "items": [
        {
          "text": "Instant Pot Korean beef tacos (marinade in freezer)",
          "section": null,
          "meal_type": "dinner",
          "season": "winter",
          "source_hint": "marinade in freezer",
          "links": [],
          "urls": []
        },
        {
          "text": "Instant Pot Chicken and dumplings",
          "section": null,
          "meal_type": "dinner",
          "season": "winter",
          "source_hint": null,
          "links": [],
          "urls": []
        },
        {
          "text": "Frozen pizza and bagged salad",
          "section": null,
          "meal_type": "dinner",
          "season": "winter",
          "source_hint": null,
          "links": [],
          "urls": []
        },
        {
          "text": "Sesame apricot tofu (Pinch of Yum)",
          "section": null,
          "meal_type": "dinner",
          "season": "winter",
          "source_hint": "Pinch of Yum",
          "links": [
            {
              "text": "Sesame Apricot Tofu",
              "url": "https://pinchofyum.com/sesame-apricot-tofu",
              "auto_added": true
            }
          ],
          "urls": []
        },
        {
          "text": "Chicken and broccoli stir fry (Damn Delicious)",
          "section": null,
          "meal_type": "dinner",
          "season": "winter",
          "source_hint": "Damn Delicious",
          "links": [],
          "urls": []
        },
        {
          "text": "Green Goddess roasted chicken and carrots",
          "section": null,
          "meal_type": "dinner",
          "season": "winter",
          "source_hint": null,
          "links": [
            {
              "text": "https://www.today.com/recipes/green-goddess-roasted-chicken-t106869",
              "url": "https://www.today.com/recipes/green-goddess-roasted-chicken-t106869"
            }
          ],
          "urls": []
        },
        {
          "text": "The best Detox crockpot lentil soup (Pinch of Yum) and bread",
          "section": null,
          "meal_type": "dinner",
          "season": "winter",
          "source_hint": null,
          "links": [],
          "urls": []
        },
        {
          "text": "Baked Salmon with amazing lemon sauce (Pinch of Yum)",
          "section": null,
          "meal_type": "dinner",
          "season": "winter",
          "source_hint": "Pinch of Yum",
          "links": [],
          "urls": []
        },
        {
          "text": "Sweet potato black bean bowls",
          "section": null,
          "meal_type": "dinner",
          "season": "winter",
          "source_hint": null,
          "links": [],
          "urls": []
        }
      ]
    },
    {
      "file": "Menus/Menu week of 1-16-22.md",
      "title": "Menu week of 1/16/22",
      "week_of_date": "2022-01-16",
      "season": "winter",
      "items": [
        {
          "text": "Blue apron: chicken",
          "section": null,
          "meal_type": "dinner",
          "season": "winter",
          "source_hint": null,
          "links": [],
          "urls": []
        },
        {
          "text": "Smokey beans and greens tacos with aj\u00ed verde",
          "section": null,
          "meal_type": "dinner",
          "season": "winter",
          "source_hint": null,
          "links": [],
          "urls": []
        },
        {
          "text": "Blue apron: steak",
          "section": null,
          "meal_type": "dinner",
          "season": "winter",
          "source_hint": null,
          "links": [],
          "urls": []
        },
        {
          "text": "Blue apron: salmon",
          "section": null,
          "meal_type": "dinner",
          "season": "winter",
          "source_hint": null,
          "links": [],
          "urls": []
        },
        {
          "text": "Creamy red pepper pasta with bl\u00edsteres tomatoes",
          "section": null,
          "meal_type": "dinner",
          "season": "winter",
          "source_hint": null,
          "links": [],
          "urls": []
        },
        {
          "text": "Blue Apron: wonton noodles",
          "section": null,
          "meal_type": "dinner",
          "season": "winter",
          "source_hint": null,
          "links": [],
          "urls": []
        },
        {
          "text": "Blue apron: cheese burgers and potato wedges",
          "section": null,
          "meal_type": "dinner",
          "season": "winter",
          "source_hint": null,
          "links": [],
          "urls": []
        },
        {
          "text": "Plantain and pinto stew with aj\u00ed verde (make rice)",
          "section": null,
          "meal_type": "dinner",
          "season": "winter",
          "source_hint": "make rice",
          "links": [],
          "urls": []
        },
        {
          "text": "Snack: cookie dough energy bites",
          "section": null,
          "meal_type": "snack",
          "season": "winter",
          "source_hint": null,
          "links": [],
          "urls": []
        },
        {
          "text": "Anytime: simple greens salad",
          "section": null,
          "meal_type": "dinner",
          "season": "winter",
          "source_hint": null,
          "links": [],
          "urls": []
        },
        {
          "text": "Moe casserole",
          "section": null,
          "meal_type": "dinner",
          "season": "winter",
          "source_hint": null,
          "links": [],
          "urls": []
        },
        {
          "text": "Frozen pizza",
          "section": null,
          "meal_type": "dinner",
          "season": "winter",
          "source_hint": null,
          "links": [],
          "urls": []
        }
      ]
    },
    {
      "file": "Menus/Menu week of 1-16-26.md",
      "title": "Menu week of 1/16/26",
      "week_of_date": "2026-01-16",
      "season": "winter",
      "items": [
        {
          "text": "White people tacos",
          "section": null,
          "meal_type": "dinner",
          "season": "winter",
          "source_hint": null,
          "links": [],
          "urls": []
        },
        {
          "text": "Roasted red pepper pasta and cauliflower",
          "section": null,
          "meal_type": "dinner",
          "season": "winter",
          "source_hint": null,
          "links": [],
          "urls": []
        },
        {
          "text": "Perogies with bacon, sour cream, cheese, chives, and salad",
          "section": null,
          "meal_type": "dinner",
          "season": "winter",
          "source_hint": null,
          "links": [],
          "urls": []
        },
        {
          "text": "Orange chicken, broccoli, and rice",
          "section": null,
          "meal_type": "dinner",
          "season": "winter",
          "source_hint": null,
          "links": [],
          "urls": []
        },
        {
          "text": "Sheet pan chicken pitas",
          "section": null,
          "meal_type": "dinner",
          "season": "winter",
          "source_hint": "https://pinchofyum.com/sheet-pan-chicken-pitas",
          "links": [
            {
              "text": "https://pinchofyum.com/sheet-pan-chicken-pitas",
              "url": "https://pinchofyum.com/sheet-pan-chicken-pitas"
            }
          ],
          "urls": []
        },
        {
          "text": "Frozen pizza and salad",
          "section": null,
          "meal_type": "dinner",
          "season": "winter",
          "source_hint": null,
          "links": [],
          "urls": []
        },
        {
          "text": "Chicken nuggets, sweet potato fries, leftover broccoli",
          "section": null,
          "meal_type": "dinner",
          "season": "winter",
          "source_hint": null,
          "links": [],
          "urls": []
        },
        {
          "text": "Orange chicken (freezer) and broccoli",
          "section": null,
          "meal_type": "dinner",
          "season": "winter",
          "source_hint": null,
          "links": [],
          "urls": []
        },
        {
          "text": "Sweet potato stacks with chipotle sauce",
          "section": null,
          "meal_type": "dinner",
          "season": "winter",
          "source_hint": "https://pinchofyum.com/roasted-sweet-potato-stacks-with-chipotle-sauce",
          "links": [
            {
              "text": "https://pinchofyum.com/roasted-sweet-potato-stacks-with-chipotle-sauce",
              "url": "https://pinchofyum.com/roasted-sweet-potato-stacks-with-chipotle-sauce"
            }
          ],
          "urls": []
        },
        {
          "text": "Sheet pan meatballs with tomato salad and green sauce",
          "section": null,
          "meal_type": "dinner",
          "season": "winter",
          "source_hint": "https://pinchofyum.com/sheet-pan-meatballs-with-tomato-salad-and-green-sauce",
          "links": [
            {
              "text": "https://pinchofyum.com/sheet-pan-meatballs-with-tomato-salad-and-green-sauce",
              "url": "https://pinchofyum.com/sheet-pan-meatballs-with-tomato-salad-and-green-sauce"
            }
          ],
          "urls": []
        },
        {
          "text": "Breakfast: French toast, bacon",
          "section": null,
          "meal_type": "breakfast",
          "season": "winter",
          "source_hint": null,
          "links": [],
          "urls": []
        },
        {
          "text": "Ang\u2019s creamy tortellini soup",
          "section": null,
          "meal_type": "dinner",
          "season": "winter",
          "source_hint": "https://pinchofyum.com/tortellini-soup",
          "links": [
            {
              "text": "https://pinchofyum.com/tortellini-soup",
              "url": "https://pinchofyum.com/tortellini-soup"
            }
          ],
          "urls": []
        },
        {
          "text": "Gnocchi with creamy mushroom sauce",
          "section": null,
          "meal_type": "dinner",
          "season": "winter",
          "source_hint": "https://pinchofyum.com/gnocchi-with-creamy-mushroom-sauce",
          "links": [
            {
              "text": "https://pinchofyum.com/gnocchi-with-creamy-mushroom-sauce",
              "url": "https://pinchofyum.com/gnocchi-with-creamy-mushroom-sauce"
            }
          ],
          "urls": []
        }
      ]
    },
    {
      "file": "Menus/Menu week of 1-17-25.md",
      "title": "Menu week of 1/17/25",
      "week_of_date": "2025-01-17",
      "season": "winter",
      "items": [
        {
          "text": "Sesame apricot tofu",
          "section": null,
          "meal_type": "dinner",
          "season": "winter",
          "source_hint": "https://pinchofyum.com/sesame-apricot-tofu",
          "links": [
            {
              "text": "https://pinchofyum.com/sesame-apricot-tofu",
              "url": "https://pinchofyum.com/sesame-apricot-tofu"
            }
          ],
          "urls": []
        },
        {
          "text": "Thai peanut chicken bowls: use chicken thighs",
          "section": null,
          "meal_type": "dinner",
          "season": "winter",
          "source_hint": "https://pinchofyum.com/thai-peanut-chicken-bowls",
          "links": [
            {
              "text": "https://pinchofyum.com/thai-peanut-chicken-bowls",
              "url": "https://pinchofyum.com/thai-peanut-chicken-bowls"
            }
          ],
          "urls": []
        },
        {
          "text": "Chicken nuggets, broccoli, sweet potato fries",
          "section": null,
          "meal_type": "dinner",
          "season": "winter",
          "source_hint": null,
          "links": [],
          "urls": []
        },
        {
          "text": "Ground beef tacos",
          "section": null,
          "meal_type": "dinner",
          "season": "winter",
          "source_hint": null,
          "links": [],
          "urls": []
        },
        {
          "text": "Frozen pizza and salad",
          "section": null,
          "meal_type": "dinner",
          "season": "winter",
          "source_hint": null,
          "links": [],
          "urls": []
        },
        {
          "text": "Slow cooker vegetarian chili (cook the onions first) and corn bread muffins",
          "section": null,
          "meal_type": "dinner",
          "season": "winter",
          "source_hint": null,
          "links": [
            {
              "text": "https://www.gimmesomeoven.com/slow-cooker  no-vegetarian-chili-recipe/#tasty-recipes-63953",
              "url": "https://www.gimmesomeoven.com/slow-cooker-vegetarian-chili-recipe/#tasty-recipes-63953"
            }
          ],
          "urls": []
        },
        {
          "text": "Short rib ragu and fancy pasta in the freezer",
          "section": null,
          "meal_type": "dinner",
          "season": "winter",
          "source_hint": null,
          "links": [
            {
              "text": "https://pinchofyum.com/instant-pot-short-rib-ragu",
              "url": "https://pinchofyum.com/instant-pot-short-rib-ragu"
            }
          ],
          "urls": []
        },
        {
          "text": "Chicken with Coconut Kale (add red pepper)",
          "section": null,
          "meal_type": "dinner",
          "season": "winter",
          "source_hint": "https://pinchofyum.com/chicken-with-coconut-kale",
          "links": [
            {
              "text": "https://pinchofyum.com/chicken-with-coconut-kale",
              "url": "https://pinchofyum.com/chicken-with-coconut-kale"
            }
          ],
          "urls": []
        }
      ]
    },
    {
      "file": "Menus/Menu week of 1-2-18.md",
      "title": "Menu week of 1/2/18",
      "week_of_date": "2018-01-02",
      "season": "winter",
      "items": [
        {
          "text": "Corned beef and cabbage, potatoes",
          "section": null,
          "meal_type": "dinner",
          "season": "winter",
          "source_hint": null,
          "links": [],
          "urls": []
        },
        {
          "text": "Golden soup and spinach salad",
          "section": null,
          "meal_type": "dinner",
          "season": "winter",
          "source_hint": null,
          "links": [],
          "urls": []
        },
        {
          "text": "Tofu green curry and brown rice",
          "section": null,
          "meal_type": "dinner",
          "season": "winter",
          "source_hint": null,
          "links": [],
          "urls": []
        },
        {
          "text": "Vegetarian Italian chopped salad",
          "section": null,
          "meal_type": "dinner",
          "season": "winter",
          "source_hint": null,
          "links": [
            {
              "text": "Vegetarian Italian Chopped Salad",
              "url": "https://cookieandkate.com/vegetarian-italian-chopped-salad-recipe/",
              "auto_added": true
            }
          ],
          "urls": []
        },
        {
          "text": "Cabbage, sausage, and potato soup",
          "section": null,
          "meal_type": "dinner",
          "season": "winter",
          "source_hint": null,
          "links": [],
          "urls": []
        },
        {
          "text": "Whole wheat pasta salad with salmon",
          "section": null,
          "meal_type": "dinner",
          "season": "winter",
          "source_hint": null,
          "links": [],
          "urls": []
        }
      ]
    },
    {
      "file": "Menus/Menu week of 1-20-24.md",
      "title": "Menu week of 1/20/24",
      "week_of_date": "2024-01-20",
      "season": "winter",
      "items": [
        {
          "text": "Black pepper stir fry udon noodles with tofu (Pinch of Yum)",
          "section": null,
          "meal_type": "dinner",
          "season": "winter",
          "source_hint": "Pinch of Yum",
          "links": [],
          "urls": []
        },
        {
          "text": "Red pepper cashew pasta with cauliflower",
          "section": null,
          "meal_type": "dinner",
          "season": "winter",
          "source_hint": null,
          "links": [],
          "urls": []
        },
        {
          "text": "Chicken nuggets, sweet potato fries, roasted broccoli",
          "section": null,
          "meal_type": "dinner",
          "season": "winter",
          "source_hint": null,
          "links": [],
          "urls": []
        },
        {
          "text": "Brats and some kind of roasted vegetable (use sour kraut up)",
          "section": null,
          "meal_type": "dinner",
          "season": "winter",
          "source_hint": "use sour kraut up",
          "links": [],
          "urls": []
        },
        {
          "text": "Frozen pizza and salad",
          "section": null,
          "meal_type": "dinner",
          "season": "winter",
          "source_hint": null,
          "links": [],
          "urls": []
        },
        {
          "text": "Crock pot white chicken chili (Iowa Girl Eats)",
          "section": null,
          "meal_type": "dinner",
          "season": "winter",
          "source_hint": "Iowa Girl Eats",
          "links": [],
          "urls": []
        },
        {
          "text": "Ground beef tacos",
          "section": null,
          "meal_type": "dinner",
          "season": "winter",
          "source_hint": null,
          "links": [],
          "urls": []
        },
        {
          "text": "Chicken wontons with spicy sauce and roasted broccoli (Pinch of Yum)",
          "section": null,
          "meal_type": "dinner",
          "season": "winter",
          "source_hint": "Pinch of Yum",
          "links": [],
          "urls": []
        }
      ]
    },
    {
      "file": "Menus/Menu week of 1-21-19.md",
      "title": "Menu week of 1/21/19",
      "week_of_date": "2019-01-21",
      "season": "winter",
      "items": [
        {
          "text": "Cauliflower and tomato coconut curry",
          "section": null,
          "meal_type": "dinner",
          "season": "winter",
          "source_hint": null,
          "links": [],
          "urls": []
        },
        {
          "text": "Black pepper stir fry noodles",
          "section": null,
          "meal_type": "dinner",
          "season": "winter",
          "source_hint": null,
          "links": [],
          "urls": []
        },
        {
          "text": "Chicken tinga tacos",
          "section": null,
          "meal_type": "dinner",
          "season": "winter",
          "source_hint": null,
          "links": [
            {
              "text": "The Best Chicken Tinga Tacos",
              "url": "https://pinchofyum.com/the-best-chicken-tinga-tacos",
              "auto_added": true
            }
          ],
          "urls": []
        },
        {
          "text": "Pizza",
          "section": null,
          "meal_type": "dinner",
          "season": "winter",
          "source_hint": null,
          "links": [],
          "urls": []
        },
        {
          "text": "Quinoa salad with apple, chickpeas, toasted almonds, apple cider vinaigrette",
          "section": null,
          "meal_type": "dinner",
          "season": "winter",
          "source_hint": null,
          "links": [],
          "urls": []
        },
        {
          "text": "Sweet potato and black bean toastadas",
          "section": null,
          "meal_type": "dinner",
          "season": "winter",
          "source_hint": null,
          "links": [],
          "urls": []
        },
        {
          "text": "Chicken Caesar salad",
          "section": null,
          "meal_type": "dinner",
          "season": "winter",
          "source_hint": null,
          "links": [
            {
              "text": "Best Chicken Caesar Salad with Homemade Croutons",
              "url": "https://damndelicious.net/2023/04/21/best-chicken-caesar-salad-with-homemade-croutons/",
              "auto_added": true
            }
          ],
          "urls": []
        },
        {
          "text": "Everything Greek pork pitas and Greek salad (take to Haley\u2019s?)",
          "section": null,
          "meal_type": "dinner",
          "season": "winter",
          "source_hint": "take to Haley\u2019s?",
          "links": [],
          "urls": []
        },
        {
          "text": "Chili",
          "section": null,
          "meal_type": "dinner",
          "season": "winter",
          "source_hint": null,
          "links": [],
          "urls": []
        }
      ]
    },
    {
      "file": "Menus/Menu week of 1-23-23.md",
      "title": "Menu week of 1/23/23",
      "week_of_date": "2023-01-23",
      "season": "winter",
      "items": [
        {
          "text": "COCONUT CURRY SALMON",
          "section": null,
          "meal_type": "dinner",
          "season": "winter",
          "source_hint": null,
          "links": [],
          "urls": []
        },
        {
          "text": "SAUSAGE, KALE, AND WHITE BEAN SOUP",
          "section": null,
          "meal_type": "dinner",
          "season": "winter",
          "source_hint": null,
          "links": [],
          "urls": []
        },
        {
          "text": "WALNUT CHORIZO TACOS",
          "section": null,
          "meal_type": "dinner",
          "season": "winter",
          "source_hint": null,
          "links": [],
          "urls": []
        },
        {
          "text": "Five ingredient spicy pork",
          "section": null,
          "meal_type": "dinner",
          "season": "winter",
          "source_hint": null,
          "links": [
            {
              "text": "https://pinchofyum.com/5-ingredient-spicy-pork",
              "url": "https://pinchofyum.com/5-ingredient-spicy-pork"
            }
          ],
          "urls": []
        },
        {
          "text": "Gnocchi with Brussels Sprouts, Chicken Sausage and Pesto",
          "section": null,
          "meal_type": "dinner",
          "season": "winter",
          "source_hint": null,
          "links": [],
          "urls": []
        },
        {
          "text": "ROASTED CAULIFLOWER HUMMUS BOWLS",
          "section": null,
          "meal_type": "dinner",
          "season": "winter",
          "source_hint": null,
          "links": [],
          "urls": []
        },
        {
          "text": "AVOCADO KALE CAESAR SALAD",
          "section": null,
          "meal_type": "dinner",
          "season": "winter",
          "source_hint": null,
          "links": [],
          "urls": []
        }
      ]
    },
    {
      "file": "Menus/Menu week of 1-24-20.md",
      "title": "Menu week of 1/24/20",
      "week_of_date": "2020-01-24",
      "season": "winter",
      "items": [
        {
          "text": "Best easy fish tacos",
          "section": null,
          "meal_type": "dinner",
          "season": "winter",
          "source_hint": null,
          "links": [],
          "urls": []
        },
        {
          "text": "Spaghetti squash burrito boats",
          "section": null,
          "meal_type": "dinner",
          "season": "winter",
          "source_hint": null,
          "links": [],
          "urls": []
        },
        {
          "text": "Chili",
          "section": null,
          "meal_type": "dinner",
          "season": "winter",
          "source_hint": null,
          "links": [],
          "urls": []
        },
        {
          "text": "Chicken caesar salad",
          "section": null,
          "meal_type": "dinner",
          "season": "winter",
          "source_hint": null,
          "links": [
            {
              "text": "Best Chicken Caesar Salad with Homemade Croutons",
              "url": "https://damndelicious.net/2023/04/21/best-chicken-caesar-salad-with-homemade-croutons/",
              "auto_added": true
            }
          ],
          "urls": []
        },
        {
          "text": "Korean bbq steak bowls",
          "section": null,
          "meal_type": "dinner",
          "season": "winter",
          "source_hint": null,
          "links": [],
          "urls": []
        },
        {
          "text": "Instant pot cauliflower mac and cheese",
          "section": null,
          "meal_type": "dinner",
          "season": "winter",
          "source_hint": null,
          "links": [],
          "urls": []
        },
        {
          "text": "Spicy peanut tofu bowls",
          "section": null,
          "meal_type": "dinner",
          "season": "winter",
          "source_hint": null,
          "links": [
            {
              "text": "Spicy Peanut Tofu Bowls",
              "url": "https://pinchofyum.com/spicy-peanut-tofu-bowls",
              "auto_added": true
            }
          ],
          "urls": []
        },
        {
          "text": "Breakfast sandwiches",
          "section": null,
          "meal_type": "breakfast",
          "season": "winter",
          "source_hint": null,
          "links": [],
          "urls": []
        }
      ]
    },
    {
      "file": "Menus/Menu week of 1-24-21.md",
      "title": "Menu week of 1/24/21",
      "week_of_date": "2021-01-24",
      "season": "winter",
      "items": [
        {
          "text": "Chili",
          "section": null,
          "meal_type": "dinner",
          "season": "winter",
          "source_hint": null,
          "links": [],
          "urls": []
        },
        {
          "text": "Cashew tofu stir fry",
          "section": null,
          "meal_type": "dinner",
          "season": "winter",
          "source_hint": null,
          "links": [],
          "urls": []
        },
        {
          "text": "Vegetarian Italian Chopped Salad",
          "section": null,
          "meal_type": "dinner",
          "season": "winter",
          "source_hint": null,
          "links": [
            {
              "text": "Vegetarian Italian Chopped Salad",
              "url": "https://cookieandkate.com/vegetarian-italian-chopped-salad-recipe/",
              "auto_added": true
            }
          ],
          "urls": []
        },
        {
          "text": "Slow cooker Olive Garden pasta e fagioli soup",
          "section": null,
          "meal_type": "dinner",
          "season": "winter",
          "source_hint": null,
          "links": [],
          "urls": []
        },
        {
          "text": "Spicy peanut tofu bowls",
          "section": null,
          "meal_type": "dinner",
          "season": "winter",
          "source_hint": null,
          "links": [
            {
              "text": "Spicy Peanut Tofu Bowls",
              "url": "https://pinchofyum.com/spicy-peanut-tofu-bowls",
              "auto_added": true
            }
          ],
          "urls": []
        },
        {
          "text": "Pizza",
          "section": null,
          "meal_type": "dinner",
          "season": "winter",
          "source_hint": null,
          "links": [],
          "urls": []
        },
        {
          "text": "Instant pot beef stew (can freeze ahead)",
          "section": null,
          "meal_type": "dinner",
          "season": "winter",
          "source_hint": "can freeze ahead",
          "links": [],
          "urls": []
        },
        {
          "text": "Sheet pan pesto gnocchi",
          "section": null,
          "meal_type": "dinner",
          "season": "winter",
          "source_hint": null,
          "links": [
            {
              "text": "Sheet Pan Pesto Gnocchi",
              "url": "https://www.twopeasandtheirpod.com/sheet-pan-pesto-gnocchi/",
              "auto_added": true
            }
          ],
          "urls": []
        },
        {
          "text": "Snack: breakfast balls",
          "section": null,
          "meal_type": "breakfast",
          "season": "winter",
          "source_hint": null,
          "links": [],
          "urls": []
        },
        {
          "text": "Peach smoothie or green smoothie",
          "section": null,
          "meal_type": "dinner",
          "season": "winter",
          "source_hint": null,
          "links": [],
          "urls": []
        }
      ]
    },
    {
      "file": "Menus/Menu week of 1-28-18.md",
      "title": "Menu week of 1/28/18",
      "week_of_date": "2018-01-28",
      "season": "winter",
      "items": [
        {
          "text": "Buffalo Chicken wontons and apples",
          "section": null,
          "meal_type": "dinner",
          "season": "winter",
          "source_hint": null,
          "links": [],
          "urls": []
        },
        {
          "text": "Bulgar salad",
          "section": null,
          "meal_type": "dinner",
          "season": "winter",
          "source_hint": null,
          "links": [],
          "urls": []
        },
        {
          "text": "Curry chicken salad",
          "section": null,
          "meal_type": "dinner",
          "season": "winter",
          "source_hint": null,
          "links": [],
          "urls": []
        },
        {
          "text": "Cilantro lime chicken meatball bowls",
          "section": null,
          "meal_type": "dinner",
          "season": "winter",
          "source_hint": null,
          "links": [],
          "urls": []
        },
        {
          "text": "Butternut squash Mac and cheese",
          "section": null,
          "meal_type": "dinner",
          "season": "winter",
          "source_hint": null,
          "links": [],
          "urls": []
        },
        {
          "text": "Red pepper pasta with roasted cauliflower",
          "section": null,
          "meal_type": "dinner",
          "season": "winter",
          "source_hint": null,
          "links": [],
          "urls": []
        },
        {
          "text": "Autumn glow salad",
          "section": null,
          "meal_type": "dinner",
          "season": "winter",
          "source_hint": null,
          "links": [
            {
              "text": "Autumn Glow Salad with Lemon Dressing",
              "url": "https://pinchofyum.com/autumn-glow-salad-with-lemon-dressing",
              "auto_added": true
            }
          ],
          "urls": []
        },
        {
          "text": "feta stuffed buffalo chicken meatballs",
          "section": null,
          "meal_type": "dinner",
          "season": "winter",
          "source_hint": null,
          "links": [],
          "urls": []
        },
        {
          "text": "Pizza bites",
          "section": null,
          "meal_type": "dinner",
          "season": "winter",
          "source_hint": null,
          "links": [],
          "urls": []
        },
        {
          "text": "Zesty like shrimp and avocado salad",
          "section": null,
          "meal_type": "dinner",
          "season": "winter",
          "source_hint": null,
          "links": [],
          "urls": []
        },
        {
          "text": "Fruit (blueberries, mangoes, apples)",
          "section": null,
          "meal_type": "dinner",
          "season": "winter",
          "source_hint": "blueberries, mangoes, apples",
          "links": [],
          "urls": []
        },
        {
          "text": "Eggs, bacon, potatoes",
          "section": null,
          "meal_type": "dinner",
          "season": "winter",
          "source_hint": null,
          "links": [],
          "urls": []
        },
        {
          "text": "Dark chocolate almond joy bites",
          "section": null,
          "meal_type": "dinner",
          "season": "winter",
          "source_hint": null,
          "links": [],
          "urls": []
        }
      ]
    },
    {
      "file": "Menus/Menu week of 1-28-25.md",
      "title": "Menu week of 1/28/25",
      "week_of_date": "2025-01-28",
      "season": "winter",
      "items": [
        {
          "text": "5 ingredient tomato soup and grilled cheese:",
          "section": null,
          "meal_type": "dinner",
          "season": "winter",
          "source_hint": null,
          "links": [
            {
              "text": "https://pinchofyum.com/5-ingredient-tomato-soup",
              "url": "https://pinchofyum.com/5-ingredient-tomato-soup"
            }
          ],
          "urls": []
        },
        {
          "text": "Black pepper stir fry udon add ground pork",
          "section": null,
          "meal_type": "dinner",
          "season": "winter",
          "source_hint": "https://pinchofyum.com/black-pepper-stir-fried-udon",
          "links": [
            {
              "text": "https://pinchofyum.com/black-pepper-stir-fried-udon",
              "url": "https://pinchofyum.com/black-pepper-stir-fried-udon"
            }
          ],
          "urls": []
        },
        {
          "text": "Autumn glow salad add chicken",
          "section": null,
          "meal_type": "dinner",
          "season": "winter",
          "source_hint": "https://pinchofyum.com/autumn-glow-salad-with-lemon-dressing",
          "links": [
            {
              "text": "https://pinchofyum.com/autumn-glow-salad-with-lemon-dressing",
              "url": "https://pinchofyum.com/autumn-glow-salad-with-lemon-dressing"
            }
          ],
          "urls": []
        },
        {
          "text": "Cauliflower walnut taco meat Double recipe, serve with black beans, pico, cheese, sour cream, corn, salsa, and lettuce",
          "section": null,
          "meal_type": "dinner",
          "season": "winter",
          "source_hint": "https://pinchofyum.com/cauliflower-walnut-vegetarian-taco-meat",
          "links": [
            {
              "text": "https://pinchofyum.com/cauliflower-walnut-vegetarian-taco-meat",
              "url": "https://pinchofyum.com/cauliflower-walnut-vegetarian-taco-meat"
            }
          ],
          "urls": []
        },
        {
          "text": "Spicy peanut tofu bowls",
          "section": null,
          "meal_type": "dinner",
          "season": "winter",
          "source_hint": "https://pinchofyum.com/spicy-peanut-tofu-bowls",
          "links": [
            {
              "text": "https://pinchofyum.com/spicy-peanut-tofu-bowls",
              "url": "https://pinchofyum.com/spicy-peanut-tofu-bowls"
            }
          ],
          "urls": []
        },
        {
          "text": "Chicken nuggets, broccoli, sweet potato fries",
          "section": null,
          "meal_type": "dinner",
          "season": "winter",
          "source_hint": null,
          "links": [],
          "urls": []
        },
        {
          "text": "Frozen pizza and salad",
          "section": null,
          "meal_type": "dinner",
          "season": "winter",
          "source_hint": null,
          "links": [],
          "urls": []
        },
        {
          "text": "Healthier Hamburger Helper",
          "section": null,
          "meal_type": "dinner",
          "season": "winter",
          "source_hint": "https://www.halfbakedharvest.com/one-pot-hamburger-helper/",
          "links": [
            {
              "text": "https://www.halfbakedharvest.com/one-pot-hamburger-helper/",
              "url": "https://www.halfbakedharvest.com/one-pot-hamburger-helper/"
            }
          ],
          "urls": []
        }
      ]
    },
    {
      "file": "Menus/Menu week of 1-31-22.md",
      "title": "Menu week of 1/31/22",
      "week_of_date": "2022-01-31",
      "season": "winter",
      "items": [
        {
          "text": "Tofu peanut bowls",
          "section": null,
          "meal_type": "dinner",
          "season": "winter",
          "source_hint": null,
          "links": [],
          "urls": []
        },
        {
          "text": "Sweet potato tacos",
          "section": null,
          "meal_type": "dinner",
          "season": "winter",
          "source_hint": null,
          "links": [],
          "urls": []
        },
        {
          "text": "Steaks",
          "section": null,
          "meal_type": "dinner",
          "season": "winter",
          "source_hint": null,
          "links": [],
          "urls": []
        },
        {
          "text": "Chicken stir fry",
          "section": null,
          "meal_type": "dinner",
          "season": "winter",
          "source_hint": null,
          "links": [],
          "urls": []
        },
        {
          "text": "Beyond Beef mushroom rice bowls",
          "section": null,
          "meal_type": "dinner",
          "season": "winter",
          "source_hint": null,
          "links": [],
          "urls": []
        },
        {
          "text": "Panko chicken",
          "section": null,
          "meal_type": "dinner",
          "season": "winter",
          "source_hint": null,
          "links": [],
          "urls": []
        },
        {
          "text": "Black pepper stir fried udon (POY week 3)",
          "section": null,
          "meal_type": "dinner",
          "season": "winter",
          "source_hint": null,
          "links": [],
          "urls": []
        },
        {
          "text": "Pita sandwiches",
          "section": null,
          "meal_type": "dinner",
          "season": "winter",
          "source_hint": null,
          "links": [],
          "urls": []
        },
        {
          "text": "Slow cooker butternut squash tortellini",
          "section": null,
          "meal_type": "dinner",
          "season": "winter",
          "source_hint": null,
          "links": [],
          "urls": []
        },
        {
          "text": "Garlic caper chicken",
          "section": null,
          "meal_type": "dinner",
          "season": "winter",
          "source_hint": null,
          "links": [],
          "urls": []
        },
        {
          "text": "Steaks",
          "section": null,
          "meal_type": "dinner",
          "season": "winter",
          "source_hint": null,
          "links": [],
          "urls": []
        },
        {
          "text": "Blue apron gnocchi",
          "section": null,
          "meal_type": "dinner",
          "season": "winter",
          "source_hint": null,
          "links": [],
          "urls": []
        },
        {
          "text": "Instant pot wild rice soup",
          "section": null,
          "meal_type": "dinner",
          "season": "winter",
          "source_hint": null,
          "links": [],
          "urls": []
        },
        {
          "text": "Orange salmon and fried rice",
          "section": null,
          "meal_type": "dinner",
          "season": "winter",
          "source_hint": null,
          "links": [],
          "urls": []
        },
        {
          "text": "Spicy shrimp tacos with garlic cilantro lime slaw",
          "section": null,
          "meal_type": "dinner",
          "season": "winter",
          "source_hint": null,
          "links": [],
          "urls": []
        },
        {
          "text": "Blue apron chicken",
          "section": null,
          "meal_type": "dinner",
          "season": "winter",
          "source_hint": null,
          "links": [],
          "urls": []
        },
        {
          "text": "Snack: cookie dough energy bites",
          "section": null,
          "meal_type": "snack",
          "season": "winter",
          "source_hint": null,
          "links": [],
          "urls": []
        },
        {
          "text": "Anytime: simple greens salad",
          "section": null,
          "meal_type": "dinner",
          "season": "winter",
          "source_hint": null,
          "links": [],
          "urls": []
        },
        {
          "text": "Moe casserole",
          "section": null,
          "meal_type": "dinner",
          "season": "winter",
          "source_hint": null,
          "links": [],
          "urls": []
        }
      ]
    },
    {
      "file": "Menus/Menu week of 1-4-25.md",
      "title": "Menu week of 1/4/25",
      "week_of_date": "2025-01-04",
      "season": "winter",
      "items": [
        {
          "text": "Autumn glow salad add chicken",
          "section": null,
          "meal_type": "dinner",
          "season": "winter",
          "source_hint": "https://pinchofyum.com/autumn-glow-salad-with-lemon-dressing",
          "links": [
            {
              "text": "https://pinchofyum.com/autumn-glow-salad-with-lemon-dressing",
              "url": "https://pinchofyum.com/autumn-glow-salad-with-lemon-dressing"
            }
          ],
          "urls": []
        },
        {
          "text": "Cauliflower Orange Gnocchi",
          "section": null,
          "meal_type": "dinner",
          "season": "winter",
          "source_hint": "https://pinchofyum.com/cauliflower-orange-gnocchi",
          "links": [
            {
              "text": "https://pinchofyum.com/cauliflower-orange-gnocchi",
              "url": "https://pinchofyum.com/cauliflower-orange-gnocchi"
            }
          ],
          "urls": []
        },
        {
          "text": "Olive Garden Zuppa Toscana and everyday italian salad",
          "section": null,
          "meal_type": "dinner",
          "season": "winter",
          "source_hint": null,
          "links": [
            {
              "text": "https://damndelicious.net/2018/03/03/instant-pot-olive-garden-zuppa-toscana-copycat/",
              "url": "https://damndelicious.net/2018/03/03/instant-pot-olive-garden-zuppa-toscana-copycat/"
            }
          ],
          "urls": []
        },
        {
          "text": "Chicken tacos with green sauce and a makeshift black bean salad",
          "section": null,
          "meal_type": "dinner",
          "season": "winter",
          "source_hint": null,
          "links": [
            {
              "text": "https://pinchofyum.com/chicken-tacos",
              "url": "https://pinchofyum.com/chicken-tacos"
            }
          ],
          "urls": []
        },
        {
          "text": "Lighter beef and broccoli",
          "section": null,
          "meal_type": "dinner",
          "season": "winter",
          "source_hint": null,
          "links": [
            {
              "text": "https://iowagirleats.com/broccoli-beef-recipe/#wprm-recipe-container-146358",
              "url": "https://iowagirleats.com/broccoli-beef-recipe/#wprm-recipe-container-146358"
            }
          ],
          "urls": []
        },
        {
          "text": "Chili",
          "section": null,
          "meal_type": "dinner",
          "season": "winter",
          "source_hint": null,
          "links": [],
          "urls": []
        }
      ]
    },
    {
      "file": "Menus/Menu week of 1-9-24.md",
      "title": "Menu week of 1/9/24",
      "week_of_date": "2024-01-09",
      "season": "winter",
      "items": [
        {
          "text": "Sesame apricot tofu with broccoli instead of beans",
          "section": null,
          "meal_type": "dinner",
          "season": "winter",
          "source_hint": null,
          "links": [
            {
              "text": "Sesame Apricot Tofu",
              "url": "https://pinchofyum.com/sesame-apricot-tofu",
              "auto_added": true
            }
          ],
          "urls": []
        },
        {
          "text": "5 ingredient tomato soup (Pinch of Yum) and grilled cheese",
          "section": null,
          "meal_type": "dinner",
          "season": "winter",
          "source_hint": null,
          "links": [],
          "urls": []
        },
        {
          "text": "Lighter broccoli beef with brown rice (Iowa Girl Eats)",
          "section": null,
          "meal_type": "dinner",
          "season": "winter",
          "source_hint": "Iowa Girl Eats",
          "links": [],
          "urls": []
        },
        {
          "text": "Red chile chicken tacos with creamy corn (Pinch of Yum)",
          "section": null,
          "meal_type": "dinner",
          "season": "winter",
          "source_hint": "Pinch of Yum",
          "links": [],
          "urls": []
        },
        {
          "text": "Frozen pizza and salad",
          "section": null,
          "meal_type": "dinner",
          "season": "winter",
          "source_hint": null,
          "links": [],
          "urls": []
        },
        {
          "text": "Thai coconut soup with tofu and rice (Pinch of Yum)",
          "section": null,
          "meal_type": "dinner",
          "season": "winter",
          "source_hint": "Pinch of Yum",
          "links": [],
          "urls": []
        },
        {
          "text": "Gnocchi with Brussels, Chicken sausage, and pesto (gimme some oven)",
          "section": null,
          "meal_type": "dinner",
          "season": "winter",
          "source_hint": "gimme some oven",
          "links": [],
          "urls": []
        },
        {
          "text": "Butternut squash mac and cheese with caramelized onions, bacon, and apple (Pinch of Yum)",
          "section": null,
          "meal_type": "dinner",
          "season": "winter",
          "source_hint": "Pinch of Yum",
          "links": [],
          "urls": []
        }
      ]
    },
    {
      "file": "Menus/Menu week of 10-1-23.md",
      "title": "Menu week of 10/1/23",
      "week_of_date": "2023-10-01",
      "season": "fall",
      "items": [
        {
          "text": "Roasted honey nut squash and chickpeas with hot honey (NYT cooking) - make with cous cous",
          "section": null,
          "meal_type": "dinner",
          "season": "fall",
          "source_hint": null,
          "links": [],
          "urls": []
        },
        {
          "text": "Spanish chicken and potatoes (Pinch of Yum)",
          "section": null,
          "meal_type": "dinner",
          "season": "fall",
          "source_hint": "Pinch of Yum",
          "links": [],
          "urls": []
        },
        {
          "text": "Spicy peanut tofu bowls (Pinch of Yum)",
          "section": null,
          "meal_type": "dinner",
          "season": "fall",
          "source_hint": "Pinch of Yum",
          "links": [
            {
              "text": "Spicy Peanut Tofu Bowls",
              "url": "https://pinchofyum.com/spicy-peanut-tofu-bowls",
              "auto_added": true
            }
          ],
          "urls": []
        },
        {
          "text": "Sheet pan pesto gnocchi (Two Peas and their Pod)",
          "section": null,
          "meal_type": "dinner",
          "season": "fall",
          "source_hint": "Two Peas and their Pod",
          "links": [
            {
              "text": "Sheet Pan Pesto Gnocchi",
              "url": "https://www.twopeasandtheirpod.com/sheet-pan-pesto-gnocchi/",
              "auto_added": true
            }
          ],
          "urls": []
        },
        {
          "text": "Slow cooker butternut squash tortellini (Mels kitchen cafe) and bagged salad",
          "section": null,
          "meal_type": "dinner",
          "season": "fall",
          "source_hint": null,
          "links": [],
          "urls": []
        },
        {
          "text": "Zoo Boo pick up something",
          "section": null,
          "meal_type": "dinner",
          "season": "fall",
          "source_hint": null,
          "links": [],
          "urls": []
        },
        {
          "text": "Grilled steak, roasted broccoli, potatoes",
          "section": null,
          "meal_type": "dinner",
          "season": "fall",
          "source_hint": null,
          "links": [],
          "urls": []
        }
      ]
    },
    {
      "file": "Menus/Menu week of 10-10-21.md",
      "title": "Menu week of 10/10/21",
      "week_of_date": "2021-10-10",
      "season": "fall",
      "items": [
        {
          "text": "Instant pot butter chicken",
          "section": null,
          "meal_type": "dinner",
          "season": "fall",
          "source_hint": null,
          "links": [],
          "urls": []
        },
        {
          "text": "Burgers and bagged salad, frozen sweet potato fries",
          "section": null,
          "meal_type": "dinner",
          "season": "fall",
          "source_hint": null,
          "links": [],
          "urls": []
        },
        {
          "text": "Roasted sweet potato tacos",
          "section": null,
          "meal_type": "dinner",
          "season": "fall",
          "source_hint": null,
          "links": [
            {
              "text": "Roasted Sweet Potato Tacos",
              "url": "https://www.gimmesomeoven.com/roasted-sweet-potato-tacos/",
              "auto_added": true
            }
          ],
          "urls": []
        },
        {
          "text": "Chicken Caesar salad",
          "section": null,
          "meal_type": "dinner",
          "season": "fall",
          "source_hint": null,
          "links": [
            {
              "text": "Best Chicken Caesar Salad with Homemade Croutons",
              "url": "https://damndelicious.net/2023/04/21/best-chicken-caesar-salad-with-homemade-croutons/",
              "auto_added": true
            }
          ],
          "urls": []
        },
        {
          "text": "Italian beef and salad (with $$ dear mom greens)",
          "section": null,
          "meal_type": "dinner",
          "season": "fall",
          "source_hint": "with $$ dear mom greens",
          "links": [],
          "urls": []
        },
        {
          "text": "Spicy peanut tofu bowls",
          "section": null,
          "meal_type": "dinner",
          "season": "fall",
          "source_hint": null,
          "links": [
            {
              "text": "Spicy Peanut Tofu Bowls",
              "url": "https://pinchofyum.com/spicy-peanut-tofu-bowls",
              "auto_added": true
            }
          ],
          "urls": []
        },
        {
          "text": "Black pepper stir fry udon (pinch of yum sos series - add stir fry beef)",
          "section": null,
          "meal_type": "dinner",
          "season": "fall",
          "source_hint": "pinch of yum sos series - add stir fry beef",
          "links": [],
          "urls": []
        },
        {
          "text": "BLTAs",
          "section": null,
          "meal_type": "dinner",
          "season": "fall",
          "source_hint": null,
          "links": [],
          "urls": []
        },
        {
          "text": "Sheet pan sausage and peppers (serve as sandwiches with provolone and pasta sauce) - Get baguette from Amelia\u2019s",
          "section": null,
          "meal_type": "dinner",
          "season": "fall",
          "source_hint": null,
          "links": [],
          "urls": []
        },
        {
          "text": "Instant pot cilantro lime chicken and lentil rice bowls",
          "section": null,
          "meal_type": "dinner",
          "season": "fall",
          "source_hint": null,
          "links": [],
          "urls": []
        },
        {
          "text": "Moe\u2019s casseroles",
          "section": null,
          "meal_type": "dinner",
          "season": "fall",
          "source_hint": null,
          "links": [],
          "urls": []
        },
        {
          "text": "Fy",
          "section": null,
          "meal_type": "dinner",
          "season": "fall",
          "source_hint": null,
          "links": [],
          "urls": []
        }
      ]
    },
    {
      "file": "Menus/Menu week of 10-11-23.md",
      "title": "Menu week of 10/11/23",
      "week_of_date": "2023-10-11",
      "season": "fall",
      "items": [
        {
          "text": "Instant pot chicken noodle soup (Spend with Pennies)",
          "section": null,
          "meal_type": "dinner",
          "season": "fall",
          "source_hint": "Spend with Pennies",
          "links": [],
          "urls": []
        },
        {
          "text": "Frozen pizza and salad",
          "section": null,
          "meal_type": "dinner",
          "season": "fall",
          "source_hint": null,
          "links": [],
          "urls": []
        },
        {
          "text": "Spaghetti with Crispy Zucchini",
          "section": null,
          "meal_type": "dinner",
          "season": "fall",
          "source_hint": null,
          "links": [
            {
              "text": "Spaghetti with Crispy Zucchini",
              "url": "https://pinchofyum.com/spaghetti-with-crispy-zucchini",
              "auto_added": true
            }
          ],
          "urls": []
        },
        {
          "text": "Roasted vegetable bowls",
          "section": null,
          "meal_type": "dinner",
          "season": "fall",
          "source_hint": null,
          "links": [
            {
              "text": "Roasted Vegetable Bowls with Green Tahini",
              "url": "https://pinchofyum.com/30-minute-meal-prep-roasted-vegetable-bowls-with-green-tahini",
              "auto_added": true
            }
          ],
          "urls": []
        },
        {
          "text": "Chicken Tinga Tacos",
          "section": null,
          "meal_type": "dinner",
          "season": "fall",
          "source_hint": null,
          "links": [
            {
              "text": "The Best Chicken Tinga Tacos",
              "url": "https://pinchofyum.com/the-best-chicken-tinga-tacos",
              "auto_added": true
            }
          ],
          "urls": []
        },
        {
          "text": "Cilantro Orange Chicken",
          "section": null,
          "meal_type": "dinner",
          "season": "fall",
          "source_hint": null,
          "links": [
            {
              "text": "Cilantro Orange Chicken with Rice and Beans",
              "url": "https://pinchofyum.com/cilantro-orange-chicken-with-rice-and-beans",
              "auto_added": true
            }
          ],
          "urls": []
        },
        {
          "text": "Salmon Burgers with Slaw",
          "section": null,
          "meal_type": "dinner",
          "season": "fall",
          "source_hint": null,
          "links": [
            {
              "text": "Yummy Salmon Burgers with Slaw",
              "url": "https://pinchofyum.com/yummy-salmon-burgers-slaw",
              "auto_added": true
            }
          ],
          "urls": []
        }
      ]
    },
    {
      "file": "Menus/Menu week of 10-13-22.md",
      "title": "Menu week of 10/13/22",
      "week_of_date": "2022-10-13",
      "season": "fall",
      "items": [
        {
          "text": "Roasted veggie pitas with avocado dip",
          "section": null,
          "meal_type": "dinner",
          "season": "fall",
          "source_hint": null,
          "links": [],
          "urls": []
        },
        {
          "text": "Crunchwrap Supreme",
          "section": null,
          "meal_type": "dinner",
          "season": "fall",
          "source_hint": null,
          "links": [],
          "urls": []
        },
        {
          "text": "Crockpot chicken gnocchi soup",
          "section": null,
          "meal_type": "dinner",
          "season": "fall",
          "source_hint": null,
          "links": [],
          "urls": []
        },
        {
          "text": "Saucy gochujang noodles with chicken",
          "section": null,
          "meal_type": "dinner",
          "season": "fall",
          "source_hint": null,
          "links": [],
          "urls": []
        },
        {
          "text": "Sesame apricot tofu",
          "section": null,
          "meal_type": "dinner",
          "season": "fall",
          "source_hint": null,
          "links": [
            {
              "text": "Sesame Apricot Tofu",
              "url": "https://pinchofyum.com/sesame-apricot-tofu",
              "auto_added": true
            }
          ],
          "urls": []
        },
        {
          "text": "Steak",
          "section": null,
          "meal_type": "dinner",
          "season": "fall",
          "source_hint": null,
          "links": [],
          "urls": []
        }
      ]
    },
    {
      "file": "Menus/Menu week of 10-15-17.md",
      "title": "Menu week of 10/15/17",
      "week_of_date": "2017-10-15",
      "season": "fall",
      "items": [
        {
          "text": "Roasted chicken thighs with delicata squash",
          "section": null,
          "meal_type": "dinner",
          "season": "fall",
          "source_hint": null,
          "links": [],
          "urls": []
        },
        {
          "text": "Sunday morning: eggs and chard, bacon, potatoes?",
          "section": null,
          "meal_type": "dinner",
          "season": "fall",
          "source_hint": null,
          "links": [],
          "urls": []
        },
        {
          "text": "Cauliflower walnut taco bowls (radishes!!!) with saut\u00e9ed peppers and onions",
          "section": null,
          "meal_type": "dinner",
          "season": "fall",
          "source_hint": null,
          "links": [],
          "urls": []
        },
        {
          "text": "Orzo with feta, tomatoes, and dill",
          "section": null,
          "meal_type": "dinner",
          "season": "fall",
          "source_hint": null,
          "links": [],
          "urls": []
        }
      ]
    },
    {
      "file": "Menus/Menu week of 10-18-20.md",
      "title": "Menu week of 10/18/20",
      "week_of_date": "2020-10-18",
      "season": "fall",
      "items": [
        {
          "text": "Cider braised pot roast with caramelized onions and cauliflower rice (takes 3-4 hours in oven)",
          "section": null,
          "meal_type": "dinner",
          "season": "fall",
          "source_hint": null,
          "links": [],
          "urls": []
        },
        {
          "text": "Feel good fall salad",
          "section": null,
          "meal_type": "dinner",
          "season": "fall",
          "source_hint": null,
          "links": [],
          "urls": []
        },
        {
          "text": "Beer braised brats with apple mustard slaw",
          "section": null,
          "meal_type": "dinner",
          "season": "fall",
          "source_hint": null,
          "links": [],
          "urls": []
        },
        {
          "text": "Short rib tacos with pepper mustard slaw (slow cooker)",
          "section": null,
          "meal_type": "dinner",
          "season": "fall",
          "source_hint": "slow cooker",
          "links": [],
          "urls": []
        },
        {
          "text": "Sheet pan pesto gnocchi (lots of baby tomatoes)",
          "section": null,
          "meal_type": "dinner",
          "season": "fall",
          "source_hint": "lots of baby tomatoes",
          "links": [
            {
              "text": "Sheet Pan Pesto Gnocchi",
              "url": "https://www.twopeasandtheirpod.com/sheet-pan-pesto-gnocchi/",
              "auto_added": true
            }
          ],
          "urls": []
        },
        {
          "text": "Sunday: Brown butter gnocchi with roasted butternut squash and kale",
          "section": null,
          "meal_type": "dinner",
          "season": "fall",
          "source_hint": null,
          "links": [],
          "urls": []
        },
        {
          "text": "Quesadillas and pico",
          "section": null,
          "meal_type": "dinner",
          "season": "fall",
          "source_hint": null,
          "links": [],
          "urls": []
        },
        {
          "text": "Precooked brats",
          "section": null,
          "meal_type": "dinner",
          "season": "fall",
          "source_hint": null,
          "links": [],
          "urls": []
        },
        {
          "text": "Kale fried rice",
          "section": null,
          "meal_type": "dinner",
          "season": "fall",
          "source_hint": null,
          "links": [],
          "urls": []
        },
        {
          "text": "Roast and/or chop one of the butternut squash",
          "section": null,
          "meal_type": "dinner",
          "season": "fall",
          "source_hint": null,
          "links": [],
          "urls": []
        },
        {
          "text": "Dice and freeze tomatoes",
          "section": null,
          "meal_type": "dinner",
          "season": "fall",
          "source_hint": null,
          "links": [],
          "urls": []
        },
        {
          "text": "Make granola",
          "section": null,
          "meal_type": "dinner",
          "season": "fall",
          "source_hint": null,
          "links": [],
          "urls": []
        },
        {
          "text": "Make pico with baby tomatoes",
          "section": null,
          "meal_type": "dinner",
          "season": "fall",
          "source_hint": null,
          "links": [],
          "urls": []
        },
        {
          "text": "Quick-pickle banana peppers",
          "section": null,
          "meal_type": "dinner",
          "season": "fall",
          "source_hint": null,
          "links": [],
          "urls": []
        },
        {
          "text": "Harvest the green onions from garden",
          "section": null,
          "meal_type": "dinner",
          "season": "fall",
          "source_hint": null,
          "links": [],
          "urls": []
        }
      ]
    },
    {
      "file": "Menus/Menu week of 10-21-19.md",
      "title": "Menu week of 10/21/19",
      "week_of_date": "2019-10-21",
      "season": "fall",
      "items": [
        {
          "text": "Maple roasted chicken thighs and winter squashSalmon cakes and slaw",
          "section": null,
          "meal_type": "dinner",
          "season": "fall",
          "source_hint": null,
          "links": [],
          "urls": []
        },
        {
          "text": "Halloween: chili and cornbread",
          "section": null,
          "meal_type": "dinner",
          "season": "fall",
          "source_hint": null,
          "links": [],
          "urls": []
        },
        {
          "text": "Spicy peanut soup with sweet potato and kale, salad",
          "section": null,
          "meal_type": "dinner",
          "season": "fall",
          "source_hint": null,
          "links": [
            {
              "text": "Spicy Peanut Soup with Sweet Potato + Kale",
              "url": "https://pinchofyum.com/sweet-potato-peanut-soup",
              "auto_added": true
            }
          ],
          "urls": []
        },
        {
          "text": "Autumn glow salad",
          "section": null,
          "meal_type": "dinner",
          "season": "fall",
          "source_hint": null,
          "links": [
            {
              "text": "Autumn Glow Salad with Lemon Dressing",
              "url": "https://pinchofyum.com/autumn-glow-salad-with-lemon-dressing",
              "auto_added": true
            }
          ],
          "urls": []
        },
        {
          "text": "Ratatouille and crusty bread",
          "section": null,
          "meal_type": "dinner",
          "season": "fall",
          "source_hint": null,
          "links": [],
          "urls": []
        },
        {
          "text": "Rosemary Chicken noodle soup, salad",
          "section": null,
          "meal_type": "dinner",
          "season": "fall",
          "source_hint": null,
          "links": [],
          "urls": []
        },
        {
          "text": "Butternut squash Mac and cheese",
          "section": null,
          "meal_type": "dinner",
          "season": "fall",
          "source_hint": null,
          "links": [],
          "urls": []
        },
        {
          "text": "Bulgar salad",
          "section": null,
          "meal_type": "dinner",
          "season": "fall",
          "source_hint": null,
          "links": [],
          "urls": []
        }
      ]
    },
    {
      "file": "Menus/Menu week of 10-22-25.md",
      "title": "Menu week of 10/22/25",
      "week_of_date": "2025-10-22",
      "season": "fall",
      "items": [
        {
          "text": "Butternut squash apple soup and croutons:",
          "section": null,
          "meal_type": "dinner",
          "season": "fall",
          "source_hint": null,
          "links": [
            {
              "text": "https://www.wellplated.com/butternut-squash-soup/#wprm-recipe-container-34260",
              "url": "https://www.wellplated.com/butternut-squash-soup/#wprm-recipe-container-34260"
            }
          ],
          "urls": []
        },
        {
          "text": "Halloween: Chili and cornbread",
          "section": null,
          "meal_type": "dinner",
          "season": "fall",
          "source_hint": null,
          "links": [],
          "urls": []
        },
        {
          "text": "Roasted sweet potato tacos",
          "section": null,
          "meal_type": "dinner",
          "season": "fall",
          "source_hint": null,
          "links": [
            {
              "text": "https://www.gimmesomeoven.com/roasted-sweet-potato-tacos/#tasty-recipes-72325-jump-target",
              "url": "https://www.gimmesomeoven.com/roasted-sweet-potato-tacos/#tasty-recipes-72325-jump-target"
            }
          ],
          "urls": []
        },
        {
          "text": "Halloween: Chili and cornbread",
          "section": null,
          "meal_type": "dinner",
          "season": "fall",
          "source_hint": null,
          "links": [],
          "urls": []
        },
        {
          "text": "Frozen pizza and salad",
          "section": null,
          "meal_type": "dinner",
          "season": "fall",
          "source_hint": null,
          "links": [],
          "urls": []
        },
        {
          "text": "Double recipes to bring to Jill Tuesday 10/28:",
          "section": null,
          "meal_type": "dinner",
          "season": "fall",
          "source_hint": null,
          "links": [],
          "urls": []
        },
        {
          "text": "Pulled pork sandwiches:",
          "section": null,
          "meal_type": "dinner",
          "season": "fall",
          "source_hint": null,
          "links": [
            {
              "text": "https://damndelicious.net/2020/08/08/instant-pot-bbq-pulled-pork/",
              "url": "https://damndelicious.net/2020/08/08/instant-pot-bbq-pulled-pork/"
            }
          ],
          "urls": []
        },
        {
          "text": "Fruit salad Coleslaw",
          "section": null,
          "meal_type": "dinner",
          "season": "fall",
          "source_hint": "https://www.loveandlemons.com/fruit-salad-recipe/",
          "links": [
            {
              "text": "https://www.loveandlemons.com/fruit-salad-recipe/",
              "url": "https://www.loveandlemons.com/fruit-salad-recipe/"
            }
          ],
          "urls": []
        },
        {
          "text": "Potato salad:",
          "section": null,
          "meal_type": "dinner",
          "season": "fall",
          "source_hint": "https://www.browneyedbaker.com/best-ever-potato-salad-recipe/",
          "links": [
            {
              "text": "https://www.browneyedbaker.com/best-ever-potato-salad-recipe/",
              "url": "https://www.browneyedbaker.com/best-ever-potato-salad-recipe/"
            }
          ],
          "urls": []
        },
        {
          "text": "Salted caramel apple pie bars:",
          "section": null,
          "meal_type": "dinner",
          "season": "fall",
          "source_hint": "https://sallysbakingaddiction.com/salted-caramel-apple-pie-bars/",
          "links": [
            {
              "text": "https://sallysbakingaddiction.com/salted-caramel-apple-pie-bars/",
              "url": "https://sallysbakingaddiction.com/salted-caramel-apple-pie-bars/"
            }
          ],
          "urls": []
        },
        {
          "text": "Slow cooker beef stroganoff",
          "section": null,
          "meal_type": "dinner",
          "season": "fall",
          "source_hint": null,
          "links": [
            {
              "text": "https://www.wellplated.com/slow-cooker-beef-stroganoff/#wprm-recipe-container-33048",
              "url": "https://www.wellplated.com/slow-cooker-beef-stroganoff/#wprm-recipe-container-33048"
            }
          ],
          "urls": []
        },
        {
          "text": "Sheet pan pesto gnocchi",
          "section": null,
          "meal_type": "dinner",
          "season": "fall",
          "source_hint": null,
          "links": [
            {
              "text": "https://www.twopeasandtheirpod.com/sheet-pan-pesto-gnocchi/#wprm-recipe-container-44204",
              "url": "https://www.twopeasandtheirpod.com/sheet-pan-pesto-gnocchi/#wprm-recipe-container-44204"
            }
          ],
          "urls": []
        },
        {
          "text": "Roasted delicate squash salad and baguette:",
          "section": null,
          "meal_type": "dinner",
          "season": "fall",
          "source_hint": "https://www.twopeasandtheirpod.com/roasted-delicata-squash-salad/",
          "links": [
            {
              "text": "https://www.twopeasandtheirpod.com/roasted-delicata-squash-salad/",
              "url": "https://www.twopeasandtheirpod.com/roasted-delicata-squash-salad/"
            }
          ],
          "urls": []
        }
      ]
    },
    {
      "file": "Menus/Menu week of 10-23-24.md",
      "title": "Menu week of 10/23/24",
      "week_of_date": "2024-10-23",
      "season": "fall",
      "items": [
        {
          "text": "Poblano white chicken chili",
          "section": null,
          "meal_type": "dinner",
          "season": "fall",
          "source_hint": "https://www.gimmesomeoven.com/poblano-white-chicken-chili/",
          "links": [
            {
              "text": "https://www.gimmesomeoven.com/poblano-white-chicken-chili/",
              "url": "https://www.gimmesomeoven.com/poblano-white-chicken-chili/"
            }
          ],
          "urls": []
        },
        {
          "text": "Roasted sweet potato tacos Chili (Halloween)",
          "section": null,
          "meal_type": "dinner",
          "season": "fall",
          "source_hint": "https://www.gimmesomeoven.com/roasted-sweet-potato-tacos/",
          "links": [
            {
              "text": "https://www.gimmesomeoven.com/roasted-sweet-potato-tacos/",
              "url": "https://www.gimmesomeoven.com/roasted-sweet-potato-tacos/"
            }
          ],
          "urls": []
        },
        {
          "text": "Chicken with Coconut Kale (add red peppers)",
          "section": null,
          "meal_type": "dinner",
          "season": "fall",
          "source_hint": "https://pinchofyum.com/chicken-with-coconut-kale",
          "links": [
            {
              "text": "https://pinchofyum.com/chicken-with-coconut-kale",
              "url": "https://pinchofyum.com/chicken-with-coconut-kale"
            }
          ],
          "urls": []
        },
        {
          "text": "Pizza and bagged salad",
          "section": null,
          "meal_type": "dinner",
          "season": "fall",
          "source_hint": null,
          "links": [],
          "urls": []
        },
        {
          "text": "Tofu and Brown Lettuce Wraps with Peanut Sauce",
          "section": null,
          "meal_type": "dinner",
          "season": "fall",
          "source_hint": "https://pinchofyum.com/tofu-and-brown-rice-lettuce-wraps",
          "links": [
            {
              "text": "https://pinchofyum.com/tofu-and-brown-rice-lettuce-wraps",
              "url": "https://pinchofyum.com/tofu-and-brown-rice-lettuce-wraps"
            }
          ],
          "urls": []
        },
        {
          "text": "One pot healthier hamburger helper",
          "section": null,
          "meal_type": "dinner",
          "season": "fall",
          "source_hint": "https://www.halfbakedharvest.com/one-pot-hamburger-helper/",
          "links": [
            {
              "text": "https://www.halfbakedharvest.com/one-pot-hamburger-helper/",
              "url": "https://www.halfbakedharvest.com/one-pot-hamburger-helper/"
            }
          ],
          "urls": []
        },
        {
          "text": "Sheet pan pesto gnocchi",
          "section": null,
          "meal_type": "dinner",
          "season": "fall",
          "source_hint": "https://www.twopeasandtheirpod.com/sheet-pan-pesto-gnocchi/",
          "links": [
            {
              "text": "https://www.twopeasandtheirpod.com/sheet-pan-pesto-gnocchi/",
              "url": "https://www.twopeasandtheirpod.com/sheet-pan-pesto-gnocchi/"
            }
          ],
          "urls": []
        },
        {
          "text": "Yellow curry",
          "section": null,
          "meal_type": "dinner",
          "season": "fall",
          "source_hint": null,
          "links": [],
          "urls": []
        },
        {
          "text": "Poblanos (lots)",
          "section": null,
          "meal_type": "dinner",
          "season": "fall",
          "source_hint": "lots",
          "links": [],
          "urls": []
        }
      ]
    },
    {
      "file": "Menus/Menu week of 10-25-18.md",
      "title": "Menu week of 10/25/18",
      "week_of_date": "2018-10-25",
      "season": "fall",
      "items": [
        {
          "text": "Friday: Mimi Blue meatballs",
          "section": null,
          "meal_type": "dinner",
          "season": "fall",
          "source_hint": null,
          "links": [],
          "urls": []
        },
        {
          "text": "Saturday: farmer\u2019s market? pancakes and eggs, chicken enchiladas with green salsa",
          "section": null,
          "meal_type": "dinner",
          "season": "fall",
          "source_hint": null,
          "links": [],
          "urls": []
        },
        {
          "text": "Sunday: baked oatmeal? butternut squash Mac and cheese",
          "section": null,
          "meal_type": "dinner",
          "season": "fall",
          "source_hint": null,
          "links": [],
          "urls": []
        },
        {
          "text": "Monday: salad and dinner rolls",
          "section": null,
          "meal_type": "dinner",
          "season": "fall",
          "source_hint": null,
          "links": [],
          "urls": []
        },
        {
          "text": "Tuesday: jimmy johns or similar (book club at center point)",
          "section": null,
          "meal_type": "dinner",
          "season": "fall",
          "source_hint": "book club at center point",
          "links": [],
          "urls": []
        },
        {
          "text": "Wed spooky season: chili, cornbread muffins",
          "section": null,
          "meal_type": "dinner",
          "season": "fall",
          "source_hint": null,
          "links": [],
          "urls": []
        },
        {
          "text": "Thursday: pan-seared chicken with roasted honey nut squash and apple",
          "section": null,
          "meal_type": "dinner",
          "season": "fall",
          "source_hint": null,
          "links": [],
          "urls": []
        },
        {
          "text": "Friday weenie roast: garlic Spaghetti squash with herbs",
          "section": null,
          "meal_type": "dinner",
          "season": "fall",
          "source_hint": null,
          "links": [],
          "urls": []
        },
        {
          "text": "Saturday: pizza?",
          "section": null,
          "meal_type": "dinner",
          "season": "fall",
          "source_hint": null,
          "links": [],
          "urls": []
        }
      ]
    },
    {
      "file": "Menus/Menu week of 10-26-23.md",
      "title": "Menu week of 10/26/23",
      "week_of_date": "2023-10-26",
      "season": "fall",
      "items": [
        {
          "text": "Autumn glow salad",
          "section": null,
          "meal_type": "dinner",
          "season": "fall",
          "source_hint": null,
          "links": [
            {
              "text": "Autumn Glow Salad with Lemon Dressing",
              "url": "https://pinchofyum.com/autumn-glow-salad-with-lemon-dressing",
              "auto_added": true
            }
          ],
          "urls": []
        },
        {
          "text": "Chili (Halloween) and salad",
          "section": null,
          "meal_type": "dinner",
          "season": "fall",
          "source_hint": null,
          "links": [],
          "urls": []
        },
        {
          "text": "Moussaka",
          "section": null,
          "meal_type": "dinner",
          "season": "fall",
          "source_hint": null,
          "links": [],
          "urls": []
        },
        {
          "text": "Frozen pizza",
          "section": null,
          "meal_type": "dinner",
          "season": "fall",
          "source_hint": null,
          "links": [],
          "urls": []
        },
        {
          "text": "Crispy Black bean tacos",
          "section": null,
          "meal_type": "dinner",
          "season": "fall",
          "source_hint": null,
          "links": [],
          "urls": []
        },
        {
          "text": "Chicken lettuce wraps with Lime drench",
          "section": null,
          "meal_type": "dinner",
          "season": "fall",
          "source_hint": null,
          "links": [],
          "urls": []
        },
        {
          "text": "Lemongrass meatball bowls",
          "section": null,
          "meal_type": "dinner",
          "season": "fall",
          "source_hint": null,
          "links": [],
          "urls": []
        },
        {
          "text": "Parsnips",
          "section": null,
          "meal_type": "dinner",
          "season": "fall",
          "source_hint": null,
          "links": [],
          "urls": []
        },
        {
          "text": "Butternut squash",
          "section": null,
          "meal_type": "dinner",
          "season": "fall",
          "source_hint": null,
          "links": [],
          "urls": []
        },
        {
          "text": "Red potatoes",
          "section": null,
          "meal_type": "dinner",
          "season": "fall",
          "source_hint": null,
          "links": [],
          "urls": []
        },
        {
          "text": "Purple finger line potatoes",
          "section": null,
          "meal_type": "dinner",
          "season": "fall",
          "source_hint": null,
          "links": [],
          "urls": []
        },
        {
          "text": "Delicate squash",
          "section": null,
          "meal_type": "dinner",
          "season": "fall",
          "source_hint": null,
          "links": [],
          "urls": []
        }
      ]
    },
    {
      "file": "Menus/Menu week of 10-27-22.md",
      "title": "Menu week of 10/27/22",
      "week_of_date": "2022-10-27",
      "season": "fall",
      "items": [
        {
          "text": "Broccoli cheese soup",
          "section": null,
          "meal_type": "dinner",
          "season": "fall",
          "source_hint": null,
          "links": [],
          "urls": []
        },
        {
          "text": "Date night rigatoni with sausage and kale",
          "section": null,
          "meal_type": "dinner",
          "season": "fall",
          "source_hint": null,
          "links": [],
          "urls": []
        },
        {
          "text": "Chicken pot pie with biscuits",
          "section": null,
          "meal_type": "dinner",
          "season": "fall",
          "source_hint": null,
          "links": [],
          "urls": []
        },
        {
          "text": "Halloween: \u201cSunday\u201d chili",
          "section": null,
          "meal_type": "dinner",
          "season": "fall",
          "source_hint": null,
          "links": [],
          "urls": []
        },
        {
          "text": "Baked shrimp with feta and grilled sourdough",
          "section": null,
          "meal_type": "dinner",
          "season": "fall",
          "source_hint": null,
          "links": [],
          "urls": []
        },
        {
          "text": "Crunchy roll bowls",
          "section": null,
          "meal_type": "dinner",
          "season": "fall",
          "source_hint": null,
          "links": [],
          "urls": []
        }
      ]
    },
    {
      "file": "Menus/Menu week of 10-31-17.md",
      "title": "Menu week of 10/31/17",
      "week_of_date": "2017-10-31",
      "season": "fall",
      "items": [
        {
          "text": "Tuesday: Chili",
          "section": null,
          "meal_type": "dinner",
          "season": "fall",
          "source_hint": null,
          "links": [],
          "urls": []
        },
        {
          "text": "Wednesday: Autumn glow salad",
          "section": null,
          "meal_type": "dinner",
          "season": "fall",
          "source_hint": null,
          "links": [],
          "urls": []
        },
        {
          "text": "Thursday: Alicia babysit for Missy, Sean on own",
          "section": null,
          "meal_type": "dinner",
          "season": "fall",
          "source_hint": null,
          "links": [],
          "urls": []
        },
        {
          "text": "Friday: Taste of Thanksgiving",
          "section": null,
          "meal_type": "dinner",
          "season": "fall",
          "source_hint": null,
          "links": [],
          "urls": []
        },
        {
          "text": "Saturday: Turnips with Bacon and Orange (Dooley pg 209), pork chops with apples and onions",
          "section": null,
          "meal_type": "dinner",
          "season": "fall",
          "source_hint": null,
          "links": [],
          "urls": []
        },
        {
          "text": "Sunday: Beets and caramelized onions with feta, chicken and honey mustard?",
          "section": null,
          "meal_type": "dinner",
          "season": "fall",
          "source_hint": null,
          "links": [],
          "urls": []
        },
        {
          "text": "Tuesday: balsamic roasted fingerling potatoes and Brussels sprouts, baked tilapia with pecan rosemary topping",
          "section": null,
          "meal_type": "dinner",
          "season": "fall",
          "source_hint": null,
          "links": [],
          "urls": []
        },
        {
          "text": "Wednesday: butternut squash Mac and cheese",
          "section": null,
          "meal_type": "dinner",
          "season": "fall",
          "source_hint": null,
          "links": [],
          "urls": []
        }
      ]
    },
    {
      "file": "Menus/Menu week of 10-4-20.md",
      "title": "Menu week of 10/4/20",
      "week_of_date": "2020-10-04",
      "season": "fall",
      "items": [
        {
          "text": "One pot spanish chicken and potatoes",
          "section": null,
          "meal_type": "dinner",
          "season": "fall",
          "source_hint": null,
          "links": [],
          "urls": []
        },
        {
          "text": "Burgers and roasted potatoes/turnips",
          "section": null,
          "meal_type": "dinner",
          "season": "fall",
          "source_hint": null,
          "links": [],
          "urls": []
        },
        {
          "text": "Roasted sweet potato tacos (radish on top)",
          "section": null,
          "meal_type": "dinner",
          "season": "fall",
          "source_hint": "radish on top",
          "links": [
            {
              "text": "Roasted Sweet Potato Tacos",
              "url": "https://www.gimmesomeoven.com/roasted-sweet-potato-tacos/",
              "auto_added": true
            }
          ],
          "urls": []
        },
        {
          "text": "Sheet pan salmon with bok choy",
          "section": null,
